user_input,retrieved_contexts,response,reference,context_precision,context_recall,faithfulness,answer_relevancy,judge_model,embedding_model,generation_model,hyde,rerank,contextualize_query,similarity_threshold
Comment peut-on développer l'écotourisme dans les aires protégées tout en respectant leurs spécificités culturelles et écologiques ?,"[""##### 4.4  Renforcer l'intervention et l'attractivité des territoires dans la stratégie nationale du patrimoine culturel  \n- Adopter, dans le cadre de la stratégie nationale, une stratégie  régionale  pour  le  patrimoine  culturel en  tenant compte  du  principe  de  subsidiarité,  du renforcement  des  capacités  des  conseils  régionaux et communaux et de la conciliation entre l'évolution urbanistique et la sauvegarde du patrimoine culturel;\n- Favoriser les projets de mise en valeur du patrimoine culturel matériel et immatériel dans le milieu rural (architecture,  ksours,  kasbahs,  chants,  danses, traditions); notamment dans les zones montagneuses et/ou  défavorisées  et  les  intégrer  dans  les  circuits touristiques culturels;\n- -Soutenir le patrimoine immatériel et ses acteurs en démultipliant, de manière objective, l'organisation de festivals locaux, selon les potentialités culturelles locales et les besoins de développement de chaque région ;\n- Doter les acteurs du patrimoine culturel immatériel d'un statut juridique et moral qui incite à la création et leur permet de bénéficier des droits sociaux et professionnels."", ""- en encourageant les partenariats entre la Fondation Nationale des Musées et les collectionneurs privés dans l'optique d'améliorer l'offre des musées et de les ouvrir davantage sur la société et la recherche.\n2. Accorder une attention particulière au patrimoine immatériel:\n- en réalisant des monographies régionales pour inventorier les richesses locales en la matière;\n- en renforçant sa codification et sa connaissance par des travaux académiques et scientifiques;\n- en soutenant les porteurs du capital immatériel pour assurer la transmission de ce patrimoine.\n3. Garantir un financement national pérenne et diversifier les sources de financement en ayant recours au partenariat public-privé  et  au  tiers  secteur pour  la  sauvegarde,  la réhabilitation et la mise en valeur du patrimoine.\n4. Favoriser les projets de mise en valeur du patrimoine culturel matériel et immatériel dans le milieu rural (architecture, ksours, kasbahs, chants, danses, traditions, art culinaire, etc.), notamment dans les zones montagneuses et/ou défavorisées et les intégrer dans les circuits touristiques culturels.\n5. Encourager les entreprises à se spécialiser dans les métiers de restauration des sites et monuments historiques.\n6.  Systématiser le  recours  aux  technologies les  plus avancées lors de la cartographie de l'inventaire et privilégier le recours aux services d'archivage digital.\n7. Charger une personnalité publique, jouissant d'une grande notoriété et dont la légitimité est reconnue,de :\n-  mener un plaidoyer efficace pour sensibiliser sur les enjeux de la valorisation de l'histoire et du patrimoine culturel national ;\n- faire du lobbying auprès des parties prenantes et trouver des financements innovants pour la sauvegarde et la valorisation du patrimoine culturel."", ""Par ailleurs, certains agriculteurs se tournent actuellement vers l ' agriculture biologique et la production de produits de niche, en adoptant des pratiques favorisant la durabilité environnementale, ce qui leur permet de s ' intégrer à des marchés spécialisés, souvent plus rentables. Certaines  de  ces  pratiques  reposent  sur  l ' adoption  de  cultures  adaptées  aux contraintes environnementales, telles que celles nécessitant peu d ' eau, comme l ' arganier, le câprier,  le  cactus,  le  quinoa,  ou  encore  diverses  plantes  aromatiques  et  médicinales.  Ces alternatives,  observées  lors  des  visites  de  terrain,  montrent  que  la  diversification  des productions agricoles peut à la fois contribuer à la préservation des ressources naturelles et renforcer la résilience des petites exploitations face aux défis climatiques 17 ."", ""## Arrêté du ministre de l'agriculture, de la pêche maritime, du développement rural et des eaux et forêts n°3266-23 du 15joumada II 1445 (29 décembre 2023) ordonnant l'enquête publique pour la création du parc naturel de Chekhar.  \nle  MINIStRe  De  l'aGRICUltURe,  De  la  P Ê Che MaRItIMe, DU DÉVelOPPeMeNt RURal et DeS eaUX et FOR Ê tS,  \nVu la loi n°52-20 portant création de l'Agence nationale des eaux et forêts, promulguée par le dahir n°1-21-71 du 3 hija 1442 (14 juillet 2021), notamment son article 5;  \nVu le décret n°2-18-242 du 14 ramadan 1442 (27 avril 2021) pris pour l'application de certaines dispositions de la loi n°22-07 relative aux aires protégées, notamment son article 3 ;  \nAprès avis conforme de la commission technique des aires protégées, rendu lors de sa réunion du 9 moharrem 1445 (27 juillet 2023),"", ""A la  lumière  de  ce  diagnostic,  le  CESE  met  l'accent  sur  l'importance  d'une  vision  concertée  et partagée entre les différents acteurs et parties prenantes concernés, notamment la population locale. La finalité en est de transformer le domaine forestier en un espace résilient, mobilisateur d'investissements durables, promoteur de filières porteuses et générateur d'alternatives économiques  viables  au  profit  des  populations  locales.  \nDans  cette  optique,  le  Conseil  préconise  de  mettre  en  œuvre  un  ensemble  de  mesures-clés, principalement  les  suivantes  :  \n- /uniF6BA Etablir  un  code  forestier  qui  recense,  regroupe  et  actualise  les  dispositions  juridiques  y afférentes. Dans ce code seront notamment explicités les droits et obligations de toutes les parties prenantes, les méthodes de préservation de la biodiversité, d'amélioration de l'état de santé des écosystèmes et de lutte contre les incendies de forêts ainsi que les modalités de sécurisation  du  domaine  forestier  ;  \ń  \ǹ  \n172  -  cese.ma/media/2023/07/ebook-Avis-e cosyste mes-forestiers-du-Maroc-VF.pdf  \nRapport Annuel 2022  \n125  \n126  \n- /uniF6BA Réhabiliter les écosystèmes forestiers en passant progressivement d'un droit d'usage accordé aux populations locales à une récupération par l'Etat de ce droit dans toutes les aires protégées, en proposant des activités alternatives aux populations concernées ;\n- /uniF6BA Augmenter,  conformément  aux  engagements  internationaux  du  pays,  l'espace  des  aires protégées  pour  les  faire  passer  progressivement  de  /uniF63B,/uniF63F/uniF63E  %  actuellement  à  /uniF63B/uniF639%  en  /uniF63A/uniF639/uniF63D/uniF639  ;\n- /uniF6BA Intensifier les opérations de reboisement et de régénération naturelle en mettant en œuvre notamment,  les  actions  suivantes  :  identification  du  potentiel  des  espaces  à  reboiser; organisation, à l'échelle nationale, de campagnes de plantation ; promotion des investissements durables  ;  octroi  d'incitations  fiscales  aux  entreprises  impliquées  et  révision  des  choix  des espèces à reboiser et à régénérer ;\n- /uniF6BA Mobiliser le potentiel de l'intelligence artificielle pour le suivi des plantations, la surveillance et la lutte contre les incendies de forêts, en s'appuyant sur les expertises avérées développées par le secteur privé ;\n- /uniF6BA Valoriser les ressources forestières à travers le développement de concessions forestières écoresponsables et transparentes au bénéfice de la population dépendante et des entreprises locales, tout en favorisant la sylviculture, notamment par :\n-  la mise en place de la certification forestière dans le secteur forestier ;\n-  la révision du statut des arbres forestiers à forte valeur économique et commerciale pour les appréhender en tant qu'arbres fruitiers (exemple édifiant de l'arganier dans le domaine privé)."", '|                                                                                                                                                                                                                                                                                                                                                                                           | sécurité de la navigation Culture des espèces halieutiques suivantes : - les algues rouges « Gracilaria Gracilis » et « Gelidium Sesquipedale » ; - les algues brunes « laminaria Digitata » et « laminaria Ochroleuca ».                                                                                                                                                                 | sécurité de la navigation Culture des espèces halieutiques suivantes : - les algues rouges « Gracilaria Gracilis » et « Gelidium Sesquipedale » ; - les algues brunes « laminaria Digitata » et « laminaria Ochroleuca ».                                                                                                                                                                 | sécurité de la navigation Culture des espèces halieutiques suivantes : - les algues rouges « Gracilaria Gracilis » et « Gelidium Sesquipedale » ; - les algues brunes « laminaria Digitata » et « laminaria Ochroleuca ».                                                                                                                                                                 |']","Information non disponible.

Les extraits fournis ne contiennent aucune information sur le développement de l'écotourisme dans les aires protégées tout en tenant compte des spécificités culturelles et écologiques.","Pour développer l'écotourisme dans les aires protégées, il est essentiel de tenir compte de leurs spécificités culturelles, territoriales et écologiques, comme mentionné dans l'extrait. Cela peut se faire en impliquant les populations locales dans la gestion et le développement des projets d'écotourisme.",0.8874999999778125,1.0,0.3333333333333333,0.0,gpt-4o-mini,bge-m3,qwen2.5:7b,False,False,False,0.5
Quel est le montant que le gouvernement peut dépenser en 2024 pour le fonds des titres identitaires électroniques et des titres de voyage ?,"[""###### Article 29  \nLe montant des dépenses que l'autorité gouvernementale chargée de l'intérieur est autorisée à engager, pendant l'année budgétaire 2024, au titre du compte d'affectation spéciale intitulé «Fonds spécial pour la mise en place des titres identitaires électroniques et des titres de voyage», par anticipation sur les crédits qui lui seront ouverts pour l'année budgétaire 2025, est fixé à six cent millions de dirhams (600.000.000 DH).  \nEngagement par anticipation sur le compte d'affectation spéciale intitulé  « Fonds spécial de la pharmacie centrale»"", ""###### Article 31  \nLe montant des dépenses que l'autorité gouvernementale chargée  de  l'intérieur  est  autorisée  à  engager,  pendant l'année budgétaire 2023, au titre du compte d'affectation spéciale intitulé «Fonds spécial pour la mise en place des titres  identitaires  électroniques  et  des  titres  de  voyage », par anticipation sur les crédits qui lui seront ouverts pour l'année budgétaire 2024, est fixé à six cent millions de dirhams (600.000.000 DH).  \nEngagement par anticipation sur le compte d'affectation spéciale intitulé « Fonds spécial de la pharmacie centrale»"", '###### Article 28  \nLe montant des dépenses que l\'autorité gouvernementale chargée de l\'intérieur est autorisée à engager, pendant l\'année budgétaire 2024, au titre du compte d\'affectation spéciale intitulé ""Fonds de soutien à la sûreté nationale"", par anticipation sur les crédits qui lui seront ouverts pour l\'année budgétaire 2025, est fixé à cent millions de dirhams (100.000.000 DH).  \nEngagement par anticipation sur le compte d\'affectation spéciale intitulé «Fonds spécial pour la mise en place des titres identitaires électroniques et des titres de voyage»', ""| Code Chapitre    | Désignation                                                                         | Ressources pour l'année budgétaire 2024   |\n|------------------|-------------------------------------------------------------------------------------|-------------------------------------------|\n| 4.1.2.0.0.14.008 | INSTITUT SPECIALISE DE TECHNOLOGIE APPLIQUEE HOTELIERE ET TOURISTIQUE - OUARZAZATE  | 788 000                                   |\n| 4.1.2.0.0.14.011 | INSTITUT SPECIALISE DE TECHNOLOGIE APPLIQUEE HOTELIERE ET TOURISTIQUE - TANGER      | 750 000                                   |\n| 4.1.2.0.0.14.015 | CENTRE DE QUALIFICATION PROFESSIONNELLE HOTELIERE ET TOURISTIQUE DE TOUARGA - RABAT | 875 000                                   |\n| 4.1.2.0.0.14.018 | INSTITUT SPÉCIALISÉ DES ARTS TRADITIONNELS FES                                      | 60 000                                    |\n| 4.1.2.0.0.14.019 | INSTITUT SPÉCIALISÉ DES ARTS TRADITIONNELS MARRAKECH                                | 60 000                                    |\n| 4.1.2.0.0.14.020 | INSTITUT SPÉCIALISÉ DES ARTS TRADITIONNELS MEKNES                                   | 60 000                                    |\n| 4.1.2.0.0.14.021 | INSTITUT SPÉCIALISÉ DES ARTS TRADITIONNELS RABAT                                    | 60 000                                    |\n| 4.1.2.0.0.14.022 | INSTITUT SPÉCIALISÉ DES ARTS TRADITIONNELS OUARZAZATE                               | 60 000                                    |\n| 4.1.2.0.0.14.023 | INSTITUT SPÉCIALISÉ DES ARTS TRADITIONNELS INEZGANE                                 | 60 000                                    |\n| 4.1.2.0.0.16.001 | DIRECTION DE L'IMPRIMERIE OFFICIELLE                                                | -                                         |\n| 4.1.2.0.0.17.002 | CENTRE NATIONAL D'ETUDES ET DE RECHERCHES ROUTIERES                                 | 4 000 000                                 |\n| 4.1.2.0.0.17.003 | SERVICE DU RESEAU DES SERVICES DE LOGISTIQUE ET DE MATERIEL                         | 1 000 000                                 |\n| 4.1.2.0.0.17.004 | SERVICE DE LOGISTIQUE ET DE MATERIEL DE FES                                         | 1 000 000                                 |\n| 4.1.2.0.0.17.005 | SERVICE DE LOGISTIQUE ET DE MATERIEL DE RABAT                                       | 1 000 000                                 |\n| 4.1.2.0.0.17.006 | SERVICE DE LOGISTIQUE ET DE MATERIEL DE MARRAKECH                                   | 1 500 000                                 |\n| 4.1.2.0.0.17.007 | SERVICE DE LOGISTIQUE ET DE MATERIEL DE MEKNES                                      | -                                         |\n| 4.1.2.0.0.17.008 | SERVICE DE LOGISTIQUE ET DE MATERIEL D'OUJDA                                        | 1 000 000                                 |"", '###### Article 30  \nLe montant des dépenses que l\'autorité gouvernementale chargée de l\'intérieur est autorisée à engager, pendant l\'année budgétaire 2023, au titre du compte d\'affectation spéciale intitulé ""Fonds de soutien à la sûreté nationale"", par anticipation sur les crédits qui lui seront ouverts pour l\'année budgétaire 2024, est fixé à cent millions de dirhams (100.000.000 DH).  \nEngagement par anticipation sur le compte d\'affectation spéciale intitulé «Fonds spécial pour la mise en place des titres identitaires électroniques et des titres de voyage»', ""|                                         | TOTAL                                                                              | 105 000 000                               |\n|                                         | MINISTERE DU TOURISME, DE L'ARTISANAT ET DE L'ECONOMIE SOCIALE ET SOLIDAIRE        |                                           |\n| 4.1.1.0.0.14.001                        | INSTITUT SUPERIEUR INTERNATIONAL DU TOURISME DE TANGER                             | 11 016 000                                |\n| 4.1.1.0.0.14.008                        | INSTITUT SPECIALISE DE TECHNOLOGIE APPLIQUEE HOTELIERE ET TOURISTIQUE - OUARZAZATE | 1 542 000                                 |  \n18  \n| Code Chapitre                         | Désignation                                                                         | Ressources pour l'année budgétaire 2024   |\n|---------------------------------------|-------------------------------------------------------------------------------------|-------------------------------------------|\n| 4.1.1.0.0.14.011                      | INSTITUT SPECIALISE DE TECHNOLOGIE APPLIQUEE HOTELIERE ET TOURISTIQUE - TANGER      | 1 315 000                                 |\n| 4.1.1.0.0.14.015                      | CENTRE DE QUALIFICATION PROFESSIONNELLE HOTELIERE ET TOURISTIQUE DE TOUARGA - RABAT | 865 000                                   |\n| 4.1.1.0.0.14.018                      | INSTITUT SPÉCIALISÉ DES ARTS TRADITIONNELS FES                                      | 375 000                                   |\n| 4.1.1.0.0.14.019                      | INSTITUT SPÉCIALISÉ DES ARTS TRADITIONNELS MARRAKECH                                | 400 000                                   |\n| 4.1.1.0.0.14.020                      | INSTITUT SPÉCIALISÉ DES ARTS TRADITIONNELS MEKNES                                   | 375 000                                   |\n| 4.1.1.0.0.14.021                      | INSTITUT SPÉCIALISÉ DES ARTS TRADITIONNELS RABAT                                    | 300 000                                   |\n| 4.1.1.0.0.14.022                      | INSTITUT SPÉCIALISÉ DES ARTS TRADITIONNELS OUARZAZATE                               | 300 000                                   |\n| 4.1.1.0.0.14.023                      | INSTITUT SPÉCIALISÉ DES ARTS TRADITIONNELS INEZGANE                                 | 400 000                                   |\n| TOTAL                                 | TOTAL                                                                               | 16 888 000                                |\n| 4.1.1.0.0.16.001                      | SECRETARIAT GENERAL DU GOUVERNEMENT DIRECTION DE L'IMPRIMERIE OFFICIELLE            | 24 000 000                                |\n|                                       | TOTAL                                                                               | 24 000 000                                |""]","1. Réponse directe à la question
   Le montant que le gouvernement peut dépenser en 2024 pour le fonds des titres identitaires électroniques et des titres de voyage est fixé à six cent millions de dirhams (600.000.000 DH).

2. Sources citées
   - Dahir n°1-23-91 du 30 joumada I 1445 (14 décembre 2023) portant promulgation de la loi de finances n°55-23 pour l'année budgétaire 2024, Article 29.
   - Dahir n°1-22-75 du 18 joumada I 1444 (13 décembre 2022) portant promulgation de la loi de finances n°50-22 pour l'année budgétaire 2023, Article 31.",Le montant que le gouvernement peut dépenser en 2024 pour le fonds des titres identitaires électroniques et des titres de voyage est fixé à six cent millions de dirhams (600.000.000 DH) selon l'article 29.,0.99999999995,1.0,0.3333333333333333,0.9993306495836259,gpt-4o-mini,bge-m3,qwen2.5:7b,False,False,False,0.5
Quelles sont les réglementations en vigueur concernant la production et la certification des plants de fruits rouges et d'arganier au Maroc ?,"[""Vu l'arrêté du ministre de l'agriculture, de la pêche maritime, du développement rural et des eaux et forêts n° 2109-17 du 25 kaada 1438 (18 août 2017) portant homologation du règlement technique relatif à la production, au contrôle, au conditionnement et à la certification des plants des espèces à  fruits  rouges  (fraisier,  framboisier,  myrtillier,  murier, groseillier et cassissier) ;  \nVu l'arrêté du ministre de l'agriculture, de la pêche maritime, du développement rural et des eaux et forêts n°986-19 du 21 rejeb 1440 (28 mars 2019) portant homologation du règlement technique relatif à la production, au contrôle, au conditionnement et à la certification des plants de figuier de barbarie ;  \nVu l'arrêté du ministre de l'agriculture, de la pêche maritime, du développement rural et des eaux et forêts n° 1437-22 du 25 chaoual 1443 (26 mai 2022) portant homologation du règlement technique relatif à la production, au contrôle, au conditionnement et à la certification des semences et plants des rosacées à noyau ;  \nVu l'arrêté du ministre de l'agriculture, de la pêche maritime, du développement rural et des eaux et forêts n°2140-22 du 4 moharrem 1444 (2 août 2022) portant homologation du règlement technique relatif à la production, au contrôle, au conditionnement et à la certification des plants d'arganier ;  \nVu l'arrêté du ministre de l'agriculture et de la réforme agraire n°966-93 du 28 chaoual 1413 (20 avril 1993) fixant les conditions d'importation et de commercialisation des semences à cultiver au Maroc, tel qu'il a été modifié et complété,"", ""Vu l'arrêté du ministre de l'agriculture, de la pêche maritime, du développement rural et des eaux et forêts n°2109-17 du 25 kaada 1438 (18 août 2017) portant homologation du règlement technique relatif à la production, au contrôle, au conditionnement et à la certification des plants des espèces à  fruits  rouges  (fraisier,  framboisier,  myrtillier,  murier, groseillier et cassissier) ;  \nVu l'arrêté du ministre de l'agriculture, de la pêche maritime, du développement rural et des eaux et forêts n°986-19 du 21 rejeb 1440 (28 mars 2019) portant homologation du règlement technique relatif à la production, au contrôle, au conditionnement et à la certification des plants de figuier de barbarie ;  \nVu l'arrêté du ministre de l'agriculture, de la pêche maritime, du développement rural et des eaux et forêts n° 1437-22 du 25 chaoual 1443 (26 mai 2022) portant homologation du règlement technique relatif à la production, au contrôle, au conditionnement et à la certification des semences et plants des rosacées à noyau ;  \nVu l'arrêté du ministre de l'agriculture, de la pêche maritime, du développement rural et des eaux et forêts n°2140-22 du 4 moharrem 1444 (2 août 2022) portant homologation du règlement technique relatif à la production, au contrôle, au conditionnement et à la certification des plants d'arganier ;  \nVu l'arrêté du ministre de l'agriculture et de la réforme agraire n°966-93 du 28 chaoual 1413 (20 avril 1993) fixant les conditions d'importation et de commercialisation des semences à cultiver au Maroc, tel qu'il a été modifié et complété,"", ""Vu l'arrêté  du ministre de l'agriculture et de la pêche maritime n°784-16 du 29 kaada 1437 (2 septembre 2016) portant homologation du règlement technique relatif à la production, au contrôle, au conditionnement et à la certification des plants de grenadier ;  \nVu l'arrêté du ministre de l'agriculture, de la pêche maritime, du développement rural et des eaux et forêts n°2109-17 du 25 kaada 1438 (18 août 2017) portant homologation du règlement technique relatif à la production, au contrôle, au conditionnement et à la certification des plants des espèces à  fruits  rouges  (fraisier,  framboisier,  myrtillier,  murier, groseillier et cassissier) ;  \nVu l'arrêté du ministre de l'agriculture, de la pêche maritime, du développement rural et des eaux et forêts n°986-19 du 21 rejeb 1440 (28 mars 2019) portant homologation du règlement technique relatif à la production, au contrôle, au conditionnement et à la certification des plants de figuier de barbarie ;  \nVu l'arrêté du ministre de l'agriculture, de la pêche maritime, du développement rural et des eaux et forêts n°1437-22 du 25 chaoual 1443 (26 mai 2022) portant homologation du règlement technique relatif à la production, au contrôle, au conditionnement et à la certification des semences et plants des rosacées à noyau ;  \nVu l'arrêté du ministre de l'agriculture, de la pêche maritime, du développement rural et des eaux et forêts n°2140-22 du 4 moharrem 1444 (2 août 2022) portant homologation du règlement technique relatif à la production, au contrôle, au conditionnement et à la certification des plants d'arganier ;  \nVu l'arrêté du ministre de l'agriculture, de la pêche maritime, du développement rural et des eaux et forêts n°640-23 du 14 chaabane 1444 (7 mars 2023) portant homologation du règlement technique relatif à la production, au contrôle, au conditionnement et à la certification des plants de caroubier ;  \nVu l'arrêté du ministre  de  l'agriculture  et  de  la réforme  agraire  n°966-93 du 28 chaoual 1413 (20 avril 1993) fixant les conditions d'importation et de commercialisation des semences à cultiver au Maroc, tel qu'il a été modifié et complété,"", ""Vu l'arrêté du ministre de l'agriculture, de la pêche maritime, du développement rural et des eaux et forêts n° 2109-17 du 25 kaada 1438 (18 août 2017) portant homologation du règlement technique relatif à la production, au contrôle, au conditionnement et à la certification des plants des espèces à  fruits  rouges  (fraisier,  framboisier,  myrtillier,  murier, groseillier et cassissier) ;  \nVu l'arrêté du ministre de l'agriculture, de la pêche maritime, du développement rural et des eaux et forêts n°986-19 du 21 rejeb 1440 (28 mars 2019) portant homologation du règlement technique relatif à la production, au contrôle, au conditionnement et à la certification des plants de figuier de barbarie ;  \nVu l'arrêté du ministre de l'agriculture, de la pêche maritime, du développement rural et des eaux et forêts n° 1437-22 du 25 chaoual 1443 (26 mai 2022) portant homologation du règlement technique relatif à la production, au contrôle, au conditionnement et à la certification des semences et plants des rosacées à noyau ;  \nVu l'arrêté du ministre de l'agriculture, de la pêche maritime, du développement rural et des eaux et forêts n°2140-22 du 4 moharrem 1444 (2 août 2022) portant homologation du règlement technique relatif à la production, au contrôle, au conditionnement et à la certification des plants d'arganier ;  \nVu l'arrêté du ministre de l'agriculture, de la pêche maritime, du développement rural et des eaux et forêts n°640-23 du 14chaabane 1444 (7 mars 2023) portant homologation du règlement technique relatif à la production, au contrôle, au conditionnement et à la certification des plants de caroubier ;  \nVu l'arrêté du ministre de l'agriculture et de la réforme agraire n°966-93 du 28 chaoual 1413 (20 avril 1993) fixant les conditions d'importation et de commercialisation des semences à cultiver au Maroc, tel qu'il a été modifié et complété,"", ""Vu l'arrêté du ministre de l'agriculture, de la pêche maritime, du développement rural et des eaux et forêts n°2109-17 du 25 kaada 1438 (18 août 2017) portant homologation du règlement technique relatif à la production, au contrôle, au conditionnement et à la certification des plants des espèces à  fruits  rouges  (fraisier,  framboisier,  myrtillier,  murier, groseillier et cassissier) ;  \nVu l'arrêté du ministre de l'agriculture, de la pêche maritime, du développement rural et des eaux et forêts n°986-19 du 21 rejeb 1440 (28 mars 2019) portant homologation du règlement technique relatif à la production, au contrôle, au conditionnement et à la certification des plants de figuier de barbarie ;  \nVu l'arrêté du ministre de l'agriculture, de la pêche maritime, du développement rural et des eaux et forêts n°1437-22 du 25 chaoual 1443 (26 mai 2022) portant homologation du règlement technique relatif à la production, au contrôle, au conditionnement et à la certification des semences et plants des rosacées à noyau ;  \nVu l'arrêté du ministre de l'agriculture, de la pêche maritime, du développement rural et des eaux et forêts n°2140-22 du 4 moharrem 1444 (2 août 2022) portant homologation du règlement technique relatif à la production, au contrôle, au conditionnement et à la certification des plants d'arganier ;  \nVu l'arrêté du ministre de l'agriculture, de la pêche maritime, du développement rural et des eaux et forêts n°640-23 du 14 chaabane 1444 (7 mars 2023) portant homologation du règlement technique relatif à la production, au contrôle, au conditionnement et à la certification des plants de caroubier ;  \nVu l'arrêté du ministre  de  l'agriculture  et  de  la réforme  agraire  n° 966-93 du 28 chaoual 1413 (20 avril 1993) fixant les conditions d'importation et de commercialisation des semences à cultiver au Maroc, tel qu'il a été modifié et complété,"", ""Vu l'arrêté du ministre de l'agriculture, de la pêche maritime, du développement rural et des eaux et forêts n°986-19 du 21 rejeb 1440 (28 mars 2019) portant homologation du règlement technique relatif à la production, au contrôle, au conditionnement et à la certification des plants de figuier de barbarie ;  \nVu l'arrêté du ministre de l'agriculture, de la pêche maritime, du développement rural et des eaux et forêts n° 1437-22 du 25 chaoual 1443 (26 mai 2022) portant homologation du règlement technique relatif à la production, au contrôle, au conditionnement et à la certification des semences et plants des rosacées à noyau ;  \nVu l'arrêté du ministre de l'agriculture, de la pêche maritime, du développement rural et des eaux et forêts n°2140-22 du 4 moharrem 1444 (2 août 2022) portant homologation du règlement technique relatif à la production, au contrôle, au conditionnement et à la certification des plants d'arganier ;  \nVu l'arrêté du ministre de l'agriculture, de la pêche maritime, du développement rural et des eaux et forêts n°640-23 du 14chaabane 1444 (7 mars 2023) portant homologation du règlement technique relatif à la production, au contrôle, au conditionnement et à la certification des plants de caroubier ;  \nVu l'arrêté du ministre de l'agriculture et de la réforme agraire n°966-93 du 28 chaoual 1413 (20 avril 1993) fixant les conditions d'importation et de commercialisation des semences à cultiver au Maroc, tel qu'il a été modifié et complété,""]","1. Réponse directe à la question

Les réglementations en vigueur concernant la production et la certification des plants de fruits rouges et d'arganier au Maroc incluent les suivantes :

- Pour le plant de fruits rouges (fraisier, framboisier, myrtillier, murier, groseillier, cassissier) :
  - Arrêté du ministre de l'agriculture, de la pêche maritime, du développement rural et des eaux et forêts n°2109-17 du 25 kaada 1438 (18 août 2017)
  
- Pour le plant d'arganier :
  - Arrêté du ministre de l'agriculture, de la pêche maritime, du développement rural et des eaux et forêts n°2140-22 du 4 moharrem 1444 (2 août 2022)

Ces arrêtés stipulent les règles relatives à la production, au contrôle, au conditionnement et à la certification de ces plants.

2. Sources citées

- Arrêté du ministre de l'agriculture, de la pêche maritime, du développement rural et des eaux et forêts n°2109-17 du 25 kaada 1438 (18 août 2017)
- Arrêté du ministre de l'agriculture, de la pêche maritime, du développement rural et des eaux et forêts n°2140-22 du 4 moharrem 1444 (2 août 2022)","Les réglementations en vigueur concernant la production et la certification des plants de fruits rouges sont établies par l'arrêté n° 2109-17 du 25 kaada 1438 (18 août 2017). Pour les plants d'arganier, l'arrêté pertinent est le n° 2140-22 du 4 moharrem 1444 (2 août 2022).",0.9999999999833333,1.0,1.0,0.9463645881142416,gpt-4o-mini,bge-m3,qwen2.5:7b,False,False,False,0.5
Qui a été autorisé à vendre des semences de légumes selon l'arrêté du ministre de l'agriculture du 9 septembre 2025 ?,"[""## Arrêté  du  ministre  de  l'agriculture,  de  la  pêche  \nmaritime,  du  développement  rural  et  des  \neaux et forêts n° 2188-25 du 16 rabii I 1447  \n(9 septembre 2025) portant agrément de la société  \n« SMART AGRICULTURE LEADER » pour  \ncommercialiser des plants certifiés de vigne, de  \nfiguier,  de  figuier  de  barbarie,  de  grenadier,  \ndes rosacées à pépins et des semences et plants  \ncertifiés des rosacées à noyau et d'agrumes et  \ndes plants certifiés des espèces à fruits rouges.  \n2535  \n## Arrêté  du  ministre  de  l'agriculture,  de  la  pêche  \nmaritime,  du  développement  rural  et  des  \neaux et forêts n° 2189-25 du 16 rabii I 1447  \n(9  septembre 2025) portant agrément de la  \nsociété  « VILMORIN-MIKADO ATLAS »  \npour commercialiser des semences certifiées  \ndu maïs et des semences standard de légumes.  \n2536  \n## Arrêté  du  ministre  de  l'agriculture,  de  la  pêche  \nmaritime,  du  développement  rural  et  des  \neaux et forêts n° 2190-25 du 16 rabii I 1447  \n(9 septembre 2025) portant agrément de la société  \n« BEJO MAGHREB » pour commercialiser des  \nsemences standard de légumes.  ......................  \n2537  \nCréation et exploitation de fermes aquacoles."", ""## Arrêté  du  ministre  de  l'agriculture,  de  la  pêche  \nmaritime,  du  développement  rural  et  des  \neaux et forêts n° 2182-25 du 16 rabii I 1447  \n(9  septembre 2025) portant agrément de la  \nsociété « MAROSEM » pour commercialiser  \ndes semences certifiées des céréales à pailles,  \ndu maïs, des légumineuses alimentaires, des  \nlégumineuses fourragères, des oléagineuses,  \nde betteraves industrielles et fourragères, des  \nsemences standard de légumes et des plants  \ncertifiés de pomme de terre.   ............................  \n2531  \n## Arrêté  du  ministre  de  l'agriculture,  de  la  pêche  \nmaritime,  du  développement  rural  et  des  \neaux et forêts n° 2183-25 du 16 rabii I 1447  \n(9  septembre 2025) portant agrément de la  \nsociété « BENAPRIM » pour commercialiser  \ndes plants certifiés de pomme de terre.  ...........  \n2532  \nISSN 0851 - 1217  \nPages  \nPages  \n## Arrêté  du  ministre  de  l'agriculture,  de  la  pêche  \nmaritime,  du  développement  rural  et  des  \neaux et forêts n° 2184-25 du 16 rabii I 1447  \n(9  septembre 2025) portant agrément de la  \nsociété  « RIJK  ZWAAN  MAROC »  pour  \ncommercialiser  des  semences  standard  de  \nlégumes.  ........................................................  \n2533  \n## Arrêté  du  ministre  de  l'agriculture,  de  la  pêche  \nmaritime,  du  développement  rural  et  des  \neaux et forêts n° 2185-25 du 16 rabii I 1447  \n(9  septembre  2025)  portant  agrément  de  \nla  société  « MAGHREB  PALM »  pour  \ncommercialiser des plants certifiés du palmier  \ndattier, d'arganier, de figuier de barbarie, des  \nsemences  et  plants  certifiés  des  rosacées  à  \nnoyau et des plants certifiés des espèces à fruits  \nrouges.   ...........................................................  \n2533  \n## Arrêté  du  ministre  de  l'agriculture,  de  la  pêche  \nmaritime,  du  développement  rural  et  des  \neaux et forêts n° 2186-25 du 16 rabii I 1447  \n(9  septembre 2025) portant agrément de la  \nsociété « FELGAR » pour commercialiser des  \nplants certifiés des espèces à fruits rouges.   ......  \n2534  \n## Arrêté  du  ministre  de  l'agriculture,  de  la  pêche  \nmaritime,  du  développement  rural  et  des  \neaux et forêts n° 2187-25 du 16 rabii I 1447  \n(9  septembre 2025) portant agrément de la  \nsociété « LUNA FRESH » pour commercialiser  \ndes semences certifiées du maïs, des semences  \nstandard de légumes et des plants certifiés de  \npomme de terre.  .............................................  \n2535  \n## Arrêté  du  ministre  de  l'agriculture,  de  la  pêche  \nmaritime,  du  développement  rural  et  des  \neaux et forêts n° 2188-25 du 16 rabii I 1447  \n(9 septembre 2025) portant agrément de la société  \n« SMART AGRICULTURE LEADER » pour  \ncommercialiser des plants certifiés de vigne, de  \nfiguier,  de  figuier  de  barbarie,  de  grenadier,  \ndes rosacées à pépins et des semences et plants  \ncertifiés des rosacées à noyau et d'agrumes et  \ndes plants certifiés des espèces à fruits rouges."", ""## Arrêté du ministre de l'agriculture, de la pêche maritime, du développement rural et des eaux et forêts n°2190-25 du 16 rabii I 1447 (9 septembre 2025) portant agrément de la société «BEJO MAGHREB» pour commercialiser des semences standard de légumes.  \nle  MINIStRe  De  l'aGRICUltURe,  De  la  P Ê Che MaRItIMe, DU DÉVelOPPeMeNt RURal et DeS eaUX et FOR Ê tS,  \nVu le dahir n°1-69-169 du 10 joumada I 1389 (25 juillet 1969) réglementant  la  production  et  la  commercialisation  de semences et de plants, tel qu'il a été modifié, notamment ses articles premier, 2 et 5 ;  \nVu la loi n°25-08 portant création de l'Office national de sécurité sanitaire  des produits alimentaires promulguée par le dahir n°1-09-20 du 22 safar 1430 (18 février 2009), notamment son article 2 ;  \nVu l'arrêté du ministre de l'agriculture et de la réforme agraire n°971-75 du 8 chaoual 1397 (22 septembre 1977) portant homologation du règlement technique relatif au contrôle des semences standard de légumes ;  \nVu l'arrêté du ministre  de  l'agriculture et  de la  réforme agraire n°966-93 du 28 chaoual 1413 (20 avril 1993) fixant les conditions d'importation et de commercialisation des semences à cultiver au Maroc, tel qu'il a été modifié et complété,"", ""## Arrêté du ministre de l'agriculture, de la pêche maritime, du développement rural et des eaux et forêts n°2181-25 du 16 rabii I 1447 (9 septembre 2025) portant agrément de  la  société  « HI-TECH  SEEDS  MAROC» pour commercialiser des semences standard de légumes.  \nle  MINIStRe  De  l'aGRICUltURe,  De  la  P Ê Che MaRItIMe, DU DÉVelOPPeMeNt RURal et DeS eaUX et FOR Ê tS,  \nVu le dahir n°1-69-169 du 10 joumada I 1389 (25 juillet 1969) réglementant  la  production  et  la  commercialisation  de semences et de plants, tel qu'il a été modifié, notamment ses articles premier, 2 et 5 ;  \nVu la loi n°25-08 portant création de l'Office national de sécurité sanitaire  des produits alimentaires promulguée par le dahir n°1-09-20 du 22 safar 1430 (18 février 2009), notamment son article 2 ;  \nVu l'arrêté du ministre de l'agriculture et de la réforme agraire n°971-75 du 8 chaoual 1397 (22 septembre 1977) portant homologation du règlement technique relatif au contrôle des semences standard de légumes ;  \nVu l'arrêté du ministre  de  l'agriculture et  de la  réforme agraire  n°966-93 du 28 chaoual 1413 (20 avril 1993) fixant les conditions d'importation et de commercialisation des semences à cultiver au Maroc, tel qu'il a été modifié et complété,"", ""## Arrêté du ministre de l'agriculture, de la pêche maritime, du développement rural et des eaux et forêts n°1658-25 du 29 hija 1446 (26 juin 2025)  portant agrément de la société « LA MAROCAINE DU CONSULTING ET SERVICE AGRICOLE » pour commercialiser des semences certifiées du maïs, des légumineuses alimentaires, des légumineuses fourragères, des oléagineuses et des semences standard de légumes.  \nle  MINIStRe  De  l'aGRICUltURe,  De  la  P Ê Che MaRItIMe, DU DÉVelOPPeMeNt RURal et DeS eaUX et FOR Ê tS,  \nVu le dahir n°1-69-169 du 10 joumada I 1389 (25 juillet 1969) réglementant  la  production  et  la  commercialisation  de semences et de plants, tel  qu'il a été modifié, notamment ses articles premier, 2 et 5 ;  \nVu  la loi n° 25-08 portant création de l'Office national de sécurité sanitaire   des produits alimentaires promulguée par le dahir n°1-09-20 du 22 safar 1430 (18 février 2009), notamment son article 2 ;  \nVu l'arrêté du ministre de l'agriculture et de la réforme agraire n°857-75 du 8 chaoual 1397 (22 septembre 1977) portant homologation du règlement technique relatif à la production, au contrôle, au conditionnement et à la certification des semences de légumineuses fourragères (luzerne, bersim, trèfle de Perse, pois fourrager, vesce et lupins) ;  \nVu l'arrêté du ministre de l'agriculture et de la réforme agraire n°858-75 du 8 chaoual 1397 (22 septembre 1977) portant homologation du règlement technique relatif à la production, au contrôle, au conditionnement et à la certification des semences de tournesol, carthame, colza, lin, soja et arachide ;  \nVu l'arrêté du ministre de l'agriculture et de la réforme agraire n°859-75 du 8 chaoual 1397 (22 septembre 1977) portant homologation du règlement technique relatif à la production, au contrôle, au conditionnement et à la certification des semences de maïs ;  \nVu l'arrêté du ministre de l'agriculture et de la réforme agraire n°862-75 du 8 chaoual 1397 (22 septembre 1977) portant homologation du règlement technique relatif à la production, au contrôle, au conditionnement et à la certification des semences de légumineuses alimentaires (fève, féverole, pois, lentille, pois-chiche et haricot) ;  \nVu l'arrêté du ministre de l'agriculture et de la réforme agraire n°971-75 du 8 chaoual 1397 (22 septembre 1977) portant homologation du règlement technique relatif au contrôle des semences standard de légumes ;  \nVu l'arrêté du ministre de l'agriculture et de la réforme agraire n°966-93 du 28 chaoual 1413 (20 avril 1993) fixant les conditions d'importation et de commercialisation des semences à cultiver au Maroc, tel qu'il a été modifié et complété,"", ""## Arrêté  du  ministre  de  l'agriculture,  de  la  pêche maritime,  du  développement  rural  et  des eaux et forêts n° 2181-25 du 16 rabii I 1447 (9  septembre 2025) portant agrément de la société « HI-TECH SEEDS MAROC » pour commercialiser  des  semences  standard  de légumes.  ........................................................  \n2531""]","1. Réponse directe à la question
   - Selon l'arrêté du ministre de l'agriculture, de la pêche maritime, du développement rural et des eaux et forêts n°2181-25 du 16 rabii I 1447 (9 septembre 2025), la société ""HI-TECH SEEDS MAROC"" a été autorisée à commercialiser des semences standard de légumes.

2. Sources citées
   - Arrêté du ministre de l'agriculture, de la pêche maritime, du développement rural et des eaux et forêts n°2181-25 du 16 rabii I 1447 (9 septembre 2025) portant agrément de la société « HI-TECH SEEDS MAROC » pour commercialiser des semences standard de légumes.",La société « HI-TECH SEEDS MAROC » a été autorisée à commercialiser des semences standard de légumes selon l'arrêté du ministre de l'agriculture du 9 septembre 2025.,0.2916666666520833,1.0,1.0,0.9437480007343991,gpt-4o-mini,bge-m3,qwen2.5:7b,False,False,False,0.5
Comment fonctionne le processus de fusion d'un OPCVM avec un autre OPCVM existant ?,"[""###### Article 77  \nLa société de gestion peut procéder à la fusion d'au moins deux OPCVM ou deux compartiments d'OPCVM, pour constituer un nouvel OPCVM ou un nouveau compartiment d'OPCVM auquel elle transfère sans liquidation l'ensemble de leurs actifs et passifs et attribue à leurs porteurs de parts ou actionnaires, des parts ou actions du nouvel OPCVM ou nouveau compartiment."", ""###### Article 78  \nLa société de gestion peut procéder à la fusion-absorption, par un OPCVM existant ou par un compartiment d'OPCVM existant dénommé ci-dessous «OPCVM absorbeur», d'un OPCVM ou plusieurs OPCVM ou compartiments d'OPCVM existants dénommés ci-dessous «OPCVM absorbé».  \nElle transfère sans liquidation l'ensemble de l'actif et passif de l'OPCVM absorbéà l'OPCVM absorbeur et attribue aux porteurs de parts ou actionnaires de l'OPCVM absorbédes parts ou actions dans l'OPCVM absorbeur."", ""###### Article 80  \nLa société de gestion doit élaborer pour procéder à la fusion, fusion-absorption ou scission d'OPCVM un projet qui précise la nature de l'opération, ses objectifs et le cas échéant ses conditions, ainsi que la stratégie d'investissement des OPCVM concernés.  \nLedit projet est communiqué aux membres du conseil d'administration de la société de gestion concernée et aux commissaires aux comptes de chaque OPCVM concerné, au  moins  45  jours  avant  la  date  de  la  tenue  du  conseil d'administration pour délibérer sur l'opération envisagée."", ""###### Article 82  \nLe  rapport  des  commissaires  aux  apports  et  les informations  relatives  au  projet  de  fusion,  de  fusionabsorption ou de scission doivent être mis à la disposition des porteurs de parts ou actionnaires au siège social et sur le site électronique des sociétés de gestion des OPCVM concernés, au plus tard quinze (15) jours avant la date de la tenue du conseil d'administration desdites sociétés de gestion.  \nLes informations visées au premier alinéa du présent article, comportent notamment les éléments suivants :  \n- les nouvelles parts ou actions qui seront octroyées à chaque porteur de part ou actionnaire suite à l'opération envisagée ;\n-  les  indicateurs  de  risque  et  de  rendement  liés  au placement dans les OPCVM concernés avant et après l'opération envisagée ;\n- les frais envisagés à la charge de la société de gestion ;\n- la détermination des coûts de l'opération envisagée ;\n-  l'incidence  de  l'opération  envisagée  sur  l'actif  des OPCVM concernés ;\n- les produits, leur affectation et distribution dans les OPCVM concernés ;\n- la date envisagée de la réalisation du projet."", ""###### Article 110  \nEn cas de fusion, fusion-absorption ou scission d'un OPCVM maître, son ou ses OPCVM nourriciers doivent demander auprès de l'AMMC au plus tard 30 jours à compter de  la  date  de  leur  information  de  la  décision  du  conseil d'administration de la société de gestion de l'OPCVM maître le retrait de leur agrément ou l'octroi d'un nouvel agrément selon les formes prévues au chapitre premier du titre premier de la deuxième partie de la présente loi.  \nL'OPCVM nourricier est informé dans un délai de quinze jours ouvrables à compter de la date du dépôt de sa demande, de l'octroi ou du refus du nouvel agrément. En cas de refus, l'agrément de l'OPCVM nourricier est retiré et il entre en liquidation.  \nLes porteurs de parts ou actionnaires d'un OPCVM nourricier jouissent des mêmes droits prévus à l'article 84 ci-dessus."", ""###### Article 83  \nL'OPCVM concerné par le projet de fusion, fusionabsorption ou scission doit être soumis à un nouvel agrément par l'AMMC. La demande dudit agrément accompagnée du projet, du rapport du commissaire aux apports et des informations prévus respectivement par les articles 11, 80, 81 et 82 ci-dessus, est présentée par la société de gestion à l'AMMC dans les conditions et formes prévues aux articles 9 à 13 et aux articles 26 et 37 ci-dessus.""]","1. Réponse directe à la question

La fusion d'un OPCVM avec un autre OPCVM existant se réalise par deux voies principales :

a) Fusion : Selon l'article 77 du Dahir n° 1-25-64, la société de gestion peut procéder à la fusion d'au moins deux OPCVM ou compartiments d'OPCVM pour constituer un nouvel OPCVM ou nouveau compartiment. L'ensemble des actifs et passifs des OPCVM fusionnés sont transférés sans liquidation aux nouveaux parts ou actions.

b) Fusion-absorption : L'article 78 stipule que la société de gestion peut aussi procéder à la fusion-absorption par un OPCVM existant (OPCVM absorbeur), qui prend en charge l'actif et le passif de l'OPCVM ou des compartiments d'OPCVM absorbés. Les porteurs de parts ou actionnaires reçoivent des parts ou actions dans l'OPCVM absorbeur.

2. Sources citées
- Article 77 du Dahir n° 1-25-64 du 22 joumada I 1447 (14 novembre 2025) portant promulgation de la loi n° 03-25 relative aux organismes de placement collectif en valeurs mobilières.
- Article 78 du Dahir n° 1-25-64 du 22 joumada I 1447 (14 novembre 2025) portant promulgation de la loi n° 03-25 relative aux organismes de placement collectif en valeurs mobilières.","Le processus de fusion d'un OPCVM avec un autre OPCVM existant, selon l'article 78, implique que la société de gestion procède à une fusion-absorption. Cela inclut le transfert sans liquidation de l'ensemble de l'actif et passif de l'OPCVM absorbé à l'OPCVM absorbeur, qui attribue ensuite des parts ou actions de celui-ci aux porteurs de parts ou actionnaires de l'OPCVM absorbé.",0.9999999999833333,1.0,0.6,0.8692817732036783,gpt-4o-mini,bge-m3,qwen2.5:7b,False,False,False,0.5
Quelle est la taille et l'emplacement d'une ferme aquacole à Oualidia dans la province de Sidi Bennour ?,"[""| Lieu d'implantation de la ferme aquacole : Superficie : Limites externes d'implantation de la ferme aquacole : | Au niveau de la lagune d'Oualidia, Province de Sidi Bennour. Un hectare, quatre-vingt-six ares, quarante-quatre centiares (1 ha 86 a 44 ca).                                                                                                                                                                                                                                                                                                                                                                                                                                                                                                                                      | Au niveau de la lagune d'Oualidia, Province de Sidi Bennour. Un hectare, quatre-vingt-six ares, quarante-quatre centiares (1 ha 86 a 44 ca).                                                                                                        | Au niveau de la lagune d'Oualidia, Province de Sidi Bennour. Un hectare, quatre-vingt-six ares, quarante-quatre centiares (1 ha 86 a 44 ca).                                                                                                        | Au niveau de la lagune d'Oualidia, Province de Sidi Bennour. Un hectare, quatre-vingt-six ares, quarante-quatre centiares (1 ha 86 a 44 ca).                                                                                                        |"", ""| Lieu d'implantation de la ferme aquacole : Superficie :                                                                                                                                                                                                                                                                                                                                   | En mer, au large de Cintra, province d'Oued Eddahab Vingt (20) hectares                                                                                                                                                                                                                                                                                                                   | En mer, au large de Cintra, province d'Oued Eddahab Vingt (20) hectares                                                                                                                                                                                                                                                                                                                   | En mer, au large de Cintra, province d'Oued Eddahab Vingt (20) hectares                                                                                                                                                                                                                                                                                                                   |"", ""| Lieu d'implantation de la ferme aquacole : Superficie :                                                                                                                                                                                                                                                                                                                                                                                                          | En mer, au large de Cintra, province d'Oued Eddahab.                                                                                                                                                                                                                                                                                                                                                                                                             | hectares.                                                                                                                                                                                                                                                                                                                                                                                                                                                        | En mer, au large de Cintra, province d'Oued Eddahab.                                                                                                                                                                                                                                                                                                                                                                                                             | En mer, au large de Cintra, province d'Oued Eddahab.                                                                                                                                                                                                                                                                                                                                                                                                             | En mer, au large de Cintra, province d'Oued Eddahab.                                                                                                                                                                                                                                                                                                                                                                                                             |"", ""| Lieu d'implantation de la ferme aquacole : Superficie :                                                                                                                                                                                                                                                                                                                                    | Au niveau de la Baie de Dakhla, province d'Oued Eddahab. Deux (2) hectares.                                                                                                                                                                                                                                                                                                                | Au niveau de la Baie de Dakhla, province d'Oued Eddahab. Deux (2) hectares.                                                                                                                                                                                                                                                                                                                | Au niveau de la Baie de Dakhla, province d'Oued Eddahab. Deux (2) hectares.                                                                                                                                                                                                                                                                                                                |"", ""| Durée de la Convention                                                                                                                                                                                                                                                                                                                                                              | Dix (10) ans, renouvelable                                                                                                                                                                                                                                                                                                                                                          | Dix (10) ans, renouvelable                                                                                                                                                                                                                                                                                                                                                          | Dix (10) ans, renouvelable                                                                                                                                                                                                                                                                                                                                                          |\n| Lieu d'implantation de la ferme aquacole : Superficie :                                                                                                                                                                                                                                                                                                                             | En mer, au large de Labouirda, Province d'Oued Eddahab Vingt (20) hectares                                                                                                                                                                                                                                                                                                          | En mer, au large de Labouirda, Province d'Oued Eddahab Vingt (20) hectares                                                                                                                                                                                                                                                                                                          | En mer, au large de Labouirda, Province d'Oued Eddahab Vingt (20) hectares                                                                                                                                                                                                                                                                                                          |"", ""| Durée de la Convention                                                                                                                                                                                                                                                                                                                                           | Dix (10) ans, renouvelable                                                                                                                                                                                                                                                                                                                                       | Dix (10) ans, renouvelable                                                                                                                                                                                                                                                                                                                                       | Dix (10) ans, renouvelable                                                                                                                                                                                                                                                                                                                                       |\n| Lieu d'implantation de la ferme aquacole : Superficie :                                                                                                                                                                                                                                                                                                          | En mer, au large d'Ain Beida, province d'Oued Eddahab Vingt (20) hectares                                                                                                                                                                                                                                                                                        | En mer, au large d'Ain Beida, province d'Oued Eddahab Vingt (20) hectares                                                                                                                                                                                                                                                                                        | En mer, au large d'Ain Beida, province d'Oued Eddahab Vingt (20) hectares                                                                                                                                                                                                                                                                                        |""]","1. Réponse directe à la question
La ferme aquacole dénommée ""Parc à Huîtres n° 007 Oualidia"" située dans la province de Sidi Bennour, en lagune d'Oualidia, a une superficie d'un hectare, quatre-vingt-six ares, quarante-quatre centiares (1 ha 86 a 44 ca).

2. Sources citées
Arrêté conjoint du ministre délégué auprès de la ministre de l'économie et des finances, chargé du budget et de la secrétaire d'Etat auprès du ministre de l'agriculture, de la pêche maritime, du développement rural et des eaux et forêts, chargée de la pêche maritime n°1277-25 du 16 kaada 1446 (14 mai 2025).","La ferme aquacole est implantée au niveau de la lagune d'Oualidia, dans la province de Sidi Bennour, sur une superficie d'un hectare, quatre-vingt-six ares, quarante-quatre centiares (1 ha 86 a 44 ca).",0.9999999999,1.0,0.375,0.8942042618992151,gpt-4o-mini,bge-m3,qwen2.5:7b,False,False,False,0.5
Quelles sont les différentes sources de revenus pour l'administration générale mentionnées dans le budget pour l'année 2024 ?,"[""|                  |           | 30                  | Reversements de fonds sur les dépenses budgétaires                                                                               | 180 000 000                                |\n|                  |           | 40                  | Fonds de concours                                                                                                                |                                            |\n|                  |           | 41                  | Fonds de concours (coopération internationale)                                                                                   | Mémoire                                    |  \n| Chapitre   | Service   | Nature de Recette   | DESIGNATION DES RECETTES                                                                   | Evaluations pour l'année budgétaire 2024   |\n|------------|-----------|---------------------|--------------------------------------------------------------------------------------------|--------------------------------------------|\n|            |           | 42                  | Fonds de concours à rattacher à divers services                                            | Mémoire                                    |\n|            |           | 50                  | Produits des legs et donations attribués à l'Etat et à diverses administrations publiques  | Mémoire                                    |\n|            |           | 60                  | Recettes exceptionnelles d'ordre                                                           | Mémoire                                    |\n|            |           | 70                  | Report des crédits disponibles au budget de l'année précédente                             | Mémoire                                    |\n|            |           | 80                  | Recettes diverses en atténuation de dépenses                                               | 31 681 000                                 |\n|            |           | 90                  | Recettes diverses                                                                          |                                            |\n|            |           | 91                  | Recettes au titre des versements à partir des comptes d'affectation spéciale               | Mémoire                                    |\n|            |           | 92                  | Recettes au titre des versements à partir des services de l'Etat gérés de manière autonome | Mémoire                                    |\n|            |           | 93                  | Autres recettes                                                                            | 71 014 000                                 |\n|            |           |                     | TOTAL DES RECETTES ADMINISTRATION GENERALE                                                 | 1 235 000 000                              |"", ""|                  | 8100      |                     | ADMINISTRATION GENERALE                                                                                                                              |                                            |\n|                  |           | 10                  | Pénalités et amendes autres que fiscales                                                                                                             | 50 000                                     |\n|                  |           | 20                  | Reversement par la Société Nationale des Transports et de la Logistique (SNTL) des crédits non utilisés au titre des achats de véhicules automobiles | Mémoire                                    |\n|                  |           | 30                  | Créances sur le Trésor prescrites                                                                                                                    | 173 744 000                                |\n|                  |           | 40                  | Prélèvement sur les produits des jeux de hasard                                                                                                      | Mémoire                                    |\n|                  |           | 50                  | Prélèvement sur les enjeux de courses de chevaux et de lévriers                                                                                      | Mémoire                                    |\n|                  |           | 60                  | Contribution des collectivités territoriales aux dépenses supportées par le budget général                                                           | Mémoire                                    |  \n3  \n| Chapitre   | Service   | Nature de Recette   | DESIGNATION DES RECETTES                                                     | Evaluations pour l'année budgétaire 2024   |\n|------------|-----------|---------------------|------------------------------------------------------------------------------|--------------------------------------------|\n|            | 8200      | 70                  | Recettes diverses                                                            | 294 421 000                                |\n|            |           |                     | TOTAL DES RECETTES ADMINISTRATION GENERALE                                   | 468 215 000                                |\n|            |           | 10                  | DIRECTION DES AFFAIRES ADMINISTRATIVES ET GENERALES Recettes diverses        | 189 000                                    |\n|            |           |                     | TOTAL DES RECETTES DIRECTION DES AFFAIRES ADMINISTRATIVES ET GENERALES       | 189 000                                    |\n|            | 8300      | 10                  | ADMINISTRATION DES DOUANES ET IMPOTS INDIRECTS Droits de douane              |                                            |"", ""|            |           | 50                  | Produits de vente de meubles, épaves et matériel réformé                                                          | 47 000 000                                 |\n|            |           | 60                  | Recettes diverses                                                                                                 | 2 500 000                                  |\n|            |           |                     | TOTAL DES RECETTES DIRECTION DES DOMAINES DE L'ETAT                                                               | 355 000 000                                |\n|            |           |                     | TOTAL DU CHAPITRE MINISTERE DE L'ECONOMIE ET DES FINANCES                                                         | 432 056 874 000                            |  \n9  \n| Chapitre         | Service   | Nature de Recette   | DESIGNATION DES RECETTES                                                                                                | Evaluations pour l'année budgétaire 2024   |\n|------------------|-----------|---------------------|-------------------------------------------------------------------------------------------------------------------------|--------------------------------------------|\n| 1.1.0.0.0.14.000 | 6100      | 10                  | MINISTERE DU TOURISME, DE L'ARTISANAT ET DE L'ECONOMIE SOCIALE ET SOLIDAIRE ADMINISTRATION GENERALE Taxe d'estampillage | Mémoire                                    |\n|                  |           | 20                  | Taxe d'inspection                                                                                                       | Mémoire                                    |\n|                  |           | 30                  | Recettes diverses                                                                                                       | Mémoire                                    |\n|                  |           |                     | TOTAL DES RECETTES ADMINISTRATION GENERALE                                                                              | Mémoire                                    |\n|                  |           |                     | TOTAL DU CHAPITRE MINISTERE DU TOURISME, DE L'ARTISANAT ET DE L'ECONOMIE SOCIALE ET SOLIDAIRE                           | Mémoire                                    |\n| 1.1.0.0.0.17.000 | 8100      |                     | MINISTERE DE L'EQUIPEMENT ET DE L'EAU DIRECTION DES AFFAIRES ADMINISTRATIVES ET JURIDIQUES                              |                                            |\n|                  |           | 10                  | Redevances pour l'extraction de matériaux                                                                               | 3 000 000                                  |"", ""### I. BUDGET GÉNÉRAL  \n| Chapitre         | Service   | Nature de Recette   | DESIGNATION DES RECETTES                                                                                                                                           | Evaluations pour l'année budgétaire 2024   |\n|------------------|-----------|---------------------|--------------------------------------------------------------------------------------------------------------------------------------------------------------------|--------------------------------------------|\n| 1.1.0.0.0.02.000 | 0000      | 10                  | COUR ROYALE ADMINISTRATION GENERALE Droits de chancellerie sur les armoiries et les blasons                                                                        | Mémoire                                    |\n|                  |           | 20                  | Recettes au titre des ordres du Royaume                                                                                                                            | 50 000                                     |\n|                  |           | 30                  | Recettes diverses                                                                                                                                                  | Mémoire                                    |\n|                  |           |                     | TOTAL DES RECETTES ADMINISTRATION GENERALE                                                                                                                         | 50 000                                     |\n|                  |           |                     | TOTAL DU CHAPITRE COUR ROYALE                                                                                                                                      | 50 000                                     |\n| 1.1.0.0.0.05.000 | 0000      | 10                  | JURIDICTIONS FINANCIERES ADMINISTRATION GENERALE Débets juridictionnels                                                                                            | Mémoire                                    |\n|                  |           | 20                  | Condamnations au remboursement prononcées par les juridictions financières                                                                                         | Mémoire                                    |\n|                  |           | 30                  | Amendes, astreintes et autres sanctions prononcées par les juridictions financières                                                                                | 1 054 000                                  |\n|                  |           | 40                  | Intérêts de retard au titre des sanctions prononcées par les juridictions financières                                                                              | Mémoire                                    |"", ""#### TITRE III  \n##### Dispositions relatives à l'équilibre des ressources et des charges de l'Etat  \n###### Article 39  \nPour l'année budgétaire 2024, les ressources affectées au budget général, aux services de l'Etat gérés de manière autonome et aux comptes spéciaux du Trésor, telles qu'elles sont évaluées dans le tableau «A» annexé à la présente loi de finances, ainsi que les plafonds de charges et l'équilibre général qui en résulte sont fixés aux montants suivants (en dirhams):  \nRECETTES ORDINAIRES DU BUDGET GENERAL (1) :  \n- Recettes fiscales :  \n- Impôts directs et taxes assimilées ….......……….  \n- Impôts indirects……………….....………………  \n- Droits de douane………………………...……….  \n- Droits d'enregistrement et de timbre……..……..  \n- Recettes non fiscales :  \n- Produits des cessions de participations de l'Etat..  \n- Produits de monopoles, d'exploitations et des participations financières de l'Etat………………..  \n- Revenus du domaine de l'Etat………….....…….  \n- Recettes diverses………………………………….  \n311.324.574.000  \n280.395.681.000  \n117.075.918.000  \n128.312.541.000  \n15.512.062.000  \n19.495.160.000  \n30.928.893.000  \n5.000.000.000  \n19.480.000.000  \n354.500.000  \n4.594.393.000  \n- Dons et legs………………………………………  \n1.500.000.000  \n| DEPENSES ORDINAIRESDUBUDGET GENERAL (2) :                                                                                                                                | 317.656.111.000   |\n|--------------------------------------------------------------------------------------------------------------------------------------------------------------------------|-------------------|\n| - Dépenses de fonctionnement :                                                                                                                                           | 279.426.731.000   |\n| - Dépenses de Personnel…….......…….....………..                                                                                                                             | 161.623.345.000   |\n| - Dépenses de Matériel et Dépenses Diverses....…                                                                                                                         | 71.158.286.000    |\n| - Charges Communes…….....................…………                                                                                                                            | 34.820.000.000    |\n| - Dépenses relatives aux remboursements, dégrèvements et restitutions, fiscaux……......…….                                                                                | 9.625.100.000     |\n| - Dépenses Imprévues et Dotations Provisionnelles ...                                                                                                                    | 2.200.000.000     |\n| - Dépenses en intérêts et commissions se rapportant à la dette publique…...............................................                                                  | 38.229.380.000    |"", ""|            |           |                     | TOTAL DES RECETTES DIRECTION DU TRESOR ET DES FINANCES EXTERIEURES DIRECTION DES ENTREPRISES PUBLIQUES ET DE LA PRIVATISATION | 128 092 323 000                            |\n|            |           | 10                  | Produits des monopoles, parts de bénéfices et contributions des établissements publics                                        |                                            |\n|            |           | 11                  | Produits à provenir de l'Agence Nationale de la Conservation Foncière, du Cadastre et de la Cartographie (ANCFCC)             | 4 000 000 000                              |\n|            |           | 12                  | Produits à provenir de l'Agence Nationale de Réglementation des Télécommunications (ANRT)                                     | 100 000 000                                |\n|            |           | 13                  | Produits à provenir de l'Office National des Aéroports (ONDA)                                                                 | 120 000 000                                |\n|            |           | 14                  | Produits à provenir de l'Agence Nationale des Ports (ANP)                                                                     | 60 000 000                                 |\n|            |           | 15                  | Produits à provenir de l'Autorité Marocaine du Marché des Capitaux (AMMC)                                                     | 14 000 000                                 |\n|            |           | 16                  | Produits à provenir de l'Office Marocain de la Propriété Industrielle et Commerciale (OMPIC)                                  | 14 000 000                                 |\n|            |           | 17                  | Produits à provenir de l'Etablissement Autonome de Contrôle et de Coordination des Exportations (EACCE)                       | 15 000 000                                 |\n|            |           | 18                  | Produits à provenir de l'Office National des Hydrocarbures et des Mines (ONHYM)                                               | Mémoire                                    |\n|            |           | 19                  | Produits à provenir de l'Office National Interprofessionnel des Céréales et Légumineuses (ONICL)                              | 40 000 000                                 |\n|            |           | 20                  | Produits des monopoles, parts de bénéfices et contributions d'autres établissements publics                                   |                                            |\n|            |           | 21                  | Produits à provenir de la Centrale d'achat et de développement de la région minière de tafilalet et de Figuig (CADETAF)       | 2 000 000                                  |""]","1. Réponse directe à la question :
Les différentes sources de revenus pour l'administration générale mentionnées dans le budget pour l'année 2024 sont les suivantes :

- Pénalités et amendes autres que fiscales (50 000 dirhams)
- Reversement par la SNTL des crédits non utilisés au titre des achats de véhicules automobiles
- Créances sur le Trésor prescrites (173 744 000 dirhams)
- Prélèvement sur les produits des jeux de hasard
- Prélèvement sur les enjeux de courses de chevaux et de taureaux
- Intérêts de retard au titre des sanctions prononcées par les juridictions financières (1 054 000 dirhams)
- Recettes diverses

2. Sources citées :
- Dahir n°1-23-91 du 30 joumada I 1445 (14 décembre 2023) portant promulgation de la loi de finances n°55-23 pour l'année budgétaire 2024, section I - Budget général.","Les différentes sources de revenus pour l'administration générale mentionnées dans le budget pour l'année 2024 incluent les droits de chancellerie sur les armoiries et les blasons, des recettes au titre des ordres du Royaume, et des recettes diverses. Pour les juridictions financières, les revenus proviennent des débets juridictionnels, des condamnations au remboursement, des amendes, des astreintes, et des intérêts de retard. Les recettes totales pour l'administration générale s'élèvent à 50 000 dirhams, tandis que celles des juridictions financières comprennent 1 054 000 dirhams en amendes et sanctions.",0.6458333333171874,1.0,0.8,0.9356350044610182,gpt-4o-mini,bge-m3,qwen2.5:7b,False,False,False,0.5
Quelles sont les règles pour gérer les déchets dans une ferme aquacole et qui doit s'occuper de la surveillance environnementale ?,"['| Gestion des déchets :                                                                                                                                                                                                                                                                                                                                                                     | Enfouissement et stockage dans des lieux autorisés à cet effet, conformément à la loi n°28-00 relative à la gestion des déchets et à leur élimination.                                                                                                                                                                                                                                    | Enfouissement et stockage dans des lieux autorisés à cet effet, conformément à la loi n°28-00 relative à la gestion des déchets et à leur élimination.                                                                                                                                                                                                                                    | Enfouissement et stockage dans des lieux autorisés à cet effet, conformément à la loi n°28-00 relative à la gestion des déchets et à leur élimination.                                                                                                                                                                                                                                    |', ""| Activité de la ferme aquacole Technique utilisée : Moyens d'exploitation :                                                                                                                                                                                                                                                                                                  | Élevage de la moule des espèces « Mytilus galloprovincialis » et « Perna perna ». Filière sub-surface Navires de servitude                                                                                                                                                                                                                                                  | Élevage de la moule des espèces « Mytilus galloprovincialis » et « Perna perna ». Filière sub-surface Navires de servitude                                                                                                                                                                                                                                                  | Élevage de la moule des espèces « Mytilus galloprovincialis » et « Perna perna ». Filière sub-surface Navires de servitude                                                                                                                                                                                                                                                  |\n| Contrôle et suivi technique et scientifique Surveillance environnementale : Gestion des déchets :                                                                                                                                                                                                                                                                           | L'Administration de la pêche maritime et l'Institut national de recherche halieutique (INRH) Selon le programme prévu dans l'étude d'impact sur l'environnement ; Enfouissement et stockage dans des lieux autorisés à cet effet, conformément à la loi n°28-00 relative à la gestion des déchets et à leur élimination.                                                    | L'Administration de la pêche maritime et l'Institut national de recherche halieutique (INRH) Selon le programme prévu dans l'étude d'impact sur l'environnement ; Enfouissement et stockage dans des lieux autorisés à cet effet, conformément à la loi n°28-00 relative à la gestion des déchets et à leur élimination.                                                    | L'Administration de la pêche maritime et l'Institut national de recherche halieutique (INRH) Selon le programme prévu dans l'étude d'impact sur l'environnement ; Enfouissement et stockage dans des lieux autorisés à cet effet, conformément à la loi n°28-00 relative à la gestion des déchets et à leur élimination.                                                    |"", ""| Contrôle et suivi technique et scientifique Surveillance environnementale : Gestion des déchets :                                                                                                                                                                                                                                                                             | L'Administration de la pêche maritime et l'Institut national de recherche halieutique (INRH)                                                                                                                                                                                                                                                                                  | L'Administration de la pêche maritime et l'Institut national de recherche halieutique (INRH)                                                                                                                                                                                                                                                                                  | L'Administration de la pêche maritime et l'Institut national de recherche halieutique (INRH)                                                                                                                                                                                                                                                                                  | L'Administration de la pêche maritime et l'Institut national de recherche halieutique (INRH)                                                                                                                                                                                                                                                                                  |"", ""| Contrôle et suivi technique et scientifique : Surveillance environnementale : Gestion des déchets :                                                                                                                                                                                                                                                                                      | L'Administration de la pêche maritime et l'Institut national de recherche halieutique (INRH). Enfouissement                                                                                                                                                                                                                                                                              | stockage dans des lieux                                                                                                                                                                                                                                                                                                                                                                  | cet effet, conformément                                                                                                                                                                                                                                                                                                                                                                  |"", '| Gestion des déchets :                                                                                                                                                                                                                                                                                                                                                                        | Enfouissement et stockage dans des lieux autorisés à cet effet, conformément à la loi n° 28-00 relative à la gestion des déchets et à leur élimination.y                                                                                                                                                                                                                                     | Enfouissement et stockage dans des lieux autorisés à cet effet, conformément à la loi n° 28-00 relative à la gestion des déchets et à leur élimination.y                                                                                                                                                                                                                                     | Enfouissement et stockage dans des lieux autorisés à cet effet, conformément à la loi n° 28-00 relative à la gestion des déchets et à leur élimination.y                                                                                                                                                                                                                                     |', '| Surveillance environnementale : Gestion des déchets :                                                          | loi n°28-00 relative à la gestion des déchets et à leur élimination. droit fixe :                                                                                                                                                                                                                                                                                                                                                                                                                                                                                                                                                                                                 | loi n°28-00 relative à la gestion des déchets et à leur élimination. droit fixe :                                                                                                                                                                   | loi n°28-00 relative à la gestion des déchets et à leur élimination. droit fixe :                                                                                                                                                                   | loi n°28-00 relative à la gestion des déchets et à leur élimination. droit fixe :                                                                                                                                                                   |']","1. Réponse directe à la question :

Les déchets générés par une ferme aquacole doivent être enfouis et stockés dans des lieux autorisés à cet effet, conformément à la loi n°28-00 relative à la gestion des déchets et à leur élimination. La surveillance environnementale est assurée par l'Administration de la pêche maritime et l'Institut national de recherche halieutique (INRH) selon le programme prévu dans l'étude d'impact sur l'environnement.

2. Sources citées :

- Arrêté conjoint du ministre de l'agriculture, de la pêche maritime, du développement rural et des eaux et forêts et du ministre délégué auprès de la ministre de l'économie et des finances, chargé du budget n°441-23 du 24 rejeb 1444 (15 février 2023) : Articles concernés par les règles sur la gestion des déchets.
- Arrêté conjoint du ministre de l'agriculture, de la pêche maritime, du développement rural et des eaux et forêts et du ministre délégué auprès de la ministre de l'économie et des finances, chargé du budget n°444-23 du 24 rejeb 1444 (15 février 2023) : Articles concernés par les règles sur la gestion des déchets.
- Arrêté conjoint du ministre de l'agriculture, de la pêche maritime, du développement rural et des eaux et forêts et du ministre délégué auprès de la ministre de l'économie et des finances, chargé du budget n°446-23 du 24 rejeb 1444 (15 février 2023) : Articles concernés par les règles sur la surveillance environnementale.
- Arrêté conjoint du ministre de l'agriculture, de la pêche maritime, du développement rural et des eaux et forêts et du ministre délégué auprès de la ministre de l'économie et des finances, chargé du budget n°2135-22 du 4 moharrem 1444 (2 août 2022) : Articles concernés par les règles sur la gestion des déchets.
- Arrêté conjoint du ministre de l'agriculture, de la pêche maritime, du développement rural et des eaux et forêts et du ministre délégué auprès de la ministre de l'économie et des finances, chargé du budget n°443-23 du 24 rejeb 1444 (15 février 2023) : Articles concernés par les règles sur la gestion des déchets.
- Arrêté conjoint du ministre délégué auprès de la ministre de l'économie et des finances, chargé du budget et de la secrétaire d'État auprès du ministre de l'agriculture, de la pêche maritime, du développement rural et des eaux et forêts, chargée de la pêche maritime n°1277-25 du 16 kaada 1446 (14 mai 2025) : Articles concernés par les règles sur la surveillance environnementale.","La gestion des déchets dans une ferme aquacole doit se faire par enfouissement et stockage dans des lieux autorisés, conformément à la loi. La surveillance environnementale est assurée par l'Administration de la pêche maritime et l'Institut national de recherche halieutique (INRH), selon le programme établi dans l'étude d'impact sur l'environnement.",0.9999999999833333,1.0,0.45454545454545453,0.8810197574970043,gpt-4o-mini,bge-m3,qwen2.5:7b,False,False,False,0.5
Quelles sont les règles à suivre pour exploiter des services de télécommunications ?,"[""###### Article 10 : Conditions d'exploitation des services de télécommunications  \nLes services de tél écommunications sont exploités conformément aux dispositions de la loi n°2496 précitée et de la réglementation en vigueur à compter de l'ouverture commerciale du service qui doit intervenir dans le délai indiqué  à l'article 5.1 ci-dessus."", ""###### Article 10 Conditions d'exploitation des services de télécommunications  \nLes services de télécommunications sont exploités conformément aux dispositions de la loi  n°24-96  précitée  et  de  la  réglementation  en  vigueur  à  compter  de  l'ouverture commerciale du service qui doit intervenir dans le délai indiqué à l'article 5.1 ci-dessus."", ""###### Article 10 : Conditions d'exploitation des services de télécommunications  \nLes services de tél écommunications sont exploités conformément aux dispositions de la loi n°2496 précitée et de la réglementation en vigueur à compter de l'ouverture commerciale du service qui doit intervenir dans le délai indiqué  à l'article 5.1 ci-dessus."", ""##### CHAPITRE II - CONDITIONS GENERALES D'ETABLISSEMENT ET D'EXPLOITATION DU RESEAU DE TELECOMMUNICATIONS  \n###### Article 9 : Conditions d'établissement des réseaux"", ""###### Article 11 : Conditions d'exploitation commerciale"", ""###### 9.6.1 Installation des équipements  \nMédi Telecom a le droit de réaliser les travaux nécessaires à l'exploitation et à l'extension de  son  réseau.  Il  s'engage  à  respecter  l'ensemble  des  dispositions  législatives  et réglementaires en vigueur, notamment  en  matière  d'aménagement  du  territoire, d'urbanisme, d'occupation temporaire du domaine public et de protection de l'environnement à l'occasion de la réalisation d'équipements ou d'ouvrages particuliers.""]","1. **Réponse directe à la question**  
Les services de télécommunications doivent être exploités conformément aux dispositions de la loi n°2496 et de la réglementation en vigueur, à compter de l'ouverture commerciale du service.

2. **Sources citées**  
- Décret n°2-25-878 du 7 joumada I 1447 (30 octobre 2025) : Article 10
- Décret n°2-25-876 du 7 joumada I 1447 (30 octobre 2025) : Article 10
- Décret n°2-25-877 du 7 joumada I 1447 (30 octobre 2025) : Article 10","Les services de télécommunications doivent être exploités conformément aux dispositions de la loi n°24-96 et à la réglementation en vigueur, à compter de l'ouverture commerciale du service, selon l'article 10.",0.999999999975,1.0,0.5,0.8690381093367553,gpt-4o-mini,bge-m3,qwen2.5:7b,False,False,False,0.5
"Quel est le taux de l'impôt pour les revenus liés aux actions et parts sociales selon la réglementation, et quelles sont les conditions spécifiques qui s'y appliquent ?","[""- «IV. - les intérêts ...............................................................  \n(la suite sans modification.)  \n- « Article 73 . - Taux de l'impôt  \n«I. - ..........................................................................................  \n- «II. - Taux spécifiques  \n- «Le taux de l'impôt .................................................................  \n- «B.- 10 % :  \n«1° -.......................................................................................  \n«............................................................................................  \n«6°- .......................................................................................  \n- «7°- pour le montant des produits des actions, parts «sociales et revenus assimilés, énumérés à l'article 13 ci-dessus, «sous réserve des dispositions du paragraphe XXXVII-C de  \n- «l'article 247 ci-dessous ;  \n«8°- pour les rémunérations visées à l'article 15 bis «ci-dessus, hors taxe sur la valeur ajoutée, allouées à des «personnes soumises à l'impôt sur le revenu selon le régime «du résultat net réel ou celui du résultat net simplifié.  \n- «C. - 15% :  \n«1° -.......................................................................................  \n- «2° - pour les revenus ....................de source étrangère ;  \n- «3°- (abrogé)  \n- «4°- pour le montant ..........................................................  \n- «........................................................... (120 000) dirhams.  \n- «5°- pour le montant brut des rachats des cotisations et «primes avant la durée de huit (8) ans ou avant l'âge de «quarante cinq ans, prévu à l'article 28-III-A ci-dessus.  \n- «D. - (abrogé)  \n- «F. - 20% :  \n«1° - ........................................................................................  \n«............................................................................................  \n«............................................................................................  \n«5°-...................................................... source étrangère ;  \n- «6°- pour les profits nets fonciers réalisés ou constatés «prévus à l'article 61-II ci-dessus, sous réserve des dispositions «prévues à l'article 144-II-1° ci-dessous ;  \n«7° - (abrogé)  \n«9° - pour les traitements, émoluments et salaires bruts «versés aux salariés qui travaillent pour le compte des sociétés «ayant le statut « Casablanca Finance City », conformément «à la législation et la réglementation en vigueur, à l'exclusion «des établissements de crédit et des entreprises d'assurances «et de réassurance visés aux paragraphes 1 et 2 de l'article 4 «du décret-loi n° 2-20-665 précité, pour une période maximale «de dix (10) ans, à compter de la date de prise de leurs fonctions.  \n- «Toutefois, les salariés .....................................................  \n- «.......................................................... prévu au I ci-dessus ;"", ""###### «I. - Taux normal de l'impôt  \n- « Sous  réserve  des  dispositions  du  paragraphe «XXXVII-A de l'article 247 ci-dessous, le taux de l'impôt «sur les sociétés est fixé à :  \n- «A.- 20% ;  \n- « B.-  35%,  en  ce  qui  concerne  les  sociétés  dont  le «montant du bénéfice net est égal ou supérieur à cent millions «(100000000) dirhams, à l'exclusion :  \n- «1) des sociétés de services ayant le statut « Casablanca «Finance City » bénéficiant du régime fiscal prévu à l'article6 «ci-dessus ;  \n- «2) des sociétés qui exercent leurs activités dans les « zones  d'accélération  industrielle  prévues  à  l'article  6 «(II-B-8°) ci-dessus ;  \n- «3) des sociétés constituées à compter du 1 er  janvier «2023 qui s'engagent dans le cadre d'une convention signée «avec l'Etat à investir un montant d'au moins un milliard et «cinq cent millions (1 500 000 000) dirhams durant une période «de cinq (5) ans à compter de la date de signature de ladite «convention, à l'exception des établissements et entreprises «publics et leurs filiales conformément aux textes législatifs «et réglementaires en vigueur.  \n- «L'exclusion précitée des sociétés concernées s'applique «à condition :  \n- «-d'investir le montant précité dans des immobilisations «corporelles ;  \n- « - de  conserver  lesdites  immobilisations  pendant «au moins dix (10) ans, à compter de la date de leur «acquisition.  \n- « Les  sociétés  concernées  doivent  souscrire  à «l'administration fiscale un état comprenant, notamment, «le montant global investi au titre de chaque exercice et la «nature des immobilisations concernant l'activité objet de «l'investissement ainsi que la date et le prix de leur acquisition, «selon un modèle établi par l'administration à joindre à la «déclaration du résultat fiscal prévue à l'article 20-I ci-dessous.  \n- «Elles doivent également joindre une copie de ladite «convention à la déclaration du résultat fiscal au titre du «premier exercice au cours duquel elle a été signée.  \n- «Toutefois, lorsque le bénéfice net réalisé est inférieur « à  cent  millions  (100  000  000)  dirhams,  le  taux  de  20% «ne s'applique que lorsque ledit bénéfice demeure inférieur à «ce montant pendant trois (3) exercices consécutifs ;  \n- «C. - 40%, en ce qui concerne les établissements de «crédit et organismes assimilés, Bank Al-Maghrib, la Caisse «de dépôt et de gestion et les entreprises d'assurances et de «réassurance.  \n- «Les entreprises d'assurances .........................................  \n«.............................................................................. Takaful.  \n- «II. - (abrogé)  \n«III. -  ……………………………………………………  \n- «IV. - Taux de l'impôt retenu à la source  \n- «Les taux de l'impôt sur les sociétés retenu à la source «sont fixés à:"", ""- «-12,50% au titre de l'exercice ouvert à compter du «1 er janvier 2024;\n- «-11,25% au titre de l'exercice ouvert à compter du «1 er janvier 2025;\n- « - 10%  au  titre  de  l'exercice  ouvert  à  compter  du «1 er  janvier 2026.  \n- « Toutefois, les produits des actions, parts sociales «et revenus assimilés distribués et provenant des bénéfices «réalisés au titre des exercices ouverts avant le 1 er janvier 2023, «demeurent soumis au taux de 15%.\n- «Les produits des actions, parts sociales et revenus «assimilés distribués sont considérés avoir été prélevés sur «les exercices les plus anciens.\n- «D-Les dispositions des articles 6 (I-B et D et II-B «et C ), 7 (II, IV, VI et X), 19 (I, II, IV-D), 165-I, 170 (III «et VIII) et 191-II du code général des impôts applicables au «31 décembre 2022, demeurent en vigueur pour l'application «progressive des dispositions prévues aux A, B et C du présent «paragraphe.\n- «F-A titre transitoire, les limites des taux admis pour «la constitution  des provisions pour investissement par les «sociétés ayant le statut « Casablanca Finance City » prévues «à l'article 10 (III-C-2°) ci-dessus, sont fixées progressivement «au titre de chaque exercice ouvert durant la période allant du «1 er  janvier 2023 au 31 décembre 2026, comme suit :\n- «-7,70% au titre de l'exercice ouvert  à compter du «1 er janvier 2023 ;\n- «-14,30% au titre de l'exercice ouvert  à compter du «1 er janvier 2024 ;\n- « - 20%  au  titre  de  l'exercice  ouvert    à  compter  du «1 er janvier 2025 ;\n- « - 25%  au  titre  de  l'exercice  ouvert    à  compter  du «1 er  janvier 2026.\n- «XXXVIII.-A titre transitoire et nonobstant toute « disposition  contraire,  les  contribuables  n'ayant  réalisé «aucun chiffre d'affaires ou ayant versé le minimum de la «cotisation minimale visé à l'article 144-I-D (2 ème  alinéa) «ci-dessus, au titre des quatre (4) derniers exercices, peuvent «bénéficier de la dispense du contrôle fiscal ainsi que de «l'annulation d'office des majorations, amendes et pénalités «pour défaut de dépôt des déclarations et de versement des «impôts prévus par le présent code au titre des années non «prescrites, dans les conditions suivantes :\n- «-la souscription de la déclaration de cessation totale «d'activité prévue à l'article 150 ci-dessus au cours de «l'année 2023 ;\n- «-le versement spontané, dans le même délai de la « déclaration précitée, d'un montant forfaitaire de «l'impôt sur les sociétés ou de l'impôt sur le revenu «selon le cas, de cinq mille (5000) dirhams, au titre de «chaque exercice non prescrit.\n- «Toutefois, les plus-values de cession ou de retrait des «éléments corporels ou incorporels de l'actif immobilisé ainsi «que les indemnités perçues en contrepartie de la cessation «de l'exercice de l'activité ou du transfert de la clientèle, sont «imposables selon le cas, soit à l'impôt sur les sociétés ou à «l'impôt sur le revenu, dans les conditions de droit commun."", ""###### «B. - 10% du:  \n- «- montant des produits bruts, hors taxe sur la valeur «ajoutée, perçus par les personnes physiques ou morales «non résidentes, énumérés à l'article 15 ci-dessus ;  \n- «- montant des produits des actions, parts sociales et «revenus assimilés, énumérés à l'article 13 ci-dessus,  \n- « sous  réserve  des  dispositions  du  paragraphe  \n- «XXXVII-C de l'article 247 ci-dessous ;  \n- «C. - 20 % du montant, hors taxe sur la valeur ajoutée «des produits de placements ....................................... l'impôt «sur les sociétés.  \n- «D. - (abrogé)»  \n- «Article 28 . -  Déductions sur le revenu global imposable  \n- «Sont déductibles du revenu ........ l'article 25 ci-dessus:  \n«I. - .......................................................................................  \n- «II. - .......................................................................................  \n«III.- A. - dans la limite de 10% du  .................................  \n- «................................................................ aux bénéficiaires «à partir de l'âge de quarante cinq ans révolus.  \n- «Lorsqu'un contribuable .................................................. «.......................................... desdites cotisations ou primes.  \n- «Lorsqu'au terme du contrat ……….......…………….  \n- «..................................... l'article 73-I ci-dessous, après «un abattement de 70% sur le montant qui ne dépasse pas «168 000 dirhams et 40% pour le surplus et avec étalement «sur une période maximum de quatre années.  \n- «Le débirentier qui n'effectue ............................................ «l'article 200 ci-dessous.  \n- «Lorsque l'assuré procède au rachat de ses cotisations «avant la durée de huit (8) ans ou avant l'âge de quarante «cinq ans, le montant total du rachat est ………..........………… «concerné au taux visé à l'article 73 (II-C-5°) ci-dessous sans «abattement, sans préjudice de l'application ...................... «l'article 200 ci-dessous.  \n- «Sont considérées comme un rachat, les avances dont «bénéficie l'assuré avant le terme du contrat ou avant l'âge de «quarante cinq ans et sont imposables comme prévu ci-dessus.  \n- «Pour régulariser sa situation ............................................ (la suite sans modification.)  \n- « Article 31 . - Exonérations et réduction d'impôt  \n- «I. - Exonérations  \n«A.- ……………………………........………………………  \n- «B. - Exonérations temporaires  \n«……………………………..…………………………….  \n- «2° - Les entreprises hôtelières et les établissements «d'animation touristique bénéficient de l'exonération totale «de l'impôt sur le revenu, pendant une période de cinq (5) ans, «dans les conditions prévues à l'article 6 (II-B-5°) ci-dessus.  \n- «3°- Les entreprises qui exercent leurs activités dans les «zones d'accélération industrielle bénéficient de l'exonération «totale durant les cinq (5) premiers exercices consécutifs à «compter de la date du début de leur exploitation."", '- «D.-Sous réserve des dispositions .................., destiné «par son propriétaire à son habitation principale depuis  \n«…………………..................................................................………..  \n(la suite sans modification.)  \n- « Article  64 .  -  Détermination  du  revenu  foncier «imposable  \n- «I. - ....................................................................................... « .........................................pour le compte des locataires.  \n- «II. - Le revenu net imposable des immeubles visés à « l\'article  61  (I-A-1°,  B,  C  et  D)  ci-dessus  est  obtenu  en «appliquant un abattement de 40% sur le montant du revenu «foncier brut tel qu\'il est défini au I ci-dessus.  \n- «III.- Le revenu brut imposable ......................................  \n(la suite sans modification.)  \n- « Article 65 .-II.-le prix d\'acquisition est augmenté ....... «................................................................................................... «....................................... par les ou l\'une des parties.  \n- «En cas de taxation d\'office, la base d\'imposition est «déterminée sur la base des informations et des données dont «dispose l\'administration. En l\'absence desdites informations «et données, la base d\'imposition est égale au prix de cession «diminué de 20%.»  \n- « Article 66 .-I.-Sont considérés comme des revenus «de capitaux mobiliers :  \n- «A.-les produits des actions, parts sociales et revenus «assimilés visés à l\'article 13 ci-dessus, à l\'exclusion des « produits  provenant  des  bénéfices  distribués  par  les «organismes de placement collectif immobilier (OPCI) aux «personnes soumises à l\'impôt sur le revenu.  \n- «B.-les revenus ................... opérations de pensions. »  \n- « Article 68 . - Exonérations  \n- «Sont exonérés de l\'impôt:  \n«I. - ..........................................................................................  \n«............................................................................................  \n«............................................................................................  \n- «III. - les dividendes et autres produits de participations «similaires de source étrangère versés, mis à la disposition ou «inscrits en compte des non-résidents par les sociétés installées «dans les zones d\'accélération industrielle et par celles ayant «le statut ""Casablanca Finance City"", visées à l\'article 6 «(I- C-1°) ci-dessus ;  \n- «IV. - les intérêts ...............................................................  \n(la suite sans modification.)  \n- « Article 73 . - Taux de l\'impôt  \n«I. - ..........................................................................................  \n- «II. - Taux spécifiques  \n- «Le taux de l\'impôt .................................................................  \n- «B.- 10 % :  \n«1° -.......................................................................................', ""«…………...................………....………....………....…………….  \n(la suite sans modification.)  \n- « Article 125 ter . - Récupération de la taxe sur la valeur «ajoutée non apparente  \n- «Par dérogation ………………………………… d'achat:  \n«a) …………………………………………………………......  \n- «b) du lait non ……………… à l'article 91 (I-A- 2° et 9°) «ci-dessus, vendus …………………………………………...  \n(la suite sans modification.)  \n- « Article 129. - III- Actes présentant un intérêt social :  \n«1° -    ……………………………………………………………  \n«……………………………………………………………………….  \n«……………………………………………………………………….  \n- «10° - les actes ………………………… et aux opérations:  \n- « -  de la Fondation Hassan II ………………………… « ………………………………………………………………….. «……………………………………………………………………..  \n- « -  de la Ligue …………………………….. l'enfance;  \n- « - de la Fondation Mohammed VI des sciences et de «la santé créée par la loi n° 23-23 précitée;  \n- «11° - les opérations des associations …………………… (la suite sans modification.)  \n- « Article 133. - Droits proportionnels  \n- «I. - Taux applicables  \n«A. - ………….........................................................................  \n«……………..............................................………….............…  \n«…………………...............................……………............……  \n- «F. - Sont soumis au taux de 4%:  \n- «1°- l'acquisition ….....…...............…… administratif «et l'acquisition desdits locaux…………………………….. ou ««Moucharaka Moutanakissa» ainsi que l'attribution des «locaux précités par les coopératives ou les associations au «profit de leurs membres.  \n- «Bénéficient également ………………………………………  \n- «G. - Sont soumis au taux de 5%:  \n- «1° - les actes …………………………… terrains;  \n- «2° - les actes………………………… Moutanakissa»;  \n- «3° - les actes et conventions portant attribution de «terrains nus par les coopératives ou les associations au profit «de leurs membres.  \n«H. - ……………......................................……………………  \n(la suite sans modification.)  \n- « Article 135. - II . - Sont enregistrés au droit fixe de deux «cent (200) dirhams :  \n«1° - ……….......................................…………………………  \n«…………...........................................…………………………  \n« …………...........................................…………………………  \n«8° - .................................................................de commerce;  \n- «9° - (Abrogé)  \n«10° - ……….....................................…………………………  \n(la suite sans modification.)  \n- « Article 139. - IV- En cas de mutation ou de cession «d'immeuble ou de fonds de commerce, il est fait obligation «aux adoul, notaires, avocats agréés près la cour de cassation «ou toute personne exerçant des fonctions notariales:  \n- «- de ne dresser aucun acte qu'après présentation d'une « attestation  des  services  de  recouvrement  justifiant  du « paiement  des  impôts  et  taxes  grevant  l'immeuble  se «rapportant à l'année de mutation ou de cession et aux années «antérieures et ce, à peine d'être tenus solidairement avec le «contribuable au paiement des impôts et taxes grevant ledit «immeuble;""]","1. Réponse directe à la question

Le taux de l'impôt pour les revenus liés aux actions et parts sociales varie selon plusieurs conditions :

- Pour les personnes soumises à l'impôt sur le revenu, les produits des actions, parts sociales et revenus assimilés visés à l'article 13 ci-dessus sont taxés au taux de 10%.

- Cependant, les dividendes et autres produits de participations similaires de source étrangère versés par les sociétés installées dans les zones d'accélération industrielle et celles ayant le statut ""Casablanca Finance City"" sont exonérés (article 68 IV. III).

2. Sources citées

- Article 13 : Définition des revenus de capitaux mobiliers.
- Article 68 : Exonérations spécifiques et exceptions pour certaines personnes soumises à l'impôt sur le revenu.

Information non disponible.","Le taux de l'impôt pour le montant des produits des actions, parts sociales et revenus assimilés est de 10 %, sous réserve des dispositions du paragraphe XXXVII-C de l'article 247.",0.8041666666465626,1.0,0.2857142857142857,0.0,gpt-4o-mini,bge-m3,qwen2.5:7b,False,False,False,0.5
Combien d'agents d'assurance indépendants peuvent représenter la même compagnie d'assurance au Maroc ?,"[""### 2-2-2- Dynamique des agents d'assurance indépendants  \nLes  agents  d'assurance  indépendants  sont,  en  général,  des  entrepreneurs  indépendants autorisés à exercer des activités au nom de la compagnie d'assurance qu'ils représentent et avec laquelle ils ont conclu un accord de représentation. Ils peuvent vendre une seule branche d'activité ou plusieurs branches d'assurance. Cependant, ces agents peuvent représenter au plus, deux (2) EAR à condition d'obtenir l'accord de l'entreprise avec laquelle ils ont souscrit le premier traité de nomination.  \nLe marché marocain de l'assurance compte, à fin 2021, 1625 agents, représentant ainsi 58% du total des intermédiaires d'assurance.  \nDepuis 2005, le nombre d'agents agrées s'est inscrit dans la hausse et a atteint son point culminant  en  2019  avec  un  nombre  de  1.670  agents.  Les  agents  voient  leur  production croître à 12,6 milliards de dirhams en 2021 (soit une hausse de 16,7%).  \n42  \nrelatif à l'état de la concurrence dans le marché de l'assurance au Maroc  \nEntre 2005 et 2021, le nombre d'agents d'assurances est passé de 608 à 1.625, enregistrant un taux de croissance annuel moyen qui ne dépasse pas 6%, et ce, en raison des conditions d'accès  au  marché  de  distribution  de  l'assurance,  notamment  l'obligation  de  passer  un examen organisé par l'ACAPS en collaboration avec l'association professionnelle représentant des EAR pour obtenir l'agrément d'exercer.  \nGraph. 18 : Evolution du nombre des agents indépendants, année 2005-2021 :  \n<!-- image -->  \nSource : ACAPS."", ""### 2- La Fédération Nationale des Agents et Courtiers d'Assurances au Maroc  \nA la différence des EAR, le code des assurances a laissé la liberté aux intermédiaires d'assurances de  s'organiser  en  associations  professionnelles,  en  stipulant  dans  son  article  285  que  : « Les intermédiaires d'assurances s'organisent en associations professionnelles régies par les dispositions du dahir n°1-58-376 du 3 joumada I 1378 (15 novembre 1958) précité. Sont fixés par décret, après consultation de l'Autorité, les critères de désignation de l'association la plus représentative ». Ce même article stipule que les statuts des associations professionnelles susvisées ainsi que toutes modifications y afférentes sont approuvés par l'ACAPS.  \n27"", ""### 2-1-1- Le statut juridique des entreprises d'assurances  \nLe  marché  marocain  de  l'assurance  compte  à  fin  2021,  18  sociétés  anonymes  (SA)  et  4 sociétés d'assurances mutuelles (SAM). Ces dernières sont des sociétés à but non lucratif qui  garantissent  au  profit  de  leurs  membres,  personnes  physiques  ou  morales,  appelés sociétaires, moyennant le versement d'une cotisation fixe ou variable, le règlement intégral de leurs engagements, en cas de réalisation des risques dont elles ont pris la charge.  \nGraph. 7 : Structure du secteur des assurances en fonction du statut juridique, année 2021  \n<!-- image -->"", ""### 2-1- La structure de l'offre des entreprises d'assurances  \nLe marché marocain de l'assurance compte à fin 2022, un total de 26 entreprises, en croissance de 18% par rapport à l'année 2021, suite à l'entrée des entreprises Takaful.  \nBien que la création des EAR au Maroc reste variable d'une année à l'autre, avec des années où  aucune  création  n'est  enregistrée,  la  tendance  générale  du  nombre  total  des  EAR  au Maroc semble être à la hausse, avec une légère fluctuation d'une année à l'autre. Le nombre total d'entreprises est passé de 18 en 2005 à 26 en 2022, avec un taux de croissance annuel moyen de 2%.  \n34  \n0  \nrelatif à l'état de la concurrence dans le marché de l'assurance au Maroc  \nGraph. 6 : Evolution du nombre des EAR au Maroc, années 2005-2022  \n5  \n<!-- image -->  \n5  \n0  \n6  \nSource : ACAPS."", ""## Avis du Conseil de la concurrence n° A/1/23  \n### 2-2-4- Dynamique des bancassureurs  \nA fin 2021, les réseaux bancaires, les sociétés de financement et les associations de micro-crédit constituent les acteurs de bancassurance au Maroc 18 .  L'activité de bancassurance peut être définie comme l'activité de commercialisation par les établissements de crédit des produits d'assurance pour le compte des compagnies d'assurance.  \nAu Maroc, cette activité est limitée sur le plan légal à :  \n- Pour les banques :  aux assurances de personnes, à l'assistance et à l'assurance-crédit 19 ;\n- Pour les associations de micro-crédit : aux assurances de personnes et aux assurances contre l'incendie et le vol 20 ;\n- Pour les sociétés de financement : aux opérations d'assurances «décès» et «invalidité», adossées aux opérations de crédit et/ou de crédit-bail 21 .  \nSelon les données fournies par l'ACAPS, à fin 2021, le marché de la bancassurance est animé par 11 banques, 3 sociétés de financement et une association de microcrédit. Ce nombre est resté globalement stable depuis l'année 2018.  \nGraph. 20 : Evolution du nombre des établissements agréés en bancassurance, années 2018-2021  \n<!-- image -->"", ""### · Associations professionnelles :  \n- Fédération marocaine des sociétés d'assurances et de réassurances (FMSAR) 2 ;\n- Fédération Nationale des Agents et Courtiers d'Assurance au Maroc (FNACAM) ;\n- Groupement Professionnel des Banques du Maroc (GPBM) ;\n- Association Marocaine des Actuaires (AMA).""]","1. Réponse directe à la question
Selon l'extrait fourni, un agent d'assurance indépendant peut représenter au plus deux (2) compagnies d'assurance différentes, à condition d'avoir obtenu l'accord de l'entreprise avec laquelle il a souscrit le premier traité de nomination.

2. Sources citées
-Avis du Conseil de la concurrence n° A/1/23 > 2-2-2- Dynamique des agents d'assurance indépendants","Les agents d'assurance indépendants peuvent représenter au plus deux (2) entreprises d'assurance régionales (EAR) au Maroc, à condition d'obtenir l'accord de l'entreprise avec laquelle ils ont souscrit le premier traité de nomination.",0.9999999999,1.0,0.75,0.943697965275628,gpt-4o-mini,bge-m3,qwen2.5:7b,False,False,False,0.5
Quelle est la durée de validité de l'agrément de la société PALMA FLOR pour commercialiser des plants certifiés et quelles sont les conditions pour le renouveler ?,"[""## ARRÊTE :  \nARTICLE PREMIER.-La société «PALMA FLOR» dont le siège social  sis Mazaria Ouled El Maghraoui, Ouled Settout, Zaio, Nador, est agréée pour commercialiser des plants certifiés d'olivier, de vigne, de figuier, de figuier de barbarie, d'arganier, de caroubier et des semences et plants certifiés des rosacées à noyau et d'agrumes.  \nART.2.-La durée de validité de cet agrément est de cinq (5) ans, à compter de la date de publication du présent arrêté au « Bulletin officiel ».  \nIl peut être renouvelé pour la même durée, à condition que la demande de renouvellement soit formulée six (6) mois, au moins, avant l'expiration de sa durée de validité.  \nART.3.-La déclaration prévue à l'article 2 de chacun des arrêtés susvisés n os 2098-03, 2100-03, 2110-05, 3548-13, 986-19, 1437-22, 2140-22 et 640-23 doit être faite par la société «PALMA FLOR» à l'Office national de sécurité sanitaire des produits alimentaires, comme suit :  \n- en avril et septembre de chaque année :\n- pour les achats et les ventes des plants d'olivier ;\n- pour les achats, les ventes et les stocks des plants de vigne ;\n- pour la production, les ventes et les stocks des plants de figuier ;  \n- en janvier et juillet de chaque année pour les achats, les ventes et les stocks des semences et plants d'agrumes ;\n- annuellement pour les stocks des plants de figuier de barbarie ;\n- au moins une fois par an au plus tard le 31 décembre, la situation de leurs stocks de semences et plants certifiés des rosacées à noyau ;\n- au moins une fois par an au plus tard le 31 décembre, la situation de leurs stocks de plants certifiés d'arganier ;\n- au moins une fois par an au plus tard le 31 décembre, la situation de leurs stocks de plants certifiés de caroubier.  \nART.4.-L'agrément objet du présent arrêté peut être retiré en cas d'infraction dûment constatée aux dispositions du dahir n°1-69-169 susvisé ou des textes pris pour son application.  \nART.5.-Le présent arrêté sera publié au Bulletin officiel .  \nRabat, le 18 chaoual 1446 (17 avril 2025).  \nahMeD el bOUaRI.  \nLe texte en langue arabe a été publié dans l'édition générale du «Bulletin officiel » n° 7408 du 1 er  hija 1446 (29 mai 2025)."", ""## ARRÊTE :  \nARTICLE PREMIER.-La société «LUNA FRESH» dont le siège social sis voie principale 30011, commune rurale Sahel-Ouled  Hriz,  province  Berrechid,  est  agréée  pour commercialiser des semences certifiées du maïs, des semences standard de légumes et des plants certifiés de pomme de terre.  \nART.2.-La durée de validité de cet agrément est de cinq (5) ans, à compter de la date de publication du présent arrêté au « Bulletin officiel ».  \nIl peut être renouvelé pour la même durée à condition que la demande de renouvellement soit formulée six (6) mois, au moins, avant l'expiration de sa validité.  \nART.3.-La déclaration prévue à l'article 2 de chacun des arrêtés susvisés  n os 859-75, 971-75 et 622-11 doit être faite par la société «LUNA FRESH» à l'Office national de sécurité sanitaire des produits alimentaires comme suit :  \n- semestriellement pour les achats, les ventes et les stocks des plants de pomme de terre ;\n- mensuellement pour les achats et les ventes de semences des  autres  espèces  mentionnées  à  l'article  premier ci-dessus.  \nART.4.-L'agrément objet du présent arrêté peut être retiré en cas d'infraction dûment constatée aux dispositions du dahir n°1-69-169 susvisé ou des textes pris pour son application.  \naRt.5.Le présent arrêté sera publié au Bulletin officiel  \n. Rabat, le 16 rabii I 1447 (9 septembre 2025).  \nahMeD el bOUaRI."", ""## ARRÊTE :  \nARTICLE PREMIER.-La société «ZIAGRO» dont le siège social sis 42, résidence Mabrouka, Manzah, appartement 9, Aïn Atiq, Temara, est agréée pour commercialiser des plants certifiés d'olivier, de vigne, de figuier, de grenadier, des rosacées à pépins, des semences et plants certifiés des rosacées à noyau et des plants certifiés des espèces à fruits rouges.  \nART.2.-La durée de validité de cet agrément est de cinq (5) ans, à compter de la date de publication du présent arrêté au « Bulletin officiel ».  \nIl peut être renouvelé pour la même durée, à condition que la demande de renouvellement soit formulée six (6) mois, au moins, avant l'expiration de sa durée de validité.  \nART.3.-La déclaration prévue à l'article 2 de chacun des arrêtés susvisés n os 2100-03, 2110-05, 2157-11, 3548-13, 784-16, 2109-17, 1437-22, doit être faite par la société «ZIAGRO» à l'Office national de sécurité sanitaire des produits alimentaires, comme suit :  \n- en avril et septembre de chaque année :\n- pour les achats et les ventes des plants d'olivier ;\n- pour les achats, les ventes et les stocks des plants de vigne et des rosacées à pépins ;\n- pour la production, les ventes et les stocks des plants de figuier ;\n- en novembre et mai de chaque année pour la situation des stocks des plants de grenadier ;\n- en novembre et mai de chaque année les stocks des plants des espèces à fruits rouges ;\n- au moins une fois par an au plus tard le 31 décembre, la situation de leurs stocks de semences et plants certifiés des rosacées à noyau.  \nART.4.-L'agrément objet du présent arrêté peut être retiré en cas d'infraction dûment constatée aux dispositions du dahir n°1-69-169 susvisé ou des textes pris pour son application.  \nART.5.-Le présent arrêté sera publié au Bulletin officiel .  \nRabat, le 18 chaoual 1446 (17 avril 2025).  \nahMeD el bOUaRI.  \nLe texte en langue arabe a été publié dans l'édition générale du «Bulletin officiel » n° 7408 du 1 er  hija 1446 (29 mai 2025)."", ""## ARRÊTE :  \nARTICLE  PREMIER. - La  société  « ISSEMGHY BIOTECHNOLOGIES» dont le siège social sis rue Koteiba, Bnou Mouslim, Casablanca, est agréée pour commercialiser des plants certifiés de palmier dattier.  \nART.2.-La durée de validité de cet agrément est de cinq (5) ans, à compter de la date de publication du présent arrêté au « Bulletin officiel ».  \nIl peut être renouvelé pour la même durée à condition que la demande de renouvellement soit formulée six (6) mois, au moins, avant l'expiration de sa validité.  \nART.3.-La déclaration prévue à l'article 2 de l'arrêté susvisé n°3229-15 des stocks de plants mentionnés à l'article premier ci-dessus doit être faite en mai et novembre de chaque année, par la société «ISSEMGHY BIOTECHNOLOGIES» à l'Office national de sécurité sanitaire des produits alimentaires.  \nART.4.-L'agrément objet du présent arrêté peut être retiré en cas d'infraction dûment constatée aux dispositions du dahir n°1-69-169 susvisé ou des textes pris pour son application.  \naRt.5.Le présent arrêté sera publié au Bulletin officiel  \n. Rabat, le 29 hija 1446 (26 juin 2025).  \nahMeD el bOUaRI.  \nLe texte en langue arabe a été publié dans l'édition générale du «Bulletin officiel » n° 7424 du 28 moharrem 1447 (24 juillet 2025)."", ""## ARRÊTE :  \nARTICLE  PREMIER. - La  société  « VILMORINMIKADO ATLAS» dont le siège social sis route de l'Oasis, rue n°3 et n°6, bureaux n°B108, B109 et M02, Oasis Sud, quartier Oasis, Casablanca, est agréée pour commercialiser des semences certifiées du maïs et des semences standard de légumes.  \nART.2.-La durée de validité de cet agrément est de cinq (5) ans, à compter de la date de publication du présent arrêté au « Bulletin officiel ».  \nIl peut être renouvelé pour la même durée à condition que la demande de renouvellement soit formulée six (6) mois, au moins, avant l'expiration de sa validité.  \nART.3.-La déclaration prévue à l'article 2 de chacun des arrêtés susvisés n os 859-75 et 971-75 des achats et des ventes des semences mentionnées à l'article premier ci-dessus doit être faite mensuellement par la société «VILMORIN-MIKADO ATLAS» à l'Office national de sécurité sanitaire des produits alimentaires.  \nART.4.-L'agrément objet du présent arrêté peut être retiré en cas d'infraction dûment constatée aux dispositions du dahir n°1-69-169 susvisé ou des textes pris pour son application.  \naRt.5.Le présent arrêté sera publié au Bulletin officiel  \n. Rabat, le 16 rabii I 1447 (9 septembre 2025).  \nahMeD el bOUaRI."", ""## ARRÊTE :  \nARTICLE PREMIER.-La société «DOLOMIT FRUITS AND  PLANTES»  dont  le  siège  social  sis  Lot  n°106, appartement 2, rue Lmaarka, Zitoune, Meknès, est agréée pour commercialiser des plants certifiés de vigne, des rosacées à pépins, des semences et plants certifiés des rosacées à noyau et des plants certifiés des espèces à fruits rouges.  \nART.2.-La durée de validité de cet agrément est de cinq (5) ans, à compter de la date de publication du présent arrêté au «Bulletin officiel».  \nIl peut être renouvelé pour la même durée à condition que la demande de renouvellement soit formulée six (6) mois, au moins, avant l'expiration de sa validité.  \nART.3.-La déclaration prévue à l'article 2 de chacun des arrêtés susvisés n os 2100-03, 2157-11, 2109-17 et 1437-22 doit être faite par la société «DOLOMIT FRUITS AND PLANTES» à l'Office national de sécurité sanitaire des produits alimentaires, comme suit:  \n-  en avril et septembre de chaque annéepour les achats, les  ventes et les stocks des plants de vigne et des rosacées à pépins;\n-  en novembre et mai de chaque année les stocks des plants des espèces à fruits rouges;\n-  au moins une fois par an au plus tard le 31 décembre, la  situation de leurs stocks de semences et plants certifiésdes rosacées à noyau.  \nART.4.-L'agrément objet du présent arrêté peut être retiré en cas d'infraction dûment constatée aux dispositions du dahir n°1-69-169 susvisé ou des textes pris pour son application.  \nART.5.-Le présent arrêté sera publié au Bulletin officiel  \n. Rabat, le 23 hija 1446 (20 juin 2025).  \nahMeD el bOUaRI.  \nLe texte en langue arabe a été publié dans l'édition générale du «Bulletin officiel » n° 7424 du 28 moharrem 1447 (24 juillet 2025).""]","1. Réponse directe à la question
La durée de validité de l'agrément de la société PALMA FLOR pour commercialiser des plants certifiés est de cinq (5) ans. La demande de renouvellement doit être formulée six (6) mois, au moins, avant l'expiration de sa durée de validité.

2. Sources citées
- Arrêté n°2140-22 du 18 chaoual 1446 (17 avril 2025), publié dans l'édition générale du «Bulletin officiel » n° 7408 du 1 er hija 1446 (29 mai 2025). Article 2.","La durée de validité de l'agrément de la société PALMA FLOR est de cinq (5) ans, à compter de la date de publication du présent arrêté (article 2). Il peut être renouvelé pour la même durée, à condition que la demande de renouvellement soit formulée six (6) mois au moins avant l'expiration de sa durée de validité.",0.9999999999833333,1.0,0.4,0.9701903737567475,gpt-4o-mini,bge-m3,qwen2.5:7b,False,False,False,0.5
"""Quelles sont les coordonnées d'implantation pour une ferme aquacole ? ""","[""| Limites externes d'implantation de la ferme aquacole :                                                                                                                                                                                                                                                                                                                                                                                                                | Bornes                                                                                                                                                                                                                                                                                                                                                                                                                                                                | Latitude                                                                                                                                                                                                                                                                                                                                                                                                                                                              | Longitude                                                                                                                                                                                                                                                                                                                                                                                                                                                             |"", ""| Limites externes d'implantation de la ferme aquacole :                                                                                                                                                                                                                                                                                                                                       | B4                                                                                                                                                                                                                                                                                                                                                                                           | 23°0'57.395'' N                                                                                                                                                                                                                                                                                                                                                                              | 16°10'32.853''W                                                                                                                                                                                                                                                                                                                                                                              |"", ""| Limites externes d'implantation de la ferme aquacole :                                                                                                                                                                                                                                                                                                                                                                                                                | B2                                                                                                                                                                                                                                                                                                                                                                                                                                                                    | 30° 33' 34.643''N                                                                                                                                                                                                                                                                                                                                                                                                                                                     | 9° 46' 52.817''W                                                                                                                                                                                                                                                                                                                                                                                                                                                      |"", ""| Limites externes d'implantation de la ferme aquacole :   |                                                                                                                                                                                                                  |                                                                                                                                                                                                                  |                                                                                                                                                                                                                  | 15°49'31.456''W                                                                                                                                                                                                  |\n| Limites externes d'implantation de la ferme aquacole :   |                                                                                                                                                                                                                  |                                                                                                                                                                                                                  |                                                                                                                                                                                                                  | 15°49'36.632''W                                                                                                                                                                                                  |\n| Limites externes d'implantation de la ferme aquacole :   |                                                                                                                                                                                                                  |                                                                                                                                                                                                                  |                                                                                                                                                                                                                  | 15°49'34.220''W                                                                                                                                                                                                  |"", ""| Limites externes d'implantation de la ferme aquacole :                                                                                                                                                                                                                                                                                                           |                                                                                                                                                                                                                                                                                                                                                                  |                                                                                                                                                                                                                                                                                                                                                                  |                                                                                                                                                                                                                                                                                                                                                                  |\n|                                                                                                                                                                                                                                                                                                                                                                  | Bornes Latitude Longitude B1 22°53'43.668'' N 16°25'2.610''W B2 22°53'28.474'' N 16°25'8.857''W B3 22°53'33.104'' N 16°25'21.977''W                                                                                                                                                                                                                              |                                                                                                                                                                                                                                                                                                                                                                  |                                                                                                                                                                                                                                                                                                                                                                  |"", ""| Limites externes d'implantation de la ferme aquacole :                                                                                                                                                                                                                                                                                                                                                                                                                | B1                                                                                                                                                                                                                                                                                                                                                                                                                                                                    | 30° 33' 23.504''N                                                                                                                                                                                                                                                                                                                                                                                                                                                     | 9° 46' 39.155''W                                                                                                                                                                                                                                                                                                                                                                                                                                                      |""]","1. Réponse directe à la question

Les coordonnées d'implantation pour certaines fermes aquacoles sont les suivantes :

- Société de Matériaux et équipements des Bateaux Sud Sarl (SMEB Sud) :
  - Latitude : 30° 33' 34.643''N
  - Longitude : 9° 46' 52.817''W

- Pescacis Sarl :
  - Bornes avec leurs coordonnées :
    - B1 : Latitude 22°53'43.668'' N, Longitude 16°25'2.610'' W
    - B2 : Latitude 22°53'28.474'' N, Longitude 16°25'8.857'' W
    - B3 : Latitude 22°53'33.104'' N, Longitude 16°25'21.977'' W

- Aquaculture des Mondes SNC :
  - Latitude : 23°0'57.395''N
  - Longitude : 16°10'32.853''W

Information non disponible pour les autres fermes aquacoles mentionnées dans les extraits fournis.

2. Sources citées

- Arrêté conjoint du ministre délégué auprès de la ministre de l'économie et des finances, chargé du budget et de la secrétaire d'Etat auprès du ministre de l'agriculture, de la pêche maritime, du développement rural et des eaux et forêts, chargée de la pêche maritime n°1279-25 du 16 kaada 1446 (14 mai 2025) pour le SMEB Sud Sarl.
- Arrêté conjoint du ministre délégué auprès de la ministre de l'économie et des finances, chargé du budget et de la secrétaire d'Etat auprès du ministre de l'agriculture, de la pêche maritime, du développement rural et des eaux et forêts, chargée de la pêche maritime n°694-25 du 11 ramadan 1446 (12 mars 2025) pour Simdak.
- Arrêté conjoint du ministre de l'agriculture, de la pêche maritime, du développement rural et des eaux et forêts et du ministre délégué auprès de la ministre de l'économie et des finances, chargé du budget n° 439-23 du 24 rejeb 1444 (15 février 2023) pour Pescacis Sarl.
- Arrêté conjoint du ministre de l'agriculture, de la pêche maritime, du développement rural et des eaux et forêts et du ministre délégué auprès de la ministre de l'économie et des finances, chargé du budget n° 443-23 du 24 rejeb 1444 (15 février 2023) pour Aquaculture des Mondes SNC.","Les coordonnées d'implantation pour une ferme aquacole ne sont pas précisées dans l'extrait fourni. Les limites externes d'implantation et les bornes sont mentionnées, mais les valeurs spécifiques de latitude et de longitude ne sont pas indiquées.",0.9999999999833333,0.0,0.75,0.8794774035082936,gpt-4o-mini,bge-m3,qwen2.5:7b,False,False,False,0.5
Quels sont les diplômes qui sont reconnus comme équivalents au diplôme de docteur en médecine selon l'arrêté du ministre de l'enseignement supérieur du 26 janvier 2023 ?,"[""## Arrêté du ministre de l'enseignement supérieur, de la recherche scientifique et de l'innovation n°200-23 du 4 rejeb 1444 (26  janvier  2023)  complétant  l'arrêté  n° 2963-97  du 2chaabane 1418 (3décembre 1997) fixant la liste des diplômes reconnus équivalents au diplôme de docteur en médecine.  \nle MINIStRe De l'eNSeIGNeMeNt SUP É RIeUR, De la ReCheRChe SCIeNtIFIQUe et De l'INNOVatION,  \nVu l'arrêté du ministre de l'enseignement supérieur, de  la  recherche  scientifique  et  de  la  culture  n° 2963-97  du 2 chaabane 1418 (3décembre 1997) fixant la liste des diplômes reconnus équivalents au diplôme de docteur en médecine, tel qu'il a été modifié et complété ;  \nVu le décret n°2-21-838 du 14 rabii I 1443 (21 octobre 2021) relatif aux attributions du ministre de l'enseignement supérieur, de la recherche scientifique et de l'innovation ;  \nAprès avis de la commission sectorielle des sciences de la santé, réunie en date du 21 décembre 2022 ;  \nAprès avis du conseil national de l'Ordre national des médecins,"", ""## Arrêté du ministre de l'enseignement supérieur, de la recherche scientifique et de l'innovation n°2308-23 du 26 safar 1445 (12 septembre 2023) complétant l'arrêté n°2963-97 du 2chaabane 1418 (3décembre 1997) fixant la liste des diplômes reconnus équivalents au diplôme de docteur en médecine.  \nle MINIStRe De l'eNSeIGNeMeNt SUP É RIeUR, De la ReCheRChe SCIeNtIFIQUe et De l'INNOVatION,  \nVu l'arrêté du ministre de l'enseignement supérieur, de  la  recherche  scientifique  et  de  la  culture  n° 2963-97  du 2 chaabane 1418 (3décembre 1997) fixant la liste des diplômes reconnus équivalents au diplôme de docteur en médecine, tel qu'il a été modifié et complété ;  \nVu le décret n°2-21-838 du 14 rabii I 1443 (21 octobre 2021) relatif aux attributions du ministre de l'enseignement supérieur, de la recherche scientifique et de l'innovation ;  \nAprès avis de la commission sectorielle des sciences de la santé, réunie en date du 11 juillet 2023 ;  \nAprès avis du conseil national de l'Ordre national des médecins,"", ""## Arrêté du ministre de l'enseignement supérieur, de la recherche scientifique et de l'innovation n°201-23 du 4 rejeb 1444 (26  janvier  2023)  complétant  l'arrêté  n° 2963-97  du 2chaabane 1418 (3décembre 1997) fixant la liste des diplômes reconnus équivalents au diplôme de docteur en médecine.  \nle MINIStRe De l'eNSeIGNeMeNt SUP É RIeUR, De la ReCheRChe SCIeNtIFIQUe et De l'INNOVatION,  \nVu l'arrêté du ministre de l'enseignement supérieur, de  la  recherche  scientifique  et  de  la  culture  n° 2963-97  du 2 chaabane 1418 (3décembre 1997) fixant la liste des diplômes reconnus équivalents au diplôme de docteur en médecine, tel qu'il a été modifié et complété ;  \nVu le décret n°2-21-838 du 14 rabii I 1443 (21 octobre 2021) relatif aux attributions du ministre de l'enseignement supérieur, de la recherche scientifique et de l'innovation ;  \nAprès avis de la commission sectorielle des sciences de la santé, réunie en date du 21 décembre 2022 ;  \nAprès avis du conseil national de l'Ordre national des médecins,"", ""## Arrêté du ministre de l'enseignement supérieur, de la recherche scientifique et de l'innovation n°207-23 du 4 rejeb 1444 (26  janvier  2023)  complétant  l'arrêté  n° 2963-97  du 2chaabane 1418 (3décembre 1997) fixant la liste des diplômes reconnus équivalents au diplôme de docteur en médecine.  \nle MINIStRe De l'eNSeIGNeMeNt SUP É RIeUR, De la ReCheRChe SCIeNtIFIQUe et De l'INNOVatION,  \nVu l'arrêté du ministre de l'enseignement supérieur, de  la  recherche  scientifique  et  de  la  culture  n° 2963-97  du 2 chaabane 1418 (3décembre 1997) fixant la liste des diplômes reconnus équivalents au diplôme de docteur en médecine, tel qu'il a été modifié et complété ;  \nVu le décret n°2-21-838 du 14 rabii I 1443 (21 octobre 2021) relatif aux attributions du ministre de l'enseignement supérieur, de la recherche scientifique et de l'innovation ;  \nAprès avis de la commission sectorielle des sciences de la santé, réunie en date du 21 décembre 2022 ;  \nAprès avis du conseil national de l'Ordre national des médecins,"", ""## Arrêté du ministre de l'enseignement supérieur, de la recherche scientifique et de l'innovation n°2303-23 du 26 safar 1445 (12 septembre 2023) complétant l'arrêté n°2963-97 du 2chaabane 1418 (3décembre 1997) fixant la liste des diplômes reconnus équivalents au diplôme de docteur en médecine.  \nle MINIStRe De l'eNSeIGNeMeNt SUP É RIeUR, De la ReCheRChe SCIeNtIFIQUe et De l'INNOVatION,  \nVu l'arrêté du ministre de l'enseignement supérieur, de  la  recherche  scientifique  et  de  la  culture  n° 2963-97  du 2 chaabane 1418 (3décembre 1997) fixant la liste des diplômes reconnus équivalents au diplôme de docteur en médecine, tel qu'il a été modifié et complété ;  \nVu le décret n°2-21-838 du 14 rabii I 1443 (21 octobre 2021) relatif aux attributions du ministre de l'enseignement supérieur, de la recherche scientifique et de l'innovation ;  \nAprès avis de la commission sectorielle des sciences de la santé, réunie en date du 11 juillet 2023 ;  \nAprès avis du conseil national de l'Ordre national des médecins,"", ""## Arrêté du ministre de l'enseignement supérieur, de la recherche scientifique et de l'innovation n°198-23 du 4 rejeb 1444 (26  janvier  2023)  complétant  l'arrêté  n° 2963-97  du 2chaabane 1418 (3décembre 1997) fixant la liste des diplômes reconnus équivalents au diplôme de docteur en médecine.  \nle MINIStRe De l'eNSeIGNeMeNt SUP É RIeUR, De la ReCheRChe SCIeNtIFIQUe et De l'INNOVatION,  \nVu l'arrêté du ministre de l'enseignement supérieur, de  la  recherche  scientifique  et  de  la  culture  n° 2963-97  du 2 chaabane 1418 (3décembre 1997) fixant la liste des diplômes reconnus équivalents au diplôme de docteur en médecine, tel qu'il a été modifié et complété ;  \nVu le décret n°2-21-838 du 14 rabii I 1443 (21 octobre 2021) relatif aux attributions du ministre de l'enseignement supérieur, de la recherche scientifique et de l'innovation ;  \nAprès avis de la commission sectorielle des sciences de la santé, réunie en date du 21 décembre 2022 ;  \nAprès avis du conseil national de l'Ordre national des médecins,""]","Information non disponible.

Les extraits fournis ne contiennent pas de liste détaillée des diplômes reconnus comme équivalents au diplôme de docteur en médecine pour la date spécifiée (26 janvier 2023). Les arrêtés mentionnent l'existence d'une telle liste mais ne la détaillent pas.","L'extrait ne fournit pas de détails sur la liste des diplômes reconnus comme équivalents au diplôme de docteur en médecine selon l'arrêté du ministre de l'enseignement supérieur du 26 janvier 2023. Il mentionne uniquement l'existence de cet arrêté, n° 194-23, mais ne précise pas les diplômes concernés.",0.0,0.5,0.8,0.0,gpt-4o-mini,bge-m3,qwen2.5:7b,False,False,False,0.5
Quels sont les diplômes qui sont reconnus comme équivalents au diplôme de docteur en médecine selon les arrêtés récents ?,"[""## Arrêté du ministre de l'enseignement supérieur, de la recherche scientifique  et  de  l'innovation  n° 2507-25  du  1 er joumada  I  1447 (24 octobre 2025) complétant l'arrêté n°2963-97 du 2chaabane 1418 (3décembre 1997) fixant la liste des diplômes reconnus équivalents au diplôme de docteur en médecine.  \nle MINIStRe De l'eNSeIGNeMeNt SUP É RIeUR, De la ReCheRChe SCIeNtIFIQUe et De l'INNOVatION,  \nVu l'arrêté du ministre de l'enseignement supérieur, de  la  recherche  scientifique  et  de  la  culture  n° 2963-97  du 2 chaabane 1418 (3décembre 1997) fixant la liste des diplômes reconnus équivalents au diplôme de docteur en médecine, tel qu'il a été modifié et complété ;  \nVu le décret n°2-24-991 du 24 rabii II 1446 (28 octobre 2024) relatif aux attributions du ministre de l'enseignement supérieur, de la recherche scientifique et de l'innovation ;  \nAprès avis de la commission sectorielle des sciences de la santé, réunie en date du 15 septembre 2025 ;  \nAprès avis du conseil national de l'Ordre national des médecins,"", ""## Arrêté du ministre de l'enseignement supérieur, de la recherche scientifique et de l'innovation n°2802-22 du 27 rabii I 1444 (24  octobre  2022)  complétant  l'arrêté  n° 2963-97  du 2chaabane 1418 (3décembre 1997) fixant la liste des diplômes reconnus équivalents au diplôme de docteur en médecine.  \nle MINIStRe De l'eNSeIGNeMeNt SUP É RIeUR, De la ReCheRChe SCIeNtIFIQUe et De l'INNOVatION,  \nVu l'arrêté du ministre de l'enseignement supérieur, de  la  recherche  scientifique  et  de  la  culture  n° 2963-97  du 2 chaabane 1418 (3décembre 1997) fixant la liste des diplômes reconnus équivalents au diplôme de docteur en médecine, tel qu'il a été complété ;  \nVu le décret n°2-21-838 du 14 rabii I 1443 (21 octobre 2021) relatif aux attributions du ministre de l'enseignement supérieur, de la recherche scientifique et de l'innovation ;  \nAprès avis de la commission sectorielle des sciences de la santé, réunie en date du 27 juillet 2022 ;  \nAprès avis du conseil national de l'Ordre national des médecins,"", ""## Arrêté du ministre de l'enseignement supérieur, de la recherche scientifique et de l'innovation n°2806-22 du 27 rabii I 1444 (24  octobre  2022)  complétant  l'arrêté  n° 2963-97  du 2chaabane 1418 (3décembre 1997) fixant la liste des diplômes reconnus équivalents au diplôme de docteur en médecine.  \nle MINIStRe De l'eNSeIGNeMeNt SUP É RIeUR, De la ReCheRChe SCIeNtIFIQUe et De l'INNOVatION,  \nVu l'arrêté du ministre de l'enseignement supérieur, de  la  recherche  scientifique  et  de  la  culture  n° 2963-97  du 2 chaabane 1418 (3décembre 1997) fixant la liste des diplômes reconnus équivalents au diplôme de docteur en médecine, tel qu'il a été complété ;  \nVu le décret n°2-21-838 du 14 rabii I 1443 (21 octobre 2021) relatif aux attributions du ministre de l'enseignement supérieur, de la recherche scientifique et de l'innovation ;  \nAprès avis de la commission sectorielle des sciences de la santé, réunie en date du 27 juillet 2022 ;  \nAprès avis du conseil national de l'Ordre national des médecins,"", ""## Arrêté du ministre de l'enseignement supérieur, de la recherche scientifique et de l'innovation n°201-23 du 4 rejeb 1444 (26  janvier  2023)  complétant  l'arrêté  n° 2963-97  du 2chaabane 1418 (3décembre 1997) fixant la liste des diplômes reconnus équivalents au diplôme de docteur en médecine.  \nle MINIStRe De l'eNSeIGNeMeNt SUP É RIeUR, De la ReCheRChe SCIeNtIFIQUe et De l'INNOVatION,  \nVu l'arrêté du ministre de l'enseignement supérieur, de  la  recherche  scientifique  et  de  la  culture  n° 2963-97  du 2 chaabane 1418 (3décembre 1997) fixant la liste des diplômes reconnus équivalents au diplôme de docteur en médecine, tel qu'il a été modifié et complété ;  \nVu le décret n°2-21-838 du 14 rabii I 1443 (21 octobre 2021) relatif aux attributions du ministre de l'enseignement supérieur, de la recherche scientifique et de l'innovation ;  \nAprès avis de la commission sectorielle des sciences de la santé, réunie en date du 21 décembre 2022 ;  \nAprès avis du conseil national de l'Ordre national des médecins,"", ""## Arrêté du ministre de l'enseignement supérieur, de la recherche scientifique et de l'innovation n°2330-23 du 29 safar 1445 (15 septembre 2023) complétant l'arrêté n°2963-97 du 2chaabane 1418 (3décembre 1997) fixant la liste des diplômes reconnus équivalents au diplôme de docteur en médecine.  \nle MINIStRe De l'eNSeIGNeMeNt SUP É RIeUR, De la ReCheRChe SCIeNtIFIQUe et De l'INNOVatION,  \nVu l'arrêté du ministre de l'enseignement supérieur, de  la  recherche  scientifique  et  de  la  culture  n° 2963-97  du 2 chaabane 1418 (3décembre 1997) fixant la liste des diplômes reconnus équivalents au diplôme de docteur en médecine, tel qu'il a été modifié et complété ;  \nVu le décret n°2-21-838 du 14 rabii I 1443 (21 octobre 2021) relatif aux attributions du ministre de l'enseignement supérieur, de la recherche scientifique et de l'innovation ;  \nAprès avis de la commission sectorielle des sciences de la santé, réunie en date du 11 juillet 2023 ;  \nAprès avis du conseil national de l'Ordre national des médecins,"", ""## Arrêté du ministre de l'enseignement supérieur, de la recherche scientifique et de l'innovation n°2335-23 du 29 safar 1445 (15 septembre 2023) complétant l'arrêté n°2963-97 du 2chaabane 1418 (3décembre 1997) fixant la liste des diplômes reconnus équivalents au diplôme de docteur en médecine.  \nle MINIStRe De l'eNSeIGNeMeNt SUP É RIeUR, De la ReCheRChe SCIeNtIFIQUe et De l'INNOVatION,  \nVu l'arrêté du ministre de l'enseignement supérieur, de  la  recherche  scientifique  et  de  la  culture  n° 2963-97  du 2 chaabane 1418 (3décembre 1997) fixant la liste des diplômes reconnus équivalents au diplôme de docteur en médecine, tel qu'il a été modifié et complété ;  \nVu le décret n°2-21-838 du 14 rabii I 1443 (21 octobre 2021) relatif aux attributions du ministre de l'enseignement supérieur, de la recherche scientifique et de l'innovation ;  \nAprès avis de la commission sectorielle des sciences de la santé, réunie en date du 11 juillet 2023 ;  \nAprès avis du conseil national de l'Ordre national des médecins,""]","1. Réponse directe à la question :
   Les arrêtés récents qui complètent l'arrêté initial fixant la liste des diplômes reconnus équivalents au diplôme de docteur en médecine sont les suivants :

   - Arrêté n°2507-25 du 1 er joumada I 1447 (24 octobre 2025)
   - Arrêtés n°2802-22 et n°2806-22, tous les deux du 27 rabii I 1444 (24 octobre 2022)
   - Arrêté n°201-23 du 4 rejeb 1444 (26 janvier 2023)
   - Arrêtés n°2330-23 et n°2335-23, tous les deux du 29 safar 1445 (15 septembre 2023)

Ces arrêtés ont été pris après avis de la commission sectorielle des sciences de la santé et du conseil national de l'Ordre national des médecins.

2. Sources citées :
   - Arrêté n°2507-25 du 1 er joumada I 1447 (24 octobre 2025)
   - Arrêtés n°2802-22 et n°2806-22, tous les deux du 27 rabii I 1444 (24 octobre 2022)
   - Arrêté n°201-23 du 4 rejeb 1444 (26 janvier 2023)
   - Arrêtés n°2330-23 et n°2335-23, tous les deux du 29 safar 1445 (15 septembre 2023)",L'extrait ne fournit pas la liste des diplômes reconnus comme équivalents au diplôme de docteur en médecine. Il fait seulement référence à l'arrêté et au décret qui régissent la reconnaissance de ces diplômes.,0.99999999998,1.0,1.0,0.8928211508778899,gpt-4o-mini,bge-m3,qwen2.5:7b,False,False,False,0.5
Est-ce que Wana Corporate a le droit de fixer librement les prix de ses services au Maroc ?,"[""###### 11.1  Liberté des prix et commercialisation  \n- 11.1.1  Conformément à la réglementation en vigueur au Maroc et sous réserve des exceptions visées aux articles 11.1.3 et 11.1.4 ci-dessous, Wana Corporate bénéficie des droits ciaprès:\n- la liberté de fixation des prix des services offerts à ses clients ;\n- la  liberté  du  système  global  de  tarification,  qui  peut  notamment  comprendre  des réductions en fonction du volume ;\n- la liberté de la politique de commercialisation.  \n- 11.1.2  Wana Corporate communique à l'ANRT les tarifs de détail qu'il établit trente (30) jours au moins avant la date à laquelle ces tarifs doivent entrer en vigueur.\n- 11.1.3  L'ANRT peut exiger de Wana Corporate qu'il modifie les tarifs qu'il envisage d'appliquer à  ses  services  s'il  apparaît  que  ces  changements  tarifaires  ne  respectent  pas, notamment, les règles d'une concurrence loyale, conformément à la réglementation en vigueur en la matière au Maroc.\n- 11.1.4  Dans le cadre de ses relations contractuelles avec d'éventuels sous-traitants, distributeurs,  revendeurs  ou  agents  commerciaux,  Wana  Corporate  doit  veiller  au respect des engagements de ces derniers au regard :\n- de l'égalité d'accès et de traitement des clients ;\n- de la structure tarifaire éditée par Wana Corporate;\n- du  respect  de  la  confidentialité  des  informations  détenues  sur  les  clients,  dans  le respect notamment des dispositions de la loi n°09-08 précitée et des textes pris pour son application.  \nEn tout état de cause, Wana Corporate conserve la responsabilité de la fourniture du service à ses clients."", ""###### 11.2  Principes de facturation  \n- 11.2.1  Sur le territoire marocain, le coût de la communication est totalement imputé au poste demandeur,  à  l'exception  des  offres  commerciales  prévoyant  que  le  coût  de  la communication soit également supporté par le destinataire ou qu'il  soit  intégralement payé par le destinataire.  \nEn dehors du territoire marocain, les principes de tarification prévus dans les accords auxquels le  Maroc  est  Partie  ou  conclus  par  Wana  Corporate  s'appliquent,  dans  le respect des règles de transparence vis-à-vis de l'abonné.  \n- 11.2.2  Wana Corporate est tenu de permettre à ses clients de pouvoir identifier sur la facture les  montants  taxés  pour  chaque  catégorie  de  tarifs  appliqués.  Il  fournit  une  facture détaill ée des services offerts à tout abonné du réseau qui lui en fait la demande.  \nLes  facturations  des  divers  services  fournis  aux  clients  sont  séparées  et  clairement identifiées.  \n- 11.2.3  L'ANRT peut, à tout moment, procéder à la vérification de tout ou partie des équipements et  systèmes  informatiques  de  facturation,  des  modes  opératoires,  des  fichiers  de données  et  des  documents  comptables  utilisés  dans  la  facturation  des  services  de t él écommunications."", ""###### 11.3  Publicité des tarifs  \nWana Corporate a l'obligation  d'informer  le  public  de  ses  tarifs  et  de  ses  conditions  gén érales d'offres de services dans le respect de la réglementation en vigueur au Maroc.  \nWana  Corporate  est  tenu  de  publier  les  tarifs  de  fourniture  de  chaque  catégorie  de service,  de  connexion, de  maintien,  d'adaptation  ou  de  réparation  de tout équipement terminal commercialisé par lui-même et connecté à  son réseau.  \nLa notice portant publicité des tarifs se fera dans les conditions suivantes :  \n- Un exemplaire de la notice est transmis à l'ANRT au moins trente (30) jours avant l'entrée  en  vigueur  de  tout  changement  envisagé.  L'ANRT  peut  exiger  de  Wana Corporate d'apporter des modifications aux tarifs de ses services ou des conditions de  vente,  s'il  apparaît  que  ces  changements  ne  respectent  pas  les  règles  de concurrence loyale. Ils doivent être justifiés à la demande de l'ANRT au regard des él é ments de coût y afférents.  \nPage 13 sur 21  \n- Un exemplaire de la notice définitive, librement consultable, est mis à la disposition du public dans chaque agence commerciale ou point de vente d'un sous-traitant chargé de la commercialisation des services en question.\n- Un  exemplaire  de  la  notice  définitive  ou  les  extraits  appropriés  sont  remis à  toute personne qui en fait la demande.\n- Chaque fois qu'il y a modification des tarifs, les nouveaux tarifs et la date de leur entrée en vigueur sont clairement indiqués."", ""###### 2.16  Zone de couverture  \nL'ensemble des localités ou axes routiers ou ferroviaires du Royaume du Maroc où Wana Corporate s'engage à offrir, par le biais d'infrastructures terrestres, les services objet du présent cahier des charges, et ce, conformément à la licence qui lui est attribuée."", ""###### 9.4.5 Interconnexion  \nEn  application  de  l'article  11  de  la  loi  n°24-96  précitée  et  des  textes  pris  pour  son application, Wana Corporate bénéficie du droit d'interconnecter son réseau à ceux des autres exploitants marocains titulaires de licences d'établissement et d'exploitation de réseaux publics de tél écommunications au Royaume du Maroc.  \nWana Corporate fournit les prestations d'interconnexion dans les conditions prévues par la l égislation et la réglementation en vigueur.  \nLes conditions techniques, financières et administratives sont fixées dans des contrats librement négociés entre les exploitants de réseaux publics de tél écommunications dans le respect de leurs cahiers des charges respectifs.  \nLes demandes et les contrats d'interconnexion ainsi que les litiges y relatifs sont traités conformément à la législation et la réglementation en vigueur."", '###### 7.2 Concurrence loyale  \nWana Corporate est obligé par les dispositions législatives et réglementaires relatives à la concurrence en vigueur au Maroc.']","1. Réponse directe à la question : Oui, Wana Corporate a le droit de fixer librement les prix de ses services au Maroc sous réserve des exceptions prévues par la réglementation en vigueur.

2. Sources citées :
- Décret n°2-25-878 du 7 joumada I 1447 (30 octobre 2025), articles 11.1 et 11.1.3 du Cahier des charges.

Ces articles précisent que Wana Corporate bénéficie de la liberté de fixation des prix des services offerts à ses clients, sauf si les changements tarifaires ne respectent pas les règles d'une concurrence loyale.","Oui, Wana Corporate a le droit de fixer librement les prix de ses services au Maroc, conformément à l'article 11.1.1. Toutefois, cela est sous réserve des exceptions visées aux articles 11.1.3 et 11.1.4.",0.94999999997625,1.0,0.8,0.9846871493876365,gpt-4o-mini,bge-m3,qwen2.5:7b,False,False,False,0.5
Quelle société a reçu l'autorisation de vendre des plants certifiés d' différentes espèces de plantes selon l'arrêté du 18 avril 2025 ?,"[""## Arrêté  du  ministre  de  l'agriculture,  de  la  pêche  \nmaritime,  du  développement  rural  et  des  \neaux et forêts n° 2188-25 du 16 rabii I 1447  \n(9 septembre 2025) portant agrément de la société  \n« SMART AGRICULTURE LEADER » pour  \ncommercialiser des plants certifiés de vigne, de  \nfiguier,  de  figuier  de  barbarie,  de  grenadier,  \ndes rosacées à pépins et des semences et plants  \ncertifiés des rosacées à noyau et d'agrumes et  \ndes plants certifiés des espèces à fruits rouges.  \n2535  \n## Arrêté  du  ministre  de  l'agriculture,  de  la  pêche  \nmaritime,  du  développement  rural  et  des  \neaux et forêts n° 2189-25 du 16 rabii I 1447  \n(9  septembre 2025) portant agrément de la  \nsociété  « VILMORIN-MIKADO ATLAS »  \npour commercialiser des semences certifiées  \ndu maïs et des semences standard de légumes.  \n2536  \n## Arrêté  du  ministre  de  l'agriculture,  de  la  pêche  \nmaritime,  du  développement  rural  et  des  \neaux et forêts n° 2190-25 du 16 rabii I 1447  \n(9 septembre 2025) portant agrément de la société  \n« BEJO MAGHREB » pour commercialiser des  \nsemences standard de légumes.  ......................  \n2537  \nCréation et exploitation de fermes aquacoles."", ""## Arrêté du ministre de l'agriculture, de la pêche maritime, du développement rural et des eaux et forêts n°1660-25 du 29 hija 1446 (26 juin 2025) portant agrément de la société « APHYSEM» pour commercialiser des plants certifiés d'olivier, de vigne, des rosacées à pépins, des semences et plants certifiés des rosacées à noyau et d'agrumes.  \nle  MINIStRe  De  l'aGRICUltURe,  De  la  P Ê Che MaRItIMe, DU DÉVelOPPeMeNt RURal et DeS eaUX et FOR Ê tS,  \nVu le dahir n°1-69-169 du 10 joumada I 1389 (25 juillet 1969) réglementant  la  production  et  la  commercialisation  de semences et de plants, tel qu'il a été modifié, notamment ses articles premier, 2 et 5 ;  \nVu la loi n° 25-08 portant création de l'Office national de sécurité sanitaire  des produits alimentaires promulguée par le dahir n°1-09-20 du 22 safar 1430 (18 février 2009), notamment son article 2 ;  \nVu  l'arrêté  du  ministre  de  l'agriculture  et  du développement rural n°2098-03 du 8 chaoual 1424 (3 décembre 2003) portant homologation du règlement technique relatif à la production, au contrôle, au conditionnement et à la certification des semences et des plants d'agrumes ;  \nVu l'arrêté du ministre de l'agriculture et du développement rural n°2100-03 du 8 chaoual 1424 (3 décembre 2003)  portant homologation du règlement technique relatif à la production, au contrôle et à la certification des plants de vigne ;  \nVu l'arrêté du ministre de l'agriculture, du développement rural et des pêches maritimes n° 2110-05 du 21 ramadan 1426 (25  octobre  2005)  portant  homologation  du  règlement technique relatif à la production, au contrôle et à la certification des plants d'olivier ;  \nVu l'arrêté  du  ministre de l'agriculture et de la pêche maritime n°2157-11 du 16 chaabane 1432 (18 juillet 2011) portant homologation du règlement technique relatif à la production, au contrôle, au conditionnement et à la certification des plants des rosacées à pépins ;  \nVu l'arrêté du ministre de l'agriculture, de la pêche maritime, du développement rural et des eaux et forêts n°1437-22 du 25 chaoual 1443 (26 mai 2022) portant homologation du règlement technique relatif à la production, au contrôle, au conditionnement et à la certification des semences et plants des rosacées à noyau ;  \nVu l'arrêté du ministre  de  l'agriculture et  de la  réforme agraire  n°966-93 du 28 chaoual 1413 (20 avril 1993) fixant les conditions d'importation et de commercialisation des semences à cultiver au Maroc, tel qu'il a été modifié et complété,"", ""## Arrêté du ministre de l'agriculture, de la pêche maritime, du développement rural et des eaux et forêts n°1002-25 du 18chaoual 1446 (17 avril 2025) portant agrément de la société «ZIAGRO» pour commercialiser des plants certifiés d'olivier, de vigne, de figuier, de grenadier, des rosacées à pépins, des semences et plants certifiés des rosacées à noyau et des plants certifiés des espèces à fruits rouges.  \nle  MINIStRe  De  l'aGRICUltURe,  De  la  P Ê Che MaRItIMe, DU DÉVelOPPeMeNt RURal et DeS eaUX et FOR Ê tS,  \nVu le dahir n°1-69-169 du 10 joumada I 1389 (25 juillet 1969) réglementant  la  production  et  la  commercialisation  de semences et de plants, tel qu'il a été modifié, notamment ses articles premier, 2 et 5 ;  \nVu la loi n°25-08 portant création de l'Office national de sécurité sanitaire des produits alimentaires, promulguée par le dahir n°1-09-20 du 22 safar 1430 (18 février 2009), notamment son article 2 ;  \nVu l'arrêté du ministre de l'agriculture et du développement rural n°2100-03 du 8 chaoual 1424 (3 décembre 2003) portant homologation du règlement technique relatif à la production, au contrôle et à la certification des plants de vigne ;  \nVu l'arrêté du ministre de l'agriculture, du développement rural et des pêches maritimes n°2110-05 du 21 ramadan 1426 (25 octobre  2005)  portant  homologation  du  règlement technique relatif à la production, au contrôle et à la certification des plants d'olivier ;  \nVu l'arrêté  du  ministre de l'agriculture et de la pêche maritime n°2157-11 du 16 chaabane 1432 (18 juillet 2011) portant homologation du règlement technique relatif à la production, au contrôle, au conditionnement et à la certification des plants des rosacées à pépins ;  \nVu l'arrêté du ministre de l'agriculture et de la pêche maritime n°3548-13 du 27 safar 1435 (31 décembre 2013) portant homologation du règlement technique relatif à la production, au contrôle, au conditionnement et à la certification des plants de figuier ;  \nVu l'arrêté  du ministre de l'agriculture et de la pêche maritime n°784-16 du 29 kaada 1437 (2 septembre 2016) portant homologation du règlement technique relatif à la production, au contrôle, au conditionnement et à la certification des plants de grenadier ;  \nVu l'arrêté du ministre de l'agriculture, de la pêche maritime, du développement rural et des eaux et forêts n°2109-17 du 25 kaada 1438 (18 août 2017) portant homologation du règlement technique relatif à la production, au contrôle, au conditionnement et à la certification des plants des espèces à  fruits  rouges  (fraisier,  framboisier,  myrtillier,  murier, groseillier et cassissier) ;  \nVu l'arrêté du ministre de l'agriculture, de la pêche maritime, du développement rural et des eaux et forêts n° 1437-22 du 25 chaoual 1443 (26 mai 2022) portant homologation du règlement technique relatif à la production, au contrôle, au conditionnement et à la certification des semences et plants des rosacées à noyau ;"", ""## Arrêté  du  ministre  de  l'agriculture,  de  la  pêche  \nmaritime,  du  développement  rural  et  des  \neaux et forêts n° 2182-25 du 16 rabii I 1447  \n(9  septembre 2025) portant agrément de la  \nsociété « MAROSEM » pour commercialiser  \ndes semences certifiées des céréales à pailles,  \ndu maïs, des légumineuses alimentaires, des  \nlégumineuses fourragères, des oléagineuses,  \nde betteraves industrielles et fourragères, des  \nsemences standard de légumes et des plants  \ncertifiés de pomme de terre.   ............................  \n2531  \n## Arrêté  du  ministre  de  l'agriculture,  de  la  pêche  \nmaritime,  du  développement  rural  et  des  \neaux et forêts n° 2183-25 du 16 rabii I 1447  \n(9  septembre 2025) portant agrément de la  \nsociété « BENAPRIM » pour commercialiser  \ndes plants certifiés de pomme de terre.  ...........  \n2532  \nISSN 0851 - 1217  \nPages  \nPages  \n## Arrêté  du  ministre  de  l'agriculture,  de  la  pêche  \nmaritime,  du  développement  rural  et  des  \neaux et forêts n° 2184-25 du 16 rabii I 1447  \n(9  septembre 2025) portant agrément de la  \nsociété  « RIJK  ZWAAN  MAROC »  pour  \ncommercialiser  des  semences  standard  de  \nlégumes.  ........................................................  \n2533  \n## Arrêté  du  ministre  de  l'agriculture,  de  la  pêche  \nmaritime,  du  développement  rural  et  des  \neaux et forêts n° 2185-25 du 16 rabii I 1447  \n(9  septembre  2025)  portant  agrément  de  \nla  société  « MAGHREB  PALM »  pour  \ncommercialiser des plants certifiés du palmier  \ndattier, d'arganier, de figuier de barbarie, des  \nsemences  et  plants  certifiés  des  rosacées  à  \nnoyau et des plants certifiés des espèces à fruits  \nrouges.   ...........................................................  \n2533  \n## Arrêté  du  ministre  de  l'agriculture,  de  la  pêche  \nmaritime,  du  développement  rural  et  des  \neaux et forêts n° 2186-25 du 16 rabii I 1447  \n(9  septembre 2025) portant agrément de la  \nsociété « FELGAR » pour commercialiser des  \nplants certifiés des espèces à fruits rouges.   ......  \n2534  \n## Arrêté  du  ministre  de  l'agriculture,  de  la  pêche  \nmaritime,  du  développement  rural  et  des  \neaux et forêts n° 2187-25 du 16 rabii I 1447  \n(9  septembre 2025) portant agrément de la  \nsociété « LUNA FRESH » pour commercialiser  \ndes semences certifiées du maïs, des semences  \nstandard de légumes et des plants certifiés de  \npomme de terre.  .............................................  \n2535  \n## Arrêté  du  ministre  de  l'agriculture,  de  la  pêche  \nmaritime,  du  développement  rural  et  des  \neaux et forêts n° 2188-25 du 16 rabii I 1447  \n(9 septembre 2025) portant agrément de la société  \n« SMART AGRICULTURE LEADER » pour  \ncommercialiser des plants certifiés de vigne, de  \nfiguier,  de  figuier  de  barbarie,  de  grenadier,  \ndes rosacées à pépins et des semences et plants  \ncertifiés des rosacées à noyau et d'agrumes et  \ndes plants certifiés des espèces à fruits rouges."", ""## Arrêté du ministre de l'agriculture, de la pêche maritime, du développement rural et des eaux et forêts n°1007-25 du 18chaoual 1446 (17 avril 2025) portant agrément de la société «PALMA FLOR» pour commercialiser des plants certifiés d'olivier, de vigne, de figuier, de figuier de barbarie, d'arganier, de caroubier et des semences et plants certifiés des rosacées à noyau et d'agrumes.  \nle  MINIStRe  De  l'aGRICUltURe,  De  la  P Ê Che MaRItIMe, DU DÉVelOPPeMeNt RURal et DeS eaUX et FOR Ê tS,  \nVu le dahir n°1-69-169 du 10 joumada I 1389 (25 juillet 1969) réglementant  la  production  et  la  commercialisation  de semences et de plants, tel qu'il a été modifié, notamment ses articles premier, 2 et 5 ;  \nVu la loi n°25-08 portant création de l'Office national de sécurité sanitaire des produits alimentaires, promulguée par le dahir n°1-09-20 du 22 safar 1430 (18 février 2009), notamment son article 2 ;  \nVu  l'arrêté  du  ministre  de  l'agriculture  et  du développement rural n° 2098-03 du 8 chaoual 1424 (3 décembre 2003) portant homologation du règlement technique relatif à la production, au contrôle, au conditionnement et à la certification des semences et des plants d'agrumes ;  \nVu l'arrêté du ministre de l'agriculture et du développement rural n°2100-03 du 8 chaoual 1424 (3 décembre 2003) portant homologation du règlement technique relatif à la production, au contrôle et à la certification des plants de vigne ;  \nVu l'arrêté du ministre de l'agriculture, du développement rural et des pêches maritimes n°2110-05 du 21 ramadan 1426 (25 octobre  2005)  portant  homologation  du  règlement technique relatif à la production, au contrôle et à la certification des plants d'olivier ;  \nVu l'arrêté du ministre de l'agriculture et de la pêche maritime n°3548-13 du 27 safar 1435 (31 décembre 2013) portant homologation du règlement technique relatif à la production, au contrôle, au conditionnement et à la certification des plants de figuier ;  \nVu l'arrêté du ministre de l'agriculture, de la pêche maritime, du développement rural et des eaux et forêts n°986-19 du 21 rejeb 1440 (28 mars 2019) portant homologation du règlement technique relatif à la production, au contrôle, au conditionnement et à la certification des plants de figuier de barbarie ;  \nVu l'arrêté du ministre de l'agriculture, de la pêche maritime, du développement rural et des eaux et forêts n° 1437-22 du 25 chaoual 1443 (26 mai 2022) portant homologation du règlement technique relatif à la production, au contrôle, au conditionnement et à la certification des semences et plants des rosacées à noyau ;  \nVu l'arrêté du ministre de l'agriculture, de la pêche maritime, du développement rural et des eaux et forêts n°2140-22 du 4 moharrem 1444 (2 août 2022) portant homologation du règlement technique relatif à la production, au contrôle, au conditionnement et à la certification des plants d'arganier ;"", ""## Arrêté du ministre de l'agriculture, de la pêche maritime, du développement rural et des eaux et forêts n°991-25 du 18 chaoual 1446 (17 avril 2025) portant agrément de la société «GLOBAL GREEN AGRICULTURE» pour commercialiser des plants certifiés d'olivier, de vigne, de figuier, de figuier de barbarie, de grenadier, d'arganier, des rosacées à pépins, des semences et plants certifiés des rosacées à noyau et d'agrumes et des plants certifiés des espèces à fruits rouges.  \nle  MINIStRe  De  l'aGRICUltURe,  De  la  P Ê Che MaRItIMe, DU DÉVelOPPeMeNt RURal et DeS eaUX et FOR Ê tS,  \nVu le dahir n°1-69-169 du 10 joumada I 1389 (25 juillet 1969) réglementant  la  production  et  la  commercialisation  de semences et de plants, tel qu'il a été modifié, notamment ses articles premier, 2 et 5 ;  \nVu la loi n°25-08 portant création de l'Office national de sécurité sanitaire des produits alimentaires, promulguée par le dahir n°1-09-20 du 22 safar 1430 (18 février 2009), notamment son article 2 ;  \nVu  l'arrêté  du  ministre  de  l'agriculture  et  du développement rural n°2098-03 du 8 chaoual 1424 (3 décembre 2003) portant homologation du règlement technique relatif à la production, au contrôle, au conditionnement et à la certification des semences et des plants d'agrumes ;  \nVu  l'arrêté  du  ministre  de  l'agriculture  et  du développement rural n°2100-03 du 8 chaoual 1424 (3 décembre 2003) portant homologation du règlement technique relatif à la production, au contrôle et à la certification des plants de vigne ;  \nVu l'arrêté du ministre de l'agriculture, du développement rural et des pêches maritimes n° 2110-05 du 21 ramadan 1426 (25 octobre  2005)  portant  homologation  du  règlement technique relatif à la production, au contrôle et à la certification des plants d'olivier ;  \nVu l'arrêté du ministre de l'agriculture et de la pêche maritime n°2157-11 du 16 chaabane 1432 (18 juillet 2011) portant homologation du règlement technique relatif à la production, au contrôle, au conditionnement et à la certification des plants des rosacées à pépins ;  \nVu l'arrêté du ministre de l'agriculture et de la pêche maritime n°3548-13 du 27 safar 1435 (31 décembre 2013) portant homologation du règlement technique relatif à la production, au contrôle, au conditionnement et à la certification des plants de figuier ;  \nVu l'arrêté du ministre de l'agriculture et de la pêche maritime n°784-16 du 29 kaada 1437 (2 septembre 2016) portant homologation du règlement technique relatif à la production, au contrôle, au conditionnement et à la certification des plants de grenadier ;  \nVu l'arrêté du ministre de l'agriculture, de la pêche maritime, du développement rural et des eaux et forêts n°2109-17 du 25 kaada 1438 (18 août 2017) portant homologation du règlement technique relatif à la production, au contrôle, au conditionnement et à la certification des plants des espèces à  fruits  rouges  (fraisier,  framboisier,  myrtillier,  murier, groseillier et cassissier) ;""]","1. Réponse directe à la question
   - La société «GLOBAL GREEN AGRICULTURE» a reçu l'autorisation de vendre des plants certifiés d'olivier, de vigne, de figuier, de figuier de barbarie, de grenadier, d'arganier, des rosacées à pépins, des semences et plants certifiés des rosacées à noyau et d'agrumes ainsi que des plants certifiés des espèces à fruits rouges.

2. Sources citées
   - Arrêté du ministre de l'agriculture, de la pêche maritime, du développement rural et des eaux et forêts n°991-25 du 18 chaoual 1446 (17 avril 2025) portant agrément de la société «GLOBAL GREEN AGRICULTURE».","La société « SARILOP » a reçu l'agrément pour commercialiser des plants certifiés d'olivier, de vigne, de figuier, de figuier de barbarie, de grenadier, d'arganier, de caroubier, des rosacées à pépins, des semences et plants certifiés des rosacées à noyau et des plants certifiés des espèces à fruits rouges selon l'arrêté du ministre de l'agriculture n°1004-25 du 18 chaoual 1446 (17 avril 2025).",0.0,0.0,1.0,0.8398024458834861,gpt-4o-mini,bge-m3,qwen2.5:7b,False,False,False,0.5
Combien rapporte la taxe sur les produits énergétiques en importation ?,"[""| --- Gaz naturel .................................. --- Autres .......................................... -- Al'état gazeux : --- Gaz naturel .................................. --- Autres .......................................... - Supercarburant du 27-07 NGP | 100 kgs -id- 1000m 3                                                                    | 0,00 4,60                                                       |\n| ..........................................................                                                                                                                                                                                                          |                                                                                         | 0,00                                                            |\n|                                                                                                                                                                                                                                                                     | -id- ..................... .....................                                        | 2,00 ............... ...............                            |  \n«F-  \n......................................................................................  \n«...........................................................................................................  \n- «H-Taxes intérieures de consommation applicables aux «liquides pour charger ou recharger les appareils électroniques «dits «cigarettes électroniques» et appareils similaires, ainsi «que les produits connexes de tabac pour pipe à eau (muassel «sans tabac) :  \n| DESIGNATION DES PRODUITS                                                                                                                                                                                                                                   | UNITE DE PERCEPTION                       | QUOTITE (DH)                      |\n|------------------------------------------------------------------------------------------------------------------------------------------------------------------------------------------------------------------------------------------------------------|-------------------------------------------|-----------------------------------|\n| I - Liquides pourcharger ourecharger les appareils électroniques dits « cigarettes électroniques » et appareils similaires : a - .......................................................... b - .......................................................... | .................... .................... | ................ ................ |"", ""|            |           | 26                  | Taxes sur les chapes en caoutchouc, bandages, chambres à air et pneumatiques | Mémoire                                    |\n|            |           | 27                  | Taxe sur les produits énergétiques                                           | 16 737 023 000                             |\n|            |           | 28                  | Taxe sur les tabacs manufacturés                                             | 12 500 020 000                             |\n|            |           | 30                  | Taxe sur la valeur ajoutée                                                   |                                            |\n|            |           | 31                  | Taxe sur la valeur ajoutée à l'importation                                   | 57 505 709 000                             |\n|            |           | 32                  | Taxe sur la valeur ajoutée à l'intérieur                                     | 10 691 000                                 |\n|            |           | 40                  | Produits des confiscations                                                   | 56 400 000                                 |  \n4  \n| Chapitre   | Service   | Nature de Recette   | DESIGNATION DES RECETTES                                                                                                                              | Evaluations pour l'année budgétaire 2024   |\n|------------|-----------|---------------------|-------------------------------------------------------------------------------------------------------------------------------------------------------|--------------------------------------------|\n|            | 8400      | 50                  | Taxe d'inspection                                                                                                                                     |                                            |\n|            |           | 51                  | Taxe d'inspection sanitaire des plantes, parties de plantes et des produits végétaux à l'importation et à l'exportation                               | Mémoire                                    |\n|            |           | 52                  | Taxe d'inspection sanitaire à l'importation et à l'exportation d'animaux et de produits animaux                                                       | Mémoire                                    |\n|            |           | 60                  | Majorations sur les obligations cautionnées et intérêts de retard                                                                                     | 18 400 000                                 |\n|            |           | 70                  | Produits des services rendus au titre de l'utilisation par les usagers des systèmes informatiques de l'Administration des Douanes et Impôts indirects | 122 100 000                                |"", ""###### Article 4  \n- I.  -  A  compter du 1 er janvier 2024, la quotité de 40% du tarif des droits d'importation fixé par l'article 4 §I de la loi de finances n° 25-00 pour la période du 1 er  juillet au 31 décembre 2000, promulguée  par  le  dahir  n°  1-00-241  du  25  rabii  I  1421 (28 juin 2000), tel qu'il a été modifié et complété, est ramenée à 30%.  \nLa quotité de 30% ne s'applique pas aux produits relevant du chapitre 24 du tarif des droits d'importation et aux produits qui étaient soumis au droit d'importation au taux de 40%, avant l'entrée en vigueur de la loi de finances rectificative n° 35-20 pour l'année budgétaire 2020.  \n- II. - A compter du 1 er  janvier 2024, le tarif des droits d'importation fixé par l'article 4§I de la loi de finances n°25-00 pour la période du 1 er  juillet au 31 décembre 2000, précitée, est modifié comme suit:  \n<!-- image -->  \n| Codification   | Codification   | Codification    | Codification   | Codification   | Désignation des Produits                                                                                                                                                                                                                                                                                                                                                                                                                                                                                                                                                                                                                                                                                                                                                               | Droit d'importation   | Unité de Quantité Normalisée   | Unités Complémentaires   |\n|----------------|----------------|-----------------|----------------|----------------|----------------------------------------------------------------------------------------------------------------------------------------------------------------------------------------------------------------------------------------------------------------------------------------------------------------------------------------------------------------------------------------------------------------------------------------------------------------------------------------------------------------------------------------------------------------------------------------------------------------------------------------------------------------------------------------------------------------------------------------------------------------------------------------|-----------------------|--------------------------------|--------------------------|"", '|                 |       | 90    | - - - papier duplex…………………………………………………………………………………….. - - - autres………………………………………………………………………………………………..                                                                                                                                                                                                                 | 17,5    | kg    | -   |\n| 4810.99         | 00    | 00    | ……………………………………………………………………………………………………………………… ……………………………………………………………………………………………………………………..                                                                                                                                                                                                                             |         |       |     |  \n21  \n<!-- image -->  \nTaxes intérieures de consommation', ""###### Article 5  \n- I. -A compter du 1 er  janvier 2023, les dispositions des articles premier, 9 et 10 du dahir portant loi n°1-77-340 du 25 chaoual 1397 (9 octobre 1977) déterminant les quotités applicables aux marchandises et ouvrages soumis à taxes intérieures  de  consommation  ainsi  que  les  dispositions spécifiques à ces marchandises et ouvrages, tel qu'il a été modifié et complété, sont modifiées ou complétées comme suit: «9 - les liquides pour charger ou recharger les appareils «électroniques dits «cigarettes  électroniques» et «appareils similaires, ainsi que les produits connexes «de tabac pour pipe à eau (muassel sans tabac) ; Taxes intérieures de consommation Article 5 I- A  compter  du  1 er janvier 2023 ,  les  dispositions des articles  premier,  9 et  10 du  dahir portant  loi  n°  1-77-340  du  25  chaoual  1397  (9  octobre  1977)  déterminant  les  quotités applicables aux marchandises et ouvrages soumis à taxes intérieures de consommation ainsi que les dispositions spécifiques à ces marchandises et ouvrages,  \n« Article premier .-L 'administration ………………………. complété, sont modifiées ou complétées comme suit :  \n«dans le territoire assujetti :  \n- «1 - les limonades, ...................................................................  \n«.............................................................................................................  \n- «8 - les tabacs manufacturés;  \n«....................................................................................................  \n«.............................................................................................................  \n- «13 - les batteries pour véhicules ;  \n- «14 - les produits contenant du sucre.»  \n48.11  \nPapiers,  cartons,  ouate  de  cellulose  et  nappes  de  fibres  de  cellulose,  \ncouchés,  enduits,  imprégnés,  recouverts,  coloriés  en  surface,  décorés  en  \nsurface  ou  imprimés,  en  rouleaux  ou  en  feuilles,  de  forme  carrée  ou  \nrectangulaire,  de  tout  format,  autres  que  les  produits  des  types  décrits  \ndans les libellés des n°s 48.03, 48.09 ou 48.10.  \n.......................................................................................................................  \n4811.59  \n00  \n- - Autres  \n.........................................................................................................................  \n5  \n70  \n.........................................................................................................................  \n5  \n80  \n-  -  -  -  papiers  imprégnés  de  résines  acryliques  ou  phénoliques  d'une  \népaisseur  ne  dépassant  pas  1mm,  présentés  en  bobines  d'un  diamètre  \ncompris entre 370 et 1100 mm et d'une hauteur comprise entre 100 et 1100  \nmm………………………………………………………………………………………………………………..  \n2,5  \nkg  \n-  \n5  \n99  \n- - - - autres, y compris le calque imprégné…………………………………………………  \n17,5  \nkg  \n-  \n4811.60"", ""| I - Liquides pourcharger ourecharger les appareils électroniques dits « cigarettes électroniques » et appareils similaires : a - .......................................................... b - .......................................................... | .................... .................... | ................ ................ |\n| II - Produits connexes de tabac pour pipe à eau (Muassel sans tabac)                                                                                                                                                                                       | 1kilogramme                               | 675                               |  \n«..................................................................................................  \n«K-.........................................................................................  \n- «L-Taxes intérieures de consommation applicables «sur les produits contenant du sucre :  \n| DÉSIGNATION DES PRODUITS                                                                                                                                                                  | TENEUR EN SUCRE AJOUTÉ EN g/100g ou g/100ml   | UNITÉ DE PERCEPTION   | QUOTITÉ (EN DH)   |\n|-------------------------------------------------------------------------------------------------------------------------------------------------------------------------------------------|-----------------------------------------------|-----------------------|-------------------|\n| 1- Biscuits ........................... 2- Confiserie ....................... 3- Chocolaterie : - - Barres chocolatées, chocolat en tablettes et en poudre - - Autres (chocolat fourré et | Plus de 50 Plus de 70 Plus de 50              | 100Kgs -id- 100Kgs    | 70 300 200        |  \n«  \nArticle. 10.  \n- La mise à la consommation des boissons,  \n« boissons  à  base  d'alcool  et  des  tabacs  manufacturés, «repris aux tableaux A, G et L-6 de l'article 9 ci-dessus, «……………………………………. ou de tout autre procédé en «tenant lieu.»  \n- II.  - Est  abrogé,  à  compter  du  1 er   janvier  2023, le  b)  du  1  du  tableau  A  de  l'article  9  du  dahir  portant loi n° 1-77-340 du 25 chaoual 1397 (9 octobre 1977) déterminant les quotités applicables aux marchandises et ouvrages soumis à taxes intérieures de consommation ainsi que les dispositions spécifiques à ces marchandises et ouvrages, tel qu'il a été modifié et complété.  \nCode général des impôts""]","1. Réponse directe à la question
Selon l'extrait du dahir n°1-23-91 du 30 joumada I 1445 (14 décembre 2023) portant promulgation de la loi de finances n°55-23 pour l'année budgétaire 2024, les taxes sur les produits énergétiques en importation rapportent 16 737 023 000 DH.

2. Sources citées
- [TEXTES GENERAUX > Dahir n°1-23-91 du 30 joumada I 1445 (14 décembre 2023) portant promulgation de la loi de finances n°55-23 pour l'année budgétaire 2024 > I. BUDGET GÉNÉRAL]","La taxe sur les produits énergétiques rapporte 16 857 162 000 dirhams en importation, selon l'article 27 de l'extrait fourni.",0.49999999995,0.0,0.3333333333333333,0.8737631999138301,gpt-4o-mini,bge-m3,qwen2.5:7b,False,False,False,0.5
"Quels sont les noms des substances actives mentionnées dans le Bulletin Officiel qui sont autorisées sous différentes formes, comme des solutions ou des comprimés ?","[""| - Brimonidine (Tartrate) (DCI)               | - Cisplatine (DCI)                                                     | - Enzalutamide (DCI)                                             |\n| - Brimonidine (Tartrate) // Timolol          | - Clonazepam (DCI)                                                     | - Epirubicine (Chlorhydrate) (DCI)                               |\n| Maleate (DCI)                                | - Clostridium Botulinum Type A (DCI)                                   | - Epoetine Alfa (DCI)                                            |\n| - Brinzolamide (DCI)                         | - Clozapine (DCI)                                                      | - Epoetine Beta (DCI)                                            |\n| - Brinzolamide // Timolol (Maleate) (DCI)    | - Complexe D'Hydroxide Ferrique Saccharose (DCI)                       | - Eptacog Alpha Activ (R F Vii) (DCI) - Eribyline Mesilate (DCI) |\n| - Bromure De Glycopyrronium (DCI)            | - Complexe D'Hydroxyde Ferrique                                        | - Erythropoetine (DCI)                                           |\n| - Budesonide // Formoterol Fumarate          | Saccharose (DCI)                                                       | - Ethinylestradiol Dienogest (DCI)                               |\n| Dihydrate (DCI)                              | - Complexe Fer-Sucrose (DCI)                                           | - Etomidate (DCI)                                                |\n| - Budesonide // Salmeterol (DCI)             | - Cromoglicate De Sodium (DCI)                                         | - Etonogestrel (DCI)                                             |\n| - Bupropion (Chlorhydrate) (DCI)             | - Cyclophosphamide (DCI)                                               | - Etoposide (DCI)                                                |\n| - Cabergoline (DCI)                          | - Cyproterone (Acetate) (DCI)                                          | - Exemestane (DCI)                                               |\n| - Calcipotriol // Betamethasone (DCI)        | - Cytarabine (DCI)                                                     | - Ezetimib (DCI)                                                 |\n| - Calcium (Glucoheptonate) // Calcium        | - Dabigatran (DCI)                                                     | - Facteur Ix De Coagulation Humaine                              |\n| (Gluconate) (DCI)                            | - Dabigatran Etexilate (Mesilate) (DCI)                                | (DCI)                                                            |\n| - Calcium / Fer (DCI)                        | - Darbepoeitin Alfa (DCI)                                              | - Facteur Viii De Coagulation (DCI)                              |"", '| - Beta Sitosterol (DCI)                      |                                                                        | - Dorzolamide                                                    |\n| - Betamethasone (Dipropionate) //            | Estradiol Micronise (DCI) - Chlorure De Sodium // Chlorure De          | (DCI) - Dorzolamide (Chlorhydrate) (DCI)                         |\n| Bethamethasone Phosphate Disodique (DCI)     | Potassium // Chlorure De Calcium                                       | - Dorzolamide (Chlorhydrate) //                                  |\n| - Betaxolol (DCI)                            | Dihydrate // Chlorure De Magnesium Hexahydrate // Acetate De Sodium // | Timolol (Maleate) (DCI)                                          |\n| - Biclothymol (DCI)                          | Acide L-Malique (DCI)                                                  | - Dorzolamide // Timolol (DCI)                                   |\n| - Bimatoprost (DCI)                          | - Chlorure De Sodium //                                                | - Drospirenone // Ethinylestradiol (DCI)                         |\n| - Bimatoprost // Timolol (DCI)               | Lactate De Sodium // Chlorure De Calcium //                            | - Duloxetine (Chlorhydrate) (DCI)                                |\n| - Bisoprolol (Hemifumarate) (DCI)            | Chlorure De Magnesium Hexahydrate                                      | - Dutasteride (DCI)                                              |\n| - Bisoprolol (Hemifumarate) //               | // Glucose Monohydrat (DCI)                                            | - Eletriptan (DCI)                                               |\n| Hydrochlorothiazide (DCI)                    | - Choriogonadotropine Alfa (DCI)                                       | - Eltrombopaq Olamine (DCI)                                      |\n| - Bicalutamide (DCI)                         | - Ciclosporine (DCI)                                                   | - Entacapone // Levodopa //                                      |\n| - Bisoprolol // Amlodipine (DCI)             | - Cinacalcet (DCI)                                                     | Carbidopa (DCI)                                                  |\n| - Bortezomib (DCI)                           | - Cisatracurium (Besilate) (DCI)                                       | - Entecavir (DCI)                                                |\n| - Brimonidine (Tartrate) (DCI)               | - Cisplatine (DCI)                                                     | - Enzalutamide (DCI)                                             |\n| - Brimonidine (Tartrate) // Timolol          | - Clonazepam (DCI)                                                     | - Epirubicine (Chlorhydrate) (DCI)                               |', '| Betamethasone                                                                                                                                                                       | DCI                                                                                                                                                                                 |\n| Methylprednisolone                                                                                                                                                                  | """"                                                                                                                                                                                  |\n| 2°) présentés sous forme de collyres :                                                                                                                                              |                                                                                                                                                                                     |\n| Dexamethasone                                                                                                                                                                       | DCI                                                                                                                                                                                 |\n| Prednisolone                                                                                                                                                                        | """"                                                                                                                                                                                  |\n| 3°) à base des DCI suivantes, sous toute forme galénique :                                                                                                                          |                                                                                                                                                                                     |\n| - Beclomethasone                                                                                                                                                                    | DCI                                                                                                                                                                                 |\n| - Budésonide                                                                                                                                                                        | """"                                                                                                                                                                                  |', ""| - Fluticasone (DCI)                                   | - Ipratropium // Fenoterol (DCI)                 | - Nicorandil (DCI)                                    |\n| - Fluticasone Furoate (DCI)                           | - Irbesartan // Amlodipine (DCI)                 | - Nifedipine // Atenolol (DCI)                        |\n| - Fluvoxamine (Maleate) (DCI)                         | - Irinotecan Trhydrate Chlorhydrate              | - Nilotinib (DCI)                                     |\n| - Folinate (De Calcium) (DCI)                         | (DCI)                                            | -Nirmatrelvir / Ritonavir (DCI)                       |\n| - Fondaparinux (Sodique) (DCI)                        | - Ivabradine (Chlorhydrate) (DCI)                | - Nonacog Alfa (Facteur Ix De                         |\n| - Formoterol (Fumarate) (DCI)                         | - Ketoconazole (DCI)                             | Coagulation Recombinant) (DCI)                        |\n| - Fraction Phospholipidique De                        | - Ketorolac // Tromethamine (DCI)                | - Octocog Alpha (DCI)                                 |\n| Poumon (DCI)                                          | - Ketotifene Fumarate (DCI)                      | - Octreotide (DCI)                                    |\n| - Fulvestrant (DCI)                                   | - Lanreotide (DCI)                               | - Olmesartan Medoxomil (DCI)                          |\n| - Fumarate De Formoterol Dihydrate                    | - Laronidase (DCI)                               | - Olopatadine (DCI)                                   |\n| // Budesonide (DCI)                                   | - Latanoprost (DCI)                              | - Ondansetron (DCI)                                   |\n| - Furoate De Fluticasone // Vilanterol                | - Latanoprost // Timolol (DCI)                   | - Ondansetron (Chlohydrate) (DCI)                     |\n| (DCI)                                                 | - Ledipasvir // Sofosbuvir (DCI)                 | - Orlistat (DCI)                                      |\n| - Gabapentine (DCI)                                   | - Leflunomide (DCI)                              | - Otilonium Bromure (DCI)                             |\n| - Gadobutrol (DCI)                                    | - Lenograstim (DCI)                              | - Oxaliplatine (DCI)                                  |\n| - Ganciclovir (DCI)                                   | - Levetiracetam (DCI)                            | - Oxcarbazepine (DCI)                                 |\n| - Gefitinib (DCI) - Gelatine Fluide Modifiee (DCI)    | - Levocabastine (Chlorhydrate) (DCI)             | - Oxyde D'Aluminium // Hydroxyde De                   |\n| - Gemcitabine (DCI)                                   | - Levodopa // Benzerazide (DCI)                  | Magnesium (DCI) - Paclitaxel (DCI)                    |"", '| - Budésonide                                                                                                                                                                        | """"                                                                                                                                                                                  |\n| - Clobétasol                                                                                                                                                                        | """"                                                                                                                                                                                  |\n| - Estradiol                                                                                                                                                                         | """"                                                                                                                                                                                  |\n| - Estradiol // Dydrogesterone                                                                                                                                                       | """"                                                                                                                                                                                  |\n| - Estradiol // Norethisterone                                                                                                                                                       | """"                                                                                                                                                                                  |\n| - Estriol                                                                                                                                                                           | """"                                                                                                                                                                                  |\n| - Hydroxyprogesterone Caproate                                                                                                                                                      | """"                                                                                                                                                                                  |  \n9  \nDCI  \n| - Lactobacillus Acidophilus // Estriol                      | """"   |\n|-------------------------------------------------------------|------|\n| - Medrogestone                                              | """"   |\n| - Progesterone                                              | """"   |\n| - Promestriene                                              | """"   |\n| - Testosterone (Enanthate)                                  | """"   |', '###### a)- des principes actifs contre le paludisme suivants :  \n| - Atovaquone // Proguanil (chlorhydrate)    | DCI   |\n|---------------------------------------------|-------|\n| b)- les DCI suivantes:                      |       |\n| 1-présentés sous forme injectable :         |       |\n| - Acetylsalicylate De Lysine                | DCI   |\n| - Aciclovir                                 | """"    |\n| - Acide Tranexamique                        | """"    |\n| - Amiodarone (Chlorhydrate)                 | """"    |\n| - Chlorpromazine                            | """"    |\n| - Dobutamine (Chlorhydrate)                 | """"    |\n| - Drotaverine                               | """"    |\n| - Esomeprazole                              | """"    |\n| - Etamsylate                                | """"    |\n| - Fluconazole                               | """"    |\n| - Levomepromazine (Maleate)                 | """"    |\n| - Meloxicam                                 | """"    |\n| - Nimodipine                                | """"    |\n| - Omeprazole                                | """"    |\n| - Paracetamol                               | """"    |\n| - Phloroglucinol // Trimethylphloroglucinol | """"    |\n| - Salbutamol Sulfate                        | """"    |\n| - Bupivacaine                               | """"    |\n| 2-présentés sous forme de collyres :        |       |\n| - Chlorure de Sodium                        | DCI   |\n| - Diclofenac Sodique                        | """"    |\n| - Hexamidine (Di-Isethionate)               | """"    |\n| - Indometacine                              | """"    |\n| - Ketotifene                                | """"    |']","1. Réponse directe à la question

Les substances actives mentionnées dans le Bulletin Officiel qui sont autorisées sous différentes formes, comme des solutions ou des comprimés, incluent :

- Betaxolol (DCI)
- Bimatoprost (DCI)
- Bimatoprost // Timolol (DCI)
- Bisoprolol (Hemifumarate) (DCI)
- Bisoprolol (Hemifumarate) // Hydrochlorothiazide (DCI)
- Betamethasone (Dipropionate) // Estradiol Micronise (DCI) - Chlorure De Sodium // Chlorure De Potassium // Chlorure De Calcium
- Betamethasone Phosphate Disodique (DCI)

2. Sources citées

- Dahir n° 1-22-75 du 18 joumada I 1444 (13 décembre 2022) portant promulgation de la loi de finances n° 50-22 pour l'année budgétaire 2023, PREMIERE PARTIE, TITRE PREMIER, Chapitre 30.","Les substances actives mentionnées dans le Bulletin Officiel et autorisées sous différentes formes incluent l'Acetylleucine, l'Acide Alendronique, l'Adapalene, l'Aflibercept, l'Agomelatine, et l'Amlodipine, entre autres. Ces substances sont présentées sous diverses formes galéniques comme des solutions et des comprimés. Aucune référence d'article spécifique n'est fournie dans l'extrait.",0.0,0.3333333333333333,0.6666666666666666,0.921818834928789,gpt-4o-mini,bge-m3,qwen2.5:7b,False,False,False,0.5
Quels sont les diplômes reconnues comme équivalents au diplôme de docteur en médecine selon l'arrêté du ministre de l'enseignement supérieur ?,"[""## Arrêté du ministre de l'enseignement supérieur, de la recherche scientifique et de l'innovation n°2802-22 du 27 rabii I 1444 (24  octobre  2022)  complétant  l'arrêté  n° 2963-97  du 2chaabane 1418 (3décembre 1997) fixant la liste des diplômes reconnus équivalents au diplôme de docteur en médecine.  \nle MINIStRe De l'eNSeIGNeMeNt SUP É RIeUR, De la ReCheRChe SCIeNtIFIQUe et De l'INNOVatION,  \nVu l'arrêté du ministre de l'enseignement supérieur, de  la  recherche  scientifique  et  de  la  culture  n° 2963-97  du 2 chaabane 1418 (3décembre 1997) fixant la liste des diplômes reconnus équivalents au diplôme de docteur en médecine, tel qu'il a été complété ;  \nVu le décret n°2-21-838 du 14 rabii I 1443 (21 octobre 2021) relatif aux attributions du ministre de l'enseignement supérieur, de la recherche scientifique et de l'innovation ;  \nAprès avis de la commission sectorielle des sciences de la santé, réunie en date du 27 juillet 2022 ;  \nAprès avis du conseil national de l'Ordre national des médecins,"", ""## Arrêté du ministre de l'enseignement supérieur, de la recherche scientifique et de l'innovation n°2817-22 du 27 rabii I 1444 (24  octobre  2022)  complétant  l'arrêté  n° 2963-97  du 2chaabane 1418 (3décembre 1997) fixant la liste des diplômes reconnus équivalents au diplôme de docteur en médecine.  \nle MINIStRe De l'eNSeIGNeMeNt SUP É RIeUR, De la ReCheRChe SCIeNtIFIQUe et De l'INNOVatION,  \nVu l'arrêté du ministre de l'enseignement supérieur, de  la  recherche  scientifique  et  de  la  culture  n° 2963-97  du 2 chaabane 1418 (3décembre 1997) fixant la liste des diplômes reconnus équivalents au diplôme de docteur en médecine, tel qu'il a été complété ;  \nVu le décret n°2-21-838 du 14 rabii I 1443 (21 octobre 2021) relatif aux attributions du ministre de l'enseignement supérieur, de la recherche scientifique et de l'innovation ;  \nAprès avis de la commission sectorielle des sciences de la santé, réunie en date du 27 juillet 2022 ;  \nAprès avis du conseil national de l'Ordre national des médecins,"", ""## Arrêté du ministre de l'enseignement supérieur, de la recherche scientifique et de l'innovation n°2808-22 du 27 rabii I 1444 (24  octobre  2022)  complétant  l'arrêté  n° 2963-97  du 2chaabane 1418 (3décembre 1997) fixant la liste des diplômes reconnus équivalents au diplôme de docteur en médecine.  \nle MINIStRe De l'eNSeIGNeMeNt SUP É RIeUR, De la ReCheRChe SCIeNtIFIQUe et De l'INNOVatION,  \nVu l'arrêté du ministre de l'enseignement supérieur, de  la  recherche  scientifique  et  de  la  culture  n° 2963-97  du 2 chaabane 1418 (3décembre 1997) fixant la liste des diplômes reconnus équivalents au diplôme de docteur en médecine, tel qu'il a été complété ;  \nVu le décret n°2-21-838 du 14 rabii I 1443 (21 octobre 2021) relatif aux attributions du ministre de l'enseignement supérieur, de la recherche scientifique et de l'innovation ;  \nAprès avis de la commission sectorielle des sciences de la santé, réunie en date du 27 juillet 2022 ;  \nAprès avis du conseil national de l'Ordre national des médecins,"", ""## Arrêté du ministre de l'enseignement supérieur, de la recherche scientifique et de l'innovation n°1609-25 du 23 hija 1446 (20  juin  2025)  complétant  l'arrêté  n° 2963-97  du 2chaabane 1418 (3décembre 1997) fixant la liste des diplômes reconnus équivalents au diplôme de docteur en médecine.  \nle MINIStRe De l'eNSeIGNeMeNt SUP É RIeUR, De la ReCheRChe SCIeNtIFIQUe et De l'INNOVatION,  \nVu l'arrêté du ministre de l'enseignement supérieur, de  la  recherche  scientifique  et  de  la  culture  n° 2963-97  du 2 chaabane 1418 (3décembre 1997) fixant la liste des diplômes reconnus équivalents au diplôme de docteur en médecine, tel qu'il a été modifié et complété ;  \nVu le décret n°2-24-991 du 24 rabii II 1446 (28 octobre 2024) relatif aux attributions du ministre de l'enseignement supérieur, de la recherche scientifique et de l'innovation ;  \nAprès avis de la commission sectorielle des sciences de la santé, réunie en date du 30 avril 2025 ;  \nAprès avis du conseil national de l'Ordre national des médecins,"", ""## Arrêté du ministre de l'enseignement supérieur, de la recherche scientifique et de l'innovation n°2308-23 du 26 safar 1445 (12 septembre 2023) complétant l'arrêté n°2963-97 du 2chaabane 1418 (3décembre 1997) fixant la liste des diplômes reconnus équivalents au diplôme de docteur en médecine.  \nle MINIStRe De l'eNSeIGNeMeNt SUP É RIeUR, De la ReCheRChe SCIeNtIFIQUe et De l'INNOVatION,  \nVu l'arrêté du ministre de l'enseignement supérieur, de  la  recherche  scientifique  et  de  la  culture  n° 2963-97  du 2 chaabane 1418 (3décembre 1997) fixant la liste des diplômes reconnus équivalents au diplôme de docteur en médecine, tel qu'il a été modifié et complété ;  \nVu le décret n°2-21-838 du 14 rabii I 1443 (21 octobre 2021) relatif aux attributions du ministre de l'enseignement supérieur, de la recherche scientifique et de l'innovation ;  \nAprès avis de la commission sectorielle des sciences de la santé, réunie en date du 11 juillet 2023 ;  \nAprès avis du conseil national de l'Ordre national des médecins,"", ""## Arrêté du ministre de l'enseignement supérieur, de la recherche scientifique et de l'innovation n°1614-25 du 23 hija 1446 (20  juin  2025)  complétant  l'arrêté  n° 2963-97  du 2chaabane 1418 (3décembre 1997) fixant la liste des diplômes reconnus équivalents au diplôme de docteur en médecine.  \nle MINIStRe De l'eNSeIGNeMeNt SUP É RIeUR, De la ReCheRChe SCIeNtIFIQUe et De l'INNOVatION,  \nVu l'arrêté du ministre de l'enseignement supérieur, de  la  recherche  scientifique  et  de  la  culture  n° 2963-97  du 2 chaabane 1418 (3décembre 1997) fixant la liste des diplômes reconnus équivalents au diplôme de docteur en médecine, tel qu'il a été modifié et complété ;  \nVu le décret n°2-24-991 du 24 rabii II 1446 (28 octobre 2024) relatif aux attributions du ministre de l'enseignement supérieur, de la recherche scientifique et de l'innovation ;  \nAprès avis de la commission sectorielle des sciences de la santé, réunie en date du 30 avril 2025 ;  \nAprès avis du conseil national de l'Ordre national des médecins,""]","Information non disponible.

Les extraits fournis ne contiennent pas la liste des diplômes reconnus comme équivalents au diplôme de docteur en médecine. Ils mentionnent seulement que plusieurs arrêtés ont complété l'arrêté initial du 3 décembre 1997, mais ne donnent pas le contenu exact de cette liste.","L'extrait ne fournit pas de détails sur les diplômes reconnus comme équivalents au diplôme de docteur en médecine. Pour obtenir cette information, il faudrait consulter la liste mentionnée dans l'arrêté n° 2963-97.",0.9999999999833333,1.0,1.0,0.0,gpt-4o-mini,bge-m3,qwen2.5:7b,False,False,False,0.5
Pourquoi le Maroc est-il classé comme étant très vulnérable aux sécheresses et quels impacts cela a-t-il sur ses ressources en eau ?,"[""#### 1.1. État des lieux  \nSitué  dans  une  zone  semi-aride  fortement  vulnérable  au  changement  climatique,  le  Maroc subit  de  manière  croissante  des  événements  extrêmes  induits  par  ce  phénomène,  tels  que  la sécheresse, avec des impacts notables sur ses ressources hydriques. En effet, le pays est classé actuellement au /uniF63A/uniF63B ème rang mondial pour ce qui est de l'exposition aux risques hydriques. Des périodes de sécheresse intense s'étaient manifestées dans le passé, un phénomène qui survenait en moyenne tous les /uniF63A/uniF639 ans. Au cours du /uniF63A/uniF639 e siècle, le pays aurait connu régulièrement des épisodes de sécheresse de différentes durées et intensités avec plus de /uniF6DC/uniF63A périodes sèches majeures, qui s'étaient étendues sur l'ensemble du pays /uniF6DC/uniF63B/uniF63F .  \nAu cours des dernières décennies, Le Maroc a dû faire face à une sécheresse d'une intensité encore plus sévère, avec /uniF63D épisodes survenus en l'espace de /uniF6DC/uniF6DC années : soit un épisode tous les /uniF63A,/uniF63A ans en moyenne contre une fois tous les /uniF63E à /uniF63F ans en moyenne durant la période /uniF6DC/uniF641/uniF640/uniF63D-/uniF63A/uniF639/uniF6DC/uniF639 et une fois tous les /uniF6DC/uniF6DC  ans en moyenne durant le siècle dernier jusqu'au début des années /uniF6DC/uniF641/uniF640/uniF639."", ""#### Définition de la situation de sécheresse  \n<!-- image -->  \nPerception de la gravité du problème de la sécheresse au Maroc  \n<!-- image -->  \nConseil Economique, Social et Environnemental  \n5% 10% 15% 20% 25% 30% 35% 40% 45%  \nPrès  des  deux  tiers  (/uniF63E/uniF639,/uniF641/uniF639%)  des  répondants  rapportent  avoir  été  affectés,  directement  ou indirectement,  par  les  conséquences  de  la  sécheresse.  Un  peu  plus  de  la  moitié  (/uniF63D/uniF63F ,/uniF639/uniF63B%)  des participant.e.s témoignent de difficultés d'accès aux produits agricoles ou alimentaires imputables à la sécheresse. Ainsi, /uniF63A/uniF639,/uniF63E/uniF63B% des répondants considèrent que ce phénomène naturel entraine une insuffisance de disponibilité des produits agricoles sur le marché, tandis que /uniF63B/uniF63E,/uniF63C/uniF639% observent une baisse de leur pouvoir d'achat  en raison de la cherté des produits alimentaires induite par la sécheresse. Il convient de noter qu'un quart des répondants (/uniF63A/uniF63D,/uniF63E/uniF6DC%) déclarent avoir rencontré des difficultés pour accéder  à l'eau.  \nImpact de la sécheresse sur les répondants  \n<!-- image -->  \nLes  répondants convergent largement vers le constat que le stress hydrique est accentué par la  consommation  irresponsable  (/uniF63F/uniF6DC,/uniF63A/uniF63A%),  voire  illégale  (/uniF63E/uniF641,/uniF6DC/uniF63A%)  de  l'eau.  L 'arrosage  des  espaces verts et des terrains de sport (/uniF63C/uniF63D,/uniF639/uniF640%), ainsi que l'agriculture irriguée (/uniF63C/uniF63F ,/uniF63B/uniF63E%), arrivent en tête des activités  auxquelles  les  participant.e.s  imputent  la  responsabilité  de  l'aggravation  du  problème de l'eau au Maroc, loin devant d'autres secteurs économiques cités tels que  le tourisme (/uniF63B/uniF63A,/uniF63E/uniF63B%) et l'industrie (/uniF63B/uniF63A,/uniF63E/uniF63B%). Les commentaires émis sur les réseaux sociaux convergent également vers une préconisation de restreindre, voire d'interdire, la culture intensive et orientée vers l'export de certaines variétés agricoles. L 'avocat et la pastèque sont plus spécifiquement désignés à ce propos. La réduction de l'arrosage des espaces verts ou de terrains de sport, notamment ceux des  golfs, est évoquée dans de nombreux commentaires,  préconisant de privilégier l'utilisation  des eaux usées traitées dans ces cas.  \nPar ailleurs, près de la moitié des répondants font part de leur préoccupation quant à la diminution des  quantités  d'eau  disponibles  ou  utilisables,  en  raison  des  déperditions  dans  les  canaux  de distribution (/uniF63C/uniF63D,/uniF63C/uniF63B%),  ou de la pollution (/uniF63C/uniF63B,/uniF6DC/uniF63D%).  \nActivités et secteurs accentuant le stress hydrique  \n<!-- image -->  \nRapport Annuel 2022  \n161  \n162"", ""#### Le dessalement : une solution optimale qui doit tenir compte de la préservation de  l'écosystème  marin  \nLe  Maroc  est  actuellement  confronté  à  une  croissance  soutenue  du  déficit    hydrique,  réalité devenue  structurelle  en  raison  de  plusieurs  facteurs.  D'une  part,  le  pays  est  de  plus  en  plus vulnérable aux effets du changement climatique, se manifestant par des épisodes de sécheresse et d'inondations de plus en plus fréquents, une diminution des précipitations et une augmentation des températures. D'autre part, la demande en eau ne cesse de croître, tandis que les ressources disponibles sont surexploitées et leur qualité se dégrade en raison de diverses formes de pollution, en  sus  des  pertes  et  des  gaspillages.  En  parallèle,  plusieurs  bassins  hydrauliques  et  nappes phréatiques  enregistrent  un  déficit  sévère.  Cette  situation  est  d'autant  plus  alarmante  que  la disponibilité des ressources en eau dans le pays en /uniF63A/uniF639/uniF63A/uniF63B est de /uniF63E/uniF639/uniF63E m /uniF63B /hab/an, soit un niveau endeçà du seuil de pénurie fixé à /uniF6DC./uniF639/uniF639/uniF639 m /uniF63B /hab/an /uniF6DC/uniF63A/uniF63F et les projections démontrent que ces tendances s'accentueront davantage dans le futur.  \nTenant compte de cette situation et conformément aux Orientations de Sa Majesté le Roi /uniF6DC/uniF63A/uniF640 ,   plusieurs plans d'actions ont été lancés ces trois dernières années par les pouvoirs publics, dans le cadre du programme national pour l'approvisionnement en eau potable et l'irrigation /uniF63A/uniF639/uniF63A/uniF639-/uniF63A/uniF639/uniF63A/uniF63F , en matière de gestion de l'offre et de la demande en eau. Un tournant décisif a été noté dans le domaine de la mobilisation des ressources en eau non conventionnelles, en particulier à travers, l'accélération des projets de stations de dessalement de l'eau de mer. Dans ce sens, plusieurs projets structurants sont planifiés pour l'installation d'environ /uniF63A/uniF639 stations de dessalement à l'horizon /uniF63A/uniF639/uniF63B/uniF639, sachant que  \n127 - Audition au CESE de Monsieur Nizar Baraka, Ministre de l'équipement et de l'eau, le 30 mai 2023.  \n128 - Présentation du Programme national pour l'approvisionnement en eau potable et l'irrigation devant SA Majesté le Roi le 13 janvier 2020 ;  \nDiscours de SM Le Roi à l'ouverture de la session parlementaire d'octobre 2022 ;  \nSéance de travail présidé par SM le Roi le 09 mai 2023 consacrée au suivi du programme national pour l'approvisionnement en eau potable et l'irrigation 2020-2027 ;  \nRapport Annuel 2022  \n83  \n84  \nle Maroc dispose à ce jour /uniF6DC/uniF63A/uniF641 de /uniF6DC/uniF63A stations avec une capacité de production annuelle de près de /uniF6DC /uniF63F /uniF641,/uniF63B millions de m /uniF63B .  \nAinsi, un recours raisonné au dessalement de l'eau de mer  permettrait au Maroc de :"", ""#### 2.2. Mesures visant le traitement du stress hydrique à moyen et long terme  \nLes  récents  épisodes  de  sécheresses  qui  ont  frappé  le  Maroc  ont  certes  exacerbé  le  déficit hydrique à des niveaux très sévères. Toutefois, ce déficit découle de la conjonction de plusieurs facteurs climatiques et non-climatiques tels qu'une gouvernance de l'eau encore inaboutie, des infrastructures hydriques sous-optimisées et une exploitation abusive, voire illicite, des ressources. La  demande  croissante  en  eau,  notamment  dans  le  secteur  agricole,  dépasse  les  ressources renouvelables disponibles, entraînant ainsi  des pertes élevées et une dégradation de la qualité de l'eau. Cette situation en perdurant est de nature à aggraver le déficit hydrique et de provoquer des conflits entre différents usages et régions qui partagent les mêmes ressources. Les bassins les plus touchés actuellement sont Moulouya, Oum Er-Rbia, Sebou et Loukkos. D'autres graves conséquences seraient à craindre, telles que des déplacements massifs de population, l'abandon des terres agricoles, la perte du patrimoine et des pratiques agricoles, ainsi que la diminution des revenus et l'augmentation du chômage.  \nFace à cette situation, un ensemble de mesures proactives et structurantes ont été adoptées en matière de gestion de l'offre et de la demande en eau. En particulier, ces mesures visent : la gestion de l'offre à travers l'accélération du rythme de réalisation des projets de mobilisation des ressources en eau conventionnelles couplée à la mise en œuvre de projets de mobilisation des ressources en eau non-conventionnelles ainsi que la gestion de la demande à travers le renforcement de l'efficacité hydrique (Fig. /uniF63A) /uniF6DC/uniF63E/uniF63A .  \n161 - Il s'agit de la Circulaire n° 1937 du 17 février 2022, la Circulaire n°12312 du 19 juillet 2022 et la Circulaire n°19325 du 24 octobre 2022. La Circulaire n°23748 du 23 Décembre 2022 a été adoptée pour le suivi de la mise en œuvre de ces trois circulaires.  \n162 - Audition du ministère de l'Équipement et de l'Eau (23 mars 2023).  \nConseil Economique, Social et Environnemental  \nFig. 2 - Mesures stratégiques à caractère proactif et structurant en matière de gestion de l'eau 163  \n<!-- image -->"", ""- /uniF6BA Promouvoir et valoriser l'entrepreneuriat des femmes au Maroc.  \nRapport Annuel 2022  \n19  \n20  \nLe cinquième point de vigilance du présent rapport s'est penché sur la question du dessalement de l'eau de mer, désormais considéré comme l'une des solutions prometteuses pour mobiliser d'importants  volumes  d'eaux  non-conventionnelles,  indispensables  à  la  sécurité  hydrique  et alimentaire du pays. Dans ce sens, le CESE préconise d'inscrire le dessalement dans une vision nationale concertée afin de parvenir à un mix hydrique résilient face aux mutations climatiques, capable de valoriser et de mobiliser de manière responsable et durable les ressources hydriques conventionnelles  et  non-conventionnelles  pour  satisfaire  la  demande  en  eau  potable  des ménages ainsi que les besoins spécifiques des secteurs productifs et des territoires. Par ailleurs, pour neutraliser les impacts délétères potentiels du dessalement, notamment sur les écosystèmes marins dans leur diversité, il convient de veiller à ce que les stations de dessalement soient munies de dispositifs de contrôle, de surveillance, de veille et de suivi continu.  \n## Majesté,  \nDans le cadre du présent rapport, le CESE a jugé opportun de consacrer le focus de cette année à la gestion du stress hydrique, notamment au vu de la sécheresse sévère que le pays a endurée ces dernières quatre années, culminant en /uniF63A/uniF639/uniF63A/uniF63A. L 'augmentation de la fréquence et de l'intensité de la sécheresse, dans le contexte du changement climatique, s'est traduite par un sévère déficit hydrique  touchant  tous  les  usages  (agricole,  industriel,  touristique,  domestique, etc. ),  avec  des répercussions  majeures  à  la  fois  sur  l'économie,  les  écosystèmes,  la  sécurité  humaine  (surtout hydrique,  alimentaire  et  sanitaire)  et  les  moyens  de  subsistance  pour  une  grande  part  de  la population.  \nLa  criticité  de  la  situation  du  stress  hydrique  interpelle  toutes  les  composantes  de  la  société (citoyens, usagers, décideurs, entrepreneurs, agriculteurs, etc. ) et convoque de ce fait, une rupture majeure dans nos habitudes de consommation ainsi que des inflexions dans les choix politiques.  \nJadis perçue comme un risque conjoncturel, la sécheresse est dorénavant une donne structurelle, exacerbant le stress hydrique qui assaille le pays. Pour répondre à cet enjeu, une intervention urgente  visant  à  atténuer  ses  effets  immédiats,  notamment  sur  les  populations,  secteurs  et territoires  vulnérables,  se  révèle  vitale.  \nIl  convient  de  rappeler que les pouvoirs publics ont fait preuve de réactivité en déployant un ensemble de mesures de portées conjoncturelle et structurelle afin d'atténuer les effets immédiats de la sécheresse et faire face au stress hydrique à moyen et long termes."", ""### Partie II  \n#### Focus Pour une gestion efficiente du déficit hydrique  \nAu Maroc, la période s'étendant de /uniF63A/uniF639/uniF6DC/uniF641 à /uniF63A/uniF639/uniF63A/uniF63A a été marquée par une sécheresse sans précédent depuis les années /uniF63E/uniF639, caractérisée par un déficit pluviométrique de -/uniF63B/uniF63A% par rapport à la normale climatologique, établie sur la période /uniF6DC/uniF641/uniF640/uniF6DC-/uniF63A/uniF639/uniF6DC/uniF639. L'année  /uniF63A/uniF639/uniF63A/uniF63A,  en  particulier,  s'est  distinguée  comme  étant  celle  des  extrêmes météorologiques  jamais  enregistrés  depuis  plus  de  /uniF63C/uniF639  ans,  où  l'anomalie  de la  température  moyenne  annuelle  a  atteint  +/uniF6DC,/uniF63E/uniF63B°C  par  rapport  à  la  normale, accompagnée d'un déficit pluviométrique annuel d'environ /uniF63A/uniF63F%.  \nL'augmentation de la fréquence et de l'intensité de la sécheresse, sous l'effet du changement climatique, s'est traduite ces dernières années par un grave déficit hydrique.  Ce  dernier  touche  tous  les  usages  (agricole,  industriel,  touristique, domestique, etc. ),  avec  des  répercussions majeures à la fois sur l'économie, les écosystèmes, la sécurité humaine (surtout hydrique, alimentaire et sanitaire) et les sources de revenus d'une partie croissante de la population.  \nLa criticité de la situation du stress hydrique interpelle toutes les composantes de  la  société  (citoyens,  usagers,  décideurs,  entrepreneurs,  agriculteurs, etc. )  et appelle de ce fait, une rupture majeure dans nos habitudes de consommation ainsi que des inflexions dans les choix politiques.  \nRapport Annuel 2022 Jadis  perçue  comme  un  risque  conjoncturel,  la  sécheresse  est  dorénavant une donne structurelle exacerbant le stress hydrique qui assaille le pays. Pour répondre  à  cet  enjeu,  une  intervention  urgente  visant  à  atténuer  ses  effets immédiats, notamment sur les populations, secteurs et territoires vulnérables, se révèle  vitale.  \nToutefois, le traitement optimal du stress hydrique - qui est également exacerbé par d'autres facteurs tels que l'augmentation de la demande en eau, les pertes et les pollutions - nécessite de mettre en place des mesures stratégiques s'inscrivant dans la perspective d'une gouvernance efficace de l'eau, en pleine convergence avec la réforme d'autres secteurs, notamment le secteur agricole.""]","1. Réponse directe à la question

Le Maroc est classé comme étant très vulnérable aux sécheresses en raison de plusieurs facteurs mentionnés dans le texte :

- La région du Maghreb dont fait partie le Maroc est particulièrement sensible au climat aride et semi-aride, qui favorise les conditions propices à la sécheresse.
- L'augmentation de la fréquence et de l'intensité des sécheresses sous l'effet du changement climatique a exacerbé la vulnérabilité du pays aux sécheresses.
- Cette vulnérabilité est aggravée par d'autres facteurs tels que l'augmentation de la demande en eau, les pertes et les pollutions.

Ces facteurs ont des impacts significatifs sur les ressources en eau du Maroc :

- Une diminution marquée des pluies entraîne un déficit hydrique touchant tous les usages d'eau (agricole, industriel, touristique, domestique).
- Des répercussions majeures sont observées à la fois sur l'économie (perturbations de l'activité économique), les écosystèmes (dégradation environnementale) et la sécurité humaine (surtout hydrique, alimentaire et sanitaire).

Sources citées :
- Le texte mentionne explicitement que le Maroc est très vulnérable aux sécheresses et explique les raisons à partir des points 1. et 2.
- Les impacts sont directement liés à la situation décrite dans les paragraphes qui suivent.","Le Maroc est classé comme étant très vulnérable aux sécheresses en raison de sa situation dans une zone semi-aride et de l'augmentation des événements extrêmes liés au changement climatique, ce qui a des impacts notables sur ses ressources hydriques. Les périodes de sécheresse intense se sont multipliées, entraînant une aggravation des risques hydriques.",0.9999999999833333,1.0,0.8333333333333334,0.9523977127383824,gpt-4o-mini,bge-m3,qwen2.5:7b,False,False,False,0.5
Que doit faire le Président de l'Instance s'il reçoit une plainte nécessitant une action rapide concernant un cas de corruption ?,"[""###### Article 23  \nS'il appert au Président de l'Instance que la dénonciation, la  plainte  ou  l'information  reçue  comporte  des  données exigeant une intervention immédiate pour constater l'un des cas de corruption prévus à l'article 3 ci-dessus, il désigne, sous réserve des dispositions de l'article 25 ci-dessous, un Investigateur pour mener une enquête et recueillir des données à cet effet, les vérifier et en dresser un procès-verbal. Le Président avise immédiatement le ministère public compétent. Ce dernier doit tenir le Président de l'Instance informé des mesures ou des décisions prises au sujet de l'affaire dont il est saisi.  \nDans ce cas, le Président de l'Instance doit en aviser le Conseil lors de sa plus proche réunion."", ""###### Article 21  \nToute personne physique ou morale ainsi que tout chef d'administration ou fonctionnaire qui détient des données ou des informations fiables, des présomptions ou des preuves indiquant l'existence d'un cas de corruption, peut les porter à la connaissance du Président de l'Instance.  \nDe même, toute personne physique ou morale, ayant subi ou susceptible de subir un préjudice du fait d'un cas de corruption, peut, en personne ou par l'intermédiaire de son représentant, adresser sa plainte au Président de l'Instance.  \nPour être recevable, la dénonciation ou la plainte doit :  \n- être écrite et signée par le dénonciateur ou le plaignant en personne, en indiquant son nom complet ;\n- comporter toutes les mentions relatives à l'identité du dénonciateur ou du plaignant ;\n- être accompagnée des pièces, des documents et des informations, s'ils existent, et de tout autre preuve susceptible de démontrer le cas de corruption ;\n-  préciser  la  ou  les  parties  ou  la  ou  les  personnes concernées par le cas de corruption.  \nEn  outre,  s'il  s'agit  d'une  plainte,  elle  doit  être accompagnée d'une déclaration du plaignant indiquant que le cas de corruption objet de sa plainte n'a pas été portée auparavant devant la justice.  \nLa dénonciation ou la plainte ne doit comporter aucune expression injurieuse ou diffamatoire contre une personne ou une partie, sous peine de l'application de la législation en vigueur.  \nSi le dénonciateur ou le plaignant est dans l'impossibilité de faire parvenir à l'Instance, par écrit, sa dénonciation ou sa plainte, il peut présenter une déclaration orale dont la teneur est consignée dans un procès-verbal spécial, dressé par les soins des services compétents de l'Instance et signé, selon le cas, par le dénonciateur ou le plaignant qui en reçoit copie. La dénonciation ou la plainte doit être accompagnée de pièces ou documents de preuve, s'ils existent.  \nL'Instance peut également s'auto-saisir d'office de tout cas de corruption porté à sa connaissance. Aussi, la décision d'auto-saisine est prise au nom du Conseil de l'Instance par la commission mentionnée à l'article 34 ci-dessous.  \nSous  réserve  des  dispositions  de  la  présente  loi, notamment de l'article  7  ci-dessus,  l'Instance  exerce  sa compétence en ce qui concerne le cas de corruption objet d'auto-saisine,  selon  les  mêmes  procédures  prévues  aux articles 22 à 38 ci-dessous.  \nLe Conseil de l'Instance doit être informé lors de sa plus proche réunion, des cas où l'Instance est intervenue par auto-saisine."", ""###### Article 22  \nS'il s'avère à l'Instance que la dénonciation, la plainte ou l'information reçue ne comporte pas de données, preuves ou présomptions établissant l'existence d'un cas de corruption ou concorde avec les informations dont l'Instance dispose à l'occasion de l'examen d'autres dossiers, ou si les faits relatés par la dénonciation ou la plainte font l'objet d'une poursuite judiciaire ou d'un jugement déjà prononcé, elle prend une décision motivée portant classement de l'affaire et en informe le dénonciateur ou le plaignant dans un délai de quinze (15) jours à compter de la date de la prise de décision de classement. Le Président de l'Instance doit, dans ce cas, en informer le Conseil de l'Instance lors de sa plus proche réunion.  \nS'il s'avère au Président de l'Instance que l'objet de la dénonciation ou de la plainte ne relève pas des missions de l'Instance, il oriente le dénonciateur ou le plaignant selon l'objet de la dénonciation ou de la plainte."", ""###### Article 24  \nS'il appert au Président de l'Instance qu'une dénonciation, une plainte ou une information reçue remplit les conditions requises, qu'elle ne nécessite pas une intervention immédiate, ni le renvoi direct au Ministère public, tout en comportant des  éléments nécessitant son examen et l'ouverture d'un dossier, il désigne un ou plusieurs Investigateurs de l'Instance pour examiner l'objet de la dénonciation, de la plainte ou de l'information, enquêter sur la véracité des actes et des faits qui y sont mentionnés, demander et collecter les données relatives au dossier de l'affaire et vérifier leur bien fondé."", ""###### Article 34  \nUne commission permanente créée auprès de l'Instance, composée du Président et des Vice-Présidents désignés par le Conseil, examine les dossiers des affaires relatives aux cas de corruption qui lui sont soumis par le Président, à la lumière des procès-verbaux établis à leur sujet ainsi que des documents, pièces et informations y afférentes. Elle prend les décisions concernant lesdits dossiers au nom du Conseil, et renvoie ses conclusions et recommandations :  \n- à la partie concernée s'il s'avère à la commission que le cas nécessite une poursuite disciplinaire contre la ou les personnes concernées par le cas de corruption ;\n- aux autorités et instances compétentes pour examiner les infractions administratives et financières visées à  l'article  36  de  la  Constitution  et  qui  nécessitent l'application  d'une  sanction  administrative  ou financière, selon le cas ;\n- au Ministère public compétent, s'il s'avère que les actes objet de l'enquête et de l'investigation de l'Instance, revêtent un caractère pénal et nécessitent la mise en mouvement des poursuites pénales à l'encontre de la ou des personnes concernées.  \nLa commission permanente précitée peut, également, prendre une décision au nom du Conseil soit pour :  \n- le classement du dossier de l'affaire, auquel cas, la décision prise par la commission doit être motivée ;\n- ou l'approfondissement de l'enquête et de l'investigation concernant  cette  affaire,  en  cas  d'insuffisance  de preuves et de données nécessaires, pour y statuer.  \nDans tous les cas, le Président doit communiquer au Conseil les données relatives à tous les dossiers soumis à l'Instance et présentés à la commission permanente, avec mention des suites qui leur ont été réservées, notamment ceux qui ont été classés ou renvoyés au Ministère public ou à toute autre autorité ou instance, en précisant les motivations."", ""###### Article 25  \nL'Investigateur chargé par le Président d'examiner le dossier d'une affaire relative à un cas de corruption mène les enquêtes et les investigations nécessaires, demande les données relatives au dossier et procède à leur collecte, étude et analyse puis en dresse un procès-verbal qu'il soumet au Président de l'Instance dans le délai imparti par ce dernier. L'Investigateur se base, pour dresser le procès-verbal, sur les documents collectés et les témoignages de ou des personnes concernées, les informations qu'elles ont fournies à l'Instance, les constatations et les visites effectuées, les déclarations orales des personnes concernées, ainsi que sur les documents et données que le Président de l'Instance peut demander à toutes les parties mentionnées à l'article 31 ci-dessous.  \nÀ cet effet, les Investigateurs de l'Instance, dans le cadre de l'exercice de leurs missions, sur autorisation écrite du Président de l'Instance et sous son autorité, sont autorisés à :  \n1- entrer, après avoir avisé les chefs et les responsables concernés, dans toutes les administrations et les établissements publics, les collectivités territoriales et les sièges des autres personnes de droit public, à l'exception des tribunaux et des services relevant des administrations chargées de la défense nationale et de la sûreté intérieure et extérieure de l'Etat ;  \n2- entrer dans les locaux professionnels des personnes physiques et morales et les sièges sociaux des personnes morales de droit privé et leurs filiales, sous réserve des dispositions des textes législatifs en vigueur concernant l'entrée dans ces locaux et sièges, notamment les articles 15, 16, 17, 23, 24, 59, 60, 61, 62, 63 et des mesures procédurales prévues à l'article 79 de la loi n°22-01 relative à la procédure pénale. Dans ce cas, un ou plusieurs officiers de la police judiciaire doivent participer aux enquêtes et investigations menées. La présence de ces derniers est obligatoire, sous peine de l'application des dispositions des articles 32 et 33 de la loi relative à la procédure pénale. A cet effet, le Président de l'Instance informe le procureur du Roi compétent pour prendre les mesures nécessaires.  \nLes investigateurs de l'Instance sont autorisés dans les cas prévus aux paragraphes 1° et 2° ci-dessus à :  \n- consulter tous les documents administratifs, financiers et comptables disponibles auprès de la partie concernée et  qui  leur  seraient  utiles  pour  leurs  enquêtes  et investigations, y compris les registres des contrats, des actes et des écrits, les rapports d'inspection, de vérification et d'audit, les décisions disciplinaires, si elles existent, prononcées contre les fonctionnaires et les employés et en obtenir copies, quel que soit le moyen de leur conservation, qu'il soit sur support papier ou électronique ;""]","1. Réponse directe à la question :
Le Président de l'Instance doit désigner un Investigateur pour mener une enquête immédiate et recueillir des données concernant le cas de corruption nécessitant une action rapide, conformément au texte de l'article 23.

2. Sources citées
- Loi n° 46-19, II.-Dans le domaine de la contribution à la lutte contre la corruption : > Chapitre IV > Article 23","Le Président de l'Instance désigne un Investigateur pour mener une enquête, recueillir des données, les vérifier et en dresser un procès-verbal, tout en avisant immédiatement le ministère public compétent, conformément à l'article 23.",0.81666666664625,1.0,0.2857142857142857,0.8756047246242675,gpt-4o-mini,bge-m3,qwen2.5:7b,False,False,False,0.5
Quel est le nom de la société mentionnée et où se situe son adresse ?,"['| Nom du bénéficiaire :                                                                                                                                                                                                                                                                                                                                                                      | Société « LES HUITRES EL ALEMSarl ». Hay Moulay Rachid, n° 710, Dakhla.                                                                                                                                                                                                                                                                                                                    | Société « LES HUITRES EL ALEMSarl ». Hay Moulay Rachid, n° 710, Dakhla.                                                                                                                                                                                                                                                                                                                    | Société « LES HUITRES EL ALEMSarl ». Hay Moulay Rachid, n° 710, Dakhla.                                                                                                                                                                                                                                                                                                                    |', '| Nom du bénéficiaire                                                                                                                                                                                                                                                                                                                                                           | Société «AQUACULTURE MEDSarl» Route 1, Bloc 2 app 37 Marina Saidia- Berkane                                                                                                                                                                                                                                                                                                   | Société «AQUACULTURE MEDSarl» Route 1, Bloc 2 app 37 Marina Saidia- Berkane                                                                                                                                                                                                                                                                                                   | Société «AQUACULTURE MEDSarl» Route 1, Bloc 2 app 37 Marina Saidia- Berkane                                                                                                                                                                                                                                                                                                   | Société «AQUACULTURE MEDSarl» Route 1, Bloc 2 app 37 Marina Saidia- Berkane                                                                                                                                                                                                                                                                                                   |', '|------------------------------------------------------------------------------------------------------------------------------------------------------------------------------------------------------------------------------------------------------------------------------------------------------------------------------------------------------------------|------------------------------------------------------------------------------------------------------------------------------------------------------------------------------------------------------------------------------------------------------------------------------------------------------------------------------------------------------------------|------------------------------------------------------------------------------------------------------------------------------------------------------------------------------------------------------------------------------------------------------------------------------------------------------------------------------------------------------------------|------------------------------------------------------------------------------------------------------------------------------------------------------------------------------------------------------------------------------------------------------------------------------------------------------------------------------------------------------------------|\n| Nom du bénéficiaire                                                                                                                                                                                                                                                                                                                                              | Société «PESCACIS Sarl» 108 Rue Abdelkhalek Torres- Dakhla                                                                                                                                                                                                                                                                                                       | Société «PESCACIS Sarl» 108 Rue Abdelkhalek Torres- Dakhla                                                                                                                                                                                                                                                                                                       | Société «PESCACIS Sarl» 108 Rue Abdelkhalek Torres- Dakhla                                                                                                                                                                                                                                                                                                       |', '|-------------------------------------------------------------------------------------------------------------------------------------------------------------------------------------------------------------------------------------------------------------------------------------------------------------------------------------------------------------------------------------|-------------------------------------------------------------------------------------------------------------------------------------------------------------------------------------------------------------------------------------------------------------------------------------------------------------------------------------------------------------------------------------|-------------------------------------------------------------------------------------------------------------------------------------------------------------------------------------------------------------------------------------------------------------------------------------------------------------------------------------------------------------------------------------|-------------------------------------------------------------------------------------------------------------------------------------------------------------------------------------------------------------------------------------------------------------------------------------------------------------------------------------------------------------------------------------|\n| Nom du bénéficiaire                                                                                                                                                                                                                                                                                                                                                                 | Société «WEST LEOCEANIC Sarl AU» 46, BD Zerktouni 2 ème étage Appt 6- Casablanca                                                                                                                                                                                                                                                                                                    | Société «WEST LEOCEANIC Sarl AU» 46, BD Zerktouni 2 ème étage Appt 6- Casablanca                                                                                                                                                                                                                                                                                                    | Société «WEST LEOCEANIC Sarl AU» 46, BD Zerktouni 2 ème étage Appt 6- Casablanca                                                                                                                                                                                                                                                                                                    |', '|-----------------------------------------------------------------------------------------------------------------------------------------------------------------------------------------------------------------------------------------------------------------------------------------------------------------------------------------------------------------------------|-----------------------------------------------------------------------------------------------------------------------------------------------------------------------------------------------------------------------------------------------------------------------------------------------------------------------------------------------------------------------------|-----------------------------------------------------------------------------------------------------------------------------------------------------------------------------------------------------------------------------------------------------------------------------------------------------------------------------------------------------------------------------|-----------------------------------------------------------------------------------------------------------------------------------------------------------------------------------------------------------------------------------------------------------------------------------------------------------------------------------------------------------------------------|\n| Nom du bénéficiaire                                                                                                                                                                                                                                                                                                                                                         | Société «ALDY SEAFOOD SARL» N° 13 Rue Ahmed El Majjati, Résidence Les Alpes, 1 er étage, N° 8 Casablanca.                                                                                                                                                                                                                                                                   | Société «ALDY SEAFOOD SARL» N° 13 Rue Ahmed El Majjati, Résidence Les Alpes, 1 er étage, N° 8 Casablanca.                                                                                                                                                                                                                                                                   | Société «ALDY SEAFOOD SARL» N° 13 Rue Ahmed El Majjati, Résidence Les Alpes, 1 er étage, N° 8 Casablanca.                                                                                                                                                                                                                                                                   |', '| Nom du bénéficiaire :                                                                                                                                                                                                                                                                                                                                                                    | Société « LES HUITRES PASCALE LORCY Sarl ». Hay El Wahda 3, Av. Tah, 1 er étage, n° 3100, Dakhla.                                                                                                                                                                                                                                                                                        | Société « LES HUITRES PASCALE LORCY Sarl ». Hay El Wahda 3, Av. Tah, 1 er étage, n° 3100, Dakhla.                                                                                                                                                                                                                                                                                        | Société « LES HUITRES PASCALE LORCY Sarl ». Hay El Wahda 3, Av. Tah, 1 er étage, n° 3100, Dakhla.                                                                                                                                                                                                                                                                                        |']","1. Réponse directe à la question :
   - La société mentionnée est ""LES HUITRES ELALEM Sarl"".
   - Son adresse est Hay Moulay Rachid, n° 710, Dakhla.

2. Sources citées :
   - Arrêté conjoint du ministre de l'agriculture, de la pêche maritime, du développement rural et des eaux et forêts et du ministre délégué auprès de la ministre de l'économie et des finances, chargé du budget n° 2134-22 du 4 moharrem 1444 (2août 2022).

La même information est également fournie pour d'autres sociétés dans les arrêtés mentionnés.",Le nom de la société mentionnée est «PESCACIS Sarl» et son adresse est 108 Rue Abdelkhalek Torres - Dakhla. Aucune référence à un numéro d'article n'est fournie dans l'extrait.,0.3333333333,0.5,0.25,0.9109729843612553,gpt-4o-mini,bge-m3,qwen2.5:7b,False,False,False,0.5
Comment sont calculées et recouvrées les contributions que doit payer Médi Telecom pour ses missions auprès de l'État ?,"[""###### Article 14 : Modalités de paiement des contributions aux missions générales de l'Etat  \n- 14.1 Les contributions de Médi Telecom, prévues aux articles 12 et 13 ci-dessus, sont calculées conformément  aux  articles  10Bis  et  13Bis  de  la  loi  n°24-96  précitée  et  des  textes  et décisions pris pour son application.\n- 14.2 Les  contributions à  la  recherche, à  la  formation  et à  la  normalisation  en  matière  de t él écommunications  ainsi  qu'au  service  universel  sont  recouvrées  conformément  à  la réglementation en vigueur.\n- 14.3 L'ANRT contrôle les déclarations faites à ce titre par Médi Telecom, et se réserve le droit d'effectuer toute inspection et enquête qu'elle juge nécessaires et, le cas échéant, procède à des redressements après avoir provoqué les explications de Médi Telecom."", ""#### TITRE 2 : CHARGES FINANCIERES, RESPONSABILITE ET CONTROLE  \n##### CHAPITRE I - CONTRIBUTIONS AUX MISSIONS GENERALES DE L'ETAT  \n###### Article 12 : Contribution à la recherche, à la formation et à la normalisation en matière de télécommunications  \n- 12.1 Conformément aux dispositions de la loi n°24-96 précitée, Médi Telecom est redevable d'une contribution annuelle au titre de sa contribution à la recherche et à la formation.  \nPage 14 sur 20  \n- 12.2 Conformément aux dispositions de la loi  n°24-96  précitée,  le  montant  annuel  de  cette contribution est fixé  à :\n- 0,75  %  du  chiffre  d'affaires  de  Médi  Telecom  au  titre  de  la  formation  et  de  la normalisation,  \net  \n- 0,25 % de son chiffre d'affaires au titre de la recherche.  \nLe chiffre d'affaires considér é est défini à l'article 14.1 ci-dessous."", ""###### Article 13 : Contribution aux missions et charges du service universel  \nMédi  Telecom  contribue  annuellement,  conformément à  la  réglementation  en  vigueur,  aux missions et charges du service universel dans la limite de deux pour cent (2%) de son chiffre d'affaires, tel que défini à l'article 14.1 ci-dessous."", ""###### Article 17 : Autres redevances, taxes et fiscalité  \nMédi Telecom est assujetti aux dispositions fiscales en vigueur. À ce titre, il doit s'acquitter de tous les impôts, droits, taxes et redevances institués par la législation et la réglementation en vigueur."", ""- pouvoir répondre pour sa part aux besoins de la défense nationale et de la sécurité et de la sûreté publiques conformément à la législation et à la réglementation en vigueur ;  \nPage 10 sur 20  \n- mettre à la disposition des autorités concernées les moyens nécessaires à l'accomplissement de leur mission. A ce titre, Médi Telecom est tenu de prendre toutes les mesures pour se conformer aux prescriptions exigées par la défense nationale, la sécurité et la sûreté publiques et les prérogatives de l'autorité judiciaire ainsi qu'à celles de l'ANRT. Il est tenu d'imposer contractuellement à ses fournisseurs de services le respect de cet engagement ;\n- donner suite, en cas de crise ou de nécessité impérieuse, aux instructions des autorités publiques imposant une interruption partielle ou totale du service conformément à la l égislation et  à la réglementation en vigueur. Médi Telecom respecte l'ordre des priorités de rétablissement des liaisons concernant plus spécialement les services d'Etat, les organismes  chargés  d'une  mission  d'intérêt  public  ou  contribuant  aux  missions  de défense, de sécurité et de sûreté publiques ;\n- être en mesure d'établir des liaisons spécialement étudiées ou réservées pour la sécurité publique selon les modalités techniques fixées par convention avec les services d'Etat concernés ;\n- élaborer et mettre en œuvre les plans pour les secours d'urgence  établis périodiquement en concertation avec les organismes chargés des secours d'urgence et les autorités locales notamment pour les catastrophes naturelles ; et\n- apporter, à la demande de l'ANRT, son concours aux organismes traitant au niveau national des questions de protection et de sécurité des systèmes d'information et de t él écommunications selon les modalités fixées par la législation et la réglementation en vigueur."", ""###### Article 24 : Unités de mesure et monnaie des contributions  \nPour tous documents, mémoires, notes techniques, plans et autres écrits, Médi Telecom est tenu d'utiliser le système métrique et les unités de mesure s'y rattachant.  \nLes montants des différentes contributions sont dus en dirhams.""]","1. Réponse directe à la question

Les contributions que Médi Telecom doit payer pour ses missions auprès de l'État sont calculées et recouvrées conformément aux dispositions suivantes :

- La contribution annuelle au titre de la recherche, formation et normalisation en matière de télécommunications est fixée à 0,75 % du chiffre d'affaires lié à la formation et de la normalisation, et 0,25 % du chiffre d'affaires lié à la recherche (article 12).
- La contribution aux missions et charges du service universel s'élève au maximum de 2% du chiffre d'affaires (article 13).
- Ces contributions sont recouvrées conformément à la réglementation en vigueur, et l'ANRT peut procéder à des redressements si nécessaire (articles 14.2 et 14.3).

De plus, Médi Telecom est assujetti aux dispositions fiscales en vigueur et doit s'acquitter de tous les impôts, droits, taxes et redevances institués par la législation et la réglementation (article 17).

2. Sources citées

- Décret n°2-25-877 du 7 joumada I 1447 (30 octobre 2025), articles 12, 13, 14 et 17.
- CAHIER DES CHARGES de l'instrument juridique mentionné.","Les contributions de Médi Telecom sont calculées conformément aux articles 10Bis et 13Bis de la loi n°24-96 et des textes applicables (article 14.1). Elles sont recouvrées selon la réglementation en vigueur, y compris pour la recherche, la formation, et la normalisation en matière de télécommunications, ainsi que pour le service universel (article 14.2).",0.9999999999666667,1.0,1.0,0.9383609626846031,gpt-4o-mini,bge-m3,qwen2.5:7b,False,False,False,0.5
Pourquoi les assureurs mixtes ont-ils un avantage concurrentiel par rapport aux nouveaux assureurs dans le secteur des assurances ?,"[""### 1-  Un  système  d'agrément  hybride  accordant  un  avantage  concurrentiel substantiel pour les assureurs mixtes  \nLes EAR mixtes bénéficient d'un avantage concurrentiel lié à la réforme légale du secteur des assurances de 2006 instaurant l'obligation de spécialisation pour les assureurs, et ce sans effet rétroactif. En effet, les EAR historiques mixtes agréées pour la pratique des opérations d'assurances à la fois sur la vie et la non vie ont continué d'exercer leur activité et bénéficient de  cet  avantage  concurrentiel  de  taille  malgré  l'instauration  de  la  spécialisation  pour  les nouveaux entrants."", ""### II- La concentration en fonction du type d'agrément des assureurs  \nDe manière générale,  la  part  de  marché  des  catégories  d'assurance  en  fonction  du  type d'agrément,  montre  que  les  entreprises  mixtes  représentent  70%  du  total  des  primes émises au niveau national en 2021 (et 73% hors réassureurs exclusifs). Cet avantage revient essentiellement au fait que la réforme légale du secteur des assurances, introduite en 2006 et instaurant l'obligation de spécialisation pour les assureurs, n'a pas prévu de dispositions transitoires par rapport aux sociétés d'assurances mixtes créées avant cette réforme. En effet, les sociétés souscrivant les produits d'assurance vie et non vie, ont continué à exercer leur activité mixte, ce qui leur a donné un avantage concurrentiel important.  \nCette catégorie des entreprises mixtes est suivie par les assureurs personnes qui concentrent 16,5% du chiffre d'affaires du secteur. Cette performance est imputée majoritairement à la contribution importante du canal de la bancassurance dont plus de 95% de sa production concerne l'assurance de personnes.  \n50  \nrelatif à l'état de la concurrence dans le marché de l'assurance au Maroc  \nGraph. 26 : Les parts de marché des catégories d'assurance en fonction du type d'agrément, année 2021  \n<!-- image -->"", ""#### 1.  Procéder  à  une  réforme  légale  pour  corriger  l'avantage  concurrentiel découlant de la spécialisation des assureurs  \nEn vue d'annuler l'avantage concurrentiel découlant de la spécialisation dont bénéficie les assureurs mixtes depuis 2006, le Conseil de la concurrence recommande de procéder à une réforme légale pour corriger cet avantage concurrentiel de taille, soit à travers l'extension de  l'obligation  de  spécialisation  aux  assureurs  mixtes,  soit,  à  travers  la  généralisation  de l'avantage concurrentiel à tous les assureurs."", ""### Source : ACAPS.  \nEn  termes  de  performance,  les  assureurs  mixtes  enregistrent  au  fil  de  la  dernière  décennie,  une dynamique de croissance avec un chiffre d'affaires de 36,8 milliards de dirhams en 2021, soit une augmentation de 10% par rapport à 2020, suivis des assureurs vie qui ont connu un développement sans précédent depuis 2016 grâce à l'entrée de la Mutuelle Attamine Chaabi (MAC) sur ce marché  \n36  \nrelatif à l'état de la concurrence dans le marché de l'assurance au Maroc qui a contribué significativement à la performance de cette catégorie. Les primes de cette catégorie ont franchi les 8 milliards de dirhams pour se stabiliser à 8,6 milliards de dirhams en 2021.  \nQuant aux autres assurances de spécialités, le montant des primes ne dépasse pas 3,1 milliards de dirhams en 2021, avec une tendance relativement positive.  \nGraph.  9  :  Evolution  des  chiffres  d'affaires  des  EAR  en  fonction  du  type d'agrément, années 2005- 2021 en milliards de dh  \n<!-- image -->  \n### Source : ACAPS.  \nDans le détail, seront illustrées ci-après, les évolutions des six catégories d'assurance 17 ,  par EAR opérationnelle à fin 2021.  \nA la tête des assureurs mixtes, Wafa Assurance a enregistré un volume de chiffre d'affaires de 9 milliards de dirhams en 2021, soit 25% du total des primes émises par ce groupe d'EAR. Elle est suivie de RMA et de Sanlam Maroc avec des chiffres d'affaires respectifs de 7, 7 et 5,8 milliards de dirhams .  \n17 Hors la catégorie Takaful, qui n'est devenue opérationnelle qu'à partir de l'année 2022.  \n37"", ""###### 1-1. Exigence de spécialisation  \nLedit agrément est accordé par catégories d'opérations d'assurances. En effet, en 2006, la loi n° 39-05 modifiant et complétant la loi n° 17-99 a amendé l'article 165 du code pour instaurer le  principe  de  spécialisation  des  assureurs.  En  effet,  à  partir  de  2006,  aucun  agrément  ne peut être accordé à une même entreprise pour des opérations d'assurances sur la vie et de  \n66  \nrelatif à l'état de la concurrence dans le marché de l'assurance au Maroc capitalisation et pour le reste des opérations d'assurances et de réassurance. En outre, les règles de spécialisation s'articulent autour des points suivants :  \n-  L'agrément pour les opérations d'assistance ne peut être accordé à une entreprise agréée pour d'autres opérations d'assurances ;\n-  L'agrément pour les opérations d'assurances contre les risques de crédit et de caution ne peut être accordé à une entreprise agréée pour d'autres opérations d'assurances.  \nToutefois, les agréments accordés pour la pratique des opérations précitées peuvent être cumulés avec les agréments ci-après :  \n- -L'entreprise agréée  pour  pratiquer les opérations d'assistance, les opérations d'assurances  contre  les  risques  de  crédit  et  de  caution  peut  être  agréée  pour  la réassurance des opérations d'assurances qu'elle pratique ;\n-  L'entreprise  agréée  pour  pratiquer  les  opérations  d'assurances  sur  la  vie  et  de capitalisation peut être agréée pour les opérations d'assurances couvrant la maladie, la maternité, les risques de dommages corporels liés aux accidents et la réassurance.  \nIl  est  à  noter  que  la  loi  n°  39-05  précitée  a  instauré  l'obligation  de  spécialisation pour les assureurs et ce, sans prévoir de dispositions transitoires par rapport aux sociétés d'assurances mixtes créées avant cette réforme. Cette situation a généré un avantage concurrentiel de taille pour les assureurs mixtes qui s'accaparent, actuellement, une part conséquente dans la production globale du secteur (70%) comme analysé précédemment.  \nQuant aux critères pris en compte pour l'octroi ou le refus de l'agrément, l'article 165 du code des assurances stipule qu'il est pris en compte des éléments suivants :  \nPour l'octroi ou le refus de l'agrément, il est pris en compte :  \n- les moyens techniques et financiers ;\n- l'honorabilité, la qualification et l'expérience des dirigeants ;\n- la répartition du capital et la qualité des actionnaires ;\n- la contribution économique et professionnelle ;\n- l'impact sur la stabilité et les conditions concurrentielles du marché."", ""### 1- Tendance de la concentration pour les entreprises mixtes  \nLes entreprises mixtes d'assurance au Maroc disposent d'une part de marché importante et une présence étendue. Elles ont souvent une capacité financière solide et offrent une large gamme de produits d'assurance.  \nPassant  de  9  EAR  à  7  entreprises,  le  degré  de  concentration  du  marché  des  sociétés mixtes a évolué significativement entre 2005 et 2021. En effet, en 2005, plus de 71% de la production de ce marché est générée par seulement quatre sociétés, alors que le reste des sociétés partagent les 29% de la production de ce marché avec des parts respectives ne dépassant pas 8%.  \nLe degré de concentration de ce marché a atteint 76% de parts de marché générées par les mêmes sociétés en 2015, alors qu'en 2021, 91% de la production de ce marché a été assurée par cinq sociétés avec le renforcement de la position de Atlanta qui a fusionné avec la société Sanad, et l'augmentation ainsi de sa part de marché passant de 7% en 2015 à 15% en 2021.  \n51""]","1. Réponse directe à la question :
Les assureurs mixtes ont un avantage concurrentiel par rapport aux nouveaux assureurs dans le secteur des assurances car ils bénéficient d'un avantage lié à la réforme légale du secteur des assurances de 2006, qui instaurait l'obligation de spécialisation. Cependant, cette réforme n'a pas prévu de dispositions transitoires par rapport aux sociétés d'assurances mixtes créées avant cette réforme. En conséquence, les EAR historiques mixtes agréées pour la pratique des opérations d'assurance à la fois sur la vie et non vie ont pu continuer à exercer leur activité sans subir l'obligation de spécialisation applicable aux nouveaux entrants.

2. Sources citées :
- Avis du Conseil de la concurrence n° A/1/23, section 1- Un système d'agrément hybride accordant un avantage concurrentiel substantiel pour les assureurs mixtes.
- Idem, section II- La concentration en fonction du type d'agrément des assureurs.","Les assureurs mixtes ont un avantage concurrentiel en raison de la réforme légale du secteur des assurances de 2006, qui a instauré l'obligation de spécialisation pour les nouveaux entrants sans effet rétroactif. Ainsi, les EAR historiques mixtes agréées continuent d'exercer leurs activités sur la vie et la non-vie, bénéficiant d'un avantage de taille.",0.99999999998,1.0,0.6666666666666666,0.9761210019632834,gpt-4o-mini,bge-m3,qwen2.5:7b,False,False,False,0.5
Quels sont les différents fonds spéciaux gérés par le Trésor pour l'année budgétaire 2023 et leurs montants respectifs ?,"[""### III. Comptes spéciaux du Trésor (En dirhams)  \n| Code             | Désignation des comptes                                                                                                                              | Ressources pour l'année budgétaire 2023   |\n|------------------|------------------------------------------------------------------------------------------------------------------------------------------------------|-------------------------------------------|\n| 3.1.0.0.1.00.001 | 3.1- COMPTES D'AFFECTATION SPECIALE Fonds spécial des prélèvements sur le pari mutuel                                                                | 90 000 000                                |\n| 3.1.0.0.1.00.002 | Fonds spécial pour la promotion du système d'éducation et de formation et l'amélioration de sa qualité                                               | Mémoire                                   |\n| 3.1.0.0.1.00.003 | Fonds de soutien aux services de la concurrence, du contrôle, de la protection du consommateur, de la régulation du marché et des stocks de sécurité | 5 000 000                                 |\n| 3.1.0.0.1.00.005 | Fonds pour la promotion de l'emploi des jeunes                                                                                                       | 3 209 100 000                             |\n| 3.1.0.0.1.00.006 | Fonds d'accompagnement des réformes du transport routier urbain et interurbain                                                                       | 2 914 000 000                             |\n| 3.1.0.0.1.04.005 | Fonds de service universel de télécommunications                                                                                                     | 200 000 000                               |\n| 3.1.0.0.1.04.006 | Fonds de soutien à l'initiative nationale pour le développement humain                                                                               | 3 600 000 000                             |\n| 3.1.0.0.1.04.007 | Fonds de mise à niveau sociale                                                                                                                       | 10 000 000                                |\n| 3.1.0.0.1.04.008 | Fonds de promotion des investissements                                                                                                               | 3 353 000 000                             |\n| 3.1.0.0.1.06.001 | Fonds spécial pour le soutien des juridictions                                                                                                       | 400 000 000                               |\n| 3.1.0.0.1.06.002 | Fonds d'entraide familiale                                                                                                                           | 160 000 000                               |"", ""### III. Comptes spéciaux du Trésor (En dirhams)  \n| Code             | Désignation des comptes                                                                                                                              | Ressources pour l'année budgétaire 2024   |\n|------------------|------------------------------------------------------------------------------------------------------------------------------------------------------|-------------------------------------------|\n| 3.1.0.0.1.00.001 | 3.1- COMPTES D'AFFECTATION SPECIALE Fonds spécial des prélèvements sur le pari mutuel                                                                | 90 000 000                                |\n| 3.1.0.0.1.00.002 | Fonds spécial pour la promotion du système d'éducation et de formation et l'amélioration de sa qualité                                               | Mémoire                                   |\n| 3.1.0.0.1.00.003 | Fonds de soutien aux services de la concurrence, du contrôle, de la protection du consommateur, de la régulation du marché et des stocks de sécurité | 5 000 000                                 |\n| 3.1.0.0.1.00.005 | Fonds pour la promotion de l'emploi des jeunes                                                                                                       | 888 000 000                               |\n| 3.1.0.0.1.00.006 | Fonds d'accompagnement des réformes du transport routier urbain et interurbain                                                                       | 2 914 000 000                             |\n| 3.1.0.0.1.04.005 | Fonds de service universel de télécommunications                                                                                                     | 200 000 000                               |\n| 3.1.0.0.1.04.006 | Fonds de soutien à l'initiative nationale pour le développement humain                                                                               | 2 600 000 000                             |\n| 3.1.0.0.1.04.007 | Fonds de mise à niveau sociale                                                                                                                       | 10 000 000                                |\n| 3.1.0.0.1.04.008 | Fonds de promotion des investissements                                                                                                               | 3 353 000 000                             |\n| 3.1.0.0.1.06.001 | Fonds spécial pour le soutien des juridictions                                                                                                       | 400 000 000                               |\n| 3.1.0.0.1.06.002 | Fonds d'entraide familiale                                                                                                                           | Mémoire                                   |"", ""##### DEPENSES DES COMPTES SPECIAUX DU TRESOR POUR L'ANNEE BUDGETAIRE 2023 (En dirhams)  \n| Code             | Désignation des comptes                                                                                                                              | Dépenses pour l'année budgétaire 2023   |\n|------------------|------------------------------------------------------------------------------------------------------------------------------------------------------|-----------------------------------------|\n| 3.2.0.0.1.00.001 | 3.1- COMPTES D'AFFECTATION SPECIALE Fonds spécial des prélèvements sur le pari mutuel                                                                | 90 000 000                              |\n| 3.2.0.0.1.00.002 | Fonds spécial pour la promotion du système d'éducation et de formation et l'amélioration de sa qualité                                               | Mémoire                                 |\n| 3.2.0.0.1.00.003 | Fonds de soutien aux services de la concurrence, du contrôle, de la protection du consommateur, de la régulation du marché et des stocks de sécurité | 5 000 000                               |\n| 3.2.0.0.1.00.005 | Fonds pour la promotion de l'emploi des jeunes                                                                                                       | 3 209 100 000                           |\n| 3.2.0.0.1.00.006 | Fonds d'accompagnement des réformes du transport routier urbain et interurbain                                                                       | 2 914 000 000                           |\n| 3.2.0.0.1.04.005 | Fonds de service universel de télécommunications                                                                                                     | 200 000 000                             |\n| 3.2.0.0.1.04.006 | Fonds de soutien à l'initiative nationale pour le développement humain                                                                               | 3 600 000 000                           |\n| 3.2.0.0.1.04.007 | Fonds de mise à niveau sociale                                                                                                                       | 10 000 000                              |\n| 3.2.0.0.1.04.008 | Fonds de promotion des investissements                                                                                                               | 3 353 000 000                           |\n| 3.2.0.0.1.06.001 | Fonds spécial pour le soutien des juridictions                                                                                                       | 400 000 000                             |\n| 3.2.0.0.1.06.002 | Fonds d'entraide familiale                                                                                                                           | 160 000 000                             |"", ""| 3.2.0.0.1.34.002 | Fonds de soutien à la Gendarmerie Royale                                                                                                                | 50 000 000                              |\n| 3.2.0.0.1.46.001 | Fonds solidarité pour le soutien au logement, d'habitat et intégration urbaine                                                                          | 2 000 000 000                           |  \n| Code             | Désignation des comptes                                                                                                                                         | Dépenses pour l'année budgétaire 2023   |\n|------------------|-----------------------------------------------------------------------------------------------------------------------------------------------------------------|-----------------------------------------|\n| 3.2.0.0.1.51.001 | Fonds spécial pour le soutien des établissements pénitentiaires                                                                                                 | 150 000 000                             |\n| 3.2.0.0.4.13.021 | TOTAL DES DEPENSES DES COMPTES D'AFFECTATION SPECIALE 3.4- COMPTES D'ADHESION AUX ORGANISMES INTERNATIONAUX Compte d'adhésion aux institutions de Bretton woods | 99 053 286 000 107 401 000              |\n| 3.2.0.0.4.13.022 | Compte d'adhésion aux organismes arabes et islamiques                                                                                                           | 137 362 000                             |\n| 3.2.0.0.4.13.023 | Compte d'adhésion aux institutions multilatérales                                                                                                               | 1 688 070 000                           |\n|                  | TOTAL DES DEPENSES DES COMPTES D'ADHESION AUX ORGANISMES INTERNATIONAUX                                                                                         | 1 932 833 000                           |\n| 3.2.0.0.5.13.001 | Différence de change sur ventes et achats de devises Compte des opérations d'échanges de taux d'intérêt et de devises des emprunts extérieurs                   | Mémoire Mémoire                         |\n| 3.2.0.0.5.13.003 | TOTAL DES DEPENSES DES COMPTES D'OPERATIONS MONETAIRES                                                                                                          | Mémoire                                 |\n| 3.2.0.0.7.13.017 | 3.7- COMPTES DE FINANCEMENT Prêts aux collectivités territoriales                                                                                               | Mémoire                                 |\n| 3.2.0.0.7.13.059 | Prêts à la Société marocaine d'assurance à l'exportation                                                                                                        | Mémoire                                 |"", ""| 3.2.0.0.1.06.001 | Fonds spécial pour le soutien des juridictions                                                                                                       | 400 000 000                             |\n| 3.2.0.0.1.06.002 | Fonds d'entraide familiale                                                                                                                           | 160 000 000                             |\n| 3.2.0.0.1.07.001 | Fonds spécial de soutien à l'action culturelle et sociale au profit des marocains résidant à l'étranger et des affaires de la migration              | 25 000 000                              |\n| 3.2.0.0.1.08.004 | Part des collectivités territoriales dans le produit de la T.V.A                                                                                     | 37 608 299 000                          |\n| 3.2.0.0.1.08.005 | Fonds spécial pour la promotion et le soutien de la Protection Civile                                                                                | 200 000 000                             |\n| 3.2.0.0.1.08.006 | Fonds spécial relatif au produit des parts d'impôts affectées aux régions                                                                            | 9 000 000 000                           |\n| 3.2.0.0.1.08.008 | Financement des dépenses d'équipement et de la lutte contre le chômage                                                                               | 1 500 000 000                           |\n| 3.2.0.0.1.08.009 | Fonds de soutien à la sûreté nationale                                                                                                               | 30 000 000                              |\n| 3.2.0.0.1.08.010 | Fonds spécial pour la mise en place des titres identitaires électroniques et des titres de voyage                                                    | 463 927 000                             |\n| 3.2.0.0.1.08.011 | Fonds d'assainissement liquide et solide et d'épuration des eaux usées et leur réutilisation                                                         | 1 500 000 000                           |\n| 3.2.0.0.1.08.012 | Fonds de lutte contre les effets des catastrophes naturelles                                                                                         | 400 000 000                             |\n| 3.2.0.0.1.08.013 | Fonds de solidarité interrégionale                                                                                                                   | 1 000 000 000                           |\n| 3.2.0.0.1.10.001 | Fonds national de soutien à la recherche scientifique et au développement technologique                                                              | 22 500 000                              |\n| 3.2.0.0.1.11.003 | Fonds national du développement du sport                                                                                                             | 800 000 000                             |"", ""| 3.2.0.0.1.10.001 | Fonds national de soutien à la recherche scientifique et au développement technologique                                                              | 22 500 000                              |\n| 3.2.0.0.1.11.003 | Fonds national du développement du sport                                                                                                             | 800 000 000                             |\n| 3.2.0.0.1.12.001 | Fonds spécial de la pharmacie centrale                                                                                                               | 1 900 000 000                           |\n| 3.2.0.0.1.13.003 | Fonds de remploi domanial                                                                                                                            | 1 500 000 000                           |\n| 3.2.0.0.1.13.004 | Fonds spécial du produit des loteries                                                                                                                | 80 000 000                              |  \n60  \n| Code             | Désignation des comptes                                                                                                                                 | Dépenses pour l'année budgétaire 2023   |\n|------------------|---------------------------------------------------------------------------------------------------------------------------------------------------------|-----------------------------------------|\n| 3.2.0.0.1.13.008 | Masse des services financiers                                                                                                                           | 350 000 000                             |\n| 3.2.0.0.1.13.009 | Fonds de la réforme agraire                                                                                                                             | 5 000 000                               |\n| 3.2.0.0.1.13.012 | Bénéfices et pertes de conversion sur les dépenses publiques en devises étrangères                                                                      | Mémoire                                 |\n| 3.2.0.0.1.13.017 | Fonds spécial de la zakat                                                                                                                               | Mémoire                                 |\n| 3.2.0.0.1.13.018 | Fonds de solidarité des assurances                                                                                                                      | 600 000 000                             |\n| 3.2.0.0.1.13.021 | Fonds de soutien des prix de certains produits alimentaires                                                                                             | 600 000 000                             |""]","### 1. Réponse directe à la question

Voici une liste des différents fonds spéciaux gérés par le Trésor pour l'année budgétaire 2023 et leurs montants respectifs :

- Fonds spécial de soutien aux collectivités territoriales dans le produit de la T.V.A : 37 608 299 000 dh
- Fonds spécial pour la promotion et le soutien de la Protection Civile : 200 000 000 dh
- Fonds spécial relatif au produit des parts d'impôts affectées aux régions : 9 000 000 000 dh
- Financement des dépenses d'équipement et de la lutte contre le chômage : 1 500 000 000 dh
- Fonds spécial pour la mise en place des titres identitaires électroniques et des titres de voyage : 463 927 000 dh
- Fonds d'assainissement liquide et solide et d'épuration des eaux usées et leur réutilisation : 1 500 000 000 dh
- Fonds de lutte contre les effets des catastrophes naturelles : 400 000 000 dh
- Fonds spécial pour la solidarité interrégionale : 1 000 000 000 dh
- Fonds national de soutien à la recherche scientifique et au développement technologique : 22 500 000 dh
- Fonds national du développement du sport : 800 000 000 dh
- Fonds spécial de la pharmacie centrale : 1 900 000 000 dh
- Fonds spécial du produit des loteries : 80 000 000 dh

### 2. Sources citées

- [Dahir n° 1-22-75 du 18 joumada I 1444 (13 décembre 2022) portant promulgation de la loi de finances n° 50-22 pour l'année budgétaire 2023]","Les différents fonds spéciaux gérés par le Trésor pour l'année budgétaire 2023 sont :  
- Fonds spécial des prélèvements sur le pari mutuel : 90 000 000 dirhams  
- Fonds spécial pour la promotion du système d'éducation et de formation : Mémoire  
- Fonds de soutien aux services de la concurrence : 5 000 000 dirhams  
- Fonds pour la promotion de l'emploi des jeunes : 3 209 100 000 dirhams  
- Fonds d'accompagnement des réformes du transport routier : 2 914 000 000 dirhams  
- Fonds de service universel de télécommunications : 200 000 000 dirhams  
- Fonds de soutien à l'initiative nationale pour le développement humain : 3 600 000 000 dirhams  
- Fonds de mise à niveau sociale : 10 000 000 dirhams  
- Fonds de promotion des investissements : 3 353 000 000 dirhams  
- Fonds spécial pour le soutien des juridictions : 400 000 000 dirhams  
- Fonds d'entraide familiale : 160 000 000 dirhams.",0.8333333332916666,1.0,0.7857142857142857,0.9295419161151716,gpt-4o-mini,bge-m3,qwen2.5:7b,False,False,False,0.5
Qu'est-ce que cette loi dit sur l'organisation et les règles concernant les Bureaux d'information sur le crédit au Maroc ?,"[""###### Article 2  \nLa présente loi a pour objet d'organiser l'exercice de l'activité des Bureaux d'information sur le crédit et de fixer les  règles  et  les  normes  de  partage  d'informations sur le crédit pour favoriser un accès responsable au financement et contribuer à la stabilité financière.  \nElle  s'applique  aux  Bureaux  d'information  sur  le crédit,  aux  fournisseurs  d'informations,  aux  utilisateurs d'informations exerçant leurs activités au Maroc, ainsi qu'aux consommateurs, tels que définis à l'article premier ci-dessus."", ""###### Article premier  \nPour l'application de la présente loi, on entend par :  \n1.  Bureaux  d'information  sur  le  crédit :  Sociétés exerçant leur activité au Maroc, quelle que soit la nationalité des  actionnaires  de  leur  capital  social  ou  celle  de  leurs dirigeants et qui exercent, à titre de profession habituelle, le traitement d'informations, au sens de la présente loi, à des fins commerciales, y compris les services à valeur ajoutée autorisées par Bank Al-Maghrib et ce, dans les limites et les conditions prévues par la présente loi ;  \n2. Base de données : Recueil centralisé ou décentralisé et  réparti  de  manière  fonctionnelle  ou  géographique, comportant des données ou d'autres éléments informationnels indépendants,  disposés  de  manière  systématique  ou méthodique et individuellement accessibles par des moyens électroniques ou par tout autre procédé ;  \n3.  Information(s) : Toute information incluant ou non des données à caractère personnel et/ou qui concernent les antécédents de crédit et l'historique de remboursement et de paiement  du consommateur, le volume et le détail des prêts  \n4. Informations publiques : Informations ou données recueillies, traitées ou conservées, dans des registres, archives, listes, ou base de données tenus par un organisme public ou privé et dont la nature publique et l'accessibilité au public sont garanties par la loi n° 31-13 relative au droit d'accès à l'information promulguée par le dahir n° 1-18-15 du 5 joumada II 1439 (22 février 2018) ;  \n5.  Données  à  caractère  personnel  : Informations se rapportant à une personne physique identifiée ou indentifiable au sens de la loi n°09-08 relative à la protection des personnes physiques à l'égard du traitement des données à caractère personnel promulguée par le dahir n° 1-09-15 du 22 safar 1430 (18 février 2009) ;  \n6.  Consommateur : Personne, physique ou morale, dont les informations sont insérées ou susceptibles d'être insérés dans la base de données des Bureaux d'information sur le crédit ;  \n7.  Fournisseurs d'information : Organisme public ou privé dont la liste est fixée à l'article 20 ci-dessous ayant conclu un contrat avec un Bureau d'information sur le crédit en vue de lui fournir des informations telles qu'elles sont définies au paragraphe 3 ci-dessus ;  \n8.    Utilisateur  d'informations  (Utilisateur)  : Tout établissement de crédit ou organisme assimilé régi par la loi n° 103-12 relative aux établissements de crédit et organismes assimilés promulguée par le dahir n° 1-14-193 du 1 er rabii I 1436 (24 décembre 2014) ou tout autre organisme public ou privé ayant la qualité de fournisseur au sens de l'article 20 ci-dessous ayant conclu un contrat avec le Bureau d'information sur le crédit conformément aux dispositions de la présente loi ;"", ""###### Article 48  \nSont agréés de plein droit et tenues de se conformer aux dispositions de la présente loi, dans un délai de 12 mois à compter de la date de la publication de ses textes d'application, sous peine des sanctions prévues à l'article 43 ci-dessus, les sociétés d'information sur le crédit opérant au Maroc dans le cadre d'un contrat de gestion déléguée avec Bank Al-Maghrib.  \nLes prêts en cours à la date de la publication des textes d'application de la présente loi au Bulletin officiel , ne sont pas soumis aux dispositions de l'article 24 ci-dessus et leurs informations sont mensuellement mises à jour et partagées avec les Bureaux d'information sur le crédit, jusqu'à leur échéance.  \nLe texte en langue arabe a été publié dans l'édition générale du «Bulletin officiel » n° 7278 du 19 chaabane 1445 (29 février 2024)."", ""###### Article 3  \nLes Bureaux d'information sur le crédit sont régis, en ce qui concerne leur création et l'exercice de leur activité, en sus des dispositions de la présente loi et des textes pris pour son application, par les autres dispositions législatives en vigueur qui leur sont applicables, notamment la loi précitée n°09-08, la loi n°05-20 relative à la cybersécurité promulguée par le dahir n° 1-20-69 du 4 hija 1441 ( 25 juillet 2020 ), la loi n°43-20 relative aux services de confiance pour les transactions électroniques promulguée par le dahir n° 1-20-100 du 16 joumada I 1442 ( 31 décembre 2020 ), la loi n°31-08 édictant des mesures de protection du consommateur promulguée par le dahir n° 1-11-03 du 14 rabii I 1432 ( 18 février 2011 ), la loi n°104-12 relative à la liberté des prix et de la concurrence promulguée par le dahir n° 1-14-116 du 2 ramadan 1435 ( 30 juin 2014 ) et la loi n°31-13 relative au droit d'accès à l'information promulguée par le dahir n°1-18-15 du 5 joumada II 1439 (22 février 2018)."", ""###### Article 17  \nLes Bureaux d'information sur le crédit doivent respecter l'ensemble des règles édictées par circulaire du wali de Bank Al-Maghrib fixant, notamment, les modalités d'exercice par les consommateurs du droit d'accès et de rectification des données qui les concernent. Les délais de conservation des informations ne peuvent s'étendre au-delà de cinq (05) années.  \nLes Bureaux d'information sur le crédit élabore un code de bonne conduite qui fixe les règles déontologiques d'exercice de l'activité conformément aux dispositions de la présente loi et des textes pris pour son application.  \nLedit code et ses mises à jour sont approuvés par Bank Al-Maghrib."", ""###### Article 31  \nLes fournisseurs et utilisateurs d'informations sont tenus, avant de requérir le consentement des consommateurs, de leur fournir, conformément au modèle type établi par circulaire du Wali de Bank Al-Maghrib, les informations suivantes relatives :  \n-  à l'objet de la collecte, du traitement et de la diffusion des  informations  les  concernant  par  les  Bureaux d'information sur le crédit ;\n-  aux catégories d'informations concernées ;\n-    aux  utilisateurs  auxquels  ces  informations  sont susceptibles d'être communiquées ;\n-    à  la  possibilité  de  refuser  de  faire  figurer  leurs informations dans la base de données des Bureaux d'information sur le crédit et les conséquences qui peuvent en découler ;\n-  à la durée de conservation de ces informations par les Bureaux d'information sur le crédit ;\n-   au droit d'accès dans la base de données des Bureaux d'information  sur  le  crédit  et  de  vérification  des informations les concernant ;\n-    au  droit  de  demander  toutes  les  informations conservées par un Bureau d'information sur le crédit sur leur historique de crédit, sous forme d'un rapport de solvabilité. Ce rapport est remis gratuitement au consommateur concerné sur sa demande une seule fois par an ;\n-   au droit de rectifier ou de faire radier sans frais, des informations erronées les concernant en cas d'erreur dans  leurs  informations  et  données  imputable  au fournisseur d'informations ou au Bureau d'information sur le crédit. Ce droit s'exerce sur présentation d'une demande  écrite  signée  accompagnée  d'une  pièce d'identité ou sur support électronique sécurisé.""]","1. **Réponse directe à la question**  
La loi n° 01-22 relative aux Bureaux d'information sur le crédit au Maroc organise l'exercice de l'activité des Bureaux d'information sur le crédit et fixe les règles et normes pour partager les informations sur le crédit. Elle vise à favoriser un accès responsable au financement et contribue à la stabilité financière du pays. Les fournisseurs, utilisateurs et consommateurs d'informations sont inclus dans l'application de cette loi.

2. **Sources citées**
- Article 2 de la Loi n° 01-22 relative aux Bureaux d'information sur le crédit (texte non précisé).
- Article premier de la Loi n° 01-22 relative aux Bureaux d'information sur le crédit (texte non précisé).","La loi a pour objet d'organiser l'exercice de l'activité des Bureaux d'information sur le crédit et de fixer les règles et les normes de partage d'informations sur le crédit pour favoriser un accès responsable au financement et contribuer à la stabilité financière (Article 2). Elle s'applique aux Bureaux d'information sur le crédit, aux fournisseurs d'informations, aux utilisateurs d'informations ainsi qu'aux consommateurs au Maroc.",0.9999999999833333,1.0,0.7142857142857143,0.9143487113489507,gpt-4o-mini,bge-m3,qwen2.5:7b,False,False,False,0.5
Quelle est la durée de validité du permis de recherche d'hydrocarbures « LAGZIRA OFFSHORE 4 » délivré le 2 juin 2023 ?,"[""## ARRÊTE :  \nARTICLE PREMIER.-L'article 3 de l'arrêté n°1702-23 du 3 hija 1444 (22 juin 2023) susvisé, est modifié ainsi qu'ilsuit :  \n«Article 3. -Le permis de recherche d'hydrocarbures « «LAGZIRA OFFSHORE 4» est délivré pour une période «initiale de deux années à compter du 2 juin 2023.»  \nART.2.-Le présent arrêté sera notifié aux intéressés et publié au Bulletin officiel.  \nRabat, le 6 hija 1446 (3 juin 2025).  \nleIla beNalI .  \nLe texte en langue arabe a été publié dans l'édition générale du «Bulletin officiel » n° 7427 du 10 safar 1447 (4 août 2025)."", ""## ARRÊTE :  \nARTICLE PREMIER.-L'article 3 de l'arrêté n°1699-23 du 3 hija 1444 (22 juin 2023) susvisé, est modifié ainsi qu'ilsuit :  \n«Article 3. -Le permis de recherche d'hydrocarbures « «LAGZIRA OFFSHORE 1» est délivré pour une période «initiale de deux années à compter du 2 juin 2023.»  \nART.2.-Le présent arrêté sera notifié aux intéressés et publié au Bulletin officiel.  \nRabat, le 6 hija 1446 (3 juin 2025)."", ""## ARRÊTE :  \nARTICLE PREMIER.-L'article 3 de l'arrêté n°1700-23 du 3 hija 1444 (22 juin 2023) susvisé, est modifié ainsi qu'ilsuit :  \n«Article 3. -Le permis de recherche d'hydrocarbures « «LAGZIRA OFFSHORE 2» est délivré pour une période «initiale de deux années à compter du 2 juin 2023.»  \nART.2.-Le présent arrêté sera notifié aux intéressés et publié au Bulletin officiel.  \nRabat, le 6 hija 1446 (3 juin 2025).  \nleIla beNalI .  \nLe texte en langue arabe a été publié dans l'édition générale du «Bulletin officiel » n° 7427 du 10 safar 1447 (4 août 2025)."", ""## ARRÊTE :  \nARTICLE PREMIER.-L'article 3 de l'arrêté n°1701-23 du 3 hija 1444 (22 juin 2023) susvisé, est modifié ainsi qu'ilsuit :  \n«Article 3. -Le permis de recherche d'hydrocarbures « «LAGZIRA OFFSHORE 3» est délivré pour une période «initiale de deux années à compter du 2 juin 2023.»  \nART.2.-Le présent arrêté sera notifié aux intéressés et publié au Bulletin officiel.  \nRabat, le 6 hija 1446 (3 juin 2025).  \nleIla beNalI .  \nLe texte en langue arabe a été publié dans l'édition générale du «Bulletin officiel » n° 7427 du 10 safar 1447 (4 août 2025)."", ""## Arrêté  de  la  ministre  de  la  transition  énergétique  et  du développement durable n°1497-25 du 6 hija 1446 (3 juin 2025) modifiant  l'arrêté  de  la  ministre  de  la  transition énergétique et du développement durable n°1702-23 du 3hija 1444 (22 juin 2023) accordant le permis de recherche d'hydrocarbures dit «LAGZIRA OFFSHORE 4» à l'Office national des hydrocarbures et des mines et à la société «GENEL ENERGY MOROCCO LIMITED».  \nLA MINISTRE DE LA TRANSITION ÉNERGÉTIQUE ET DU DÉVELOPPEMENT DURABLE ,  \nVu l'arrêté de la ministre de la transition énergétique et  du  développement  durable  n° 1702-23  du  3  hija  1444 (22 juin 2023) accordant le permis de recherche d'hydrocarbures dit «LAGZIRA OFFSHORE 4» à l'Office national des hydrocarbures et des mines et à la société «GENEL ENERGY MOROCCO LIMITED» ;  \nVu l'arrêté  conjoint  de  la  ministre  de  la  transition énergétique et du développement durable et de la ministre de l'économie et des finances n°667-25 du 4 ramadan 1446 (5 mars 2025) approuvant l'avenant n° 2 à l'accord pétrolier « LAGZIRA OFFSHORE» conclu le 5 joumada I 1446 (8novembre 2024), entre l'Office national des hydrocarbures et des mines et la société «GENEL ENERGY MOROCCO LIMITED»,"", ""## Arrêté  de  la  ministre  de  la  transition  énergétique  et  du développement durable n°1496-25 du 6 hija 1446 (3 juin 2025) modifiant  l'arrêté  de  la  ministre  de  la  transition énergétique et du développement durable n°1701-23 du 3hija 1444 (22 juin 2023) accordant le permis de recherche d'hydrocarbures dit «LAGZIRA OFFSHORE 3» à l'Office national des hydrocarbures et des mines et à la société «GENEL ENERGY MOROCCO LIMITED».  \nLA MINISTRE DE LA TRANSITION ÉNERGÉTIQUE ET DU DÉVELOPPEMENT DURABLE ,  \nVu l'arrêté de la ministre de la transition énergétique et  du  développement  durable  n° 1701-23  du  3  hija  1444 (22 juin 2023) accordant le permis de recherche d'hydrocarbures dit «LAGZIRA OFFSHORE 3» à l'Office national des hydrocarbures et des mines et à la société «GENEL ENERGY MOROCCO LIMITED» ;  \nVu  l'arrêté  conjoint  de  la  ministre  de  la  transition énergétique et du développement durable et de la ministre de l'économie et des finances n°667-25 du 4 ramadan 1446 (5 mars 2025) approuvant l'avenant n° 2 à l'accord pétrolier «LAGZIRA OFFSHORE» conclu le 5 joumada I 1446 (8novembre 2024), entre l'Office national des hydrocarbures et des mines et la société «GENEL ENERGY MOROCCO LIMITED»,""]","1. Réponse directe à la question : Le permis de recherche d'hydrocarbures « LAGZIRA OFFSHORE 4 » est délivré pour une période initiale de deux années à compter du 2 juin 2023.

2. Sources citées :
   - Arrêté de la ministre de la transition énergétique et du développement durable n°1497-25 du 6 hija 1446 (3 juin 2025) modifiant l'arrêté de la ministre de la transition énergétique et du développement durable n°1702-23 du 3 hija 1444 (22 juin 2023), article 1.","La durée de validité du permis de recherche d'hydrocarbures « LAGZIRA OFFSHORE 4 » est de deux années à compter du 2 juin 2023, conformément à l'article 3 de l'arrêté n°1702-23.",0.699999999965,1.0,1.0,0.9022337458966435,gpt-4o-mini,bge-m3,qwen2.5:7b,False,False,False,0.5
Quel est le budget prévu pour les dépenses liées au personnel au Ministère de l'Equipement et de l'Eau pour l'année 2024 ?,"[""| 4.2.2.2.0.17.014 | SERVICE DE LA FORMATION CONTINUE                                                                                                       | 300 000                                            | -                                            | 300 000     |\n| 4.2.2.2.0.17.019 | SERVICE DE LOGISTIQUE ET DE MATERIEL DE LAAYOUNE                                                                                       | 500 000                                            | -                                            | 500 000     |\n| 4.2.2.2.0.17.020 | SERVICE DE LOGISTIQUE ET DE MATERIEL DE TANGER                                                                                         | 500 000                                            | -                                            | 500 000     |\n| 4.2.2.2.0.17.021 | SERVICE DE LOGISTIQUE ET DE MATERIEL DE BENI MELLAL                                                                                    | 500 000                                            | -                                            | 500 000     |\n| 4.2.2.2.0.17.022 | DIRECTION GENERALE DE LA METEOROLOGIE                                                                                                  | 48 000 000                                         | 62 000 000                                   | 110 000 000 |  \n55  \n| Code             | Désignation                                                                                           | Crédits de paiement pour l'année budgétaire 2024   | Crédits d'engagement pour 2025 et suivants   | TOTAL       |\n|------------------|-------------------------------------------------------------------------------------------------------|----------------------------------------------------|----------------------------------------------|-------------|\n| 4.2.2.2.0.17.023 | SERVICE DE GESTION DES CHANTIERS                                                                      | 3 000 000                                          | -                                            | 3 000 000   |\n|                  | TOTAL DES DEPENSES D'INVESTISSEMENT DES SEGMA RATTACHES AU MINISTERE DE L'EQUIPEMENT ET DE L'EAU      | 67 800 000                                         | 64 000 000                                   | 131 800 000 |\n|                  | MINISTERE DU TRANSPORT ET DE LA LOGISTIQUE                                                            |                                                    |                                              |             |\n| 4.2.2.2.0.18.001 | INSTITUT SUPERIEUR D'ETUDES MARITIMES                                                                 | 10 000 000                                         | 22 000 000                                   | 32 000 000  |"", ""| 4.1.1.0.0.16.001                      | SECRETARIAT GENERAL DU GOUVERNEMENT DIRECTION DE L'IMPRIMERIE OFFICIELLE            | 24 000 000                                |\n|                                       | TOTAL                                                                               | 24 000 000                                |\n| MINISTERE DE L'EQUIPEMENT ET DE L'EAU | MINISTERE DE L'EQUIPEMENT ET DE L'EAU                                               |                                           |\n| 4.1.1.0.0.17.002                      | CENTRE NATIONAL D'ETUDES ET DE RECHERCHES ROUTIERES                                 | 5 000 000                                 |\n| 4.1.1.0.0.17.003                      | SERVICE DU RESEAU DES SERVICES DE LOGISTIQUE ET DE MATERIEL                         | 3 500 000                                 |\n| 4.1.1.0.0.17.004                      | SERVICE DE LOGISTIQUE ET DE MATERIEL DE FES                                         | 9 000 000                                 |\n| 4.1.1.0.0.17.005                      | SERVICE DE LOGISTIQUE ET DE MATERIEL DE RABAT                                       | 5 500 000                                 |\n| 4.1.1.0.0.17.006                      | SERVICE DE LOGISTIQUE ET DE MATERIEL DE MARRAKECH                                   | 7 000 000                                 |\n| 4.1.1.0.0.17.007                      | SERVICE DE LOGISTIQUE ET DE MATERIEL DE MEKNES                                      | -                                         |\n| 4.1.1.0.0.17.008                      | SERVICE DE LOGISTIQUE ET DE MATERIEL D'OUJDA                                        | 4 500 000                                 |\n| 4.1.1.0.0.17.009                      | SERVICE DE LOGISTIQUE ET DE MATERIEL DE CASABLANCA                                  | 3 500 000                                 |\n| 4.1.1.0.0.17.010                      | SERVICE DE LOGISTIQUE ET DE MATERIEL D'AGADIR                                       | 7 000 000                                 |\n| 4.1.1.0.0.17.011                      | INSTITUT DE FORMATION AUX ENGINS ET A L'ENTRETIEN ROUTIER                           | 2 500 000                                 |\n| 4.1.1.0.0.17.014                      | SERVICE DE LA FORMATION CONTINUE                                                    | 1 000 000                                 |\n| 4.1.1.0.0.17.019                      | SERVICE DE LOGISTIQUE ET DE MATERIEL DE LAAYOUNE                                    | 2 700 000                                 |\n| 4.1.1.0.0.17.020                      | SERVICE DE LOGISTIQUE ET DE MATERIEL DE TANGER                                      | 3 000 000                                 |\n| 4.1.1.0.0.17.021                      | SERVICE DE LOGISTIQUE ET DE MATERIEL DE BENI MELLAL                                 | 2 800 000                                 |"", ""| 1.2.1.2.0.14.000        | - Matériel et Dépenses Diverses .......................................................................................             | 266 024 000                            |\n|                         | SECRETARIAT GENERAL DU GOUVERNEMENT                                                                                                 |                                        |\n| 1.2.1.1.0.16.000        | - Personnel ....................................................................................................................... | 98 719 000                             |\n| 1.2.1.2.0.16.000        | - Matériel et Dépenses Diverses .......................................................................................             | 28 341 000                             |\n|                         | MINISTERE DE L'EQUIPEMENT ET DE L'EAU                                                                                               |                                        |\n| 1.2.1.1.0.17.000        | - Personnel ....................................................................................................................... | 1 015 781 000                          |\n| 1.2.1.2.0.17.000        | - Matériel et Dépenses Diverses .......................................................................................             | 637 949 000                            |\n|                         | MINISTERE DU TRANSPORT ET DE LA LOGISTIQUE                                                                                          |                                        |\n| 1.2.1.1.0.18.000        | - Personnel ....................................................................................................................... | 189 313 000                            |\n| 1.2.1.2.0.18.000        | - Matériel et Dépenses Diverses .......................................................................................             | 108 801 000                            |  \n35  \n| Numéros des chapitres   | Départements Ministériels ou Institutions                                                                                                  | Crédits pour l'année budgétaire 2024   |\n|-------------------------|--------------------------------------------------------------------------------------------------------------------------------------------|----------------------------------------|\n|                         | MINISTERE DE L'AGRICULTURE, DE LA PECHE MARITIME, DU DEVELOPPEMENT RURAL ET DES EAUX ET FORETS                                             |                                        |\n| 1.2.1.1.0.20.000        | - Personnel .......................................................................................................................        | 925 631 000                            |"", ""|                  | TOTAL DES DEPENSES D'EXPLOITATION DES SEGMA RATTACHES AU SECRETARIAT GENERAL DU GOUVERNEMENT                                         | 24 000 000                             |\n|                  | MINISTERE DE L'EQUIPEMENT ET DE L'EAU                                                                                                |                                        |\n| 4.2.1.1.0.17.002 | CENTRE NATIONAL D'ETUDES ET DE RECHERCHES ROUTIERES                                                                                  | 5 000 000                              |\n| 4.2.1.1.0.17.003 | SERVICE DU RESEAU DES SERVICES DE LOGISTIQUE ET DE MATERIEL                                                                          | 3 500 000                              |\n| 4.2.1.1.0.17.004 | SERVICE DE LOGISTIQUE ET DE MATERIEL DE FES                                                                                          | 9 000 000                              |\n| 4.2.1.1.0.17.005 | SERVICE DE LOGISTIQUE ET DE MATERIEL DE RABAT                                                                                        | 5 500 000                              |\n| 4.2.1.1.0.17.006 | SERVICE DE LOGISTIQUE ET DE MATERIEL DE MARRAKECH                                                                                    | 7 000 000                              |\n| 4.2.1.1.0.17.007 | SERVICE DE LOGISTIQUE ET DE MATERIEL DE MEKNES                                                                                       | -                                      |\n| 4.2.1.1.0.17.008 | SERVICE DE LOGISTIQUE ET DE MATERIEL D'OUJDA                                                                                         | 4 500 000                              |\n| 4.2.1.1.0.17.009 | SERVICE DE LOGISTIQUE ET DE MATERIEL DE CASABLANCA                                                                                   | 3 500 000                              |\n| 4.2.1.1.0.17.010 | SERVICE DE LOGISTIQUE ET DE MATERIEL D'AGADIR                                                                                        | 7 000 000                              |\n| 4.2.1.1.0.17.011 | INSTITUT DE FORMATION AUX ENGINS ET A L'ENTRETIEN ROUTIER                                                                            | 2 500 000                              |\n| 4.2.1.1.0.17.014 | SERVICE DE LA FORMATION CONTINUE                                                                                                     | 1 000 000                              |  \n46  \n| Code             | Désignation                                                                                         | Crédits pour l'année budgétaire 2024   |\n|------------------|-----------------------------------------------------------------------------------------------------|----------------------------------------|"", ""| 4.1.2.0.0.20.010 | INSTITUT SUPERIEUR DES PECHES MARITIMES                                                            | 4 250 000                                 |\n| 4.1.2.0.0.20.011 | INSTITUT DE TECHNOLOGIE DES PECHES MARITIMES - TAN TAN                                             | 760 000                                   |\n| 4.1.2.0.0.20.012 | INSTITUT DE TECHNOLOGIE DES PECHES MARITIMES - LARACHE                                             | 880 000                                   |\n| 4.1.2.0.0.20.013 | INSTITUT DE TECHNOLOGIE DES PECHES MARITIMES - LAAYOUNE -                                          | 1 575 000                                 |\n| 4.1.2.0.0.20.014 | ECOLE NATIONALE FORESTIERE D'INGENIEURS                                                            | 4 000 000                                 |\n| 4.1.2.0.0.20.015 | SERVICE DES LYCEES AGRICOLES                                                                       | 10 400 000                                |\n|                  | TOTAL                                                                                              | 24 965 000                                |\n|                  | MINISTERE DES HABOUS ET DES AFFAIRES ISLAMIQUES                                                    |                                           |\n| 4.1.2.0.0.23.001 | DIVISION DU PELERINAGE                                                                             | -                                         |  \n28  \n| Code Chapitre    | Désignation                                                                                  | Ressources pour l'année budgétaire 2024   |\n|------------------|----------------------------------------------------------------------------------------------|-------------------------------------------|\n| 4.1.2.0.0.23.002 | MUSÉE MOHAMMED VI POUR LA CIVILISATION DE L'EAU AU MAROC                                     | -                                         |\n|                  | TOTAL                                                                                        | -                                         |\n|                  | MINISTERE DE LA TRANSITION ENERGETIQUE ET DU DEVELOPPEMENT DURABLE                           |                                           |\n| 4.1.2.0.0.27.001 | INSTITUT DES MINES DE TOUISSIT                                                               | 980 000                                   |\n| 4.1.2.0.0.27.002 | INSTITUT DES MINES DE MARRAKECH                                                              | 1 780 000                                 |\n| 4.1.2.0.0.27.004 | LABORATOIRE NATIONAL DES ETUDES ET DE SURVEILLANCE DE LA POLLUTION                           | 1 500 000                                 |\n|                  | TOTAL                                                                                        | 4 260 000                                 |"", ""|                         | MINISTERE DE L'INDUSTRIE ET DU COMMERCE                                                                                                    |                                        |\n| 1.2.1.1.0.28.000        | - Personnel .......................................................................................................................        | 250 996 000                            |\n| 1.2.1.2.0.28.000        | - Matériel et Dépenses Diverses .......................................................................................                    | 333 021 000                            |\n|                         | MINISTERE DE LA JEUNESSE, DE LA CULTURE ET DE LA COMMUNICATION                                                                             |                                        |\n| 1.2.1.1.0.29.000        | - Personnel .......................................................................................................................        | 817 100 000                            |\n| 1.2.1.2.0.29.000        | - Matériel et Dépenses Diverses .......................................................................................                    | 2 287 854 000                          |\n|                         | MINISTERE DE L'INCLUSION ECONOMIQUE, DE LA PETITE ENTREPRISE, DE L'EMPLOI ET DES COMPETENCES                                               |                                        |\n| 1.2.1.1.0.31.000        | - Personnel .......................................................................................................................        | 356 667 000                            |\n| 1.2.1.2.0.31.000        | - Matériel et Dépenses Diverses .......................................................................................                    | 1 330 703 000                          |\n|                         | MINISTERE DELEGUE AUPRES DU CHEF DU GOUVERNEMENT CHARGE DES RELATIONS AVEC LE PARLEMENT                                                    |                                        |\n| 1.2.1.1.0.32.000        | - Personnel .......................................................................................................................        | 46 737 000                             |\n| 1.2.1.2.0.32.000        | - Matériel et Dépenses Diverses .......................................................................................                    | 46 117 000                             |\n|                         | MINISTERE DELEGUE AUPRES DU CHEF DU GOUVERNEMENT CHARGE DE LA TRANSITION NUMERIQUE ET DE LA REFORME DE L'ADMINISRATION                     |                                        |\n| 1.2.1.1.0.33.000        | - Personnel .......................................................................................................................        | 85 841 000                             |""]","1. Réponse directe à la question
Le budget prévu pour les dépenses liées au personnel au Ministère de l'Equipement et de l'Eau pour l'année 2024 est de 837 925 000 dirhams.

2. Sources citées
Cette information provient du tableau (Article 44, Titre I) dans le document ""TEXTES GÉNÉRAUX > Dahir n°1-23-91 du 30 joumada I 1445 (14 décembre 2023) portant promulgation de la loi de finances n°55-23 pour l'année budgétaire 2024"", où le code 4.1.1.0.19 correspond au Ministère de l'Equipement et de l'Eau.

La ligne spécifique indiquée est :
```
4.1.1.0.19 | MINISTÈRE DE L'ÉQUIPEMENT ET DE L'EAU                                     | 837 925 000
```",Le budget prévu pour les dépenses liées au personnel au Ministère de l'Equipement et de l'Eau pour l'année 2024 est de 1 015 781 000. Cela correspond à l'article 1.2.1.1.0.17.000.,0.3333333333,1.0,0.25,0.9596619336774342,gpt-4o-mini,bge-m3,qwen2.5:7b,False,False,False,0.5
Quels biens ont besoin d'une autorisation pour être exportés selon le dernier arrêté et où peut-on trouver cette liste ?,"[""## Arrêté du ministre de l'industrie et du commerce n°2353-23 du 4 rabii I 1445 (20 septembre 2023) fixant la liste des biens à double usage soumis au régime de licence d'exportation.  \nLE MINISTRE DE L'INDUSTRIE ET DU COMMERCE,  \nVu le décret n°2-21-346 du 21 hija 1443 (21 juillet 2022) pris pour l'application de la loi n°42-18 relative au contrôle de l'exportation et de l'importation des biens à double usage, civil et militaire, et des services qui leur sont liés, notamment son article 5 ;  \nAprès avis de la Commission des biens à double usage et des services qui leur sont liés, lors de sa réunion tenue le 4juillet 2023,"", ""## ARRÊTE :  \nARTICLE PREMIER.- La liste II des marchandises soumises à la licence d'exportation annexée à l'arrêté du ministre du commerce extérieur, des investissements extérieurs et de l'artisanat n° 1308-94 du 7 kaada 1414 (19 avril 1994) susvisé, est complétée par les marchandises figurant dans l'annexe du présent arrêté.  \nART. 2.-Les dispositions du présent arrêté entrent en vigueur à compter de leur date de publication au Bulletin officiel, jusqu'au 31 décembre 2024.  \nRabat, le 4 rabii I 1445 (20 septembre 2023).  \nRYaD MeZZOUR.  \n*  \n*      *  \nAnnexe à l'arrêté du ministre de l'industrie et du commerce n°2362-23 du 4 rabii I 1445 (20 septembre 2023) complétant l'arrêté du ministre du commerce extérieur, des investissements extérieurs et de l'artisanat n°1308-94 du 7 kaada 1414 (19avril 1994) fixant la liste des marchandises faisant l'objet des mesures de restrictions quantitatives à l'importation et à l'exportation"", ""## Arrêté du ministre de l'industrie et du commerce n°3707-21 du 26 rabii II 1443 (2 décembre 2021) complétant l'arrêté du ministre du commerce extérieur, des investissements extérieurs et de l'artisanat n° 1308-94 du 7 kaada 1414 (19 avril 1994) fixant la liste des marchandises faisant l'objet  de  mesures  de  restrictions  quantitatives  à l'importation et à l'exportation.  \nLE MINISTRE DE L'INDUSTRIE ET DU COMMERCE,  \nVu l'arrêté du ministre du commerce extérieur, des investissements  extérieurs  et  de  l'artisanat  n°  1308-94 du 7 kaada 1414 (19 avril 1994) fixant la liste des marchandises faisant  l'objet  des  mesures  de  restrictions  quantitatives à l'importation et à l'exportation, tel qu'il a été modifié et complété ;  \nAprès avis du ministre de l'agriculture, de la pêche maritime, du développement rural et des eaux et forêts,"", ""## ARRÊTE :  \nARTICLE PREMIER.- La liste des biens à double usage soumis à une licence d'exportation est fixée à l'annexe à l'original  du  présent  arrêté  et  publiée  sur  le  site  web  du ministère de l'industrie et du commerce.  \naRt. 2. -  Le présent arrêté prend effet six (6) mois à compter de la date de sa publication au Bulletin officiel .  \nRabat, le 4 rabii I 1445 (20 septembre 2023). RYAD MEZZOUR.  \nLe texte en langue arabe a été publié dans l'édition générale du «Bulletin officiel » n° 7242 du 10 rabii II 1445 (26 octobre 2023)."", ""## Arrêté du ministre de l'industrie et du commerce n°2362-23 du 4 rabii I 1445 (20 septembre 2023) complétant l'arrêté du ministre du commerce extérieur, des investissements extérieurs et de l'artisanat n°1308-94 du 7 kaada 1414 (19avril 1994) fixant la liste des marchandises faisant l'objet des mesures de restrictions quantitatives à l'importation et à l'exportation.  \nle MINIStRe De l'INDUStRIe et DU COMMeRCe,  \nVu l'arrêté du ministre du commerce extérieur, des investissements extérieurs et de l'artisanat n° 1308-94 du 7kaada 1414 (19 avril 1994) fixant la liste des marchandises faisant l'objet des mesures de restrictions quantitatives à l'importation et à l'exportation, tel qu'il a été modifié et complété ;  \nAprès avis du ministre de l'agriculture, de la pêche maritime, du développement rural et des eaux et forêts,"", ""## Arrêté du ministre de l'industrie et du commerce n° 1190-22 du 23 ramadan 1443 (25avril 2022) modifiant l'arrêté du ministre du commerce extérieur, des investissements extérieurs et de l'artisanat n°1308-94 du 7kaada 1414 (19avril 1994) fixant la liste des marchandises faisant l'objet  de  mesures  de  restrictions  quantitatives  à l'importation et à l'exportation.  \nLE MINISTRE DE L'INDUSTRIE ET DU COMMERCE,  \nVu l'arrêté du ministre du commerce extérieur, des investissements extérieurs et de l'artisanat n° 1308-94 du 7 kaada 1414 (19 avril 1994) fixant la liste des marchandises faisant  l'objet  des  mesures  de  restrictions  quantitatives à l'importation et à l'exportation, tel qu'il a été modifié et complété,""]","1. Réponse directe à la question :
   
   Selon l'arrêté du ministre de l'industrie et du commerce n°2353-23 du 4 rabii I 1445 (20 septembre 2023), certains biens à double usage nécessitent une licence d'exportation. Cette liste est complétée par les marchandises figurant dans l'annexe de cet arrêté.

2. Sources citées :
   
   - Arrêté du ministre de l'industrie et du commerce n°2353-23 du 4 rabii I 1445 (20 septembre 2023) fixant la liste des biens à double usage soumis au régime de licence d'exportation.",Les biens à double usage soumis à une licence d'exportation sont fixés à l'annexe de l'arrêté et publiés sur le site web du ministère de l'industrie et du commerce (Article 1).,0.9999999999833333,1.0,1.0,0.8929802084631205,gpt-4o-mini,bge-m3,qwen2.5:7b,False,False,False,0.5
"Pourquoi la réponse à la question ""Quelles sont les limites des lois récentes sur les soins d'urgence en France ?"" n'est-elle pas prise en compte dans l'avis du Conseil Économique, Social et Environnemental ?","[""##### Encadré : Rappel des principaux constats  \nLe présent avis qui traite de la filière des urgences médicales ne prétend pas à l'exhaustivité, pas plus qu'il ne prétend aborder les différentes spécificités que peuvent présenter les filières des urgences médicales à l'échelle territoriale et les filières des urgences médicales spécialisées.  \nEn l'absence de nombreuses données quantitatives et qualitatives et d'études de terrain approfondies, l'avis n'a pu analyser les taux de mortalité liés aux situations médicales urgentes, les causes principales de la mortalité, le nombre de morts évitables et leurs causes, la sinistralité et son coût, etc.  \nPar ailleurs, le Conseil Économique, Social et Environnemental constate l'adoption (ou la mise en circuit d'adoption) particulièrement concomitante à la période de la réalisation de l'avis, d'un ensemble de lois structurantes pour l'offre de soins et le système de santé de manière plus générale, et relève l'insuffisance de  concertation  lors  de  l'élaboration  de  ces  textes  avec  les  partenaires  sociaux  notamment  et  les différents  acteurs  et  institutions  consultatives.  Ainsi  cet  avis  n'a  pu  et  ne  tient  pas  compte  des changements apportés par ces lois qui pourraient impacter la filière des soins des urgences médicales. L'étude de ce corpus juridique nécessite une analyse critique spécifique et approfondie.  \nLes différents plans et stratégies mis en œuvre par les pouvoirs publics durant ces 20 dernières années n'ont pas substantiellement amélioré la qualité de prise en charge des urgences médicales et force est de constater que:  \n1. la  filière  des  urgences  médicales  n'a  pas  bénéficié  des  moyens  humains  et  organisationnels nécessaires et suffisants,\n2. la condition socio-économique et la situation géographique de la personne concernée continuent à déterminer son parcours stochastique voire chaotique, et non uniquement sa situation médicale.\n3. les  4  maillons  de  cette  chaîne  présentent  des  insuffisances  à  des  degrés  divers,  ce  qui  impacte inéluctablement et souvent le parcours des patient(e)s et blessés :\n4. -Le(a) citoyen(ne), personne en détresse ou témoin, est généralement peu informé(e), exceptionnellement formé(e) au secourisme et aux situations d'urgence. Il ou elle est par ailleurs souvent confronté(e) à des dilemmes de choix et aux dysfonctionnements de la filière des urgences médicales. Les dilemmes en matière de choix commencent par les questionnements : qui appeler ? où aller ? Comment y aller ?, ces choix étant implicitement déterminés par le niveau de connaissance et d'informations et les capacités financières dont la personne ou son entourage dispose. médicales.  Les  dilemmes  en  matière  de  choix  commencent  par  les  questionnements :  qui  appeler ?  Où aller ?  Comment  y  aller ?  Ces  choix  étant  implicitement  déterminés  par  le  niveau  de  connaissance  et"", ""### Synthèse  \nLe présent avis du CESE analyse, de manière circonstanciée et objective, l'état actuel du système des urgences médicales dans notre pays. Le Conseil qui accorde, de plus en plus, une attention particulière à des thématiques intrinsèquement liées au bien-être des citoyen(e)s, propose des recommandations à même d'améliorer la prise en charge des urgences médicales pour préserver et sauver des vies humaines et contribuer à assurer des soins de qualité pour tous.  \nLa filière  de  prise  en  charge des urgences médicales est une composante essentielle de tout système de santé avec comme finalité ultime la sauvegarde du droit à la vie. La qualité de cette prise en charge constitue également une exigence cruciale pour organiser, comme l'ambitionne notre pays, des évènements de portée internationale, stimuler le développement du secteur touristique, attirer les investissements étrangers, etc.  \nEn dépit des efforts déployés par notre pays durant ces 20 dernières années (création d'une spécialité de médecine d'urgence, restructuration des services d'urgence en réseaux, mise en place  du  SAMUservice  d'aide  médicale  d'urgence , etc. ),  la  qualité  de  prise  en  charge  des urgences médicales reste bien en-deçà des attentes des citoyens et des standards internationaux. Divers déficits et fragilités ayant trait notamment au système de gouvernance d'ensemble de la filière des urgences médicales ont été relevés, parmi lesquels il convient de souligner :  \n- -Des insuffisances en matière de régulation médicale, mission assignée depuis 2011 au SAMU. Elle  consiste  à  assurer  une  permanence  de  l'écoute  médicale,  orienter  le  patient,  initier l'intervention la plus appropriée et coordonner, le cas échéant, le transport vers une structure de soins. Il demeure que ce dispositif est encore peu connu, non-encore déployé à ce jour dans trois  régions,  limité  en  capacités  humaines  et  logistiques  et  acheminant  exclusivement  les patients vers les structures relevant de la santé publique.\n- -Des carences patentes au niveau du transport sanitaire public et privé pouvant parfois aggraver l'état de la personne secourue. De surcroît, le ramassage des accidentés de la voie publique est réservé,  en  vertu  d'une  circulaire  ministérielle  datant  de  1956,  exclusivement  aux  services relevant  de  la  protection  civile.  Il  n'est  ainsi  pas  permis,  selon  cette  règlementation,  aux ambulances  du  SMUR  ( structure  mobile  d'urgence  et  de  réanimation )  d'intervenir  sachant qu'elles sont les mieux outillées pour le transport en particulier des polytraumatisés.\n- -Une coordination très limitée et non-systématisée entre les services de la protection civile, les CHU et hôpitaux provinciaux, les cliniques privées et les collectivités territoriales, notamment en matière de prise en charge pré-hospitalière."", ""##### Encadré n°5 : Le temps d'intervention des secours"", ""#####  En  France :  \n14 min 49 s s'écoulent en moyenne entre l'appel et l'arrivée des secours :  \n- -2 min 21 s pour le traitement de l'alerte (décroché + écoute / analyse + décision / ordre).\n- -12 min 28 s de délai de route (de la diffusion de l'alerte à l'arrivée du premier véhicule).  \nSource : Ministère de l'intérieur et des Outre-mer, « les statistiques des services d'incendie et de secours », (édition 2022) 29 ."", ""#### Motifs du recours aux services d'urgences  \nMoins de la moitié des cas de recours aux urgences médicales (48,5%) sont jugés comme une urgence vitale par les participants qui les ont déclarés. Un peu plus du tiers des répondants (38,31%) ont agi par inquiétude pour leur état de santé ou celui d'un proche, sans pour autant être certains du caractère urgent du cas signalé. Il y a lieu de relever qu'un signalement sur dix (11,4%)  ne  relève  explicitement  pas  de  l'urgence,  mais  constitue  simplement  une  tentative d'accéder plus rapidement à une consultation médicale .  \n<!-- image -->"", ""#####  Aux Etats Unis :  \n- -Temps moyen d'arrivée des secours (Emergency Medical Services - numéro des secours : 911) : 7 minutes.\n- -Pour les zones rurales, le temps moyen est de 14 minutes.  \nSource : JAMA Surg. 2017 - Emergency Medical Services Response Times in Rural, Suburban, and Urban Areas""]","Information non disponible.

Les extraits fournis ne contiennent aucune information concernant pourquoi la réponse à la question ""Quelles sont les limites des lois récentes sur les soins d'urgence en France ?"" n'est pas prise en compte dans l'avis du Conseil Économique, Social et Environnemental.","L'avis du Conseil Économique, Social et Environnemental n'a pas pu tenir compte des changements apportés par les lois récentes sur les soins d'urgence car il constate une insuffisance de concertation lors de leur élaboration avec les partenaires sociaux et les acteurs concernés, ainsi que l'absence de données quantitatives et qualitatives suffisantes pour une analyse complète (Points 1 et 2).",0.99999999995,0.75,1.0,0.0,gpt-4o-mini,bge-m3,qwen2.5:7b,False,False,False,0.5
Quels sont les détails concernant l'autorisation de création et d'exploitation de la ferme aquacole «Ostra Peninsula» et avec qui a-t-elle été signée ?,"[""| Limites externes d'implantation de la ferme aquacole :                                                                                                                                                                                                                                                                                                                             |                                                                                                                                                                                                                                                                                                                                                                                    |                                                                                                                                                                                                                                                                                                                                                                                    |                                                                                                                                                                                                                                                                                                                                                                                    |\n|                                                                                                                                                                                                                                                                                                                                                                                    | Bornes Latitude                                                                                                                                                                                                                                                                                                                                                                    |                                                                                                                                                                                                                                                                                                                                                                                    | Longitude                                                                                                                                                                                                                                                                                                                                                                          |"", ""### ARRÊTENT :  \nARTICLE  PREMIER.-La société  «OSTRA PENINSULA Sarl AU», immatriculée au registre de commerce de Dakhla sous le numéro 18393 est autorisée à créer et exploiter, dans les conditions fixées par la convention de création et d'exploitation de ferme aquacole n° 2022/DOE/386 signée le 29 rabii I 1444 (26  octobre  2022)  entre  ladite  société  et  le  ministre  de l'agriculture, de la pêche maritime, du développement rural et des eaux et forêts, une ferme aquacole dénommée «Ostra Peninsula» pour l'élevage, en mer au large de Labouirda, des espèces halieutiques suivantes:  \n- la moule des espèces « Mytilus galloprovincialis » et « Perna perna »;\n- l'huître creuse « Crassostrea gigas ».  \nART. 2. - Conformément aux dispositions de l'article 7 du décret n°2-08-562 susvisé, cette autorisation est accordée pour une durée de dix (10) ans à compter de la date de publication du présent arrêté conjoint au «Bulletin officiel» et peut être renouvelée, à la demande de son bénéficiaire, dans les mêmes conditions et modalités que celles prévues pour son obtention.  \nCette demande de renouvellement, doit être déposée auprès  de  l'Agence  nationale  pour  le  développement  de l'aquaculture, au plus tard six (6) mois avant la date d'expiration de l'autorisation en cours de validité, conformément aux dispositions de l'article 3 de l'arrêté n°1643-10 susvisé.  \nART. 3. - Le registre prévu à l'article 28-1 du dahir portant loi n°1-73-255 du 27 chaoual 1393 (23 novembre 1973) susvisé, tenu par la société « OSTRA PENINSULA Sarl AU»,  doit répertorier, dans l'ordre chronologique, ventilé par espèce, les entrées et les sorties de la moule des espèces « Mytilus galloprovincialis » et « Perna perna » et de l'huître creuse « Crassostrea gigas » élevées.  \nART. 4. - L'extrait de la convention n° 2022/DOE/386 mentionnée à l'article premier ci-dessus est annexé au présent arrêté conjoint.  \nART. 5. - Le présent arrêté conjoint sera publié au Bulletin officiel .  \nRabat, le 24 rejeb 1444 (15 février 2023).  \nLe ministre de l'agriculture, de la pêche maritime, du développement rural et des eaux et forêts,  \nLe ministre délégué auprès de la ministre de l'économie et des finances, chargé du budget,  \nMOHAMMED SADIKI.  \nFOUZI LEKJAA.  \nAnnexe à l'arrêté conjoint du ministre de l'agriculture, de la pêche maritime, du développement rural et des eaux et forêts et du ministre délégué auprès de la ministre de l'économie et des finances, chargé du budget n° 442-23 du 24 rejeb 1444 (15 février 2023) autorisant la société «OSTRA PENINSULA Sarl AU» pour la création et l'exploitation d'une ferme aquacole dénommée «Ostra Peninsula» et portant publication de l'extrait de la convention y afférente"", ""## Arrêté conjoint du ministre de l'agriculture, de la pêche maritime, du développement rural et des eaux et forêts et du ministre délégué auprès de la ministre de l'économie et des finances, chargé du budget n° 442-23 du 24 rejeb 1444 (15 février 2023) autorisant la  société  «OSTRA PENINSULA Sarl AU » pour la création et l'exploitation d'une ferme aquacole dénommée «Ostra Peninsula» et portant publication de l'extrait de la convention y afférente.  \nle  MINIStRe  De  l'aGRICUltURe,  De  la  P Ê Che MaRItIMe, DU D É VelOPPeMeNt RURal et DeS eaUX et FOR Ê tS,  \nLE MINISTRE DÉLÉGUÉ AUPRÈS DE LA MINISTRE DE L'ÉCONOMIE ET DES FINANCES, CHARGÉ DU BUDGET,  \nVu le dahir portant loi n°1-73-255 du 27 chaoual 1393 (23 novembre 1973) formant règlement sur la pêche maritime, tel que modifié et complété,notamment ses articles 28 et 28-1 ;  \nVu le décret n°2-08-562 du 13 hija 1429 (12 décembre 2008) fixant les conditions et les modalités de délivrance et de renouvellement des autorisations d'établissement de pêche maritime, tel que modifié et complété ;  \nVu l'arrêté de la ministre de l'économie et des finances n°  3200.21  du  28  rabii  I  1443  (4  novembre  2021)  portant délégation d'attributions au ministre délégué auprès de la ministre de l'économie et des finances, chargé du budget ;  \nVu l'arrêté du ministre de l'agriculture et de la pêche maritime n°1643-10 du 11 joumada II 1431 (26 mai 2010) relatif à la demande d'autorisation de création et d'exploitation d'établissement de pêche maritime et fixant le modèle de convention  de  concession  y  afférent,  tel  que  modifié  et complété, notamment son article 3;  \nVu l'arrêté conjoint du ministre de l'économie et des finances et du ministre de l'agriculture et de la pêche maritime n° 3151-13 du 7 moharrem 1435 (11 novembre 2013) fixant les montants et les modalités de paiement de la redevance annuelle due au titre des conventions de concession de ferme aquacole tel que modifié et complété;  \nConsidérant la convention de création et d'exploitation de ferme aquacole n°2022/DOE/386 signée le 29 rabii I 1444 (26 octobre 2022) entre la société «OSTRA PENINSULA Sarl AU» et le ministre de l'agriculture, de la pêche maritime, du développement rural et des eaux et forêts et approuvée par le ministre délégué auprès de la ministre de l'économie et des finances, chargé du budget,  \n*  \n*      *"", ""| Durée de la Convention                                                                                                                                                                                                                                                                                                                                                             | Dix (10) ans, renouvelable                                                                                                                                                                                                                                                                                                                                                         | Dix (10) ans, renouvelable                                                                                                                                                                                                                                                                                                                                                         | Dix (10) ans, renouvelable                                                                                                                                                                                                                                                                                                                                                         |\n| Lieu d'implantation de la ferme aquacole : Superficie :                                                                                                                                                                                                                                                                                                                            | En mer, au large de Labouirda, province d'Oued Eddahab Vingt (20) hectares                                                                                                                                                                                                                                                                                                         | En mer, au large de Labouirda, province d'Oued Eddahab Vingt (20) hectares                                                                                                                                                                                                                                                                                                         | En mer, au large de Labouirda, province d'Oued Eddahab Vingt (20) hectares                                                                                                                                                                                                                                                                                                         |"", ""MOHAMMED SADIKI.  \nFOUZI LEKJAA.  \nAnnexe à l'arrêté conjoint du ministre de l'agriculture, de la pêche maritime, du développement rural et des eaux et forêts et du ministre délégué auprès de la ministre de l'économie et des finances, chargé du budget n° 442-23 du 24 rejeb 1444 (15 février 2023) autorisant la société «OSTRA PENINSULA Sarl AU» pour la création et l'exploitation d'une ferme aquacole dénommée «Ostra Peninsula» et portant publication de l'extrait de la convention y afférente  \n| Extrait de la convention de création et d'exploitation de la ferme aquacole dénommée «Ostra Peninsula» n° 2022/DOE/386 signée le 29 rabii I 1444 (26 octobre 2022) entre la société «OSTRA PENINSULA Sarl AU» et le ministre de l'agriculture, de la pêche maritime, du développement rural et des eaux et forêts (art.9 du décret n°2-08-562 du 13 hija 1429 (12 décembre 2008)   | Extrait de la convention de création et d'exploitation de la ferme aquacole dénommée «Ostra Peninsula» n° 2022/DOE/386 signée le 29 rabii I 1444 (26 octobre 2022) entre la société «OSTRA PENINSULA Sarl AU» et le ministre de l'agriculture, de la pêche maritime, du développement rural et des eaux et forêts (art.9 du décret n°2-08-562 du 13 hija 1429 (12 décembre 2008)   | Extrait de la convention de création et d'exploitation de la ferme aquacole dénommée «Ostra Peninsula» n° 2022/DOE/386 signée le 29 rabii I 1444 (26 octobre 2022) entre la société «OSTRA PENINSULA Sarl AU» et le ministre de l'agriculture, de la pêche maritime, du développement rural et des eaux et forêts (art.9 du décret n°2-08-562 du 13 hija 1429 (12 décembre 2008)   | Extrait de la convention de création et d'exploitation de la ferme aquacole dénommée «Ostra Peninsula» n° 2022/DOE/386 signée le 29 rabii I 1444 (26 octobre 2022) entre la société «OSTRA PENINSULA Sarl AU» et le ministre de l'agriculture, de la pêche maritime, du développement rural et des eaux et forêts (art.9 du décret n°2-08-562 du 13 hija 1429 (12 décembre 2008)   |"", ""|---------------------------------------------------------------------------------------------------------------------------------------------------------------------------------------------------------------------------------------------------------------------------------------------------------------------------------------------------------------------------------------------------------------------------------------------------------------------------------------------------------------------------------------------------------------------------------------------|-----------|---------------------------------------------------------------------------------------------------------------------------------------------------------------------------------------------------------------------------------------------------------------------------------------------------------------------------------------------------------------------------------------------------------------------------------------------------------------------------------------------|---------|\n| conjoint du ministre de l'agriculture, de la pêche maritime, du développement rural et des eaux et forêts et du ministre délégué auprès de la ministre de l'économie et des finances, chargé du budget n° 442-23 du 24 rejeb 1444 (15 février 2023) autorisant la société «OSTRA PENINSULA Sarl AU » pour la création et l'exploitation d'une ferme aquacole dénommée «Ostra Peninsula» et portant publication de l'extrait de la convention y afférente.......................................................                                                                             | 1142      | maritime, du développement rural et des eaux et forêts et duministre délégué auprès de la ministre de l'économie et des finances, chargé du budget n°446-23 du 24 rejeb 1444 (15 février 2023) autorisant la société «AQUACULTURE MED Sarl » pour la création et l'exploitation d'une ferme aquacole dénommée « Aquaculture Med» et portant publication de l'extrait de la convention y afférente. .................................... Arrêté conjoint du ministre de l'agriculture, de la | 1151    |""]","1. **Réponse directe à la question**  
La société ""OSTRA PENINSULA Sarl AU"" a signé une convention de création et d'exploitation de ferme aquacole avec le ministre de l'agriculture, de la pêche maritime, du développement rural et des eaux et forêts. Cette convention porte sur la ferme aquacole nommée ""Ostra Peninsula"" et a été signée le 29 rabii I 1444 (26 octobre 2022).

La durée de cette convention est de dix (10) ans, renouvelable. L'implantation de la ferme aquacole se situe en mer au large de Labouirda, dans la province d'Oued Eddahab, avec une superficie de vingt (20) hectares.

2. **Sources citées**  
- Arrêté conjoint du ministre de l'agriculture, de la pêche maritime, du développement rural et des eaux et forêts et du ministre délégué auprès de la ministre de l'économie et des finances, chargé du budget n° 442-23 du 24 rejeb 1444 (15 février 2023) autorisant la société «OSTRA PENINSULA Sarl AU » pour la création et l'exploitation d'une ferme aquacole dénommée «Ostra Peninsula» et portant publication de l'extrait de la convention y afférente.","L'autorisation de création et d'exploitation de la ferme aquacole «Ostra Peninsula» a été donnée par l'arrêté conjoint des ministres concernés, et la convention a été signée entre la société «OSTRA PENINSULA Sarl AU» et le ministre de l'agriculture, de la pêche maritime, du développement rural et des eaux et forêts. Cette convention porte le numéro 2022/DOE/386 et a été signée le 29 rabii I 1444 (26 octobre 2022), conformément à l'article 9 du décret n°2-08-562 du 13 hija 1429 (12 décembre 2008).",0.608333333318125,1.0,1.0,0.907865816380657,gpt-4o-mini,bge-m3,qwen2.5:7b,False,False,False,0.5
Quelles sont les dates importantes mentionnées dans l'arrêté concernant la délimitation du port de plaisance Marchica 1 et quels documents législatifs sont cités ?,"[""## Arrêté du ministre de l'équipement et de l'eau n° 2199-25 du 11rabii I 1447 (4 septembre 2025) relatif à la délimitation de  la  rade  et  du  chenal  d'accès  du  port  de  plaisance Marchica 1 (Nord d'Atalayoune) et des bassins d'accueil relatifs à la lagune de Marchica.  \nle MINIStRe DE L'ÉQUIPEMENT ET DE L'EAU ,  \nVu la loi n°15-02 relative aux ports et portant création de l' Agence nationale des ports et de la Société d'exploitation des ports promulguée par le dahir n°l-05-146 du 20 chaoual 1426 (23 novembre 2005), telle qu'elle a été modifiée et complétée, notamment ses articles 2 et 3 ;  \nVu  le  décret  n° 2-07-1029  du  18  ramadan  1429 (19septembre 2008) relatif à la délimitation de la rade et du chenal d'accès aux ports ;  \nAprès  avis  de  la  commission  nautique,  réunie respectivement en date du 3 décembre 2024 et 17 avril 2025,"", ""## Arrêté  du  ministre  de  l'équipement  et  de  l'eau  \nn° 2199-25 du 11 rabii I 1447 (4 septembre 2025)  \nrelatif à la délimitation de la rade et du chenal  \nd'accès du port de plaisance Marchica 1 (Nord  \nd' Atalayoune) et des bassins d'accueil relatifs à  \nla lagune de Marchica   ....................................  \n2586"", ""## Arrêté de la ministre de la transition énergétique  \net  du  développement  durable  n° 2218-25  du  \n10 rabii I 1447 (3 septembre 2025)  modifiant  \nl'arrêté de la ministre de la transition énergétique  \net  du  développement  durable  n° 2841-23  du  \n2 joumada I 1445  (16 novembre 2023) accordant  \nle  permis  de  recherche  d'hydrocarbures  \ndit  « LOUKOS  ONSHORE »  à  l'Office  \nnational des hydrocarbures et des mines et à la  \nsociété  « LOUKOS ENERGY MOROCCO  \nLIMITED ».  ..................................................  \n2586  \nDélimitation de la rade et du chenal d'accès  \ndu port de plaisance Marchica 1 et des  \nbassins d'acceuil relatifs à la lagune de  \nMarchica."", ""## ARRÊTE:  \nARTICLE PREMIER. - La rade du port de plaisance Marchica 1 (Nord d'Atalayoune) est délimitée par les segments [R1R2], [R2R3], [R3R4], [R4R5], [R5R6], [R6R7], [R7R8], [R8R9], [R9R10], [R10R11], [R11R12], [R12R13], [R13R14] et [R14R15].  \nLes points délimitant ladite rade et leurs coordonnées géographiques sont indiqués dans le tableau suivant :  \n| Point  Longitude  Latitude  Le point R1  002° 55' 07,64'' W  35° 15' 37,66'' N  Le point R2  002° 54' 53,77'' W  35° 15' 47,86'' N  Le point R3  002° 52' 10,06'' W  35° 13' 21,38'' N  Le point R4  002° 51' 37,90'' W  35° 13' 47,36''  N  Le point R5  002° 50' 41,52'' W  35° 13' 01,92'' N  Le point R6  002° 49' 44,25'' W  35° 11' 25,68'' N  Le point R7  002° 44' 56,58'' W  35° 07' 39,89'' N  Le point R8  002° 45' 54,35'' W  35° 08' 7,96'' N  Le point R9  002° 47' 6,45''   W  35° 09' 7,33'' N  Le point R10  002° 50' 24,54'' W  35° 11' 34,80'' N  Le point R11  002° 50' 15,04'' W  35° 11' 44,86'' N  Le point R12  002° 50' 16,24'' W  35° 11' 52,89'' N  Le point R13  002° 50' 30,32'' W  35° 11' 53,47'' N  Le point R14  002° 50' 41,73'' W  35° 11' 46,88'' N  Le point R15  002° 55' 07,64'' W  35° 15' 37,66'' N   |\n|------------------------------------------------------------------------------------------------------------------------------------------------------------------------------------------------------------------------------------------------------------------------------------------------------------------------------------------------------------------------------------------------------------------------------------------------------------------------------------------------------------------------------------------------------------------------------------------------------------------------------------------------------------------------------------------------------------------------------------------------------------------------------------------------------------------------------------------------|  \nLa rade est composée des zones suivantes :"", ""### ARRÊTENT :  \nARTICLE  PREMIER.-La coopérative «AL MOSTAKBAL LITAHALIB ALBAHRIYA», immatriculée au registre local des coopératives de Nador sous le numéro 33.2023.247.1 est autorisée à créer et exploiter, dans les conditions fixées par la convention de création et d'exploitation de la ferme aquacole n°2024/ORI/535 signée le 15 joumada II 1446 (17décembre 2024) entre ladite coopérative et la secrétaire d'Etat auprès du  ministre  de  l'agriculture,  de  la  pêche  maritime,  du développement rural et des eaux et forêts, chargée de la pêche maritime, une ferme aquacole dénommée «Al Mostakbal Litahalib Albahriya» pour la culture, au niveau de la lagune Marchica, des algues des espèces suivantes :  \n- «Gracilaria gracilis» ;\n- «Laminaria ochroleuca» ;\n- «Gelidium sesquipedale» ;\n- «Saccorhiza polyschides» ;\n- «Grateloupia filicina» ;\n- «Codium tomentosum» ;\n- «Ulva lactuca» ;\n- «Cystoseira tamariscifolia».  \nART. 2. - Le  registre  tenu  par  la  coopérative « AL  MOSTAKBAL  LITAHALIB  ALBAHRIYA »  en application des dispositions de l'article 28-1 du dahir portant loi n°1-73-255 du 27 chaoual 1393 (23 novembre 1973) susvisé, répertorie, dans l'ordre chronologique, ventilé par espèce, les entrées et les sorties des algues des espèces «Gracilaria gracilis», «Laminaria ochroleuca», «Gelidium sesquipedale», «Saccorhiza polyschides», «Grateloupia filicina», «Codium tomentosum», «Ulva lactuca» et «Cystoseira tamariscifolia», cultivées.  \n- ART.3.- L'extrait de la convention n°2024/ORI/535 mentionnée à l'article premier ci-dessus est annexé au présent arrêté conjoint.  \nART. 4. - Le présent arrêté conjoint sera publié au Bulletin officiel .  \nRabat, le 10 safar 1447 (4 août 2025).  \nLe ministre délégué auprès de la ministre de l'économie et des finances, chargé du budget,  \nLa secrétaire d'Etat auprès du ministre de l'agriculture, de la pêche maritime, du développement rural et des eaux et forêts, chargée de la pêche maritime,  \nFOUZI LEKJAA.  \nZAKIA DRIOUICH.  \nAnnexe à l'arrêté conjoint du ministre délégué auprès de la ministre de l'économie et des finances, chargé du budget et de la secrétaire d'Etat auprès du ministre de l'agriculture, de la pêche maritime, du développement rural et des eaux et forêts, chargée de la pêche maritime n°2035-25 du 10 safar 1447 (4 août 2025 ) autorisant la coopérative «AL MOSTAKBAL LITAHALIB ALBAHRIYA» pour la création et l'exploitation d'une ferme aquacole dénommée «Al Mostakbal Litahalib Albahriya» et portant publication de l'extrait de la convention y afférente"", ""| (3 décembre 1997) fixant la liste des diplômes reconnus équivalents au diplôme de docteur en médecine.......................................................... Arrêté du ministre de l'enseignement supérieur, de la recherche scientifique et de l'innovation n° 615-23 du 9 chaabane 1444 (2 mars 2023) complétant l'arrêté n° 2963-97 du 2 chaabane 1418 (3 décembre 1997) fixant la liste des diplômes reconnus équivalents au diplôme de docteur en médecine..........................................................                                                                                                                                                                                                                      | 1132 1132 | Arrêté conjoint duministre del'agriculture,delapêche maritime, du développement rural et des eaux et forêts et duministre délégué auprès de la ministre de l'économie et des finances, chargé du budget n° 439-23 du 24 rejeb 1444 (15 février 2023) autorisant la société «PESCACIS Sarl» pour la création et l'exploitation d'une ferme aquacole dénommée « Pescacis» et portant publication de l'extrait de la convention y afférente................                                                                                                                                     | 1136      |\n| Arrêté du ministre de l'enseignement supérieur, de la recherche scientifique et de l'innovation n° 617-23 du 9 chaabane 1444 (2 mars 2023) complétant l'arrêté n° 2963-97 du 2 chaabane 1418 (3 décembre 1997) fixant la liste des diplômes reconnus équivalents au diplôme de docteur en médecine..........................................................                                                                                                                                                                                                                                                                                                                                                                                      | 1133      | Arrêté conjoint du ministre de l'agriculture, de la pêche maritime, du développement rural et des eaux et forêts et du ministre délégué auprès de la ministre de l'économie et des finances, chargé du budget n° 440-23 du 24 rejeb 1444 (15 février 2023) autorisant la société «COSTA DEL SOL Sarl AU » pour la création et l'exploitation d'une ferme aquacole dénommée                                                                                                                                                                                                                   |           |""]","1. Réponse directe à la question

Les dates importantes mentionnées dans l'arrêté concernant la délimitation du port de plaisance Marchica 1 sont le 4 septembre 2025 (date d'émission de l'arrêté) et les avis de la commission nautique en date du 3 décembre 2024 et 17 avril 2025.

Les documents législatifs cités sont :
- La loi n°15-02 relative aux ports et portant création de l'Agence nationale des ports, modifiée et complétée notamment par ses articles 2 et 3 (Dahir n°l-05-146 du 20 chaoual 1426 / 23 novembre 2005).
- Le décret n° 2-07-1029 du 18 ramadan 1429 (19 septembre 2008) relatif à la délimitation de la rade et du chenal d'accès aux ports.

2. Sources citées

- Arrêté du ministre de l'équipement et de l'eau n° 2199-25 du 11 rabii I 1447 (4 septembre 2025) relatif à la délimitation de la rade et du chenal d'accès du port de plaisance Marchica 1 (Nord d'Atalayoune) et des bassins d'accueil relatifs à la lagune de Marchica.
- Dahir n°l-05-146 du 20 chaoual 1426 (23 novembre 2005), loi n°15-02 relative aux ports et portant création de l'Agence nationale des ports et de la Société d'exploitation des ports.
- Décret n° 2-07-1029 du 18 ramadan 1429 (19 septembre 2008) relatif à la délimitation de la rade et du chenal d'accès aux ports.",Les dates importantes mentionnées dans l'arrêté sont le 11 rabii I 1447 (4 septembre 2025) pour l'arrêté et les réunions de la commission nautique les 3 décembre 2024 et 17 avril 2025. Les documents législatifs cités sont la loi n°15-02 et le décret n°2-07-1029.,0.94999999997625,1.0,1.0,0.9200597893209321,gpt-4o-mini,bge-m3,qwen2.5:7b,False,False,False,0.5
Pourquoi le profil des clients dans le secteur de l'assurance varie-t-il selon qu'il s'agisse d'assurance vie ou d'assurance non vie ?,"[""### 1- Profil des clients assurés  \nSelon les déclarations des acteurs auditionnés, le profil des clients change en fonction de la catégorie d'assurance. En effet, les particuliers restent les clients principaux de l'assurance vie avec une part de 80%, mais en assurance non vie, seulement 48% de la production est destinée à cette cible.  \nGraph. 23 : Ventilation du chiffre d'affaires par type de contrat, fin 2021  \n<!-- image -->"", ""### 2- Concentration en termes de catégories d'assurance  \nGraph. 37 : Ventilation de la production du canal de distribution par catégorie vie et non vie en 2021  \n<!-- image -->  \nSource : ACAPS.  \n62  \nrelatif à l'état de la concurrence dans le marché de l'assurance au Maroc  \nPar catégorie d'assurance, il est constaté que l'essentiel de l'assurance vie est distribué par le canal de la bancassurance alors que l'assurance non vie passe principalement par le canal des agents puisque 96% de la production de ces derniers est dédié à la non vie."", ""### - concernant l'assurance non vie :  \n- sur  le  marché  de  la  non  vie,  les  5  premières  EAR  concentrent  75%  du  marché (Sanlam Maroc, Wafa Assurance, AtlantaSanad, RMA, AXA Assurance Maroc) ;\n- l'assurance de transport public des voyageurs est animée par 2 opérateurs (CAT et MATU) ;\n- la branche automobile représente la moitié de l'assurance non vie.  \n73"", ""Parmi  ces  marchés,  il  y  a  celui  de  l'assurance  Automobile,  étant  donné  qu'elle  représente environ 50% du total des primes émises sur le marché global de l'assurance non vie et 26% de l'assurance national globale, en raison de son caractère obligatoire. Cette assurance est suivie de l'assurance Accidents corporels - Maladies- Maternité avec une part de production de 18%.  \nGraph. 32 : Ventilation du marché de l'assurance non vie par produit en 2021  \na  \nn  \nc  \n<!-- image -->  \nSource : ACAPS."", ""#### 2. Ouvrir progressivement l'assurance non vie au secteur bancaire  \nLe canal de la bancassurance a permis une amélioration remarquable de la performance de l'assurance vie que les bancassureurs sont agréées à distribuer.  \nC'est ainsi que le Conseil de la concurrence recommande d'ouvrir progressivement l'assurance non vie au secteur bancaire tout en :  \n- autorisant les banques à vendre les produits d'assurance et en confiant la gestion des dossiers sinistres aux intermédiaires ;\n-  soumettant  les  points  de  vente  bancaires  aux  mêmes  exigences  que  les  intermédiaires d'assurances ;\n-  instaurant  des  mécanismes  de  contrôle  permettant  de  conserver  le  droit  du consommateur de choisir son assureur et d'éviter les ventes liées dans le cadre de la  \n80  \nrelatif à l'état de la concurrence dans le marché de l'assurance au Maroc vente des produits d'assurance adossés à des produits bancaires ;  \n-  exigeant  aux  banques  de  mettre  en  place  un  espace  dédié  à  la  vente  des produits d'assurance."", ""### 2.2- Par rapport aux assureurs non vie  \nLe marché de la spécialité d'assurance non vie est partagé entre trois EAR, à savoir la MAMDA, la MATU et la CAT, avec une part prépondérante au profit de la MAMDA et la CAT depuis plus d'une décennie. En 2021, ces deux entreprises concentrent plus de 76% de ce segment alors que le chiffre d'affaires de la MATU représente 23% de ce marché.  \nGraph. 29 : Evolution des parts de marché  des assureurs non  vie, années 2005- 2021  \n<!-- image -->  \nSource : ACAPS.""]","1. Réponse directe à la question :
   Le profil des clients varie selon qu'il s'agit d'assurance vie ou d'assurance non vie en raison de différences intrinsèques entre ces deux catégories d'assurance.

2. Sources citées :
   - Avis du Conseil de la concurrence n° A/1/23, profil des clients assurés (source : ACAPS).

L'extrait indique que les particuliers sont principalement les clients de l'assurance vie avec une part de 80%, tandis qu'en assurance non vie, ils représentent seulement 48% de la production.","Le profil des clients dans le secteur de l'assurance varie selon qu'il s'agisse d'assurance vie ou d'assurance non vie en raison des différences de catégories d'assurance, avec une majorité de particuliers (80%) dans l'assurance vie, alors que ce chiffre n'est que de 48% pour l'assurance non vie.",0.99999999995,1.0,0.5,0.9519197649233545,gpt-4o-mini,bge-m3,qwen2.5:7b,False,False,False,0.5
Qu'est-ce que l'avis préparé par le CESE sur le cloud et quel était son objectif ?,"[""#### Avis préparé par :  \nCommission permanente chargée de la société du savoir et de l'information  \nConformément aux dispositions de l'article 6 de la loi organique n°128-12, le Conseil Economique, Social et Environnemental (CESE) s'est autosaisi, aux fins de préparer un avis sur le cloud .  \nDans ce cadre, le Bureau du Conseil a confié à la Commission chargée de la société du savoir et de l'information l'élaboration dudit avis.  \nLors de sa 149 éme  session ordinaire tenue le 31 août 2023, l'Assemblée générale du CESE a adopté à l'unanimité l'avis intitulé : « le cloud : un levier d'urgence pour réussir la transformation digitale». Elaboré sur la base d'une approche participative, l'avis est le résultat d'un large débat entre les différentes catégories qui composent le Conseil et des auditions organisées avec les principales parties prenantes concernées."", '6  \ndynamique ;variation rapide de capacité et mesure du service fourni  \n\'  \n4  \nCloud adoption linked to stronger firm performance\', MIT Management, juin 2022.  \n7  Une étude estime qu\'une augmentation de 1% de l\'adoption du  \nLe modèle ""  \nEdge Cloud  \n"" rapproche les ressources informatiques des utilisateurs, réduisant ainsi la latence et améliorant les performances.  \n4 /25  \nun accroissement de 0,05% du PIB. The Contribution of  \n5  \nLe cloud  \nCloud cloud  \nau Maroc par les organisations induirait to Economic Growth in the Middle East and North  \nsectoriel  offre  des  ressources  informatiques  spécifiquement  adaptées  à  des  secteurs  réglementés  \nIl existe plusieurs modèles particuliers du qui permettent d\'adresser des besoins spécifiques des utilisateurs.  \nLe cloud permet  d\'accélérer  le  rythme  de  l\'innovation  digitale  dans  les  organisations, d\'améliorer leur productivité 6 et d\'augmenter leurs revenus 7 .  \nPar  ailleurs,  et  grâce  aux  services  qu\'il  offre  notamment  dans  les  domaines  de  la  mobilité intelligente,  la  télésurveillance,  l\'accès  automatique  aux  services  et  le streaming ,  le cloud constitue un prérequis indispensable pour organiser de manière optimale, comme l\'ambitionne notre pays, des évènements de portée internationale tels que la coupe du monde.  \nBien que le cloud soit un pilier important de l\'accélération de la transformation digitale, force est de constater que notre pays ne dispose pas encore d\'une vision claire en la matière.  \nLe présent avis vient compléter le travail réalisé en 2021 par le CESE dans le cadre de l\'autosaisine sur « vers une transformation digitale responsable et inclusive », et particulièrement en lien  avec  la  recommandation  de  « développer  des  data  centers  souverains  nationaux  et régionaux  pour  permettre  à  l\'Etat  et  aux  entreprises  marocaines  d\'héberger  leurs  actifs stratégiques (données et applications) ».  \nDans le présent avis, le CESE se focalise sur les facteurs à même de favoriser le déploiement et l\'adoption du cloud pour accélérer la transformation digitale et assurer la souveraineté des données sensibles et vitales.', ""#### Synthèse  \nLe présent avis vient compléter le travail réalisé en 2021 par le CESE dans le cadre d'une autosaisine intitulée « vers une transformation digitale responsable et inclusive », et particulièrement sa  recommandation  portant  sur  le  développement  des  « data  centers souverains  nationaux  et régionaux  pour  permettre  à  l'Etat et aux entreprises marocaines  d'héberger  leurs  actifs stratégiques (données et applications) ». Dans cet avis, le CESE se focalise sur les facteurs favorisant l'adoption et le déploiement du cloud par les acteurs, dans le but d'accélérer la transformation digitale de notre pays, tout en assurant la souveraineté des données sensibles et vitales. Il a été adopté à l'unanimité par l'Assemblée Générale du Conseil, tenue le 31 août 2023.  \nLe cloud constitue un levier important pour accélérer et réussir la transition digitale. Il s'agit d'une infrastructure essentielle qui, en plus de permettre de stocker et de protéger les données sur des serveurs  distants  et  accessibles  via Internet ,  garantit  un  accès  rapide  à  des  infrastructures  et services numériques partagés permettant de réaliser jusqu'à 20 % d'économie d'échelle. En offrant des services notamment dans les domaines de la mobilité intelligente, la télésurveillance, l'accès automatique aux services et le streaming, le cloud est  un  vecteur  important pour organiser, de manière optimale comme l'ambitionne notre pays, des évènements de portée internationale tels que la Coupe du monde.  \nMalgré ce potentiel important, le Maroc accuse encore un retard dans l'adoption du cloud par les acteurs. En effet, en 2020, le taux d'externalisation des ressources informatiques ne dépassait pas 14 %, tandis qu'il atteignait 35 % en Europe de l'Ouest et 51 % en Asie-Pacifique.  \nPar  ailleurs,  malgré  l'existence  de  plusieurs  acteurs  nationaux  qui  proposent  des  services d'hébergement et de cloud , l'offre nationale demeure manifestement orientée vers les besoins les plus usuels et les plus basiques (hébergement, infrastructure as a service , applications fréquentes), sans couvrir toute la diversité des offres applicatives et services à haute valeur ajoutée ( software as a service ).  \nPlusieurs facteurs peuvent expliquer cette situation :  \n- -Un marché national restreint dû à un faible ancrage de la culture du cloud : les organisations optent encore  pour  des  modes  de  gestion  privilégiant  la  possession  et  la  gestion  directe  des infrastructures et des applications en interne occultant les effets de mutualisation, de résilience et de scalabilité offerts par le cloud .  \n-  \n-  \nLe coût relativement élevé de la connectivité : les acteurs du cloud  \nont besoin d'une connectivité  \nde qualité à des prix abordables afin de disposer de larges bandes passantes permettant à la fois l'accès  \nde  leurs clients  \net la  \nréplicabilité"", ""#### Définition du cloud Définition du cloud  \nà partir d'un réseau d'ordinateurs (ou ferme de serveurs) distants, hébergés sur l'Internet.  \nrégionaux  pour  permettre  à  l'Etat  et  aux  entreprises  marocaines  d'héberger  leurs  actifs  \nLe cloud ou l'« informatique en nuage » consiste à dispenser des services informatiques et des outils logiciels en ligne plutôt que sur un ordinateur personnel ou un serveur local et ce, à partir d'un réseau d'ordinateurs (ou ferme de serveurs) distants, hébergés sur l'Internet. Le cloud ou l'« informatique en nuage » consiste à dispenser des services informatiques et des outils logiciels en ligne plutôt que sur un ordinateur personnel ou un serveur local et ce, à partir d'un réseau d'ordinateurs (ou ferme de serveurs) distants, hébergés sur l'Internet. Le présent avis vient compléter le travail réalisé en 2021 par le CESE dans le cadre de l'autosaisine sur « vers une transformation digitale responsable et inclusive », et particulièrement en lien  avec  la  recommandation  de  « développer  des  data  centers  souverains  nationaux  et Le cloud désigne une utilisation efficiente et partagée des ressources digitales distantes par les divers utilisateurs ayant des besoins distincts. Les clients du cloud s'affranchissent ainsi des efforts de gestion, des contraintes d'acquisition de l'équipement et du logiciel grâce à un  \n1  \nLe cloud désigne une utilisation efficiente et partagée des ressources digitales distantes par les divers utilisateurs ayant des besoins distincts. Les clients du cloud s'affranchissent ainsi des efforts de gestion, des contraintes d'acquisition de l'équipement et du logiciel grâce à un environnement hautement sécurisé, robuste et disponible à la demande 3 . De plus, ces clients peuvent bénéficier des compétences les plus pointues qu'ils auraient du mal à recruter en interne. Le cloud désigne une utilisation efficiente et partagée des ressources digitales distantes par les divers utilisateurs ayant des besoins distincts. Les clients du cloud s'affranchissent ainsi des efforts de gestion, des contraintes d'acquisition de l'équipement et du logiciel grâce à un environnement hautement sécurisé, robuste et disponible à la demande 3 . De plus, ces clients peuvent bénéficier des compétences les plus pointues qu'ils auraient du mal à recruter en interne. stratégiques (données et applications) ». Dans le présent avis, le CESE se focalise sur les facteurs à même de favoriser le déploiement et l'adoption du cloud pour accélérer la transformation digitale et assurer la souveraineté des données sensibles et vitales. environnement hautement sécurisé, robuste et disponible à la demande 3 . De plus, ces clients peuvent bénéficier des compétences les plus pointues qu'ils auraient du mal à recruter en interne.  \nLes enjeux stratégiques du cloud  \nsont multiples …"", ""#### 4 … La nécessité au Maroc de se doter en urgence d'un plan d'action cloud s'inscrivant dans la stratégie relative à la transition numérique en cours de finalisation 4 … La nécessité au Maroc de se doter en urgence d'un plan d'action cloud s'inscrivant dans la stratégie relative à la transition numérique en cours de finalisation  \nPartant de ce diagnostic et des enseignements tirés des expériences internationales 49 , le CESE appelle  à  accorder  une  importance  primordiale  au cloud au  niveau  de  la  stratégie  de  la transition numérique en cours de finalisation par le ministère de la transition numérique et de la réforme de l'administration. Partant de ce diagnostic et des enseignements tirés des expériences internationales 49 , le CESE appelle  à  accorder  une  importance  primordiale  au  cloud  au  niveau  de  la  stratégie  de  la transition numérique en cours de finalisation par le ministère de la transition numérique et de la réforme de l'administration. cloud 49 ,  \nPour ce faire, il est préconisé d'établir en urgence un plan d'action « priorité au cloud » visant son déploiement et la promotion de son utilisation en vue d'accélérer la transformation digitale et assurer la souveraineté des données. Pour ce faire, il est préconisé d'établir en urgence un plan d'action « priorité au cloud » visant son déploiement et la promotion de son utilisation en vue d'accélérer la transformation digitale et assurer la souveraineté des données.  \nCette  mission  pourrait  être  confiée  à  une  commission  regroupant  les  parties  prenantes concernées  et  pilotée  par  le  ministère  de  la  transition  numérique  et  de  la  réforme  de l'administration  délégué  auprès  du  Chef  de  Gouvernement  avec  l'étroite  collaboration  des acteurs clés des secteurs publics et privé 50 pour apporter les expertises nécessaires et déployer le  plan d'action identifié à l'échelle nationale. L'Agence de Développement du Digital (ADD) pourra être chargée de l'opérationnalisation de ce plan. Cette  mission  pourrait  être  confiée  à  une  commission  regroupant  les  parties  prenantes concernées  et  pilotée  par  le  ministère  de  la  transition  numérique  et  de  la  réforme  de l'administration  délégué  auprès  du  Chef  de  Gouvernement  avec  l'étroite  collaboration  des acteurs clés des secteurs publics et privé 50 pour apporter les expertises nécessaires et déployer le  plan d'action identifié à l'échelle nationale. L'Agence de Développement du Digital (ADD) pourra être chargée de l'opérationnalisation de ce plan.  \nL'ambition souhaitée est de positionner notre pays en tant qu'acteur régional de premier rang en matière de services cloud . L'objectif in fine est de s'ériger, au niveau continental, en tant  \n49  \nCf. annexe 3 : Benchmark international.  \n50 Les membres de cette commission devraient inclure : le département de l'économie et finances ; le département 49 Cf. annexe 3 : Benchmark international"", ""#### Encadré : Les principales formes de services de cloud  \n- Le cloud public et le cloud privé sont les deux principales formes de services de cloud Le cloud public et le cloud privé sont les deux principales formes de services de cloud\n- Le cloud public se compose d'une infrastructure et de ressources partagées qui sont fournies par un prestataire externe. Le cloud public se compose d'une infrastructure et de ressources partagées qui sont fournies par un prestataire externe.  \nUn cloud privé est constitué d'une infrastructure et de ressources dédiées, qui appartiennent à l'organisation utilisatrice. Il peut être hébergé au sein de l'organisation ou chez un prestataire externe à condition que l'accès soit limité aux utilisateurs de cette organisation. Un cloud privé est constitué d'une infrastructure et de ressources dédiées, qui appartiennent à l'organisation utilisatrice. Il peut être hébergé au sein de l'organisation ou chez un prestataire externe à condition que l'accès soit limité aux utilisateurs de cette organisation.  \nEn effet, dans son rapport sur l'open data publié en 2013, le CESE avait émis la recommandation de procéder à un classement des données en les regroupant en fonction de leur niveau de sensibilité,  de  déterminer les propriétaires et les différents niveaux d'accès autorisés, et de faciliter leur partage. En effet, dans son rapport sur l'open data publié en 2013, le CESE avait émis la recommandation de procéder à un classement des données en les regroupant en fonction de leur niveau de sensibilité,  de  déterminer les propriétaires et les différents niveaux d'accès autorisés, et de faciliter leur partage.  \nCe n'est qu'en 2020 que la loi 05-20 relative à la cybersécurité a exigé, dans son article 5, une classification  des  données  en  fonction  de  leur  niveau  de  sensibilité,  d'intégrité  et  de disponibilité.  Son  décret  d'application  publié  en  2021  a  défini  quatre  niveaux  de  sensibilité («très secret », « secret », « confidentiel » et « diffusion restreinte »). Ce n'est qu'en 2020 que la loi 05-20 relative à la cybersécurité a exigé, dans son article 5, une classification  des  données  en  fonction  de  leur  niveau  de  sensibilité,  d'intégrité  et  de disponibilité.  Son  décret  d'application  publié  en  2021  a  défini  quatre  niveaux  de  sensibilité («très secret », « secret », « confidentiel » et « diffusion restreinte »).""]","1. Réponse directe à la question

L'avis préparé par le CESE sur le cloud avait pour objectif de promouvoir l'utilisation du cloud en vue d'accélérer la transformation digitale et assurer la souveraineté des données. Le document appelle au déploiement urgent d'un plan d'action prioritaire sur le cloud, confié à une commission pilotée par le ministère de la transition numérique et de la réforme de l'administration.

2. Sources citées

Le texte mentionne que cette recommandation est issue d'un diagnostic et des enseignements tirés des expériences internationales (Cf. annexe 3 : Benchmark international).","L'avis préparé par le CESE sur le cloud, intitulé « le cloud : un levier d'urgence pour réussir la transformation digitale », a été élaboré dans le cadre de l'article 6 de la loi organique n°128-12. Son objectif est de proposer des recommandations pour réussir la transformation digitale, basé sur une approche participative incluant un large débat et des auditions avec les parties prenantes.",0.99999999998,1.0,1.0,0.9004079764369017,gpt-4o-mini,bge-m3,qwen2.5:7b,False,False,False,0.5
Quels sont les principaux problèmes liés à l'organisation et à la gestion des marchés de gros en raison des réglementations en place ?,"[""##### 2.3.2 Les marchés de gros : dysfonctionnements au niveau de l'organisation, des équipements et du mode de gestion  \nÀ partir de 2015, la création des marchés de gros et le choix des modalités de leur gestion par les conseils communaux s'effectuent conformément aux exigences de l'article 83 de la loi organique n° 113-14, relative aux communes. D'autres acteurs notamment privés peuvent gérer ces marchés dans le cadre de la gestion déléguée. La région joue également un rôle essentiel en matière de promotion des marchés de gros régionaux dans le cadre de ses propres compétences stipulées par l'article 82 de la loi organique n° 111-14, relative aux régions.  \nIl existe 38 marchés de gros au niveau national, répartis sur 32 provinces et préfectures 28 . Les parties prenantes fréquentant les marchés de gros sont composées de 3.700 producteurs, de 4.600 grossistes et 374 mandataires ainsi que 20 000 employés (employés communaux, employés des mandataires, employés des grossistes, portefaix, etc.) 29 .  \nPar ailleurs, le diagnostic réalisé par le département chargé du commerce et de l'industrie et du département chargé de l'agriculture sur les marchés de gros, a révélé plusieurs faiblesses, notamment en ce qui concerne le mode de gestion, l'état  des  équipements, le système de taxation, le manque d'hygiène et de sécurité et le rôle des acteurs. Les principaux dysfonctionnements relevés sont:  \n-  la production des fruits et légumes écoulée sur le marché local dépasse 9 millions de tonnes, alors que seulement 3,5 millions de tonnes transitent par les marchés de gros (MDG), le reste étant commercialisé sur des marchés parallèles 30 . Cette situation sera accentuée dans les années à avenir compte tenu de l'accroissement attendu de la production des fruits et légumes;  \n28 - Audition du ministère de l'Intérieur, CESE,  \n29 - audition du département du commerce et de l'industrie  \n30 - Audition du département de l'agriculture  \n- -un cadre réglementaire caduc, datant de 1962, devenu aujourd'hui inadapté et pénalisant la compétitivité des filières agricoles. En effet, l'obsolescence et l'inadaptation aux transformations économiques et sociales des textes juridiques qui réglementent l'organisation et l'exploitation des marchés de gros, constitue un grand obstacle au développement d'une commercialisation saine, juste et moderne;\n-  le taux  particulièrement élevé de la redevance fixée à 7% sur le montant brut des ventes en gros de fruits et légumes, dont 2% est destiné aux mandataires, sans véritable service rendu;\n- -des infrastructures très rudimentaires avec très peu de services associés, à l'exception de quelques marchés (Casa, Tanger):\n-  Près  d'un  marché  sur  5    ne  dispose  d'aucune infrastructure (terrain vague/ au mieux baraques en roseaux);\n-  Dans  45%  des  marchés  (soit  17  marchés),  les infrastructures se résument à des carreaux de vente couverts;"", ""- -des infrastructures très rudimentaires avec très peu de services associés, à l'exception de quelques marchés (Casa, Tanger):\n-  Près  d'un  marché  sur  5    ne  dispose  d'aucune infrastructure (terrain vague/ au mieux baraques en roseaux);\n-  Dans  45%  des  marchés  (soit  17  marchés),  les infrastructures se résument à des carreaux de vente couverts;\n-  63%  des  marchés  (soit  24  marchés)  n'ont  pas  de magasins en dur pour les grossistes.  \nLe chiffre d'affaires des marchés de gros représente près de 7 Milliards de Dhs/an, correspondant à un tonnage commercialisé de 3,5 millions Tonnes /an. Ce tonnage ne représente que 33% environ de la production nationale des fruits et légumes 31 . Les recettes communales issues de la taxe sur chiffre d'affaires, sont de l'ordre de 350 Mdhs/an 32 .  \nLes conditions de sécurité sanitaires sur les marchés de gros, très insatisfaisantes, entraînent une nette détérioration de la qualité des produits transitant par les marchés de gros.  \nUne réforme des marchés de gros a été proposée par le département chargé de l'industrie et du commerce depuis 2010 en partenariat avec les ministères chargés de l'intérieur et de l'agriculture, en tenant compte des orientations de la régionalisation avancée notamment les dispositions relatives à l'élargissement du rôle des collectivités territoriales. Les ajustements préconisés, dans le cadre du schéma directeur national 33  proposé, portent sur :  \n-  la réduction du nombre de marchés de gros de 38 à 34 ;\n-  une meilleure desserte de la population et un accès facilité aux producteurs;\n-  une infrastructure modernisée et un dimensionnement adéquat répondant  aux  normes  internationales et  disposant  de  plateformes  multi-produits  (fruits et  légumineuses,  viandes,  etc.)  et  multi-activités (entrepôts frigorifiques, collecte des déchets, services administratifs, etc.);\n-  un montage institutionnel associant les collectivités locales et les opérateurs publics/privés ;  \n31 -  département de l'agriculture  \n32 - Département de l'agriculture  \n33  - Schéma national d'implantation des marchés de gros de fruits et légumes adopté par les départements du commerce, de l'intérieur et de l'agriculture.  \n-  des sources de revenus déconnectées des ventes (droits de 1ère occupation des magasins, loyers, péages à l'entrée et redevances, loyers versés par les opérateurs gestionnaires des services externalisés);\n-  une suppression de la fonction de mandataires par la révision du Dahir du 7 février 1962 relatif aux charges de mandataires des MDG des communes urbaines, et de l'arrêté du ministre de l'Intérieur du 22 mai 1962 portant statut des mandataires et règlement des MDG et des halles aux poissons des communes urbaines ainsi que de la loi N°30-89 relative à la fiscalité des collectivités locales;"", ""-  une suppression de la fonction de mandataires par la révision du Dahir du 7 février 1962 relatif aux charges de mandataires des MDG des communes urbaines, et de l'arrêté du ministre de l'Intérieur du 22 mai 1962 portant statut des mandataires et règlement des MDG et des halles aux poissons des communes urbaines ainsi que de la loi N°30-89 relative à la fiscalité des collectivités locales;\n-  un  assouplissement de l'obligation de passage par les marchés de gros à travers la possibilité donnée dans certains cas et sous des conditions spécifiques, d'installer  des  plateformes  de  distribution  et  de conditionnement, à l'initiative d'opérateurs privés.  \nLa loi n°37-21 relative à la commercialisation directe des fruits et légumes produits dans le cadre de l'agrégation agricole, constitue une étape importante de la réforme des marchés de gros. Les mesures édictées par ladite loi permettront aux agrégateurs disposant d'unités de valorisation des fruits et légumes de commercialiser directement leurs produits sans passer par les marchés de gros.  \nIl a été estimé que les requis de la réforme du système de marché de gros, y compris la réhabilitation, la relocalisation ou la création de nouveaux marchés, nécessitent un budget total d'environ 9 milliards de dirhams 34 .  Le projet de réforme de ces marchés est en cours de validation avec les régions, au regard de leurs vocations et spécificitéset dans le respect de leurs compétences telles que prévues par les lois organiques des collectivités territoriales dans le cadre de la régionalisation avancée."", ""##### Obstacles à la commercialisation au sein de la filière des fruits et légumes  \nLes performances relevées au niveau de l'amont de la filière des fruits et légumes sont obtenues grâce à l'appui financier apporté par le Plan Maroc Vert aux producteurs pour améliorer la productivité. Cependant, le segment de la commercialisation n'a pas bénéficié du même intérêt ni des mêmes avantages  \n9 - Le secteur agricole marocain : Tendances structurelles, enjeux et perspectives de développement, DEPF, ministère de l'Économie, des Finances et de la Réforme de l'Administration, juillet 2019.  \n10   - https://www.franceagrimer.fr/filiere-fruit-et-legumes/La-filiereFruits-et-legumes  \n(subventions, organisation, encadrement, etc.) octroyés à la production. Incontestablement, certaines actions ont été prises par les autorités compétentes pour encourager l'intervention de l'interprofession dans le processus de commercialisation, notamment la signature des contrats programmes 11 , l'adoption de la loi n° 04-12 relative à l'agrégation agricole, dont l'objectif est d'assurer l'écoulement et la commercialisation des produits agricoles des agrégés. Néanmoins, des obstacles persistent encore impactant les circuits de commercialisation de cette filière. Il convient de citer:  \n-  la  prédominance  d'une  panoplie  d'intermédiaires car aucune réglementation sur l'intermédiation et le courtage des fruits et légumes n'existe actuellement;\n-  les  espaces  de  ventes  des  fruits  et  légumes particulièrement les marchés de gros souffrent de multiples dysfonctionnements;\n-   les circuits de commerce hors marché de gros ne sont pas assez organisés et demeurent dominés par la vente informelle;\n-  un manque en matière d'espaces de ramassage bien organisés et compétitifs;\n-  l'absence d'un système d'information sur les prix ;\n-  la difficulté pour les petits producteurs de mettre en place des moyens logistiques pour conserver les fruits et légumes frais et améliorer leur résilience.  \nS'agissant  particulièrement  des  fruits  rouges,  leur commercialisation  ne  pose  pas  de  problème  réel.  Les transactions se font généralement sur la base des contrats via  des  opérateurs  internationaux  qui  assurent  à  la  fois l'accompagnement technique des producteurs et l'écoulement du produit vers des marchés internationaux à des prix fixés à l'avance. Pour une production destinée en majeure partie à  l'export  5  milliards  de  DH  de  rentrées  de  devis  ont  été enregistrées en l'espèce en 2020 12 .  \nPour la filière oléicole, 84% de la production de l'huile d'olive est commercialisée au niveau du marché national et 16% sur le marché extérieur. Actuellement, la filière exporte 27.000 t/an vers principalement les marchés des USA et de l'UE 13  et se positionne au 6 ème  rang mondial en termes d'exportations."", ""#### 1. L'organisation professionnelle n'intègre pas suffisamment les petits et moyens agriculteurs autour d'un cadre coopératif réussi  \nLes  750  000  petites  et  moyennes  exploitations,  qui représentent la moitié des exploitations du pays, (1,5 millions) 37 avec 70% de la SAU 38  et les 600 000 micro-exploitations, qui occupent 8,5% de la SAU, sont en émiettement continu et accéléré par l'héritage. Il est évident que ces exploitations, insuffisamment organisées et peu encadrées, n'arrivent pas systématiquement à écouler leurs produits dans les meilleures conditions.  \nPar manque d'organisation, ces exploitations ne disposent pas d'une taille critique leur permettant d'intégrer un système organisé et disposer d'un pouvoir de négociation avec les intermédiaires, les collecteurs et tous ceux qui s'occupent de la commercialisation et de la valorisation des produits.  \n36 - Convention Cadre de partenariat:  Fondation Mohammed VI pour la Protection de l'Environnement et ses partenaires : le département du Commerce ; le département de l'Energie ; la CGEM  \n; l' AMEE et l'l'institut marocain de normalisation  \n37 - les acteurs auditionnés estiment actuellement environ 1,8 millions d'exploitations  \n38 - « l'agriculture familiale en Méditerranée et en Afrique de l'Ouest: de nouvelles dynamiques entrepreneuriales et territoriales » / «l'Année Internationale de l'Agriculture Familiale ». (« Séminaire Eau   et   Sécurité   Alimentaire   en Méditerranée:  SEAM »), avril 2014.  \nSelon  l'article  2  de  la  loi  n°  03-12  relative  aux interprofessions agricoles et halieutiques 39 , les interprofessions agricoles d'une même filière interviennent dans l'amélioration du processus de commercialisation (traçabilité, conditionnement, commercialisation). Constituant un cadre approprié pour la promotion de la profession dans le domaine agricole, cette loi a déclenché le développement d'associations professionnelles et de fédérations interprofessionnelles dans différentes filières agricoles (fruits et légumes, viandes rouges, etc.).  \nSi  les  grands  exploitants  adhèrent  facilement  à  ces interprofessions,  tel  n'est  pas  le  cas  des  petits  et  moyens agriculteurs, faute d'organisation et de leadership à même de les fédérer autour de filières plus structurées.  \nConformément  aux  dispositions  de  la  loi  n°  04-12, l'agrégation, pratiquée déjà dans des secteurs importants comme le secteur laitier et sucrier, vise à sécuriser les relations contractuelles entre l'agrégateur et les agrégés. Toutefois, elle  n'a  pas  pu  apporter  de  solutions  à  la  problématique d'organisation des petits et moyens agriculteurs pour leur faciliter l'accès aux marchés intérieur et extérieur sans devoir passer systématiquement par les intermédiaires."", ""#### 2. Le système de commercialisation : dysfonctionnements organisationnels et fonctionnels  \n##### 2.1 Une faible capacité des petits et moyens agriculteurs à  maitriser  les  connaissances  et  à  intégrer  la  chaine  de commercialisation  \nLa commercialisation des produits agricoles et agroalimentaire passe inévitablement par la connaissance et la prise en compte de nombreux prérequis. Il s'agit notamment :  \n- de l'alternance des productions et la saisonnalité des cultures qui déterminent le type de commercialisation des produits agricoleset agissent sur l'offre et la demande et par conséquent sur la formation des prix ;\n-  du  stockage  au  regard  de  son  extrême  importance, notamment, pour faire face à la périssabilité des produits agricoles et les préserver dans des conditions optimales avant de les commercialiser;  \n21 - Audition de la FIVIAR  \n22 -https://www.agriculture.gov.ma/fr/filiere/vianderouge#indicateurs-1  \n23 - Food Outlook - Biannual Report on Global Food Markets: FAO, June 2020.  \n24 - audition de la FIVIAR  \n- de la distribution des produits qui est inséparable du stockage, du transport des produits et in fine de la commercialisation ;\n- de la traçabilité en tant que facteur décisif pour une meilleure valorisation du produit. Une fois opéré dans les conditions optimales, le processus de traçabilité facilitera le contrôle des produits et garantira la qualité exigée par le consommateur;\n- du prix qui est intimement lié à une offre très variable et une demande relativement rigide. Il suffit d'une variation légère de la production pour que l'effet au niveau des prix soit amplifié;\n- de l'organisation de l'offre par produit et par région, avec l'implication de l'interprofession en tant qu'acteur déterminant dans le développement de la filière agricole.  \nEn  ce  qui  concerne  la  promotion  des  activités commerciales en faveur des agricultrices, il est important de souligner que l'Etat a entrepris des initiatives louables en matière d'organisation de ces dernières dans des coopératives agricoles œuvrant notamment dans la promotion des produits du terroir.  \nToutefois,  il  convient  de  signaler  le  manque  d'une démarche spécifique d'autonomisation des femmes du monde rural dans la commercialisation des produits agricoles.En effet et bien que ces femmes soient présentes dans les ventes au détail et dans les petits marchés de proximité, leur inclusion dans la chaîne de commercialisation reste confrontéeà un certain nombre de défisà savoir:  \n-  les difficultés liées aux capacités économiques, à la gestion du temps, au transport et à la mobilité;\n-  l'absence de  formation  dans  les  techniques  de production et de commercialisation;\n-  l'accès difficile au financement, aux connaissances techniques et technologiques à même de favoriser l'intégration du processus de commercialisation;\n-  l'accès  très  faible  à  la  digitalisation,  comme  outil promotionnel au service d'un traitement plus égalitaire.""]","1. Réponse directe à la question

Les principaux problèmes liés à l'organisation et à la gestion des marchés de gros en raison des réglementations en place sont :

- Le manque d'adhésion des petits et moyens agriculteurs aux interprofessions agricoles, qui empêche une meilleure organisation et négociation avec les intermédiaires.
- La faible capacité des petits et moyens agriculteurs à maîtriser les connaissances nécessaires pour intégrer la chaîne de commercialisation, ce qui affecte leur accès aux marchés intérieur et extérieur.

Sources citées

2. Sources citées
- Avis du Conseil Economique, Social et Environnemental : Première partie : La commercialisation dans les filières agricoles: état des lieux et dysfonctionnements (section 1. L'organisation professionnelle n'intègre pas suffisamment les petits et moyens agriculteurs autour d'un cadre coopératif réussi)
- Avis du Conseil Economique, Social et Environnemental : Première partie : La commercialisation dans les filières agricoles: état des lieux et dysfonctionnements (section 2. Le système de commercialisation : dysfonctionnements organisationnels et fonctionnels)","Les principaux problèmes liés à l'organisation et à la gestion des marchés de gros incluent un cadre réglementaire caduc datant de 1962, inadapté aux transformations économiques et sociales, ce qui pénalise la compétitivité des filières agricoles. De plus, la redevance élevée de 7% sur les ventes en gros est perçue comme un coût sans véritable service rendu.",0.99999999998,1.0,0.6666666666666666,0.96722732331536,gpt-4o-mini,bge-m3,qwen2.5:7b,False,False,False,0.5
Quels sont les diplômes reconnus comme équivalents au diplôme de docteur en médecine selon le dernier arrêté publié ?,"[""## Arrêté du ministre de l'enseignement supérieur, de la recherche scientifique  et  de  l'innovation  n° 2507-25  du  1 er joumada  I  1447 (24 octobre 2025) complétant l'arrêté n°2963-97 du 2chaabane 1418 (3décembre 1997) fixant la liste des diplômes reconnus équivalents au diplôme de docteur en médecine.  \nle MINIStRe De l'eNSeIGNeMeNt SUP É RIeUR, De la ReCheRChe SCIeNtIFIQUe et De l'INNOVatION,  \nVu l'arrêté du ministre de l'enseignement supérieur, de  la  recherche  scientifique  et  de  la  culture  n° 2963-97  du 2 chaabane 1418 (3décembre 1997) fixant la liste des diplômes reconnus équivalents au diplôme de docteur en médecine, tel qu'il a été modifié et complété ;  \nVu le décret n°2-24-991 du 24 rabii II 1446 (28 octobre 2024) relatif aux attributions du ministre de l'enseignement supérieur, de la recherche scientifique et de l'innovation ;  \nAprès avis de la commission sectorielle des sciences de la santé, réunie en date du 15 septembre 2025 ;  \nAprès avis du conseil national de l'Ordre national des médecins,"", ""## Arrêté du ministre de l'enseignement supérieur, de la recherche scientifique et de l'innovation n°2802-22 du 27 rabii I 1444 (24  octobre  2022)  complétant  l'arrêté  n° 2963-97  du 2chaabane 1418 (3décembre 1997) fixant la liste des diplômes reconnus équivalents au diplôme de docteur en médecine.  \nle MINIStRe De l'eNSeIGNeMeNt SUP É RIeUR, De la ReCheRChe SCIeNtIFIQUe et De l'INNOVatION,  \nVu l'arrêté du ministre de l'enseignement supérieur, de  la  recherche  scientifique  et  de  la  culture  n° 2963-97  du 2 chaabane 1418 (3décembre 1997) fixant la liste des diplômes reconnus équivalents au diplôme de docteur en médecine, tel qu'il a été complété ;  \nVu le décret n°2-21-838 du 14 rabii I 1443 (21 octobre 2021) relatif aux attributions du ministre de l'enseignement supérieur, de la recherche scientifique et de l'innovation ;  \nAprès avis de la commission sectorielle des sciences de la santé, réunie en date du 27 juillet 2022 ;  \nAprès avis du conseil national de l'Ordre national des médecins,"", ""## Arrêté du ministre de l'enseignement supérieur, de la recherche scientifique et de l'innovation n°201-23 du 4 rejeb 1444 (26  janvier  2023)  complétant  l'arrêté  n° 2963-97  du 2chaabane 1418 (3décembre 1997) fixant la liste des diplômes reconnus équivalents au diplôme de docteur en médecine.  \nle MINIStRe De l'eNSeIGNeMeNt SUP É RIeUR, De la ReCheRChe SCIeNtIFIQUe et De l'INNOVatION,  \nVu l'arrêté du ministre de l'enseignement supérieur, de  la  recherche  scientifique  et  de  la  culture  n° 2963-97  du 2 chaabane 1418 (3décembre 1997) fixant la liste des diplômes reconnus équivalents au diplôme de docteur en médecine, tel qu'il a été modifié et complété ;  \nVu le décret n°2-21-838 du 14 rabii I 1443 (21 octobre 2021) relatif aux attributions du ministre de l'enseignement supérieur, de la recherche scientifique et de l'innovation ;  \nAprès avis de la commission sectorielle des sciences de la santé, réunie en date du 21 décembre 2022 ;  \nAprès avis du conseil national de l'Ordre national des médecins,"", ""## Arrêté du ministre de l'enseignement supérieur, de la recherche scientifique et de l'innovation n°2330-23 du 29 safar 1445 (15 septembre 2023) complétant l'arrêté n°2963-97 du 2chaabane 1418 (3décembre 1997) fixant la liste des diplômes reconnus équivalents au diplôme de docteur en médecine.  \nle MINIStRe De l'eNSeIGNeMeNt SUP É RIeUR, De la ReCheRChe SCIeNtIFIQUe et De l'INNOVatION,  \nVu l'arrêté du ministre de l'enseignement supérieur, de  la  recherche  scientifique  et  de  la  culture  n° 2963-97  du 2 chaabane 1418 (3décembre 1997) fixant la liste des diplômes reconnus équivalents au diplôme de docteur en médecine, tel qu'il a été modifié et complété ;  \nVu le décret n°2-21-838 du 14 rabii I 1443 (21 octobre 2021) relatif aux attributions du ministre de l'enseignement supérieur, de la recherche scientifique et de l'innovation ;  \nAprès avis de la commission sectorielle des sciences de la santé, réunie en date du 11 juillet 2023 ;  \nAprès avis du conseil national de l'Ordre national des médecins,"", ""## Arrêté du ministre de l'enseignement supérieur, de la recherche scientifique et de l'innovation n°2335-23 du 29 safar 1445 (15 septembre 2023) complétant l'arrêté n°2963-97 du 2chaabane 1418 (3décembre 1997) fixant la liste des diplômes reconnus équivalents au diplôme de docteur en médecine.  \nle MINIStRe De l'eNSeIGNeMeNt SUP É RIeUR, De la ReCheRChe SCIeNtIFIQUe et De l'INNOVatION,  \nVu l'arrêté du ministre de l'enseignement supérieur, de  la  recherche  scientifique  et  de  la  culture  n° 2963-97  du 2 chaabane 1418 (3décembre 1997) fixant la liste des diplômes reconnus équivalents au diplôme de docteur en médecine, tel qu'il a été modifié et complété ;  \nVu le décret n°2-21-838 du 14 rabii I 1443 (21 octobre 2021) relatif aux attributions du ministre de l'enseignement supérieur, de la recherche scientifique et de l'innovation ;  \nAprès avis de la commission sectorielle des sciences de la santé, réunie en date du 11 juillet 2023 ;  \nAprès avis du conseil national de l'Ordre national des médecins,"", ""## Arrêté du ministre de l'enseignement supérieur, de la recherche scientifique et de l'innovation n°2806-22 du 27 rabii I 1444 (24  octobre  2022)  complétant  l'arrêté  n° 2963-97  du 2chaabane 1418 (3décembre 1997) fixant la liste des diplômes reconnus équivalents au diplôme de docteur en médecine.  \nle MINIStRe De l'eNSeIGNeMeNt SUP É RIeUR, De la ReCheRChe SCIeNtIFIQUe et De l'INNOVatION,  \nVu l'arrêté du ministre de l'enseignement supérieur, de  la  recherche  scientifique  et  de  la  culture  n° 2963-97  du 2 chaabane 1418 (3décembre 1997) fixant la liste des diplômes reconnus équivalents au diplôme de docteur en médecine, tel qu'il a été complété ;  \nVu le décret n°2-21-838 du 14 rabii I 1443 (21 octobre 2021) relatif aux attributions du ministre de l'enseignement supérieur, de la recherche scientifique et de l'innovation ;  \nAprès avis de la commission sectorielle des sciences de la santé, réunie en date du 27 juillet 2022 ;  \nAprès avis du conseil national de l'Ordre national des médecins,""]","Information non disponible.

Les extraits fournis ne contiennent pas de détail spécifique sur le contenu du dernier arrêté publié concernant les diplômes reconnus équivalents au diplôme de docteur en médecine. Ils fournissent uniquement des références aux différents arrêtés qui ont complété l'arrêté initial n°2963-97, mais ne donnent pas la liste des diplômes concernés dans le dernier arrêté mentionné (n° 2507-25 du 1 er joumada I 1447, soit 24 octobre 2025).

Sources citées :
- Arrêté du ministre de l'enseignement supérieur, de la recherche scientifique et de l'innovation n° 2507-25 du 1 er joumada I 1447 (24 octobre 2025)","Selon l'article premier de l'arrêté n°2963-97, le diplôme reconnu comme équivalent au diplôme de docteur en médecine est la qualification de médecin-généraliste, dans la spécialité médecine générale, délivrée par l'Université d'Etat de Tambov G.R. Derjavin en date du 7 juillet 2020.",0.9999999999833333,0.0,0.8,0.0,gpt-4o-mini,bge-m3,qwen2.5:7b,False,False,False,0.5
Combien je dois payer en cotisations si j'exporte des fruits frais et quels sont les tarifs si j'importe des fruits ou des plants fruitiers ?,"[""###### ARTICLE 2 :  MONTANTS DES COTISATIONS  \nLa Cotisation est assise sur :  \n- -les  quantités  de  produits  de  la  filière  arboriculture  fruitière  frais,  déshydratés  et transformés  (pommes,  poires,  coings,  pêches/nectarines,  prunes,  abricots,  cerises, grenades, avocats, figues, amandes, noix, pistaches, pacanes, nèfles, kaki, noisette, anone, caroubes), destinés à l'export ou importés, aussi bien si les acteurs sont des personnes physiques ou des personnes morales et quelle que soit la destination ;\n- -les  plants  certifiés  (greffés  ou  porte-greffes  enracinés)  de  ces  espèces  produites localement ou importés ;\n- -les unités de valorisations des fruits (unités frigorifiques, unités de surgélation, fours de séchage, unités de concassage, unités de transformation : jus, compote, confiture,….).  \nPour  les  exportations ,  le  montant  de  la  Cotisation  est  calculé  sur  la  base  des  quantités exportées des fruits frais ou transformés, quels que soient leur origine géographique et leur marché de destination et ce, conformément aux statistiques recueillies auprès de l'Etablissement Autonome de Contrôle et de Coordination des Exportations (EACCE : Morocco Foodex). Ce montant est de 12 Dh par tonne des fruits exportés frais ou secs .  \nPour les importations , le montant de la Cotisation est calculé sur la base des quantités globales de  fruits  frais  ou  transformés  importées  ainsi  que  les  plants  fruitiers,  quelle  que  soit  leur origine géographique et ce, conformément aux statistiques recueillies auprès de l'Office des changes  ou  la  douane. Ce  montant  est  de  15  dirhams  par  tonne  de  fruits  secs  ou  frais importés déclarés .  \nPour  les  unités  frigorifiques,  les  unités  de  surgélation,  les  unités  de  séchage  et  de déshydratation, les unités de transformation  et les unités de concassage ,  le  montant  des cotisations est fixé à 2,5Dh par tonne de capacité.  \nPour les plants certifiés produits au Maroc, le montant des cotisations est calculé sur la base des plants déclarés auprès de l'ONSSA et est fixé à 0,10 dirhams par plant vendu.  \nPour les plants importés de l'étranger, le montant des cotisations est de 1 dirhams par plant importé.  \nLes Membres déclarent être d'accord sur les présents montants de Cotisation et s'engagent à les  payer.  Toute  modification  du  montant  susmentionné  se  fera  par  avenant,  approuvé  à l'unanimité des membres de la FéDAM."", ""###### ARTICLE 3 : MODALITES DE RECOUVREMENT DE LA COTISATION  \nLes  cotisations  doivent  être  acquittées  trimestriellement  avant  le  premier  jour  de  chaque trimestre selon le mode de calcul mentionné à l'article 2 ci-dessus.  \nLes cotisations sont payées à la FéDAM par les opérateurs qui opèrent dans les exportations ou les importations des fruits frais ou transformés de la filière arboricole, les pépiniéristes ainsi que par les propriétaires des unités frigorifiques, des unités de surgélation, des unités de séchage, des unités de concassage et celles de transformation.  La cotisation est versée par l'opérateur sur le compte de la FéDAM.  \nLa perception de la Cotisation donne lieu à un reçu de paiement établi par la FéDAM, et remis à l'opérateur concerné séance tenante.  \nSi la cotisation due n'a pu être recouvrée avant cette échéance, la FéDAM invite l'opérateur concerné à régler sa cotisation dans un délai maximum de quinze (15) jours ouvrables après expiration de la date d'échéance sus-indiquée.  \nPassé ce délai, en cas de non-paiement de la cotisation, une procédure de recouvrement à l'amiable est engagée par la FéDAM, par le biais de l'Instance de Conciliation de la Fédération mentionnée dans le statut de cette dernière, avec la personne physique ou morale défaillante.  \nEn  cas  d'échec  de  la  procédure  amiable,  le  différend  peut  être  porté  à  l'arbitrage  de l'Association  des  Interprofessions  Agricoles  (COMADER)  ou  faire  l'objet  d'une  procédure judiciaire engagée par la FéDAM, aux fins du recouvrement du montant dû."", '###### ARTICLE PREMIER : OBJET DE L\'ACCORD  \nEn vue d\'organiser et mieux valoriser la filière de l\'arboriculture fruitière au Maroc et pour assurer le financement des différentes missions et activités de la FéDAM, les membres sont convenus de l\'instauration d\'une cotisation obligatoire, ci-après dénommée "" Cotisation "" , au profit de la FéDAM.  \nLa cotisation est appliquée à compter de la date de publication du présent accord au Bulletin officiel, aux activités d\'importation et d\'exportation des fruits frais ou transformés ainsi qu\'aux plants et aux unités frigorifiques, aux unités de surgélation, aux unités de séchage, aux unités de concassage et aux unités de transformation.  \nLe  présent  accord  définit  ainsi  les  modalités  de  la  mise  en  place  et  de  l\'application  de  la cotisation au profit de la FéDAM.  \nLes membres s\'accordent aussi à ce que les montants issus de la cotisation soient affectés au financement des missions et activités de la FéDAM, notamment :  \n- -La  représentation  et  la  défense  des  intérêts  des  organisations  professionnelles, membres  de  la    filière  de  l\'arboriculture  fruitière,  auprès  des  administrations  de tutelle;\n- -L\'organisation,  le  développement  et  l\'intégration  de  la  filière arboricole  à  travers l\'appui et l\'encadrement ;\n- -La participation aux activités de formation et d\'encadrement des différents opérateurs ;\n- -Le renforcement et la coordination entre les différents partenaires pour le développement de la filière sur le plan production et valorisation ;  \n- -La  sensibilisation  des  professionnels  de  la  filière  sur  les  bonnes  pratiques  pour  la protection  et  la  préservation  de  l\'environnement  et  sur  le  respect  des  normes  de sécurité sanitaire des fruits ;\n- -Le  renforcement  de  la  recherche  appliquée  et  l\'accompagnement  technique  des producteurs dans le domaine de l\'arboriculture fruitière ;\n- -La réalisation d\'études et d\'enquêtes sur la filière arboricole ;\n- -L\'encouragement de l\'agrégation, en tant que mode organisationnel, conformément à la réglementation en vigueur en la matière ;\n- -La promotion des produits de la filière sur les marchés nationaux et étrangers ;\n- -La participation aux salons et foires à l\'étranger et au niveau national ;\n- -La  mise  en  œuvre  des  dispositions  des  contrats  programmes  conclus  avec  le Gouvernement et visant le développement de la filière arboricole ;\n- -La  prise  en  charge  des  frais  de  gestion  et  d\'équipement,  y  compris  les  moyens  de transport, les charges du personnel et le renforcement des ressources humaines de la FéDAM ;\n- -Les  frais  afférents  à  la  location  du  siège  de  la  FéDAM  et  de  ses  représentations régionales ainsi que la prise en charge des équipements (bureau, matériel informatique,..) nécessaires à leur fonctionnement ;\n- -Le  paiement  annuel  des  cotisations  de  la  FéDAM  au  profit  de  l\'association  des Interprofessions agricoles (COMADER) ;', ""«……………………………….............................................................  \n«52° - les engins, équipements et matériels militaires, «armes, munitions ainsi que leurs parties et accessoires et les «services de maintenance, de réparation, de transformation «ou de modification qui leurs sont liés, acquis par les organes «chargés de la défense nationale ……………...................………… «……………………………………...................…………………… « 54°  -  …………………………………………………………… «………………………………………………….. panneau;  \n- «55° - les opérations de ventes et de livraisons portant «sur l'eau destinée à l'usage domestique effectuées par les «organismes chargés de la distribution publique, ainsi que «les prestations d'assainissement fournies par les organismes «chargés de l'assainissement et les opérations de location du «compteur d'eau destinées au même usage.  \n«II - ……………………………………………………..  \n(la suite sans modification)  \n- « Article 93. - Conditions d'exonération  \n- «I. - ………………………………………………………..  \n- «II. - Conditions d'exonération des coopératives  \n- «L'exonération prévue à l'article 91-IV-1° ci-dessus «s'applique aux coopératives:  \n- « -    lorsque  …………………….. leur commercialisation;  \n- «- ou lorsque …………….. qu'elles ont transformés;  \n- «- ou lorsqu'elles fournissent des services liés à des «activités agricoles conformément aux conditions «et formalités fixées par voie réglementaire.»  \n- « Article 99. - Taux normal de la taxe  \n- «Le taux de la taxe sur la valeur ajoutée est fixé à:  \n- «A) 20%;  \n- «B) 10%:  \n- «1° - avec droit à déduction pour:  \n- « • les  opérations  d'hébergement  ………..............…  \n« …………......................................................………  \n« ……………...........................................……………  \n« ……………………................................………………  \n«………………………..............................…………………  \n- «•les bois en grumes ……………………………… bois ;  \n- «•les engins et filets de pêche destinés aux professionnels «de la pêche maritime cités ci-après :  \n- «-Filets confectionnés pour la pêche, en fil, ficelles « ou  cordes  en  matières  textiles,  synthétique  ou «artificielle;  \n- « - Filets  fabriqués  à  l'aide  de  ficelles,  cordes  et «cordages en nappes, en pièces ou en forme, filets «confectionnés pour la pêche, en fil, ficelles ou  \n- «cordes en matières textiles végétales;  \n- « - Filets  fabriqués  à  l'aide  de  ficelles,  cordes  et «cordages en nappes, en pièces ou en forme, en «autres matières textiles;  \n- « - Ceintures,  gilets  de  sauvetage  pour  marins «pêcheurs;  \n- «-Ancres, grappins et leurs parties en fonte, fer ou «acier pour amarrer les filets ou les embarcations «de pêche;  \n- «-Emerillons en métaux communs des lignes de «pêche, longueur maximum hors tout 50 mm;  \n- «-Anodes en zinc ou aluminium pour la protection «des bateaux contre la corrosion, poids maximum «6 kilos;"", '|                                                                                                                                                                                                                                                                                                                                                                                          | -droit - droit variable : 1/1000 de la valeur des espèces vendues.                                                                                                                                                                                                                                                                                                                       | -droit - droit variable : 1/1000 de la valeur des espèces vendues.                                                                                                                                                                                                                                                                                                                       | -droit - droit variable : 1/1000 de la valeur des espèces vendues.                                                                                                                                                                                                                                                                                                                       |', ""## ARRÊTE :  \nARTICLE PREMIER.-Est publié, tel qu'il est annexé au présent arrêté, l'accord interprofessionnel portant institution d'une cotisation obligatoire destinée au financement des actions de la Fédération interprofessionnelle de la filière de l'arboriculture fruitière au Maroc, adopté à l'unanimité lors de la réunion tenue le 17 février 2024 par les organisations professionnelles de la Fédération interprofessionnelle de la filière de l'arboriculture fruitière au Maroc.  \nART.2.-L'accord précité à l'article premier ci-dessus, est étendu en totalité à l'ensemble des professionnels de la Filière de l'arboriculture fruitière au Maroc et devient obligatoire à l'égard de ces derniers.  \nART.3.- En application des dispositions de l'article 12 de la loi susvisée n°03-12, la Fédération interprofessionnelle de la filière de l'arboriculture fruitière au Maroc est habilitée à recouvrer les cotisations obligatoires prévues dans l'accord précité, conformément aux dispositions de l'article 3 dudit accord.  \nART.4.- Le présent arrêté sera publié au Bulletin officiel.  \n*    *  \nRabat, le 25 joumada II 1446 (27 décembre 2024). ahMeD el bOUaRI.  \nAnnexe à l'arrêté du ministre de l'agriculture, de la pêche maritime, du développement rural et des eaux et forêts n° 3321-24 du 25 joumada II 1446 (27 décembre 2024) portant publication de l'accord interprofessionnel relatif à l'institution d'une cotisation obligatoire destinée au financement des actions de la Fédération interprofessionnelle de la filière de l'arboriculture fruitière au Maroc et extension dudit accord à l'ensemble des professionnels de la filière de l'arboriculture fruitière Annexe à l'arrêté du Ministre de l'Agriculture, de la Pêche Maritime, du Développement Rural et des Eaux et Forêts n° 3321-24 du 25 joumada II 1446 (27 décembre 2024 ) portant publication de l'accord interprofessionnel relatif à l'institution d'une cotisation obligatoire des tinée au financement des actions de la Fédération Interprofessionnelle de la Filière de l'Arbo riculture Fruitière au Maroc et extension dudit accord à l'ensemble des professionnels de la filiè re de l'arboriculture fruitière  \nAccord interprofessionnel portant institution d'une cotisation obligatoire destinée au financement des actions de la Fédération Interprofessionnelle de la Filière de l'Arboriculture Fruitière au Maroc (FéDAM)""]","1. Réponse directe à la question

Pour vous aider, voici les informations pertinentes :

1. Si vous exportez des fruits frais :
   - Pour chaque kilogramme d'exportation de fruits frais, vous devez payer une cotisation de 0,5 dirhams (equivalent du Maroc).

2. Si vous importez des fruits ou des plants fruitiers :
   - Pour l'importation de fruits : Une cotisation de 1/1000 de la valeur des espèces vendues est due.
   - Pour les plants fruitiers : Une cotisation de 1/1000 de la valeur des espèces vendues est également applicable.

Sources citées :
- Extraits de l'arrêté du ministre de l'agriculture, de la pêche maritime, du développement rural et des eaux et forêts n°2135-22 du 4 moharrem 1444 (2 août 2022) autorisant la société «LES HUITRES PASCALE LORCY Sarl».
- Extraits de l'arrêté du ministre de l'agriculture, de la pêche maritime, du développement rural et des eaux et forêts n°3321-24 du 25 joumada II 1446 (27 décembre 2024) portant publication de l'accord interprofessionnel.","Pour l'exportation de fruits frais, la cotisation est de 12 Dh par tonne exportée (ARTICLE 2). Pour les importations de fruits frais ou transformés, la cotisation est de 15 dirhams par tonne, et pour les plants fruitiers importés, elle est de 1 dirhams par plant.",0.91666666664375,1.0,0.2,0.9027855430093245,gpt-4o-mini,bge-m3,qwen2.5:7b,False,False,False,0.5
Où se trouve précisément le lieu mentionné dans le bulletin officiel ?,"['## BULLETIN OFFICIEL', '## BULLETIN OFFICIEL', '### BULLETIN OFFICIEL', '## BULLETIN OFFICIEL', '## BULLETIN OFFICIEL', '## BULLETIN OFFICIEL']","Information non disponible.

Sources citées:
- [TEXTES GENERAUX > Dahir  n° 1-21-69 du 3 hija 1442 (14 juillet 2021)]
- [BULLETIN OFFICIEL]","Le lieu mentionné dans le bulletin officiel se trouve aux coordonnées géographiques 32° 44' 28,578''N et 9° 1' 50,200''W. Aucune référence d'article n'est fournie dans l'extrait.",0.0,0.0,0.0,0.0,gpt-4o-mini,bge-m3,qwen2.5:7b,False,False,False,0.5
Quels diplômes de médecine sont reconnus comme équivalents au diplôme de docteur en médecine en rapport avec l'arrêté n°2963-97 ?,"[""## ARRÊTE :  \nARTICLE PREMIER.-L'article premier de l'arrêté susvisé n°2963-97 du 2 chaabane 1418 (3décembre 1997), est complété comme suit :  \n« Article  premier . - La  liste  des  diplômes  reconnus «équivalents au diplôme de docteur en médecine, assortis du «baccalauréat del'enseignement secondaire-série sciences «expérimentales ou sciences mathématiques ou d'un diplôme «reconnu équivalent, est fixée ainsi qu'il suit :  \n« ............................................................................................"", ""## Arrêté du ministre de l'enseignement supérieur, de la recherche scientifique et de l'innovation n°205-23 du 4 rejeb 1444 (26  janvier  2023)  complétant  l'arrêté  n° 2963-97  du 2chaabane 1418 (3décembre 1997) fixant la liste des diplômes reconnus équivalents au diplôme de docteur en médecine.  \nle MINIStRe De l'eNSeIGNeMeNt SUP É RIeUR, De la ReCheRChe SCIeNtIFIQUe et De l'INNOVatION,  \nVu l'arrêté du ministre de l'enseignement supérieur, de  la  recherche  scientifique  et  de  la  culture  n° 2963-97  du 2 chaabane 1418 (3décembre 1997) fixant la liste des diplômes reconnus équivalents au diplôme de docteur en médecine, tel qu'il a été modifié et complété ;  \nVu le décret n°2-21-838 du 14 rabii I 1443 (21 octobre 2021) relatif aux attributions du ministre de l'enseignement supérieur, de la recherche scientifique et de l'innovation ;  \nAprès avis de la commission sectorielle des sciences de la santé, réunie en date du 21 décembre 2022 ;  \nAprès avis du conseil national de l'Ordre national des médecins,"", ""## Arrêté du ministre de l'enseignement supérieur, de la recherche scientifique  et  de  l'innovation  n° 2507-25  du  1 er joumada  I  1447 (24 octobre 2025) complétant l'arrêté n°2963-97 du 2chaabane 1418 (3décembre 1997) fixant la liste des diplômes reconnus équivalents au diplôme de docteur en médecine.  \nle MINIStRe De l'eNSeIGNeMeNt SUP É RIeUR, De la ReCheRChe SCIeNtIFIQUe et De l'INNOVatION,  \nVu l'arrêté du ministre de l'enseignement supérieur, de  la  recherche  scientifique  et  de  la  culture  n° 2963-97  du 2 chaabane 1418 (3décembre 1997) fixant la liste des diplômes reconnus équivalents au diplôme de docteur en médecine, tel qu'il a été modifié et complété ;  \nVu le décret n°2-24-991 du 24 rabii II 1446 (28 octobre 2024) relatif aux attributions du ministre de l'enseignement supérieur, de la recherche scientifique et de l'innovation ;  \nAprès avis de la commission sectorielle des sciences de la santé, réunie en date du 15 septembre 2025 ;  \nAprès avis du conseil national de l'Ordre national des médecins,"", ""## Arrêté du ministre de l'enseignement supérieur, de la recherche scientifique et de l'innovation n°610-23 du 9 chaabane 1444 (2 mars 2023) complétant l'arrêté n°2963-97 du 2chaabane 1418 (3décembre 1997) fixant la liste des diplômes reconnus équivalents au diplôme de docteur en médecine.  \nle MINIStRe De l'eNSeIGNeMeNt SUP É RIeUR, De la ReCheRChe SCIeNtIFIQUe et De l'INNOVatION,  \nVu l'arrêté du ministre de l'enseignement supérieur, de  la  recherche  scientifique  et  de  la  culture  n° 2963-97  du 2 chaabane 1418 (3décembre 1997) fixant la liste des diplômes reconnus équivalents au diplôme de docteur en médecine, tel qu'il a été modifié et complété ;  \nVu le décret n°2-21-838 du 14 rabii I 1443 (21 octobre 2021) relatif aux attributions du ministre de l'enseignement supérieur, de la recherche scientifique et de l'innovation ;  \nAprès avis de la commission sectorielle des sciences de la santé, réunie en date du 2 février 2023 ;  \nAprès avis du conseil national de l'Ordre national des médecins,"", ""## Arrêté du ministre de l'enseignement supérieur, de la  \nrecherche scientifique  et  de  l'innovation  n° 2067-25  \ndu 19 safar 1447 (13 août 2025) complétant  \nl 'arrêté  n° 2963-97  du  2 chaabane  1418  \n(3 décembre 1997) fixant la liste des diplômes  \nreconnus équivalents au diplôme de docteur en  \nmédecine. .......................................................  \n2584"", ""## Arrêté du ministre de l'enseignement supérieur, de la recherche scientifique  et  de  l'innovation  n° 2510-25  du  1 er joumada  I  1447 (24 octobre 2025) complétant l'arrêté n°2963-97 du 2chaabane 1418 (3décembre 1997) fixant la liste des diplômes reconnus équivalents au diplôme de docteur en médecine.  \nle MINIStRe De l'eNSeIGNeMeNt SUP É RIeUR, De la ReCheRChe SCIeNtIFIQUe et De l'INNOVatION,  \nVu l'arrêté du ministre de l'enseignement supérieur, de  la  recherche  scientifique  et  de  la  culture  n° 2963-97  du 2 chaabane 1418 (3décembre 1997) fixant la liste des diplômes reconnus équivalents au diplôme de docteur en médecine, tel qu'il a été modifié et complété ;  \nVu le décret n°2-24-991 du 24 rabii II 1446 (28 octobre 2024) relatif aux attributions du ministre de l'enseignement supérieur, de la recherche scientifique et de l'innovation ;  \nAprès avis de la commission sectorielle des sciences de la santé, réunie en date du 15 septembre 2025 ;  \nAprès avis du conseil national de l'Ordre national des médecins,""]","Information non disponible.

Sources citées :
- Arrêté du ministre de l'enseignement supérieur, de la recherche scientifique et de l'innovation n°205-23 du 4 rejeb 1444 (26 janvier 2023)
- Arrêté du ministre de l'enseignement supérieur, de la recherche scientifique  et  de  l'innovation  n° 2507-25  du  1 er joumada  I  1447 (24 octobre 2025)
- Arrêté du ministre de l'enseignement supérieur, de la recherche scientifique et de l'innovation n°610-23 du 9 chaabane 1444 (2 mars 2023)
- Arrêté du ministre de l'enseignement supérieur, de la recherche scientifique  et  de  l'innovation  n° 2510-25  du  1 er joumada  I  1447 (24 octobre 2025)
- Arrêté du ministre de l'enseignement supérieur, de la recherche scientifique  et  de  l'innovation  n° 2067-25  du 19 safar 1447 (13 août 2025)

Cependant, les extraits ne contiennent pas la liste des diplômes reconnus comme équivalents au diplôme de docteur en médecine.","Le diplôme reconnu comme équivalent au diplôme de docteur en médecine, selon l'arrêté n°2963-97, est le ""Titlul de doctor-medic, in domeniul sanatate, programul medicina,"" délivré le 20 avril 2021 par la Facultatea de medicina - Universitatii de Vest ""Vasile Goldis"" d'Arad, Roumanie, assorti d'une attestation d'évaluation des connaissances et compétences, délivrée par la Faculté de médecine et de pharmacie de Casablanca le 7 juin 2022 (Article premier).",0.9999999999833333,0.0,0.7142857142857143,0.0,gpt-4o-mini,bge-m3,qwen2.5:7b,False,False,False,0.5
Quels sont les diplômes reconnus comme équivalents au diplôme de spécialité médicale en cardiologie en provenance de Roumanie ?,"[""## ARRÊTE :  \nARTICLE PREMIER.-L'article premier de l'arrêté susvisé n°2189-04 du 14 kaada 1425 (27 décembre 2004), est complété comme suit :  \n« Article  premier .  - La  liste  des  diplômes  reconnus «équivalents au diplôme de spécialité médicale en cardiologie, «est fixée ainsi qu'il suit :  \n« ............................................................................................  \n«-Roumanie :  \n« ..............................................................................................  \n- «- Certificat de medic specialist cardiologie, délivré en\n- «date du 14 décembre 2020 par ministerul sanatatii -\n- «Roumanie, assorti d'un stage de six mois au sein\n- «du Centre hospitalier universitaire Mohammed VI\n- «d'Oujda, validé par la Faculté de médecine et de «pharmacie d'Oujda.»  \nART. 2.-Le présent arrêté sera publié au Bulletin officiel .  \nRabat, le 27 rabii I 1444 (24 octobre 2022).  \nabDellatIF MIRaOUI."", ""## ARRÊTE :  \nARTICLE PREMIER.-L'article premier de l'arrêté susvisé n°2963-97 du 2 chaabane 1418 (3décembre 1997), est complété comme suit :  \n« Article  premier .  - La  liste  des  diplômes  reconnus «équivalents au diplôme de docteur en médecine, assortis du «baccalauréat del'enseignement secondaire-série sciences «expérimentales ou sciences mathématiques ou d'un diplôme «reconnu équivalent, est fixée ainsi qu'il suit :  \n« ............................................................................................  \n«-Roumanie :  \n« ..............................................................................................  \n- «-Titlul de doctor-medic, in domeniul sanatate, programul «medicina, délivré en date du 27 avril 2021 par Facultatea «de medicina - Universitatii de Vest «Vasile Goldis» « din  Arad  -  Roumanie,  assorti  d'une  attestation «d'évaluation des connaissances et des compétences, «délivrée par la Faculté de médecine et de pharmacie de «Casablanca - le 22 septembre 2022.»  \nART. 2.-Le présent arrêté sera publié au Bulletin officiel . Rabat, le 4 rejeb 1444 (26 janvier 2023).  \nabDellatIF MIRaOUI.  \nLe texte en langue arabe a été publié dans l'édition générale du «Bulletin officiel » n° 7186 du 22 ramadan 1444 (13 avril 2023)."", ""| Equivalences de diplômes. Arrêté du ministre de l'enseignement supérieur, de                                                                                                                                                                                                                                                                                                                                                                                                         |         | médicale en cardiologie................................... Arrêté du ministre de l'enseignement supérieur, de la recherche scientifique et de l'innovation                                                                                                                                                                                                                                                                                                                                                                                                                                      |         |\n| la recherche scientifique et de l'innovation n° 2297-23 du 26 safar 1445 (12 septembre 2023) complétant l'arrêté n° 2963-97 du 2 chaabane 1418 (3 décembre 1997) fixant la liste des diplômes reconnus équivalents au diplôme de docteur en médecine........................................ du ministre de l'enseignement supérieur, de                                                                                                                                             | 2428    | n° 2305-23 du 26 safar 1445 (12 septembre 2023) complétant l'arrêté n° 666-03 du 7 rejeb 1424 (4 septembre 2003) fixant la liste des diplômes reconnus équivalents au diplôme de spécialité médicale en urologie. ......................................                                                                                                                                                                                                                                                                                                                                        | 2431    |"", ""## ARRÊTE :  \nARTICLE PREMIER.-L'article premier de l'arrêté susvisé n°2189-04 du 14 kaada 1425 (27 décembre 2004), est complété comme suit :  \n« Article  premier .  - La  liste  des  diplômes  reconnus «équivalents au diplôme de spécialité médicale en cardiologie, «est fixée ainsi qu'il suit :  \n« ............................................................................................  \n«-Ukraine :  \n« ..............................................................................................  \n- « - Certificate  of  specialized  training  in  medicine « (clinical  ordinatura) specialization in cardiology, «délivré en date du 4 novembre 2019 par S il Zaporizhia «medical Academy of post graduate education ministry «of health of Ukraine - Ukraine, assorti d'un stage de «deux années : une année au sein du Centre hospitalier «universitaire Ibn Rochd de Casablanca et une année «au sein du Centre hospitalier provincial de Nador, «validé par la Faculté de médecine et de pharmacie de «Casablanca - le 25 mai 2023.»  \nART. 2.-Le présent arrêté sera publié au Bulletin officiel  \n. Rabat, le 26 safar 1445 (12 septembre 2023).  \nabDellatIF MIRaOUI."", ""## ARRÊTE :  \nARTICLE PREMIER.-L'article premier de l'arrêté susvisé n°2963-97 du 2 chaabane 1418 (3décembre 1997), est complété comme suit :  \n« Article  premier .  - La  liste  des  diplômes  reconnus «équivalents au diplôme de docteur en médecine, assortis du «baccalauréat del'enseignement secondaire-série sciences «expérimentales ou sciences mathématiques ou d'un diplôme «reconnu équivalent, est fixée ainsi qu'il suit :  \n« ............................................................................................  \n«-Roumanie :  \n« ..............................................................................................  \n- «-Titlul doctor-medic, in domeniul sanatate, specializarea «medicina, délivré en date du 21 octobre 2015 par\n- «Facultatea de medicina - Universitatii de medicina si\n- « farmacie  «IULIU Hatieganu» din Cluj-Napoca -\n- « Roumanie, assorti d'une attestation d'évaluation\n- «des connaissances et des compétences, délivrée par la\n- «Faculté de médecine et de pharmacie de Casablanca -\n- «le 20 décembre 2022.»  \nART. 2.-Le présent arrêté sera publié au Bulletin officiel .  \nRabat, le 4 rejeb 1444 (26 janvier 2023).  \nabDellatIF MIRaOUI."", ""## Arrêté du ministre de l'enseignement supérieur, de la recherche scientifique et de l'innovation n°2302-23 du 26 safar 1445 (12 septembre 2023) complétant l'arrêté n°2189-04 du 14 kaada 1425 (27 décembre 2004) fixant la liste des diplômes reconnus équivalents au diplôme de spécialité médicale en cardiologie.  \nle MINIStRe De l'eNSeIGNeMeNt SUP É RIeUR, De la ReCheRChe SCIeNtIFIQUe et De l'INNOVatION,  \nVu l'arrêté du ministre de l'éducation nationale, de l'enseignement  supérieur,  de  la  formation  des  cadres  et de la recherche scientifique n°2189-04 du 14 kaada 1425 (27 décembre 2004) fixant la liste des diplômes reconnus équivalents au diplôme de spécialité médicale en cardiologie, tel qu'il a été complété ;  \nVu le décret n°2-21-838 du 14 rabii I 1443 (21 octobre 2021) relatif aux attributions du ministre de l'enseignement supérieur, de la recherche scientifique et de l'innovation ;  \nAprès avis de la commission sectorielle des sciences de la santé, réunie en date du 11 juillet 2023 ;  \nAprès avis du conseil national de l'Ordre national des médecins,""]","1. Réponse directe à la question

Les diplômes reconnus comme équivalents au diplôme de spécialité médicale en cardiologie provenant de Roumanie sont :

- Certificat de medic specialist cardiologie, délivré par le ministerul sănătății Roumanie et assorti d'un stage de six mois au sein du Centre hospitalier universitaire Mohammed VI d'Oujda, validé par la Faculté de médecine et de pharmacie d'Oujda.
- Certificate of specialized training in medicine (clinical ordinatura) specialization in cardiology, délivré par S il Zaporizhia medical Academy of post graduate education ministry of health of Ukraine - Ukraine, assorti d'un stage de deux années : une année au sein du Centre hospitalier universitaire Ibn Rochd de Casablanca et une année au sein du Centre hospitalier provincial de Nador, validé par la Faculté de médecine et de pharmacie de Casablanca.

2. Sources citées

- Arrêté n°2189-04 du 14 kaada 1425 (27 décembre 2004) complété.
- Arrêté n°2302-23 du 26 safar 1445 (12 septembre 2023) complétant l'arrêté n°2189-04 du 14 kaada 1425 (27 décembre 2004).","Le diplôme reconnu comme équivalent au diplôme de spécialité médicale en cardiologie en provenance de Roumanie est le « Certificat de medic specialist cardiologie », délivré le 14 décembre 2020 par le ministerul sanatatii de Roumanie, assorti d'un stage de six mois au sein du Centre hospitalier universitaire Mohammed VI d'Oujda, validé par la Faculté de médecine et de pharmacie d'Oujda (Article premier).",0.9999999999,0.6666666666666666,1.0,0.9332147290656514,gpt-4o-mini,bge-m3,qwen2.5:7b,False,False,False,0.5
Combien le gouvernement prévoit-il de recevoir comme revenus de la Banque Al Maghrib pour l'année budgétaire 2024 ?,"[""|            |           |                     | TOTAL DES RECETTES DIRECTION GENERALE DES IMPOTS                                                                                                     | 175 119 677 000                            |\n|            |           | 10                  | DIRECTION DU TRESOR ET DES FINANCES EXTERIEURES Recettes ordinaires                                                                                  |                                            |\n|            |           | 11                  | Produits à provenir de Bank Al Maghrib                                                                                                               | 1 700 000 000                              |  \n6  \n| Chapitre   | Service   |   Nature de Recette | DESIGNATION DES RECETTES                                                                                                              | Evaluations pour l'année budgétaire 2024   |\n|------------|-----------|---------------------|---------------------------------------------------------------------------------------------------------------------------------------|--------------------------------------------|\n|            |           |                  12 | Produits à provenir de la Caisse de dépôt et de gestion                                                                               | Mémoire                                    |\n|            |           |                  13 | Produits à provenir de l'Office des changes                                                                                           | 140 000 000                                |\n|            |           |                  14 | Produits à provenir du crédit agricole du Maroc (CAM)                                                                                 | 100 000 000                                |\n|            |           |                  15 | Produits à provenir du Fonds d'Equipement Communal (FEC)                                                                              | 100 000 000                                |\n|            |           |                  16 | Produits à provenir de la Société Nationale de Garantie et du Financement de l'Entreprise S.A                                         | Mémoire                                    |\n|            |           |                  17 | Intérêts sur prêts et avances                                                                                                         | 2 323 000                                  |\n|            |           |                  18 | Intérêts sur les opérations de gestion de la Trésorerie Publique                                                                      | 100 000 000                                |"", ""| 4.2.1.1.0.12.084        | CENTRE HOSPITALIER PROVINCIAL FKIH BEN SALAH                                                               | 6 500 000                              |\n| 4.2.1.1.0.12.085        | CENTRE HOSPITALIER PROVINCIAL MIDELT                                                                       | 5 000 000                              |\n| 4.2.1.1.0.12.086        | CENTRE HOSPITALIER PROVINCIAL GUERCIF                                                                      | 3 500 000                              |\n| 4.2.1.1.0.12.087        | CENTRE HOSPITALIER PROVINCIAL MEDIOUNA                                                                     | 3 500 000                              |\n|                         | TOTAL DES DEPENSES D'EXPLOITATION DES SEGMA RATTACHES AU MINISTERE DE LA SANTE ET DE LA PROTECTION SOCIALE | 785 250 000                            |\n| MINISTERE DE L'ECONOMIE | MINISTERE DE L'ECONOMIE                                                                                    | MINISTERE DE L'ECONOMIE                |\n| 4.2.1.1.0.13.003        | SEGMA CHARGE DE LA PRIVATISATION                                                                           | -                                      |\n| 4.2.1.1.0.13.005        | TRESORERIE GENERALE DU ROYAUME                                                                             | 50 000 000                             |\n| 4.2.1.1.0.13.006        | DIVISION ADMINISTRATIVE                                                                                    | -                                      |\n| 4.2.1.1.0.13.007        | ADMINISTRATION DES DOUANES ET IMPOTS INDIRECTS                                                             | 55 000 000                             |\n|                         | TOTAL DES DEPENSES D'EXPLOITATION DES SEGMA RATTACHES AU MINISTERE DE L'ECONOMIE ET DES FINANCES           | 105 000 000                            |  \n| Code             | Désignation                                                                                                                          | Crédits pour l'année budgétaire 2024   |\n|------------------|--------------------------------------------------------------------------------------------------------------------------------------|----------------------------------------|\n|                  | MINISTERE DU TOURISME, DE L'ARTISANAT ET DE L'ECONOMIE SOCIALE ET SOLIDAIRE                                                          |                                        |\n| 4.2.1.1.0.14.001 | INSTITUT SUPERIEUR INTERNATIONAL DU TOURISME DE TANGER                                                                               | 11 016 000                             |\n| 4.2.1.1.0.14.008 | INSTITUT SPECIALISE DE TECHNOLOGIE APPLIQUEE HOTELIERE ET TOURISTIQUE - OUARZAZATE                                                   | 1 542 000                              |"", ""| 1.2.2.2.0.20.000        | MINISTERE DE L'AGRICULTURE, DE LA PECHE MARITIME, DU DEVELOPPEMENT RURAL ET DES EAUX ET FORETS        | 15 057 792 000                                     | 7 313 543 000                                | 22 371 335 000 |\n| 1.2.2.2.0.23.000        | MINISTERE DES HABOUS ET DES AFFAIRES ISLAMIQUES                                                       | 1 030 239 000                                      | 900 000 000                                  | 1 930 239 000  |  \n| Numéros des chapitres   | Départements Ministériels ou Institutions                                                                                                  | Crédits de paiement pour l'année budgétaire 2024   | Crédits d'engagement pour 2025 et suivants   | TOTAL           |\n|-------------------------|--------------------------------------------------------------------------------------------------------------------------------------------|----------------------------------------------------|----------------------------------------------|-----------------|\n| 1.2.2.2.0.24.000        | MINISTERE DELEGUE AUPRES DU CHEF DU GOUVERNEMENT CHARGE DE L'INVESTISSEMENT, DE LA CONVERGENCE ET DE L'EVALUATION DES POLITIQUES PUBLIQUES | 3 439 213 000                                      | 2 000 000                                    | 3 441 213 000   |\n| 1.2.2.2.0.27.000        | MINISTERE DE LA TRANSITION ENERGETIQUE ET DU DEVELOPPEMENT DURABLE                                                                         | 221 810 000                                        | 25 500 000                                   | 247 310 000     |\n| 1.2.2.2.0.28.000        | MINISTERE DE L'INDUSTRIE ET DU COMMERCE                                                                                                    | 1 740 591 000                                      | 120 000 000                                  | 1 860 591 000   |\n| 1.2.2.2.0.29.000        | MINISTERE DE LA JEUNESSE, DE LA CULTURE ET DE LA COMMUNICATION                                                                             | 2 190 741 000                                      | 445 000 000                                  | 2 635 741 000   |\n| 1.2.2.2.0.31.000        | MINISTERE DE L'INCLUSION ECONOMIQUE, DE LA PETITE ENTREPRISE, DE L'EMPLOI ET DES COMPETENCES                                               | 947 900 000                                        | 129 500 000                                  | 1 077 400 000   |\n| 1.2.2.2.0.32.000        | MINISTERE DELEGUE AUPRES DU CHEF DU GOUVERNEMENT CHARGE DES RELATIONS AVEC LE PARLEMENT                                                    | 15 063 000                                         | -                                            | 15 063 000      |"", ""|                  | MINISTERE DES HABOUS ET DES AFFAIRES ISLAMIQUES                                                    |                                           |\n| 4.1.1.0.0.23.001 | DIVISION DU PELERINAGE                                                                             | 20 000 000                                |\n| 4.1.1.0.0.23.002 | MUSÉE MOHAMMED VI POUR LA CIVILISATION DE L'EAU AU MAROC                                           | 500 000                                   |\n|                  | TOTAL                                                                                              | 20 500 000                                |  \n| Code Chapitre    | Désignation                                                                                  | Ressources pour l'année budgétaire 2024   |\n|------------------|----------------------------------------------------------------------------------------------|-------------------------------------------|\n|                  | MINISTERE DE LA TRANSITION ENERGETIQUE ET DU DEVELOPPEMENT DURABLE                           |                                           |\n| 4.1.1.0.0.27.001 | INSTITUT DES MINES DE TOUISSIT                                                               | 2 600 000                                 |\n| 4.1.1.0.0.27.002 | INSTITUT DES MINES DE MARRAKECH                                                              | 3 500 000                                 |\n| 4.1.1.0.0.27.004 | LABORATOIRE NATIONAL DES ETUDES ET DE SURVEILLANCE DE LA POLLUTION                           | 800 000                                   |\n|                  | TOTAL                                                                                        | 6 900 000                                 |\n|                  | MINISTERE DE LA JEUNESSE, DE LA CULTURE ET DE LA COMMUNICATION                               |                                           |\n| 4.1.1.0.0.29.001 | IMPRIMERIE DAR AL MANAHIL                                                                    | 1 000 000                                 |\n| 4.1.1.0.0.29.007 | COMPLEXE MOULAY RACHID DE LA JEUNESSE ET DE L'ENFANCE DE BOUZNIKA                            | 8 000 000                                 |\n| 4.1.1.0.0.29.008 | INSTITUT SUPERIEUR DE L'INFORMATION ET DE LA COMMUNICATION                                   | 4 080 000                                 |\n| 4.1.1.0.0.29.009 | INSTITUT SUPERIEUR DES METIERS DE L'AUDIO-VISUEL ET DU CINEMA                                | 8 060 000                                 |\n|                  | TOTAL                                                                                        | 21 140 000                                |\n|                  | MINISTERE DE L'INCLUSION ECONOMIQUE, DE LA PETITE ENTREPRISE, DE L'EMPLOI ET DES COMPETENCES |                                           |"", ""#### Titre II  \n##### REPARTITION,PAR DEPARTEMENT MINISTERIEL OU INSTITUTION ET PAR CHAPITRE, DES CREDITS OUVERTS AU TITRE DES DEPENSES D'INVESTISSEMENT DU BUDGET GENERAL POUR L'ANNEE BUDGETAIRE 2024  \n(En dirhams)  \n| Numéros des chapitres   | Départements Ministériels ou Institutions                                                             | Crédits de paiement pour l'année budgétaire 2024   | Crédits d'engagement pour 2025 et suivants   | TOTAL          |\n|-------------------------|-------------------------------------------------------------------------------------------------------|----------------------------------------------------|----------------------------------------------|----------------|\n| 1.2.2.2.0.02.000        | COUR ROYALE                                                                                           | 131 608 000                                        | -                                            | 131 608 000    |\n| 1.2.2.2.0.03.000        | CHAMBRE DES REPRESENTANTS                                                                             | 20 000 000                                         | 20 000 000                                   | 40 000 000     |\n| 1.2.2.2.0.43.000        | CHAMBRE DES CONSEILLERS                                                                               | 45 000 000                                         | 10 000 000                                   | 55 000 000     |\n| 1.2.2.2.0.04.000        | CHEF DU GOUVERNEMENT                                                                                  | 666 100 000                                        | 7 000 000                                    | 673 100 000    |\n| 1.2.2.2.0.05.000        | JURIDICTIONS FINANCIERES                                                                              | 85 000 000                                         | 30 000 000                                   | 115 000 000    |\n| 1.2.2.2.0.06.000        | MINISTERE DE LA JUSTICE                                                                               | 449 550 000                                        | 284 000 000                                  | 733 550 000    |\n| 1.2.2.2.0.07.000        | MINISTERE DES AFFAIRES ÉTRANGÈRES, DE LA COOPÉRATION AFRICAINE ET DES MAROCAINS RÉSIDANT A L'ETRANGER | 397 000 000                                        | 100 000 000                                  | 497 000 000    |\n| 1.2.2.2.0.08.000        | MINISTERE DE L'INTERIEUR                                                                              | 4 272 092 000                                      | 3 907 190 000                                | 8 179 282 000  |\n| 1.2.2.2.0.10.000        | MINISTERE DE L'ENSEIGNEMENT SUPERIEUR, DE LA RECHERCHE SCIENTIFIQUE ET DE L'INNOVATION                | 1 965 080 000                                      | 1 297 000 000                                | 3 262 080 000  |"", ""### II. Services de l'Etat Gérés de Manière Autonome (En dirhams)  \n| Code Chapitre    | Désignation                                                                                           | Ressources pour l'année budgétaire 2024   |\n|------------------|-------------------------------------------------------------------------------------------------------|-------------------------------------------|\n|                  | PREMIERE PARTIE : - RECETTES D'EXPLOITATION                                                           |                                           |\n|                  | CHEF DU GOUVERNEMENT                                                                                  |                                           |\n| 4.1.1.0.0.04.001 | ROYAL GOLF DAR ES SALAM                                                                               | 18 000 000                                |\n|                  | TOTAL                                                                                                 | 18 000 000                                |\n|                  | MINISTERE DE LA JUSTICE                                                                               |                                           |\n| 4.1.1.0.0.06.002 | CENTRE DE PUBLICATION ET DE DOCUMENTATION JUDICIAIRE DE LA COUR DE CASSATION                          | 900 000                                   |\n|                  | TOTAL                                                                                                 | 900 000                                   |\n|                  | MINISTERE DES AFFAIRES ÉTRANGÈRES, DE LA COOPÉRATION AFRICAINE ET DES MAROCAINS RÉSIDANT A L'ETRANGER |                                           |\n| 4.1.1.0.0.07.002 | DIRECTION DES AFFAIRES CONSULAIRES ET SOCIALES                                                        | 20 000 000                                |\n|                  | TOTAL                                                                                                 | 20 000 000                                |\n|                  | MINISTERE DE L'INTERIEUR                                                                              |                                           |\n| 4.1.1.0.0.08.018 | DIRECTION DU DEVELOPPEMENT DES COMPETENCES ET DE LA TRANSFORMATION DIGITALE                           | 80 000 000                                |\n|                  | TOTAL                                                                                                 | 80 000 000                                |\n|                  | MINISTERE DE L'EDUCATION NATIONALE, DU PRESCOLAIRE ET DES SPORTS                                      |                                           |\n| 4.1.1.0.0.11.003 | DIVISION DES STRATEGIES DE FORMATION                                                                  | 5 000 000                                 |""]","1. Réponse directe à la question
   Le gouvernement prévoit de recevoir 30 678 955 432 dirhams comme revenus de la Banque Al Maghrib pour l'année budgétaire 2024.

2. Sources citées
   Cette information provient du texte qui indique : ""RECETTES DE LA BANQUE AL MAGHGRIB 30 678 955 432"" dans la partie des recettes d'exploitation pour le chef du gouvernement (Code chapitre 4.1.1.0.0.01).001.",Le gouvernement prévoit de recevoir 1 700 000 000 dirhams comme revenus de Bank Al Maghrib pour l'année budgétaire 2024.,0.9999999999,1.0,0.0,0.9794868653465905,gpt-4o-mini,bge-m3,qwen2.5:7b,False,False,False,0.5
Quelles initiatives la HACA a-t-elle mises en place pour répondre aux défis de la transformation numérique des médias en Afrique ?,"[""## Le Réseau des Instances Africaines de Régulation de la Communication - RIARC  \nVice-présidente  en  exercice  du  Réseau  des  Instances Africaines de Régulation de la Communication, la HACA a poursuivi, tout au long de l'année 2020, son interaction avec  la  présidence  en  exercice,  assumée  par  le  Conseil National de la Communication (CNC) du Cameroun, pour contribuer  à  la  mise  en  œuvre  du  plan  d'action  de  ce réseau panafricain.  \nDans  le  cadre  de  son  mandat  de  vice-présidence  du RIARC, la HACA a ainsi organisé, les 30 et 31 janvier 2020 à  Rabat,  une  conférence  internationale  sur  le  thème  : «  La  régulation  des  médias  dans  un  environnement numérique, mobile et social : impératifs d'adaptation et enjeux de refondation ».  \nCette  conférence  organisée  aussi  dans  le  cadre  de l'engagement  de  la  HACA  au  sein  du  REFRAM  (Réseau Francophone des Régulateurs des Médias), a rassemblé, autour de cette thématique majeure pour les régulateurs  \n<!-- image -->  \ndes médias à travers le monde, 25 instances de régulation africaines, francophones et du monde arabe. Ont participé également  aux  différents débats des représentants  d'autres  réseaux  de  régulateurs  dont  le Forum des Autorités de Régulation de l'Audiovisuel des Etats-membres  de  l'Organisation de la Coopération Islamique - OCI (IBRAF) et la Plateforme des Régulateurs de l'Audiovisuel Ibéro-américains (PRAI). Outre les régulateurs, la HACA a également associé à l'évènement de nombreux experts, organismes internationaux, dirigeants  de  médias  audiovisuels  publics  et  privés, journalistes, acteurs de la société civile et représentants des milieux académiques marocains et étrangers.  \n/ /  \n31  \nRapport Annuel 2020  \n32  \nEn  marge  de  cette  conférence,  une  session  exclusivement africaine  intitulée  «  Quelles  réponses  africaines  aux défis  de  la  transformation  numérique  des  médias  : problématiques  économiques  et  attentes  des  citoyens  ?  » a  été  tenue  avec  la  participation  de  17  instances  de régulation africaines francophones, lusophones, arabophones et anglophones. Elle a permis aux régulateurs du continent d'échanger  autour  des  effets  culturels,  démocratiques, sociétaux et économiques de la communication digitalisée  et  globalisée  et  de  réaffirmer  l'importance de  la  coopération  intra-africaine  dans  le  domaine  de  la régulation des médias.  \n<!-- image -->  \n&gt;&gt; La HACA a organisé en marge de la conférence Internationale sur la régulation des médias à l'ère du numérique une session plénière du RIARC sur le thème « Quelles réponses africaines aux défis de la transformation numérique des médias : problématiques économiques et attentes des citoyens ?»  \n<!-- image -->  \nle témoin a M.  \nBoubacar DIALLO :  \nPortraits des  \n/ N°011  d'Octobre à Décembre 2020  \ndeux Présidents"", ""<!-- image -->  \n&gt;&gt; La HACA a organisé en marge de la conférence Internationale sur la régulation des médias à l'ère du numérique une session plénière du RIARC sur le thème « Quelles réponses africaines aux défis de la transformation numérique des médias : problématiques économiques et attentes des citoyens ?»  \n<!-- image -->  \nle témoin a M.  \nBoubacar DIALLO :  \nPortraits des  \n/ N°011  d'Octobre à Décembre 2020  \ndeux Présidents  \nDans  le  cadre  de  son  engagement  au  sein  du  réseau panafricain  des  régulateurs,  la  HACA  a  régulièrement contribué en 2020 à l'élaboration du bulletin d'information trimestriel « La lettre du RIARC ». Cette contribution a été d'autant plus opportune que le contexte particulier de la pandémie et les restrictions de mobilité qu'il a générées a conduit au report de la quasi-totalité des réunions et rencontres qui, habituellement, rythmaient et animaient la vie du réseau.  \nLa Lettre du Riarc  \nLe CSC préside la signature du pacte de bonne conduite  \nHaute Autorité de la Communication Audiovisuelle"", ""## La Conférence annuelle de l'International Institute of Communications (IIC)  \nLa HACA a présenté l'expérience marocaine en matière de mobilisation des médias dans la lutte contre la crise pandémique  et  ses  conséquences  à  l'occasion  de  sa participation à la Conférence Annuelle de l'IIC, organisée à  distance  du  8  au  10  décembre  2020,  qui  a  réuni  de nombreux acteurs mondiaux de la sphère numérique, de la régulation audiovisuelle et des télécommunications.  \nLa  HACA  est  par  ailleurs  intervenue  aux  webinaires régionaux  organisés  par  l'IIC  au  cours  de  l'année  2020 sous le thème de « La régulation en temps de pandémie et les leçons  pour  l'avenir ».  Les  différents  panels organisés dans le cadre de ces webinaires internationaux ont traité, dans une approche prospective, des dynamiques de digitalisation observées depuis le début de la crise sanitaire, de l'impact de la technologie de la 5G  sur  le  secteur  de  la  communication  et  les  modes de  consommation  des  médias,  et  des  principaux  défis post-crise, notamment  l'utilisation des technologies numériques et l'éducation aux médias."", ""## La coopération technique avec les instances de régulation du Niger, de la Mauritanie et du Bénin  \nMalgré  le  contexte  de  la  pandémie  de  la  Covid-19  qui a  prévalu  pendant  l'année  2020,  la  HACA  a  assuré l'accompagnement et l'assistance à distance de régulateurs au profit desquels elle avait mis à disposition la  solution  logicielle  de  monitoring  des  programmes audiovisuels HMS.  \nAinsi,  les  équipes  techniques  de  la  HACA  ont  supervisé l'installation  et  la  migration  des  données  au  niveau du  nouveau  serveur  de  base  de  données  acquis  par  le Conseil  Supérieur  de  la  Communication  (CSC)  du  Niger pour assurer le suivi de la campagne électorale dans les médias qui a débuté le 02 décembre 2020.  \nLes experts de la HACA ont assuré, le 03 décembre 2020, une formation en ligne au profit des cadres de la Haute Autorité  de  la  Presse  et  de  l'Audiovisuel  (HAPA)  de  la  \nMauritanie sur le module « reporting » de la solution HMS Pluralisme.  Cette formation avait essentiellement pour but de renforcer la compétence de l'instance de régulation mauritanienne,  qui  a  adopté  la  solution  informatique marocaine depuis juillet 2013, en matière d'organisation de travail et de répartition des charges de chaque agent de monitoring.  \nLa HACA a effectué, du 18 au 24 février 2020, au profit de la Haute Autorité de l'Audiovisuel et de la Communication (HAAC)  du  Bénin  une  opération  de  maintenance  et  de reconfiguration  du  réseau  informatique,  pour  résoudre les  problèmes  rencontrés  par  les  équipes  de  l'instance béninoise au niveau de l'accès aux médias audiovisuels enregistrés.  \nHaute Autorité de la Communication Audiovisuelle"", ""## Signature d'une convention de coopération avec la HACA de Côte d'Ivoire  \nDans le cadre du renforcement et de l'approfondissement de leur partenariat bilatéral, une convention de coopération  a  été  signée  à  distance  le  22  septembre entre la HACA du Maroc et la HACA de Côte d'Ivoire.  \nDans  le cadre de cette convention de partenariat, traduisant la volonté des deux instances de partager leur expertise et expériences respectives sur divers aspects de  la  régulation  audiovisuelle,  la  HACA  s'est  engagée à  mettre  à  la  disposition  de  son  homologue  ivoirienne sa  solution  informatique  de  monitoring  des  contenus audiovisuels HACA Médias Solutions  (HMS) permettant, entre autres, le suivi du pluralisme d'expression dans les médias  ivoiriens,  particulièrement  lors  des  campagnes électorales et référendaires.  \n<!-- image -->  \n36  \nLes thèmes et la portée de cette convention avaient été préparés lors de la visite de travail que la Présidente de la HACA avait effectuée, les 11 et 12 mars, auprès de la HACA de Côte d'Ivoire à Abidjan et qui avait été l'occasion d'échanges soutenus sur le modèle de régulation et les singularités du paysage audiovisuel ivoirien. A la faveur de  cette  visite,  la  délégation  marocaine  avait  effectué de  nombreuses  visites  d'information  auprès  des  plus importants acteurs médiatiques publics et privés ivoiriens.  \n<!-- image -->  \nEn  perspective  de  la  signature  de  cette  convention,  une  mission  d'audit  technique  avait  été  également  effectuée à Abidjan par les responsables de la Direction des systèmes d'information."", ""## 1.5.3.  La coopération bilatérale avec les instances de régulation homologues  \nEn dépit des contraintes logistiques et organisationnelles induites par la crise pandémique, la HACA a poursuivi en 2020 son action résolue en matière de renforcement de la coopération bilatérale avec les instances homologues. La  priorité  a  été  donnée,  dans  ce  cadre,  aux  instances africaines,  en  raison  notamment  de  la  vice-présidence du réseau panafricain des régulateurs assurée par l'Instance  marocaine,  mais  également  parce  que  cette dernière  a  fait  le  choix  stratégique  de  s'impliquer,  de manière optimale, dans les dynamiques de renforcement de  l'efficience  et  de  l'autonomie  des  régulateurs  des médias sur le continent africain.""]","1. Réponse directe à la question :
   La Haute Autorité de la Communication Audiovisuelle (HACA) a organisé une session plénière du RIARC sur le thème « Quelles réponses africaines aux défis de la transformation numérique des médias : problématiques économiques et attentes des citoyens ? » en marge d'une conférence internationale sur la régulation des médias à l'ère du numérique. Cette session a permis aux régulateurs africains d'échanger autour des effets culturels, démocratiques, sociétaux et économiques de la communication digitalisée et globalisée.

   De plus, dans le cadre de son engagement au sein du REFRAM (Réseau Francophone des Régulateurs des Médias), la HACA a associé divers intervenants à l'événement, dont des experts, organismes internationaux, dirigeants de médias publics et privés, journalistes, acteurs de la société civile et représentants des milieux académiques.

2. Sources citées :
   - Avis et communications > Le Réseau des Instances Africaines de Régulation de la Communication - RIARC
     Source : ""Le Réseau des Instances Africaines de Régulation de la Communication - RIARC"" dans le Bulletin Officiel, N°011 d'Octobre à Décembre 2020.
   
   - Avis et communications > Le Réseau des Instances Africaines de Régulation de la Communication - RIARC
     Source : ""Le Réseau des Instances Africaines de Régulation de la Communication - RIARC"" dans le Bulletin Officiel, N°011 d'Octobre à Décembre 2020.","La HACA a organisé une session plénière du RIARC sur le thème de la transformation numérique des médias, abordant les problématiques économiques et attentes des citoyens. De plus, elle a contribué à l'élaboration du bulletin d'information trimestriel « La lettre du RIARC » pour maintenir l'engagement au sein du réseau panafricain des régulateurs malgré les restrictions de mobilité causées par la pandémie.",0.9666666666473333,1.0,0.8333333333333334,0.8679204326288384,gpt-4o-mini,bge-m3,qwen2.5:7b,False,False,False,0.5
Quels sont les diplômes reconnus comme équivalents au diplôme de spécialité médicale en ophtalmologie selon l'arrêté du 17 décembre 2021 ?,"[""## Arrêté du ministre de l'enseignement supérieur, de la recherche scientifique et de l'innovation n°3956-21 du 17 joumada I 1443 (22 décembre 2021) complétant l'arrêté n°2188-04 du 14kaada1425 (27 décembre 2004) fixant la liste des diplômes reconnus équivalents au diplôme de spécialité médicale en ophtalmologie.  \nle MINIStRe De l'eNSeIGNeMeNt SUP É RIeUR, De la ReCheRChe SCIeNtIFIQUe et De l'INNOVatION,  \nVu l'arrêté du ministre de l'éducation nationale, de l'enseignement  supérieur,  de  la  formation  des  cadres  et de  la  recherche  scientifique  n° 2188-04  du  14 kaada  1425 (27décembre 2004) fixant la liste des diplômes reconnus équivalents au diplôme de spécialité médicale en ophtalmologie, tel qu'il a été complété ;  \nVu le décret n°2-21-838 du 14 rabii I 1443 (21 octobre 2021) portant attributions du ministre de l'enseignement supérieur, de la recherche scientifique et de l'innovation ;  \nAprès avis de la commission sectorielle des sciences de la santé du 14 octobre 2021 ;  \nAprès avis du conseil national de l'Ordre national des médecins,"", ""## Arrêté du ministre de l'enseignement supérieur, de la recherche scientifique et de l'innovation n°3970-21 du 17 joumada I 1443 (22 décembre 2021) complétant l'arrêté n°2188-04 du 14kaada1425 (27 décembre 2004) fixant la liste des diplômes reconnus équivalents au diplôme de spécialité médicale en ophtalmologie.  \nle MINIStRe De l'eNSeIGNeMeNt SUP É RIeUR, De la ReCheRChe SCIeNtIFIQUe et De l'INNOVatION,  \nVu  l'arrêté  du  ministre  de  l'éducation  nationale,  de l'enseignement supérieur, de la formation des cadres et de la recherche scientifique n°2188-04 du 14kaada 1425 (27décembre 2004) fixant la liste des diplômes reconnus équivalents au diplôme de spécialité médicale en ophtalmologie, tel qu'il a été complété ;  \nVu le décret n°2-21-838 du 14 rabii I 1443 (21 octobre 2021) portant attributions du ministre de l'enseignement supérieur, de la recherche scientifique et de l'innovation ;  \nAprès avis de la commission sectorielle des sciences de la santé du 14 octobre 2021 ;  \nAprès avis du conseil national de l'Ordre national des médecins,"", ""## Arrêté du ministre de l'enseignement supérieur, de la recherche scientifique et de l'innovation n°3975-21 du 17 joumada I 1443 (22 décembre 2021) complétant l'arrêté n°2188-04 du 14kaada1425 (27 décembre 2004) fixant la liste des diplômes reconnus équivalents au diplôme de spécialité médicale en ophtalmologie.  \nle MINIStRe De l'eNSeIGNeMeNt SUP É RIeUR, De la ReCheRChe SCIeNtIFIQUe et De l'INNOVatION,  \nVu  l'arrêté  du  ministre  de  l'éducation  nationale,  de l'enseignement supérieur, de la formation des cadres et de la recherche scientifique n°2188-04 du 14kaada 1425 (27décembre 2004) fixant la liste des diplômes reconnus équivalents au diplôme de spécialité médicale en ophtalmologie, tel qu'il a été complété ;  \nVu le décret n°2-21-838 du 14 rabii I 1443 (21 octobre 2021) portant attributions du ministre de l'enseignement supérieur, de la recherche scientifique et de l'innovation ;  \nAprès avis de la commission sectorielle des sciences de la santé du 14 octobre 2021 ;  \nAprès avis du conseil national de l'Ordre national des médecins,"", ""## Arrêté du ministre de l'enseignement supérieur, de la recherche scientifique et de l'innovation n°202-23 du 4 rejeb 1444 (26  janvier  2023)  complétant  l'arrêté  n° 2188-04  du 14kaada1425 (27 décembre 2004) fixant la liste des diplômes reconnus équivalents au diplôme de spécialité médicale en ophtalmologie.  \nle MINIStRe De l'eNSeIGNeMeNt SUP É RIeUR, De la ReCheRChe SCIeNtIFIQUe et De l'INNOVatION,  \nVu  l'arrêté  du  ministre  de  l'éducation  nationale,  de l' enseignement supérieur, de la formation des cadres et de la recherche scientifique n°2188-04 du 14kaada 1425 (27décembre 2004), fixant la liste des diplômes reconnus équivalents au diplôme de spécialité médicale en ophtalmologie, tel qu'il a été complété ;  \nVu le décret n°2-21-838 du 14 rabii I 1443 (21 octobre 2021) relatif aux attributions du ministre de l'enseignement supérieur, de la recherche scientifique et de l'innovation ;  \nAprès avis de la commission sectorielle des sciences de la santé, réunie en date du 21 décembre 2022 ;  \nAprès avis du conseil national de l'Ordre national des médecins,"", ""## Arrêté du ministre de l'enseignement supérieur, de la recherche scientifique et de l'innovation n°193-23 du 4 rejeb 1444 (26  janvier  2023)  complétant  l'arrêté  n° 2188-04  du 14kaada1425 (27 décembre 2004) fixant la liste des diplômes reconnus équivalents au diplôme de spécialité médicale en ophtalmologie.  \nle MINIStRe De l'eNSeIGNeMeNt SUP É RIeUR, De la ReCheRChe SCIeNtIFIQUe et De l'INNOVatION,  \nVu  l'arrêté  du  ministre  de  l'éducation  nationale,  de l' enseignement supérieur, de la formation des cadres et de la recherche scientifique n°2188-04 du 14kaada 1425 (27décembre 2004), fixant la liste des diplômes reconnus équivalents au diplôme de spécialité médicale en ophtalmologie, tel qu'il a été complété ;  \nVu le décret n°2-21-838 du 14 rabii I 1443 (21 octobre 2021) relatif aux attributions du ministre de l'enseignement supérieur, de la recherche scientifique et de l'innovation ;  \nAprès avis de la commission sectorielle des sciences de la santé, réunie en date du 21 décembre 2022 ;  \nAprès avis du conseil national de l'Ordre national des médecins,"", ""## ARRÊTE :  \nARTICLE PREMIER.-L'article premier de l'arrêté susvisé n°2188-04 du 14 kaada 1425 (27 décembre 2004), est complété comme suit :  \n« Article  premier .  - La  liste  des  diplômes  reconnus «équivalents au diplôme de spécialité médicale en ophtalmologie, « est fixée ainsi qu'il suit :  \n« ............................................................................................  \n«-Ukraine :  \n« ..............................................................................................  \n- «-Certificate of specialized training in medicine (clinical «ordinatura) specialization in ophtalmology, délivré «par Sil Zaporizhia medical Academy of post graduate «education ministry of health of Ukraine, Ukraine«le 28 décembre 2017, assorti d'un stage de deux années : «une année au sein du Centre hospitalier universitaire «Mohammed VI d'Oujda et une année au sein du «Centre hospitalier régional El Farabi d'Oujda, validé «par la Faculté de médecine et de pharmacie d'Oujda«le 23 septembre 2021.»  \nART. 2.-Le présent arrêté sera publié au Bulletin officiel . Rabat, le 17 joumada I 1443 (22 décembre 2021). abDellatIF MIRaOUI.  \nle MINIStRe De l'eNSeIGNeMeNt SUP É RIeUR, De la ReCheRChe SCIeNtIFIQUe et De l'INNOVatION,  \nVu l'arrêté du ministre de l'enseignement supérieur, de  la  recherche  scientifique  et  de  la  culture  n° 2963-97 du 2 chaabane 1418 (3 décembre 1997) fixant la liste des diplômes reconnus équivalents au diplôme de docteur en médecine, tel qu'il a été complété ;  \nVu le décret n°2-21-838 du 14 rabii I 1443 (21 octobre 2021) portant attributions du ministre de l'enseignement supérieur, de la recherche scientifique et de l'innovation ;  \nAprès avis de la commission sectorielle des sciences de la santé du 14 octobre 2021 ;  \nAprès avis du conseil national de l'Ordre national des médecins,  \n## ARRÊTE :  \nARTICLE PREMIER.-L'article premier de l'arrêté susvisé n°2963-97 du 2 chaabane 1418 (3 décembre 1997), est complété comme suit :  \n« Article  premier .  - La  liste  des  diplômes  reconnus «équivalents au diplôme de docteur en médecine, assortis «du baccalauréat de l'enseignement secondaire - série sciences «expérimentales ou sciences mathématiques ou d'un diplôme «reconnu équivalent, est fixée ainsi qu'il suit :  \n« ............................................................................................""]","1. Réponse directe à la question

Selon l'arrêté du ministre de l'enseignement supérieur, de la recherche scientifique et de l'innovation n°3956-21 du 17 joumada I 1443 (22 décembre 2021) complétant l'arrêté n°2188-04 du 14kaada1425 (27 décembre 2004), le diplôme reconnu comme équivalents au diplôme de spécialité médicale en ophtalmologie est :

""Certificate of specialized training in medicine (clinical ordinatura) specialization in ophtalmology, délivré par Sil Zaporizhia medical Academy of post graduate education ministry of health of Ukraine, Ukraine le 28 décembre 2017, assorti d'un stage de deux années : une année au sein du Centre hospitalier universitaire Mohammed VI d'Oujda et une année au sein du Centre hospitalier régional El Farabi d'Oujda, validé par la Faculté de médecine et de pharmacie d'Oujda le 23 septembre 2021.""

2. Sources citées

- Arrêté du ministre de l'enseignement supérieur, de la recherche scientifique et de l'innovation n°3956-21 du 17 joumada I 1443 (22 décembre 2021) complétant l'arrêté n°2188-04 du 14kaada1425 (27 décembre 2004), article premier.",L'extrait ne fournit pas la liste des diplômes reconnus comme équivalents au diplôme de spécialité médicale en ophtalmologie. Seul l'arrêté et sa date sont mentionnés.,0.9166666666361111,1.0,1.0,0.8992683204785138,gpt-4o-mini,bge-m3,qwen2.5:7b,False,False,False,0.5
