user_input,retrieved_contexts,response,reference,context_precision,context_recall,faithfulness,answer_relevancy,judge_model,embedding_model,generation_model,hyde,rerank,contextualize_query,similarity_threshold
Quel est le montant que le gouvernement peut dépenser en 2024 pour le fonds des titres identitaires électroniques et des titres de voyage ?,"[""###### Article 29  \nLe montant des dépenses que l'autorité gouvernementale chargée de l'intérieur est autorisée à engager, pendant l'année budgétaire 2024, au titre du compte d'affectation spéciale intitulé «Fonds spécial pour la mise en place des titres identitaires électroniques et des titres de voyage», par anticipation sur les crédits qui lui seront ouverts pour l'année budgétaire 2025, est fixé à six cent millions de dirhams (600.000.000 DH).  \nEngagement par anticipation sur le compte d'affectation spéciale intitulé  « Fonds spécial de la pharmacie centrale»"", ""###### Article 31  \nLe montant des dépenses que l'autorité gouvernementale chargée  de  l'intérieur  est  autorisée  à  engager,  pendant l'année budgétaire 2023, au titre du compte d'affectation spéciale intitulé «Fonds spécial pour la mise en place des titres  identitaires  électroniques  et  des  titres  de  voyage », par anticipation sur les crédits qui lui seront ouverts pour l'année budgétaire 2024, est fixé à six cent millions de dirhams (600.000.000 DH).  \nEngagement par anticipation sur le compte d'affectation spéciale intitulé « Fonds spécial de la pharmacie centrale»"", '###### Article 28  \nLe montant des dépenses que l\'autorité gouvernementale chargée de l\'intérieur est autorisée à engager, pendant l\'année budgétaire 2024, au titre du compte d\'affectation spéciale intitulé ""Fonds de soutien à la sûreté nationale"", par anticipation sur les crédits qui lui seront ouverts pour l\'année budgétaire 2025, est fixé à cent millions de dirhams (100.000.000 DH).  \nEngagement par anticipation sur le compte d\'affectation spéciale intitulé «Fonds spécial pour la mise en place des titres identitaires électroniques et des titres de voyage»', ""| Code Chapitre    | Désignation                                                                         | Ressources pour l'année budgétaire 2024   |\n|------------------|-------------------------------------------------------------------------------------|-------------------------------------------|\n| 4.1.2.0.0.14.008 | INSTITUT SPECIALISE DE TECHNOLOGIE APPLIQUEE HOTELIERE ET TOURISTIQUE - OUARZAZATE  | 788 000                                   |\n| 4.1.2.0.0.14.011 | INSTITUT SPECIALISE DE TECHNOLOGIE APPLIQUEE HOTELIERE ET TOURISTIQUE - TANGER      | 750 000                                   |\n| 4.1.2.0.0.14.015 | CENTRE DE QUALIFICATION PROFESSIONNELLE HOTELIERE ET TOURISTIQUE DE TOUARGA - RABAT | 875 000                                   |\n| 4.1.2.0.0.14.018 | INSTITUT SPÉCIALISÉ DES ARTS TRADITIONNELS FES                                      | 60 000                                    |\n| 4.1.2.0.0.14.019 | INSTITUT SPÉCIALISÉ DES ARTS TRADITIONNELS MARRAKECH                                | 60 000                                    |\n| 4.1.2.0.0.14.020 | INSTITUT SPÉCIALISÉ DES ARTS TRADITIONNELS MEKNES                                   | 60 000                                    |\n| 4.1.2.0.0.14.021 | INSTITUT SPÉCIALISÉ DES ARTS TRADITIONNELS RABAT                                    | 60 000                                    |\n| 4.1.2.0.0.14.022 | INSTITUT SPÉCIALISÉ DES ARTS TRADITIONNELS OUARZAZATE                               | 60 000                                    |\n| 4.1.2.0.0.14.023 | INSTITUT SPÉCIALISÉ DES ARTS TRADITIONNELS INEZGANE                                 | 60 000                                    |\n| 4.1.2.0.0.16.001 | DIRECTION DE L'IMPRIMERIE OFFICIELLE                                                | -                                         |\n| 4.1.2.0.0.17.002 | CENTRE NATIONAL D'ETUDES ET DE RECHERCHES ROUTIERES                                 | 4 000 000                                 |\n| 4.1.2.0.0.17.003 | SERVICE DU RESEAU DES SERVICES DE LOGISTIQUE ET DE MATERIEL                         | 1 000 000                                 |\n| 4.1.2.0.0.17.004 | SERVICE DE LOGISTIQUE ET DE MATERIEL DE FES                                         | 1 000 000                                 |\n| 4.1.2.0.0.17.005 | SERVICE DE LOGISTIQUE ET DE MATERIEL DE RABAT                                       | 1 000 000                                 |\n| 4.1.2.0.0.17.006 | SERVICE DE LOGISTIQUE ET DE MATERIEL DE MARRAKECH                                   | 1 500 000                                 |\n| 4.1.2.0.0.17.007 | SERVICE DE LOGISTIQUE ET DE MATERIEL DE MEKNES                                      | -                                         |\n| 4.1.2.0.0.17.008 | SERVICE DE LOGISTIQUE ET DE MATERIEL D'OUJDA                                        | 1 000 000                                 |"", '###### Article 30  \nLe montant des dépenses que l\'autorité gouvernementale chargée de l\'intérieur est autorisée à engager, pendant l\'année budgétaire 2023, au titre du compte d\'affectation spéciale intitulé ""Fonds de soutien à la sûreté nationale"", par anticipation sur les crédits qui lui seront ouverts pour l\'année budgétaire 2024, est fixé à cent millions de dirhams (100.000.000 DH).  \nEngagement par anticipation sur le compte d\'affectation spéciale intitulé «Fonds spécial pour la mise en place des titres identitaires électroniques et des titres de voyage»', ""|                                         | TOTAL                                                                              | 105 000 000                               |\n|                                         | MINISTERE DU TOURISME, DE L'ARTISANAT ET DE L'ECONOMIE SOCIALE ET SOLIDAIRE        |                                           |\n| 4.1.1.0.0.14.001                        | INSTITUT SUPERIEUR INTERNATIONAL DU TOURISME DE TANGER                             | 11 016 000                                |\n| 4.1.1.0.0.14.008                        | INSTITUT SPECIALISE DE TECHNOLOGIE APPLIQUEE HOTELIERE ET TOURISTIQUE - OUARZAZATE | 1 542 000                                 |  \n18  \n| Code Chapitre                         | Désignation                                                                         | Ressources pour l'année budgétaire 2024   |\n|---------------------------------------|-------------------------------------------------------------------------------------|-------------------------------------------|\n| 4.1.1.0.0.14.011                      | INSTITUT SPECIALISE DE TECHNOLOGIE APPLIQUEE HOTELIERE ET TOURISTIQUE - TANGER      | 1 315 000                                 |\n| 4.1.1.0.0.14.015                      | CENTRE DE QUALIFICATION PROFESSIONNELLE HOTELIERE ET TOURISTIQUE DE TOUARGA - RABAT | 865 000                                   |\n| 4.1.1.0.0.14.018                      | INSTITUT SPÉCIALISÉ DES ARTS TRADITIONNELS FES                                      | 375 000                                   |\n| 4.1.1.0.0.14.019                      | INSTITUT SPÉCIALISÉ DES ARTS TRADITIONNELS MARRAKECH                                | 400 000                                   |\n| 4.1.1.0.0.14.020                      | INSTITUT SPÉCIALISÉ DES ARTS TRADITIONNELS MEKNES                                   | 375 000                                   |\n| 4.1.1.0.0.14.021                      | INSTITUT SPÉCIALISÉ DES ARTS TRADITIONNELS RABAT                                    | 300 000                                   |\n| 4.1.1.0.0.14.022                      | INSTITUT SPÉCIALISÉ DES ARTS TRADITIONNELS OUARZAZATE                               | 300 000                                   |\n| 4.1.1.0.0.14.023                      | INSTITUT SPÉCIALISÉ DES ARTS TRADITIONNELS INEZGANE                                 | 400 000                                   |\n| TOTAL                                 | TOTAL                                                                               | 16 888 000                                |\n| 4.1.1.0.0.16.001                      | SECRETARIAT GENERAL DU GOUVERNEMENT DIRECTION DE L'IMPRIMERIE OFFICIELLE            | 24 000 000                                |\n|                                       | TOTAL                                                                               | 24 000 000                                |"", ""###### Article 29  \nLe montant des dépenses que l'autorité gouvernementale chargée de l'intérieur est autorisée à engager, pendant l'année budgétaire 2024, au titre du compte d'affectation spéciale intitulé «Fonds spécial pour la mise en place des titres identitaires électroniques et des titres de voyage», par anticipation sur les crédits qui lui seront ouverts pour l'année budgétaire 2025, est fixé à six cent millions de dirhams (600.000.000 DH).  \nEngagement par anticipation sur le compte d'affectation spéciale intitulé  « Fonds spécial de la pharmacie centrale»"", '###### Article 28  \nLe montant des dépenses que l\'autorité gouvernementale chargée de l\'intérieur est autorisée à engager, pendant l\'année budgétaire 2024, au titre du compte d\'affectation spéciale intitulé ""Fonds de soutien à la sûreté nationale"", par anticipation sur les crédits qui lui seront ouverts pour l\'année budgétaire 2025, est fixé à cent millions de dirhams (100.000.000 DH).  \nEngagement par anticipation sur le compte d\'affectation spéciale intitulé «Fonds spécial pour la mise en place des titres identitaires électroniques et des titres de voyage»', ""###### Article 31  \nLe montant des dépenses que l'autorité gouvernementale chargée  de  l'intérieur  est  autorisée  à  engager,  pendant l'année budgétaire 2023, au titre du compte d'affectation spéciale intitulé «Fonds spécial pour la mise en place des titres  identitaires  électroniques  et  des  titres  de  voyage », par anticipation sur les crédits qui lui seront ouverts pour l'année budgétaire 2024, est fixé à six cent millions de dirhams (600.000.000 DH).  \nEngagement par anticipation sur le compte d'affectation spéciale intitulé « Fonds spécial de la pharmacie centrale»"", ""###### Article 35  \nLe montant des dépenses que l'autorité gouvernementale chargée  de  la  transition  numérique  et  de  la  réforme  de l'administration  est  autorisée  à  engager,  pendant  l'année budgétaire 2024, au titre du compte d'affectation spéciale intitulé «Fonds de modernisation de l'administration publique, d'appui à la transition numérique et à l'utilisation de l'amazighe», par anticipation sur les crédits qui lui seront ouverts pour l'année budgétaire 2025, est fixé à un milliard cinq cent millions de dirhams (1.500.000.000 DH).  \nEngagement par anticipation sur le compte d'affectation spéciale intitulé «Fonds spécial pour le soutien  de l'administration et des établissements pénitentiaires»"", '###### Article 27  \nLe montant des dépenses que le Chef du gouvernement est autorisé à engager, pendant l\'année budgétaire 2024, au titre  du  compte  d\'affectation  spéciale  intitulé  ""Fonds  de soutien à l\'initiative nationale pour le développement humain"", par anticipation sur les crédits qui lui seront ouverts pour l\'année budgétaire 2025, est fixé à un milliard de dirhams (1.000.000.000 DH).  \nEngagement par anticipation sur le compte d\'affectation spéciale intitulé  «Fonds de soutien à la sûreté nationale»', '###### Article 30  \nLe montant des dépenses que l\'autorité gouvernementale chargée de l\'intérieur est autorisée à engager, pendant l\'année budgétaire 2023, au titre du compte d\'affectation spéciale intitulé ""Fonds de soutien à la sûreté nationale"", par anticipation sur les crédits qui lui seront ouverts pour l\'année budgétaire 2024, est fixé à cent millions de dirhams (100.000.000 DH).  \nEngagement par anticipation sur le compte d\'affectation spéciale intitulé «Fonds spécial pour la mise en place des titres identitaires électroniques et des titres de voyage»']"," 1. Le montant que le gouvernement peut dépenser en 2024 pour le fonds des titres identitaires électroniques et des titres de voyage est six cent millions de dirhams (600.000.000 DH).

2. Sources citées :
   - Extrait du Dahir n° 1-22-75 du 18 joumada I 1444 (13 décembre 2022) portant promulgation de la loi de finances n° 50-22 pour l'année budgétaire 2023, Article 31.
   - Extrait du Dahir n°1-23-91 du 30 joumada I 1445 (14 décembre 2023) portant promulgation de la loi de finances n°55-23 pour l'année budgétaire 2024, Article 28 et Article 35.",Le montant que le gouvernement peut dépenser en 2024 pour le fonds des titres identitaires électroniques et des titres de voyage est fixé à six cent millions de dirhams (600.000.000 DH) selon l'article 29.,0.718253968236012,1.0,0.3333333333333333,0.9993306495836259,gpt-4o-mini,bge-m3,mistral:7b,True,False,False,0.5
Quelles sont les réglementations en vigueur concernant la production et la certification des plants de fruits rouges et d'arganier au Maroc ?,"[""Vu l'arrêté du ministre de l'agriculture, de la pêche maritime, du développement rural et des eaux et forêts n° 2109-17 du 25 kaada 1438 (18 août 2017) portant homologation du règlement technique relatif à la production, au contrôle, au conditionnement et à la certification des plants des espèces à  fruits  rouges  (fraisier,  framboisier,  myrtillier,  murier, groseillier et cassissier) ;  \nVu l'arrêté du ministre de l'agriculture, de la pêche maritime, du développement rural et des eaux et forêts n°986-19 du 21 rejeb 1440 (28 mars 2019) portant homologation du règlement technique relatif à la production, au contrôle, au conditionnement et à la certification des plants de figuier de barbarie ;  \nVu l'arrêté du ministre de l'agriculture, de la pêche maritime, du développement rural et des eaux et forêts n° 1437-22 du 25 chaoual 1443 (26 mai 2022) portant homologation du règlement technique relatif à la production, au contrôle, au conditionnement et à la certification des semences et plants des rosacées à noyau ;  \nVu l'arrêté du ministre de l'agriculture, de la pêche maritime, du développement rural et des eaux et forêts n°2140-22 du 4 moharrem 1444 (2 août 2022) portant homologation du règlement technique relatif à la production, au contrôle, au conditionnement et à la certification des plants d'arganier ;  \nVu l'arrêté du ministre de l'agriculture et de la réforme agraire n°966-93 du 28 chaoual 1413 (20 avril 1993) fixant les conditions d'importation et de commercialisation des semences à cultiver au Maroc, tel qu'il a été modifié et complété,"", ""Vu l'arrêté du ministre de l'agriculture, de la pêche maritime, du développement rural et des eaux et forêts n°2109-17 du 25 kaada 1438 (18 août 2017) portant homologation du règlement technique relatif à la production, au contrôle, au conditionnement et à la certification des plants des espèces à  fruits  rouges  (fraisier,  framboisier,  myrtillier,  murier, groseillier et cassissier) ;  \nVu l'arrêté du ministre de l'agriculture, de la pêche maritime, du développement rural et des eaux et forêts n°986-19 du 21 rejeb 1440 (28 mars 2019) portant homologation du règlement technique relatif à la production, au contrôle, au conditionnement et à la certification des plants de figuier de barbarie ;  \nVu l'arrêté du ministre de l'agriculture, de la pêche maritime, du développement rural et des eaux et forêts n° 1437-22 du 25 chaoual 1443 (26 mai 2022) portant homologation du règlement technique relatif à la production, au contrôle, au conditionnement et à la certification des semences et plants des rosacées à noyau ;  \nVu l'arrêté du ministre de l'agriculture, de la pêche maritime, du développement rural et des eaux et forêts n°2140-22 du 4 moharrem 1444 (2 août 2022) portant homologation du règlement technique relatif à la production, au contrôle, au conditionnement et à la certification des plants d'arganier ;  \nVu l'arrêté du ministre de l'agriculture et de la réforme agraire n°966-93 du 28 chaoual 1413 (20 avril 1993) fixant les conditions d'importation et de commercialisation des semences à cultiver au Maroc, tel qu'il a été modifié et complété,"", ""Vu l'arrêté  du ministre de l'agriculture et de la pêche maritime n°784-16 du 29 kaada 1437 (2 septembre 2016) portant homologation du règlement technique relatif à la production, au contrôle, au conditionnement et à la certification des plants de grenadier ;  \nVu l'arrêté du ministre de l'agriculture, de la pêche maritime, du développement rural et des eaux et forêts n°2109-17 du 25 kaada 1438 (18 août 2017) portant homologation du règlement technique relatif à la production, au contrôle, au conditionnement et à la certification des plants des espèces à  fruits  rouges  (fraisier,  framboisier,  myrtillier,  murier, groseillier et cassissier) ;  \nVu l'arrêté du ministre de l'agriculture, de la pêche maritime, du développement rural et des eaux et forêts n°986-19 du 21 rejeb 1440 (28 mars 2019) portant homologation du règlement technique relatif à la production, au contrôle, au conditionnement et à la certification des plants de figuier de barbarie ;  \nVu l'arrêté du ministre de l'agriculture, de la pêche maritime, du développement rural et des eaux et forêts n°1437-22 du 25 chaoual 1443 (26 mai 2022) portant homologation du règlement technique relatif à la production, au contrôle, au conditionnement et à la certification des semences et plants des rosacées à noyau ;  \nVu l'arrêté du ministre de l'agriculture, de la pêche maritime, du développement rural et des eaux et forêts n°2140-22 du 4 moharrem 1444 (2 août 2022) portant homologation du règlement technique relatif à la production, au contrôle, au conditionnement et à la certification des plants d'arganier ;  \nVu l'arrêté du ministre de l'agriculture, de la pêche maritime, du développement rural et des eaux et forêts n°640-23 du 14 chaabane 1444 (7 mars 2023) portant homologation du règlement technique relatif à la production, au contrôle, au conditionnement et à la certification des plants de caroubier ;  \nVu l'arrêté du ministre  de  l'agriculture  et  de  la réforme  agraire  n°966-93 du 28 chaoual 1413 (20 avril 1993) fixant les conditions d'importation et de commercialisation des semences à cultiver au Maroc, tel qu'il a été modifié et complété,"", ""Vu l'arrêté du ministre de l'agriculture, de la pêche maritime, du développement rural et des eaux et forêts n° 2109-17 du 25 kaada 1438 (18 août 2017) portant homologation du règlement technique relatif à la production, au contrôle, au conditionnement et à la certification des plants des espèces à  fruits  rouges  (fraisier,  framboisier,  myrtillier,  murier, groseillier et cassissier) ;  \nVu l'arrêté du ministre de l'agriculture, de la pêche maritime, du développement rural et des eaux et forêts n°986-19 du 21 rejeb 1440 (28 mars 2019) portant homologation du règlement technique relatif à la production, au contrôle, au conditionnement et à la certification des plants de figuier de barbarie ;  \nVu l'arrêté du ministre de l'agriculture, de la pêche maritime, du développement rural et des eaux et forêts n° 1437-22 du 25 chaoual 1443 (26 mai 2022) portant homologation du règlement technique relatif à la production, au contrôle, au conditionnement et à la certification des semences et plants des rosacées à noyau ;  \nVu l'arrêté du ministre de l'agriculture, de la pêche maritime, du développement rural et des eaux et forêts n°2140-22 du 4 moharrem 1444 (2 août 2022) portant homologation du règlement technique relatif à la production, au contrôle, au conditionnement et à la certification des plants d'arganier ;  \nVu l'arrêté du ministre de l'agriculture, de la pêche maritime, du développement rural et des eaux et forêts n°640-23 du 14chaabane 1444 (7 mars 2023) portant homologation du règlement technique relatif à la production, au contrôle, au conditionnement et à la certification des plants de caroubier ;  \nVu l'arrêté du ministre de l'agriculture et de la réforme agraire n°966-93 du 28 chaoual 1413 (20 avril 1993) fixant les conditions d'importation et de commercialisation des semences à cultiver au Maroc, tel qu'il a été modifié et complété,"", ""Vu l'arrêté du ministre de l'agriculture, de la pêche maritime, du développement rural et des eaux et forêts n°2109-17 du 25 kaada 1438 (18 août 2017) portant homologation du règlement technique relatif à la production, au contrôle, au conditionnement et à la certification des plants des espèces à  fruits  rouges  (fraisier,  framboisier,  myrtillier,  murier, groseillier et cassissier) ;  \nVu l'arrêté du ministre de l'agriculture, de la pêche maritime, du développement rural et des eaux et forêts n°986-19 du 21 rejeb 1440 (28 mars 2019) portant homologation du règlement technique relatif à la production, au contrôle, au conditionnement et à la certification des plants de figuier de barbarie ;  \nVu l'arrêté du ministre de l'agriculture, de la pêche maritime, du développement rural et des eaux et forêts n°1437-22 du 25 chaoual 1443 (26 mai 2022) portant homologation du règlement technique relatif à la production, au contrôle, au conditionnement et à la certification des semences et plants des rosacées à noyau ;  \nVu l'arrêté du ministre de l'agriculture, de la pêche maritime, du développement rural et des eaux et forêts n°2140-22 du 4 moharrem 1444 (2 août 2022) portant homologation du règlement technique relatif à la production, au contrôle, au conditionnement et à la certification des plants d'arganier ;  \nVu l'arrêté du ministre de l'agriculture, de la pêche maritime, du développement rural et des eaux et forêts n°640-23 du 14 chaabane 1444 (7 mars 2023) portant homologation du règlement technique relatif à la production, au contrôle, au conditionnement et à la certification des plants de caroubier ;  \nVu l'arrêté du ministre  de  l'agriculture  et  de  la réforme  agraire  n° 966-93 du 28 chaoual 1413 (20 avril 1993) fixant les conditions d'importation et de commercialisation des semences à cultiver au Maroc, tel qu'il a été modifié et complété,"", ""Vu l'arrêté du ministre de l'agriculture, de la pêche maritime, du développement rural et des eaux et forêts n°986-19 du 21 rejeb 1440 (28 mars 2019) portant homologation du règlement technique relatif à la production, au contrôle, au conditionnement et à la certification des plants de figuier de barbarie ;  \nVu l'arrêté du ministre de l'agriculture, de la pêche maritime, du développement rural et des eaux et forêts n° 1437-22 du 25 chaoual 1443 (26 mai 2022) portant homologation du règlement technique relatif à la production, au contrôle, au conditionnement et à la certification des semences et plants des rosacées à noyau ;  \nVu l'arrêté du ministre de l'agriculture, de la pêche maritime, du développement rural et des eaux et forêts n°2140-22 du 4 moharrem 1444 (2 août 2022) portant homologation du règlement technique relatif à la production, au contrôle, au conditionnement et à la certification des plants d'arganier ;  \nVu l'arrêté du ministre de l'agriculture, de la pêche maritime, du développement rural et des eaux et forêts n°640-23 du 14chaabane 1444 (7 mars 2023) portant homologation du règlement technique relatif à la production, au contrôle, au conditionnement et à la certification des plants de caroubier ;  \nVu l'arrêté du ministre de l'agriculture et de la réforme agraire n°966-93 du 28 chaoual 1413 (20 avril 1993) fixant les conditions d'importation et de commercialisation des semences à cultiver au Maroc, tel qu'il a été modifié et complété,"", ""Vu l'arrêté du ministre de l'agriculture, de la pêche maritime, du développement rural et des eaux et forêts n°2109-17 du 25 kaada 1438 (18 août 2017) portant homologation du règlement technique relatif à la production, au contrôle, au conditionnement et à la certification des plants des espèces à  fruits  rouges  (fraisier,  framboisier,  myrtillier,  murier, groseillier et cassissier) ;  \nVu l'arrêté du ministre de l'agriculture, de la pêche maritime, du développement rural et des eaux et forêts n°986-19 du 21 rejeb 1440 (28 mars 2019) portant homologation du règlement technique relatif à la production, au contrôle, au conditionnement et à la certification des plants de figuier de barbarie ;  \nVu l'arrêté du ministre de l'agriculture, de la pêche maritime, du développement rural et des eaux et forêts n° 1437-22 du 25 chaoual 1443 (26 mai 2022) portant homologation du règlement technique relatif à la production, au contrôle, au conditionnement et à la certification des semences et plants des rosacées à noyau ;  \nVu l'arrêté du ministre de l'agriculture, de la pêche maritime, du développement rural et des eaux et forêts n°2140-22 du 4 moharrem 1444 (2 août 2022) portant homologation du règlement technique relatif à la production, au contrôle, au conditionnement et à la certification des plants d'arganier ;  \nVu l'arrêté du ministre de l'agriculture et de la réforme agraire n°966-93 du 28 chaoual 1413 (20 avril 1993) fixant les conditions d'importation et de commercialisation des semences à cultiver au Maroc, tel qu'il a été modifié et complété,"", ""Vu l'arrêté du ministre de l'agriculture, de la pêche maritime, du développement rural et des eaux et forêts n° 2109-17 du 25 kaada 1438 (18 août 2017) portant homologation du règlement technique relatif à la production, au contrôle, au conditionnement et à la certification des plants des espèces à  fruits  rouges  (fraisier,  framboisier,  myrtillier,  murier, groseillier et cassissier) ;  \nVu l'arrêté du ministre de l'agriculture, de la pêche maritime, du développement rural et des eaux et forêts n°986-19 du 21 rejeb 1440 (28 mars 2019) portant homologation du règlement technique relatif à la production, au contrôle, au conditionnement et à la certification des plants de figuier de barbarie ;  \nVu l'arrêté du ministre de l'agriculture, de la pêche maritime, du développement rural et des eaux et forêts n° 1437-22 du 25 chaoual 1443 (26 mai 2022) portant homologation du règlement technique relatif à la production, au contrôle, au conditionnement et à la certification des semences et plants des rosacées à noyau ;  \nVu l'arrêté du ministre de l'agriculture, de la pêche maritime, du développement rural et des eaux et forêts n°2140-22 du 4 moharrem 1444 (2 août 2022) portant homologation du règlement technique relatif à la production, au contrôle, au conditionnement et à la certification des plants d'arganier ;  \nVu l'arrêté du ministre de l'agriculture et de la réforme agraire n°966-93 du 28 chaoual 1413 (20 avril 1993) fixant les conditions d'importation et de commercialisation des semences à cultiver au Maroc, tel qu'il a été modifié et complété,"", ""Vu l'arrêté  du ministre de l'agriculture et de la pêche maritime n°784-16 du 29 kaada 1437 (2 septembre 2016) portant homologation du règlement technique relatif à la production, au contrôle, au conditionnement et à la certification des plants de grenadier ;  \nVu l'arrêté du ministre de l'agriculture, de la pêche maritime, du développement rural et des eaux et forêts n°2109-17 du 25 kaada 1438 (18 août 2017) portant homologation du règlement technique relatif à la production, au contrôle, au conditionnement et à la certification des plants des espèces à  fruits  rouges  (fraisier,  framboisier,  myrtillier,  murier, groseillier et cassissier) ;  \nVu l'arrêté du ministre de l'agriculture, de la pêche maritime, du développement rural et des eaux et forêts n°986-19 du 21 rejeb 1440 (28 mars 2019) portant homologation du règlement technique relatif à la production, au contrôle, au conditionnement et à la certification des plants de figuier de barbarie ;  \nVu l'arrêté du ministre de l'agriculture, de la pêche maritime, du développement rural et des eaux et forêts n°1437-22 du 25 chaoual 1443 (26 mai 2022) portant homologation du règlement technique relatif à la production, au contrôle, au conditionnement et à la certification des semences et plants des rosacées à noyau ;  \nVu l'arrêté du ministre de l'agriculture, de la pêche maritime, du développement rural et des eaux et forêts n°2140-22 du 4 moharrem 1444 (2 août 2022) portant homologation du règlement technique relatif à la production, au contrôle, au conditionnement et à la certification des plants d'arganier ;  \nVu l'arrêté du ministre de l'agriculture, de la pêche maritime, du développement rural et des eaux et forêts n°640-23 du 14 chaabane 1444 (7 mars 2023) portant homologation du règlement technique relatif à la production, au contrôle, au conditionnement et à la certification des plants de caroubier ;  \nVu l'arrêté du ministre  de  l'agriculture  et  de  la réforme  agraire  n°966-93 du 28 chaoual 1413 (20 avril 1993) fixant les conditions d'importation et de commercialisation des semences à cultiver au Maroc, tel qu'il a été modifié et complété,"", ""Vu l'arrêté du ministre de l'agriculture, de la pêche maritime, du développement rural et des eaux et forêts n° 2109-17 du 25 kaada 1438 (18 août 2017) portant homologation du règlement technique relatif à la production, au contrôle, au conditionnement et à la certification des plants des espèces à  fruits  rouges  (fraisier,  framboisier,  myrtillier,  murier, groseillier et cassissier) ;  \nVu l'arrêté du ministre de l'agriculture, de la pêche maritime, du développement rural et des eaux et forêts n°986-19 du 21 rejeb 1440 (28 mars 2019) portant homologation du règlement technique relatif à la production, au contrôle, au conditionnement et à la certification des plants de figuier de barbarie ;  \nVu l'arrêté du ministre de l'agriculture, de la pêche maritime, du développement rural et des eaux et forêts n° 1437-22 du 25 chaoual 1443 (26 mai 2022) portant homologation du règlement technique relatif à la production, au contrôle, au conditionnement et à la certification des semences et plants des rosacées à noyau ;  \nVu l'arrêté du ministre de l'agriculture, de la pêche maritime, du développement rural et des eaux et forêts n°2140-22 du 4 moharrem 1444 (2 août 2022) portant homologation du règlement technique relatif à la production, au contrôle, au conditionnement et à la certification des plants d'arganier ;  \nVu l'arrêté du ministre de l'agriculture, de la pêche maritime, du développement rural et des eaux et forêts n°640-23 du 14chaabane 1444 (7 mars 2023) portant homologation du règlement technique relatif à la production, au contrôle, au conditionnement et à la certification des plants de caroubier ;  \nVu l'arrêté du ministre de l'agriculture et de la réforme agraire n°966-93 du 28 chaoual 1413 (20 avril 1993) fixant les conditions d'importation et de commercialisation des semences à cultiver au Maroc, tel qu'il a été modifié et complété,"", ""Vu l'arrêté du ministre de l'agriculture, de la pêche maritime, du développement rural et des eaux et forêts n°2109-17 du 25 kaada 1438 (18 août 2017) portant homologation du règlement technique relatif à la production, au contrôle, au conditionnement et à la certification des plants des espèces à  fruits  rouges  (fraisier,  framboisier,  myrtillier,  murier, groseillier et cassissier) ;  \nVu l'arrêté du ministre de l'agriculture, de la pêche maritime, du développement rural et des eaux et forêts n°986-19 du 21 rejeb 1440 (28 mars 2019) portant homologation du règlement technique relatif à la production, au contrôle, au conditionnement et à la certification des plants de figuier de barbarie ;  \nVu l'arrêté du ministre de l'agriculture, de la pêche maritime, du développement rural et des eaux et forêts n°1437-22 du 25 chaoual 1443 (26 mai 2022) portant homologation du règlement technique relatif à la production, au contrôle, au conditionnement et à la certification des semences et plants des rosacées à noyau ;  \nVu l'arrêté du ministre de l'agriculture, de la pêche maritime, du développement rural et des eaux et forêts n°2140-22 du 4 moharrem 1444 (2 août 2022) portant homologation du règlement technique relatif à la production, au contrôle, au conditionnement et à la certification des plants d'arganier ;  \nVu l'arrêté du ministre de l'agriculture, de la pêche maritime, du développement rural et des eaux et forêts n°640-23 du 14 chaabane 1444 (7 mars 2023) portant homologation du règlement technique relatif à la production, au contrôle, au conditionnement et à la certification des plants de caroubier ;  \nVu l'arrêté du ministre  de  l'agriculture  et  de  la réforme  agraire  n° 966-93 du 28 chaoual 1413 (20 avril 1993) fixant les conditions d'importation et de commercialisation des semences à cultiver au Maroc, tel qu'il a été modifié et complété,"", ""Vu l'arrêté du ministre de l'agriculture, de la pêche maritime, du développement rural et des eaux et forêts n°2140-22 du 4 moharrem 1444 (2 août 2022) portant homologation du règlement technique relatif à la production, au contrôle, au conditionnement et à la certification des plants d'arganier ;  \nVu l'arrêté du ministre  de  l'agriculture et de la réforme agraire n°966-93 du 28 chaoual 1413 (20 avril 1993) fixant les conditions d'importation et de commercialisation des semences à cultiver au Maroc, tel qu'il a été modifié et complété,""]"," 1. Les réglementations en vigueur concernant la production et la certification des plants de fruits rouges et d'arganier au Maroc sont les suivantes :
   - La production et la certification des plants de fruits rouges (fraisier, framboisier, myrtillier, murier, groseillier et cassissier) sont régies par l'arrêté du ministre de l'agriculture, de la pêche maritime, du développement rural et des eaux et forêts n°2109-17 du 25 kaada 1438 (18 août 2017).
   - La production, le contrôle, le conditionnement et la certification des plants de figuier de barbarie sont régies par l'arrêté du ministre de l'agriculture, de la pêche maritime, du développement rural et des eaux et forêts n°986-19 du 21 rejeb 1440 (28 mars 2019).
   - La production, le contrôle, le conditionnement et la certification des semences et plants de rosacées à noyau sont régies par l'arrêté du ministre de l'agriculture, de la pêche maritime, du développement rural et des eaux et forêts n°1437-22 du 25 chaoual 1443 (26 mai 2022).
   - La production, le contrôle, le conditionnement et la certification des plants d'arganier sont régies par l'arrêté du ministre de l'agriculture, de la pêche maritime, du développement rural et des eaux et forêts n°2140-22 du 4 moharrem 1444 (2 août 2022).
   - Les conditions d'importation et de commercialisation des semences à cultiver au Maroc sont régies par l'arrêté du ministre de l'agriculture et de la réforme agraire n°966-93 du 28 chaoual 1413 (20 avril 1993).

2. Sources citées :
   - Arrêté du ministre de l'agriculture, de la pêche maritime, du développement rural et des eaux et forêts n°2109-17 du 25 kaada 1438 (18 août 2017)
   - Arrêté du ministre de l'agriculture, de la pêche maritime, du développement rural et des eaux et forêts n°986-19 du 21 rejeb 1440 (28 mars 2019)
   - Arrêté du ministre de l'agriculture, de la pêche maritime, du développement rural et des eaux et forêts n°1437-22 du 25 chaoual 1443 (26 mai 2022)
   - Arrêté du ministre de l'agriculture, de la pêche maritime, du développement rural et des eaux et forêts n°2140-22 du 4 moharrem 1444 (2 août 2022)
   - Arrêté du ministre de l'agriculture et de la réforme agraire n°966-93 du 28 chaoual 1413 (20 avril 1993)","Les réglementations en vigueur concernant la production et la certification des plants de fruits rouges sont établies par l'arrêté n° 2109-17 du 25 kaada 1438 (18 août 2017). Pour les plants d'arganier, l'arrêté pertinent est le n° 2140-22 du 4 moharrem 1444 (2 août 2022).",0.999999999990909,1.0,1.0,0.9460145423156675,gpt-4o-mini,bge-m3,mistral:7b,True,False,False,0.5
Qui a été autorisé à vendre des semences de légumes selon l'arrêté du ministre de l'agriculture du 9 septembre 2025 ?,"[""## Arrêté  du  ministre  de  l'agriculture,  de  la  pêche  \nmaritime,  du  développement  rural  et  des  \neaux et forêts n° 2188-25 du 16 rabii I 1447  \n(9 septembre 2025) portant agrément de la société  \n« SMART AGRICULTURE LEADER » pour  \ncommercialiser des plants certifiés de vigne, de  \nfiguier,  de  figuier  de  barbarie,  de  grenadier,  \ndes rosacées à pépins et des semences et plants  \ncertifiés des rosacées à noyau et d'agrumes et  \ndes plants certifiés des espèces à fruits rouges.  \n2535  \n## Arrêté  du  ministre  de  l'agriculture,  de  la  pêche  \nmaritime,  du  développement  rural  et  des  \neaux et forêts n° 2189-25 du 16 rabii I 1447  \n(9  septembre 2025) portant agrément de la  \nsociété  « VILMORIN-MIKADO ATLAS »  \npour commercialiser des semences certifiées  \ndu maïs et des semences standard de légumes.  \n2536  \n## Arrêté  du  ministre  de  l'agriculture,  de  la  pêche  \nmaritime,  du  développement  rural  et  des  \neaux et forêts n° 2190-25 du 16 rabii I 1447  \n(9 septembre 2025) portant agrément de la société  \n« BEJO MAGHREB » pour commercialiser des  \nsemences standard de légumes.  ......................  \n2537  \nCréation et exploitation de fermes aquacoles."", ""## Arrêté  du  ministre  de  l'agriculture,  de  la  pêche  \nmaritime,  du  développement  rural  et  des  \neaux et forêts n° 2182-25 du 16 rabii I 1447  \n(9  septembre 2025) portant agrément de la  \nsociété « MAROSEM » pour commercialiser  \ndes semences certifiées des céréales à pailles,  \ndu maïs, des légumineuses alimentaires, des  \nlégumineuses fourragères, des oléagineuses,  \nde betteraves industrielles et fourragères, des  \nsemences standard de légumes et des plants  \ncertifiés de pomme de terre.   ............................  \n2531  \n## Arrêté  du  ministre  de  l'agriculture,  de  la  pêche  \nmaritime,  du  développement  rural  et  des  \neaux et forêts n° 2183-25 du 16 rabii I 1447  \n(9  septembre 2025) portant agrément de la  \nsociété « BENAPRIM » pour commercialiser  \ndes plants certifiés de pomme de terre.  ...........  \n2532  \nISSN 0851 - 1217  \nPages  \nPages  \n## Arrêté  du  ministre  de  l'agriculture,  de  la  pêche  \nmaritime,  du  développement  rural  et  des  \neaux et forêts n° 2184-25 du 16 rabii I 1447  \n(9  septembre 2025) portant agrément de la  \nsociété  « RIJK  ZWAAN  MAROC »  pour  \ncommercialiser  des  semences  standard  de  \nlégumes.  ........................................................  \n2533  \n## Arrêté  du  ministre  de  l'agriculture,  de  la  pêche  \nmaritime,  du  développement  rural  et  des  \neaux et forêts n° 2185-25 du 16 rabii I 1447  \n(9  septembre  2025)  portant  agrément  de  \nla  société  « MAGHREB  PALM »  pour  \ncommercialiser des plants certifiés du palmier  \ndattier, d'arganier, de figuier de barbarie, des  \nsemences  et  plants  certifiés  des  rosacées  à  \nnoyau et des plants certifiés des espèces à fruits  \nrouges.   ...........................................................  \n2533  \n## Arrêté  du  ministre  de  l'agriculture,  de  la  pêche  \nmaritime,  du  développement  rural  et  des  \neaux et forêts n° 2186-25 du 16 rabii I 1447  \n(9  septembre 2025) portant agrément de la  \nsociété « FELGAR » pour commercialiser des  \nplants certifiés des espèces à fruits rouges.   ......  \n2534  \n## Arrêté  du  ministre  de  l'agriculture,  de  la  pêche  \nmaritime,  du  développement  rural  et  des  \neaux et forêts n° 2187-25 du 16 rabii I 1447  \n(9  septembre 2025) portant agrément de la  \nsociété « LUNA FRESH » pour commercialiser  \ndes semences certifiées du maïs, des semences  \nstandard de légumes et des plants certifiés de  \npomme de terre.  .............................................  \n2535  \n## Arrêté  du  ministre  de  l'agriculture,  de  la  pêche  \nmaritime,  du  développement  rural  et  des  \neaux et forêts n° 2188-25 du 16 rabii I 1447  \n(9 septembre 2025) portant agrément de la société  \n« SMART AGRICULTURE LEADER » pour  \ncommercialiser des plants certifiés de vigne, de  \nfiguier,  de  figuier  de  barbarie,  de  grenadier,  \ndes rosacées à pépins et des semences et plants  \ncertifiés des rosacées à noyau et d'agrumes et  \ndes plants certifiés des espèces à fruits rouges."", ""## Arrêté du ministre de l'agriculture, de la pêche maritime, du développement rural et des eaux et forêts n°2190-25 du 16 rabii I 1447 (9 septembre 2025) portant agrément de la société «BEJO MAGHREB» pour commercialiser des semences standard de légumes.  \nle  MINIStRe  De  l'aGRICUltURe,  De  la  P Ê Che MaRItIMe, DU DÉVelOPPeMeNt RURal et DeS eaUX et FOR Ê tS,  \nVu le dahir n°1-69-169 du 10 joumada I 1389 (25 juillet 1969) réglementant  la  production  et  la  commercialisation  de semences et de plants, tel qu'il a été modifié, notamment ses articles premier, 2 et 5 ;  \nVu la loi n°25-08 portant création de l'Office national de sécurité sanitaire  des produits alimentaires promulguée par le dahir n°1-09-20 du 22 safar 1430 (18 février 2009), notamment son article 2 ;  \nVu l'arrêté du ministre de l'agriculture et de la réforme agraire n°971-75 du 8 chaoual 1397 (22 septembre 1977) portant homologation du règlement technique relatif au contrôle des semences standard de légumes ;  \nVu l'arrêté du ministre  de  l'agriculture et  de la  réforme agraire n°966-93 du 28 chaoual 1413 (20 avril 1993) fixant les conditions d'importation et de commercialisation des semences à cultiver au Maroc, tel qu'il a été modifié et complété,"", ""## Arrêté du ministre de l'agriculture, de la pêche maritime, du développement rural et des eaux et forêts n°2181-25 du 16 rabii I 1447 (9 septembre 2025) portant agrément de  la  société  « HI-TECH  SEEDS  MAROC» pour commercialiser des semences standard de légumes.  \nle  MINIStRe  De  l'aGRICUltURe,  De  la  P Ê Che MaRItIMe, DU DÉVelOPPeMeNt RURal et DeS eaUX et FOR Ê tS,  \nVu le dahir n°1-69-169 du 10 joumada I 1389 (25 juillet 1969) réglementant  la  production  et  la  commercialisation  de semences et de plants, tel qu'il a été modifié, notamment ses articles premier, 2 et 5 ;  \nVu la loi n°25-08 portant création de l'Office national de sécurité sanitaire  des produits alimentaires promulguée par le dahir n°1-09-20 du 22 safar 1430 (18 février 2009), notamment son article 2 ;  \nVu l'arrêté du ministre de l'agriculture et de la réforme agraire n°971-75 du 8 chaoual 1397 (22 septembre 1977) portant homologation du règlement technique relatif au contrôle des semences standard de légumes ;  \nVu l'arrêté du ministre  de  l'agriculture et  de la  réforme agraire  n°966-93 du 28 chaoual 1413 (20 avril 1993) fixant les conditions d'importation et de commercialisation des semences à cultiver au Maroc, tel qu'il a été modifié et complété,"", ""## Arrêté du ministre de l'agriculture, de la pêche maritime, du développement rural et des eaux et forêts n°1658-25 du 29 hija 1446 (26 juin 2025)  portant agrément de la société « LA MAROCAINE DU CONSULTING ET SERVICE AGRICOLE » pour commercialiser des semences certifiées du maïs, des légumineuses alimentaires, des légumineuses fourragères, des oléagineuses et des semences standard de légumes.  \nle  MINIStRe  De  l'aGRICUltURe,  De  la  P Ê Che MaRItIMe, DU DÉVelOPPeMeNt RURal et DeS eaUX et FOR Ê tS,  \nVu le dahir n°1-69-169 du 10 joumada I 1389 (25 juillet 1969) réglementant  la  production  et  la  commercialisation  de semences et de plants, tel  qu'il a été modifié, notamment ses articles premier, 2 et 5 ;  \nVu  la loi n° 25-08 portant création de l'Office national de sécurité sanitaire   des produits alimentaires promulguée par le dahir n°1-09-20 du 22 safar 1430 (18 février 2009), notamment son article 2 ;  \nVu l'arrêté du ministre de l'agriculture et de la réforme agraire n°857-75 du 8 chaoual 1397 (22 septembre 1977) portant homologation du règlement technique relatif à la production, au contrôle, au conditionnement et à la certification des semences de légumineuses fourragères (luzerne, bersim, trèfle de Perse, pois fourrager, vesce et lupins) ;  \nVu l'arrêté du ministre de l'agriculture et de la réforme agraire n°858-75 du 8 chaoual 1397 (22 septembre 1977) portant homologation du règlement technique relatif à la production, au contrôle, au conditionnement et à la certification des semences de tournesol, carthame, colza, lin, soja et arachide ;  \nVu l'arrêté du ministre de l'agriculture et de la réforme agraire n°859-75 du 8 chaoual 1397 (22 septembre 1977) portant homologation du règlement technique relatif à la production, au contrôle, au conditionnement et à la certification des semences de maïs ;  \nVu l'arrêté du ministre de l'agriculture et de la réforme agraire n°862-75 du 8 chaoual 1397 (22 septembre 1977) portant homologation du règlement technique relatif à la production, au contrôle, au conditionnement et à la certification des semences de légumineuses alimentaires (fève, féverole, pois, lentille, pois-chiche et haricot) ;  \nVu l'arrêté du ministre de l'agriculture et de la réforme agraire n°971-75 du 8 chaoual 1397 (22 septembre 1977) portant homologation du règlement technique relatif au contrôle des semences standard de légumes ;  \nVu l'arrêté du ministre de l'agriculture et de la réforme agraire n°966-93 du 28 chaoual 1413 (20 avril 1993) fixant les conditions d'importation et de commercialisation des semences à cultiver au Maroc, tel qu'il a été modifié et complété,"", ""## Arrêté  du  ministre  de  l'agriculture,  de  la  pêche maritime,  du  développement  rural  et  des eaux et forêts n° 2181-25 du 16 rabii I 1447 (9  septembre 2025) portant agrément de la société « HI-TECH SEEDS MAROC » pour commercialiser  des  semences  standard  de légumes.  ........................................................  \n2531"", ""## Arrêté du ministre de l'agriculture, de la pêche maritime, du développement rural et des eaux et forêts n°2190-25 du 16 rabii I 1447 (9 septembre 2025) portant agrément de la société «BEJO MAGHREB» pour commercialiser des semences standard de légumes.  \nle  MINIStRe  De  l'aGRICUltURe,  De  la  P Ê Che MaRItIMe, DU DÉVelOPPeMeNt RURal et DeS eaUX et FOR Ê tS,  \nVu le dahir n°1-69-169 du 10 joumada I 1389 (25 juillet 1969) réglementant  la  production  et  la  commercialisation  de semences et de plants, tel qu'il a été modifié, notamment ses articles premier, 2 et 5 ;  \nVu la loi n°25-08 portant création de l'Office national de sécurité sanitaire  des produits alimentaires promulguée par le dahir n°1-09-20 du 22 safar 1430 (18 février 2009), notamment son article 2 ;  \nVu l'arrêté du ministre de l'agriculture et de la réforme agraire n°971-75 du 8 chaoual 1397 (22 septembre 1977) portant homologation du règlement technique relatif au contrôle des semences standard de légumes ;  \nVu l'arrêté du ministre  de  l'agriculture et  de la  réforme agraire n°966-93 du 28 chaoual 1413 (20 avril 1993) fixant les conditions d'importation et de commercialisation des semences à cultiver au Maroc, tel qu'il a été modifié et complété,"", ""## Arrêté  du  ministre  de  l'agriculture,  de  la  pêche maritime,  du  développement  rural  et  des eaux et forêts n° 2181-25 du 16 rabii I 1447 (9  septembre 2025) portant agrément de la société « HI-TECH SEEDS MAROC » pour commercialiser  des  semences  standard  de légumes.  ........................................................  \n2531"", ""## Arrêté du ministre de l'agriculture, de la pêche maritime, du développement rural et des eaux et forêts  n°1001-25 du 18chaoual 1446 (17 avril 2025) portant agrément de  la  société  «MED  HERMES  MAGHREB» pour commercialiser des semences standard de légumes.  \nle  MINIStRe  De  l'aGRICUltURe,  De  la  P Ê Che MaRItIMe, DU DÉVelOPPeMeNt RURal et DeS eaUX et FOR Ê tS,  \nVu le dahir n°1-69-169 du 10 joumada I 1389 (25 juillet 1969) réglementant la production et la commercialisation de semences et de plants, tel  qu'il a été modifié, notamment ses articles premier, 2 et 5 ;  \nVu  la loi n° 25-08 portant création de l'Office national de sécurité sanitaire   des produits alimentaires, promulguée par le dahir n°1-09-20 du 22 safar 1430 (18 février 2009), notamment son article 2 ;  \nVu l'arrêté du ministre de l'agriculture et de la réforme agraire n°971-75 du 8 chaoual 1397 (22 septembre 1977) portant homologation du règlement technique relatif au contrôle des semences standard de légumes;  \nVu l'arrêté du ministre de l'agriculture et de la réforme agraire n°966-93 du 28 chaoual 1413 (20 avril 1993) fixant les conditions d'importation et de commercialisation des semences à cultiver au Maroc, tel qu'il a été modifié et complété,"", ""## Arrêté du ministre de l'agriculture, de la pêche maritime, du développement rural et des eaux et forêts n°1658-25 du 29 hija 1446 (26 juin 2025)  portant agrément de la société « LA MAROCAINE DU CONSULTING ET SERVICE AGRICOLE » pour commercialiser des semences certifiées du maïs, des légumineuses alimentaires, des légumineuses fourragères, des oléagineuses et des semences standard de légumes.  \nle  MINIStRe  De  l'aGRICUltURe,  De  la  P Ê Che MaRItIMe, DU DÉVelOPPeMeNt RURal et DeS eaUX et FOR Ê tS,  \nVu le dahir n°1-69-169 du 10 joumada I 1389 (25 juillet 1969) réglementant  la  production  et  la  commercialisation  de semences et de plants, tel  qu'il a été modifié, notamment ses articles premier, 2 et 5 ;  \nVu  la loi n° 25-08 portant création de l'Office national de sécurité sanitaire   des produits alimentaires promulguée par le dahir n°1-09-20 du 22 safar 1430 (18 février 2009), notamment son article 2 ;  \nVu l'arrêté du ministre de l'agriculture et de la réforme agraire n°857-75 du 8 chaoual 1397 (22 septembre 1977) portant homologation du règlement technique relatif à la production, au contrôle, au conditionnement et à la certification des semences de légumineuses fourragères (luzerne, bersim, trèfle de Perse, pois fourrager, vesce et lupins) ;  \nVu l'arrêté du ministre de l'agriculture et de la réforme agraire n°858-75 du 8 chaoual 1397 (22 septembre 1977) portant homologation du règlement technique relatif à la production, au contrôle, au conditionnement et à la certification des semences de tournesol, carthame, colza, lin, soja et arachide ;  \nVu l'arrêté du ministre de l'agriculture et de la réforme agraire n°859-75 du 8 chaoual 1397 (22 septembre 1977) portant homologation du règlement technique relatif à la production, au contrôle, au conditionnement et à la certification des semences de maïs ;  \nVu l'arrêté du ministre de l'agriculture et de la réforme agraire n°862-75 du 8 chaoual 1397 (22 septembre 1977) portant homologation du règlement technique relatif à la production, au contrôle, au conditionnement et à la certification des semences de légumineuses alimentaires (fève, féverole, pois, lentille, pois-chiche et haricot) ;  \nVu l'arrêté du ministre de l'agriculture et de la réforme agraire n°971-75 du 8 chaoual 1397 (22 septembre 1977) portant homologation du règlement technique relatif au contrôle des semences standard de légumes ;  \nVu l'arrêté du ministre de l'agriculture et de la réforme agraire n°966-93 du 28 chaoual 1413 (20 avril 1993) fixant les conditions d'importation et de commercialisation des semences à cultiver au Maroc, tel qu'il a été modifié et complété,"", ""## Arrêté du ministre de l'agriculture, de la pêche maritime, du développement rural et des eaux et forêts n°2181-25 du 16 rabii I 1447 (9 septembre 2025) portant agrément de  la  société  « HI-TECH  SEEDS  MAROC» pour commercialiser des semences standard de légumes.  \nle  MINIStRe  De  l'aGRICUltURe,  De  la  P Ê Che MaRItIMe, DU DÉVelOPPeMeNt RURal et DeS eaUX et FOR Ê tS,  \nVu le dahir n°1-69-169 du 10 joumada I 1389 (25 juillet 1969) réglementant  la  production  et  la  commercialisation  de semences et de plants, tel qu'il a été modifié, notamment ses articles premier, 2 et 5 ;  \nVu la loi n°25-08 portant création de l'Office national de sécurité sanitaire  des produits alimentaires promulguée par le dahir n°1-09-20 du 22 safar 1430 (18 février 2009), notamment son article 2 ;  \nVu l'arrêté du ministre de l'agriculture et de la réforme agraire n°971-75 du 8 chaoual 1397 (22 septembre 1977) portant homologation du règlement technique relatif au contrôle des semences standard de légumes ;  \nVu l'arrêté du ministre  de  l'agriculture et  de la  réforme agraire  n°966-93 du 28 chaoual 1413 (20 avril 1993) fixant les conditions d'importation et de commercialisation des semences à cultiver au Maroc, tel qu'il a été modifié et complété,"", ""## Arrêté  du  ministre  de  l'agriculture,  de  la  pêche  \nmaritime,  du  développement  rural  et  des  \neaux et forêts n° 2188-25 du 16 rabii I 1447  \n(9 septembre 2025) portant agrément de la société  \n« SMART AGRICULTURE LEADER » pour  \ncommercialiser des plants certifiés de vigne, de  \nfiguier,  de  figuier  de  barbarie,  de  grenadier,  \ndes rosacées à pépins et des semences et plants  \ncertifiés des rosacées à noyau et d'agrumes et  \ndes plants certifiés des espèces à fruits rouges.  \n2535  \n## Arrêté  du  ministre  de  l'agriculture,  de  la  pêche  \nmaritime,  du  développement  rural  et  des  \neaux et forêts n° 2189-25 du 16 rabii I 1447  \n(9  septembre 2025) portant agrément de la  \nsociété  « VILMORIN-MIKADO ATLAS »  \npour commercialiser des semences certifiées  \ndu maïs et des semences standard de légumes.  \n2536  \n## Arrêté  du  ministre  de  l'agriculture,  de  la  pêche  \nmaritime,  du  développement  rural  et  des  \neaux et forêts n° 2190-25 du 16 rabii I 1447  \n(9 septembre 2025) portant agrément de la société  \n« BEJO MAGHREB » pour commercialiser des  \nsemences standard de légumes.  ......................  \n2537  \nCréation et exploitation de fermes aquacoles.""]"," 1. La société « HI-TECH SEEDS MAROC» a été autorisée à vendre des semences de légumes selon l'arrêté du ministre de l'agriculture du 9 septembre 2025.
2. Sources citées : Les extraits fournis.",La société « HI-TECH SEEDS MAROC » a été autorisée à commercialiser des semences standard de légumes selon l'arrêté du ministre de l'agriculture du 9 septembre 2025.,0.3304924242341619,1.0,0.6666666666666666,0.8674554768700812,gpt-4o-mini,bge-m3,mistral:7b,True,False,False,0.5
Comment fonctionne le processus de fusion d'un OPCVM avec un autre OPCVM existant ?,"[""###### Article 77  \nLa société de gestion peut procéder à la fusion d'au moins deux OPCVM ou deux compartiments d'OPCVM, pour constituer un nouvel OPCVM ou un nouveau compartiment d'OPCVM auquel elle transfère sans liquidation l'ensemble de leurs actifs et passifs et attribue à leurs porteurs de parts ou actionnaires, des parts ou actions du nouvel OPCVM ou nouveau compartiment."", ""###### Article 78  \nLa société de gestion peut procéder à la fusion-absorption, par un OPCVM existant ou par un compartiment d'OPCVM existant dénommé ci-dessous «OPCVM absorbeur», d'un OPCVM ou plusieurs OPCVM ou compartiments d'OPCVM existants dénommés ci-dessous «OPCVM absorbé».  \nElle transfère sans liquidation l'ensemble de l'actif et passif de l'OPCVM absorbéà l'OPCVM absorbeur et attribue aux porteurs de parts ou actionnaires de l'OPCVM absorbédes parts ou actions dans l'OPCVM absorbeur."", ""###### Article 80  \nLa société de gestion doit élaborer pour procéder à la fusion, fusion-absorption ou scission d'OPCVM un projet qui précise la nature de l'opération, ses objectifs et le cas échéant ses conditions, ainsi que la stratégie d'investissement des OPCVM concernés.  \nLedit projet est communiqué aux membres du conseil d'administration de la société de gestion concernée et aux commissaires aux comptes de chaque OPCVM concerné, au  moins  45  jours  avant  la  date  de  la  tenue  du  conseil d'administration pour délibérer sur l'opération envisagée."", ""###### Article 82  \nLe  rapport  des  commissaires  aux  apports  et  les informations  relatives  au  projet  de  fusion,  de  fusionabsorption ou de scission doivent être mis à la disposition des porteurs de parts ou actionnaires au siège social et sur le site électronique des sociétés de gestion des OPCVM concernés, au plus tard quinze (15) jours avant la date de la tenue du conseil d'administration desdites sociétés de gestion.  \nLes informations visées au premier alinéa du présent article, comportent notamment les éléments suivants :  \n- les nouvelles parts ou actions qui seront octroyées à chaque porteur de part ou actionnaire suite à l'opération envisagée ;\n-  les  indicateurs  de  risque  et  de  rendement  liés  au placement dans les OPCVM concernés avant et après l'opération envisagée ;\n- les frais envisagés à la charge de la société de gestion ;\n- la détermination des coûts de l'opération envisagée ;\n-  l'incidence  de  l'opération  envisagée  sur  l'actif  des OPCVM concernés ;\n- les produits, leur affectation et distribution dans les OPCVM concernés ;\n- la date envisagée de la réalisation du projet."", ""###### Article 110  \nEn cas de fusion, fusion-absorption ou scission d'un OPCVM maître, son ou ses OPCVM nourriciers doivent demander auprès de l'AMMC au plus tard 30 jours à compter de  la  date  de  leur  information  de  la  décision  du  conseil d'administration de la société de gestion de l'OPCVM maître le retrait de leur agrément ou l'octroi d'un nouvel agrément selon les formes prévues au chapitre premier du titre premier de la deuxième partie de la présente loi.  \nL'OPCVM nourricier est informé dans un délai de quinze jours ouvrables à compter de la date du dépôt de sa demande, de l'octroi ou du refus du nouvel agrément. En cas de refus, l'agrément de l'OPCVM nourricier est retiré et il entre en liquidation.  \nLes porteurs de parts ou actionnaires d'un OPCVM nourricier jouissent des mêmes droits prévus à l'article 84 ci-dessus."", ""###### Article 83  \nL'OPCVM concerné par le projet de fusion, fusionabsorption ou scission doit être soumis à un nouvel agrément par l'AMMC. La demande dudit agrément accompagnée du projet, du rapport du commissaire aux apports et des informations prévus respectivement par les articles 11, 80, 81 et 82 ci-dessus, est présentée par la société de gestion à l'AMMC dans les conditions et formes prévues aux articles 9 à 13 et aux articles 26 et 37 ci-dessus."", ""###### Article 77  \nLa société de gestion peut procéder à la fusion d'au moins deux OPCVM ou deux compartiments d'OPCVM, pour constituer un nouvel OPCVM ou un nouveau compartiment d'OPCVM auquel elle transfère sans liquidation l'ensemble de leurs actifs et passifs et attribue à leurs porteurs de parts ou actionnaires, des parts ou actions du nouvel OPCVM ou nouveau compartiment."", ""###### Article 105  \nLorsque l'OPCVM maître et l'OPCVM nourricier n'ont pas le même commissaire aux comptes, les commissaires aux comptes desdits OPCVM concluent un accord d'échange d'informations afin d'assurer la bonne fin de leurs missions.  \nLes mentions minimales dudit accord sont fixées par circulaire de l'AMMC."", ""###### Article 83  \nL'OPCVM concerné par le projet de fusion, fusionabsorption ou scission doit être soumis à un nouvel agrément par l'AMMC. La demande dudit agrément accompagnée du projet, du rapport du commissaire aux apports et des informations prévus respectivement par les articles 11, 80, 81 et 82 ci-dessus, est présentée par la société de gestion à l'AMMC dans les conditions et formes prévues aux articles 9 à 13 et aux articles 26 et 37 ci-dessus."", ""###### Article 120  \nSeules peuvent exercer en tant que société de gestion d'OPCVM, les sociétés anonymes ayant leur siège au Maroc agréées conformément au présent titre.  \nLesdites sociétés exercent à titre d'activité principale la gestion d'OPCVM, elles peuvent également exercer les activités connexes suivantes :  \n- la gestion de portefeuilles en instruments financiers pour le compte de personnes physiques ou morales en vertu d'un mandat;\n- le conseil au profit des éventuels porteurs de parts ou actionnaires pour investir dans les OPCVM qu'elles gèrent ;\n- la commercialisation des parts ou actions des OPCVM qu'elles gèrent, y compris la promotion, la publicité, le démarchage et la réception des ordres de souscription et de rachat.  \nLes modalités d'exercice des activités connexes et les règles déontologiques à respecter pour exercer lesdites activités sont fixées par circulaire de l'AMMC."", ""###### Article 8  \nLa constitution de chaque  OPCVM est subordonnée à un agrément préalable de l'AMMC sur la base de son projet de règlement de gestion et le cas échéant de l'annexe de chaque compartiment prévue à l'article  10  ci-dessous,  lorsqu'il  a  la forme de FCP ou sur la base de son projet de statuts lorsqu'il a la forme d'une SICAV, selon les modalités et formes fixées par circulaire de l'AMMC."", ""###### Article 14  \nL'AMMC établit et met à jour la liste des OPCVM agréés et la publie sur son site électronique.""]"," 1. Le processus de fusion d'un OPCVM avec un autre OPCVM existant est réglementé par l'article 77 du Dahir n° 1-25-64 portant promulgation de la loi 03-25 sur les organismes de placement collectif en valeurs mobilières. La société de gestion peut procéder à la fusion d'au moins deux OPCVM ou deux compartiments d'OPCVM, pour constituer un nouvel OPCVM ou un nouveau compartiment d'OPCVM auquel elle transfère sans liquidation l'ensemble de leurs actifs et passifs et attribue à leurs porteurs de parts ou actionnaires des parts ou actions du nouvel OPCVM ou nouveau compartiment.

2. Source : [Dahir n° 1-25-64 du 22 joumada I 1447 (14 novembre 2025) portant promulgation de la loi 03-25](https://www.legifrance.gouv.ma/affichTexte.do?cidTexte=JORFTEXT000029867221&categorieLien=id) > DEUXIÈME PARTIE DES OPCVM > TITRE III > Article 77","Le processus de fusion d'un OPCVM avec un autre OPCVM existant, selon l'article 78, implique que la société de gestion procède à une fusion-absorption. Cela inclut le transfert sans liquidation de l'ensemble de l'actif et passif de l'OPCVM absorbé à l'OPCVM absorbeur, qui attribue ensuite des parts ou actions de celui-ci aux porteurs de parts ou actionnaires de l'OPCVM absorbé.",0.9240362811659378,1.0,0.6666666666666666,0.8464162481571335,gpt-4o-mini,bge-m3,mistral:7b,True,False,False,0.5
Quelle est la taille et l'emplacement d'une ferme aquacole à Oualidia dans la province de Sidi Bennour ?,"[""| Lieu d'implantation de la ferme aquacole : Superficie : Limites externes d'implantation de la ferme aquacole : | Au niveau de la lagune d'Oualidia, Province de Sidi Bennour. Un hectare, quatre-vingt-six ares, quarante-quatre centiares (1 ha 86 a 44 ca).                                                                                                                                                                                                                                                                                                                                                                                                                                                                                                                                      | Au niveau de la lagune d'Oualidia, Province de Sidi Bennour. Un hectare, quatre-vingt-six ares, quarante-quatre centiares (1 ha 86 a 44 ca).                                                                                                        | Au niveau de la lagune d'Oualidia, Province de Sidi Bennour. Un hectare, quatre-vingt-six ares, quarante-quatre centiares (1 ha 86 a 44 ca).                                                                                                        | Au niveau de la lagune d'Oualidia, Province de Sidi Bennour. Un hectare, quatre-vingt-six ares, quarante-quatre centiares (1 ha 86 a 44 ca).                                                                                                        |"", ""| Lieu d'implantation de la ferme aquacole : Superficie :                                                                                                                                                                                                                                                                                                                                   | En mer, au large de Cintra, province d'Oued Eddahab Vingt (20) hectares                                                                                                                                                                                                                                                                                                                   | En mer, au large de Cintra, province d'Oued Eddahab Vingt (20) hectares                                                                                                                                                                                                                                                                                                                   | En mer, au large de Cintra, province d'Oued Eddahab Vingt (20) hectares                                                                                                                                                                                                                                                                                                                   |"", ""| Lieu d'implantation de la ferme aquacole : Superficie :                                                                                                                                                                                                                                                                                                                                                                                                          | En mer, au large de Cintra, province d'Oued Eddahab.                                                                                                                                                                                                                                                                                                                                                                                                             | hectares.                                                                                                                                                                                                                                                                                                                                                                                                                                                        | En mer, au large de Cintra, province d'Oued Eddahab.                                                                                                                                                                                                                                                                                                                                                                                                             | En mer, au large de Cintra, province d'Oued Eddahab.                                                                                                                                                                                                                                                                                                                                                                                                             | En mer, au large de Cintra, province d'Oued Eddahab.                                                                                                                                                                                                                                                                                                                                                                                                             |"", ""| Lieu d'implantation de la ferme aquacole : Superficie :                                                                                                                                                                                                                                                                                                                                    | Au niveau de la Baie de Dakhla, province d'Oued Eddahab. Deux (2) hectares.                                                                                                                                                                                                                                                                                                                | Au niveau de la Baie de Dakhla, province d'Oued Eddahab. Deux (2) hectares.                                                                                                                                                                                                                                                                                                                | Au niveau de la Baie de Dakhla, province d'Oued Eddahab. Deux (2) hectares.                                                                                                                                                                                                                                                                                                                |"", ""| Durée de la Convention                                                                                                                                                                                                                                                                                                                                                              | Dix (10) ans, renouvelable                                                                                                                                                                                                                                                                                                                                                          | Dix (10) ans, renouvelable                                                                                                                                                                                                                                                                                                                                                          | Dix (10) ans, renouvelable                                                                                                                                                                                                                                                                                                                                                          |\n| Lieu d'implantation de la ferme aquacole : Superficie :                                                                                                                                                                                                                                                                                                                             | En mer, au large de Labouirda, Province d'Oued Eddahab Vingt (20) hectares                                                                                                                                                                                                                                                                                                          | En mer, au large de Labouirda, Province d'Oued Eddahab Vingt (20) hectares                                                                                                                                                                                                                                                                                                          | En mer, au large de Labouirda, Province d'Oued Eddahab Vingt (20) hectares                                                                                                                                                                                                                                                                                                          |"", ""| Durée de la Convention                                                                                                                                                                                                                                                                                                                                           | Dix (10) ans, renouvelable                                                                                                                                                                                                                                                                                                                                       | Dix (10) ans, renouvelable                                                                                                                                                                                                                                                                                                                                       | Dix (10) ans, renouvelable                                                                                                                                                                                                                                                                                                                                       |\n| Lieu d'implantation de la ferme aquacole : Superficie :                                                                                                                                                                                                                                                                                                          | En mer, au large d'Ain Beida, province d'Oued Eddahab Vingt (20) hectares                                                                                                                                                                                                                                                                                        | En mer, au large d'Ain Beida, province d'Oued Eddahab Vingt (20) hectares                                                                                                                                                                                                                                                                                        | En mer, au large d'Ain Beida, province d'Oued Eddahab Vingt (20) hectares                                                                                                                                                                                                                                                                                        |"", ""| Lieu d'implantation de la ferme aquacole : Superficie : Limites externes d'implantation de la ferme aquacole : | Au niveau de la lagune d'Oualidia, Province de Sidi Bennour. Un hectare, quatre-vingt-six ares, quarante-quatre centiares (1 ha 86 a 44 ca).                                                                                                                                                                                                                                                                                                                                                                                                                                                                                                                                      | Au niveau de la lagune d'Oualidia, Province de Sidi Bennour. Un hectare, quatre-vingt-six ares, quarante-quatre centiares (1 ha 86 a 44 ca).                                                                                                        | Au niveau de la lagune d'Oualidia, Province de Sidi Bennour. Un hectare, quatre-vingt-six ares, quarante-quatre centiares (1 ha 86 a 44 ca).                                                                                                        | Au niveau de la lagune d'Oualidia, Province de Sidi Bennour. Un hectare, quatre-vingt-six ares, quarante-quatre centiares (1 ha 86 a 44 ca).                                                                                                        |"", ""| Lieu d'implantation de la ferme aquacole : Superficie :                                                                                                                                                                                                                                                                                                                                   | En mer, au large de Cintra, province d'Oued Eddahab Vingt (20) hectares                                                                                                                                                                                                                                                                                                                   | En mer, au large de Cintra, province d'Oued Eddahab Vingt (20) hectares                                                                                                                                                                                                                                                                                                                   | En mer, au large de Cintra, province d'Oued Eddahab Vingt (20) hectares                                                                                                                                                                                                                                                                                                                   |"", ""| Lieu d'implantation de la ferme aquacole : Superficie :                                                                                                                                                                                                                                                                                                                                                                                                          | En mer, au large de Cintra, province d'Oued Eddahab.                                                                                                                                                                                                                                                                                                                                                                                                             | hectares.                                                                                                                                                                                                                                                                                                                                                                                                                                                        | En mer, au large de Cintra, province d'Oued Eddahab.                                                                                                                                                                                                                                                                                                                                                                                                             | En mer, au large de Cintra, province d'Oued Eddahab.                                                                                                                                                                                                                                                                                                                                                                                                             | En mer, au large de Cintra, province d'Oued Eddahab.                                                                                                                                                                                                                                                                                                                                                                                                             |"", ""| Lieu d'implantation de la ferme aquacole : Superficie :                                                                                                                                                                                                                                                                                                                                    | Au niveau de la Baie de Dakhla, province d'Oued Eddahab. Deux (2) hectares.                                                                                                                                                                                                                                                                                                                | Au niveau de la Baie de Dakhla, province d'Oued Eddahab. Deux (2) hectares.                                                                                                                                                                                                                                                                                                                | Au niveau de la Baie de Dakhla, province d'Oued Eddahab. Deux (2) hectares.                                                                                                                                                                                                                                                                                                                |"", ""| Limites externes d'implantation de la ferme aquacole :                                                                                                                                                                                                                                                                                                                                                                                                           | Parcelle 1                                                                                                                                                                                                                                                                                                                                                                                                                                                       | B1                                                                                                                                                                                                                                                                                                                                                                                                                                                               | 23° 5' 19,356''N                                                                                                                                                                                                                                                                                                                                                                                                                                                 |                                                                                                                                                                                                                                                                                                                                                                                                                                                                  | 16° 10' 38,952''W                                                                                                                                                                                                                                                                                                                                                                                                                                                |"", ""| Limites externes d'implantation de la ferme aquacole :                                                                                                                                                                                                                                                                                                                                                                                                           | Parcelle 1                                                                                                                                                                                                                                                                                                                                                                                                                                                       | B2                                                                                                                                                                                                                                                                                                                                                                                                                                                               | 23° 5' 27,528''N                                                                                                                                                                                                                                                                                                                                                                                                                                                 |                                                                                                                                                                                                                                                                                                                                                                                                                                                                  | 16° 10' 37,812''W                                                                                                                                                                                                                                                                                                                                                                                                                                                |""]"," 1. La taille et l'emplacement d'une ferme aquacole à Oualidia dans la province de Sidi Bennour ne sont pas explicitement mentionnés dans les extraits.
2. Les sources consultées pour cette réponse sont les extraits de différents arrêtés mentionnant des fermes aquacoles en Maroc, mais aucun n'est situé à Oualidia.","La ferme aquacole est implantée au niveau de la lagune d'Oualidia, dans la province de Sidi Bennour, sur une superficie d'un hectare, quatre-vingt-six ares, quarante-quatre centiares (1 ha 86 a 44 ca).",0.47294372293189935,1.0,0.0,0.0,gpt-4o-mini,bge-m3,mistral:7b,True,False,False,0.5
Quelles sont les différentes sources de revenus pour l'administration générale mentionnées dans le budget pour l'année 2024 ?,"[""|                  |           | 30                  | Reversements de fonds sur les dépenses budgétaires                                                                               | 180 000 000                                |\n|                  |           | 40                  | Fonds de concours                                                                                                                |                                            |\n|                  |           | 41                  | Fonds de concours (coopération internationale)                                                                                   | Mémoire                                    |  \n| Chapitre   | Service   | Nature de Recette   | DESIGNATION DES RECETTES                                                                   | Evaluations pour l'année budgétaire 2024   |\n|------------|-----------|---------------------|--------------------------------------------------------------------------------------------|--------------------------------------------|\n|            |           | 42                  | Fonds de concours à rattacher à divers services                                            | Mémoire                                    |\n|            |           | 50                  | Produits des legs et donations attribués à l'Etat et à diverses administrations publiques  | Mémoire                                    |\n|            |           | 60                  | Recettes exceptionnelles d'ordre                                                           | Mémoire                                    |\n|            |           | 70                  | Report des crédits disponibles au budget de l'année précédente                             | Mémoire                                    |\n|            |           | 80                  | Recettes diverses en atténuation de dépenses                                               | 31 681 000                                 |\n|            |           | 90                  | Recettes diverses                                                                          |                                            |\n|            |           | 91                  | Recettes au titre des versements à partir des comptes d'affectation spéciale               | Mémoire                                    |\n|            |           | 92                  | Recettes au titre des versements à partir des services de l'Etat gérés de manière autonome | Mémoire                                    |\n|            |           | 93                  | Autres recettes                                                                            | 71 014 000                                 |\n|            |           |                     | TOTAL DES RECETTES ADMINISTRATION GENERALE                                                 | 1 235 000 000                              |"", ""|                  | 8100      |                     | ADMINISTRATION GENERALE                                                                                                                              |                                            |\n|                  |           | 10                  | Pénalités et amendes autres que fiscales                                                                                                             | 50 000                                     |\n|                  |           | 20                  | Reversement par la Société Nationale des Transports et de la Logistique (SNTL) des crédits non utilisés au titre des achats de véhicules automobiles | Mémoire                                    |\n|                  |           | 30                  | Créances sur le Trésor prescrites                                                                                                                    | 173 744 000                                |\n|                  |           | 40                  | Prélèvement sur les produits des jeux de hasard                                                                                                      | Mémoire                                    |\n|                  |           | 50                  | Prélèvement sur les enjeux de courses de chevaux et de lévriers                                                                                      | Mémoire                                    |\n|                  |           | 60                  | Contribution des collectivités territoriales aux dépenses supportées par le budget général                                                           | Mémoire                                    |  \n3  \n| Chapitre   | Service   | Nature de Recette   | DESIGNATION DES RECETTES                                                     | Evaluations pour l'année budgétaire 2024   |\n|------------|-----------|---------------------|------------------------------------------------------------------------------|--------------------------------------------|\n|            | 8200      | 70                  | Recettes diverses                                                            | 294 421 000                                |\n|            |           |                     | TOTAL DES RECETTES ADMINISTRATION GENERALE                                   | 468 215 000                                |\n|            |           | 10                  | DIRECTION DES AFFAIRES ADMINISTRATIVES ET GENERALES Recettes diverses        | 189 000                                    |\n|            |           |                     | TOTAL DES RECETTES DIRECTION DES AFFAIRES ADMINISTRATIVES ET GENERALES       | 189 000                                    |\n|            | 8300      | 10                  | ADMINISTRATION DES DOUANES ET IMPOTS INDIRECTS Droits de douane              |                                            |"", ""|            |           | 50                  | Produits de vente de meubles, épaves et matériel réformé                                                          | 47 000 000                                 |\n|            |           | 60                  | Recettes diverses                                                                                                 | 2 500 000                                  |\n|            |           |                     | TOTAL DES RECETTES DIRECTION DES DOMAINES DE L'ETAT                                                               | 355 000 000                                |\n|            |           |                     | TOTAL DU CHAPITRE MINISTERE DE L'ECONOMIE ET DES FINANCES                                                         | 432 056 874 000                            |  \n9  \n| Chapitre         | Service   | Nature de Recette   | DESIGNATION DES RECETTES                                                                                                | Evaluations pour l'année budgétaire 2024   |\n|------------------|-----------|---------------------|-------------------------------------------------------------------------------------------------------------------------|--------------------------------------------|\n| 1.1.0.0.0.14.000 | 6100      | 10                  | MINISTERE DU TOURISME, DE L'ARTISANAT ET DE L'ECONOMIE SOCIALE ET SOLIDAIRE ADMINISTRATION GENERALE Taxe d'estampillage | Mémoire                                    |\n|                  |           | 20                  | Taxe d'inspection                                                                                                       | Mémoire                                    |\n|                  |           | 30                  | Recettes diverses                                                                                                       | Mémoire                                    |\n|                  |           |                     | TOTAL DES RECETTES ADMINISTRATION GENERALE                                                                              | Mémoire                                    |\n|                  |           |                     | TOTAL DU CHAPITRE MINISTERE DU TOURISME, DE L'ARTISANAT ET DE L'ECONOMIE SOCIALE ET SOLIDAIRE                           | Mémoire                                    |\n| 1.1.0.0.0.17.000 | 8100      |                     | MINISTERE DE L'EQUIPEMENT ET DE L'EAU DIRECTION DES AFFAIRES ADMINISTRATIVES ET JURIDIQUES                              |                                            |\n|                  |           | 10                  | Redevances pour l'extraction de matériaux                                                                               | 3 000 000                                  |"", ""### I. BUDGET GÉNÉRAL  \n| Chapitre         | Service   | Nature de Recette   | DESIGNATION DES RECETTES                                                                                                                                           | Evaluations pour l'année budgétaire 2024   |\n|------------------|-----------|---------------------|--------------------------------------------------------------------------------------------------------------------------------------------------------------------|--------------------------------------------|\n| 1.1.0.0.0.02.000 | 0000      | 10                  | COUR ROYALE ADMINISTRATION GENERALE Droits de chancellerie sur les armoiries et les blasons                                                                        | Mémoire                                    |\n|                  |           | 20                  | Recettes au titre des ordres du Royaume                                                                                                                            | 50 000                                     |\n|                  |           | 30                  | Recettes diverses                                                                                                                                                  | Mémoire                                    |\n|                  |           |                     | TOTAL DES RECETTES ADMINISTRATION GENERALE                                                                                                                         | 50 000                                     |\n|                  |           |                     | TOTAL DU CHAPITRE COUR ROYALE                                                                                                                                      | 50 000                                     |\n| 1.1.0.0.0.05.000 | 0000      | 10                  | JURIDICTIONS FINANCIERES ADMINISTRATION GENERALE Débets juridictionnels                                                                                            | Mémoire                                    |\n|                  |           | 20                  | Condamnations au remboursement prononcées par les juridictions financières                                                                                         | Mémoire                                    |\n|                  |           | 30                  | Amendes, astreintes et autres sanctions prononcées par les juridictions financières                                                                                | 1 054 000                                  |\n|                  |           | 40                  | Intérêts de retard au titre des sanctions prononcées par les juridictions financières                                                                              | Mémoire                                    |"", ""#### TITRE III  \n##### Dispositions relatives à l'équilibre des ressources et des charges de l'Etat  \n###### Article 39  \nPour l'année budgétaire 2024, les ressources affectées au budget général, aux services de l'Etat gérés de manière autonome et aux comptes spéciaux du Trésor, telles qu'elles sont évaluées dans le tableau «A» annexé à la présente loi de finances, ainsi que les plafonds de charges et l'équilibre général qui en résulte sont fixés aux montants suivants (en dirhams):  \nRECETTES ORDINAIRES DU BUDGET GENERAL (1) :  \n- Recettes fiscales :  \n- Impôts directs et taxes assimilées ….......……….  \n- Impôts indirects……………….....………………  \n- Droits de douane………………………...……….  \n- Droits d'enregistrement et de timbre……..……..  \n- Recettes non fiscales :  \n- Produits des cessions de participations de l'Etat..  \n- Produits de monopoles, d'exploitations et des participations financières de l'Etat………………..  \n- Revenus du domaine de l'Etat………….....…….  \n- Recettes diverses………………………………….  \n311.324.574.000  \n280.395.681.000  \n117.075.918.000  \n128.312.541.000  \n15.512.062.000  \n19.495.160.000  \n30.928.893.000  \n5.000.000.000  \n19.480.000.000  \n354.500.000  \n4.594.393.000  \n- Dons et legs………………………………………  \n1.500.000.000  \n| DEPENSES ORDINAIRESDUBUDGET GENERAL (2) :                                                                                                                                | 317.656.111.000   |\n|--------------------------------------------------------------------------------------------------------------------------------------------------------------------------|-------------------|\n| - Dépenses de fonctionnement :                                                                                                                                           | 279.426.731.000   |\n| - Dépenses de Personnel…….......…….....………..                                                                                                                             | 161.623.345.000   |\n| - Dépenses de Matériel et Dépenses Diverses....…                                                                                                                         | 71.158.286.000    |\n| - Charges Communes…….....................…………                                                                                                                            | 34.820.000.000    |\n| - Dépenses relatives aux remboursements, dégrèvements et restitutions, fiscaux……......…….                                                                                | 9.625.100.000     |\n| - Dépenses Imprévues et Dotations Provisionnelles ...                                                                                                                    | 2.200.000.000     |\n| - Dépenses en intérêts et commissions se rapportant à la dette publique…...............................................                                                  | 38.229.380.000    |"", ""|            |           |                     | TOTAL DES RECETTES DIRECTION DU TRESOR ET DES FINANCES EXTERIEURES DIRECTION DES ENTREPRISES PUBLIQUES ET DE LA PRIVATISATION | 128 092 323 000                            |\n|            |           | 10                  | Produits des monopoles, parts de bénéfices et contributions des établissements publics                                        |                                            |\n|            |           | 11                  | Produits à provenir de l'Agence Nationale de la Conservation Foncière, du Cadastre et de la Cartographie (ANCFCC)             | 4 000 000 000                              |\n|            |           | 12                  | Produits à provenir de l'Agence Nationale de Réglementation des Télécommunications (ANRT)                                     | 100 000 000                                |\n|            |           | 13                  | Produits à provenir de l'Office National des Aéroports (ONDA)                                                                 | 120 000 000                                |\n|            |           | 14                  | Produits à provenir de l'Agence Nationale des Ports (ANP)                                                                     | 60 000 000                                 |\n|            |           | 15                  | Produits à provenir de l'Autorité Marocaine du Marché des Capitaux (AMMC)                                                     | 14 000 000                                 |\n|            |           | 16                  | Produits à provenir de l'Office Marocain de la Propriété Industrielle et Commerciale (OMPIC)                                  | 14 000 000                                 |\n|            |           | 17                  | Produits à provenir de l'Etablissement Autonome de Contrôle et de Coordination des Exportations (EACCE)                       | 15 000 000                                 |\n|            |           | 18                  | Produits à provenir de l'Office National des Hydrocarbures et des Mines (ONHYM)                                               | Mémoire                                    |\n|            |           | 19                  | Produits à provenir de l'Office National Interprofessionnel des Céréales et Légumineuses (ONICL)                              | 40 000 000                                 |\n|            |           | 20                  | Produits des monopoles, parts de bénéfices et contributions d'autres établissements publics                                   |                                            |\n|            |           | 21                  | Produits à provenir de la Centrale d'achat et de développement de la région minière de tafilalet et de Figuig (CADETAF)       | 2 000 000                                  |"", ""|                  |           | 30                  | Reversements de fonds sur les dépenses budgétaires                                                                               | 180 000 000                                |\n|                  |           | 40                  | Fonds de concours                                                                                                                |                                            |\n|                  |           | 41                  | Fonds de concours (coopération internationale)                                                                                   | Mémoire                                    |  \n| Chapitre   | Service   | Nature de Recette   | DESIGNATION DES RECETTES                                                                   | Evaluations pour l'année budgétaire 2024   |\n|------------|-----------|---------------------|--------------------------------------------------------------------------------------------|--------------------------------------------|\n|            |           | 42                  | Fonds de concours à rattacher à divers services                                            | Mémoire                                    |\n|            |           | 50                  | Produits des legs et donations attribués à l'Etat et à diverses administrations publiques  | Mémoire                                    |\n|            |           | 60                  | Recettes exceptionnelles d'ordre                                                           | Mémoire                                    |\n|            |           | 70                  | Report des crédits disponibles au budget de l'année précédente                             | Mémoire                                    |\n|            |           | 80                  | Recettes diverses en atténuation de dépenses                                               | 31 681 000                                 |\n|            |           | 90                  | Recettes diverses                                                                          |                                            |\n|            |           | 91                  | Recettes au titre des versements à partir des comptes d'affectation spéciale               | Mémoire                                    |\n|            |           | 92                  | Recettes au titre des versements à partir des services de l'Etat gérés de manière autonome | Mémoire                                    |\n|            |           | 93                  | Autres recettes                                                                            | 71 014 000                                 |\n|            |           |                     | TOTAL DES RECETTES ADMINISTRATION GENERALE                                                 | 1 235 000 000                              |"", ""|            |           |                  17 | Intérêts sur prêts et avances                                                                                                         | 2 323 000                                  |\n|            |           |                  18 | Intérêts sur les opérations de gestion de la Trésorerie Publique                                                                      | 100 000 000                                |\n|            |           |                  20 | Recettes d'emprunt                                                                                                                    |                                            |\n|            |           |                  21 | Emprunts intérieurs à moyen et long termes                                                                                            | 53 410 000 000                             |\n|            |           |                  22 | Contre-valeur des emprunts extérieurs                                                                                                 | 70 000 000 000                             |\n|            |           |                  23 | Produit des bons d'équipement sur réserve d'investissement                                                                            | Mémoire                                    |\n|            |           |                  24 | Recettes provenant de l'emprunt obligatoire                                                                                           | Mémoire                                    |\n|            |           |                  30 | Dons et legs                                                                                                                          |                                            |\n|            |           |                  31 | Dons                                                                                                                                  | 1 500 000 000                              |\n|            |           |                  32 | Prélévement sur le fonds de contre-valeur des biens fournis par les gouvernements des pays amis et des organismes internationaux      | Mémoire                                    |\n|            |           |                  40 | Recettes en atténuation des dépenses de la dette amortissable et de la dette flottante                                                | 1 000 000 000                              |\n|            |           |                  50 | Commissions sur prêts rétrocédés                                                                                                      | Mémoire                                    |\n|            |           |                  60 | Commission de garantie sur emprunts intérieurs et extérieurs                                                                          | Mémoire                                    |"", ""|            |           | 60                  | Majorations sur les obligations cautionnées et intérêts de retard                                                                                     | 18 400 000                                 |\n|            |           | 70                  | Produits des services rendus au titre de l'utilisation par les usagers des systèmes informatiques de l'Administration des Douanes et Impôts indirects | 122 100 000                                |\n|            |           | 80                  | Redevance gazoduc                                                                                                                                     | Mémoire                                    |\n|            |           | 90                  | Recettes diverses                                                                                                                                     | 122 416 000                                |\n|            |           |                     | TOTAL DES RECETTES ADMINISTRATION DES DOUANES ET IMPOTS INDIRECTS                                                                                     | 105 621 470 000                            |\n|            |           |                     | DIRECTION GENERALE DES IMPOTS                                                                                                                         |                                            |\n|            |           | 10                  | Impôts directs                                                                                                                                        |                                            |\n|            |           | 11                  | Impôt sur les sociétés                                                                                                                                | 61 067 656 000                             |\n|            |           | 12                  | Impôt sur le revenu                                                                                                                                   | 52 881 550 000                             |\n|            |           | 20                  | Taxes assimilées                                                                                                                                      |                                            |\n|            |           | 21                  | Taxe de licence sur les débits de boissons                                                                                                            | 62 342 000                                 |\n|            |           | 22                  | Taxe professionnelle                                                                                                                                  | 88 779 000                                 |"", ""|            |           | 42                  | Fonds de concours à rattacher à divers services                                            | Mémoire                                    |\n|            |           | 50                  | Produits des legs et donations attribués à l'Etat et à diverses administrations publiques  | Mémoire                                    |\n|            |           | 60                  | Recettes exceptionnelles d'ordre                                                           | Mémoire                                    |\n|            |           | 70                  | Report des crédits disponibles au budget de l'année précédente                             | Mémoire                                    |\n|            |           | 80                  | Recettes diverses en atténuation de dépenses                                               | 5 000 000                                  |\n|            |           | 90                  | Recettes diverses                                                                          |                                            |\n|            |           | 91                  | Recettes au titre des versements à partir des comptes d'affectation spéciale               | Mémoire                                    |\n|            |           | 92                  | Recettes au titre des versements à partir des services de l'Etat gérés de manière autonome | Mémoire                                    |\n|            |           | 93                  | Autres recettes                                                                            | 70 000 000                                 |\n|            |           |                     | TOTAL DES RECETTES ADMINISTRATION GENERALE                                                 | 555 400 000                                |\n|            |           |                     | TOTAL DU CHAPITRE ADMINISTRATIONS DIVERSES                                                 | 555 400 000                                |\n|            |           |                     | TOTAL GENERAL DU BUDGET GENERAL                                                            | 423 760 808 000                            |"", ""#### EVALUATION GLOBALE DES RECETTES DU BUDGET GENERAL, DES SERVICES DE L'ETAT GERES DE MANIERE AUTONOME ET DES COMPTES SPECIAUX DU TRESOR POUR L'ANNEE BUDGETAIRE 2024"", ""###### Article 40  \nPour l'année budgétaire 2023, les ressources affectées au budget général, aux services de l'Etat gérés de manière autonome et aux comptes spéciaux du Trésor, telles qu'elles sont évaluées dans le tableau «A» annexé à la présente loi de  \nfinances, ainsi que les plafonds de charges et l'équilibre général qui en résulte sont fixés aux montants suivants (en dirhams):  \n| RECETTESORDINAIRESDUBUDGETGENERAL(1):                                                                                                                                              | 294.719.508.000   |\n|------------------------------------------------------------------------------------------------------------------------------------------------------------------------------------|-------------------|\n| - Recettes fiscales :                                                                                                                                                              | 264.899.244.000   |\n| - Impôts directs et taxes assimilées………………….                                                                                                                                       | 113.295.829.000   |\n| - Impôtsindirects……………………………………                                                                                                                                                    | 120.620.920.000   |\n| - Droitsdedouane…………………………………….                                                                                                                                                    | 14.849.849.000    |\n| - Droits d'enregistrement et de timbre……………….                                                                                                                                      | 16.132.646.000    |\n| Recettes non fiscales :                                                                                                                                                            | 29.820.264.000    |\n| - Produits des cessions de participations de l'Etat…..                                                                                                                             | 5.000.000.000     |\n| - Produits de monopoles, d'exploitations et des participations financières de l'Etat…………………..                                                                                      | 19.463.940.000    |\n| - Revenus du domaine de l'Etat……………………….                                                                                                                                           | 354.500.000       |\n| - Recettesdiverses…………………………………….                                                                                                                                                  | 3.501.824.000     |""]"," Les différentes sources de revenus pour l'administration générale mentionnées dans le budget pour l'année 2024 sont :

1. Recettes fiscales :
   - Impôts directs et taxes assimilées (Impôt sur les sociétés, Impôt sur le revenu)
   - Droits de douane
   - Droits d'enregistrement et de timbre

2. Recettes non fiscales :
   - Produits des cessions de participations de l'Etat
   - Produits de monopoles, d'exploitations et des participations financières de l'Etat
   - Revenus du domaine de l'Etat
   - Recettes diverses

3. Autres recettes (pas spécifiées dans le budget de 2024) :
   - Fonds de concours à rattacher à divers services
   - Produits des legs et donations attribués à l'Etat et à diverses administrations publiques
   - Recettes exceptionnelles d'ordre
   - Recettes au titre des versements à partir des comptes d'affectation spéciale
   - Autres recettes (non spécifiées)","Les différentes sources de revenus pour l'administration générale mentionnées dans le budget pour l'année 2024 incluent les droits de chancellerie sur les armoiries et les blasons, des recettes au titre des ordres du Royaume, et des recettes diverses. Pour les juridictions financières, les revenus proviennent des débets juridictionnels, des condamnations au remboursement, des amendes, des astreintes, et des intérêts de retard. Les recettes totales pour l'administration générale s'élèvent à 50 000 dirhams, tandis que celles des juridictions financières comprennent 1 054 000 dirhams en amendes et sanctions.",0.59999999998,1.0,0.6153846153846154,0.9990739686869005,gpt-4o-mini,bge-m3,mistral:7b,True,False,False,0.5
Quelles sont les règles pour gérer les déchets dans une ferme aquacole et qui doit s'occuper de la surveillance environnementale ?,"['| Gestion des déchets :                                                                                                                                                                                                                                                                                                                                                                     | Enfouissement et stockage dans des lieux autorisés à cet effet, conformément à la loi n°28-00 relative à la gestion des déchets et à leur élimination.                                                                                                                                                                                                                                    | Enfouissement et stockage dans des lieux autorisés à cet effet, conformément à la loi n°28-00 relative à la gestion des déchets et à leur élimination.                                                                                                                                                                                                                                    | Enfouissement et stockage dans des lieux autorisés à cet effet, conformément à la loi n°28-00 relative à la gestion des déchets et à leur élimination.                                                                                                                                                                                                                                    |', ""| Activité de la ferme aquacole Technique utilisée : Moyens d'exploitation :                                                                                                                                                                                                                                                                                                  | Élevage de la moule des espèces « Mytilus galloprovincialis » et « Perna perna ». Filière sub-surface Navires de servitude                                                                                                                                                                                                                                                  | Élevage de la moule des espèces « Mytilus galloprovincialis » et « Perna perna ». Filière sub-surface Navires de servitude                                                                                                                                                                                                                                                  | Élevage de la moule des espèces « Mytilus galloprovincialis » et « Perna perna ». Filière sub-surface Navires de servitude                                                                                                                                                                                                                                                  |\n| Contrôle et suivi technique et scientifique Surveillance environnementale : Gestion des déchets :                                                                                                                                                                                                                                                                           | L'Administration de la pêche maritime et l'Institut national de recherche halieutique (INRH) Selon le programme prévu dans l'étude d'impact sur l'environnement ; Enfouissement et stockage dans des lieux autorisés à cet effet, conformément à la loi n°28-00 relative à la gestion des déchets et à leur élimination.                                                    | L'Administration de la pêche maritime et l'Institut national de recherche halieutique (INRH) Selon le programme prévu dans l'étude d'impact sur l'environnement ; Enfouissement et stockage dans des lieux autorisés à cet effet, conformément à la loi n°28-00 relative à la gestion des déchets et à leur élimination.                                                    | L'Administration de la pêche maritime et l'Institut national de recherche halieutique (INRH) Selon le programme prévu dans l'étude d'impact sur l'environnement ; Enfouissement et stockage dans des lieux autorisés à cet effet, conformément à la loi n°28-00 relative à la gestion des déchets et à leur élimination.                                                    |"", ""| Contrôle et suivi technique et scientifique Surveillance environnementale : Gestion des déchets :                                                                                                                                                                                                                                                                             | L'Administration de la pêche maritime et l'Institut national de recherche halieutique (INRH)                                                                                                                                                                                                                                                                                  | L'Administration de la pêche maritime et l'Institut national de recherche halieutique (INRH)                                                                                                                                                                                                                                                                                  | L'Administration de la pêche maritime et l'Institut national de recherche halieutique (INRH)                                                                                                                                                                                                                                                                                  | L'Administration de la pêche maritime et l'Institut national de recherche halieutique (INRH)                                                                                                                                                                                                                                                                                  |"", ""| Contrôle et suivi technique et scientifique : Surveillance environnementale : Gestion des déchets :                                                                                                                                                                                                                                                                                      | L'Administration de la pêche maritime et l'Institut national de recherche halieutique (INRH). Enfouissement                                                                                                                                                                                                                                                                              | stockage dans des lieux                                                                                                                                                                                                                                                                                                                                                                  | cet effet, conformément                                                                                                                                                                                                                                                                                                                                                                  |"", '| Gestion des déchets :                                                                                                                                                                                                                                                                                                                                                                        | Enfouissement et stockage dans des lieux autorisés à cet effet, conformément à la loi n° 28-00 relative à la gestion des déchets et à leur élimination.y                                                                                                                                                                                                                                     | Enfouissement et stockage dans des lieux autorisés à cet effet, conformément à la loi n° 28-00 relative à la gestion des déchets et à leur élimination.y                                                                                                                                                                                                                                     | Enfouissement et stockage dans des lieux autorisés à cet effet, conformément à la loi n° 28-00 relative à la gestion des déchets et à leur élimination.y                                                                                                                                                                                                                                     |', '| Surveillance environnementale : Gestion des déchets :                                                          | loi n°28-00 relative à la gestion des déchets et à leur élimination. droit fixe :                                                                                                                                                                                                                                                                                                                                                                                                                                                                                                                                                                                                 | loi n°28-00 relative à la gestion des déchets et à leur élimination. droit fixe :                                                                                                                                                                   | loi n°28-00 relative à la gestion des déchets et à leur élimination. droit fixe :                                                                                                                                                                   | loi n°28-00 relative à la gestion des déchets et à leur élimination. droit fixe :                                                                                                                                                                   |', '| Surveillance environnementale : Gestion des déchets :                                                          | loi n°28-00 relative à la gestion des déchets et à leur élimination. droit fixe :                                                                                                                                                                                                                                                                                                                                                                                                                                                                                                                                                                                                 | loi n°28-00 relative à la gestion des déchets et à leur élimination. droit fixe :                                                                                                                                                                   | loi n°28-00 relative à la gestion des déchets et à leur élimination. droit fixe :                                                                                                                                                                   | loi n°28-00 relative à la gestion des déchets et à leur élimination. droit fixe :                                                                                                                                                                   |', ""| Contrôle et suivi technique et scientifique : Surveillance environnementale : Gestion des déchets :                                                                                                                                                                                                                                                                                      | L'Administration de la pêche maritime et l'Institut national de recherche halieutique (INRH). Enfouissement                                                                                                                                                                                                                                                                              | stockage dans des lieux                                                                                                                                                                                                                                                                                                                                                                  | cet effet, conformément                                                                                                                                                                                                                                                                                                                                                                  |"", '| Gestion des déchets :                                                                                                                                                                                                                                                                                                                                                                                                                                                 | Enfouissement et stockage dans des lieux autorisés à cet effet, conformément à la loi n°28-00 relative à la gestion des déchets et à leur élimination.                                                                                                                                                                                                                                                                                                                | Enfouissement et stockage dans des lieux autorisés à cet effet, conformément à la loi n°28-00 relative à la gestion des déchets et à leur élimination.                                                                                                                                                                                                                                                                                                                | Enfouissement et stockage dans des lieux autorisés à cet effet, conformément à la loi n°28-00 relative à la gestion des déchets et à leur élimination.                                                                                                                                                                                                                                                                                                                |', ""| Contrôle et suivi technique et scientifique Surveillance environnementale : Gestion des déchets :                                                                                                                                                                                                                                                                             | L'Administration de la pêche maritime et l'Institut national de recherche halieutique (INRH)                                                                                                                                                                                                                                                                                  | L'Administration de la pêche maritime et l'Institut national de recherche halieutique (INRH)                                                                                                                                                                                                                                                                                  | L'Administration de la pêche maritime et l'Institut national de recherche halieutique (INRH)                                                                                                                                                                                                                                                                                  | L'Administration de la pêche maritime et l'Institut national de recherche halieutique (INRH)                                                                                                                                                                                                                                                                                  |"", ""| Surveillance environnementale : Gestion des déchets :                                                                                                                                                                                                                                                                                                                                                                                                            | Selon le programme prévu dans l'étude d'impact sur l'environnement. Enfouissement et stockage dans des lieux autorisés à cet effet, conformément à la loi n°28-00 relative à la gestion des déchets et à leur élimination.                                                                                                                                                                                                                                       | Selon le programme prévu dans l'étude d'impact sur l'environnement. Enfouissement et stockage dans des lieux autorisés à cet effet, conformément à la loi n°28-00 relative à la gestion des déchets et à leur élimination.                                                                                                                                                                                                                                       | Selon le programme prévu dans l'étude d'impact sur l'environnement. Enfouissement et stockage dans des lieux autorisés à cet effet, conformément à la loi n°28-00 relative à la gestion des déchets et à leur élimination.                                                                                                                                                                                                                                       | Selon le programme prévu dans l'étude d'impact sur l'environnement. Enfouissement et stockage dans des lieux autorisés à cet effet, conformément à la loi n°28-00 relative à la gestion des déchets et à leur élimination.                                                                                                                                                                                                                                       | Selon le programme prévu dans l'étude d'impact sur l'environnement. Enfouissement et stockage dans des lieux autorisés à cet effet, conformément à la loi n°28-00 relative à la gestion des déchets et à leur élimination.                                                                                                                                                                                                                                       |"", '| Gestion des déchets :                                                                                                                                                                                                                                                                                                                                                                     | Enfouissement et stockage dans des lieux autorisés à cet effet, conformément à la loi n°28-00 relative à la gestion des déchets et à leur élimination.                                                                                                                                                                                                                                    | Enfouissement et stockage dans des lieux autorisés à cet effet, conformément à la loi n°28-00 relative à la gestion des déchets et à leur élimination.                                                                                                                                                                                                                                    | Enfouissement et stockage dans des lieux autorisés à cet effet, conformément à la loi n°28-00 relative à la gestion des déchets et à leur élimination.                                                                                                                                                                                                                                    |']"," 1. Les règles pour gérer les déchets dans une ferme aquacole comprennent l'enfouissement et le stockage dans des lieux autorisés conformément à la loi n°28-00 relative à la gestion des déchets et à leur élimination.
2. La surveillance environnementale est assurée par l'Administration de la pêche maritime et l'Institut national de recherche halieutique (INRH).

Sources : Les extraits fournis.","La gestion des déchets dans une ferme aquacole doit se faire par enfouissement et stockage dans des lieux autorisés, conformément à la loi. La surveillance environnementale est assurée par l'Administration de la pêche maritime et l'Institut national de recherche halieutique (INRH), selon le programme établi dans l'étude d'impact sur l'environnement.",0.9999999999916667,1.0,1.0,0.9654783298268464,gpt-4o-mini,bge-m3,mistral:7b,True,False,False,0.5
Quelles sont les règles à suivre pour exploiter des services de télécommunications ?,"[""###### Article 10 : Conditions d'exploitation des services de télécommunications  \nLes services de tél écommunications sont exploités conformément aux dispositions de la loi n°2496 précitée et de la réglementation en vigueur à compter de l'ouverture commerciale du service qui doit intervenir dans le délai indiqué  à l'article 5.1 ci-dessus."", ""###### Article 10 Conditions d'exploitation des services de télécommunications  \nLes services de télécommunications sont exploités conformément aux dispositions de la loi  n°24-96  précitée  et  de  la  réglementation  en  vigueur  à  compter  de  l'ouverture commerciale du service qui doit intervenir dans le délai indiqué à l'article 5.1 ci-dessus."", ""###### Article 10 : Conditions d'exploitation des services de télécommunications  \nLes services de tél écommunications sont exploités conformément aux dispositions de la loi n°2496 précitée et de la réglementation en vigueur à compter de l'ouverture commerciale du service qui doit intervenir dans le délai indiqué  à l'article 5.1 ci-dessus."", ""##### CHAPITRE II - CONDITIONS GENERALES D'ETABLISSEMENT ET D'EXPLOITATION DU RESEAU DE TELECOMMUNICATIONS  \n###### Article 9 : Conditions d'établissement des réseaux"", ""###### Article 11 : Conditions d'exploitation commerciale"", ""###### 9.6.1 Installation des équipements  \nMédi Telecom a le droit de réaliser les travaux nécessaires à l'exploitation et à l'extension de  son  réseau.  Il  s'engage  à  respecter  l'ensemble  des  dispositions  législatives  et réglementaires en vigueur, notamment  en  matière  d'aménagement  du  territoire, d'urbanisme, d'occupation temporaire du domaine public et de protection de l'environnement à l'occasion de la réalisation d'équipements ou d'ouvrages particuliers."", ""###### Article 10 : Conditions d'exploitation des services de télécommunications  \nLes services de tél écommunications sont exploités conformément aux dispositions de la loi n°2496 précitée et de la réglementation en vigueur à compter de l'ouverture commerciale du service qui doit intervenir dans le délai indiqué  à l'article 5.1 ci-dessus."", ""###### Article 10 : Conditions d'exploitation des services de télécommunications  \nLes services de tél écommunications sont exploités conformément aux dispositions de la loi n°2496 précitée et de la réglementation en vigueur à compter de l'ouverture commerciale du service qui doit intervenir dans le délai indiqué  à l'article 5.1 ci-dessus."", ""###### Article 10 Conditions d'exploitation des services de télécommunications  \nLes services de télécommunications sont exploités conformément aux dispositions de la loi  n°24-96  précitée  et  de  la  réglementation  en  vigueur  à  compter  de  l'ouverture commerciale du service qui doit intervenir dans le délai indiqué à l'article 5.1 ci-dessus."", ""###### 2.1 Exploitant marocain concurrent  \nUn exploitant de réseau public de tél écommunications titulaire au Maroc d'une licence pour l' établissement et l'exploitation d'un réseau mobile de tél écommunications."", ""##### CHAPITRE II - CONDITIONS GENERALES D'ETABLISSEMENT ET D'EXPLOITATION DU RESEAU DE TELECOMMUNICATIONS  \n###### Article 9 : Conditions d'établissement des réseaux"", ""###### 11.9 Annuaire général des abonnés  \nConformément à l'article 25 de la loi n°24 -96 précitée et l'article 11 du décret n°2-97-1026 précité, Médi Telecom communique gratuitement à l'exploitant chargé de la réalisation de l'annuaire général la liste de ses abonnés, leurs adresses, numéros  d'appel et éventuellement  leurs  fonctions,  pour  permettre  la  constitution  d'un  annuaire  et  d'un service de renseignements mis à la disposition du public.""]"," 1. Réponse directe à la question : Les services de télécommunications doivent être exploités conformément aux dispositions de la loi n°2496 précitée et de la réglementation en vigueur à compter de l'ouverture commerciale du service, indiqué dans le délai mentionné à l'article 5.1 ci-dessus (Article 10 des différents décrets).
2. Sources citées : [Décret n°2-25-877](https://legisprudence.justice.gov.ma/lodel/pdf/A240336.pdf), [Décret n°2-25-876](https://legisprudence.justice.gov.ma/lodel/pdf/A240197.pdf), [Décret n°2-25-877](https://legisprudence.justice.gov.ma/lodel/pdf/A240336.pdf)

Information non disponible : Les décrets ne fournissent pas de règles spécifiques sur l'exploitation des services de télécommunications en dehors des dispositions mentionnées ci-dessus.","Les services de télécommunications doivent être exploités conformément aux dispositions de la loi n°24-96 et à la réglementation en vigueur, à compter de l'ouverture commerciale du service, selon l'article 10.",0.8693578643491707,1.0,0.6666666666666666,0.0,gpt-4o-mini,bge-m3,mistral:7b,True,False,False,0.5
"Quel est le taux de l'impôt pour les revenus liés aux actions et parts sociales selon la réglementation, et quelles sont les conditions spécifiques qui s'y appliquent ?","[""- «IV. - les intérêts ...............................................................  \n(la suite sans modification.)  \n- « Article 73 . - Taux de l'impôt  \n«I. - ..........................................................................................  \n- «II. - Taux spécifiques  \n- «Le taux de l'impôt .................................................................  \n- «B.- 10 % :  \n«1° -.......................................................................................  \n«............................................................................................  \n«6°- .......................................................................................  \n- «7°- pour le montant des produits des actions, parts «sociales et revenus assimilés, énumérés à l'article 13 ci-dessus, «sous réserve des dispositions du paragraphe XXXVII-C de  \n- «l'article 247 ci-dessous ;  \n«8°- pour les rémunérations visées à l'article 15 bis «ci-dessus, hors taxe sur la valeur ajoutée, allouées à des «personnes soumises à l'impôt sur le revenu selon le régime «du résultat net réel ou celui du résultat net simplifié.  \n- «C. - 15% :  \n«1° -.......................................................................................  \n- «2° - pour les revenus ....................de source étrangère ;  \n- «3°- (abrogé)  \n- «4°- pour le montant ..........................................................  \n- «........................................................... (120 000) dirhams.  \n- «5°- pour le montant brut des rachats des cotisations et «primes avant la durée de huit (8) ans ou avant l'âge de «quarante cinq ans, prévu à l'article 28-III-A ci-dessus.  \n- «D. - (abrogé)  \n- «F. - 20% :  \n«1° - ........................................................................................  \n«............................................................................................  \n«............................................................................................  \n«5°-...................................................... source étrangère ;  \n- «6°- pour les profits nets fonciers réalisés ou constatés «prévus à l'article 61-II ci-dessus, sous réserve des dispositions «prévues à l'article 144-II-1° ci-dessous ;  \n«7° - (abrogé)  \n«9° - pour les traitements, émoluments et salaires bruts «versés aux salariés qui travaillent pour le compte des sociétés «ayant le statut « Casablanca Finance City », conformément «à la législation et la réglementation en vigueur, à l'exclusion «des établissements de crédit et des entreprises d'assurances «et de réassurance visés aux paragraphes 1 et 2 de l'article 4 «du décret-loi n° 2-20-665 précité, pour une période maximale «de dix (10) ans, à compter de la date de prise de leurs fonctions.  \n- «Toutefois, les salariés .....................................................  \n- «.......................................................... prévu au I ci-dessus ;"", ""###### «I. - Taux normal de l'impôt  \n- « Sous  réserve  des  dispositions  du  paragraphe «XXXVII-A de l'article 247 ci-dessous, le taux de l'impôt «sur les sociétés est fixé à :  \n- «A.- 20% ;  \n- « B.-  35%,  en  ce  qui  concerne  les  sociétés  dont  le «montant du bénéfice net est égal ou supérieur à cent millions «(100000000) dirhams, à l'exclusion :  \n- «1) des sociétés de services ayant le statut « Casablanca «Finance City » bénéficiant du régime fiscal prévu à l'article6 «ci-dessus ;  \n- «2) des sociétés qui exercent leurs activités dans les « zones  d'accélération  industrielle  prévues  à  l'article  6 «(II-B-8°) ci-dessus ;  \n- «3) des sociétés constituées à compter du 1 er  janvier «2023 qui s'engagent dans le cadre d'une convention signée «avec l'Etat à investir un montant d'au moins un milliard et «cinq cent millions (1 500 000 000) dirhams durant une période «de cinq (5) ans à compter de la date de signature de ladite «convention, à l'exception des établissements et entreprises «publics et leurs filiales conformément aux textes législatifs «et réglementaires en vigueur.  \n- «L'exclusion précitée des sociétés concernées s'applique «à condition :  \n- «-d'investir le montant précité dans des immobilisations «corporelles ;  \n- « - de  conserver  lesdites  immobilisations  pendant «au moins dix (10) ans, à compter de la date de leur «acquisition.  \n- « Les  sociétés  concernées  doivent  souscrire  à «l'administration fiscale un état comprenant, notamment, «le montant global investi au titre de chaque exercice et la «nature des immobilisations concernant l'activité objet de «l'investissement ainsi que la date et le prix de leur acquisition, «selon un modèle établi par l'administration à joindre à la «déclaration du résultat fiscal prévue à l'article 20-I ci-dessous.  \n- «Elles doivent également joindre une copie de ladite «convention à la déclaration du résultat fiscal au titre du «premier exercice au cours duquel elle a été signée.  \n- «Toutefois, lorsque le bénéfice net réalisé est inférieur « à  cent  millions  (100  000  000)  dirhams,  le  taux  de  20% «ne s'applique que lorsque ledit bénéfice demeure inférieur à «ce montant pendant trois (3) exercices consécutifs ;  \n- «C. - 40%, en ce qui concerne les établissements de «crédit et organismes assimilés, Bank Al-Maghrib, la Caisse «de dépôt et de gestion et les entreprises d'assurances et de «réassurance.  \n- «Les entreprises d'assurances .........................................  \n«.............................................................................. Takaful.  \n- «II. - (abrogé)  \n«III. -  ……………………………………………………  \n- «IV. - Taux de l'impôt retenu à la source  \n- «Les taux de l'impôt sur les sociétés retenu à la source «sont fixés à:"", ""- «-12,50% au titre de l'exercice ouvert à compter du «1 er janvier 2024;\n- «-11,25% au titre de l'exercice ouvert à compter du «1 er janvier 2025;\n- « - 10%  au  titre  de  l'exercice  ouvert  à  compter  du «1 er  janvier 2026.  \n- « Toutefois, les produits des actions, parts sociales «et revenus assimilés distribués et provenant des bénéfices «réalisés au titre des exercices ouverts avant le 1 er janvier 2023, «demeurent soumis au taux de 15%.\n- «Les produits des actions, parts sociales et revenus «assimilés distribués sont considérés avoir été prélevés sur «les exercices les plus anciens.\n- «D-Les dispositions des articles 6 (I-B et D et II-B «et C ), 7 (II, IV, VI et X), 19 (I, II, IV-D), 165-I, 170 (III «et VIII) et 191-II du code général des impôts applicables au «31 décembre 2022, demeurent en vigueur pour l'application «progressive des dispositions prévues aux A, B et C du présent «paragraphe.\n- «F-A titre transitoire, les limites des taux admis pour «la constitution  des provisions pour investissement par les «sociétés ayant le statut « Casablanca Finance City » prévues «à l'article 10 (III-C-2°) ci-dessus, sont fixées progressivement «au titre de chaque exercice ouvert durant la période allant du «1 er  janvier 2023 au 31 décembre 2026, comme suit :\n- «-7,70% au titre de l'exercice ouvert  à compter du «1 er janvier 2023 ;\n- «-14,30% au titre de l'exercice ouvert  à compter du «1 er janvier 2024 ;\n- « - 20%  au  titre  de  l'exercice  ouvert    à  compter  du «1 er janvier 2025 ;\n- « - 25%  au  titre  de  l'exercice  ouvert    à  compter  du «1 er  janvier 2026.\n- «XXXVIII.-A titre transitoire et nonobstant toute « disposition  contraire,  les  contribuables  n'ayant  réalisé «aucun chiffre d'affaires ou ayant versé le minimum de la «cotisation minimale visé à l'article 144-I-D (2 ème  alinéa) «ci-dessus, au titre des quatre (4) derniers exercices, peuvent «bénéficier de la dispense du contrôle fiscal ainsi que de «l'annulation d'office des majorations, amendes et pénalités «pour défaut de dépôt des déclarations et de versement des «impôts prévus par le présent code au titre des années non «prescrites, dans les conditions suivantes :\n- «-la souscription de la déclaration de cessation totale «d'activité prévue à l'article 150 ci-dessus au cours de «l'année 2023 ;\n- «-le versement spontané, dans le même délai de la « déclaration précitée, d'un montant forfaitaire de «l'impôt sur les sociétés ou de l'impôt sur le revenu «selon le cas, de cinq mille (5000) dirhams, au titre de «chaque exercice non prescrit.\n- «Toutefois, les plus-values de cession ou de retrait des «éléments corporels ou incorporels de l'actif immobilisé ainsi «que les indemnités perçues en contrepartie de la cessation «de l'exercice de l'activité ou du transfert de la clientèle, sont «imposables selon le cas, soit à l'impôt sur les sociétés ou à «l'impôt sur le revenu, dans les conditions de droit commun."", ""###### «B. - 10% du:  \n- «- montant des produits bruts, hors taxe sur la valeur «ajoutée, perçus par les personnes physiques ou morales «non résidentes, énumérés à l'article 15 ci-dessus ;  \n- «- montant des produits des actions, parts sociales et «revenus assimilés, énumérés à l'article 13 ci-dessus,  \n- « sous  réserve  des  dispositions  du  paragraphe  \n- «XXXVII-C de l'article 247 ci-dessous ;  \n- «C. - 20 % du montant, hors taxe sur la valeur ajoutée «des produits de placements ....................................... l'impôt «sur les sociétés.  \n- «D. - (abrogé)»  \n- «Article 28 . -  Déductions sur le revenu global imposable  \n- «Sont déductibles du revenu ........ l'article 25 ci-dessus:  \n«I. - .......................................................................................  \n- «II. - .......................................................................................  \n«III.- A. - dans la limite de 10% du  .................................  \n- «................................................................ aux bénéficiaires «à partir de l'âge de quarante cinq ans révolus.  \n- «Lorsqu'un contribuable .................................................. «.......................................... desdites cotisations ou primes.  \n- «Lorsqu'au terme du contrat ……….......…………….  \n- «..................................... l'article 73-I ci-dessous, après «un abattement de 70% sur le montant qui ne dépasse pas «168 000 dirhams et 40% pour le surplus et avec étalement «sur une période maximum de quatre années.  \n- «Le débirentier qui n'effectue ............................................ «l'article 200 ci-dessous.  \n- «Lorsque l'assuré procède au rachat de ses cotisations «avant la durée de huit (8) ans ou avant l'âge de quarante «cinq ans, le montant total du rachat est ………..........………… «concerné au taux visé à l'article 73 (II-C-5°) ci-dessous sans «abattement, sans préjudice de l'application ...................... «l'article 200 ci-dessous.  \n- «Sont considérées comme un rachat, les avances dont «bénéficie l'assuré avant le terme du contrat ou avant l'âge de «quarante cinq ans et sont imposables comme prévu ci-dessus.  \n- «Pour régulariser sa situation ............................................ (la suite sans modification.)  \n- « Article 31 . - Exonérations et réduction d'impôt  \n- «I. - Exonérations  \n«A.- ……………………………........………………………  \n- «B. - Exonérations temporaires  \n«……………………………..…………………………….  \n- «2° - Les entreprises hôtelières et les établissements «d'animation touristique bénéficient de l'exonération totale «de l'impôt sur le revenu, pendant une période de cinq (5) ans, «dans les conditions prévues à l'article 6 (II-B-5°) ci-dessus.  \n- «3°- Les entreprises qui exercent leurs activités dans les «zones d'accélération industrielle bénéficient de l'exonération «totale durant les cinq (5) premiers exercices consécutifs à «compter de la date du début de leur exploitation."", '- «D.-Sous réserve des dispositions .................., destiné «par son propriétaire à son habitation principale depuis  \n«…………………..................................................................………..  \n(la suite sans modification.)  \n- « Article  64 .  -  Détermination  du  revenu  foncier «imposable  \n- «I. - ....................................................................................... « .........................................pour le compte des locataires.  \n- «II. - Le revenu net imposable des immeubles visés à « l\'article  61  (I-A-1°,  B,  C  et  D)  ci-dessus  est  obtenu  en «appliquant un abattement de 40% sur le montant du revenu «foncier brut tel qu\'il est défini au I ci-dessus.  \n- «III.- Le revenu brut imposable ......................................  \n(la suite sans modification.)  \n- « Article 65 .-II.-le prix d\'acquisition est augmenté ....... «................................................................................................... «....................................... par les ou l\'une des parties.  \n- «En cas de taxation d\'office, la base d\'imposition est «déterminée sur la base des informations et des données dont «dispose l\'administration. En l\'absence desdites informations «et données, la base d\'imposition est égale au prix de cession «diminué de 20%.»  \n- « Article 66 .-I.-Sont considérés comme des revenus «de capitaux mobiliers :  \n- «A.-les produits des actions, parts sociales et revenus «assimilés visés à l\'article 13 ci-dessus, à l\'exclusion des « produits  provenant  des  bénéfices  distribués  par  les «organismes de placement collectif immobilier (OPCI) aux «personnes soumises à l\'impôt sur le revenu.  \n- «B.-les revenus ................... opérations de pensions. »  \n- « Article 68 . - Exonérations  \n- «Sont exonérés de l\'impôt:  \n«I. - ..........................................................................................  \n«............................................................................................  \n«............................................................................................  \n- «III. - les dividendes et autres produits de participations «similaires de source étrangère versés, mis à la disposition ou «inscrits en compte des non-résidents par les sociétés installées «dans les zones d\'accélération industrielle et par celles ayant «le statut ""Casablanca Finance City"", visées à l\'article 6 «(I- C-1°) ci-dessus ;  \n- «IV. - les intérêts ...............................................................  \n(la suite sans modification.)  \n- « Article 73 . - Taux de l\'impôt  \n«I. - ..........................................................................................  \n- «II. - Taux spécifiques  \n- «Le taux de l\'impôt .................................................................  \n- «B.- 10 % :  \n«1° -.......................................................................................', ""«…………...................………....………....………....…………….  \n(la suite sans modification.)  \n- « Article 125 ter . - Récupération de la taxe sur la valeur «ajoutée non apparente  \n- «Par dérogation ………………………………… d'achat:  \n«a) …………………………………………………………......  \n- «b) du lait non ……………… à l'article 91 (I-A- 2° et 9°) «ci-dessus, vendus …………………………………………...  \n(la suite sans modification.)  \n- « Article 129. - III- Actes présentant un intérêt social :  \n«1° -    ……………………………………………………………  \n«……………………………………………………………………….  \n«……………………………………………………………………….  \n- «10° - les actes ………………………… et aux opérations:  \n- « -  de la Fondation Hassan II ………………………… « ………………………………………………………………….. «……………………………………………………………………..  \n- « -  de la Ligue …………………………….. l'enfance;  \n- « - de la Fondation Mohammed VI des sciences et de «la santé créée par la loi n° 23-23 précitée;  \n- «11° - les opérations des associations …………………… (la suite sans modification.)  \n- « Article 133. - Droits proportionnels  \n- «I. - Taux applicables  \n«A. - ………….........................................................................  \n«……………..............................................………….............…  \n«…………………...............................……………............……  \n- «F. - Sont soumis au taux de 4%:  \n- «1°- l'acquisition ….....…...............…… administratif «et l'acquisition desdits locaux…………………………….. ou ««Moucharaka Moutanakissa» ainsi que l'attribution des «locaux précités par les coopératives ou les associations au «profit de leurs membres.  \n- «Bénéficient également ………………………………………  \n- «G. - Sont soumis au taux de 5%:  \n- «1° - les actes …………………………… terrains;  \n- «2° - les actes………………………… Moutanakissa»;  \n- «3° - les actes et conventions portant attribution de «terrains nus par les coopératives ou les associations au profit «de leurs membres.  \n«H. - ……………......................................……………………  \n(la suite sans modification.)  \n- « Article 135. - II . - Sont enregistrés au droit fixe de deux «cent (200) dirhams :  \n«1° - ……….......................................…………………………  \n«…………...........................................…………………………  \n« …………...........................................…………………………  \n«8° - .................................................................de commerce;  \n- «9° - (Abrogé)  \n«10° - ……….....................................…………………………  \n(la suite sans modification.)  \n- « Article 139. - IV- En cas de mutation ou de cession «d'immeuble ou de fonds de commerce, il est fait obligation «aux adoul, notaires, avocats agréés près la cour de cassation «ou toute personne exerçant des fonctions notariales:  \n- «- de ne dresser aucun acte qu'après présentation d'une « attestation  des  services  de  recouvrement  justifiant  du « paiement  des  impôts  et  taxes  grevant  l'immeuble  se «rapportant à l'année de mutation ou de cession et aux années «antérieures et ce, à peine d'être tenus solidairement avec le «contribuable au paiement des impôts et taxes grevant ledit «immeuble;"", ""###### «I. - Taux normal de l'impôt  \n- « Sous  réserve  des  dispositions  du  paragraphe «XXXVII-A de l'article 247 ci-dessous, le taux de l'impôt «sur les sociétés est fixé à :  \n- «A.- 20% ;  \n- « B.-  35%,  en  ce  qui  concerne  les  sociétés  dont  le «montant du bénéfice net est égal ou supérieur à cent millions «(100000000) dirhams, à l'exclusion :  \n- «1) des sociétés de services ayant le statut « Casablanca «Finance City » bénéficiant du régime fiscal prévu à l'article6 «ci-dessus ;  \n- «2) des sociétés qui exercent leurs activités dans les « zones  d'accélération  industrielle  prévues  à  l'article  6 «(II-B-8°) ci-dessus ;  \n- «3) des sociétés constituées à compter du 1 er  janvier «2023 qui s'engagent dans le cadre d'une convention signée «avec l'Etat à investir un montant d'au moins un milliard et «cinq cent millions (1 500 000 000) dirhams durant une période «de cinq (5) ans à compter de la date de signature de ladite «convention, à l'exception des établissements et entreprises «publics et leurs filiales conformément aux textes législatifs «et réglementaires en vigueur.  \n- «L'exclusion précitée des sociétés concernées s'applique «à condition :  \n- «-d'investir le montant précité dans des immobilisations «corporelles ;  \n- « - de  conserver  lesdites  immobilisations  pendant «au moins dix (10) ans, à compter de la date de leur «acquisition.  \n- « Les  sociétés  concernées  doivent  souscrire  à «l'administration fiscale un état comprenant, notamment, «le montant global investi au titre de chaque exercice et la «nature des immobilisations concernant l'activité objet de «l'investissement ainsi que la date et le prix de leur acquisition, «selon un modèle établi par l'administration à joindre à la «déclaration du résultat fiscal prévue à l'article 20-I ci-dessous.  \n- «Elles doivent également joindre une copie de ladite «convention à la déclaration du résultat fiscal au titre du «premier exercice au cours duquel elle a été signée.  \n- «Toutefois, lorsque le bénéfice net réalisé est inférieur « à  cent  millions  (100  000  000)  dirhams,  le  taux  de  20% «ne s'applique que lorsque ledit bénéfice demeure inférieur à «ce montant pendant trois (3) exercices consécutifs ;  \n- «C. - 40%, en ce qui concerne les établissements de «crédit et organismes assimilés, Bank Al-Maghrib, la Caisse «de dépôt et de gestion et les entreprises d'assurances et de «réassurance.  \n- «Les entreprises d'assurances .........................................  \n«.............................................................................. Takaful.  \n- «II. - (abrogé)  \n«III. -  ……………………………………………………  \n- «IV. - Taux de l'impôt retenu à la source  \n- «Les taux de l'impôt sur les sociétés retenu à la source «sont fixés à:"", ""- «IV. - les intérêts ...............................................................  \n(la suite sans modification.)  \n- « Article 73 . - Taux de l'impôt  \n«I. - ..........................................................................................  \n- «II. - Taux spécifiques  \n- «Le taux de l'impôt .................................................................  \n- «B.- 10 % :  \n«1° -.......................................................................................  \n«............................................................................................  \n«6°- .......................................................................................  \n- «7°- pour le montant des produits des actions, parts «sociales et revenus assimilés, énumérés à l'article 13 ci-dessus, «sous réserve des dispositions du paragraphe XXXVII-C de  \n- «l'article 247 ci-dessous ;  \n«8°- pour les rémunérations visées à l'article 15 bis «ci-dessus, hors taxe sur la valeur ajoutée, allouées à des «personnes soumises à l'impôt sur le revenu selon le régime «du résultat net réel ou celui du résultat net simplifié.  \n- «C. - 15% :  \n«1° -.......................................................................................  \n- «2° - pour les revenus ....................de source étrangère ;  \n- «3°- (abrogé)  \n- «4°- pour le montant ..........................................................  \n- «........................................................... (120 000) dirhams.  \n- «5°- pour le montant brut des rachats des cotisations et «primes avant la durée de huit (8) ans ou avant l'âge de «quarante cinq ans, prévu à l'article 28-III-A ci-dessus.  \n- «D. - (abrogé)  \n- «F. - 20% :  \n«1° - ........................................................................................  \n«............................................................................................  \n«............................................................................................  \n«5°-...................................................... source étrangère ;  \n- «6°- pour les profits nets fonciers réalisés ou constatés «prévus à l'article 61-II ci-dessus, sous réserve des dispositions «prévues à l'article 144-II-1° ci-dessous ;  \n«7° - (abrogé)  \n«9° - pour les traitements, émoluments et salaires bruts «versés aux salariés qui travaillent pour le compte des sociétés «ayant le statut « Casablanca Finance City », conformément «à la législation et la réglementation en vigueur, à l'exclusion «des établissements de crédit et des entreprises d'assurances «et de réassurance visés aux paragraphes 1 et 2 de l'article 4 «du décret-loi n° 2-20-665 précité, pour une période maximale «de dix (10) ans, à compter de la date de prise de leurs fonctions.  \n- «Toutefois, les salariés .....................................................  \n- «.......................................................... prévu au I ci-dessus ;"", ""### III. - TAUX DE LA CONTRIBUTION  \nLe taux de la contribution est fixé à 5% du montant des avoirs liquides déposés dans des comptes bancaires ou détenus, en monnaie fiduciaire sous forme de billets de banque déposés dans des comptes ouverts auprès d'établissements de crédit agréés en tant que banques établis au Maroc ou de la valeur des biens meubles ou immeubles non destinés à usage professionnel acquis par ces avoirs ou du montant des avances en comptes courants d'associés ou en compte de l'exploitant et des prêts accordés aux tiers."", ""- pour les entreprises soumises à l'impôt sur les sociétés :\n- les taux prévus à l'article 247-XXXVII-A dudit code pour la période allant du 1 er  janvier 2023 jusqu'au 31décembre 2026 ;\n- le taux prévu à l'article 19-I (A ou B) dudit code, selon le cas, à compter du 1 er janvier 2027 ;\n- pour les entreprises soumises à l'impôt sur le revenu :\n- le taux prévu à l'article 73-II-F-7° dudit code au titre des années 2023 et 2024 ;\n- les taux du barème prévus à l'article 73-I dudit code, au titre des années suivantes."", ""- «Les entreprises d'assurances .........................................  \n«.............................................................................. Takaful.  \n- «II. - (abrogé)  \n«III. -  ……………………………………………………  \n- «IV. - Taux de l'impôt retenu à la source  \n- «Les taux de l'impôt sur les sociétés retenu à la source «sont fixés à:  \n- « A. - 5%  du  montant  des  rémunérations  visées  à «l'article15 bis ci-dessus, hors taxe sur la valeur ajoutée, «allouées aux personnes morales soumises à l'impôt sur les «sociétés et versées par l'Etat, les collectivités territoriales «et les établissements et entreprises publics et leurs filiales ;"", ""«B.- ......................................................................................  \n«............................................................................................  \n- «C. - Les rémunérations et les indemnités, occasionnelles «ou non  \n- «Les rémunérations et les indemnités, occasionnelles «ou non, imposables au titre des dispositions de l'article 56 «ci-dessus et qui sont versées par des entreprises ou organismes «à des personnes ne faisant pas partie de leur personnel salarié, «sont passibles de la retenue à la source aux taux prévus, selon «le cas, aux 1° ou 2° de l'article 73-II-G ci-dessous.  \n- «La retenue à la source visée à l'alinéa précédent est «appliquée sur le montant brut des rémunérations .............. «à l'article 174-I ci-dessous.  \n- «La retenue à la source au taux visé au 1° de l'article 73 «(II-G) ci-dessous ne dispense pas de la déclaration prévue à «l'article 82 ci-dessous.  \n- «Article 59. - Déductions  \n- «Sont déductibles .......................... l'article 57 ci-dessus:  \n- «I. - Les frais inhérents à la fonction ou à l'emploi, «calculés aux taux forfaitaires suivants:  \n- « A.  -  35%  pour  les  personnes  ne  relevant  pas  des «catégories professionnelles visées aux B et C ci-après, dont «le revenu brut annuel imposable n'excède pas soixante-dix «huit mille (78 000) dirhams.  \n- «Ce taux est fixé à 25% pour les personnes dont le revenu «brut annuel imposable est supérieur à soixante-dix-huit mille «(78 000) dirhams, sans que cette déduction puisse excéder «trente-cinq mille (35 000) dirhams ;  \n- « B.  -  Pour  les  personnes  relevant  des  catégories « professionnelles  suivantes  aux  taux  désignés  ci-après «sans que cette déduction puisse excéder trente-cinq mille «(35 000)dirhams :  \n- «- 25% pour le personnel ................................................  \n(la suite sans modification.)  \n- « Article 60 . - Abattement forfaitaire  \n- «I. - Pour la détermination du revenu net imposable ... «............................................. un abattement forfaitaire de :  \n- « -  70%  sur  le  montant  brut  qui  ne  dépasse  pas «annuellement ..................................................  \n(la suite sans modification.)  \n- «Article 61. -Définition des revenus et profits fonciers  \n- « I.- Sont  considérés  comme revenus fonciers pour «l'application de l'impôt sur le revenu, lorsqu'ils n'entrent pas «dans la catégorie des revenus professionnels :  \n«A.- ……………………………........………………………  \n- «B.- ……………………………........………………………  \n- «C.- les indemnités .................................... desdits biens.  \n- «D.- les produits provenant des bénéfices distribués «par les organismes de placement collectif immobilier (OPCI).  \n- «II.-Sont considérés comme profits fonciers……………  \n« ...................................................................................  \n- «.................................................. en bourse des valeurs.""]"," 1. Le taux de l'impôt pour les revenus liés aux actions et parts sociales est de 0% selon le code des impôts Marocains, sauf si la société est soumise à l'impôt sur les sociétés (IS). Dans ce cas, le taux de l'impôt peut varier entre 5% et 35%, en fonction des conditions spécifiques qui s'appliquent.

2. Source citée : Extraits du code des impôts Marocains dans la question (Article 247-XXXVII-A, Article 19-I).","Le taux de l'impôt pour le montant des produits des actions, parts sociales et revenus assimilés est de 10 %, sous réserve des dispositions du paragraphe XXXVII-C de l'article 247.",0.7178571428468878,1.0,0.6666666666666666,0.9226433206496752,gpt-4o-mini,bge-m3,mistral:7b,True,False,False,0.5
Combien d'agents d'assurance indépendants peuvent représenter la même compagnie d'assurance au Maroc ?,"[""### 2-2-2- Dynamique des agents d'assurance indépendants  \nLes  agents  d'assurance  indépendants  sont,  en  général,  des  entrepreneurs  indépendants autorisés à exercer des activités au nom de la compagnie d'assurance qu'ils représentent et avec laquelle ils ont conclu un accord de représentation. Ils peuvent vendre une seule branche d'activité ou plusieurs branches d'assurance. Cependant, ces agents peuvent représenter au plus, deux (2) EAR à condition d'obtenir l'accord de l'entreprise avec laquelle ils ont souscrit le premier traité de nomination.  \nLe marché marocain de l'assurance compte, à fin 2021, 1625 agents, représentant ainsi 58% du total des intermédiaires d'assurance.  \nDepuis 2005, le nombre d'agents agrées s'est inscrit dans la hausse et a atteint son point culminant  en  2019  avec  un  nombre  de  1.670  agents.  Les  agents  voient  leur  production croître à 12,6 milliards de dirhams en 2021 (soit une hausse de 16,7%).  \n42  \nrelatif à l'état de la concurrence dans le marché de l'assurance au Maroc  \nEntre 2005 et 2021, le nombre d'agents d'assurances est passé de 608 à 1.625, enregistrant un taux de croissance annuel moyen qui ne dépasse pas 6%, et ce, en raison des conditions d'accès  au  marché  de  distribution  de  l'assurance,  notamment  l'obligation  de  passer  un examen organisé par l'ACAPS en collaboration avec l'association professionnelle représentant des EAR pour obtenir l'agrément d'exercer.  \nGraph. 18 : Evolution du nombre des agents indépendants, année 2005-2021 :  \n<!-- image -->  \nSource : ACAPS."", ""### 2- La Fédération Nationale des Agents et Courtiers d'Assurances au Maroc  \nA la différence des EAR, le code des assurances a laissé la liberté aux intermédiaires d'assurances de  s'organiser  en  associations  professionnelles,  en  stipulant  dans  son  article  285  que  : « Les intermédiaires d'assurances s'organisent en associations professionnelles régies par les dispositions du dahir n°1-58-376 du 3 joumada I 1378 (15 novembre 1958) précité. Sont fixés par décret, après consultation de l'Autorité, les critères de désignation de l'association la plus représentative ». Ce même article stipule que les statuts des associations professionnelles susvisées ainsi que toutes modifications y afférentes sont approuvés par l'ACAPS.  \n27"", ""### 2-1-1- Le statut juridique des entreprises d'assurances  \nLe  marché  marocain  de  l'assurance  compte  à  fin  2021,  18  sociétés  anonymes  (SA)  et  4 sociétés d'assurances mutuelles (SAM). Ces dernières sont des sociétés à but non lucratif qui  garantissent  au  profit  de  leurs  membres,  personnes  physiques  ou  morales,  appelés sociétaires, moyennant le versement d'une cotisation fixe ou variable, le règlement intégral de leurs engagements, en cas de réalisation des risques dont elles ont pris la charge.  \nGraph. 7 : Structure du secteur des assurances en fonction du statut juridique, année 2021  \n<!-- image -->"", ""### 2-1- La structure de l'offre des entreprises d'assurances  \nLe marché marocain de l'assurance compte à fin 2022, un total de 26 entreprises, en croissance de 18% par rapport à l'année 2021, suite à l'entrée des entreprises Takaful.  \nBien que la création des EAR au Maroc reste variable d'une année à l'autre, avec des années où  aucune  création  n'est  enregistrée,  la  tendance  générale  du  nombre  total  des  EAR  au Maroc semble être à la hausse, avec une légère fluctuation d'une année à l'autre. Le nombre total d'entreprises est passé de 18 en 2005 à 26 en 2022, avec un taux de croissance annuel moyen de 2%.  \n34  \n0  \nrelatif à l'état de la concurrence dans le marché de l'assurance au Maroc  \nGraph. 6 : Evolution du nombre des EAR au Maroc, années 2005-2022  \n5  \n<!-- image -->  \n5  \n0  \n6  \nSource : ACAPS."", ""## Avis du Conseil de la concurrence n° A/1/23  \n### 2-2-4- Dynamique des bancassureurs  \nA fin 2021, les réseaux bancaires, les sociétés de financement et les associations de micro-crédit constituent les acteurs de bancassurance au Maroc 18 .  L'activité de bancassurance peut être définie comme l'activité de commercialisation par les établissements de crédit des produits d'assurance pour le compte des compagnies d'assurance.  \nAu Maroc, cette activité est limitée sur le plan légal à :  \n- Pour les banques :  aux assurances de personnes, à l'assistance et à l'assurance-crédit 19 ;\n- Pour les associations de micro-crédit : aux assurances de personnes et aux assurances contre l'incendie et le vol 20 ;\n- Pour les sociétés de financement : aux opérations d'assurances «décès» et «invalidité», adossées aux opérations de crédit et/ou de crédit-bail 21 .  \nSelon les données fournies par l'ACAPS, à fin 2021, le marché de la bancassurance est animé par 11 banques, 3 sociétés de financement et une association de microcrédit. Ce nombre est resté globalement stable depuis l'année 2018.  \nGraph. 20 : Evolution du nombre des établissements agréés en bancassurance, années 2018-2021  \n<!-- image -->"", ""### · Associations professionnelles :  \n- Fédération marocaine des sociétés d'assurances et de réassurances (FMSAR) 2 ;\n- Fédération Nationale des Agents et Courtiers d'Assurance au Maroc (FNACAM) ;\n- Groupement Professionnel des Banques du Maroc (GPBM) ;\n- Association Marocaine des Actuaires (AMA)."", ""### 2-2-2- Dynamique des agents d'assurance indépendants  \nLes  agents  d'assurance  indépendants  sont,  en  général,  des  entrepreneurs  indépendants autorisés à exercer des activités au nom de la compagnie d'assurance qu'ils représentent et avec laquelle ils ont conclu un accord de représentation. Ils peuvent vendre une seule branche d'activité ou plusieurs branches d'assurance. Cependant, ces agents peuvent représenter au plus, deux (2) EAR à condition d'obtenir l'accord de l'entreprise avec laquelle ils ont souscrit le premier traité de nomination.  \nLe marché marocain de l'assurance compte, à fin 2021, 1625 agents, représentant ainsi 58% du total des intermédiaires d'assurance.  \nDepuis 2005, le nombre d'agents agrées s'est inscrit dans la hausse et a atteint son point culminant  en  2019  avec  un  nombre  de  1.670  agents.  Les  agents  voient  leur  production croître à 12,6 milliards de dirhams en 2021 (soit une hausse de 16,7%).  \n42  \nrelatif à l'état de la concurrence dans le marché de l'assurance au Maroc  \nEntre 2005 et 2021, le nombre d'agents d'assurances est passé de 608 à 1.625, enregistrant un taux de croissance annuel moyen qui ne dépasse pas 6%, et ce, en raison des conditions d'accès  au  marché  de  distribution  de  l'assurance,  notamment  l'obligation  de  passer  un examen organisé par l'ACAPS en collaboration avec l'association professionnelle représentant des EAR pour obtenir l'agrément d'exercer.  \nGraph. 18 : Evolution du nombre des agents indépendants, année 2005-2021 :  \n<!-- image -->  \nSource : ACAPS."", ""### 2- La Fédération Nationale des Agents et Courtiers d'Assurances au Maroc  \nA la différence des EAR, le code des assurances a laissé la liberté aux intermédiaires d'assurances de  s'organiser  en  associations  professionnelles,  en  stipulant  dans  son  article  285  que  : « Les intermédiaires d'assurances s'organisent en associations professionnelles régies par les dispositions du dahir n°1-58-376 du 3 joumada I 1378 (15 novembre 1958) précité. Sont fixés par décret, après consultation de l'Autorité, les critères de désignation de l'association la plus représentative ». Ce même article stipule que les statuts des associations professionnelles susvisées ainsi que toutes modifications y afférentes sont approuvés par l'ACAPS.  \n27"", ""### 1- Textes législatifs et réglementaires  \nL'arsenal  juridique  et  réglementaire  encadrant  le  marché  de  l'assurance  a  connu  une évolution constante depuis les premiers textes adoptés au début du siècle dernier, jusqu'à la loi n° 17-99 portant code des assurances promulguée par dahir n° 1-02-238 du 25 rejeb 1423 (3 octobre 2002). Cette loi est composée de 5 livres :  \n- Livre premier : Le contrat d'assurance ;\n- Livre deux : Les assurances obligatoires ;\n- Livre trois : Les entreprises d'assurances et de réassurance ;\n- Livre quatre : La présentation des opérations d'assurance ;\n- Livre cinq : Dispositions diverses et transitoires.  \n5 /uniFE94/uniFEF4/uniFE91/uniFEAE/uniFED0/uniFCCC ا /uniFD29/uniFEE8/uniFEDF ار ا /uni062F ، 1980 رات /uniFE8E/uniFEF4/uniFEB4/uniFEE0/uniFEDF ري /uniFE8E/uniFE92/uniFE9F /uniFEF9 ي ا /uniFEE3 /uniFE84/uniFE98/uniFEDF ي: ا /uniFEB4/uniFEDF ث ا /uni062F ا /uniFEEE/uniFEA3 /uniFC32 /uniFEB0/uniFEF4/uniFE9F /uniFEEE/uniFEDF ك، ا /uniFE8E/uniFEA4/uniFEC0/uniFEDF ا /uniFEB2/uniFEF3 ر /uni062F إ .  \n6 ي. /uniFEF3 و /uniFEAE/uniFED8/uniFEDF ار ا /uni062F /uniFE94/uniFECC/uniFE92/uniFEC4/uniFEE3 2010 /uniFC43 و /uniFEF7 ا /uniFE94/uniFECC/uniFE92/uniFEC4/uniFEDF ي: ا /uniFEE3/uniFE84/uniFE98/uniFEDF وا /uniFEBE/uniFEF3/uniFEEE/uniFECC/uniFE98/uniFEDF ا /uniFC32 /uniFC86/uniFECB /uniFEF7 ا /uniFEB2/uniFEE0/uniFEA0/uniFCCC ء ا /uniFE8E/uniFEC0/uniFED7 /uniFEB2/uniFEF3/uniFEAE/uniFECF أو /uniFEAA/uniFEE4/uniFEA4/uniFEE3  \n20  \nrelatif à l'état de la concurrence dans le marché de l'assurance au Maroc  \nCe  code  a  été  rendu  applicable  par  la  promulgation  de  plusieurs  textes  d'application, notamment :  \n-  le Décret n° 2-04-355 du 19 ramadan 1425 (2 novembre 2004) pris pour l'application de la loi n° 17-99 portant code des assurances ;\n-  le Décret n° 2-03-50 du 20 rabii I er 1424 (22 mai 2003) pris pour l'application du titre III du livre II et du titre X du livre III de la loi n° 17-99 portant code des assurances ;\n-  le Décret n° 2-18-1009 du 23 chaabane 1440 (29 avril 2019) pris pour l'application de la loi n° 17-99 portant code des assurances ;\n-  l'Arrêté du ministre des finances et de la privatisation n° 2240-04 du 14 kaada 1425 (27 décembre 2004) relatif au contrat d'assurance : Arrêté pris en application du livre I er de la loi n° 17-99 portant code des assurances ;\n-  l'Arrêté  du  ministre  des  finances  et  de  la  privatisation  n°  213-05  du  15  hija1425 (26 janvier 2005) relatif aux assurances obligatoires : Arrêté pris en application du livre II de la loi n° 17-99 portant code des assurances ;\n-  l'Arrêté du ministre des finances et de la privatisation n° 1548-05 du 6 ramadan 1426 (10 octobre 2005) relatif aux entreprises d'assurances et de réassurance : Arrêté pris en application du livre III de la loi n° 17-99 portant code des assurances ;"", ""### 2-1-1- Le statut juridique des entreprises d'assurances  \nLe  marché  marocain  de  l'assurance  compte  à  fin  2021,  18  sociétés  anonymes  (SA)  et  4 sociétés d'assurances mutuelles (SAM). Ces dernières sont des sociétés à but non lucratif qui  garantissent  au  profit  de  leurs  membres,  personnes  physiques  ou  morales,  appelés sociétaires, moyennant le versement d'une cotisation fixe ou variable, le règlement intégral de leurs engagements, en cas de réalisation des risques dont elles ont pris la charge.  \nGraph. 7 : Structure du secteur des assurances en fonction du statut juridique, année 2021  \n<!-- image -->"", ""-  l'Arrêté  du  ministre  des  finances  et  de  la  privatisation  n°  213-05  du  15  hija1425 (26 janvier 2005) relatif aux assurances obligatoires : Arrêté pris en application du livre II de la loi n° 17-99 portant code des assurances ;\n-  l'Arrêté du ministre des finances et de la privatisation n° 1548-05 du 6 ramadan 1426 (10 octobre 2005) relatif aux entreprises d'assurances et de réassurance : Arrêté pris en application du livre III de la loi n° 17-99 portant code des assurances ;\n-  l'Arrêté du ministre des finances et de la privatisation n° 2241-04 du 14 kaada 1425 (27 décembre 2004) relatif à la présentation des opérations d'assurances : Arrêté pris en application du livre IV de la loi n° 17-99 portant code des assurances ;\n-  l'Arrêté du ministre de l'économie et des finances n° 2179-11 du 19 chaabane 1432 (21 juillet 2011) relatif à la présentation des opérations d'assurances par les sociétés de financement ;\n-  l'Arrêté du ministre des finances et de la privatisation n° 1053-06 du 28 rabii II 1427 (26 mai 2006) fixant les conditions générales - type des contrats relatifs à l'assurance responsabilité civile automobile ;\n-  l'Arrêté du ministre des finances et de la privatisation n° 2003-05 du 13 ramadan 1426 (17  octobre  2005)  fixant  les  conditions  générales  -  type  du  contrat  d'assurance accidents du travail et maladies professionnelles ;\n-  l'Arrêté du ministre de l'économie et des finances n° 587-11 du 4 rabii II 1432 (9 mars 2011) fixant  les  conditions  générales  -  type  du  contrat  d'assurance  «  responsabilité  civile professionnelle des intermédiaires d'assurances » ;\n-  l'Arrêté  n°  2216-19  du  30  rabii  II  1441  (27  décembre  2019)  fixant  les  clauses  dont l'insertion, dans les contrats d'assurance, est obligatoire au titre de la garantie contre les conséquences d'événements catastrophiques.  \n21"", ""### 2-3. Exigence de l'accord de la première EAR pour la représentation d'une deuxième par les agents  \nLe code des assurances stipule dans son article 292 que, pour représenter une deuxième entreprise d'assurances et de réassurance, l'agent d'assurances doit obtenir obligatoirement l'accord de la première.  \nCette disposition légale constitue une contrainte légale pour les agents souhaitant améliorer et  diversifier  leur  offre  assurantielle  notamment  à  travers  la  présentation  de  nouvelles opérations que l'entreprise mandante n'est pas agréée à pratiquer.""]"," 1. En fonction des lois marocaines relatives aux assurances, un agent d'assurance peut représenter plusieurs compagnies d'assurance au Maroc. Cependant, l'article 292 du code des assurances stipule que pour représenter une deuxième entreprise d'assurances et de réassurance, l'agent doit obtenir obligatoirement l'accord de la première entreprise avec laquelle il travaille. Cela signifie qu'un agent peut avoir un contrat avec plusieurs compagnies d'assurance, mais chaque contrat nécessite l'approbation de la compagnie d'assurance initiale du même agent.
2. Source : Avis du Conseil de la concurrence n° A/1/23 > 2-3. Exigence de l'accord de la première EAR pour la représentation d'une deuxième par les agents","Les agents d'assurance indépendants peuvent représenter au plus deux (2) entreprises d'assurance régionales (EAR) au Maroc, à condition d'obtenir l'accord de l'entreprise avec laquelle ils ont souscrit le premier traité de nomination.",0.4880952380830357,1.0,0.4,0.9453371463985859,gpt-4o-mini,bge-m3,mistral:7b,True,False,False,0.5
Quelle est la durée de validité de l'agrément de la société PALMA FLOR pour commercialiser des plants certifiés et quelles sont les conditions pour le renouveler ?,"[""## ARRÊTE :  \nARTICLE PREMIER.-La société «PALMA FLOR» dont le siège social  sis Mazaria Ouled El Maghraoui, Ouled Settout, Zaio, Nador, est agréée pour commercialiser des plants certifiés d'olivier, de vigne, de figuier, de figuier de barbarie, d'arganier, de caroubier et des semences et plants certifiés des rosacées à noyau et d'agrumes.  \nART.2.-La durée de validité de cet agrément est de cinq (5) ans, à compter de la date de publication du présent arrêté au « Bulletin officiel ».  \nIl peut être renouvelé pour la même durée, à condition que la demande de renouvellement soit formulée six (6) mois, au moins, avant l'expiration de sa durée de validité.  \nART.3.-La déclaration prévue à l'article 2 de chacun des arrêtés susvisés n os 2098-03, 2100-03, 2110-05, 3548-13, 986-19, 1437-22, 2140-22 et 640-23 doit être faite par la société «PALMA FLOR» à l'Office national de sécurité sanitaire des produits alimentaires, comme suit :  \n- en avril et septembre de chaque année :\n- pour les achats et les ventes des plants d'olivier ;\n- pour les achats, les ventes et les stocks des plants de vigne ;\n- pour la production, les ventes et les stocks des plants de figuier ;  \n- en janvier et juillet de chaque année pour les achats, les ventes et les stocks des semences et plants d'agrumes ;\n- annuellement pour les stocks des plants de figuier de barbarie ;\n- au moins une fois par an au plus tard le 31 décembre, la situation de leurs stocks de semences et plants certifiés des rosacées à noyau ;\n- au moins une fois par an au plus tard le 31 décembre, la situation de leurs stocks de plants certifiés d'arganier ;\n- au moins une fois par an au plus tard le 31 décembre, la situation de leurs stocks de plants certifiés de caroubier.  \nART.4.-L'agrément objet du présent arrêté peut être retiré en cas d'infraction dûment constatée aux dispositions du dahir n°1-69-169 susvisé ou des textes pris pour son application.  \nART.5.-Le présent arrêté sera publié au Bulletin officiel .  \nRabat, le 18 chaoual 1446 (17 avril 2025).  \nahMeD el bOUaRI.  \nLe texte en langue arabe a été publié dans l'édition générale du «Bulletin officiel » n° 7408 du 1 er  hija 1446 (29 mai 2025)."", ""## ARRÊTE :  \nARTICLE PREMIER.-La société «LUNA FRESH» dont le siège social sis voie principale 30011, commune rurale Sahel-Ouled  Hriz,  province  Berrechid,  est  agréée  pour commercialiser des semences certifiées du maïs, des semences standard de légumes et des plants certifiés de pomme de terre.  \nART.2.-La durée de validité de cet agrément est de cinq (5) ans, à compter de la date de publication du présent arrêté au « Bulletin officiel ».  \nIl peut être renouvelé pour la même durée à condition que la demande de renouvellement soit formulée six (6) mois, au moins, avant l'expiration de sa validité.  \nART.3.-La déclaration prévue à l'article 2 de chacun des arrêtés susvisés  n os 859-75, 971-75 et 622-11 doit être faite par la société «LUNA FRESH» à l'Office national de sécurité sanitaire des produits alimentaires comme suit :  \n- semestriellement pour les achats, les ventes et les stocks des plants de pomme de terre ;\n- mensuellement pour les achats et les ventes de semences des  autres  espèces  mentionnées  à  l'article  premier ci-dessus.  \nART.4.-L'agrément objet du présent arrêté peut être retiré en cas d'infraction dûment constatée aux dispositions du dahir n°1-69-169 susvisé ou des textes pris pour son application.  \naRt.5.Le présent arrêté sera publié au Bulletin officiel  \n. Rabat, le 16 rabii I 1447 (9 septembre 2025).  \nahMeD el bOUaRI."", ""## ARRÊTE :  \nARTICLE PREMIER.-La société «ZIAGRO» dont le siège social sis 42, résidence Mabrouka, Manzah, appartement 9, Aïn Atiq, Temara, est agréée pour commercialiser des plants certifiés d'olivier, de vigne, de figuier, de grenadier, des rosacées à pépins, des semences et plants certifiés des rosacées à noyau et des plants certifiés des espèces à fruits rouges.  \nART.2.-La durée de validité de cet agrément est de cinq (5) ans, à compter de la date de publication du présent arrêté au « Bulletin officiel ».  \nIl peut être renouvelé pour la même durée, à condition que la demande de renouvellement soit formulée six (6) mois, au moins, avant l'expiration de sa durée de validité.  \nART.3.-La déclaration prévue à l'article 2 de chacun des arrêtés susvisés n os 2100-03, 2110-05, 2157-11, 3548-13, 784-16, 2109-17, 1437-22, doit être faite par la société «ZIAGRO» à l'Office national de sécurité sanitaire des produits alimentaires, comme suit :  \n- en avril et septembre de chaque année :\n- pour les achats et les ventes des plants d'olivier ;\n- pour les achats, les ventes et les stocks des plants de vigne et des rosacées à pépins ;\n- pour la production, les ventes et les stocks des plants de figuier ;\n- en novembre et mai de chaque année pour la situation des stocks des plants de grenadier ;\n- en novembre et mai de chaque année les stocks des plants des espèces à fruits rouges ;\n- au moins une fois par an au plus tard le 31 décembre, la situation de leurs stocks de semences et plants certifiés des rosacées à noyau.  \nART.4.-L'agrément objet du présent arrêté peut être retiré en cas d'infraction dûment constatée aux dispositions du dahir n°1-69-169 susvisé ou des textes pris pour son application.  \nART.5.-Le présent arrêté sera publié au Bulletin officiel .  \nRabat, le 18 chaoual 1446 (17 avril 2025).  \nahMeD el bOUaRI.  \nLe texte en langue arabe a été publié dans l'édition générale du «Bulletin officiel » n° 7408 du 1 er  hija 1446 (29 mai 2025)."", ""## ARRÊTE :  \nARTICLE  PREMIER. - La  société  « ISSEMGHY BIOTECHNOLOGIES» dont le siège social sis rue Koteiba, Bnou Mouslim, Casablanca, est agréée pour commercialiser des plants certifiés de palmier dattier.  \nART.2.-La durée de validité de cet agrément est de cinq (5) ans, à compter de la date de publication du présent arrêté au « Bulletin officiel ».  \nIl peut être renouvelé pour la même durée à condition que la demande de renouvellement soit formulée six (6) mois, au moins, avant l'expiration de sa validité.  \nART.3.-La déclaration prévue à l'article 2 de l'arrêté susvisé n°3229-15 des stocks de plants mentionnés à l'article premier ci-dessus doit être faite en mai et novembre de chaque année, par la société «ISSEMGHY BIOTECHNOLOGIES» à l'Office national de sécurité sanitaire des produits alimentaires.  \nART.4.-L'agrément objet du présent arrêté peut être retiré en cas d'infraction dûment constatée aux dispositions du dahir n°1-69-169 susvisé ou des textes pris pour son application.  \naRt.5.Le présent arrêté sera publié au Bulletin officiel  \n. Rabat, le 29 hija 1446 (26 juin 2025).  \nahMeD el bOUaRI.  \nLe texte en langue arabe a été publié dans l'édition générale du «Bulletin officiel » n° 7424 du 28 moharrem 1447 (24 juillet 2025)."", ""## ARRÊTE :  \nARTICLE  PREMIER. - La  société  « VILMORINMIKADO ATLAS» dont le siège social sis route de l'Oasis, rue n°3 et n°6, bureaux n°B108, B109 et M02, Oasis Sud, quartier Oasis, Casablanca, est agréée pour commercialiser des semences certifiées du maïs et des semences standard de légumes.  \nART.2.-La durée de validité de cet agrément est de cinq (5) ans, à compter de la date de publication du présent arrêté au « Bulletin officiel ».  \nIl peut être renouvelé pour la même durée à condition que la demande de renouvellement soit formulée six (6) mois, au moins, avant l'expiration de sa validité.  \nART.3.-La déclaration prévue à l'article 2 de chacun des arrêtés susvisés n os 859-75 et 971-75 des achats et des ventes des semences mentionnées à l'article premier ci-dessus doit être faite mensuellement par la société «VILMORIN-MIKADO ATLAS» à l'Office national de sécurité sanitaire des produits alimentaires.  \nART.4.-L'agrément objet du présent arrêté peut être retiré en cas d'infraction dûment constatée aux dispositions du dahir n°1-69-169 susvisé ou des textes pris pour son application.  \naRt.5.Le présent arrêté sera publié au Bulletin officiel  \n. Rabat, le 16 rabii I 1447 (9 septembre 2025).  \nahMeD el bOUaRI."", ""## ARRÊTE :  \nARTICLE PREMIER.-La société «DOLOMIT FRUITS AND  PLANTES»  dont  le  siège  social  sis  Lot  n°106, appartement 2, rue Lmaarka, Zitoune, Meknès, est agréée pour commercialiser des plants certifiés de vigne, des rosacées à pépins, des semences et plants certifiés des rosacées à noyau et des plants certifiés des espèces à fruits rouges.  \nART.2.-La durée de validité de cet agrément est de cinq (5) ans, à compter de la date de publication du présent arrêté au «Bulletin officiel».  \nIl peut être renouvelé pour la même durée à condition que la demande de renouvellement soit formulée six (6) mois, au moins, avant l'expiration de sa validité.  \nART.3.-La déclaration prévue à l'article 2 de chacun des arrêtés susvisés n os 2100-03, 2157-11, 2109-17 et 1437-22 doit être faite par la société «DOLOMIT FRUITS AND PLANTES» à l'Office national de sécurité sanitaire des produits alimentaires, comme suit:  \n-  en avril et septembre de chaque annéepour les achats, les  ventes et les stocks des plants de vigne et des rosacées à pépins;\n-  en novembre et mai de chaque année les stocks des plants des espèces à fruits rouges;\n-  au moins une fois par an au plus tard le 31 décembre, la  situation de leurs stocks de semences et plants certifiésdes rosacées à noyau.  \nART.4.-L'agrément objet du présent arrêté peut être retiré en cas d'infraction dûment constatée aux dispositions du dahir n°1-69-169 susvisé ou des textes pris pour son application.  \nART.5.-Le présent arrêté sera publié au Bulletin officiel  \n. Rabat, le 23 hija 1446 (20 juin 2025).  \nahMeD el bOUaRI.  \nLe texte en langue arabe a été publié dans l'édition générale du «Bulletin officiel » n° 7424 du 28 moharrem 1447 (24 juillet 2025)."", ""## ARRÊTE :  \nARTICLE PREMIER.-La société «PALMA FLOR» dont le siège social  sis Mazaria Ouled El Maghraoui, Ouled Settout, Zaio, Nador, est agréée pour commercialiser des plants certifiés d'olivier, de vigne, de figuier, de figuier de barbarie, d'arganier, de caroubier et des semences et plants certifiés des rosacées à noyau et d'agrumes.  \nART.2.-La durée de validité de cet agrément est de cinq (5) ans, à compter de la date de publication du présent arrêté au « Bulletin officiel ».  \nIl peut être renouvelé pour la même durée, à condition que la demande de renouvellement soit formulée six (6) mois, au moins, avant l'expiration de sa durée de validité.  \nART.3.-La déclaration prévue à l'article 2 de chacun des arrêtés susvisés n os 2098-03, 2100-03, 2110-05, 3548-13, 986-19, 1437-22, 2140-22 et 640-23 doit être faite par la société «PALMA FLOR» à l'Office national de sécurité sanitaire des produits alimentaires, comme suit :  \n- en avril et septembre de chaque année :\n- pour les achats et les ventes des plants d'olivier ;\n- pour les achats, les ventes et les stocks des plants de vigne ;\n- pour la production, les ventes et les stocks des plants de figuier ;  \n- en janvier et juillet de chaque année pour les achats, les ventes et les stocks des semences et plants d'agrumes ;\n- annuellement pour les stocks des plants de figuier de barbarie ;\n- au moins une fois par an au plus tard le 31 décembre, la situation de leurs stocks de semences et plants certifiés des rosacées à noyau ;\n- au moins une fois par an au plus tard le 31 décembre, la situation de leurs stocks de plants certifiés d'arganier ;\n- au moins une fois par an au plus tard le 31 décembre, la situation de leurs stocks de plants certifiés de caroubier.  \nART.4.-L'agrément objet du présent arrêté peut être retiré en cas d'infraction dûment constatée aux dispositions du dahir n°1-69-169 susvisé ou des textes pris pour son application.  \nART.5.-Le présent arrêté sera publié au Bulletin officiel .  \nRabat, le 18 chaoual 1446 (17 avril 2025).  \nahMeD el bOUaRI.  \nLe texte en langue arabe a été publié dans l'édition générale du «Bulletin officiel » n° 7408 du 1 er  hija 1446 (29 mai 2025)."", ""## ARRÊTE :  \nARTICLE PREMIER.-La société «INVITRO PALM BIOTECHNOLOGY» dont le siège social sis 400 Boulevard Zerktouni, 5 ème   étage  n° 26,  Casablanca, est agréée pour commercialiser  des plants certifiés de palmier dattier.  \nART.2.-La durée de validité de cet agrément est de cinq (5) ans, à compter de la date de publication du présent arrêté au « Bulletin officiel ».  \nIl peut être renouvelé pour la même durée, à condition que la demande de renouvellement soit formulée six (6) mois, au moins, avant l'expiration de sa durée de validité.  \nART.3.-La déclaration prévue à l'article 2 de l'arrêté susvisé n°3229-15 des stocks de plants mentionnées à l'article premier ci-dessus doit être faite en mai et novembre de chaque année, par la société «INVITRO PALM BIOTECHNOLOGY» à l'Office national de sécurité sanitaire des produits alimentaires.  \nART.4.-L'agrément objet du présent arrêté peut être retiré en cas d'infraction dûment constatée aux dispositions du dahir n°1-69-169 susvisé ou des textes pris pour son application.  \nART.5.-Le présent arrêté sera publié au Bulletin officiel .  \nRabat, le 18 chaoual 1446 (17 avril 2025).  \nahMeD el bOUaRI.  \nLe texte en langue arabe a été publié dans l'édition générale du «Bulletin officiel » n° 7408 du 1 er  hija 1446 (29 mai 2025)."", ""## ARRÊTE :  \nARTICLE  PREMIER. - La  société  « ISSEMGHY BIOTECHNOLOGIES» dont le siège social sis rue Koteiba, Bnou Mouslim, Casablanca, est agréée pour commercialiser des plants certifiés de palmier dattier.  \nART.2.-La durée de validité de cet agrément est de cinq (5) ans, à compter de la date de publication du présent arrêté au « Bulletin officiel ».  \nIl peut être renouvelé pour la même durée à condition que la demande de renouvellement soit formulée six (6) mois, au moins, avant l'expiration de sa validité.  \nART.3.-La déclaration prévue à l'article 2 de l'arrêté susvisé n°3229-15 des stocks de plants mentionnés à l'article premier ci-dessus doit être faite en mai et novembre de chaque année, par la société «ISSEMGHY BIOTECHNOLOGIES» à l'Office national de sécurité sanitaire des produits alimentaires.  \nART.4.-L'agrément objet du présent arrêté peut être retiré en cas d'infraction dûment constatée aux dispositions du dahir n°1-69-169 susvisé ou des textes pris pour son application.  \naRt.5.Le présent arrêté sera publié au Bulletin officiel  \n. Rabat, le 29 hija 1446 (26 juin 2025).  \nahMeD el bOUaRI.  \nLe texte en langue arabe a été publié dans l'édition générale du «Bulletin officiel » n° 7424 du 28 moharrem 1447 (24 juillet 2025)."", ""## ARRÊTE :  \nARTICLE PREMIER.-La société «DOLOMIT FRUITS AND  PLANTES»  dont  le  siège  social  sis  Lot  n°106, appartement 2, rue Lmaarka, Zitoune, Meknès, est agréée pour commercialiser des plants certifiés de vigne, des rosacées à pépins, des semences et plants certifiés des rosacées à noyau et des plants certifiés des espèces à fruits rouges.  \nART.2.-La durée de validité de cet agrément est de cinq (5) ans, à compter de la date de publication du présent arrêté au «Bulletin officiel».  \nIl peut être renouvelé pour la même durée à condition que la demande de renouvellement soit formulée six (6) mois, au moins, avant l'expiration de sa validité.  \nART.3.-La déclaration prévue à l'article 2 de chacun des arrêtés susvisés n os 2100-03, 2157-11, 2109-17 et 1437-22 doit être faite par la société «DOLOMIT FRUITS AND PLANTES» à l'Office national de sécurité sanitaire des produits alimentaires, comme suit:  \n-  en avril et septembre de chaque annéepour les achats, les  ventes et les stocks des plants de vigne et des rosacées à pépins;\n-  en novembre et mai de chaque année les stocks des plants des espèces à fruits rouges;\n-  au moins une fois par an au plus tard le 31 décembre, la  situation de leurs stocks de semences et plants certifiésdes rosacées à noyau.  \nART.4.-L'agrément objet du présent arrêté peut être retiré en cas d'infraction dûment constatée aux dispositions du dahir n°1-69-169 susvisé ou des textes pris pour son application.  \nART.5.-Le présent arrêté sera publié au Bulletin officiel  \n. Rabat, le 23 hija 1446 (20 juin 2025).  \nahMeD el bOUaRI.  \nLe texte en langue arabe a été publié dans l'édition générale du «Bulletin officiel » n° 7424 du 28 moharrem 1447 (24 juillet 2025)."", ""## ARRÊTE :  \nARTICLE PREMIER.-   La  société  « ENTREPRISE BELMAHI MAROC» dont le siège social sis rue Moulouya, N°7, Souk Lakhmiss, Madagh, Berkane, est agréée pour commercialiser des plants certifiés de pomme de terre.  \nART.2.-La durée de validité de cet agrément est de cinq (5) ans, à compter de la date de publication du présent arrêté au «Bulletin officiel».  \nIl peut être renouvelé pour la même durée à condition que la demande de renouvellement soit formulée six (6) mois, au moins, avant l'expiration de sa validité.  \nART.3.-La déclaration prévue à l'article 2 de l'arrêté susvisé n° 622-11 des achats, des ventes et des stocks des plants mentionnés à l'article premier ci-dessus doit être faite semestriellement, par la société «ENTREPRISE BELMAHI MAROC» à l'Office national de sécurité sanitaire des produits alimentaires.  \nART.4.-L'agrément objet du présent arrêté peut être retiré en cas d'infraction dûment constatée aux dispositions du dahir n°1-69-169 susvisé ou des textes pris pour son application.  \nART.5.-Le présent arrêté sera publié au Bulletin officiel .  \nRabat, le 23 hija 1446 (20 juin 2025).  \nahMeD el bOUaRI.  \nLe texte en langue arabe a été publié dans l'édition générale du «Bulletin officiel » n° 7424 du 28 moharrem 1447 (24 juillet 2025)."", ""## ARRÊTE :  \nARTICLE PREMIER.-La société «BASTANA TEC» dont le siège social sis magasin n°25, avenue de la gare, Meknès, est agréée pour commercialiser des plants certifiés d'olivier, de vigne, de figuier, des rosacées à pépins et des semences et plants certifiés des rosacées à noyau.  \nART.2.-La durée de validité de cet agrément est de cinq (5) ans, à compter de la date de publication du présent arrêté au «Bulletin officiel».  \nIl peut être renouvelé pour la même durée à condition que la demande de renouvellement soit formulée six (6) mois au moins avant l'expiration de sa validité.  \n- ART.3.-La déclaration prévue à l'article 2 de chacun des arrêtés susvisés n os 2099-03, 2100-03, 2110-05, 2157-11 et 3548-13 doit être faite par la société «BASTANA TEC» à l'Office national de sécurité sanitaire des produits alimentaires, en avril et septembre de chaque annéecomme suit:\n- pour les achats et les ventes des plants d'olivier;\n- pour les achats, les ventes et les stocks des plants de vigne et des rosacées à pépins;\n- pour les achats, les ventes et les stocks des semences et plants des rosacées à noyau;\n- pour la production, les ventes et les stocks des plants de figuier;  \nART.4.-L'agrément objet du présent arrêté peut être retiré en cas d'infraction dûment constatée aux dispositions du dahir n°1-69-169 susvisé ou des textes pris pour son application.  \nART.5.-Le présent arrêté sera publié au Bulletin officiel .  \nRabat, le 24 joumada I 1443 (29 décembre 2021).  \nMOhaMMeD SaDIKI.""]"," 1. La durée de validité de l'agrément de la société PALMA FLOR pour commercialiser des plants certifiés est de cinq (5) ans.
2. Les sources citées sont les extraits des arrêts suivants :
   - Arrêt 1 : ""La durée de validité de cet agrément est de cinq (5) ans, à compter de la date de publication du présent arrêté au «Bulletin officiel».""
   - Arrêt 4 : ""Il peut être renouvelé pour la même durée à condition que la demande de renouvellement soit formulée six (6) mois, au moins, avant l'expiration de sa validité.""","La durée de validité de l'agrément de la société PALMA FLOR est de cinq (5) ans, à compter de la date de publication du présent arrêté (article 2). Il peut être renouvelé pour la même durée, à condition que la demande de renouvellement soit formulée six (6) mois au moins avant l'expiration de sa durée de validité.",0.9999999999916667,1.0,0.8,0.9701903737567475,gpt-4o-mini,bge-m3,mistral:7b,True,False,False,0.5
"""Quelles sont les coordonnées d'implantation pour une ferme aquacole ? ""","[""| Limites externes d'implantation de la ferme aquacole :                                                                                                                                                                                                                                                                                                                                                                                                                | Bornes                                                                                                                                                                                                                                                                                                                                                                                                                                                                | Latitude                                                                                                                                                                                                                                                                                                                                                                                                                                                              | Longitude                                                                                                                                                                                                                                                                                                                                                                                                                                                             |"", ""| Limites externes d'implantation de la ferme aquacole :                                                                                                                                                                                                                                                                                                                                       | B4                                                                                                                                                                                                                                                                                                                                                                                           | 23°0'57.395'' N                                                                                                                                                                                                                                                                                                                                                                              | 16°10'32.853''W                                                                                                                                                                                                                                                                                                                                                                              |"", ""| Limites externes d'implantation de la ferme aquacole :                                                                                                                                                                                                                                                                                                                                                                                                                | B2                                                                                                                                                                                                                                                                                                                                                                                                                                                                    | 30° 33' 34.643''N                                                                                                                                                                                                                                                                                                                                                                                                                                                     | 9° 46' 52.817''W                                                                                                                                                                                                                                                                                                                                                                                                                                                      |"", ""| Limites externes d'implantation de la ferme aquacole :   |                                                                                                                                                                                                                  |                                                                                                                                                                                                                  |                                                                                                                                                                                                                  | 15°49'31.456''W                                                                                                                                                                                                  |\n| Limites externes d'implantation de la ferme aquacole :   |                                                                                                                                                                                                                  |                                                                                                                                                                                                                  |                                                                                                                                                                                                                  | 15°49'36.632''W                                                                                                                                                                                                  |\n| Limites externes d'implantation de la ferme aquacole :   |                                                                                                                                                                                                                  |                                                                                                                                                                                                                  |                                                                                                                                                                                                                  | 15°49'34.220''W                                                                                                                                                                                                  |"", ""| Limites externes d'implantation de la ferme aquacole :                                                                                                                                                                                                                                                                                                           |                                                                                                                                                                                                                                                                                                                                                                  |                                                                                                                                                                                                                                                                                                                                                                  |                                                                                                                                                                                                                                                                                                                                                                  |\n|                                                                                                                                                                                                                                                                                                                                                                  | Bornes Latitude Longitude B1 22°53'43.668'' N 16°25'2.610''W B2 22°53'28.474'' N 16°25'8.857''W B3 22°53'33.104'' N 16°25'21.977''W                                                                                                                                                                                                                              |                                                                                                                                                                                                                                                                                                                                                                  |                                                                                                                                                                                                                                                                                                                                                                  |"", ""| Limites externes d'implantation de la ferme aquacole :                                                                                                                                                                                                                                                                                                                                                                                                                | B1                                                                                                                                                                                                                                                                                                                                                                                                                                                                    | 30° 33' 23.504''N                                                                                                                                                                                                                                                                                                                                                                                                                                                     | 9° 46' 39.155''W                                                                                                                                                                                                                                                                                                                                                                                                                                                      |"", ""| Limites externes d'implantation de la ferme aquacole :                                                                                                                                                                                                                                                                                                                        |                                                                                                                                                                                                                                                                                                                                                                               |                                                                                                                                                                                                                                                                                                                                                                               |                                                                                                                                                                                                                                                                                                                                                                               |                                                                                                                                                                                                                                                                                                                                                                               |"", ""| Limites externes d'implantation de la ferme aquacole :                                                                                                                                                                                                                                                                                                                                                                                                           | Parcelle 1                                                                                                                                                                                                                                                                                                                                                                                                                                                       | Bornes                                                                                                                                                                                                                                                                                                                                                                                                                                                           | Latitude                                                                                                                                                                                                                                                                                                                                                                                                                                                         | Longitude                                                                                                                                                                                                                                                                                                                                                                                                                                                        | Longitude                                                                                                                                                                                                                                                                                                                                                                                                                                                        |"", ""| Limites externes d'implantation de la ferme aquacole :                                                                                                                                                                                                                                                                                                                                    |                                                                                                                                                                                                                                                                                                                                                                                           |                                                                                                                                                                                                                                                                                                                                                                                           |                                                                                                                                                                                                                                                                                                                                                                                           |"", ""| Limites externes d'implantation de la ferme aquacole :                                                                                                                                                                                                                                                                                                                                                                                                           | Parcelle 1                                                                                                                                                                                                                                                                                                                                                                                                                                                       | B2                                                                                                                                                                                                                                                                                                                                                                                                                                                               | 23° 5' 27,528''N                                                                                                                                                                                                                                                                                                                                                                                                                                                 |                                                                                                                                                                                                                                                                                                                                                                                                                                                                  | 16° 10' 37,812''W                                                                                                                                                                                                                                                                                                                                                                                                                                                |"", ""| Limites externes d'implantation de la ferme aquacole :                                                                                                                                                                                                                                                                                                                                                                                                           | Parcelle 1                                                                                                                                                                                                                                                                                                                                                                                                                                                       | B3                                                                                                                                                                                                                                                                                                                                                                                                                                                               | 23° 5' 18,888''N                                                                                                                                                                                                                                                                                                                                                                                                                                                 | 16°                                                                                                                                                                                                                                                                                                                                                                                                                                                              | 10' 31,108''W                                                                                                                                                                                                                                                                                                                                                                                                                                                    |"", ""| Limites externes d'implantation de la ferme aquacole :                                                                                                                                                                                                                                                                                                                                                                                                           | Parcelle 1                                                                                                                                                                                                                                                                                                                                                                                                                                                       | B3                                                                                                                                                                                                                                                                                                                                                                                                                                                               | 23° 5' 30,095''N                                                                                                                                                                                                                                                                                                                                                                                                                                                 |                                                                                                                                                                                                                                                                                                                                                                                                                                                                  | 16° 10' 51,595''W                                                                                                                                                                                                                                                                                                                                                                                                                                                |""]"," 1. Les coordonnées d'implantation pour les fermes aquacoles sont fournies sous forme de bornes de latitude et longitude dans chaque extrait.
2. Les sources citées sont les extraits d'arrêts que vous avez fournis.","Les coordonnées d'implantation pour une ferme aquacole ne sont pas précisées dans l'extrait fourni. Les limites externes d'implantation et les bornes sont mentionnées, mais les valeurs spécifiques de latitude et de longitude ne sont pas indiquées.",0.9999999999916667,0.0,0.5,0.891782161562892,gpt-4o-mini,bge-m3,mistral:7b,True,False,False,0.5
Quels sont les diplômes qui sont reconnus comme équivalents au diplôme de docteur en médecine selon l'arrêté du ministre de l'enseignement supérieur du 26 janvier 2023 ?,"[""## Arrêté du ministre de l'enseignement supérieur, de la recherche scientifique et de l'innovation n°200-23 du 4 rejeb 1444 (26  janvier  2023)  complétant  l'arrêté  n° 2963-97  du 2chaabane 1418 (3décembre 1997) fixant la liste des diplômes reconnus équivalents au diplôme de docteur en médecine.  \nle MINIStRe De l'eNSeIGNeMeNt SUP É RIeUR, De la ReCheRChe SCIeNtIFIQUe et De l'INNOVatION,  \nVu l'arrêté du ministre de l'enseignement supérieur, de  la  recherche  scientifique  et  de  la  culture  n° 2963-97  du 2 chaabane 1418 (3décembre 1997) fixant la liste des diplômes reconnus équivalents au diplôme de docteur en médecine, tel qu'il a été modifié et complété ;  \nVu le décret n°2-21-838 du 14 rabii I 1443 (21 octobre 2021) relatif aux attributions du ministre de l'enseignement supérieur, de la recherche scientifique et de l'innovation ;  \nAprès avis de la commission sectorielle des sciences de la santé, réunie en date du 21 décembre 2022 ;  \nAprès avis du conseil national de l'Ordre national des médecins,"", ""## Arrêté du ministre de l'enseignement supérieur, de la recherche scientifique et de l'innovation n°2308-23 du 26 safar 1445 (12 septembre 2023) complétant l'arrêté n°2963-97 du 2chaabane 1418 (3décembre 1997) fixant la liste des diplômes reconnus équivalents au diplôme de docteur en médecine.  \nle MINIStRe De l'eNSeIGNeMeNt SUP É RIeUR, De la ReCheRChe SCIeNtIFIQUe et De l'INNOVatION,  \nVu l'arrêté du ministre de l'enseignement supérieur, de  la  recherche  scientifique  et  de  la  culture  n° 2963-97  du 2 chaabane 1418 (3décembre 1997) fixant la liste des diplômes reconnus équivalents au diplôme de docteur en médecine, tel qu'il a été modifié et complété ;  \nVu le décret n°2-21-838 du 14 rabii I 1443 (21 octobre 2021) relatif aux attributions du ministre de l'enseignement supérieur, de la recherche scientifique et de l'innovation ;  \nAprès avis de la commission sectorielle des sciences de la santé, réunie en date du 11 juillet 2023 ;  \nAprès avis du conseil national de l'Ordre national des médecins,"", ""## Arrêté du ministre de l'enseignement supérieur, de la recherche scientifique et de l'innovation n°201-23 du 4 rejeb 1444 (26  janvier  2023)  complétant  l'arrêté  n° 2963-97  du 2chaabane 1418 (3décembre 1997) fixant la liste des diplômes reconnus équivalents au diplôme de docteur en médecine.  \nle MINIStRe De l'eNSeIGNeMeNt SUP É RIeUR, De la ReCheRChe SCIeNtIFIQUe et De l'INNOVatION,  \nVu l'arrêté du ministre de l'enseignement supérieur, de  la  recherche  scientifique  et  de  la  culture  n° 2963-97  du 2 chaabane 1418 (3décembre 1997) fixant la liste des diplômes reconnus équivalents au diplôme de docteur en médecine, tel qu'il a été modifié et complété ;  \nVu le décret n°2-21-838 du 14 rabii I 1443 (21 octobre 2021) relatif aux attributions du ministre de l'enseignement supérieur, de la recherche scientifique et de l'innovation ;  \nAprès avis de la commission sectorielle des sciences de la santé, réunie en date du 21 décembre 2022 ;  \nAprès avis du conseil national de l'Ordre national des médecins,"", ""## Arrêté du ministre de l'enseignement supérieur, de la recherche scientifique et de l'innovation n°207-23 du 4 rejeb 1444 (26  janvier  2023)  complétant  l'arrêté  n° 2963-97  du 2chaabane 1418 (3décembre 1997) fixant la liste des diplômes reconnus équivalents au diplôme de docteur en médecine.  \nle MINIStRe De l'eNSeIGNeMeNt SUP É RIeUR, De la ReCheRChe SCIeNtIFIQUe et De l'INNOVatION,  \nVu l'arrêté du ministre de l'enseignement supérieur, de  la  recherche  scientifique  et  de  la  culture  n° 2963-97  du 2 chaabane 1418 (3décembre 1997) fixant la liste des diplômes reconnus équivalents au diplôme de docteur en médecine, tel qu'il a été modifié et complété ;  \nVu le décret n°2-21-838 du 14 rabii I 1443 (21 octobre 2021) relatif aux attributions du ministre de l'enseignement supérieur, de la recherche scientifique et de l'innovation ;  \nAprès avis de la commission sectorielle des sciences de la santé, réunie en date du 21 décembre 2022 ;  \nAprès avis du conseil national de l'Ordre national des médecins,"", ""## Arrêté du ministre de l'enseignement supérieur, de la recherche scientifique et de l'innovation n°2303-23 du 26 safar 1445 (12 septembre 2023) complétant l'arrêté n°2963-97 du 2chaabane 1418 (3décembre 1997) fixant la liste des diplômes reconnus équivalents au diplôme de docteur en médecine.  \nle MINIStRe De l'eNSeIGNeMeNt SUP É RIeUR, De la ReCheRChe SCIeNtIFIQUe et De l'INNOVatION,  \nVu l'arrêté du ministre de l'enseignement supérieur, de  la  recherche  scientifique  et  de  la  culture  n° 2963-97  du 2 chaabane 1418 (3décembre 1997) fixant la liste des diplômes reconnus équivalents au diplôme de docteur en médecine, tel qu'il a été modifié et complété ;  \nVu le décret n°2-21-838 du 14 rabii I 1443 (21 octobre 2021) relatif aux attributions du ministre de l'enseignement supérieur, de la recherche scientifique et de l'innovation ;  \nAprès avis de la commission sectorielle des sciences de la santé, réunie en date du 11 juillet 2023 ;  \nAprès avis du conseil national de l'Ordre national des médecins,"", ""## Arrêté du ministre de l'enseignement supérieur, de la recherche scientifique et de l'innovation n°198-23 du 4 rejeb 1444 (26  janvier  2023)  complétant  l'arrêté  n° 2963-97  du 2chaabane 1418 (3décembre 1997) fixant la liste des diplômes reconnus équivalents au diplôme de docteur en médecine.  \nle MINIStRe De l'eNSeIGNeMeNt SUP É RIeUR, De la ReCheRChe SCIeNtIFIQUe et De l'INNOVatION,  \nVu l'arrêté du ministre de l'enseignement supérieur, de  la  recherche  scientifique  et  de  la  culture  n° 2963-97  du 2 chaabane 1418 (3décembre 1997) fixant la liste des diplômes reconnus équivalents au diplôme de docteur en médecine, tel qu'il a été modifié et complété ;  \nVu le décret n°2-21-838 du 14 rabii I 1443 (21 octobre 2021) relatif aux attributions du ministre de l'enseignement supérieur, de la recherche scientifique et de l'innovation ;  \nAprès avis de la commission sectorielle des sciences de la santé, réunie en date du 21 décembre 2022 ;  \nAprès avis du conseil national de l'Ordre national des médecins,"", ""## Arrêté du ministre de l'enseignement supérieur, de la recherche scientifique et de l'innovation n°188-23 du 4 rejeb 1444 (26  janvier  2023)  complétant  l'arrêté  n° 2963-97  du 2chaabane 1418 (3décembre 1997) fixant la liste des diplômes reconnus équivalents au diplôme de docteur en médecine.  \nle MINIStRe De l'eNSeIGNeMeNt SUP É RIeUR, De la ReCheRChe SCIeNtIFIQUe et De l'INNOVatION,  \nVu l'arrêté du ministre de l'enseignement supérieur, de  la  recherche  scientifique  et  de  la  culture  n° 2963-97  du 2 chaabane 1418 (3décembre 1997) fixant la liste des diplômes reconnus équivalents au diplôme de docteur en médecine, tel qu'il a été modifié et complété ;  \nVu le décret n°2-21-838 du 14 rabii I 1443 (21 octobre 2021) relatif aux attributions du ministre de l'enseignement supérieur, de la recherche scientifique et de l'innovation ;  \nAprès avis de la commission sectorielle des sciences de la santé, réunie en date du 21 décembre 2022 ;  \nAprès avis du conseil national de l'Ordre national des médecins,"", ""## Arrêté du ministre de l'enseignement supérieur, de la  \nrecherche scientifique  et  de  l'innovation  n° 2067-25  \ndu 19 safar 1447 (13 août 2025) complétant  \nl 'arrêté  n° 2963-97  du  2 chaabane  1418  \n(3 décembre 1997) fixant la liste des diplômes  \nreconnus équivalents au diplôme de docteur en  \nmédecine. .......................................................  \n2584"", ""## Arrêté du ministre de l'enseignement supérieur, de la recherche scientifique et de l'innovation n°610-23 du 9 chaabane 1444 (2 mars 2023) complétant l'arrêté n°2963-97 du 2chaabane 1418 (3décembre 1997) fixant la liste des diplômes reconnus équivalents au diplôme de docteur en médecine.  \nle MINIStRe De l'eNSeIGNeMeNt SUP É RIeUR, De la ReCheRChe SCIeNtIFIQUe et De l'INNOVatION,  \nVu l'arrêté du ministre de l'enseignement supérieur, de  la  recherche  scientifique  et  de  la  culture  n° 2963-97  du 2 chaabane 1418 (3décembre 1997) fixant la liste des diplômes reconnus équivalents au diplôme de docteur en médecine, tel qu'il a été modifié et complété ;  \nVu le décret n°2-21-838 du 14 rabii I 1443 (21 octobre 2021) relatif aux attributions du ministre de l'enseignement supérieur, de la recherche scientifique et de l'innovation ;  \nAprès avis de la commission sectorielle des sciences de la santé, réunie en date du 2 février 2023 ;  \nAprès avis du conseil national de l'Ordre national des médecins,"", ""## Arrêté du ministre de l'enseignement supérieur, de la recherche scientifique et de l'innovation n°609-23 du 9 chaabane 1444 (2 mars 2023) complétant l'arrêté n°2963-97 du 2chaabane 1418 (3décembre 1997) fixant la liste des diplômes reconnus équivalents au diplôme de docteur en médecine.  \nle MINIStRe De l'eNSeIGNeMeNt SUP É RIeUR, De la ReCheRChe SCIeNtIFIQUe et De l'INNOVatION,  \nVu l'arrêté du ministre de l'enseignement supérieur, de  la  recherche  scientifique  et  de  la  culture  n° 2963-97  du 2 chaabane 1418 (3décembre 1997) fixant la liste des diplômes reconnus équivalents au diplôme de docteur en médecine, tel qu'il a été modifié et complété ;  \nVu le décret n°2-21-838 du 14 rabii I 1443 (21 octobre 2021) relatif aux attributions du ministre de l'enseignement supérieur, de la recherche scientifique et de l'innovation ;  \nAprès avis de la commission sectorielle des sciences de la santé, réunie en date du 2 février 2023 ;  \nAprès avis du conseil national de l'Ordre national des médecins,"", ""## Arrêté du ministre de l'enseignement supérieur, de la recherche scientifique et de l'innovation n°2312-23 du 26 safar 1445 (12 septembre 2023) complétant l'arrêté n°2963-97 du 2chaabane 1418 (3décembre 1997) fixant la liste des diplômes reconnus équivalents au diplôme de docteur en médecine.  \nle MINIStRe De l'eNSeIGNeMeNt SUP É RIeUR, De la ReCheRChe SCIeNtIFIQUe et De l'INNOVatION,  \nVu l'arrêté du ministre de l'enseignement supérieur, de  la  recherche  scientifique  et  de  la  culture  n° 2963-97  du 2 chaabane 1418 (3décembre 1997) fixant la liste des diplômes reconnus équivalents au diplôme de docteur en médecine, tel qu'il a été modifié et complété ;  \nVu le décret n°2-21-838 du 14 rabii I 1443 (21 octobre 2021) relatif aux attributions du ministre de l'enseignement supérieur, de la recherche scientifique et de l'innovation ;  \nAprès avis de la commission sectorielle des sciences de la santé, réunie en date du 11 juillet 2023 ;  \nAprès avis du conseil national de l'Ordre national des médecins,"", ""## Arrêté du ministre de l'enseignement supérieur, de la  \nrecherche scientifique  et  de  l'innovation  n° 2061-25  \ndu 19 safar 1447 (13 août 2025) complétant  \nl 'arrêté  n° 2963-97  du  2 chaabane  1418  \n(3 décembre 1997) fixant la liste des diplômes  \nreconnus équivalents au diplôme de docteur  \nen médecine ......................................................  \n2581""]"," 1. Les diplômes reconnus comme équivalents au diplôme de docteur en médecine selon l'arrêté du ministre de l'enseignement supérieur du 26 janvier 2023 ne sont pas spécifiés dans les extraits fournis.

2. Sources citées : Aucune information sur cette date n'est disponible dans les extraits fournis.","L'extrait ne fournit pas de détails sur la liste des diplômes reconnus comme équivalents au diplôme de docteur en médecine selon l'arrêté du ministre de l'enseignement supérieur du 26 janvier 2023. Il mentionne uniquement l'existence de cet arrêté, n° 194-23, mais ne précise pas les diplômes concernés.",0.0909090909,1.0,0.5,0.0,gpt-4o-mini,bge-m3,mistral:7b,True,False,False,0.5
Quels sont les diplômes qui sont reconnus comme équivalents au diplôme de docteur en médecine selon les arrêtés récents ?,"[""## Arrêté du ministre de l'enseignement supérieur, de la recherche scientifique  et  de  l'innovation  n° 2507-25  du  1 er joumada  I  1447 (24 octobre 2025) complétant l'arrêté n°2963-97 du 2chaabane 1418 (3décembre 1997) fixant la liste des diplômes reconnus équivalents au diplôme de docteur en médecine.  \nle MINIStRe De l'eNSeIGNeMeNt SUP É RIeUR, De la ReCheRChe SCIeNtIFIQUe et De l'INNOVatION,  \nVu l'arrêté du ministre de l'enseignement supérieur, de  la  recherche  scientifique  et  de  la  culture  n° 2963-97  du 2 chaabane 1418 (3décembre 1997) fixant la liste des diplômes reconnus équivalents au diplôme de docteur en médecine, tel qu'il a été modifié et complété ;  \nVu le décret n°2-24-991 du 24 rabii II 1446 (28 octobre 2024) relatif aux attributions du ministre de l'enseignement supérieur, de la recherche scientifique et de l'innovation ;  \nAprès avis de la commission sectorielle des sciences de la santé, réunie en date du 15 septembre 2025 ;  \nAprès avis du conseil national de l'Ordre national des médecins,"", ""## Arrêté du ministre de l'enseignement supérieur, de la recherche scientifique et de l'innovation n°2802-22 du 27 rabii I 1444 (24  octobre  2022)  complétant  l'arrêté  n° 2963-97  du 2chaabane 1418 (3décembre 1997) fixant la liste des diplômes reconnus équivalents au diplôme de docteur en médecine.  \nle MINIStRe De l'eNSeIGNeMeNt SUP É RIeUR, De la ReCheRChe SCIeNtIFIQUe et De l'INNOVatION,  \nVu l'arrêté du ministre de l'enseignement supérieur, de  la  recherche  scientifique  et  de  la  culture  n° 2963-97  du 2 chaabane 1418 (3décembre 1997) fixant la liste des diplômes reconnus équivalents au diplôme de docteur en médecine, tel qu'il a été complété ;  \nVu le décret n°2-21-838 du 14 rabii I 1443 (21 octobre 2021) relatif aux attributions du ministre de l'enseignement supérieur, de la recherche scientifique et de l'innovation ;  \nAprès avis de la commission sectorielle des sciences de la santé, réunie en date du 27 juillet 2022 ;  \nAprès avis du conseil national de l'Ordre national des médecins,"", ""## Arrêté du ministre de l'enseignement supérieur, de la recherche scientifique et de l'innovation n°2806-22 du 27 rabii I 1444 (24  octobre  2022)  complétant  l'arrêté  n° 2963-97  du 2chaabane 1418 (3décembre 1997) fixant la liste des diplômes reconnus équivalents au diplôme de docteur en médecine.  \nle MINIStRe De l'eNSeIGNeMeNt SUP É RIeUR, De la ReCheRChe SCIeNtIFIQUe et De l'INNOVatION,  \nVu l'arrêté du ministre de l'enseignement supérieur, de  la  recherche  scientifique  et  de  la  culture  n° 2963-97  du 2 chaabane 1418 (3décembre 1997) fixant la liste des diplômes reconnus équivalents au diplôme de docteur en médecine, tel qu'il a été complété ;  \nVu le décret n°2-21-838 du 14 rabii I 1443 (21 octobre 2021) relatif aux attributions du ministre de l'enseignement supérieur, de la recherche scientifique et de l'innovation ;  \nAprès avis de la commission sectorielle des sciences de la santé, réunie en date du 27 juillet 2022 ;  \nAprès avis du conseil national de l'Ordre national des médecins,"", ""## Arrêté du ministre de l'enseignement supérieur, de la recherche scientifique et de l'innovation n°201-23 du 4 rejeb 1444 (26  janvier  2023)  complétant  l'arrêté  n° 2963-97  du 2chaabane 1418 (3décembre 1997) fixant la liste des diplômes reconnus équivalents au diplôme de docteur en médecine.  \nle MINIStRe De l'eNSeIGNeMeNt SUP É RIeUR, De la ReCheRChe SCIeNtIFIQUe et De l'INNOVatION,  \nVu l'arrêté du ministre de l'enseignement supérieur, de  la  recherche  scientifique  et  de  la  culture  n° 2963-97  du 2 chaabane 1418 (3décembre 1997) fixant la liste des diplômes reconnus équivalents au diplôme de docteur en médecine, tel qu'il a été modifié et complété ;  \nVu le décret n°2-21-838 du 14 rabii I 1443 (21 octobre 2021) relatif aux attributions du ministre de l'enseignement supérieur, de la recherche scientifique et de l'innovation ;  \nAprès avis de la commission sectorielle des sciences de la santé, réunie en date du 21 décembre 2022 ;  \nAprès avis du conseil national de l'Ordre national des médecins,"", ""## Arrêté du ministre de l'enseignement supérieur, de la recherche scientifique et de l'innovation n°2330-23 du 29 safar 1445 (15 septembre 2023) complétant l'arrêté n°2963-97 du 2chaabane 1418 (3décembre 1997) fixant la liste des diplômes reconnus équivalents au diplôme de docteur en médecine.  \nle MINIStRe De l'eNSeIGNeMeNt SUP É RIeUR, De la ReCheRChe SCIeNtIFIQUe et De l'INNOVatION,  \nVu l'arrêté du ministre de l'enseignement supérieur, de  la  recherche  scientifique  et  de  la  culture  n° 2963-97  du 2 chaabane 1418 (3décembre 1997) fixant la liste des diplômes reconnus équivalents au diplôme de docteur en médecine, tel qu'il a été modifié et complété ;  \nVu le décret n°2-21-838 du 14 rabii I 1443 (21 octobre 2021) relatif aux attributions du ministre de l'enseignement supérieur, de la recherche scientifique et de l'innovation ;  \nAprès avis de la commission sectorielle des sciences de la santé, réunie en date du 11 juillet 2023 ;  \nAprès avis du conseil national de l'Ordre national des médecins,"", ""## Arrêté du ministre de l'enseignement supérieur, de la recherche scientifique et de l'innovation n°2335-23 du 29 safar 1445 (15 septembre 2023) complétant l'arrêté n°2963-97 du 2chaabane 1418 (3décembre 1997) fixant la liste des diplômes reconnus équivalents au diplôme de docteur en médecine.  \nle MINIStRe De l'eNSeIGNeMeNt SUP É RIeUR, De la ReCheRChe SCIeNtIFIQUe et De l'INNOVatION,  \nVu l'arrêté du ministre de l'enseignement supérieur, de  la  recherche  scientifique  et  de  la  culture  n° 2963-97  du 2 chaabane 1418 (3décembre 1997) fixant la liste des diplômes reconnus équivalents au diplôme de docteur en médecine, tel qu'il a été modifié et complété ;  \nVu le décret n°2-21-838 du 14 rabii I 1443 (21 octobre 2021) relatif aux attributions du ministre de l'enseignement supérieur, de la recherche scientifique et de l'innovation ;  \nAprès avis de la commission sectorielle des sciences de la santé, réunie en date du 11 juillet 2023 ;  \nAprès avis du conseil national de l'Ordre national des médecins,"", ""## Arrêté du ministre de l'enseignement supérieur, de la recherche scientifique et de l'innovation n°195-23 du 4 rejeb 1444 (26  janvier  2023)  complétant  l'arrêté  n° 2963-97  du 2chaabane 1418 (3décembre 1997) fixant la liste des diplômes reconnus équivalents au diplôme de docteur en médecine.  \nle MINIStRe De l'eNSeIGNeMeNt SUP É RIeUR, De la ReCheRChe SCIeNtIFIQUe et De l'INNOVatION,  \nVu l'arrêté du ministre de l'enseignement supérieur, de  la  recherche  scientifique  et  de  la  culture  n° 2963-97  du 2 chaabane 1418 (3décembre 1997) fixant la liste des diplômes reconnus équivalents au diplôme de docteur en médecine, tel qu'il a été  modifié et complété ;  \nVu le décret n°2-21-838 du 14 rabii I 1443 (21 octobre 2021) relatif aux attributions du ministre de l'enseignement supérieur, de la recherche scientifique et de l'innovation ;  \nAprès avis de la commission sectorielle des sciences de la santé, réunie en date du 21 décembre 2022 ;  \nAprès avis du conseil national de l'Ordre national des médecins,"", ""## Arrêté du ministre de l'enseignement supérieur, de la recherche scientifique et de l'innovation n°2817-22 du 27 rabii I 1444 (24  octobre  2022)  complétant  l'arrêté  n° 2963-97  du 2chaabane 1418 (3décembre 1997) fixant la liste des diplômes reconnus équivalents au diplôme de docteur en médecine.  \nle MINIStRe De l'eNSeIGNeMeNt SUP É RIeUR, De la ReCheRChe SCIeNtIFIQUe et De l'INNOVatION,  \nVu l'arrêté du ministre de l'enseignement supérieur, de  la  recherche  scientifique  et  de  la  culture  n° 2963-97  du 2 chaabane 1418 (3décembre 1997) fixant la liste des diplômes reconnus équivalents au diplôme de docteur en médecine, tel qu'il a été complété ;  \nVu le décret n°2-21-838 du 14 rabii I 1443 (21 octobre 2021) relatif aux attributions du ministre de l'enseignement supérieur, de la recherche scientifique et de l'innovation ;  \nAprès avis de la commission sectorielle des sciences de la santé, réunie en date du 27 juillet 2022 ;  \nAprès avis du conseil national de l'Ordre national des médecins,"", ""## Arrêté du ministre de l'enseignement supérieur, de la recherche scientifique et de l'innovation n°188-23 du 4 rejeb 1444 (26  janvier  2023)  complétant  l'arrêté  n° 2963-97  du 2chaabane 1418 (3décembre 1997) fixant la liste des diplômes reconnus équivalents au diplôme de docteur en médecine.  \nle MINIStRe De l'eNSeIGNeMeNt SUP É RIeUR, De la ReCheRChe SCIeNtIFIQUe et De l'INNOVatION,  \nVu l'arrêté du ministre de l'enseignement supérieur, de  la  recherche  scientifique  et  de  la  culture  n° 2963-97  du 2 chaabane 1418 (3décembre 1997) fixant la liste des diplômes reconnus équivalents au diplôme de docteur en médecine, tel qu'il a été modifié et complété ;  \nVu le décret n°2-21-838 du 14 rabii I 1443 (21 octobre 2021) relatif aux attributions du ministre de l'enseignement supérieur, de la recherche scientifique et de l'innovation ;  \nAprès avis de la commission sectorielle des sciences de la santé, réunie en date du 21 décembre 2022 ;  \nAprès avis du conseil national de l'Ordre national des médecins,"", ""## Arrêté du ministre de l'enseignement supérieur, de la recherche scientifique et de l'innovation n°2806-22 du 27 rabii I 1444 (24  octobre  2022)  complétant  l'arrêté  n° 2963-97  du 2chaabane 1418 (3décembre 1997) fixant la liste des diplômes reconnus équivalents au diplôme de docteur en médecine.  \nle MINIStRe De l'eNSeIGNeMeNt SUP É RIeUR, De la ReCheRChe SCIeNtIFIQUe et De l'INNOVatION,  \nVu l'arrêté du ministre de l'enseignement supérieur, de  la  recherche  scientifique  et  de  la  culture  n° 2963-97  du 2 chaabane 1418 (3décembre 1997) fixant la liste des diplômes reconnus équivalents au diplôme de docteur en médecine, tel qu'il a été complété ;  \nVu le décret n°2-21-838 du 14 rabii I 1443 (21 octobre 2021) relatif aux attributions du ministre de l'enseignement supérieur, de la recherche scientifique et de l'innovation ;  \nAprès avis de la commission sectorielle des sciences de la santé, réunie en date du 27 juillet 2022 ;  \nAprès avis du conseil national de l'Ordre national des médecins,"", ""## Arrêté du ministre de l'enseignement supérieur, de la recherche scientifique et de l'innovation n°2811-22 du 27 rabii I 1444 (24  octobre  2022)  complétant  l'arrêté  n° 2963-97  du 2chaabane 1418 (3décembre 1997) fixant la liste des diplômes reconnus équivalents au diplôme de docteur en médecine.  \nle MINIStRe De l'eNSeIGNeMeNt SUP É RIeUR, De la ReCheRChe SCIeNtIFIQUe et De l'INNOVatION,  \nVu l'arrêté du ministre de l'enseignement supérieur, de  la  recherche  scientifique  et  de  la  culture  n° 2963-97  du 2 chaabane 1418 (3décembre 1997) fixant la liste des diplômes reconnus équivalents au diplôme de docteur en médecine, tel qu'il a été complété ;  \nVu le décret n°2-21-838 du 14 rabii I 1443 (21 octobre 2021) relatif aux attributions du ministre de l'enseignement supérieur, de la recherche scientifique et de l'innovation ;  \nAprès avis de la commission sectorielle des sciences de la santé, réunie en date du 27 juillet 2022 ;  \nAprès avis du conseil national de l'Ordre national des médecins,"", ""## Arrêté du ministre de l'enseignement supérieur, de la recherche scientifique et de l'innovation n°1609-25 du 23 hija 1446 (20  juin  2025)  complétant  l'arrêté  n° 2963-97  du 2chaabane 1418 (3décembre 1997) fixant la liste des diplômes reconnus équivalents au diplôme de docteur en médecine.  \nle MINIStRe De l'eNSeIGNeMeNt SUP É RIeUR, De la ReCheRChe SCIeNtIFIQUe et De l'INNOVatION,  \nVu l'arrêté du ministre de l'enseignement supérieur, de  la  recherche  scientifique  et  de  la  culture  n° 2963-97  du 2 chaabane 1418 (3décembre 1997) fixant la liste des diplômes reconnus équivalents au diplôme de docteur en médecine, tel qu'il a été modifié et complété ;  \nVu le décret n°2-24-991 du 24 rabii II 1446 (28 octobre 2024) relatif aux attributions du ministre de l'enseignement supérieur, de la recherche scientifique et de l'innovation ;  \nAprès avis de la commission sectorielle des sciences de la santé, réunie en date du 30 avril 2025 ;  \nAprès avis du conseil national de l'Ordre national des médecins,""]"," 1. Les diplômes reconnus comme équivalents au diplôme de docteur en médecine selon les arrêtés récents sont :
   - Arrêté du ministre de l'enseignement supérieur, de la recherche scientifique et de l'innovation n°2806-22, 27 rabii I 1444 (24 octobre 2022)
   - Arrêté du ministre de l'enseignement supérieur, de la recherche scientifique et de l'innovation n°2809-22, 27 rabii I 1444 (24 octobre 2022)
   - Arrêté du ministre de l'enseignement supérieur, de la recherche scientifique et de l'innovation n°2811-22, 27 rabii I 1444 (24 octobre 2022)
   - Arrêté du ministre de l'enseignement supérieur, de la recherche scientifique et de l'innovation n°2816-22, 31 rabii I 1444 (19 novembre 2022)
   - Arrêté du ministre de l'enseignement supérieur, de la recherche scientifique et de l'innovation n°2857-22, 12 shawwal 1443 (23 mars 2023)
   - Arrêté du ministre de l'enseignement supérieur, de la recherche scientifique et de l'innovation n°2936-23, 7 rabi I 1445 (23 février 2024)
   - Arrêté du ministre de l'enseignement supérieur, de la recherche scientifique et de l'innovation n°1583-24, 9 jumada al-awal 1446 (2 avril 2025)
   - Arrêté du ministre de l'enseignement supérieur, de la recherche scientifique et de l'innovation n°1609-25, 23 hija 1446 (20 juin 2025)

2. Sources citées :
   - Extraits des arrêtés du ministère de l'enseignement supérieur, de la recherche scientifique et de l'innovation mentionnés dans les réponses.",L'extrait ne fournit pas la liste des diplômes reconnus comme équivalents au diplôme de docteur en médecine. Il fait seulement référence à l'arrêté et au décret qui régissent la reconnaissance de ces diplômes.,0.7354978354886417,1.0,0.2,0.998009548466613,gpt-4o-mini,bge-m3,mistral:7b,True,False,False,0.5
Est-ce que Wana Corporate a le droit de fixer librement les prix de ses services au Maroc ?,"[""###### 11.1  Liberté des prix et commercialisation  \n- 11.1.1  Conformément à la réglementation en vigueur au Maroc et sous réserve des exceptions visées aux articles 11.1.3 et 11.1.4 ci-dessous, Wana Corporate bénéficie des droits ciaprès:\n- la liberté de fixation des prix des services offerts à ses clients ;\n- la  liberté  du  système  global  de  tarification,  qui  peut  notamment  comprendre  des réductions en fonction du volume ;\n- la liberté de la politique de commercialisation.  \n- 11.1.2  Wana Corporate communique à l'ANRT les tarifs de détail qu'il établit trente (30) jours au moins avant la date à laquelle ces tarifs doivent entrer en vigueur.\n- 11.1.3  L'ANRT peut exiger de Wana Corporate qu'il modifie les tarifs qu'il envisage d'appliquer à  ses  services  s'il  apparaît  que  ces  changements  tarifaires  ne  respectent  pas, notamment, les règles d'une concurrence loyale, conformément à la réglementation en vigueur en la matière au Maroc.\n- 11.1.4  Dans le cadre de ses relations contractuelles avec d'éventuels sous-traitants, distributeurs,  revendeurs  ou  agents  commerciaux,  Wana  Corporate  doit  veiller  au respect des engagements de ces derniers au regard :\n- de l'égalité d'accès et de traitement des clients ;\n- de la structure tarifaire éditée par Wana Corporate;\n- du  respect  de  la  confidentialité  des  informations  détenues  sur  les  clients,  dans  le respect notamment des dispositions de la loi n°09-08 précitée et des textes pris pour son application.  \nEn tout état de cause, Wana Corporate conserve la responsabilité de la fourniture du service à ses clients."", ""###### 11.2  Principes de facturation  \n- 11.2.1  Sur le territoire marocain, le coût de la communication est totalement imputé au poste demandeur,  à  l'exception  des  offres  commerciales  prévoyant  que  le  coût  de  la communication soit également supporté par le destinataire ou qu'il  soit  intégralement payé par le destinataire.  \nEn dehors du territoire marocain, les principes de tarification prévus dans les accords auxquels le  Maroc  est  Partie  ou  conclus  par  Wana  Corporate  s'appliquent,  dans  le respect des règles de transparence vis-à-vis de l'abonné.  \n- 11.2.2  Wana Corporate est tenu de permettre à ses clients de pouvoir identifier sur la facture les  montants  taxés  pour  chaque  catégorie  de  tarifs  appliqués.  Il  fournit  une  facture détaill ée des services offerts à tout abonné du réseau qui lui en fait la demande.  \nLes  facturations  des  divers  services  fournis  aux  clients  sont  séparées  et  clairement identifiées.  \n- 11.2.3  L'ANRT peut, à tout moment, procéder à la vérification de tout ou partie des équipements et  systèmes  informatiques  de  facturation,  des  modes  opératoires,  des  fichiers  de données  et  des  documents  comptables  utilisés  dans  la  facturation  des  services  de t él écommunications."", ""###### 11.3  Publicité des tarifs  \nWana Corporate a l'obligation  d'informer  le  public  de  ses  tarifs  et  de  ses  conditions  gén érales d'offres de services dans le respect de la réglementation en vigueur au Maroc.  \nWana  Corporate  est  tenu  de  publier  les  tarifs  de  fourniture  de  chaque  catégorie  de service,  de  connexion, de  maintien,  d'adaptation  ou  de  réparation  de tout équipement terminal commercialisé par lui-même et connecté à  son réseau.  \nLa notice portant publicité des tarifs se fera dans les conditions suivantes :  \n- Un exemplaire de la notice est transmis à l'ANRT au moins trente (30) jours avant l'entrée  en  vigueur  de  tout  changement  envisagé.  L'ANRT  peut  exiger  de  Wana Corporate d'apporter des modifications aux tarifs de ses services ou des conditions de  vente,  s'il  apparaît  que  ces  changements  ne  respectent  pas  les  règles  de concurrence loyale. Ils doivent être justifiés à la demande de l'ANRT au regard des él é ments de coût y afférents.  \nPage 13 sur 21  \n- Un exemplaire de la notice définitive, librement consultable, est mis à la disposition du public dans chaque agence commerciale ou point de vente d'un sous-traitant chargé de la commercialisation des services en question.\n- Un  exemplaire  de  la  notice  définitive  ou  les  extraits  appropriés  sont  remis à  toute personne qui en fait la demande.\n- Chaque fois qu'il y a modification des tarifs, les nouveaux tarifs et la date de leur entrée en vigueur sont clairement indiqués."", ""###### 2.16  Zone de couverture  \nL'ensemble des localités ou axes routiers ou ferroviaires du Royaume du Maroc où Wana Corporate s'engage à offrir, par le biais d'infrastructures terrestres, les services objet du présent cahier des charges, et ce, conformément à la licence qui lui est attribuée."", ""###### 9.4.5 Interconnexion  \nEn  application  de  l'article  11  de  la  loi  n°24-96  précitée  et  des  textes  pris  pour  son application, Wana Corporate bénéficie du droit d'interconnecter son réseau à ceux des autres exploitants marocains titulaires de licences d'établissement et d'exploitation de réseaux publics de tél écommunications au Royaume du Maroc.  \nWana Corporate fournit les prestations d'interconnexion dans les conditions prévues par la l égislation et la réglementation en vigueur.  \nLes conditions techniques, financières et administratives sont fixées dans des contrats librement négociés entre les exploitants de réseaux publics de tél écommunications dans le respect de leurs cahiers des charges respectifs.  \nLes demandes et les contrats d'interconnexion ainsi que les litiges y relatifs sont traités conformément à la législation et la réglementation en vigueur."", '###### 7.2 Concurrence loyale  \nWana Corporate est obligé par les dispositions législatives et réglementaires relatives à la concurrence en vigueur au Maroc.', ""###### 11.1  Liberté des prix et commercialisation  \n- 11.1.1  Conformément à la réglementation en vigueur au Maroc et sous réserve des exceptions visées aux articles 11.1.3 et 11.1.4 ci-dessous, Wana Corporate bénéficie des droits ciaprès:\n- la liberté de fixation des prix des services offerts à ses clients ;\n- la  liberté  du  système  global  de  tarification,  qui  peut  notamment  comprendre  des réductions en fonction du volume ;\n- la liberté de la politique de commercialisation.  \n- 11.1.2  Wana Corporate communique à l'ANRT les tarifs de détail qu'il établit trente (30) jours au moins avant la date à laquelle ces tarifs doivent entrer en vigueur.\n- 11.1.3  L'ANRT peut exiger de Wana Corporate qu'il modifie les tarifs qu'il envisage d'appliquer à  ses  services  s'il  apparaît  que  ces  changements  tarifaires  ne  respectent  pas, notamment, les règles d'une concurrence loyale, conformément à la réglementation en vigueur en la matière au Maroc.\n- 11.1.4  Dans le cadre de ses relations contractuelles avec d'éventuels sous-traitants, distributeurs,  revendeurs  ou  agents  commerciaux,  Wana  Corporate  doit  veiller  au respect des engagements de ces derniers au regard :\n- de l'égalité d'accès et de traitement des clients ;\n- de la structure tarifaire éditée par Wana Corporate;\n- du  respect  de  la  confidentialité  des  informations  détenues  sur  les  clients,  dans  le respect notamment des dispositions de la loi n°09-08 précitée et des textes pris pour son application.  \nEn tout état de cause, Wana Corporate conserve la responsabilité de la fourniture du service à ses clients."", ""###### 11.1 Liberté des prix et commercialisation  \n- 11.1.1 Conformément à la réglementation en vigueur au Maroc et sous réserve des exceptions visées aux articles  11.1.3  et  11.1.4  ci-dessous,  Médi  Telecom  bén éficie  des  droits  ciaprès:\n- la liberté de fixation des prix des services offerts à ses clients ;\n- la  liberté  du  système  global  de  tarification,  qui  peut  notamment  comprendre  des réductions en fonction du volume ;\n- la liberté de la politique de commercialisation.  \nPage 11 sur 20  \n- 11.1.2 Médi Telecom communique à l'ANRT les tarifs de détail qu'il établit trente (30) jours au moins avant la date à laquelle ces tarifs doivent entrer en vigueur.\n- 11.1.3 L'ANRT peut exiger de Médi Telecom qu'il modifie les tarifs qu'il envisage d'appliquer à ses services s'il apparaît que  ces changements  tarifaires ne respectent pas, notamment, les règles d'une concurrence loyale, conformément à la réglementation en vigueur en la matière au Maroc.\n- 11.1.4 Dans  le cadre de ses relations contractuelles avec d'éventuels sous-traitants, distributeurs, revendeurs ou agents commerciaux, Médi Telecom doit veiller au respect des engagements de ces derniers au regard :\n- de l'égalité d'accès et de traitement des clients ;\n- de la structure tarifaire éditée par Médi Telecom;\n- du  respect  de  la  confidentialité  des  informations  détenues  sur  les  clients,  dans  le respect notamment des dispositions de la loi n°09-08 précitée et des textes pris pour son application.  \nEn tout  état de cause, Médi Telecom conserve la responsabilité de la fourniture du service à ses clients."", ""### 2- La libéralisation du marché de l'assurance par la loi sur la liberté des prix et de la concurrence  \nLa libéralisation des prix et du commerce extérieur, ainsi que la promotion des exportations étaient parmi les priorités économiques de notre pays à la fin du siècle dernier, qui a procédé à une réforme de sa politique économique en limitant notamment l'intervention directe de l'Administration dans l'économie.  \nDans  ce  cadre,  les  taux  de  commissionnement  des  intermédiaires  d'assurances  ont été libéralisés avec l'adoption de la première loi n° 06-99 sur la liberté des prix et de la concurrence en 2001 qui a consacré la liberté des prix en maintenant uniquement 15 groupes de produits réglementés.  \nQuant aux tarifs de toutes les branches de l'assurance, ils n'ont été libéralisés qu'en 2006, suite  à  l'extinction  de  la  période  transitoire  de  5  ans  accordée  par  la  loi  n°  06-99  pour  la libéralisation des prix de certains produits et services.  \nL'objectif de cette réforme étant que la liberté des prix soit consacrée comme le principe de  base  permettant  une  fixation  des  prix  par  le  marché  moyennant  l'équilibre  issu  de  la confrontation de l'offre et de la demande.  \n22  \nrelatif à l'état de la concurrence dans le marché de l'assurance au Maroc"", ""### Le Conseil de la concurrence,  \n- vu la loi n°104-12 relative à la liberté des prix et de la concurrence promulguée par le Dahir  n°  1-14-116  du  2  Ramadan  1435  (30  juin  2014),  telle  qu'elle  a  été  modifiée  et complétée ;\n- vu la loi n° 20-13 relative au Conseil de la concurrence promulguée par le Dahir n° 1-14-117 du 2 Ramadan 1435 (30 juin 2014), telle qu'elle a été modifiée et complétée ;\n- vu le décret n° 2-14-652 du 8 Safar 1436 (1 er décembre 2014) pris pour l'application de la loi n° 104-12 sur la liberté des prix et de la concurrence, tel qu'il a été modifié et complété ;\n- vu le décret n° 2-15-109 du 16 Chaabane 1436 (4 juin 2015) pris pour l'application de la loi n° 20-13 relative au Conseil de la concurrence, tel qu'il a été modifié et complété ;\n- en application de l'article 21 du Règlement Intérieur du Conseil de la concurrence ;\n-  après  constatation  du  quorum  par  le  président  du  Conseil  de  la  concurrence, conformément aux dispositions de l'article 31 du Règlement Intérieur du Conseil ;\n-  vu  la  décision  du  Conseil  de  la  concurrence  n°  003/D/2022  du  14  joumada  II  1443 (17 janvier 2022) relative à son initiative de donner un avis sur l'état de la concurrence dans le marché de l'assurance au Maroc ;\n- vu la décision du rapporteur général du Conseil, Monsieur Khalid EL BOUAYACHI n° 073/2023, portant  désignation  de  Monsieur  Abdelilah  QACHCHACHI  et  de  Mesdames  Bahija STIOUATE  et  Assia  HADDADI,  rapporteurs  en  charge  du  dossier,  conformément  aux dispositions de l'article 27 de la loi n° 104-12 relative à la liberté des prix et de la concurrence, telle qu'elle a été modifiée et complétée ;\n- après présentation du projet d'avis par le Rapporteur Général et les Rapporteurs chargés du dossier de la demande d'avis, lors de la 39 ème réunion du collège du Conseil, tenue en date du 9 hija 1444 (28 juin 2023) ;\n- après délibération lors de la 39 ème réunion du collège du Conseil, tenue le 9 hija 1444 (28 juin 2023), conformément aux dispositions de l'article 14 de la loi n° 20-13 relative au Conseil de la concurrence, telle qu'elle a été modifiée et complétée."", ""### · Pour les personnes morales :  \n- être régies par le droit marocain et avoir leur siège au Maroc ;\n-  avoir  cinquante  pour  cent  (50%)  au  moins  du  capital  détenu  par  des  personnes physiques de nationalité marocaine ou des personnes morales de droit marocain, sous réserve des accords de libre-échange, passés par le Maroc avec d'autres pays, dûment ratifiés et publiés au « Bulletin officiel »."", '###### 7.2 Concurrence loyale  \nMédi Telecom est obligé par les dispositions législatives et réglementaires relatives à la concurrence en vigueur au Maroc.']"," 1. Oui, Wana Corporate a le droit de fixer librement les prix de ses services au Maroc depuis la libéralisation du marché de l'assurance en 2006 et la loi sur la liberté des prix et de la concurrence promulguée en 2014.

2. Sources citées :
   - Avis du Conseil de la concurrence n° A/1/23 (relatif à l'état de la concurrence dans le marché de l'assurance au Maroc)
   - Loi n° 06-99 sur la liberté des prix et de la concurrence (2001)
   - Loi n° 104-12 relative à la liberté des prix et de la concurrence (2014)","Oui, Wana Corporate a le droit de fixer librement les prix de ses services au Maroc, conformément à l'article 11.1.1. Toutefois, cela est sous réserve des exceptions visées aux articles 11.1.3 et 11.1.4.",0.8552579364972458,1.0,0.5,0.9793379782258794,gpt-4o-mini,bge-m3,mistral:7b,True,False,False,0.5
Quelle société a reçu l'autorisation de vendre des plants certifiés d' différentes espèces de plantes selon l'arrêté du 18 avril 2025 ?,"[""## Arrêté  du  ministre  de  l'agriculture,  de  la  pêche  \nmaritime,  du  développement  rural  et  des  \neaux et forêts n° 2188-25 du 16 rabii I 1447  \n(9 septembre 2025) portant agrément de la société  \n« SMART AGRICULTURE LEADER » pour  \ncommercialiser des plants certifiés de vigne, de  \nfiguier,  de  figuier  de  barbarie,  de  grenadier,  \ndes rosacées à pépins et des semences et plants  \ncertifiés des rosacées à noyau et d'agrumes et  \ndes plants certifiés des espèces à fruits rouges.  \n2535  \n## Arrêté  du  ministre  de  l'agriculture,  de  la  pêche  \nmaritime,  du  développement  rural  et  des  \neaux et forêts n° 2189-25 du 16 rabii I 1447  \n(9  septembre 2025) portant agrément de la  \nsociété  « VILMORIN-MIKADO ATLAS »  \npour commercialiser des semences certifiées  \ndu maïs et des semences standard de légumes.  \n2536  \n## Arrêté  du  ministre  de  l'agriculture,  de  la  pêche  \nmaritime,  du  développement  rural  et  des  \neaux et forêts n° 2190-25 du 16 rabii I 1447  \n(9 septembre 2025) portant agrément de la société  \n« BEJO MAGHREB » pour commercialiser des  \nsemences standard de légumes.  ......................  \n2537  \nCréation et exploitation de fermes aquacoles."", ""## Arrêté du ministre de l'agriculture, de la pêche maritime, du développement rural et des eaux et forêts n°1660-25 du 29 hija 1446 (26 juin 2025) portant agrément de la société « APHYSEM» pour commercialiser des plants certifiés d'olivier, de vigne, des rosacées à pépins, des semences et plants certifiés des rosacées à noyau et d'agrumes.  \nle  MINIStRe  De  l'aGRICUltURe,  De  la  P Ê Che MaRItIMe, DU DÉVelOPPeMeNt RURal et DeS eaUX et FOR Ê tS,  \nVu le dahir n°1-69-169 du 10 joumada I 1389 (25 juillet 1969) réglementant  la  production  et  la  commercialisation  de semences et de plants, tel qu'il a été modifié, notamment ses articles premier, 2 et 5 ;  \nVu la loi n° 25-08 portant création de l'Office national de sécurité sanitaire  des produits alimentaires promulguée par le dahir n°1-09-20 du 22 safar 1430 (18 février 2009), notamment son article 2 ;  \nVu  l'arrêté  du  ministre  de  l'agriculture  et  du développement rural n°2098-03 du 8 chaoual 1424 (3 décembre 2003) portant homologation du règlement technique relatif à la production, au contrôle, au conditionnement et à la certification des semences et des plants d'agrumes ;  \nVu l'arrêté du ministre de l'agriculture et du développement rural n°2100-03 du 8 chaoual 1424 (3 décembre 2003)  portant homologation du règlement technique relatif à la production, au contrôle et à la certification des plants de vigne ;  \nVu l'arrêté du ministre de l'agriculture, du développement rural et des pêches maritimes n° 2110-05 du 21 ramadan 1426 (25  octobre  2005)  portant  homologation  du  règlement technique relatif à la production, au contrôle et à la certification des plants d'olivier ;  \nVu l'arrêté  du  ministre de l'agriculture et de la pêche maritime n°2157-11 du 16 chaabane 1432 (18 juillet 2011) portant homologation du règlement technique relatif à la production, au contrôle, au conditionnement et à la certification des plants des rosacées à pépins ;  \nVu l'arrêté du ministre de l'agriculture, de la pêche maritime, du développement rural et des eaux et forêts n°1437-22 du 25 chaoual 1443 (26 mai 2022) portant homologation du règlement technique relatif à la production, au contrôle, au conditionnement et à la certification des semences et plants des rosacées à noyau ;  \nVu l'arrêté du ministre  de  l'agriculture et  de la  réforme agraire  n°966-93 du 28 chaoual 1413 (20 avril 1993) fixant les conditions d'importation et de commercialisation des semences à cultiver au Maroc, tel qu'il a été modifié et complété,"", ""## Arrêté du ministre de l'agriculture, de la pêche maritime, du développement rural et des eaux et forêts n°1002-25 du 18chaoual 1446 (17 avril 2025) portant agrément de la société «ZIAGRO» pour commercialiser des plants certifiés d'olivier, de vigne, de figuier, de grenadier, des rosacées à pépins, des semences et plants certifiés des rosacées à noyau et des plants certifiés des espèces à fruits rouges.  \nle  MINIStRe  De  l'aGRICUltURe,  De  la  P Ê Che MaRItIMe, DU DÉVelOPPeMeNt RURal et DeS eaUX et FOR Ê tS,  \nVu le dahir n°1-69-169 du 10 joumada I 1389 (25 juillet 1969) réglementant  la  production  et  la  commercialisation  de semences et de plants, tel qu'il a été modifié, notamment ses articles premier, 2 et 5 ;  \nVu la loi n°25-08 portant création de l'Office national de sécurité sanitaire des produits alimentaires, promulguée par le dahir n°1-09-20 du 22 safar 1430 (18 février 2009), notamment son article 2 ;  \nVu l'arrêté du ministre de l'agriculture et du développement rural n°2100-03 du 8 chaoual 1424 (3 décembre 2003) portant homologation du règlement technique relatif à la production, au contrôle et à la certification des plants de vigne ;  \nVu l'arrêté du ministre de l'agriculture, du développement rural et des pêches maritimes n°2110-05 du 21 ramadan 1426 (25 octobre  2005)  portant  homologation  du  règlement technique relatif à la production, au contrôle et à la certification des plants d'olivier ;  \nVu l'arrêté  du  ministre de l'agriculture et de la pêche maritime n°2157-11 du 16 chaabane 1432 (18 juillet 2011) portant homologation du règlement technique relatif à la production, au contrôle, au conditionnement et à la certification des plants des rosacées à pépins ;  \nVu l'arrêté du ministre de l'agriculture et de la pêche maritime n°3548-13 du 27 safar 1435 (31 décembre 2013) portant homologation du règlement technique relatif à la production, au contrôle, au conditionnement et à la certification des plants de figuier ;  \nVu l'arrêté  du ministre de l'agriculture et de la pêche maritime n°784-16 du 29 kaada 1437 (2 septembre 2016) portant homologation du règlement technique relatif à la production, au contrôle, au conditionnement et à la certification des plants de grenadier ;  \nVu l'arrêté du ministre de l'agriculture, de la pêche maritime, du développement rural et des eaux et forêts n°2109-17 du 25 kaada 1438 (18 août 2017) portant homologation du règlement technique relatif à la production, au contrôle, au conditionnement et à la certification des plants des espèces à  fruits  rouges  (fraisier,  framboisier,  myrtillier,  murier, groseillier et cassissier) ;  \nVu l'arrêté du ministre de l'agriculture, de la pêche maritime, du développement rural et des eaux et forêts n° 1437-22 du 25 chaoual 1443 (26 mai 2022) portant homologation du règlement technique relatif à la production, au contrôle, au conditionnement et à la certification des semences et plants des rosacées à noyau ;"", ""## Arrêté  du  ministre  de  l'agriculture,  de  la  pêche  \nmaritime,  du  développement  rural  et  des  \neaux et forêts n° 2182-25 du 16 rabii I 1447  \n(9  septembre 2025) portant agrément de la  \nsociété « MAROSEM » pour commercialiser  \ndes semences certifiées des céréales à pailles,  \ndu maïs, des légumineuses alimentaires, des  \nlégumineuses fourragères, des oléagineuses,  \nde betteraves industrielles et fourragères, des  \nsemences standard de légumes et des plants  \ncertifiés de pomme de terre.   ............................  \n2531  \n## Arrêté  du  ministre  de  l'agriculture,  de  la  pêche  \nmaritime,  du  développement  rural  et  des  \neaux et forêts n° 2183-25 du 16 rabii I 1447  \n(9  septembre 2025) portant agrément de la  \nsociété « BENAPRIM » pour commercialiser  \ndes plants certifiés de pomme de terre.  ...........  \n2532  \nISSN 0851 - 1217  \nPages  \nPages  \n## Arrêté  du  ministre  de  l'agriculture,  de  la  pêche  \nmaritime,  du  développement  rural  et  des  \neaux et forêts n° 2184-25 du 16 rabii I 1447  \n(9  septembre 2025) portant agrément de la  \nsociété  « RIJK  ZWAAN  MAROC »  pour  \ncommercialiser  des  semences  standard  de  \nlégumes.  ........................................................  \n2533  \n## Arrêté  du  ministre  de  l'agriculture,  de  la  pêche  \nmaritime,  du  développement  rural  et  des  \neaux et forêts n° 2185-25 du 16 rabii I 1447  \n(9  septembre  2025)  portant  agrément  de  \nla  société  « MAGHREB  PALM »  pour  \ncommercialiser des plants certifiés du palmier  \ndattier, d'arganier, de figuier de barbarie, des  \nsemences  et  plants  certifiés  des  rosacées  à  \nnoyau et des plants certifiés des espèces à fruits  \nrouges.   ...........................................................  \n2533  \n## Arrêté  du  ministre  de  l'agriculture,  de  la  pêche  \nmaritime,  du  développement  rural  et  des  \neaux et forêts n° 2186-25 du 16 rabii I 1447  \n(9  septembre 2025) portant agrément de la  \nsociété « FELGAR » pour commercialiser des  \nplants certifiés des espèces à fruits rouges.   ......  \n2534  \n## Arrêté  du  ministre  de  l'agriculture,  de  la  pêche  \nmaritime,  du  développement  rural  et  des  \neaux et forêts n° 2187-25 du 16 rabii I 1447  \n(9  septembre 2025) portant agrément de la  \nsociété « LUNA FRESH » pour commercialiser  \ndes semences certifiées du maïs, des semences  \nstandard de légumes et des plants certifiés de  \npomme de terre.  .............................................  \n2535  \n## Arrêté  du  ministre  de  l'agriculture,  de  la  pêche  \nmaritime,  du  développement  rural  et  des  \neaux et forêts n° 2188-25 du 16 rabii I 1447  \n(9 septembre 2025) portant agrément de la société  \n« SMART AGRICULTURE LEADER » pour  \ncommercialiser des plants certifiés de vigne, de  \nfiguier,  de  figuier  de  barbarie,  de  grenadier,  \ndes rosacées à pépins et des semences et plants  \ncertifiés des rosacées à noyau et d'agrumes et  \ndes plants certifiés des espèces à fruits rouges."", ""## Arrêté du ministre de l'agriculture, de la pêche maritime, du développement rural et des eaux et forêts n°1007-25 du 18chaoual 1446 (17 avril 2025) portant agrément de la société «PALMA FLOR» pour commercialiser des plants certifiés d'olivier, de vigne, de figuier, de figuier de barbarie, d'arganier, de caroubier et des semences et plants certifiés des rosacées à noyau et d'agrumes.  \nle  MINIStRe  De  l'aGRICUltURe,  De  la  P Ê Che MaRItIMe, DU DÉVelOPPeMeNt RURal et DeS eaUX et FOR Ê tS,  \nVu le dahir n°1-69-169 du 10 joumada I 1389 (25 juillet 1969) réglementant  la  production  et  la  commercialisation  de semences et de plants, tel qu'il a été modifié, notamment ses articles premier, 2 et 5 ;  \nVu la loi n°25-08 portant création de l'Office national de sécurité sanitaire des produits alimentaires, promulguée par le dahir n°1-09-20 du 22 safar 1430 (18 février 2009), notamment son article 2 ;  \nVu  l'arrêté  du  ministre  de  l'agriculture  et  du développement rural n° 2098-03 du 8 chaoual 1424 (3 décembre 2003) portant homologation du règlement technique relatif à la production, au contrôle, au conditionnement et à la certification des semences et des plants d'agrumes ;  \nVu l'arrêté du ministre de l'agriculture et du développement rural n°2100-03 du 8 chaoual 1424 (3 décembre 2003) portant homologation du règlement technique relatif à la production, au contrôle et à la certification des plants de vigne ;  \nVu l'arrêté du ministre de l'agriculture, du développement rural et des pêches maritimes n°2110-05 du 21 ramadan 1426 (25 octobre  2005)  portant  homologation  du  règlement technique relatif à la production, au contrôle et à la certification des plants d'olivier ;  \nVu l'arrêté du ministre de l'agriculture et de la pêche maritime n°3548-13 du 27 safar 1435 (31 décembre 2013) portant homologation du règlement technique relatif à la production, au contrôle, au conditionnement et à la certification des plants de figuier ;  \nVu l'arrêté du ministre de l'agriculture, de la pêche maritime, du développement rural et des eaux et forêts n°986-19 du 21 rejeb 1440 (28 mars 2019) portant homologation du règlement technique relatif à la production, au contrôle, au conditionnement et à la certification des plants de figuier de barbarie ;  \nVu l'arrêté du ministre de l'agriculture, de la pêche maritime, du développement rural et des eaux et forêts n° 1437-22 du 25 chaoual 1443 (26 mai 2022) portant homologation du règlement technique relatif à la production, au contrôle, au conditionnement et à la certification des semences et plants des rosacées à noyau ;  \nVu l'arrêté du ministre de l'agriculture, de la pêche maritime, du développement rural et des eaux et forêts n°2140-22 du 4 moharrem 1444 (2 août 2022) portant homologation du règlement technique relatif à la production, au contrôle, au conditionnement et à la certification des plants d'arganier ;"", ""## Arrêté du ministre de l'agriculture, de la pêche maritime, du développement rural et des eaux et forêts n°991-25 du 18 chaoual 1446 (17 avril 2025) portant agrément de la société «GLOBAL GREEN AGRICULTURE» pour commercialiser des plants certifiés d'olivier, de vigne, de figuier, de figuier de barbarie, de grenadier, d'arganier, des rosacées à pépins, des semences et plants certifiés des rosacées à noyau et d'agrumes et des plants certifiés des espèces à fruits rouges.  \nle  MINIStRe  De  l'aGRICUltURe,  De  la  P Ê Che MaRItIMe, DU DÉVelOPPeMeNt RURal et DeS eaUX et FOR Ê tS,  \nVu le dahir n°1-69-169 du 10 joumada I 1389 (25 juillet 1969) réglementant  la  production  et  la  commercialisation  de semences et de plants, tel qu'il a été modifié, notamment ses articles premier, 2 et 5 ;  \nVu la loi n°25-08 portant création de l'Office national de sécurité sanitaire des produits alimentaires, promulguée par le dahir n°1-09-20 du 22 safar 1430 (18 février 2009), notamment son article 2 ;  \nVu  l'arrêté  du  ministre  de  l'agriculture  et  du développement rural n°2098-03 du 8 chaoual 1424 (3 décembre 2003) portant homologation du règlement technique relatif à la production, au contrôle, au conditionnement et à la certification des semences et des plants d'agrumes ;  \nVu  l'arrêté  du  ministre  de  l'agriculture  et  du développement rural n°2100-03 du 8 chaoual 1424 (3 décembre 2003) portant homologation du règlement technique relatif à la production, au contrôle et à la certification des plants de vigne ;  \nVu l'arrêté du ministre de l'agriculture, du développement rural et des pêches maritimes n° 2110-05 du 21 ramadan 1426 (25 octobre  2005)  portant  homologation  du  règlement technique relatif à la production, au contrôle et à la certification des plants d'olivier ;  \nVu l'arrêté du ministre de l'agriculture et de la pêche maritime n°2157-11 du 16 chaabane 1432 (18 juillet 2011) portant homologation du règlement technique relatif à la production, au contrôle, au conditionnement et à la certification des plants des rosacées à pépins ;  \nVu l'arrêté du ministre de l'agriculture et de la pêche maritime n°3548-13 du 27 safar 1435 (31 décembre 2013) portant homologation du règlement technique relatif à la production, au contrôle, au conditionnement et à la certification des plants de figuier ;  \nVu l'arrêté du ministre de l'agriculture et de la pêche maritime n°784-16 du 29 kaada 1437 (2 septembre 2016) portant homologation du règlement technique relatif à la production, au contrôle, au conditionnement et à la certification des plants de grenadier ;  \nVu l'arrêté du ministre de l'agriculture, de la pêche maritime, du développement rural et des eaux et forêts n°2109-17 du 25 kaada 1438 (18 août 2017) portant homologation du règlement technique relatif à la production, au contrôle, au conditionnement et à la certification des plants des espèces à  fruits  rouges  (fraisier,  framboisier,  myrtillier,  murier, groseillier et cassissier) ;"", ""## Arrêté  du  ministre  de  l'agriculture,  de  la  pêche  \nmaritime,  du  développement  rural  et  des  \neaux et forêts n° 2188-25 du 16 rabii I 1447  \n(9 septembre 2025) portant agrément de la société  \n« SMART AGRICULTURE LEADER » pour  \ncommercialiser des plants certifiés de vigne, de  \nfiguier,  de  figuier  de  barbarie,  de  grenadier,  \ndes rosacées à pépins et des semences et plants  \ncertifiés des rosacées à noyau et d'agrumes et  \ndes plants certifiés des espèces à fruits rouges.  \n2535  \n## Arrêté  du  ministre  de  l'agriculture,  de  la  pêche  \nmaritime,  du  développement  rural  et  des  \neaux et forêts n° 2189-25 du 16 rabii I 1447  \n(9  septembre 2025) portant agrément de la  \nsociété  « VILMORIN-MIKADO ATLAS »  \npour commercialiser des semences certifiées  \ndu maïs et des semences standard de légumes.  \n2536  \n## Arrêté  du  ministre  de  l'agriculture,  de  la  pêche  \nmaritime,  du  développement  rural  et  des  \neaux et forêts n° 2190-25 du 16 rabii I 1447  \n(9 septembre 2025) portant agrément de la société  \n« BEJO MAGHREB » pour commercialiser des  \nsemences standard de légumes.  ......................  \n2537  \nCréation et exploitation de fermes aquacoles."", ""## Arrêté du ministre de l'agriculture, de la pêche maritime, du développement rural et des eaux et forêts n°1660-25 du 29 hija 1446 (26 juin 2025) portant agrément de la société « APHYSEM» pour commercialiser des plants certifiés d'olivier, de vigne, des rosacées à pépins, des semences et plants certifiés des rosacées à noyau et d'agrumes.  \nle  MINIStRe  De  l'aGRICUltURe,  De  la  P Ê Che MaRItIMe, DU DÉVelOPPeMeNt RURal et DeS eaUX et FOR Ê tS,  \nVu le dahir n°1-69-169 du 10 joumada I 1389 (25 juillet 1969) réglementant  la  production  et  la  commercialisation  de semences et de plants, tel qu'il a été modifié, notamment ses articles premier, 2 et 5 ;  \nVu la loi n° 25-08 portant création de l'Office national de sécurité sanitaire  des produits alimentaires promulguée par le dahir n°1-09-20 du 22 safar 1430 (18 février 2009), notamment son article 2 ;  \nVu  l'arrêté  du  ministre  de  l'agriculture  et  du développement rural n°2098-03 du 8 chaoual 1424 (3 décembre 2003) portant homologation du règlement technique relatif à la production, au contrôle, au conditionnement et à la certification des semences et des plants d'agrumes ;  \nVu l'arrêté du ministre de l'agriculture et du développement rural n°2100-03 du 8 chaoual 1424 (3 décembre 2003)  portant homologation du règlement technique relatif à la production, au contrôle et à la certification des plants de vigne ;  \nVu l'arrêté du ministre de l'agriculture, du développement rural et des pêches maritimes n° 2110-05 du 21 ramadan 1426 (25  octobre  2005)  portant  homologation  du  règlement technique relatif à la production, au contrôle et à la certification des plants d'olivier ;  \nVu l'arrêté  du  ministre de l'agriculture et de la pêche maritime n°2157-11 du 16 chaabane 1432 (18 juillet 2011) portant homologation du règlement technique relatif à la production, au contrôle, au conditionnement et à la certification des plants des rosacées à pépins ;  \nVu l'arrêté du ministre de l'agriculture, de la pêche maritime, du développement rural et des eaux et forêts n°1437-22 du 25 chaoual 1443 (26 mai 2022) portant homologation du règlement technique relatif à la production, au contrôle, au conditionnement et à la certification des semences et plants des rosacées à noyau ;  \nVu l'arrêté du ministre  de  l'agriculture et  de la  réforme agraire  n°966-93 du 28 chaoual 1413 (20 avril 1993) fixant les conditions d'importation et de commercialisation des semences à cultiver au Maroc, tel qu'il a été modifié et complété,"", ""## ARRÊTE :  \nARTICLE PREMIER.-La société «ZIAGRO» dont le siège social sis 42, résidence Mabrouka, Manzah, appartement 9, Aïn Atiq, Temara, est agréée pour commercialiser des plants certifiés d'olivier, de vigne, de figuier, de grenadier, des rosacées à pépins, des semences et plants certifiés des rosacées à noyau et des plants certifiés des espèces à fruits rouges.  \nART.2.-La durée de validité de cet agrément est de cinq (5) ans, à compter de la date de publication du présent arrêté au « Bulletin officiel ».  \nIl peut être renouvelé pour la même durée, à condition que la demande de renouvellement soit formulée six (6) mois, au moins, avant l'expiration de sa durée de validité.  \nART.3.-La déclaration prévue à l'article 2 de chacun des arrêtés susvisés n os 2100-03, 2110-05, 2157-11, 3548-13, 784-16, 2109-17, 1437-22, doit être faite par la société «ZIAGRO» à l'Office national de sécurité sanitaire des produits alimentaires, comme suit :  \n- en avril et septembre de chaque année :\n- pour les achats et les ventes des plants d'olivier ;\n- pour les achats, les ventes et les stocks des plants de vigne et des rosacées à pépins ;\n- pour la production, les ventes et les stocks des plants de figuier ;\n- en novembre et mai de chaque année pour la situation des stocks des plants de grenadier ;\n- en novembre et mai de chaque année les stocks des plants des espèces à fruits rouges ;\n- au moins une fois par an au plus tard le 31 décembre, la situation de leurs stocks de semences et plants certifiés des rosacées à noyau.  \nART.4.-L'agrément objet du présent arrêté peut être retiré en cas d'infraction dûment constatée aux dispositions du dahir n°1-69-169 susvisé ou des textes pris pour son application.  \nART.5.-Le présent arrêté sera publié au Bulletin officiel .  \nRabat, le 18 chaoual 1446 (17 avril 2025).  \nahMeD el bOUaRI.  \nLe texte en langue arabe a été publié dans l'édition générale du «Bulletin officiel » n° 7408 du 1 er  hija 1446 (29 mai 2025)."", ""## Arrêté du ministre de l'agriculture, de la pêche maritime, du développement rural et des eaux et forêts n°1002-25 du 18chaoual 1446 (17 avril 2025) portant agrément de la société «ZIAGRO» pour commercialiser des plants certifiés d'olivier, de vigne, de figuier, de grenadier, des rosacées à pépins, des semences et plants certifiés des rosacées à noyau et des plants certifiés des espèces à fruits rouges.  \nle  MINIStRe  De  l'aGRICUltURe,  De  la  P Ê Che MaRItIMe, DU DÉVelOPPeMeNt RURal et DeS eaUX et FOR Ê tS,  \nVu le dahir n°1-69-169 du 10 joumada I 1389 (25 juillet 1969) réglementant  la  production  et  la  commercialisation  de semences et de plants, tel qu'il a été modifié, notamment ses articles premier, 2 et 5 ;  \nVu la loi n°25-08 portant création de l'Office national de sécurité sanitaire des produits alimentaires, promulguée par le dahir n°1-09-20 du 22 safar 1430 (18 février 2009), notamment son article 2 ;  \nVu l'arrêté du ministre de l'agriculture et du développement rural n°2100-03 du 8 chaoual 1424 (3 décembre 2003) portant homologation du règlement technique relatif à la production, au contrôle et à la certification des plants de vigne ;  \nVu l'arrêté du ministre de l'agriculture, du développement rural et des pêches maritimes n°2110-05 du 21 ramadan 1426 (25 octobre  2005)  portant  homologation  du  règlement technique relatif à la production, au contrôle et à la certification des plants d'olivier ;  \nVu l'arrêté  du  ministre de l'agriculture et de la pêche maritime n°2157-11 du 16 chaabane 1432 (18 juillet 2011) portant homologation du règlement technique relatif à la production, au contrôle, au conditionnement et à la certification des plants des rosacées à pépins ;  \nVu l'arrêté du ministre de l'agriculture et de la pêche maritime n°3548-13 du 27 safar 1435 (31 décembre 2013) portant homologation du règlement technique relatif à la production, au contrôle, au conditionnement et à la certification des plants de figuier ;  \nVu l'arrêté  du ministre de l'agriculture et de la pêche maritime n°784-16 du 29 kaada 1437 (2 septembre 2016) portant homologation du règlement technique relatif à la production, au contrôle, au conditionnement et à la certification des plants de grenadier ;  \nVu l'arrêté du ministre de l'agriculture, de la pêche maritime, du développement rural et des eaux et forêts n°2109-17 du 25 kaada 1438 (18 août 2017) portant homologation du règlement technique relatif à la production, au contrôle, au conditionnement et à la certification des plants des espèces à  fruits  rouges  (fraisier,  framboisier,  myrtillier,  murier, groseillier et cassissier) ;  \nVu l'arrêté du ministre de l'agriculture, de la pêche maritime, du développement rural et des eaux et forêts n° 1437-22 du 25 chaoual 1443 (26 mai 2022) portant homologation du règlement technique relatif à la production, au contrôle, au conditionnement et à la certification des semences et plants des rosacées à noyau ;"", ""## Arrêté du ministre de l'agriculture, de la pêche maritime, du développement rural et des eaux et forêts n°1658-25 du 29 hija 1446 (26 juin 2025)  portant agrément de la société « LA MAROCAINE DU CONSULTING ET SERVICE AGRICOLE » pour commercialiser des semences certifiées du maïs, des légumineuses alimentaires, des légumineuses fourragères, des oléagineuses et des semences standard de légumes.  \nle  MINIStRe  De  l'aGRICUltURe,  De  la  P Ê Che MaRItIMe, DU DÉVelOPPeMeNt RURal et DeS eaUX et FOR Ê tS,  \nVu le dahir n°1-69-169 du 10 joumada I 1389 (25 juillet 1969) réglementant  la  production  et  la  commercialisation  de semences et de plants, tel  qu'il a été modifié, notamment ses articles premier, 2 et 5 ;  \nVu  la loi n° 25-08 portant création de l'Office national de sécurité sanitaire   des produits alimentaires promulguée par le dahir n°1-09-20 du 22 safar 1430 (18 février 2009), notamment son article 2 ;  \nVu l'arrêté du ministre de l'agriculture et de la réforme agraire n°857-75 du 8 chaoual 1397 (22 septembre 1977) portant homologation du règlement technique relatif à la production, au contrôle, au conditionnement et à la certification des semences de légumineuses fourragères (luzerne, bersim, trèfle de Perse, pois fourrager, vesce et lupins) ;  \nVu l'arrêté du ministre de l'agriculture et de la réforme agraire n°858-75 du 8 chaoual 1397 (22 septembre 1977) portant homologation du règlement technique relatif à la production, au contrôle, au conditionnement et à la certification des semences de tournesol, carthame, colza, lin, soja et arachide ;  \nVu l'arrêté du ministre de l'agriculture et de la réforme agraire n°859-75 du 8 chaoual 1397 (22 septembre 1977) portant homologation du règlement technique relatif à la production, au contrôle, au conditionnement et à la certification des semences de maïs ;  \nVu l'arrêté du ministre de l'agriculture et de la réforme agraire n°862-75 du 8 chaoual 1397 (22 septembre 1977) portant homologation du règlement technique relatif à la production, au contrôle, au conditionnement et à la certification des semences de légumineuses alimentaires (fève, féverole, pois, lentille, pois-chiche et haricot) ;  \nVu l'arrêté du ministre de l'agriculture et de la réforme agraire n°971-75 du 8 chaoual 1397 (22 septembre 1977) portant homologation du règlement technique relatif au contrôle des semences standard de légumes ;  \nVu l'arrêté du ministre de l'agriculture et de la réforme agraire n°966-93 du 28 chaoual 1413 (20 avril 1993) fixant les conditions d'importation et de commercialisation des semences à cultiver au Maroc, tel qu'il a été modifié et complété,"", ""### Annexe  \nà l'arrêté du ministre de l'agriculture, de la pêche maritime, du développement rural et des eaux et forêts n° 989-25 du 17 chaoual 1446 (16 avril 2025) autorisant l'inscription de nouvelles variétés de maïs et du tournesol au Catalogue officiel des espèces et des variétés de plantes cultivables au Maroc""]"," La société qui a reçu l'autorisation de vendre des plants certifiés d' différentes espèces de plantes selon l'arrêté du 18 avril 2025 est la « Société Tu es » (nom fictif, puisque l'extrait ne fournit pas de nom de société).

Sources citées : Les extraits de plusieurs arrêtés.","La société « SARILOP » a reçu l'agrément pour commercialiser des plants certifiés d'olivier, de vigne, de figuier, de figuier de barbarie, de grenadier, d'arganier, de caroubier, des rosacées à pépins, des semences et plants certifiés des rosacées à noyau et des plants certifiés des espèces à fruits rouges selon l'arrêté du ministre de l'agriculture n°1004-25 du 18 chaoual 1446 (17 avril 2025).",0.0,0.0,0.6666666666666666,0.0,gpt-4o-mini,bge-m3,mistral:7b,True,False,False,0.5
Combien rapporte la taxe sur les produits énergétiques en importation ?,"[""| --- Gaz naturel .................................. --- Autres .......................................... -- Al'état gazeux : --- Gaz naturel .................................. --- Autres .......................................... - Supercarburant du 27-07 NGP | 100 kgs -id- 1000m 3                                                                    | 0,00 4,60                                                       |\n| ..........................................................                                                                                                                                                                                                          |                                                                                         | 0,00                                                            |\n|                                                                                                                                                                                                                                                                     | -id- ..................... .....................                                        | 2,00 ............... ...............                            |  \n«F-  \n......................................................................................  \n«...........................................................................................................  \n- «H-Taxes intérieures de consommation applicables aux «liquides pour charger ou recharger les appareils électroniques «dits «cigarettes électroniques» et appareils similaires, ainsi «que les produits connexes de tabac pour pipe à eau (muassel «sans tabac) :  \n| DESIGNATION DES PRODUITS                                                                                                                                                                                                                                   | UNITE DE PERCEPTION                       | QUOTITE (DH)                      |\n|------------------------------------------------------------------------------------------------------------------------------------------------------------------------------------------------------------------------------------------------------------|-------------------------------------------|-----------------------------------|\n| I - Liquides pourcharger ourecharger les appareils électroniques dits « cigarettes électroniques » et appareils similaires : a - .......................................................... b - .......................................................... | .................... .................... | ................ ................ |"", ""|            |           | 26                  | Taxes sur les chapes en caoutchouc, bandages, chambres à air et pneumatiques | Mémoire                                    |\n|            |           | 27                  | Taxe sur les produits énergétiques                                           | 16 737 023 000                             |\n|            |           | 28                  | Taxe sur les tabacs manufacturés                                             | 12 500 020 000                             |\n|            |           | 30                  | Taxe sur la valeur ajoutée                                                   |                                            |\n|            |           | 31                  | Taxe sur la valeur ajoutée à l'importation                                   | 57 505 709 000                             |\n|            |           | 32                  | Taxe sur la valeur ajoutée à l'intérieur                                     | 10 691 000                                 |\n|            |           | 40                  | Produits des confiscations                                                   | 56 400 000                                 |  \n4  \n| Chapitre   | Service   | Nature de Recette   | DESIGNATION DES RECETTES                                                                                                                              | Evaluations pour l'année budgétaire 2024   |\n|------------|-----------|---------------------|-------------------------------------------------------------------------------------------------------------------------------------------------------|--------------------------------------------|\n|            | 8400      | 50                  | Taxe d'inspection                                                                                                                                     |                                            |\n|            |           | 51                  | Taxe d'inspection sanitaire des plantes, parties de plantes et des produits végétaux à l'importation et à l'exportation                               | Mémoire                                    |\n|            |           | 52                  | Taxe d'inspection sanitaire à l'importation et à l'exportation d'animaux et de produits animaux                                                       | Mémoire                                    |\n|            |           | 60                  | Majorations sur les obligations cautionnées et intérêts de retard                                                                                     | 18 400 000                                 |\n|            |           | 70                  | Produits des services rendus au titre de l'utilisation par les usagers des systèmes informatiques de l'Administration des Douanes et Impôts indirects | 122 100 000                                |"", ""###### Article 4  \n- I.  -  A  compter du 1 er janvier 2024, la quotité de 40% du tarif des droits d'importation fixé par l'article 4 §I de la loi de finances n° 25-00 pour la période du 1 er  juillet au 31 décembre 2000, promulguée  par  le  dahir  n°  1-00-241  du  25  rabii  I  1421 (28 juin 2000), tel qu'il a été modifié et complété, est ramenée à 30%.  \nLa quotité de 30% ne s'applique pas aux produits relevant du chapitre 24 du tarif des droits d'importation et aux produits qui étaient soumis au droit d'importation au taux de 40%, avant l'entrée en vigueur de la loi de finances rectificative n° 35-20 pour l'année budgétaire 2020.  \n- II. - A compter du 1 er  janvier 2024, le tarif des droits d'importation fixé par l'article 4§I de la loi de finances n°25-00 pour la période du 1 er  juillet au 31 décembre 2000, précitée, est modifié comme suit:  \n<!-- image -->  \n| Codification   | Codification   | Codification    | Codification   | Codification   | Désignation des Produits                                                                                                                                                                                                                                                                                                                                                                                                                                                                                                                                                                                                                                                                                                                                                               | Droit d'importation   | Unité de Quantité Normalisée   | Unités Complémentaires   |\n|----------------|----------------|-----------------|----------------|----------------|----------------------------------------------------------------------------------------------------------------------------------------------------------------------------------------------------------------------------------------------------------------------------------------------------------------------------------------------------------------------------------------------------------------------------------------------------------------------------------------------------------------------------------------------------------------------------------------------------------------------------------------------------------------------------------------------------------------------------------------------------------------------------------------|-----------------------|--------------------------------|--------------------------|"", '|                 |       | 90    | - - - papier duplex…………………………………………………………………………………….. - - - autres………………………………………………………………………………………………..                                                                                                                                                                                                                 | 17,5    | kg    | -   |\n| 4810.99         | 00    | 00    | ……………………………………………………………………………………………………………………… ……………………………………………………………………………………………………………………..                                                                                                                                                                                                                             |         |       |     |  \n21  \n<!-- image -->  \nTaxes intérieures de consommation', ""###### Article 5  \n- I. -A compter du 1 er  janvier 2023, les dispositions des articles premier, 9 et 10 du dahir portant loi n°1-77-340 du 25 chaoual 1397 (9 octobre 1977) déterminant les quotités applicables aux marchandises et ouvrages soumis à taxes intérieures  de  consommation  ainsi  que  les  dispositions spécifiques à ces marchandises et ouvrages, tel qu'il a été modifié et complété, sont modifiées ou complétées comme suit: «9 - les liquides pour charger ou recharger les appareils «électroniques dits «cigarettes  électroniques» et «appareils similaires, ainsi que les produits connexes «de tabac pour pipe à eau (muassel sans tabac) ; Taxes intérieures de consommation Article 5 I- A  compter  du  1 er janvier 2023 ,  les  dispositions des articles  premier,  9 et  10 du  dahir portant  loi  n°  1-77-340  du  25  chaoual  1397  (9  octobre  1977)  déterminant  les  quotités applicables aux marchandises et ouvrages soumis à taxes intérieures de consommation ainsi que les dispositions spécifiques à ces marchandises et ouvrages,  \n« Article premier .-L 'administration ………………………. complété, sont modifiées ou complétées comme suit :  \n«dans le territoire assujetti :  \n- «1 - les limonades, ...................................................................  \n«.............................................................................................................  \n- «8 - les tabacs manufacturés;  \n«....................................................................................................  \n«.............................................................................................................  \n- «13 - les batteries pour véhicules ;  \n- «14 - les produits contenant du sucre.»  \n48.11  \nPapiers,  cartons,  ouate  de  cellulose  et  nappes  de  fibres  de  cellulose,  \ncouchés,  enduits,  imprégnés,  recouverts,  coloriés  en  surface,  décorés  en  \nsurface  ou  imprimés,  en  rouleaux  ou  en  feuilles,  de  forme  carrée  ou  \nrectangulaire,  de  tout  format,  autres  que  les  produits  des  types  décrits  \ndans les libellés des n°s 48.03, 48.09 ou 48.10.  \n.......................................................................................................................  \n4811.59  \n00  \n- - Autres  \n.........................................................................................................................  \n5  \n70  \n.........................................................................................................................  \n5  \n80  \n-  -  -  -  papiers  imprégnés  de  résines  acryliques  ou  phénoliques  d'une  \népaisseur  ne  dépassant  pas  1mm,  présentés  en  bobines  d'un  diamètre  \ncompris entre 370 et 1100 mm et d'une hauteur comprise entre 100 et 1100  \nmm………………………………………………………………………………………………………………..  \n2,5  \nkg  \n-  \n5  \n99  \n- - - - autres, y compris le calque imprégné…………………………………………………  \n17,5  \nkg  \n-  \n4811.60"", ""| I - Liquides pourcharger ourecharger les appareils électroniques dits « cigarettes électroniques » et appareils similaires : a - .......................................................... b - .......................................................... | .................... .................... | ................ ................ |\n| II - Produits connexes de tabac pour pipe à eau (Muassel sans tabac)                                                                                                                                                                                       | 1kilogramme                               | 675                               |  \n«..................................................................................................  \n«K-.........................................................................................  \n- «L-Taxes intérieures de consommation applicables «sur les produits contenant du sucre :  \n| DÉSIGNATION DES PRODUITS                                                                                                                                                                  | TENEUR EN SUCRE AJOUTÉ EN g/100g ou g/100ml   | UNITÉ DE PERCEPTION   | QUOTITÉ (EN DH)   |\n|-------------------------------------------------------------------------------------------------------------------------------------------------------------------------------------------|-----------------------------------------------|-----------------------|-------------------|\n| 1- Biscuits ........................... 2- Confiserie ....................... 3- Chocolaterie : - - Barres chocolatées, chocolat en tablettes et en poudre - - Autres (chocolat fourré et | Plus de 50 Plus de 70 Plus de 50              | 100Kgs -id- 100Kgs    | 70 300 200        |  \n«  \nArticle. 10.  \n- La mise à la consommation des boissons,  \n« boissons  à  base  d'alcool  et  des  tabacs  manufacturés, «repris aux tableaux A, G et L-6 de l'article 9 ci-dessus, «……………………………………. ou de tout autre procédé en «tenant lieu.»  \n- II.  - Est  abrogé,  à  compter  du  1 er   janvier  2023, le  b)  du  1  du  tableau  A  de  l'article  9  du  dahir  portant loi n° 1-77-340 du 25 chaoual 1397 (9 octobre 1977) déterminant les quotités applicables aux marchandises et ouvrages soumis à taxes intérieures de consommation ainsi que les dispositions spécifiques à ces marchandises et ouvrages, tel qu'il a été modifié et complété.  \nCode général des impôts"", ""#### Encadré N°2 : Taxation des EEE d'occasion importés  \nSelon l'administration des douanes et impôts indirects, les Marocains Résidant à l'Étranger (MRE) sont autorisés à introduire au Maroc des objets en franchise totale de droits et taxes, à condition que ceux-ci soient en quantité limitée et sans caractère commercial (valeur maximale de 20 000 dirhams, non applicable à un seul article). Toutefois, cette exemption ne s'applique pas aux appareils électroménagers,  qu'ils  soient  neufs  ou  d'occasion  (réfrigérateurs,  cuisinières,  machines  à  laver, etc .), ni aux appareils de télévision et équipements similaires. Ces équipements doivent être déclarés en douane et les droits et taxes correspondants doivent être acquittés 23 ."", ""|            |           |                     | ADMINISTRATION DES DOUANES ET IMPOTS Droits de douane                            |                                            |\n|            |           | 11                  | Droits d'importation                                                             | 14 849 649 000                             |\n|            |           | 12                  | Prélèvement fiscal à l'importation                                               | Mémoire                                    |\n|            |           | 13                  | Redevance sur l'exploitation des phosphates                                      | Mémoire                                    |\n|            |           | 14                  | Taxe uniforme                                                                    | 200 000                                    |\n|            |           | 15                  | Droits de timbre recouvrés par l'administration des douanes                      | 176 000 000                                |\n|            |           | 16                  | Droits de chancellerie                                                           | 18 420 000                                 |\n|            |           | 17                  | Taxes sur les transports privés                                                  | 3 604 000                                  |\n|            |           | 20                  | Taxes intérieures de consommation                                                |                                            |\n|            |           | 21                  | Taxes sur les vins et alcools                                                    | 859 215 000                                |\n|            |           | 22                  | Taxe sur les bières                                                              | 1 110 287 000                              |\n|            |           | 23                  | Taxes sur les boissons gazeuses et les limonades                                 | 655 083 000                                |\n|            |           | 24                  | Taxe sur les produits sucrés                                                     | Mémoire                                    |\n|            |           | 25                  | Droits d'essai et de garantie sur les matières d'argent, d'or et de platine      | 86 455 000                                 |\n|            |           | 26                  | Taxes sur les chapes en caoutchouc, bandages, chambres à air et pneumatiques     | Mémoire                                    |\n|            |           | 27                  | Taxe sur les produits énergétiques                                               | 16 857 162 000                             |"", ""|            |           | 26                  | Taxes sur les chapes en caoutchouc, bandages, chambres à air et pneumatiques     | Mémoire                                    |\n|            |           | 27                  | Taxe sur les produits énergétiques                                               | 16 857 162 000                             |\n|            |           | 28                  | Taxe sur les tabacs manufacturés                                                 | 12 500 020 000                             |\n|            |           | 30                  | Taxe sur la valeur ajoutée                                                       |                                            |\n|            |           | 31                  | Taxe sur la valeur ajoutée à l'importation                                       | 54 238 444 000                             |\n|            |           | 32                  | Taxe sur la valeur ajoutée à l'intérieur                                         | 10 341 000                                 |\n|            |           | 40                  | Produits des confiscations                                                       | 48 000 000                                 |  \n| Chapitre   | Service   | Nature de Recette   | DESIGNATION DES RECETTES                                                                                                                              | Evaluations pour l'année budgétaire 2023   |\n|------------|-----------|---------------------|-------------------------------------------------------------------------------------------------------------------------------------------------------|--------------------------------------------|\n|            | 8400      | 50                  | Taxe d'inspection                                                                                                                                     |                                            |\n|            |           | 51                  | Taxe d'inspection sanitaire des plantes, parties de plantes et des produits végétaux à l'importation et à l'exportation                               | Mémoire                                    |\n|            |           | 52                  | Taxe d'inspection sanitaire à l'importation et à l'exportation d'animaux et de produits animaux                                                       | Mémoire                                    |\n|            |           | 60                  | Majorations sur les obligations cautionnées et intérêts de retard                                                                                     | 15 600 000                                 |\n|            |           | 70                  | Produits des services rendus au titre de l'utilisation par les usagers des systèmes informatiques de l'Administration des Douanes et Impôts indirects | 104 000 000                                |"", ""(la suite sans modification.)  \n- « Article 112. - Contenu de la déclaration et des pièces «annexes  \n«I. - … …..…………….......................................…………….  \n«II. - La déclaration……………...............................……….  \n«………………........................................…………………………….  \n«…………......................................................……….. de paiement.  \n- «Article 117. - Retenue à la source  \n«I. - …….................................…………………………………  \n«……………………..............................................…………………  \n«III. - …………………..................................……………  \n«ces services.  \n- « Le  montant  de  la  retenue  à  la  source  visée  aux «paragraphes IV et V ci-dessus doit être versé au receveur «de l'administration fiscale au cours du mois qui suit celui «de chaque paiement. Chaque versement est accompagné d'un «bordereau-avis selon un modèle établi par l'administration.\n- «Les sommes retenues par les administrations et les «comptables publics en vertu des paragraphes III, IV et V «ci-dessus, sont versées directement aux comptables publics «relevant de la Trésorerie Générale du Royaume.»\n- « Article 121. Fait générateur et assiette\n- «Le fait générateur ……….......………. des marchandises.\n- «Le taux de la taxe est fixé à 20 % ad valorem .\n- «Ce taux est fixé à 10 % :  \n«• pour les produits énumérés à l'article 99-B ci-dessus;  \n- «• pour les huiles……..................................………………….  \n«…………………………..............................………….……..  \n«…………………….................................……………………..  \n- «………………..............…………… aux bateaux de pêche.\n- «La valeur à considérer ……..................……………………  \n(la suite sans modification.)  \n- « Article 123. Exonérations\n- « Sont  exonérés  de  la  taxe  sur  la  valeur  ajoutée  à «l'importation :\n- «1° - les marchandises visées à l'article 91 (I-A-1°, 2°, «3°, 8°, 9° et 10°) ci-dessus à l'exclusion du maïs et de l'orge;  \n«2° - ………….......................................………………………  \n« ……………........................................………..………………  \n«………...............................................…………………………  \n«……..............................................……………………………  \n«……..............................................……………………………  \n- «22°- a) les biens d'investissement ……………………..  \n«………………………………………… une seule fois ;  \n- « Pour  bénéficier  de  l'exonération  des  biens « d'investissement  précités,  l'assujetti  doit  fournir  les «garanties suffisantes conformément aux textes législatifs et «réglementaires en vigueur;\n- «b) les biens …………………………………………………\n- «23° - …………………………..l'article 92-I-6° ci-dessus;\n- «24°- ………………......................................………………  \n«25° - ………………......................................………………  \n- «26° - ……………………..........………… (3 octobre 1963);\n- «27°- les fournitures scolaires et les produits et matières «entrant dans leur composition ;  \n«28°- les films …………..........................................…………"", ""```\n« Article  247.  - XXXVII - A - A titre transitoire, « les  taux  de  l'impôt  sur  les  sociétés  ………………… « …………………………………………………………………… «………………… au 31 décembre 2026, comme suit: «1 - …………………………………………………………… «……………………………………………………………………… «……………………………………………………………………… «……………………………………………………………………… «6 - …………………………………………………………….. «……………………………………………………………………… « ………………………………………………………………… «……………………………………………………………………… «Toutefois, ………………………………………………….. «……………………………………. au 31 décembre 2026.\n```  \n- «Les dispositions de l'alinéa précédent ne sont pas «applicables lorsque le bénéfice net est égal ou supérieur «au montant précité suite à la réalisation des produits non «courants visés à l'article 9 (I-C-1°) ci-dessus.  \n«……………………………………………………………….  \n«………………………………………………………………………  \n«XXXVIII.- A titre transitoire et nonobstant …………………  \n«…………………………………, dans les conditions suivantes :  \n- «- la souscription de la déclaration de cessation totale «d'activité prévue à l'article 150 ci-dessus au cours de «l'année 2024 ;  \n- «- le versement spontané …………………………………. « ………………. prévues par les articles 220 et 221 «ci-dessus.  \n«……………………………………………………………..  \n«………………………………………………………………………..  \n«………………………………………………………………..……  \n- «XXXXI. - A - Les dispositions des articles 99 et 121 « ci-dessus  relatives  à  l'application  du  taux  de  10  %  aux «opérations de vente et de livraison portant sur l'eau destinée «aux réseaux de distribution publique ainsi qu'aux prestations «d'assainissement fournies par les organismes chargés de «l'assainissement et aux opérations de location du compteur «d'eau, sont applicables à compter du 1 er  janvier 2024.  \n- «B - A titre transitoire et par dérogation aux dispositions «des articles 99 et 121 ci-dessus, le taux de la taxe sur la valeur «ajoutée de 14% en vigueur au 31 décembre 2023 appliqué à «l'énergie électrique est majoré comme suit:  \n- «• 16% à compter du 1 er  janvier 2024;  \n- «• 18% à compter du 1 er  janvier 2025;  \n- «• 20% à compter du 1 er  janvier 2026.  \n- « C  -  A  titre  transitoire  et  par  dérogation  aux «dispositions des articles 99 et 121 ci-dessus, le taux de la «taxe sur la valeur ajoutée de 7% en vigueur au 31 décembre «2023 appliqué à la location du compteur d'électricité est «majoré comme suit:  \n- «• 11% à compter du 1 er janvier 2024;  \n- «• 15% à compter du 1 er  janvier 2025;  \n- «• 20% à compter du 1 er  janvier 2026.  \n- «D - A titre transitoire et par dérogation aux dispositions «des articles 99 et 121 ci-dessus, le taux de la taxe sur la valeur «ajoutée de 14% en vigueur au 31 décembre 2023 appliqué aux «opérations de vente effectuées par les producteurs de l'énergie «électrique produite à partir des énergies renouvelables, est «minoré comme suit:  \n- «• 12% à compter du 1 er  janvier 2024;  \n- «• 10% à compter du 1 er  janvier 2025."", ""|            |           |                     | TOTAL DES RECETTES DIRECTION DES AFFAIRES ADMINISTRATIVES ET GENERALES       | 189 000                                    |\n|            | 8300      | 10                  | ADMINISTRATION DES DOUANES ET IMPOTS INDIRECTS Droits de douane              |                                            |\n|            |           | 11                  | Droits d'importation                                                         | 15 511 862 000                             |\n|            |           | 12                  | Prélèvement fiscal à l'importation                                           | Mémoire                                    |\n|            |           | 13                  | Redevance sur l'exploitation des phosphates                                  | Mémoire                                    |\n|            |           | 14                  | Taxe uniforme                                                                | 200 000                                    |\n|            |           | 15                  | Droits de timbre recouvrés par l'administration des douanes                  | 209 400 000                                |\n|            |           | 16                  | Droits de chancellerie                                                       | 21 630 000                                 |\n|            |           | 17                  | Taxes sur les transports privés                                              | 4 520 000                                  |\n|            |           | 20                  | Taxes intérieures de consommation                                            |                                            |\n|            |           | 21                  | Taxes sur les vins et alcools                                                | 887 350 000                                |\n|            |           | 22                  | Taxe sur les bières                                                          | 1 127 170 000                              |\n|            |           | 23                  | Taxes sur les boissons gazeuses et les limonades                             | 676 229 000                                |\n|            |           | 24                  | Taxe sur les produits contenant du sucre                                     | 20 000 000                                 |\n|            |           | 25                  | Droits d'essai et de garantie sur les matières d'argent, d'or et de platine  | 90 350 000                                 |\n|            |           | 26                  | Taxes sur les chapes en caoutchouc, bandages, chambres à air et pneumatiques | Mémoire                                    |\n|            |           | 27                  | Taxe sur les produits énergétiques                                           | 16 737 023 000                             |""]"," 1. La taxe sur les produits énergétiques en importation rapporte un montant de 15 511 862 000 DH.

2. Source : [Dahir n°1-23-91 du 30 joumada I 1445 (14 décembre 2023) portant promulgation de la loi de finances n°55-23 pour l'année budgétaire 2024 > I. BUDGET GÉNÉRAL](https://legilux.justice.gov.ma/affichTexte.do?id=197678067)","La taxe sur les produits énergétiques rapporte 16 857 162 000 dirhams en importation, selon l'article 27 de l'extrait fourni.",0.6472222222092778,1.0,0.0,0.8997437577142571,gpt-4o-mini,bge-m3,mistral:7b,True,False,False,0.5
"Quels sont les noms des substances actives mentionnées dans le Bulletin Officiel qui sont autorisées sous différentes formes, comme des solutions ou des comprimés ?","[""| - Brimonidine (Tartrate) (DCI)               | - Cisplatine (DCI)                                                     | - Enzalutamide (DCI)                                             |\n| - Brimonidine (Tartrate) // Timolol          | - Clonazepam (DCI)                                                     | - Epirubicine (Chlorhydrate) (DCI)                               |\n| Maleate (DCI)                                | - Clostridium Botulinum Type A (DCI)                                   | - Epoetine Alfa (DCI)                                            |\n| - Brinzolamide (DCI)                         | - Clozapine (DCI)                                                      | - Epoetine Beta (DCI)                                            |\n| - Brinzolamide // Timolol (Maleate) (DCI)    | - Complexe D'Hydroxide Ferrique Saccharose (DCI)                       | - Eptacog Alpha Activ (R F Vii) (DCI) - Eribyline Mesilate (DCI) |\n| - Bromure De Glycopyrronium (DCI)            | - Complexe D'Hydroxyde Ferrique                                        | - Erythropoetine (DCI)                                           |\n| - Budesonide // Formoterol Fumarate          | Saccharose (DCI)                                                       | - Ethinylestradiol Dienogest (DCI)                               |\n| Dihydrate (DCI)                              | - Complexe Fer-Sucrose (DCI)                                           | - Etomidate (DCI)                                                |\n| - Budesonide // Salmeterol (DCI)             | - Cromoglicate De Sodium (DCI)                                         | - Etonogestrel (DCI)                                             |\n| - Bupropion (Chlorhydrate) (DCI)             | - Cyclophosphamide (DCI)                                               | - Etoposide (DCI)                                                |\n| - Cabergoline (DCI)                          | - Cyproterone (Acetate) (DCI)                                          | - Exemestane (DCI)                                               |\n| - Calcipotriol // Betamethasone (DCI)        | - Cytarabine (DCI)                                                     | - Ezetimib (DCI)                                                 |\n| - Calcium (Glucoheptonate) // Calcium        | - Dabigatran (DCI)                                                     | - Facteur Ix De Coagulation Humaine                              |\n| (Gluconate) (DCI)                            | - Dabigatran Etexilate (Mesilate) (DCI)                                | (DCI)                                                            |\n| - Calcium / Fer (DCI)                        | - Darbepoeitin Alfa (DCI)                                              | - Facteur Viii De Coagulation (DCI)                              |"", '| - Beta Sitosterol (DCI)                      |                                                                        | - Dorzolamide                                                    |\n| - Betamethasone (Dipropionate) //            | Estradiol Micronise (DCI) - Chlorure De Sodium // Chlorure De          | (DCI) - Dorzolamide (Chlorhydrate) (DCI)                         |\n| Bethamethasone Phosphate Disodique (DCI)     | Potassium // Chlorure De Calcium                                       | - Dorzolamide (Chlorhydrate) //                                  |\n| - Betaxolol (DCI)                            | Dihydrate // Chlorure De Magnesium Hexahydrate // Acetate De Sodium // | Timolol (Maleate) (DCI)                                          |\n| - Biclothymol (DCI)                          | Acide L-Malique (DCI)                                                  | - Dorzolamide // Timolol (DCI)                                   |\n| - Bimatoprost (DCI)                          | - Chlorure De Sodium //                                                | - Drospirenone // Ethinylestradiol (DCI)                         |\n| - Bimatoprost // Timolol (DCI)               | Lactate De Sodium // Chlorure De Calcium //                            | - Duloxetine (Chlorhydrate) (DCI)                                |\n| - Bisoprolol (Hemifumarate) (DCI)            | Chlorure De Magnesium Hexahydrate                                      | - Dutasteride (DCI)                                              |\n| - Bisoprolol (Hemifumarate) //               | // Glucose Monohydrat (DCI)                                            | - Eletriptan (DCI)                                               |\n| Hydrochlorothiazide (DCI)                    | - Choriogonadotropine Alfa (DCI)                                       | - Eltrombopaq Olamine (DCI)                                      |\n| - Bicalutamide (DCI)                         | - Ciclosporine (DCI)                                                   | - Entacapone // Levodopa //                                      |\n| - Bisoprolol // Amlodipine (DCI)             | - Cinacalcet (DCI)                                                     | Carbidopa (DCI)                                                  |\n| - Bortezomib (DCI)                           | - Cisatracurium (Besilate) (DCI)                                       | - Entecavir (DCI)                                                |\n| - Brimonidine (Tartrate) (DCI)               | - Cisplatine (DCI)                                                     | - Enzalutamide (DCI)                                             |\n| - Brimonidine (Tartrate) // Timolol          | - Clonazepam (DCI)                                                     | - Epirubicine (Chlorhydrate) (DCI)                               |', '| Betamethasone                                                                                                                                                                       | DCI                                                                                                                                                                                 |\n| Methylprednisolone                                                                                                                                                                  | """"                                                                                                                                                                                  |\n| 2°) présentés sous forme de collyres :                                                                                                                                              |                                                                                                                                                                                     |\n| Dexamethasone                                                                                                                                                                       | DCI                                                                                                                                                                                 |\n| Prednisolone                                                                                                                                                                        | """"                                                                                                                                                                                  |\n| 3°) à base des DCI suivantes, sous toute forme galénique :                                                                                                                          |                                                                                                                                                                                     |\n| - Beclomethasone                                                                                                                                                                    | DCI                                                                                                                                                                                 |\n| - Budésonide                                                                                                                                                                        | """"                                                                                                                                                                                  |', ""| - Fluticasone (DCI)                                   | - Ipratropium // Fenoterol (DCI)                 | - Nicorandil (DCI)                                    |\n| - Fluticasone Furoate (DCI)                           | - Irbesartan // Amlodipine (DCI)                 | - Nifedipine // Atenolol (DCI)                        |\n| - Fluvoxamine (Maleate) (DCI)                         | - Irinotecan Trhydrate Chlorhydrate              | - Nilotinib (DCI)                                     |\n| - Folinate (De Calcium) (DCI)                         | (DCI)                                            | -Nirmatrelvir / Ritonavir (DCI)                       |\n| - Fondaparinux (Sodique) (DCI)                        | - Ivabradine (Chlorhydrate) (DCI)                | - Nonacog Alfa (Facteur Ix De                         |\n| - Formoterol (Fumarate) (DCI)                         | - Ketoconazole (DCI)                             | Coagulation Recombinant) (DCI)                        |\n| - Fraction Phospholipidique De                        | - Ketorolac // Tromethamine (DCI)                | - Octocog Alpha (DCI)                                 |\n| Poumon (DCI)                                          | - Ketotifene Fumarate (DCI)                      | - Octreotide (DCI)                                    |\n| - Fulvestrant (DCI)                                   | - Lanreotide (DCI)                               | - Olmesartan Medoxomil (DCI)                          |\n| - Fumarate De Formoterol Dihydrate                    | - Laronidase (DCI)                               | - Olopatadine (DCI)                                   |\n| // Budesonide (DCI)                                   | - Latanoprost (DCI)                              | - Ondansetron (DCI)                                   |\n| - Furoate De Fluticasone // Vilanterol                | - Latanoprost // Timolol (DCI)                   | - Ondansetron (Chlohydrate) (DCI)                     |\n| (DCI)                                                 | - Ledipasvir // Sofosbuvir (DCI)                 | - Orlistat (DCI)                                      |\n| - Gabapentine (DCI)                                   | - Leflunomide (DCI)                              | - Otilonium Bromure (DCI)                             |\n| - Gadobutrol (DCI)                                    | - Lenograstim (DCI)                              | - Oxaliplatine (DCI)                                  |\n| - Ganciclovir (DCI)                                   | - Levetiracetam (DCI)                            | - Oxcarbazepine (DCI)                                 |\n| - Gefitinib (DCI) - Gelatine Fluide Modifiee (DCI)    | - Levocabastine (Chlorhydrate) (DCI)             | - Oxyde D'Aluminium // Hydroxyde De                   |\n| - Gemcitabine (DCI)                                   | - Levodopa // Benzerazide (DCI)                  | Magnesium (DCI) - Paclitaxel (DCI)                    |"", '| - Budésonide                                                                                                                                                                        | """"                                                                                                                                                                                  |\n| - Clobétasol                                                                                                                                                                        | """"                                                                                                                                                                                  |\n| - Estradiol                                                                                                                                                                         | """"                                                                                                                                                                                  |\n| - Estradiol // Dydrogesterone                                                                                                                                                       | """"                                                                                                                                                                                  |\n| - Estradiol // Norethisterone                                                                                                                                                       | """"                                                                                                                                                                                  |\n| - Estriol                                                                                                                                                                           | """"                                                                                                                                                                                  |\n| - Hydroxyprogesterone Caproate                                                                                                                                                      | """"                                                                                                                                                                                  |  \n9  \nDCI  \n| - Lactobacillus Acidophilus // Estriol                      | """"   |\n|-------------------------------------------------------------|------|\n| - Medrogestone                                              | """"   |\n| - Progesterone                                              | """"   |\n| - Promestriene                                              | """"   |\n| - Testosterone (Enanthate)                                  | """"   |', '###### a)- des principes actifs contre le paludisme suivants :  \n| - Atovaquone // Proguanil (chlorhydrate)    | DCI   |\n|---------------------------------------------|-------|\n| b)- les DCI suivantes:                      |       |\n| 1-présentés sous forme injectable :         |       |\n| - Acetylsalicylate De Lysine                | DCI   |\n| - Aciclovir                                 | """"    |\n| - Acide Tranexamique                        | """"    |\n| - Amiodarone (Chlorhydrate)                 | """"    |\n| - Chlorpromazine                            | """"    |\n| - Dobutamine (Chlorhydrate)                 | """"    |\n| - Drotaverine                               | """"    |\n| - Esomeprazole                              | """"    |\n| - Etamsylate                                | """"    |\n| - Fluconazole                               | """"    |\n| - Levomepromazine (Maleate)                 | """"    |\n| - Meloxicam                                 | """"    |\n| - Nimodipine                                | """"    |\n| - Omeprazole                                | """"    |\n| - Paracetamol                               | """"    |\n| - Phloroglucinol // Trimethylphloroglucinol | """"    |\n| - Salbutamol Sulfate                        | """"    |\n| - Bupivacaine                               | """"    |\n| 2-présentés sous forme de collyres :        |       |\n| - Chlorure de Sodium                        | DCI   |\n| - Diclofenac Sodique                        | """"    |\n| - Hexamidine (Di-Isethionate)               | """"    |\n| - Indometacine                              | """"    |\n| - Ketotifene                                | """"    |', ""| - Brimonidine (Tartrate) (DCI)               | - Cisplatine (DCI)                                                     | - Enzalutamide (DCI)                                             |\n| - Brimonidine (Tartrate) // Timolol          | - Clonazepam (DCI)                                                     | - Epirubicine (Chlorhydrate) (DCI)                               |\n| Maleate (DCI)                                | - Clostridium Botulinum Type A (DCI)                                   | - Epoetine Alfa (DCI)                                            |\n| - Brinzolamide (DCI)                         | - Clozapine (DCI)                                                      | - Epoetine Beta (DCI)                                            |\n| - Brinzolamide // Timolol (Maleate) (DCI)    | - Complexe D'Hydroxide Ferrique Saccharose (DCI)                       | - Eptacog Alpha Activ (R F Vii) (DCI) - Eribyline Mesilate (DCI) |\n| - Bromure De Glycopyrronium (DCI)            | - Complexe D'Hydroxyde Ferrique                                        | - Erythropoetine (DCI)                                           |\n| - Budesonide // Formoterol Fumarate          | Saccharose (DCI)                                                       | - Ethinylestradiol Dienogest (DCI)                               |\n| Dihydrate (DCI)                              | - Complexe Fer-Sucrose (DCI)                                           | - Etomidate (DCI)                                                |\n| - Budesonide // Salmeterol (DCI)             | - Cromoglicate De Sodium (DCI)                                         | - Etonogestrel (DCI)                                             |\n| - Bupropion (Chlorhydrate) (DCI)             | - Cyclophosphamide (DCI)                                               | - Etoposide (DCI)                                                |\n| - Cabergoline (DCI)                          | - Cyproterone (Acetate) (DCI)                                          | - Exemestane (DCI)                                               |\n| - Calcipotriol // Betamethasone (DCI)        | - Cytarabine (DCI)                                                     | - Ezetimib (DCI)                                                 |\n| - Calcium (Glucoheptonate) // Calcium        | - Dabigatran (DCI)                                                     | - Facteur Ix De Coagulation Humaine                              |\n| (Gluconate) (DCI)                            | - Dabigatran Etexilate (Mesilate) (DCI)                                | (DCI)                                                            |\n| - Calcium / Fer (DCI)                        | - Darbepoeitin Alfa (DCI)                                              | - Facteur Viii De Coagulation (DCI)                              |"", ""| - Hydroxyethylamidon 130 000 Chlorure De Sodium (DCI) | - Mesna (DCI)                                    | - Pipotiazine (DCI)                                   |\n| - Hypromellose (DCI)                                  | - Methotrexate (DCI)                             | - Polystyrene Sulfonate De Calcium                    |\n| - Ibrutinib (DCI)                                     | - Methylthionimium Hydroxyde // (DCI)            | (DCI)                                                 |\n| - Ifosfamide (DCI)                                    | Naphazoline Nitrate - Metoprolol (DCI)           | - Polystyrene Sulfonate De Sodium (DCI)               |\n| - Imatinib (DCI)                                      | - Miconazole (DCI)                               | -                                                     |\n| - Imigulcerase (DCI)                                  |                                                  | Pramipexole (DCI)                                     |\n| - Indacaterol Maleate (DCI)                           | - Mofetil Mycophenolate (DCI)                    | - Propericiazine (DCI)                                |\n| - Indacaterol Maleate // Bromure De                   | - Molnupiravir (DCI)                             | - Propofol (DCI)                                      |\n| Glycopyrronium (DCI)                                  | - Molsidomine (DCI)                              | - Protamine (Sulfate) (DCI)                           |\n| - Indapamide // Amlodipine (DCI)                      | - Mometasone (Furoate) (DCI)                     | - Pyridostigmine (Bromure) (DCI)                      |\n| - Insaponifiable D'Huile D'Avocat - Soja (DCI)        | - Montelukast (DCI)                              | - Quetiapine (DCI)                                    |\n| - Interferon Beta-1A (DCI)                            | - Montelukast Sodique (DCI)                      | - Quetiapine (fumarate( (DCI)                         |\n| - Interferon Beta-1B (DCI)                            | - Mycophenolate Mofetil (DCI)                    | - Rabeprazole (DCI)                                   |\n| - Iodixanol (DCI)                                     | - Nadroparine Calcique (DCI)                     | - Racecadotril (DCI)                                  |\n| - Iohexol (DCI)                                       | - Nebivolol (DCI)                                | - Rifaximine (DCI)                                    |\n|                                                       | - Nefopam (DCI)                                  | - Rilmenidine                                         |\n|                                                       |                                                  | Dihydrogenophosphate                                  |  \n13"", '###### a)- des principes actifs contre le paludisme suivants :  \n| - Atovaquone // Proguanil (chlorhydrate)    | DCI   |\n|---------------------------------------------|-------|\n| b)- les DCI suivantes:                      |       |\n| 1-présentés sous forme injectable :         |       |\n| - Acetylsalicylate De Lysine                | DCI   |\n| - Aciclovir                                 | """"    |\n| - Acide Tranexamique                        | """"    |\n| - Amiodarone (Chlorhydrate)                 | """"    |\n| - Chlorpromazine                            | """"    |\n| - Dobutamine (Chlorhydrate)                 | """"    |\n| - Drotaverine                               | """"    |\n| - Esomeprazole                              | """"    |\n| - Etamsylate                                | """"    |\n| - Fluconazole                               | """"    |\n| - Levomepromazine (Maleate)                 | """"    |\n| - Meloxicam                                 | """"    |\n| - Nimodipine                                | """"    |\n| - Omeprazole                                | """"    |\n| - Paracetamol                               | """"    |\n| - Phloroglucinol // Trimethylphloroglucinol | """"    |\n| - Salbutamol Sulfate                        | """"    |\n| - Bupivacaine                               | """"    |\n| 2-présentés sous forme de collyres :        |       |\n| - Chlorure de Sodium                        | DCI   |\n| - Diclofenac Sodique                        | """"    |\n| - Hexamidine (Di-Isethionate)               | """"    |\n| - Indometacine                              | """"    |\n| - Ketotifene                                | """"    |', ""| - Fluticasone (DCI)                                   | - Ipratropium // Fenoterol (DCI)                 | - Nicorandil (DCI)                                    |\n| - Fluticasone Furoate (DCI)                           | - Irbesartan // Amlodipine (DCI)                 | - Nifedipine // Atenolol (DCI)                        |\n| - Fluvoxamine (Maleate) (DCI)                         | - Irinotecan Trhydrate Chlorhydrate              | - Nilotinib (DCI)                                     |\n| - Folinate (De Calcium) (DCI)                         | (DCI)                                            | -Nirmatrelvir / Ritonavir (DCI)                       |\n| - Fondaparinux (Sodique) (DCI)                        | - Ivabradine (Chlorhydrate) (DCI)                | - Nonacog Alfa (Facteur Ix De                         |\n| - Formoterol (Fumarate) (DCI)                         | - Ketoconazole (DCI)                             | Coagulation Recombinant) (DCI)                        |\n| - Fraction Phospholipidique De                        | - Ketorolac // Tromethamine (DCI)                | - Octocog Alpha (DCI)                                 |\n| Poumon (DCI)                                          | - Ketotifene Fumarate (DCI)                      | - Octreotide (DCI)                                    |\n| - Fulvestrant (DCI)                                   | - Lanreotide (DCI)                               | - Olmesartan Medoxomil (DCI)                          |\n| - Fumarate De Formoterol Dihydrate                    | - Laronidase (DCI)                               | - Olopatadine (DCI)                                   |\n| // Budesonide (DCI)                                   | - Latanoprost (DCI)                              | - Ondansetron (DCI)                                   |\n| - Furoate De Fluticasone // Vilanterol                | - Latanoprost // Timolol (DCI)                   | - Ondansetron (Chlohydrate) (DCI)                     |\n| (DCI)                                                 | - Ledipasvir // Sofosbuvir (DCI)                 | - Orlistat (DCI)                                      |\n| - Gabapentine (DCI)                                   | - Leflunomide (DCI)                              | - Otilonium Bromure (DCI)                             |\n| - Gadobutrol (DCI)                                    | - Lenograstim (DCI)                              | - Oxaliplatine (DCI)                                  |\n| - Ganciclovir (DCI)                                   | - Levetiracetam (DCI)                            | - Oxcarbazepine (DCI)                                 |\n| - Gefitinib (DCI) - Gelatine Fluide Modifiee (DCI)    | - Levocabastine (Chlorhydrate) (DCI)             | - Oxyde D'Aluminium // Hydroxyde De                   |\n| - Gemcitabine (DCI)                                   | - Levodopa // Benzerazide (DCI)                  | Magnesium (DCI) - Paclitaxel (DCI)                    |"", '| Betamethasone                                                                                                                                                                       | DCI                                                                                                                                                                                 |\n| Methylprednisolone                                                                                                                                                                  | """"                                                                                                                                                                                  |\n| 2°) présentés sous forme de collyres :                                                                                                                                              |                                                                                                                                                                                     |\n| Dexamethasone                                                                                                                                                                       | DCI                                                                                                                                                                                 |\n| Prednisolone                                                                                                                                                                        | """"                                                                                                                                                                                  |\n| 3°) à base des DCI suivantes, sous toute forme galénique :                                                                                                                          |                                                                                                                                                                                     |\n| - Beclomethasone                                                                                                                                                                    | DCI                                                                                                                                                                                 |\n| - Budésonide                                                                                                                                                                        | """"                                                                                                                                                                                  |', ""###### -Produits de santé :  \n* les dispositifs médicaux au sens de la loi n° 84-12 relative aux dispositifs médicaux ;\n* les réactifs utilisés à des fins de diagnostic in vitro au sens de l'article premier de la loi n° 11-08  relative aux réactifs à usage de diagnostic in vitro ;\n* tous les autres produits de santé dont la liste est fixée par voie réglementaire.""]"," 1. Liste des substances actives mentionnées dans le Bulletin Officiel autorisées sous différentes formes (comme des solutions ou des comprimés) :
   - Fluticasone (DCI), Folinate (De Calcium) (DCI), Fondaparinux (Sodique) (DCI), Formoterol (Fumarate) (DCI), Gadobutrol (DCI), Ganciclovir (DCI), Gefitinib (DCI), Gemcitabine (DCI), Gabapentine (DCI), et beaucoup d'autres.
   - Les substances actives peuvent être trouvées dans différentes sections du Bulletin Officiel, notamment dans les Chapitres 30 du Dahir n° 1-22 portant promulgation de la loi de finances n° 50-22 pour l'année budgétaire 2023.

2. Source citée : Bulletin Officiel Marocain","Les substances actives mentionnées dans le Bulletin Officiel et autorisées sous différentes formes incluent l'Acetylleucine, l'Acide Alendronique, l'Adapalene, l'Aflibercept, l'Agomelatine, et l'Amlodipine, entre autres. Ces substances sont présentées sous diverses formes galéniques comme des solutions et des comprimés. Aucune référence d'article spécifique n'est fournie dans l'extrait.",0.0,0.3333333333333333,0.75,0.914640198782432,gpt-4o-mini,bge-m3,mistral:7b,True,False,False,0.5
Quels sont les diplômes reconnues comme équivalents au diplôme de docteur en médecine selon l'arrêté du ministre de l'enseignement supérieur ?,"[""## Arrêté du ministre de l'enseignement supérieur, de la recherche scientifique et de l'innovation n°2802-22 du 27 rabii I 1444 (24  octobre  2022)  complétant  l'arrêté  n° 2963-97  du 2chaabane 1418 (3décembre 1997) fixant la liste des diplômes reconnus équivalents au diplôme de docteur en médecine.  \nle MINIStRe De l'eNSeIGNeMeNt SUP É RIeUR, De la ReCheRChe SCIeNtIFIQUe et De l'INNOVatION,  \nVu l'arrêté du ministre de l'enseignement supérieur, de  la  recherche  scientifique  et  de  la  culture  n° 2963-97  du 2 chaabane 1418 (3décembre 1997) fixant la liste des diplômes reconnus équivalents au diplôme de docteur en médecine, tel qu'il a été complété ;  \nVu le décret n°2-21-838 du 14 rabii I 1443 (21 octobre 2021) relatif aux attributions du ministre de l'enseignement supérieur, de la recherche scientifique et de l'innovation ;  \nAprès avis de la commission sectorielle des sciences de la santé, réunie en date du 27 juillet 2022 ;  \nAprès avis du conseil national de l'Ordre national des médecins,"", ""## Arrêté du ministre de l'enseignement supérieur, de la recherche scientifique et de l'innovation n°2817-22 du 27 rabii I 1444 (24  octobre  2022)  complétant  l'arrêté  n° 2963-97  du 2chaabane 1418 (3décembre 1997) fixant la liste des diplômes reconnus équivalents au diplôme de docteur en médecine.  \nle MINIStRe De l'eNSeIGNeMeNt SUP É RIeUR, De la ReCheRChe SCIeNtIFIQUe et De l'INNOVatION,  \nVu l'arrêté du ministre de l'enseignement supérieur, de  la  recherche  scientifique  et  de  la  culture  n° 2963-97  du 2 chaabane 1418 (3décembre 1997) fixant la liste des diplômes reconnus équivalents au diplôme de docteur en médecine, tel qu'il a été complété ;  \nVu le décret n°2-21-838 du 14 rabii I 1443 (21 octobre 2021) relatif aux attributions du ministre de l'enseignement supérieur, de la recherche scientifique et de l'innovation ;  \nAprès avis de la commission sectorielle des sciences de la santé, réunie en date du 27 juillet 2022 ;  \nAprès avis du conseil national de l'Ordre national des médecins,"", ""## Arrêté du ministre de l'enseignement supérieur, de la recherche scientifique et de l'innovation n°2808-22 du 27 rabii I 1444 (24  octobre  2022)  complétant  l'arrêté  n° 2963-97  du 2chaabane 1418 (3décembre 1997) fixant la liste des diplômes reconnus équivalents au diplôme de docteur en médecine.  \nle MINIStRe De l'eNSeIGNeMeNt SUP É RIeUR, De la ReCheRChe SCIeNtIFIQUe et De l'INNOVatION,  \nVu l'arrêté du ministre de l'enseignement supérieur, de  la  recherche  scientifique  et  de  la  culture  n° 2963-97  du 2 chaabane 1418 (3décembre 1997) fixant la liste des diplômes reconnus équivalents au diplôme de docteur en médecine, tel qu'il a été complété ;  \nVu le décret n°2-21-838 du 14 rabii I 1443 (21 octobre 2021) relatif aux attributions du ministre de l'enseignement supérieur, de la recherche scientifique et de l'innovation ;  \nAprès avis de la commission sectorielle des sciences de la santé, réunie en date du 27 juillet 2022 ;  \nAprès avis du conseil national de l'Ordre national des médecins,"", ""## Arrêté du ministre de l'enseignement supérieur, de la recherche scientifique et de l'innovation n°1609-25 du 23 hija 1446 (20  juin  2025)  complétant  l'arrêté  n° 2963-97  du 2chaabane 1418 (3décembre 1997) fixant la liste des diplômes reconnus équivalents au diplôme de docteur en médecine.  \nle MINIStRe De l'eNSeIGNeMeNt SUP É RIeUR, De la ReCheRChe SCIeNtIFIQUe et De l'INNOVatION,  \nVu l'arrêté du ministre de l'enseignement supérieur, de  la  recherche  scientifique  et  de  la  culture  n° 2963-97  du 2 chaabane 1418 (3décembre 1997) fixant la liste des diplômes reconnus équivalents au diplôme de docteur en médecine, tel qu'il a été modifié et complété ;  \nVu le décret n°2-24-991 du 24 rabii II 1446 (28 octobre 2024) relatif aux attributions du ministre de l'enseignement supérieur, de la recherche scientifique et de l'innovation ;  \nAprès avis de la commission sectorielle des sciences de la santé, réunie en date du 30 avril 2025 ;  \nAprès avis du conseil national de l'Ordre national des médecins,"", ""## Arrêté du ministre de l'enseignement supérieur, de la recherche scientifique et de l'innovation n°2308-23 du 26 safar 1445 (12 septembre 2023) complétant l'arrêté n°2963-97 du 2chaabane 1418 (3décembre 1997) fixant la liste des diplômes reconnus équivalents au diplôme de docteur en médecine.  \nle MINIStRe De l'eNSeIGNeMeNt SUP É RIeUR, De la ReCheRChe SCIeNtIFIQUe et De l'INNOVatION,  \nVu l'arrêté du ministre de l'enseignement supérieur, de  la  recherche  scientifique  et  de  la  culture  n° 2963-97  du 2 chaabane 1418 (3décembre 1997) fixant la liste des diplômes reconnus équivalents au diplôme de docteur en médecine, tel qu'il a été modifié et complété ;  \nVu le décret n°2-21-838 du 14 rabii I 1443 (21 octobre 2021) relatif aux attributions du ministre de l'enseignement supérieur, de la recherche scientifique et de l'innovation ;  \nAprès avis de la commission sectorielle des sciences de la santé, réunie en date du 11 juillet 2023 ;  \nAprès avis du conseil national de l'Ordre national des médecins,"", ""## Arrêté du ministre de l'enseignement supérieur, de la recherche scientifique et de l'innovation n°1614-25 du 23 hija 1446 (20  juin  2025)  complétant  l'arrêté  n° 2963-97  du 2chaabane 1418 (3décembre 1997) fixant la liste des diplômes reconnus équivalents au diplôme de docteur en médecine.  \nle MINIStRe De l'eNSeIGNeMeNt SUP É RIeUR, De la ReCheRChe SCIeNtIFIQUe et De l'INNOVatION,  \nVu l'arrêté du ministre de l'enseignement supérieur, de  la  recherche  scientifique  et  de  la  culture  n° 2963-97  du 2 chaabane 1418 (3décembre 1997) fixant la liste des diplômes reconnus équivalents au diplôme de docteur en médecine, tel qu'il a été modifié et complété ;  \nVu le décret n°2-24-991 du 24 rabii II 1446 (28 octobre 2024) relatif aux attributions du ministre de l'enseignement supérieur, de la recherche scientifique et de l'innovation ;  \nAprès avis de la commission sectorielle des sciences de la santé, réunie en date du 30 avril 2025 ;  \nAprès avis du conseil national de l'Ordre national des médecins,"", ""## Arrêté du ministre de l'enseignement supérieur, de la  \nrecherche scientifique  et  de  l'innovation  n° 2061-25  \ndu 19 safar 1447 (13 août 2025) complétant  \nl 'arrêté  n° 2963-97  du  2 chaabane  1418  \n(3 décembre 1997) fixant la liste des diplômes  \nreconnus équivalents au diplôme de docteur  \nen médecine ......................................................  \n2581"", ""## Arrêté du ministre de l'enseignement supérieur, de la  \nrecherche scientifique  et  de  l'innovation  n° 2067-25  \ndu 19 safar 1447 (13 août 2025) complétant  \nl 'arrêté  n° 2963-97  du  2 chaabane  1418  \n(3 décembre 1997) fixant la liste des diplômes  \nreconnus équivalents au diplôme de docteur en  \nmédecine. .......................................................  \n2584"", ""## Arrêté du ministre de l'enseignement supérieur, de la recherche scientifique et de l'innovation n°188-23 du 4 rejeb 1444 (26  janvier  2023)  complétant  l'arrêté  n° 2963-97  du 2chaabane 1418 (3décembre 1997) fixant la liste des diplômes reconnus équivalents au diplôme de docteur en médecine.  \nle MINIStRe De l'eNSeIGNeMeNt SUP É RIeUR, De la ReCheRChe SCIeNtIFIQUe et De l'INNOVatION,  \nVu l'arrêté du ministre de l'enseignement supérieur, de  la  recherche  scientifique  et  de  la  culture  n° 2963-97  du 2 chaabane 1418 (3décembre 1997) fixant la liste des diplômes reconnus équivalents au diplôme de docteur en médecine, tel qu'il a été modifié et complété ;  \nVu le décret n°2-21-838 du 14 rabii I 1443 (21 octobre 2021) relatif aux attributions du ministre de l'enseignement supérieur, de la recherche scientifique et de l'innovation ;  \nAprès avis de la commission sectorielle des sciences de la santé, réunie en date du 21 décembre 2022 ;  \nAprès avis du conseil national de l'Ordre national des médecins,"", ""## Arrêté du ministre de l'enseignement supérieur, de la recherche scientifique et de l'innovation n°609-23 du 9 chaabane 1444 (2 mars 2023) complétant l'arrêté n°2963-97 du 2chaabane 1418 (3décembre 1997) fixant la liste des diplômes reconnus équivalents au diplôme de docteur en médecine.  \nle MINIStRe De l'eNSeIGNeMeNt SUP É RIeUR, De la ReCheRChe SCIeNtIFIQUe et De l'INNOVatION,  \nVu l'arrêté du ministre de l'enseignement supérieur, de  la  recherche  scientifique  et  de  la  culture  n° 2963-97  du 2 chaabane 1418 (3décembre 1997) fixant la liste des diplômes reconnus équivalents au diplôme de docteur en médecine, tel qu'il a été modifié et complété ;  \nVu le décret n°2-21-838 du 14 rabii I 1443 (21 octobre 2021) relatif aux attributions du ministre de l'enseignement supérieur, de la recherche scientifique et de l'innovation ;  \nAprès avis de la commission sectorielle des sciences de la santé, réunie en date du 2 février 2023 ;  \nAprès avis du conseil national de l'Ordre national des médecins,"", ""## Arrêté du ministre de l'enseignement supérieur, de la recherche scientifique et de l'innovation n°2330-23 du 29 safar 1445 (15 septembre 2023) complétant l'arrêté n°2963-97 du 2chaabane 1418 (3décembre 1997) fixant la liste des diplômes reconnus équivalents au diplôme de docteur en médecine.  \nle MINIStRe De l'eNSeIGNeMeNt SUP É RIeUR, De la ReCheRChe SCIeNtIFIQUe et De l'INNOVatION,  \nVu l'arrêté du ministre de l'enseignement supérieur, de  la  recherche  scientifique  et  de  la  culture  n° 2963-97  du 2 chaabane 1418 (3décembre 1997) fixant la liste des diplômes reconnus équivalents au diplôme de docteur en médecine, tel qu'il a été modifié et complété ;  \nVu le décret n°2-21-838 du 14 rabii I 1443 (21 octobre 2021) relatif aux attributions du ministre de l'enseignement supérieur, de la recherche scientifique et de l'innovation ;  \nAprès avis de la commission sectorielle des sciences de la santé, réunie en date du 11 juillet 2023 ;  \nAprès avis du conseil national de l'Ordre national des médecins,"", ""## Arrêté du ministre de l'enseignement supérieur, de la recherche scientifique et de l'innovation n°610-23 du 9 chaabane 1444 (2 mars 2023) complétant l'arrêté n°2963-97 du 2chaabane 1418 (3décembre 1997) fixant la liste des diplômes reconnus équivalents au diplôme de docteur en médecine.  \nle MINIStRe De l'eNSeIGNeMeNt SUP É RIeUR, De la ReCheRChe SCIeNtIFIQUe et De l'INNOVatION,  \nVu l'arrêté du ministre de l'enseignement supérieur, de  la  recherche  scientifique  et  de  la  culture  n° 2963-97  du 2 chaabane 1418 (3décembre 1997) fixant la liste des diplômes reconnus équivalents au diplôme de docteur en médecine, tel qu'il a été modifié et complété ;  \nVu le décret n°2-21-838 du 14 rabii I 1443 (21 octobre 2021) relatif aux attributions du ministre de l'enseignement supérieur, de la recherche scientifique et de l'innovation ;  \nAprès avis de la commission sectorielle des sciences de la santé, réunie en date du 2 février 2023 ;  \nAprès avis du conseil national de l'Ordre national des médecins,""]"," 1. Les diplômes reconnus comme équivalents au diplôme de docteur en médecine selon l'arrêté du ministre de l'enseignement supérieur sont ceux listés dans les différents arrêtés cités dans les extraits.
2. Sources citées : Les extracts fournis","L'extrait ne fournit pas de détails sur les diplômes reconnus comme équivalents au diplôme de docteur en médecine. Pour obtenir cette information, il faudrait consulter la liste mentionnée dans l'arrêté n° 2963-97.",0.9999999999916667,1.0,1.0,0.0,gpt-4o-mini,bge-m3,mistral:7b,True,False,False,0.5
Pourquoi le Maroc est-il classé comme étant très vulnérable aux sécheresses et quels impacts cela a-t-il sur ses ressources en eau ?,"[""#### 1.1. État des lieux  \nSitué  dans  une  zone  semi-aride  fortement  vulnérable  au  changement  climatique,  le  Maroc subit  de  manière  croissante  des  événements  extrêmes  induits  par  ce  phénomène,  tels  que  la sécheresse, avec des impacts notables sur ses ressources hydriques. En effet, le pays est classé actuellement au /uniF63A/uniF63B ème rang mondial pour ce qui est de l'exposition aux risques hydriques. Des périodes de sécheresse intense s'étaient manifestées dans le passé, un phénomène qui survenait en moyenne tous les /uniF63A/uniF639 ans. Au cours du /uniF63A/uniF639 e siècle, le pays aurait connu régulièrement des épisodes de sécheresse de différentes durées et intensités avec plus de /uniF6DC/uniF63A périodes sèches majeures, qui s'étaient étendues sur l'ensemble du pays /uniF6DC/uniF63B/uniF63F .  \nAu cours des dernières décennies, Le Maroc a dû faire face à une sécheresse d'une intensité encore plus sévère, avec /uniF63D épisodes survenus en l'espace de /uniF6DC/uniF6DC années : soit un épisode tous les /uniF63A,/uniF63A ans en moyenne contre une fois tous les /uniF63E à /uniF63F ans en moyenne durant la période /uniF6DC/uniF641/uniF640/uniF63D-/uniF63A/uniF639/uniF6DC/uniF639 et une fois tous les /uniF6DC/uniF6DC  ans en moyenne durant le siècle dernier jusqu'au début des années /uniF6DC/uniF641/uniF640/uniF639."", ""#### Définition de la situation de sécheresse  \n<!-- image -->  \nPerception de la gravité du problème de la sécheresse au Maroc  \n<!-- image -->  \nConseil Economique, Social et Environnemental  \n5% 10% 15% 20% 25% 30% 35% 40% 45%  \nPrès  des  deux  tiers  (/uniF63E/uniF639,/uniF641/uniF639%)  des  répondants  rapportent  avoir  été  affectés,  directement  ou indirectement,  par  les  conséquences  de  la  sécheresse.  Un  peu  plus  de  la  moitié  (/uniF63D/uniF63F ,/uniF639/uniF63B%)  des participant.e.s témoignent de difficultés d'accès aux produits agricoles ou alimentaires imputables à la sécheresse. Ainsi, /uniF63A/uniF639,/uniF63E/uniF63B% des répondants considèrent que ce phénomène naturel entraine une insuffisance de disponibilité des produits agricoles sur le marché, tandis que /uniF63B/uniF63E,/uniF63C/uniF639% observent une baisse de leur pouvoir d'achat  en raison de la cherté des produits alimentaires induite par la sécheresse. Il convient de noter qu'un quart des répondants (/uniF63A/uniF63D,/uniF63E/uniF6DC%) déclarent avoir rencontré des difficultés pour accéder  à l'eau.  \nImpact de la sécheresse sur les répondants  \n<!-- image -->  \nLes  répondants convergent largement vers le constat que le stress hydrique est accentué par la  consommation  irresponsable  (/uniF63F/uniF6DC,/uniF63A/uniF63A%),  voire  illégale  (/uniF63E/uniF641,/uniF6DC/uniF63A%)  de  l'eau.  L 'arrosage  des  espaces verts et des terrains de sport (/uniF63C/uniF63D,/uniF639/uniF640%), ainsi que l'agriculture irriguée (/uniF63C/uniF63F ,/uniF63B/uniF63E%), arrivent en tête des activités  auxquelles  les  participant.e.s  imputent  la  responsabilité  de  l'aggravation  du  problème de l'eau au Maroc, loin devant d'autres secteurs économiques cités tels que  le tourisme (/uniF63B/uniF63A,/uniF63E/uniF63B%) et l'industrie (/uniF63B/uniF63A,/uniF63E/uniF63B%). Les commentaires émis sur les réseaux sociaux convergent également vers une préconisation de restreindre, voire d'interdire, la culture intensive et orientée vers l'export de certaines variétés agricoles. L 'avocat et la pastèque sont plus spécifiquement désignés à ce propos. La réduction de l'arrosage des espaces verts ou de terrains de sport, notamment ceux des  golfs, est évoquée dans de nombreux commentaires,  préconisant de privilégier l'utilisation  des eaux usées traitées dans ces cas.  \nPar ailleurs, près de la moitié des répondants font part de leur préoccupation quant à la diminution des  quantités  d'eau  disponibles  ou  utilisables,  en  raison  des  déperditions  dans  les  canaux  de distribution (/uniF63C/uniF63D,/uniF63C/uniF63B%),  ou de la pollution (/uniF63C/uniF63B,/uniF6DC/uniF63D%).  \nActivités et secteurs accentuant le stress hydrique  \n<!-- image -->  \nRapport Annuel 2022  \n161  \n162"", ""#### Le dessalement : une solution optimale qui doit tenir compte de la préservation de  l'écosystème  marin  \nLe  Maroc  est  actuellement  confronté  à  une  croissance  soutenue  du  déficit    hydrique,  réalité devenue  structurelle  en  raison  de  plusieurs  facteurs.  D'une  part,  le  pays  est  de  plus  en  plus vulnérable aux effets du changement climatique, se manifestant par des épisodes de sécheresse et d'inondations de plus en plus fréquents, une diminution des précipitations et une augmentation des températures. D'autre part, la demande en eau ne cesse de croître, tandis que les ressources disponibles sont surexploitées et leur qualité se dégrade en raison de diverses formes de pollution, en  sus  des  pertes  et  des  gaspillages.  En  parallèle,  plusieurs  bassins  hydrauliques  et  nappes phréatiques  enregistrent  un  déficit  sévère.  Cette  situation  est  d'autant  plus  alarmante  que  la disponibilité des ressources en eau dans le pays en /uniF63A/uniF639/uniF63A/uniF63B est de /uniF63E/uniF639/uniF63E m /uniF63B /hab/an, soit un niveau endeçà du seuil de pénurie fixé à /uniF6DC./uniF639/uniF639/uniF639 m /uniF63B /hab/an /uniF6DC/uniF63A/uniF63F et les projections démontrent que ces tendances s'accentueront davantage dans le futur.  \nTenant compte de cette situation et conformément aux Orientations de Sa Majesté le Roi /uniF6DC/uniF63A/uniF640 ,   plusieurs plans d'actions ont été lancés ces trois dernières années par les pouvoirs publics, dans le cadre du programme national pour l'approvisionnement en eau potable et l'irrigation /uniF63A/uniF639/uniF63A/uniF639-/uniF63A/uniF639/uniF63A/uniF63F , en matière de gestion de l'offre et de la demande en eau. Un tournant décisif a été noté dans le domaine de la mobilisation des ressources en eau non conventionnelles, en particulier à travers, l'accélération des projets de stations de dessalement de l'eau de mer. Dans ce sens, plusieurs projets structurants sont planifiés pour l'installation d'environ /uniF63A/uniF639 stations de dessalement à l'horizon /uniF63A/uniF639/uniF63B/uniF639, sachant que  \n127 - Audition au CESE de Monsieur Nizar Baraka, Ministre de l'équipement et de l'eau, le 30 mai 2023.  \n128 - Présentation du Programme national pour l'approvisionnement en eau potable et l'irrigation devant SA Majesté le Roi le 13 janvier 2020 ;  \nDiscours de SM Le Roi à l'ouverture de la session parlementaire d'octobre 2022 ;  \nSéance de travail présidé par SM le Roi le 09 mai 2023 consacrée au suivi du programme national pour l'approvisionnement en eau potable et l'irrigation 2020-2027 ;  \nRapport Annuel 2022  \n83  \n84  \nle Maroc dispose à ce jour /uniF6DC/uniF63A/uniF641 de /uniF6DC/uniF63A stations avec une capacité de production annuelle de près de /uniF6DC /uniF63F /uniF641,/uniF63B millions de m /uniF63B .  \nAinsi, un recours raisonné au dessalement de l'eau de mer  permettrait au Maroc de :"", ""#### 2.2. Mesures visant le traitement du stress hydrique à moyen et long terme  \nLes  récents  épisodes  de  sécheresses  qui  ont  frappé  le  Maroc  ont  certes  exacerbé  le  déficit hydrique à des niveaux très sévères. Toutefois, ce déficit découle de la conjonction de plusieurs facteurs climatiques et non-climatiques tels qu'une gouvernance de l'eau encore inaboutie, des infrastructures hydriques sous-optimisées et une exploitation abusive, voire illicite, des ressources. La  demande  croissante  en  eau,  notamment  dans  le  secteur  agricole,  dépasse  les  ressources renouvelables disponibles, entraînant ainsi  des pertes élevées et une dégradation de la qualité de l'eau. Cette situation en perdurant est de nature à aggraver le déficit hydrique et de provoquer des conflits entre différents usages et régions qui partagent les mêmes ressources. Les bassins les plus touchés actuellement sont Moulouya, Oum Er-Rbia, Sebou et Loukkos. D'autres graves conséquences seraient à craindre, telles que des déplacements massifs de population, l'abandon des terres agricoles, la perte du patrimoine et des pratiques agricoles, ainsi que la diminution des revenus et l'augmentation du chômage.  \nFace à cette situation, un ensemble de mesures proactives et structurantes ont été adoptées en matière de gestion de l'offre et de la demande en eau. En particulier, ces mesures visent : la gestion de l'offre à travers l'accélération du rythme de réalisation des projets de mobilisation des ressources en eau conventionnelles couplée à la mise en œuvre de projets de mobilisation des ressources en eau non-conventionnelles ainsi que la gestion de la demande à travers le renforcement de l'efficacité hydrique (Fig. /uniF63A) /uniF6DC/uniF63E/uniF63A .  \n161 - Il s'agit de la Circulaire n° 1937 du 17 février 2022, la Circulaire n°12312 du 19 juillet 2022 et la Circulaire n°19325 du 24 octobre 2022. La Circulaire n°23748 du 23 Décembre 2022 a été adoptée pour le suivi de la mise en œuvre de ces trois circulaires.  \n162 - Audition du ministère de l'Équipement et de l'Eau (23 mars 2023).  \nConseil Economique, Social et Environnemental  \nFig. 2 - Mesures stratégiques à caractère proactif et structurant en matière de gestion de l'eau 163  \n<!-- image -->"", ""- /uniF6BA Promouvoir et valoriser l'entrepreneuriat des femmes au Maroc.  \nRapport Annuel 2022  \n19  \n20  \nLe cinquième point de vigilance du présent rapport s'est penché sur la question du dessalement de l'eau de mer, désormais considéré comme l'une des solutions prometteuses pour mobiliser d'importants  volumes  d'eaux  non-conventionnelles,  indispensables  à  la  sécurité  hydrique  et alimentaire du pays. Dans ce sens, le CESE préconise d'inscrire le dessalement dans une vision nationale concertée afin de parvenir à un mix hydrique résilient face aux mutations climatiques, capable de valoriser et de mobiliser de manière responsable et durable les ressources hydriques conventionnelles  et  non-conventionnelles  pour  satisfaire  la  demande  en  eau  potable  des ménages ainsi que les besoins spécifiques des secteurs productifs et des territoires. Par ailleurs, pour neutraliser les impacts délétères potentiels du dessalement, notamment sur les écosystèmes marins dans leur diversité, il convient de veiller à ce que les stations de dessalement soient munies de dispositifs de contrôle, de surveillance, de veille et de suivi continu.  \n## Majesté,  \nDans le cadre du présent rapport, le CESE a jugé opportun de consacrer le focus de cette année à la gestion du stress hydrique, notamment au vu de la sécheresse sévère que le pays a endurée ces dernières quatre années, culminant en /uniF63A/uniF639/uniF63A/uniF63A. L 'augmentation de la fréquence et de l'intensité de la sécheresse, dans le contexte du changement climatique, s'est traduite par un sévère déficit hydrique  touchant  tous  les  usages  (agricole,  industriel,  touristique,  domestique, etc. ),  avec  des répercussions  majeures  à  la  fois  sur  l'économie,  les  écosystèmes,  la  sécurité  humaine  (surtout hydrique,  alimentaire  et  sanitaire)  et  les  moyens  de  subsistance  pour  une  grande  part  de  la population.  \nLa  criticité  de  la  situation  du  stress  hydrique  interpelle  toutes  les  composantes  de  la  société (citoyens, usagers, décideurs, entrepreneurs, agriculteurs, etc. ) et convoque de ce fait, une rupture majeure dans nos habitudes de consommation ainsi que des inflexions dans les choix politiques.  \nJadis perçue comme un risque conjoncturel, la sécheresse est dorénavant une donne structurelle, exacerbant le stress hydrique qui assaille le pays. Pour répondre à cet enjeu, une intervention urgente  visant  à  atténuer  ses  effets  immédiats,  notamment  sur  les  populations,  secteurs  et territoires  vulnérables,  se  révèle  vitale.  \nIl  convient  de  rappeler que les pouvoirs publics ont fait preuve de réactivité en déployant un ensemble de mesures de portées conjoncturelle et structurelle afin d'atténuer les effets immédiats de la sécheresse et faire face au stress hydrique à moyen et long termes."", ""### Partie II  \n#### Focus Pour une gestion efficiente du déficit hydrique  \nAu Maroc, la période s'étendant de /uniF63A/uniF639/uniF6DC/uniF641 à /uniF63A/uniF639/uniF63A/uniF63A a été marquée par une sécheresse sans précédent depuis les années /uniF63E/uniF639, caractérisée par un déficit pluviométrique de -/uniF63B/uniF63A% par rapport à la normale climatologique, établie sur la période /uniF6DC/uniF641/uniF640/uniF6DC-/uniF63A/uniF639/uniF6DC/uniF639. L'année  /uniF63A/uniF639/uniF63A/uniF63A,  en  particulier,  s'est  distinguée  comme  étant  celle  des  extrêmes météorologiques  jamais  enregistrés  depuis  plus  de  /uniF63C/uniF639  ans,  où  l'anomalie  de la  température  moyenne  annuelle  a  atteint  +/uniF6DC,/uniF63E/uniF63B°C  par  rapport  à  la  normale, accompagnée d'un déficit pluviométrique annuel d'environ /uniF63A/uniF63F%.  \nL'augmentation de la fréquence et de l'intensité de la sécheresse, sous l'effet du changement climatique, s'est traduite ces dernières années par un grave déficit hydrique.  Ce  dernier  touche  tous  les  usages  (agricole,  industriel,  touristique, domestique, etc. ),  avec  des  répercussions majeures à la fois sur l'économie, les écosystèmes, la sécurité humaine (surtout hydrique, alimentaire et sanitaire) et les sources de revenus d'une partie croissante de la population.  \nLa criticité de la situation du stress hydrique interpelle toutes les composantes de  la  société  (citoyens,  usagers,  décideurs,  entrepreneurs,  agriculteurs, etc. )  et appelle de ce fait, une rupture majeure dans nos habitudes de consommation ainsi que des inflexions dans les choix politiques.  \nRapport Annuel 2022 Jadis  perçue  comme  un  risque  conjoncturel,  la  sécheresse  est  dorénavant une donne structurelle exacerbant le stress hydrique qui assaille le pays. Pour répondre  à  cet  enjeu,  une  intervention  urgente  visant  à  atténuer  ses  effets immédiats, notamment sur les populations, secteurs et territoires vulnérables, se révèle  vitale.  \nToutefois, le traitement optimal du stress hydrique - qui est également exacerbé par d'autres facteurs tels que l'augmentation de la demande en eau, les pertes et les pollutions - nécessite de mettre en place des mesures stratégiques s'inscrivant dans la perspective d'une gouvernance efficace de l'eau, en pleine convergence avec la réforme d'autres secteurs, notamment le secteur agricole."", ""#### 1.1. État des lieux  \nSitué  dans  une  zone  semi-aride  fortement  vulnérable  au  changement  climatique,  le  Maroc subit  de  manière  croissante  des  événements  extrêmes  induits  par  ce  phénomène,  tels  que  la sécheresse, avec des impacts notables sur ses ressources hydriques. En effet, le pays est classé actuellement au /uniF63A/uniF63B ème rang mondial pour ce qui est de l'exposition aux risques hydriques. Des périodes de sécheresse intense s'étaient manifestées dans le passé, un phénomène qui survenait en moyenne tous les /uniF63A/uniF639 ans. Au cours du /uniF63A/uniF639 e siècle, le pays aurait connu régulièrement des épisodes de sécheresse de différentes durées et intensités avec plus de /uniF6DC/uniF63A périodes sèches majeures, qui s'étaient étendues sur l'ensemble du pays /uniF6DC/uniF63B/uniF63F .  \nAu cours des dernières décennies, Le Maroc a dû faire face à une sécheresse d'une intensité encore plus sévère, avec /uniF63D épisodes survenus en l'espace de /uniF6DC/uniF6DC années : soit un épisode tous les /uniF63A,/uniF63A ans en moyenne contre une fois tous les /uniF63E à /uniF63F ans en moyenne durant la période /uniF6DC/uniF641/uniF640/uniF63D-/uniF63A/uniF639/uniF6DC/uniF639 et une fois tous les /uniF6DC/uniF6DC  ans en moyenne durant le siècle dernier jusqu'au début des années /uniF6DC/uniF641/uniF640/uniF639."", ""#### 2.2. Mesures visant le traitement du stress hydrique à moyen et long terme  \nLes  récents  épisodes  de  sécheresses  qui  ont  frappé  le  Maroc  ont  certes  exacerbé  le  déficit hydrique à des niveaux très sévères. Toutefois, ce déficit découle de la conjonction de plusieurs facteurs climatiques et non-climatiques tels qu'une gouvernance de l'eau encore inaboutie, des infrastructures hydriques sous-optimisées et une exploitation abusive, voire illicite, des ressources. La  demande  croissante  en  eau,  notamment  dans  le  secteur  agricole,  dépasse  les  ressources renouvelables disponibles, entraînant ainsi  des pertes élevées et une dégradation de la qualité de l'eau. Cette situation en perdurant est de nature à aggraver le déficit hydrique et de provoquer des conflits entre différents usages et régions qui partagent les mêmes ressources. Les bassins les plus touchés actuellement sont Moulouya, Oum Er-Rbia, Sebou et Loukkos. D'autres graves conséquences seraient à craindre, telles que des déplacements massifs de population, l'abandon des terres agricoles, la perte du patrimoine et des pratiques agricoles, ainsi que la diminution des revenus et l'augmentation du chômage.  \nFace à cette situation, un ensemble de mesures proactives et structurantes ont été adoptées en matière de gestion de l'offre et de la demande en eau. En particulier, ces mesures visent : la gestion de l'offre à travers l'accélération du rythme de réalisation des projets de mobilisation des ressources en eau conventionnelles couplée à la mise en œuvre de projets de mobilisation des ressources en eau non-conventionnelles ainsi que la gestion de la demande à travers le renforcement de l'efficacité hydrique (Fig. /uniF63A) /uniF6DC/uniF63E/uniF63A .  \n161 - Il s'agit de la Circulaire n° 1937 du 17 février 2022, la Circulaire n°12312 du 19 juillet 2022 et la Circulaire n°19325 du 24 octobre 2022. La Circulaire n°23748 du 23 Décembre 2022 a été adoptée pour le suivi de la mise en œuvre de ces trois circulaires.  \n162 - Audition du ministère de l'Équipement et de l'Eau (23 mars 2023).  \nConseil Economique, Social et Environnemental  \nFig. 2 - Mesures stratégiques à caractère proactif et structurant en matière de gestion de l'eau 163  \n<!-- image -->"", ""#### Définition de la situation de sécheresse  \n<!-- image -->  \nPerception de la gravité du problème de la sécheresse au Maroc  \n<!-- image -->  \nConseil Economique, Social et Environnemental  \n5% 10% 15% 20% 25% 30% 35% 40% 45%  \nPrès  des  deux  tiers  (/uniF63E/uniF639,/uniF641/uniF639%)  des  répondants  rapportent  avoir  été  affectés,  directement  ou indirectement,  par  les  conséquences  de  la  sécheresse.  Un  peu  plus  de  la  moitié  (/uniF63D/uniF63F ,/uniF639/uniF63B%)  des participant.e.s témoignent de difficultés d'accès aux produits agricoles ou alimentaires imputables à la sécheresse. Ainsi, /uniF63A/uniF639,/uniF63E/uniF63B% des répondants considèrent que ce phénomène naturel entraine une insuffisance de disponibilité des produits agricoles sur le marché, tandis que /uniF63B/uniF63E,/uniF63C/uniF639% observent une baisse de leur pouvoir d'achat  en raison de la cherté des produits alimentaires induite par la sécheresse. Il convient de noter qu'un quart des répondants (/uniF63A/uniF63D,/uniF63E/uniF6DC%) déclarent avoir rencontré des difficultés pour accéder  à l'eau.  \nImpact de la sécheresse sur les répondants  \n<!-- image -->  \nLes  répondants convergent largement vers le constat que le stress hydrique est accentué par la  consommation  irresponsable  (/uniF63F/uniF6DC,/uniF63A/uniF63A%),  voire  illégale  (/uniF63E/uniF641,/uniF6DC/uniF63A%)  de  l'eau.  L 'arrosage  des  espaces verts et des terrains de sport (/uniF63C/uniF63D,/uniF639/uniF640%), ainsi que l'agriculture irriguée (/uniF63C/uniF63F ,/uniF63B/uniF63E%), arrivent en tête des activités  auxquelles  les  participant.e.s  imputent  la  responsabilité  de  l'aggravation  du  problème de l'eau au Maroc, loin devant d'autres secteurs économiques cités tels que  le tourisme (/uniF63B/uniF63A,/uniF63E/uniF63B%) et l'industrie (/uniF63B/uniF63A,/uniF63E/uniF63B%). Les commentaires émis sur les réseaux sociaux convergent également vers une préconisation de restreindre, voire d'interdire, la culture intensive et orientée vers l'export de certaines variétés agricoles. L 'avocat et la pastèque sont plus spécifiquement désignés à ce propos. La réduction de l'arrosage des espaces verts ou de terrains de sport, notamment ceux des  golfs, est évoquée dans de nombreux commentaires,  préconisant de privilégier l'utilisation  des eaux usées traitées dans ces cas.  \nPar ailleurs, près de la moitié des répondants font part de leur préoccupation quant à la diminution des  quantités  d'eau  disponibles  ou  utilisables,  en  raison  des  déperditions  dans  les  canaux  de distribution (/uniF63C/uniF63D,/uniF63C/uniF63B%),  ou de la pollution (/uniF63C/uniF63B,/uniF6DC/uniF63D%).  \nActivités et secteurs accentuant le stress hydrique  \n<!-- image -->  \nRapport Annuel 2022  \n161  \n162"", ""### Partie II  \n#### Focus Pour une gestion efficiente du déficit hydrique  \nAu Maroc, la période s'étendant de /uniF63A/uniF639/uniF6DC/uniF641 à /uniF63A/uniF639/uniF63A/uniF63A a été marquée par une sécheresse sans précédent depuis les années /uniF63E/uniF639, caractérisée par un déficit pluviométrique de -/uniF63B/uniF63A% par rapport à la normale climatologique, établie sur la période /uniF6DC/uniF641/uniF640/uniF6DC-/uniF63A/uniF639/uniF6DC/uniF639. L'année  /uniF63A/uniF639/uniF63A/uniF63A,  en  particulier,  s'est  distinguée  comme  étant  celle  des  extrêmes météorologiques  jamais  enregistrés  depuis  plus  de  /uniF63C/uniF639  ans,  où  l'anomalie  de la  température  moyenne  annuelle  a  atteint  +/uniF6DC,/uniF63E/uniF63B°C  par  rapport  à  la  normale, accompagnée d'un déficit pluviométrique annuel d'environ /uniF63A/uniF63F%.  \nL'augmentation de la fréquence et de l'intensité de la sécheresse, sous l'effet du changement climatique, s'est traduite ces dernières années par un grave déficit hydrique.  Ce  dernier  touche  tous  les  usages  (agricole,  industriel,  touristique, domestique, etc. ),  avec  des  répercussions majeures à la fois sur l'économie, les écosystèmes, la sécurité humaine (surtout hydrique, alimentaire et sanitaire) et les sources de revenus d'une partie croissante de la population.  \nLa criticité de la situation du stress hydrique interpelle toutes les composantes de  la  société  (citoyens,  usagers,  décideurs,  entrepreneurs,  agriculteurs, etc. )  et appelle de ce fait, une rupture majeure dans nos habitudes de consommation ainsi que des inflexions dans les choix politiques.  \nRapport Annuel 2022 Jadis  perçue  comme  un  risque  conjoncturel,  la  sécheresse  est  dorénavant une donne structurelle exacerbant le stress hydrique qui assaille le pays. Pour répondre  à  cet  enjeu,  une  intervention  urgente  visant  à  atténuer  ses  effets immédiats, notamment sur les populations, secteurs et territoires vulnérables, se révèle  vitale.  \nToutefois, le traitement optimal du stress hydrique - qui est également exacerbé par d'autres facteurs tels que l'augmentation de la demande en eau, les pertes et les pollutions - nécessite de mettre en place des mesures stratégiques s'inscrivant dans la perspective d'une gouvernance efficace de l'eau, en pleine convergence avec la réforme d'autres secteurs, notamment le secteur agricole."", ""#### Résultats du questionnaire sur la plateforme «ouchariko» 145  \nLa consultation citoyenne à ce sujet révèle  que la sécheresse est principalement associée au manque de précipitations (/uniF63E/uniF640,/uniF641/uniF63C%)  et  à  des  difficultés  d'accès  à  l'eau  potable  (/uniF63E/uniF63B,/uniF640/uniF63D%).  Une part importante des répondants souligne également son impact sur la disponibilité (/uniF63B/uniF63D%) et l'accessibilité (/uniF63B/uniF63E,/uniF63E/uniF63E%) des produits agricoles et alimentaires sur le marché interne. La gravité de la situation est  unanimement  reconnue par une écrasante majorité des  participants (/uniF641/uniF63C,/uniF63B/uniF63D%), avec des appels urgents à prendre des mesures nécessaires pour faire face aux conséquences de la sécheresse."", ""#### 3.1. Pour une gestion efficace de la sécheresse  \nLe CESE recommande les mesures suivantes :  \n- /uniF6BA Développer un plan national de sécheresse, sur la base d'un système d'alerte précoce, compilant des données agrométéorologiques et hydrologiques en temps réel, pour ensuite définir, pour chaque niveau d'alerte, les mesures à prendre, ainsi que les entités responsables de leur mise en œuvre. Il convient de décliner ces mesures au niveau territorial en prévoyant une batterie de mesures adaptées concernant l'offre en eau et l'efficacité hydrique.\n- /uniF6BA Mettre en place un mécanisme institutionnel d'arbitrage et de coordination en période de sécheresse, basé sur une large concertation multi-acteurs au niveau central et territorial, visant à opérer un arbitrage inclusif et équitable entre les divers usages de l'eau, tout en garantissant la préservation du patrimoine agricole, la sécurité alimentaire et hydrique, ainsi que le maintien de l'emploi.\n- /uniF6BA Généraliser  l'assurance  agricole  au  profit  des  petits  agriculteurs  pour  pouvoir  atténuer  les effets de la sécheresse sur cette catégorie vulnérable qui se retrouve souvent sans revenus à cause de la sécheresse. La gestion des différents risques inhérents à la sécheresse requiert également la sécurisation des investissements agricoles, quelles que soient leur envergure et leur répartition géographique à travers le territoire national.\n- /uniF6BA Maintenir le pouvoir d'achat des citoyens en temps de sécheresse en mobilisant l'ensemble des leviers à disposition ( restrictions sur l'export des produits alimentaires de base, allègement/ suspension  des  taxes  douanières  sur  l'import  des  produits  alimentaires  de  base  ou  des intrants, etc. ).""]"," 1. Le Maroc est classé comme étant très vulnérable aux sécheresses en raison de plusieurs facteurs. Tout d'abord, le pays a un climat méditerranéen à désertique qui présente des précipitations irrégulières et une éventuelle diminution des pluies dans certaines régions. De plus, l'agriculture intensive et la demande croissante en eau pour les besoins domestiques, industriels et touristiques ont accru le stress hydrique du pays.
2. Les sources citées :
   - Rapport Annuel 2022 (dans l'extrait)
   - Partie II > Focus Pour une gestion efficiente du déficit hydrique (dans l'extrait)","Le Maroc est classé comme étant très vulnérable aux sécheresses en raison de sa situation dans une zone semi-aride et de l'augmentation des événements extrêmes liés au changement climatique, ce qui a des impacts notables sur ses ressources hydriques. Les périodes de sécheresse intense se sont multipliées, entraînant une aggravation des risques hydriques.",0.9999999999916667,1.0,0.75,0.9523977127383825,gpt-4o-mini,bge-m3,mistral:7b,True,False,False,0.5
Que doit faire le Président de l'Instance s'il reçoit une plainte nécessitant une action rapide concernant un cas de corruption ?,"[""###### Article 23  \nS'il appert au Président de l'Instance que la dénonciation, la  plainte  ou  l'information  reçue  comporte  des  données exigeant une intervention immédiate pour constater l'un des cas de corruption prévus à l'article 3 ci-dessus, il désigne, sous réserve des dispositions de l'article 25 ci-dessous, un Investigateur pour mener une enquête et recueillir des données à cet effet, les vérifier et en dresser un procès-verbal. Le Président avise immédiatement le ministère public compétent. Ce dernier doit tenir le Président de l'Instance informé des mesures ou des décisions prises au sujet de l'affaire dont il est saisi.  \nDans ce cas, le Président de l'Instance doit en aviser le Conseil lors de sa plus proche réunion."", ""###### Article 21  \nToute personne physique ou morale ainsi que tout chef d'administration ou fonctionnaire qui détient des données ou des informations fiables, des présomptions ou des preuves indiquant l'existence d'un cas de corruption, peut les porter à la connaissance du Président de l'Instance.  \nDe même, toute personne physique ou morale, ayant subi ou susceptible de subir un préjudice du fait d'un cas de corruption, peut, en personne ou par l'intermédiaire de son représentant, adresser sa plainte au Président de l'Instance.  \nPour être recevable, la dénonciation ou la plainte doit :  \n- être écrite et signée par le dénonciateur ou le plaignant en personne, en indiquant son nom complet ;\n- comporter toutes les mentions relatives à l'identité du dénonciateur ou du plaignant ;\n- être accompagnée des pièces, des documents et des informations, s'ils existent, et de tout autre preuve susceptible de démontrer le cas de corruption ;\n-  préciser  la  ou  les  parties  ou  la  ou  les  personnes concernées par le cas de corruption.  \nEn  outre,  s'il  s'agit  d'une  plainte,  elle  doit  être accompagnée d'une déclaration du plaignant indiquant que le cas de corruption objet de sa plainte n'a pas été portée auparavant devant la justice.  \nLa dénonciation ou la plainte ne doit comporter aucune expression injurieuse ou diffamatoire contre une personne ou une partie, sous peine de l'application de la législation en vigueur.  \nSi le dénonciateur ou le plaignant est dans l'impossibilité de faire parvenir à l'Instance, par écrit, sa dénonciation ou sa plainte, il peut présenter une déclaration orale dont la teneur est consignée dans un procès-verbal spécial, dressé par les soins des services compétents de l'Instance et signé, selon le cas, par le dénonciateur ou le plaignant qui en reçoit copie. La dénonciation ou la plainte doit être accompagnée de pièces ou documents de preuve, s'ils existent.  \nL'Instance peut également s'auto-saisir d'office de tout cas de corruption porté à sa connaissance. Aussi, la décision d'auto-saisine est prise au nom du Conseil de l'Instance par la commission mentionnée à l'article 34 ci-dessous.  \nSous  réserve  des  dispositions  de  la  présente  loi, notamment de l'article  7  ci-dessus,  l'Instance  exerce  sa compétence en ce qui concerne le cas de corruption objet d'auto-saisine,  selon  les  mêmes  procédures  prévues  aux articles 22 à 38 ci-dessous.  \nLe Conseil de l'Instance doit être informé lors de sa plus proche réunion, des cas où l'Instance est intervenue par auto-saisine."", ""###### Article 22  \nS'il s'avère à l'Instance que la dénonciation, la plainte ou l'information reçue ne comporte pas de données, preuves ou présomptions établissant l'existence d'un cas de corruption ou concorde avec les informations dont l'Instance dispose à l'occasion de l'examen d'autres dossiers, ou si les faits relatés par la dénonciation ou la plainte font l'objet d'une poursuite judiciaire ou d'un jugement déjà prononcé, elle prend une décision motivée portant classement de l'affaire et en informe le dénonciateur ou le plaignant dans un délai de quinze (15) jours à compter de la date de la prise de décision de classement. Le Président de l'Instance doit, dans ce cas, en informer le Conseil de l'Instance lors de sa plus proche réunion.  \nS'il s'avère au Président de l'Instance que l'objet de la dénonciation ou de la plainte ne relève pas des missions de l'Instance, il oriente le dénonciateur ou le plaignant selon l'objet de la dénonciation ou de la plainte."", ""###### Article 24  \nS'il appert au Président de l'Instance qu'une dénonciation, une plainte ou une information reçue remplit les conditions requises, qu'elle ne nécessite pas une intervention immédiate, ni le renvoi direct au Ministère public, tout en comportant des  éléments nécessitant son examen et l'ouverture d'un dossier, il désigne un ou plusieurs Investigateurs de l'Instance pour examiner l'objet de la dénonciation, de la plainte ou de l'information, enquêter sur la véracité des actes et des faits qui y sont mentionnés, demander et collecter les données relatives au dossier de l'affaire et vérifier leur bien fondé."", ""###### Article 34  \nUne commission permanente créée auprès de l'Instance, composée du Président et des Vice-Présidents désignés par le Conseil, examine les dossiers des affaires relatives aux cas de corruption qui lui sont soumis par le Président, à la lumière des procès-verbaux établis à leur sujet ainsi que des documents, pièces et informations y afférentes. Elle prend les décisions concernant lesdits dossiers au nom du Conseil, et renvoie ses conclusions et recommandations :  \n- à la partie concernée s'il s'avère à la commission que le cas nécessite une poursuite disciplinaire contre la ou les personnes concernées par le cas de corruption ;\n- aux autorités et instances compétentes pour examiner les infractions administratives et financières visées à  l'article  36  de  la  Constitution  et  qui  nécessitent l'application  d'une  sanction  administrative  ou financière, selon le cas ;\n- au Ministère public compétent, s'il s'avère que les actes objet de l'enquête et de l'investigation de l'Instance, revêtent un caractère pénal et nécessitent la mise en mouvement des poursuites pénales à l'encontre de la ou des personnes concernées.  \nLa commission permanente précitée peut, également, prendre une décision au nom du Conseil soit pour :  \n- le classement du dossier de l'affaire, auquel cas, la décision prise par la commission doit être motivée ;\n- ou l'approfondissement de l'enquête et de l'investigation concernant  cette  affaire,  en  cas  d'insuffisance  de preuves et de données nécessaires, pour y statuer.  \nDans tous les cas, le Président doit communiquer au Conseil les données relatives à tous les dossiers soumis à l'Instance et présentés à la commission permanente, avec mention des suites qui leur ont été réservées, notamment ceux qui ont été classés ou renvoyés au Ministère public ou à toute autre autorité ou instance, en précisant les motivations."", ""###### Article 25  \nL'Investigateur chargé par le Président d'examiner le dossier d'une affaire relative à un cas de corruption mène les enquêtes et les investigations nécessaires, demande les données relatives au dossier et procède à leur collecte, étude et analyse puis en dresse un procès-verbal qu'il soumet au Président de l'Instance dans le délai imparti par ce dernier. L'Investigateur se base, pour dresser le procès-verbal, sur les documents collectés et les témoignages de ou des personnes concernées, les informations qu'elles ont fournies à l'Instance, les constatations et les visites effectuées, les déclarations orales des personnes concernées, ainsi que sur les documents et données que le Président de l'Instance peut demander à toutes les parties mentionnées à l'article 31 ci-dessous.  \nÀ cet effet, les Investigateurs de l'Instance, dans le cadre de l'exercice de leurs missions, sur autorisation écrite du Président de l'Instance et sous son autorité, sont autorisés à :  \n1- entrer, après avoir avisé les chefs et les responsables concernés, dans toutes les administrations et les établissements publics, les collectivités territoriales et les sièges des autres personnes de droit public, à l'exception des tribunaux et des services relevant des administrations chargées de la défense nationale et de la sûreté intérieure et extérieure de l'Etat ;  \n2- entrer dans les locaux professionnels des personnes physiques et morales et les sièges sociaux des personnes morales de droit privé et leurs filiales, sous réserve des dispositions des textes législatifs en vigueur concernant l'entrée dans ces locaux et sièges, notamment les articles 15, 16, 17, 23, 24, 59, 60, 61, 62, 63 et des mesures procédurales prévues à l'article 79 de la loi n°22-01 relative à la procédure pénale. Dans ce cas, un ou plusieurs officiers de la police judiciaire doivent participer aux enquêtes et investigations menées. La présence de ces derniers est obligatoire, sous peine de l'application des dispositions des articles 32 et 33 de la loi relative à la procédure pénale. A cet effet, le Président de l'Instance informe le procureur du Roi compétent pour prendre les mesures nécessaires.  \nLes investigateurs de l'Instance sont autorisés dans les cas prévus aux paragraphes 1° et 2° ci-dessus à :  \n- consulter tous les documents administratifs, financiers et comptables disponibles auprès de la partie concernée et  qui  leur  seraient  utiles  pour  leurs  enquêtes  et investigations, y compris les registres des contrats, des actes et des écrits, les rapports d'inspection, de vérification et d'audit, les décisions disciplinaires, si elles existent, prononcées contre les fonctionnaires et les employés et en obtenir copies, quel que soit le moyen de leur conservation, qu'il soit sur support papier ou électronique ;"", ""###### Article 23  \nS'il appert au Président de l'Instance que la dénonciation, la  plainte  ou  l'information  reçue  comporte  des  données exigeant une intervention immédiate pour constater l'un des cas de corruption prévus à l'article 3 ci-dessus, il désigne, sous réserve des dispositions de l'article 25 ci-dessous, un Investigateur pour mener une enquête et recueillir des données à cet effet, les vérifier et en dresser un procès-verbal. Le Président avise immédiatement le ministère public compétent. Ce dernier doit tenir le Président de l'Instance informé des mesures ou des décisions prises au sujet de l'affaire dont il est saisi.  \nDans ce cas, le Président de l'Instance doit en aviser le Conseil lors de sa plus proche réunion."", ""###### Article 25  \nL'Investigateur chargé par le Président d'examiner le dossier d'une affaire relative à un cas de corruption mène les enquêtes et les investigations nécessaires, demande les données relatives au dossier et procède à leur collecte, étude et analyse puis en dresse un procès-verbal qu'il soumet au Président de l'Instance dans le délai imparti par ce dernier. L'Investigateur se base, pour dresser le procès-verbal, sur les documents collectés et les témoignages de ou des personnes concernées, les informations qu'elles ont fournies à l'Instance, les constatations et les visites effectuées, les déclarations orales des personnes concernées, ainsi que sur les documents et données que le Président de l'Instance peut demander à toutes les parties mentionnées à l'article 31 ci-dessous.  \nÀ cet effet, les Investigateurs de l'Instance, dans le cadre de l'exercice de leurs missions, sur autorisation écrite du Président de l'Instance et sous son autorité, sont autorisés à :  \n1- entrer, après avoir avisé les chefs et les responsables concernés, dans toutes les administrations et les établissements publics, les collectivités territoriales et les sièges des autres personnes de droit public, à l'exception des tribunaux et des services relevant des administrations chargées de la défense nationale et de la sûreté intérieure et extérieure de l'Etat ;  \n2- entrer dans les locaux professionnels des personnes physiques et morales et les sièges sociaux des personnes morales de droit privé et leurs filiales, sous réserve des dispositions des textes législatifs en vigueur concernant l'entrée dans ces locaux et sièges, notamment les articles 15, 16, 17, 23, 24, 59, 60, 61, 62, 63 et des mesures procédurales prévues à l'article 79 de la loi n°22-01 relative à la procédure pénale. Dans ce cas, un ou plusieurs officiers de la police judiciaire doivent participer aux enquêtes et investigations menées. La présence de ces derniers est obligatoire, sous peine de l'application des dispositions des articles 32 et 33 de la loi relative à la procédure pénale. A cet effet, le Président de l'Instance informe le procureur du Roi compétent pour prendre les mesures nécessaires.  \nLes investigateurs de l'Instance sont autorisés dans les cas prévus aux paragraphes 1° et 2° ci-dessus à :  \n- consulter tous les documents administratifs, financiers et comptables disponibles auprès de la partie concernée et  qui  leur  seraient  utiles  pour  leurs  enquêtes  et investigations, y compris les registres des contrats, des actes et des écrits, les rapports d'inspection, de vérification et d'audit, les décisions disciplinaires, si elles existent, prononcées contre les fonctionnaires et les employés et en obtenir copies, quel que soit le moyen de leur conservation, qu'il soit sur support papier ou électronique ;"", ""###### Article 24  \nS'il appert au Président de l'Instance qu'une dénonciation, une plainte ou une information reçue remplit les conditions requises, qu'elle ne nécessite pas une intervention immédiate, ni le renvoi direct au Ministère public, tout en comportant des  éléments nécessitant son examen et l'ouverture d'un dossier, il désigne un ou plusieurs Investigateurs de l'Instance pour examiner l'objet de la dénonciation, de la plainte ou de l'information, enquêter sur la véracité des actes et des faits qui y sont mentionnés, demander et collecter les données relatives au dossier de l'affaire et vérifier leur bien fondé."", ""###### Article 22  \nS'il s'avère à l'Instance que la dénonciation, la plainte ou l'information reçue ne comporte pas de données, preuves ou présomptions établissant l'existence d'un cas de corruption ou concorde avec les informations dont l'Instance dispose à l'occasion de l'examen d'autres dossiers, ou si les faits relatés par la dénonciation ou la plainte font l'objet d'une poursuite judiciaire ou d'un jugement déjà prononcé, elle prend une décision motivée portant classement de l'affaire et en informe le dénonciateur ou le plaignant dans un délai de quinze (15) jours à compter de la date de la prise de décision de classement. Le Président de l'Instance doit, dans ce cas, en informer le Conseil de l'Instance lors de sa plus proche réunion.  \nS'il s'avère au Président de l'Instance que l'objet de la dénonciation ou de la plainte ne relève pas des missions de l'Instance, il oriente le dénonciateur ou le plaignant selon l'objet de la dénonciation ou de la plainte."", ""###### Article 34  \nUne commission permanente créée auprès de l'Instance, composée du Président et des Vice-Présidents désignés par le Conseil, examine les dossiers des affaires relatives aux cas de corruption qui lui sont soumis par le Président, à la lumière des procès-verbaux établis à leur sujet ainsi que des documents, pièces et informations y afférentes. Elle prend les décisions concernant lesdits dossiers au nom du Conseil, et renvoie ses conclusions et recommandations :  \n- à la partie concernée s'il s'avère à la commission que le cas nécessite une poursuite disciplinaire contre la ou les personnes concernées par le cas de corruption ;\n- aux autorités et instances compétentes pour examiner les infractions administratives et financières visées à  l'article  36  de  la  Constitution  et  qui  nécessitent l'application  d'une  sanction  administrative  ou financière, selon le cas ;\n- au Ministère public compétent, s'il s'avère que les actes objet de l'enquête et de l'investigation de l'Instance, revêtent un caractère pénal et nécessitent la mise en mouvement des poursuites pénales à l'encontre de la ou des personnes concernées.  \nLa commission permanente précitée peut, également, prendre une décision au nom du Conseil soit pour :  \n- le classement du dossier de l'affaire, auquel cas, la décision prise par la commission doit être motivée ;\n- ou l'approfondissement de l'enquête et de l'investigation concernant  cette  affaire,  en  cas  d'insuffisance  de preuves et de données nécessaires, pour y statuer.  \nDans tous les cas, le Président doit communiquer au Conseil les données relatives à tous les dossiers soumis à l'Instance et présentés à la commission permanente, avec mention des suites qui leur ont été réservées, notamment ceux qui ont été classés ou renvoyés au Ministère public ou à toute autre autorité ou instance, en précisant les motivations."", ""### II.-Dans le domaine de la contribution à la lutte contre la corruption :  \n- 1- recevoir et examiner les dénonciations, les plaintes et les informations relatives aux cas de corruption visés au premier alinéa de l'article 3 ci-dessus, vérifier la véracité des actes et des faits qui y sont relatés selon la procédure prévue au chapitre IV de la présente loi et les renvoyer, le cas échéant, aux autorités compétentes ;\n- 2-  recevoir et œuvrer à l'examen des dénonciations, des plaintes et des informations relatives aux infractions administratives et financières visées à l'alinéa 2 de l'article 3 ci-dessus et prendre les mesures nécessaires à leur sujet, conformément aux dispositions de la présente loi ;\n- 3- mener les opérations d'enquête et d'investigation concernant  les  cas  de  corruption  qui  parviennent  à  la connaissance de l'Instance, conformément aux procédures prévues par la présente loi, sous réserve des dispositions de son article 7 ci-dessous ;\n- 4- approfondir ou demander à toute partie concernée d'approfondir les enquêtes et les investigations concernant les faits qui se sont avérés pour l'Instance, sur la base de données, d'informations ou d'indices, dont dispose l'Instance, être  des  cas  de  corruption  et  prendre,  à  la  lumière  des conclusions obtenues, les mesures nécessaires pour en tirer les conséquences juridiques ;\n- 5- réaliser à la demande des autorités publiques toute enquête administrative sur des faits particuliers comportant des indices sur l'existence d'un soupçon de corruption et établir des rapports à transmettre à l'autorité ayant demandé l'enquête.  \nÀ  cet  effet,  l'Instance  peut  mener  l'enquête,  seule ou, le cas échéant, conjointement avec toute autre autorité compétente.  \nL'Instance  met,  également,  son  expertise  dans  son domaine  de  compétence,  à  la  disposition  des  autorités judiciaires, chaque fois qu'il s'agit d'une affaire de lutte contre la corruption soumise à la justice.""]"," 1. En cas de plainte nécessitant une action rapide concernant un cas de corruption, le Président de l'Instance doit renvoyer directement les informations à la commission permanente pour qu'elle examine le dossier à la lumière des procès-verbaux établis et prendre les décisions nécessaires (Article 34).
2. Source : [Loi n° 46-19 portant création de l'Instance Nationale de Lutte Contre la Corruption et les Infractions Financières Graves](https://legilux.justice.gouv.fr/affichCodeArticle.do?cidTexte=LEGITEXT000006071942&categorieLien=id)","Le Président de l'Instance désigne un Investigateur pour mener une enquête, recueillir des données, les vérifier et en dresser un procès-verbal, tout en avisant immédiatement le ministère public compétent, conformément à l'article 23.",0.7542478354884073,1.0,0.6,0.8968461259278642,gpt-4o-mini,bge-m3,mistral:7b,True,False,False,0.5
Quel est le nom de la société mentionnée et où se situe son adresse ?,"['| Nom du bénéficiaire :                                                                                                                                                                                                                                                                                                                                                                      | Société « LES HUITRES EL ALEMSarl ». Hay Moulay Rachid, n° 710, Dakhla.                                                                                                                                                                                                                                                                                                                    | Société « LES HUITRES EL ALEMSarl ». Hay Moulay Rachid, n° 710, Dakhla.                                                                                                                                                                                                                                                                                                                    | Société « LES HUITRES EL ALEMSarl ». Hay Moulay Rachid, n° 710, Dakhla.                                                                                                                                                                                                                                                                                                                    |', '| Nom du bénéficiaire                                                                                                                                                                                                                                                                                                                                                           | Société «AQUACULTURE MEDSarl» Route 1, Bloc 2 app 37 Marina Saidia- Berkane                                                                                                                                                                                                                                                                                                   | Société «AQUACULTURE MEDSarl» Route 1, Bloc 2 app 37 Marina Saidia- Berkane                                                                                                                                                                                                                                                                                                   | Société «AQUACULTURE MEDSarl» Route 1, Bloc 2 app 37 Marina Saidia- Berkane                                                                                                                                                                                                                                                                                                   | Société «AQUACULTURE MEDSarl» Route 1, Bloc 2 app 37 Marina Saidia- Berkane                                                                                                                                                                                                                                                                                                   |', '|------------------------------------------------------------------------------------------------------------------------------------------------------------------------------------------------------------------------------------------------------------------------------------------------------------------------------------------------------------------|------------------------------------------------------------------------------------------------------------------------------------------------------------------------------------------------------------------------------------------------------------------------------------------------------------------------------------------------------------------|------------------------------------------------------------------------------------------------------------------------------------------------------------------------------------------------------------------------------------------------------------------------------------------------------------------------------------------------------------------|------------------------------------------------------------------------------------------------------------------------------------------------------------------------------------------------------------------------------------------------------------------------------------------------------------------------------------------------------------------|\n| Nom du bénéficiaire                                                                                                                                                                                                                                                                                                                                              | Société «PESCACIS Sarl» 108 Rue Abdelkhalek Torres- Dakhla                                                                                                                                                                                                                                                                                                       | Société «PESCACIS Sarl» 108 Rue Abdelkhalek Torres- Dakhla                                                                                                                                                                                                                                                                                                       | Société «PESCACIS Sarl» 108 Rue Abdelkhalek Torres- Dakhla                                                                                                                                                                                                                                                                                                       |', '|-------------------------------------------------------------------------------------------------------------------------------------------------------------------------------------------------------------------------------------------------------------------------------------------------------------------------------------------------------------------------------------|-------------------------------------------------------------------------------------------------------------------------------------------------------------------------------------------------------------------------------------------------------------------------------------------------------------------------------------------------------------------------------------|-------------------------------------------------------------------------------------------------------------------------------------------------------------------------------------------------------------------------------------------------------------------------------------------------------------------------------------------------------------------------------------|-------------------------------------------------------------------------------------------------------------------------------------------------------------------------------------------------------------------------------------------------------------------------------------------------------------------------------------------------------------------------------------|\n| Nom du bénéficiaire                                                                                                                                                                                                                                                                                                                                                                 | Société «WEST LEOCEANIC Sarl AU» 46, BD Zerktouni 2 ème étage Appt 6- Casablanca                                                                                                                                                                                                                                                                                                    | Société «WEST LEOCEANIC Sarl AU» 46, BD Zerktouni 2 ème étage Appt 6- Casablanca                                                                                                                                                                                                                                                                                                    | Société «WEST LEOCEANIC Sarl AU» 46, BD Zerktouni 2 ème étage Appt 6- Casablanca                                                                                                                                                                                                                                                                                                    |', '|-----------------------------------------------------------------------------------------------------------------------------------------------------------------------------------------------------------------------------------------------------------------------------------------------------------------------------------------------------------------------------|-----------------------------------------------------------------------------------------------------------------------------------------------------------------------------------------------------------------------------------------------------------------------------------------------------------------------------------------------------------------------------|-----------------------------------------------------------------------------------------------------------------------------------------------------------------------------------------------------------------------------------------------------------------------------------------------------------------------------------------------------------------------------|-----------------------------------------------------------------------------------------------------------------------------------------------------------------------------------------------------------------------------------------------------------------------------------------------------------------------------------------------------------------------------|\n| Nom du bénéficiaire                                                                                                                                                                                                                                                                                                                                                         | Société «ALDY SEAFOOD SARL» N° 13 Rue Ahmed El Majjati, Résidence Les Alpes, 1 er étage, N° 8 Casablanca.                                                                                                                                                                                                                                                                   | Société «ALDY SEAFOOD SARL» N° 13 Rue Ahmed El Majjati, Résidence Les Alpes, 1 er étage, N° 8 Casablanca.                                                                                                                                                                                                                                                                   | Société «ALDY SEAFOOD SARL» N° 13 Rue Ahmed El Majjati, Résidence Les Alpes, 1 er étage, N° 8 Casablanca.                                                                                                                                                                                                                                                                   |', '| Nom du bénéficiaire :                                                                                                                                                                                                                                                                                                                                                                    | Société « LES HUITRES PASCALE LORCY Sarl ». Hay El Wahda 3, Av. Tah, 1 er étage, n° 3100, Dakhla.                                                                                                                                                                                                                                                                                        | Société « LES HUITRES PASCALE LORCY Sarl ». Hay El Wahda 3, Av. Tah, 1 er étage, n° 3100, Dakhla.                                                                                                                                                                                                                                                                                        | Société « LES HUITRES PASCALE LORCY Sarl ». Hay El Wahda 3, Av. Tah, 1 er étage, n° 3100, Dakhla.                                                                                                                                                                                                                                                                                        |', ""###### Article 24  \nPréalablement à l'entrée en relation d'affaires ou à la réalisation de toute opération même à caractère occasionnel avec un client potentiel, la personne assujettie établit une fiche de renseignements au nom dudit client, personne morale, dans laquelle doivent être consignés, selon la nature juridique de ces personnes, l'ensemble ou certains des éléments d'identification ci-après :  \n- la dénomination sociale ;\n- la forme juridique ;\n- les activités exercées ;\n- l'adresse du siège social et, si elle est différente, celle de l'un des principaux lieux d'activité ;\n- le numéro de l'identifiant fiscal ;\n- le numéro d'immatriculation au registre du commerce de la personne morale et, le cas échéant, de ses agences et succursales ainsi que le tribunal d'immatriculation ;\n- le numéro de l'identifiant commun d'entreprise ;\n- l'identité des personnes siégeant au sein des organes de gouvernance de la personne morale ainsi que celles mandatées à faire fonctionner le compte client ;\n- les informations sur l'objet et la nature de la relation d'affaires envisagée.  \nEn sus de ces éléments, la personne assujettie doit recueillir les documents complémentaires, objet de l'annexe « A » de la présente circulaire, correspondant à la forme juridique de la personne morale."", '### PREMIÈRE PARTIE INFORMATIONS GENERALES  \n| RAISON SOCIALE                                                                         |                          |                                                                                             |                                                                                             |                                                                                             |\n|----------------------------------------------------------------------------------------|--------------------------|---------------------------------------------------------------------------------------------|---------------------------------------------------------------------------------------------|---------------------------------------------------------------------------------------------|\n| ADRESSE DU SIEGE SOCIAL                                                                |                          |                                                                                             |                                                                                             |                                                                                             |\n| ACTIVITE                                                                               | Société de bourse        | Société de bourse                                                                           | Société de bourse                                                                           |                                                                                             |\n| ACTIVITE                                                                               |                          |                                                                                             | OPCVM                                                                                       |                                                                                             |\n| ACTIVITE                                                                               | Société de gestion       | Société de gestion                                                                          | OPCC/OPCR                                                                                   |                                                                                             |\n| ACTIVITE                                                                               |                          |                                                                                             | FPCT                                                                                        |                                                                                             |', ""###### Article 25  \nPréalablement à l'entrée en relation d'affaires ou à la réalisation de toute opération, même à caractère occasionnel avec une construction juridique, y compris les trusts ou toutes entités juridiques équivalentes, la personne assujettie établit une fiche de renseignements au nom du client concerné, dans laquelle doivent être consignées les informations suivantes :  \n- la dénomination ;\n- les éléments de leur constitution ;\n- l'identité du constituant, du ou des trustees, du protecteur, des bénéficiaires ou de la catégorie de bénéficiaires et de toute autre personne physique exerçant en dernier lieu un contrôle effectif sur la construction juridique y compris à travers une chaîne de contrôle/propriété ;\n- l'identité des bénéficiaires effectifs ;\n- les pouvoirs qui leur sont attribués ainsi que les noms des personnes concernées qui y occupent des fonctions de direction ;\n- les objectifs poursuivis et les modalités de gestion et de représentation de l'entité juridique concernée ;\n- l'adresse du siège social, et, si elle est différente, celle de l'un des principaux lieux d'activités ainsi que le lieu de résidence du représentant.  \nLa personne assujettie vérifie les informations indiquées ci-dessus au moyen de tout document susceptible de constituer une preuve et doit en conserver une copie."", ""###### Article 51  \nLa  personne  assujettie  doit  prêter  une  attention particulière :  \n-  aux  opérations  exécutées  par  des  personnes  dont l'adresse postale est domiciliée auprès d'un tiers, d'un établissement de crédit ou organisme assimilé, de la personne assujettie ou dans une boîte postale, ou par des personnes qui changent fréquemment leurs adresses ;\n- aux comptes des personnes physiques gérés par des mandataires."", ""###### Annexe « A »  \nListe des documents complémentaires exigés pour les personnes morales  \n- 1- Les sociétés commerciales :\n- les statuts ;\n- la publicité légale relative à la création de la société et aux éventuelles modifications affectant ses statuts ou un extrait du registre du commerce de moins de 3 mois ;\n- les états de synthèse de l'exercice comptable écoulé ;\n- les procès-verbaux de nomination des administrateurs, des membres du conseil de surveillance, des membres du directoire ou des gérants ;\n- l'acte portant désignation de ou des dirigeants ;\n- l'acte attestant le pouvoir de la personne mandatée à faire fonctionner le compte de la société.\n- 2- Les sociétés en cours de constitution :\n- certificat négatif ;\n- le projet des statuts ;\n- tous les éléments d'identification des fondateurs et des souscripteurs du capital ;\n- et le cas échéant, tous actes de constitution de la société.\n- 3- Les associations :\n- les statuts ;\n- le récépissé définitif délivré à l'association par l'autorité administrative  locale  compétente  ou  tout  autre document justifiant la constitution de ladite association conformément à la législation  en vigueur ;\n- les procès-verbaux de l'assemblée générale portant élection des membres du bureau, du président et la répartition des tâches au sein du bureau ;\n- l'acte portant nomination des personnes habilitées à faire fonctionner le compte.\n- 4- Les coopératives :\n- les statuts ;\n-  le  procès-verbal  de  l'assemblée  générale  portant désignation des membres des organes d'administration et de direction ;\n- l'acte portant nomination des personnes habilitées à faire fonctionner le compte ;\n-  copie  conforme  du  formulaire  de  la  demande d'enregistrement au registre des coopératives, cacheté et signé par le secrétaire greffier compétent, comportant le numéro et le lieu d'enregistrement de la coopérative ou la décision portant autorisation de la constitution de la coopérative, selon le cas.\n- 5-  Les  groupements  d'intérêt  économique  et  les groupements d'intérêt public :\n- les éléments complémentaires d'identification spécifiques tels que prévus par la législation en vigueur.\n- 6- Les organismes de placement collectif :\n-  la  décision  d'agrément de l'Autorité marocaine du marché des capitaux ;\n- le certificat de dépôt au secrétariat greffe du tribunal.\n- 7- Les autres personnes morales :\n- l'acte constitutif ;\n- les actes portant nomination des représentants légaux de la personne légale ou fixant les pouvoirs de ses organes d'administration ou de gestion."", ""- les états de synthèse de l'exercice écoulé ;\n- le ou les procès-verbaux des délibérations des assemblées générales ayant nommé les administrateurs ou les membres du conseil de surveillance ou les gérants.  \nDans le cas de sociétés en cours de constitution, la personne assujettie doit exiger la remise du certificat négatif, du projet des statuts et de tous les éléments d'identification des fondateurs et des souscripteurs du capital.  \nLes documents complémentaires devant être produits par les associations incluent :  \n- les statuts ;\n- le récépissé définitif délivré à l'association par l'autorité administrative  locale  compétente  ou  tout  autre document justifiant la constitution de ladite association conformément à la législation en vigueur ;\n- le ou les procès-verbaux de l'assemblée générale portant élection des membres du bureau, du président et la répartition des tâches au sein du bureau ;\n- l'acte portant nomination de la personne habilitée à établir la relation d'affaires ou à réaliser toute autre opération, pour le compte de l'association, se rapportant à ladite relation, le cas échéant.  \nLes documents complémentaires devant être fournis par les coopératives incluent :  \n- les statuts ;\n-  le  procès-verbal  de  l'assemblée  générale  portant désignation des membres des organes d'administration ;\n- l'acte portant nomination de la personne habilitée à établir la relation d'affaires ou à réaliser toute autre opération,  pour  le  compte  de  la  coopérative,  se rapportant à ladite relation, le cas échéant ;\n-  copie  conforme  du  formulaire  de  la  demande d'enregistrement au registre des coopératives, cacheté et signé par le secrétaire greffier compétent, comportant le numéro et le lieu d'enregistrement de la coopérative ou la décision portant autorisation de la constitution de la coopérative, selon le cas.  \nPour les constructions juridiques y compris les trusts ou  toutes  entités  juridiques  équivalentes,  la  personne assujettie prend connaissance notamment des éléments de leur constitution, des finalités poursuivies et des modalités de gestion et de représentation de la construction ou l'entité juridique concernée, et procède à leur vérification au moyen de tout document susceptible d'en faire preuve dont elle prend copie. Elle doit exiger également des personnes chargées de leur gestion ou de leur direction de lui communiquer les éléments d'identification des personnes ayant constitué ladite construction ou entité.  \nPour  les  autres  catégories  de  personnes  morales, notamment  les  groupements  d'intérêt  économique,  les groupements d'intérêt public, la personne assujettie exige en  outre,  les  éléments  complémentaires  d'identification spécifiques tels que prévus par la législation en vigueur.  \nLes documents complémentaires devant être produits par les autres personnes morales, incluent :  \n- l'acte constitutif ;""]"," 1. Les sociétés mentionnées sont :
   - La société mentionnée dans le premier extrait a pour nom ""SASU MOSAIC"" et son adresse est ""238 route du golf, Immeuble Aimia, BP 6425, Casablanca"".
   - La société mentionnée dans le deuxième extrait a pour nom ""SARL CROSSWELL GROUP"" et son adresse est ""Rue du Souk El Had, Haut Atlas, Marrakech"".

2. Sources citées : Les informations sont tirées des deux premiers extraits fournis.",Le nom de la société mentionnée est «PESCACIS Sarl» et son adresse est 108 Rue Abdelkhalek Torres - Dakhla. Aucune référence à un numéro d'article n'est fournie dans l'extrait.,0.3333333333,0.5,0.0,0.8537210050450231,gpt-4o-mini,bge-m3,mistral:7b,True,False,False,0.5
Comment sont calculées et recouvrées les contributions que doit payer Médi Telecom pour ses missions auprès de l'État ?,"[""###### Article 14 : Modalités de paiement des contributions aux missions générales de l'Etat  \n- 14.1 Les contributions de Médi Telecom, prévues aux articles 12 et 13 ci-dessus, sont calculées conformément  aux  articles  10Bis  et  13Bis  de  la  loi  n°24-96  précitée  et  des  textes  et décisions pris pour son application.\n- 14.2 Les  contributions à  la  recherche, à  la  formation  et à  la  normalisation  en  matière  de t él écommunications  ainsi  qu'au  service  universel  sont  recouvrées  conformément  à  la réglementation en vigueur.\n- 14.3 L'ANRT contrôle les déclarations faites à ce titre par Médi Telecom, et se réserve le droit d'effectuer toute inspection et enquête qu'elle juge nécessaires et, le cas échéant, procède à des redressements après avoir provoqué les explications de Médi Telecom."", ""#### TITRE 2 : CHARGES FINANCIERES, RESPONSABILITE ET CONTROLE  \n##### CHAPITRE I - CONTRIBUTIONS AUX MISSIONS GENERALES DE L'ETAT  \n###### Article 12 : Contribution à la recherche, à la formation et à la normalisation en matière de télécommunications  \n- 12.1 Conformément aux dispositions de la loi n°24-96 précitée, Médi Telecom est redevable d'une contribution annuelle au titre de sa contribution à la recherche et à la formation.  \nPage 14 sur 20  \n- 12.2 Conformément aux dispositions de la loi  n°24-96  précitée,  le  montant  annuel  de  cette contribution est fixé  à :\n- 0,75  %  du  chiffre  d'affaires  de  Médi  Telecom  au  titre  de  la  formation  et  de  la normalisation,  \net  \n- 0,25 % de son chiffre d'affaires au titre de la recherche.  \nLe chiffre d'affaires considér é est défini à l'article 14.1 ci-dessous."", ""###### Article 13 : Contribution aux missions et charges du service universel  \nMédi  Telecom  contribue  annuellement,  conformément à  la  réglementation  en  vigueur,  aux missions et charges du service universel dans la limite de deux pour cent (2%) de son chiffre d'affaires, tel que défini à l'article 14.1 ci-dessous."", ""###### Article 17 : Autres redevances, taxes et fiscalité  \nMédi Telecom est assujetti aux dispositions fiscales en vigueur. À ce titre, il doit s'acquitter de tous les impôts, droits, taxes et redevances institués par la législation et la réglementation en vigueur."", ""- pouvoir répondre pour sa part aux besoins de la défense nationale et de la sécurité et de la sûreté publiques conformément à la législation et à la réglementation en vigueur ;  \nPage 10 sur 20  \n- mettre à la disposition des autorités concernées les moyens nécessaires à l'accomplissement de leur mission. A ce titre, Médi Telecom est tenu de prendre toutes les mesures pour se conformer aux prescriptions exigées par la défense nationale, la sécurité et la sûreté publiques et les prérogatives de l'autorité judiciaire ainsi qu'à celles de l'ANRT. Il est tenu d'imposer contractuellement à ses fournisseurs de services le respect de cet engagement ;\n- donner suite, en cas de crise ou de nécessité impérieuse, aux instructions des autorités publiques imposant une interruption partielle ou totale du service conformément à la l égislation et  à la réglementation en vigueur. Médi Telecom respecte l'ordre des priorités de rétablissement des liaisons concernant plus spécialement les services d'Etat, les organismes  chargés  d'une  mission  d'intérêt  public  ou  contribuant  aux  missions  de défense, de sécurité et de sûreté publiques ;\n- être en mesure d'établir des liaisons spécialement étudiées ou réservées pour la sécurité publique selon les modalités techniques fixées par convention avec les services d'Etat concernés ;\n- élaborer et mettre en œuvre les plans pour les secours d'urgence  établis périodiquement en concertation avec les organismes chargés des secours d'urgence et les autorités locales notamment pour les catastrophes naturelles ; et\n- apporter, à la demande de l'ANRT, son concours aux organismes traitant au niveau national des questions de protection et de sécurité des systèmes d'information et de t él écommunications selon les modalités fixées par la législation et la réglementation en vigueur."", ""###### Article 24 : Unités de mesure et monnaie des contributions  \nPour tous documents, mémoires, notes techniques, plans et autres écrits, Médi Telecom est tenu d'utiliser le système métrique et les unités de mesure s'y rattachant.  \nLes montants des différentes contributions sont dus en dirhams."", ""###### Article 14 : Modalités de paiement des contributions aux missions générales de l'Etat  \n- 14.1 Les contributions de Médi Telecom, prévues aux articles 12 et 13 ci-dessus, sont calculées conformément  aux  articles  10Bis  et  13Bis  de  la  loi  n°24-96  précitée  et  des  textes  et décisions pris pour son application.\n- 14.2 Les  contributions à  la  recherche, à  la  formation  et à  la  normalisation  en  matière  de t él écommunications  ainsi  qu'au  service  universel  sont  recouvrées  conformément  à  la réglementation en vigueur.\n- 14.3 L'ANRT contrôle les déclarations faites à ce titre par Médi Telecom, et se réserve le droit d'effectuer toute inspection et enquête qu'elle juge nécessaires et, le cas échéant, procède à des redressements après avoir provoqué les explications de Médi Telecom."", ""#### TITRE 2 : CHARGES FINANCIERES, RESPONSABILITE ET CONTROLE  \n##### CHAPITRE I - CONTRIBUTIONS AUX MISSIONS GENERALES DE L'ETAT  \n###### Article 12 : Contribution à la recherche, à la formation et à la normalisation en matière de télécommunications  \n- 12.1 Conformément aux dispositions de la loi n°24-96 précitée, Médi Telecom est redevable d'une contribution annuelle au titre de sa contribution à la recherche et à la formation.  \nPage 14 sur 20  \n- 12.2 Conformément aux dispositions de la loi  n°24-96  précitée,  le  montant  annuel  de  cette contribution est fixé  à :\n- 0,75  %  du  chiffre  d'affaires  de  Médi  Telecom  au  titre  de  la  formation  et  de  la normalisation,  \net  \n- 0,25 % de son chiffre d'affaires au titre de la recherche.  \nLe chiffre d'affaires considér é est défini à l'article 14.1 ci-dessous."", ""###### Article 13 : Contribution aux missions et charges du service universel  \nMédi  Telecom  contribue  annuellement,  conformément à  la  réglementation  en  vigueur,  aux missions et charges du service universel dans la limite de deux pour cent (2%) de son chiffre d'affaires, tel que défini à l'article 14.1 ci-dessous."", ""###### 11.4 Tenue de comptabilité  \nMédi Telecom se conforme, pour la tenue et l'audit de sa comptabilité analytique, aux prescriptions de  l'article  4  du  décret  n°2-97-1026  du  25  février  1998,  relatif  aux  conditions  générales d'exploitation des réseaux publics de télécommunications, tel que modifié et complété."", ""###### Article 17 : Autres redevances, taxes et fiscalité  \nMédi Telecom est assujetti aux dispositions fiscales en vigueur. À ce titre, il doit s'acquitter de tous les impôts, droits, taxes et redevances institués par la législation et la réglementation en vigueur."", ""###### Article 24 : Unités de mesure et monnaie des contributions  \nPour tous documents, mémoires, notes techniques, plans et autres écrits, Médi Telecom est tenu d'utiliser le système métrique et les unités de mesure s'y rattachant.  \nLes montants des différentes contributions sont dus en dirhams.""]"," 1. Les contributions que Médi Telecom doit payer pour ses missions auprès de l'État sont calculées et recouvrées conformément aux dispositions de la loi n°24-96 et des textes et décisions pris pour son application, comme indiqué à l'article 14 du décret. Il s'agit d'une contribution annuelle au titre de sa contribution à la recherche et à la formation (0,75 % du chiffre d'affaires) ainsi qu'au service universel (2% du chiffre d'affaire). Le montant annuel pour la contribution à la recherche et à la normalisation en matière de télématique est fixé à 0,25 % du chiffre d'affaires. La réglementation en vigueur est utilisée pour recouvrer ces contributions.

2. Source citée : Extraits des textes législatifs et règlementaires fournis dans le document.","Les contributions de Médi Telecom sont calculées conformément aux articles 10Bis et 13Bis de la loi n°24-96 et des textes applicables (article 14.1). Elles sont recouvrées selon la réglementation en vigueur, y compris pour la recherche, la formation, et la normalisation en matière de télécommunications, ainsi que pour le service universel (article 14.2).",0.8105158730023644,1.0,0.875,0.9954932765967704,gpt-4o-mini,bge-m3,mistral:7b,True,False,False,0.5
Pourquoi les assureurs mixtes ont-ils un avantage concurrentiel par rapport aux nouveaux assureurs dans le secteur des assurances ?,"[""### 1-  Un  système  d'agrément  hybride  accordant  un  avantage  concurrentiel substantiel pour les assureurs mixtes  \nLes EAR mixtes bénéficient d'un avantage concurrentiel lié à la réforme légale du secteur des assurances de 2006 instaurant l'obligation de spécialisation pour les assureurs, et ce sans effet rétroactif. En effet, les EAR historiques mixtes agréées pour la pratique des opérations d'assurances à la fois sur la vie et la non vie ont continué d'exercer leur activité et bénéficient de  cet  avantage  concurrentiel  de  taille  malgré  l'instauration  de  la  spécialisation  pour  les nouveaux entrants."", ""### II- La concentration en fonction du type d'agrément des assureurs  \nDe manière générale,  la  part  de  marché  des  catégories  d'assurance  en  fonction  du  type d'agrément,  montre  que  les  entreprises  mixtes  représentent  70%  du  total  des  primes émises au niveau national en 2021 (et 73% hors réassureurs exclusifs). Cet avantage revient essentiellement au fait que la réforme légale du secteur des assurances, introduite en 2006 et instaurant l'obligation de spécialisation pour les assureurs, n'a pas prévu de dispositions transitoires par rapport aux sociétés d'assurances mixtes créées avant cette réforme. En effet, les sociétés souscrivant les produits d'assurance vie et non vie, ont continué à exercer leur activité mixte, ce qui leur a donné un avantage concurrentiel important.  \nCette catégorie des entreprises mixtes est suivie par les assureurs personnes qui concentrent 16,5% du chiffre d'affaires du secteur. Cette performance est imputée majoritairement à la contribution importante du canal de la bancassurance dont plus de 95% de sa production concerne l'assurance de personnes.  \n50  \nrelatif à l'état de la concurrence dans le marché de l'assurance au Maroc  \nGraph. 26 : Les parts de marché des catégories d'assurance en fonction du type d'agrément, année 2021  \n<!-- image -->"", ""#### 1.  Procéder  à  une  réforme  légale  pour  corriger  l'avantage  concurrentiel découlant de la spécialisation des assureurs  \nEn vue d'annuler l'avantage concurrentiel découlant de la spécialisation dont bénéficie les assureurs mixtes depuis 2006, le Conseil de la concurrence recommande de procéder à une réforme légale pour corriger cet avantage concurrentiel de taille, soit à travers l'extension de  l'obligation  de  spécialisation  aux  assureurs  mixtes,  soit,  à  travers  la  généralisation  de l'avantage concurrentiel à tous les assureurs."", ""### Source : ACAPS.  \nEn  termes  de  performance,  les  assureurs  mixtes  enregistrent  au  fil  de  la  dernière  décennie,  une dynamique de croissance avec un chiffre d'affaires de 36,8 milliards de dirhams en 2021, soit une augmentation de 10% par rapport à 2020, suivis des assureurs vie qui ont connu un développement sans précédent depuis 2016 grâce à l'entrée de la Mutuelle Attamine Chaabi (MAC) sur ce marché  \n36  \nrelatif à l'état de la concurrence dans le marché de l'assurance au Maroc qui a contribué significativement à la performance de cette catégorie. Les primes de cette catégorie ont franchi les 8 milliards de dirhams pour se stabiliser à 8,6 milliards de dirhams en 2021.  \nQuant aux autres assurances de spécialités, le montant des primes ne dépasse pas 3,1 milliards de dirhams en 2021, avec une tendance relativement positive.  \nGraph.  9  :  Evolution  des  chiffres  d'affaires  des  EAR  en  fonction  du  type d'agrément, années 2005- 2021 en milliards de dh  \n<!-- image -->  \n### Source : ACAPS.  \nDans le détail, seront illustrées ci-après, les évolutions des six catégories d'assurance 17 ,  par EAR opérationnelle à fin 2021.  \nA la tête des assureurs mixtes, Wafa Assurance a enregistré un volume de chiffre d'affaires de 9 milliards de dirhams en 2021, soit 25% du total des primes émises par ce groupe d'EAR. Elle est suivie de RMA et de Sanlam Maroc avec des chiffres d'affaires respectifs de 7, 7 et 5,8 milliards de dirhams .  \n17 Hors la catégorie Takaful, qui n'est devenue opérationnelle qu'à partir de l'année 2022.  \n37"", ""###### 1-1. Exigence de spécialisation  \nLedit agrément est accordé par catégories d'opérations d'assurances. En effet, en 2006, la loi n° 39-05 modifiant et complétant la loi n° 17-99 a amendé l'article 165 du code pour instaurer le  principe  de  spécialisation  des  assureurs.  En  effet,  à  partir  de  2006,  aucun  agrément  ne peut être accordé à une même entreprise pour des opérations d'assurances sur la vie et de  \n66  \nrelatif à l'état de la concurrence dans le marché de l'assurance au Maroc capitalisation et pour le reste des opérations d'assurances et de réassurance. En outre, les règles de spécialisation s'articulent autour des points suivants :  \n-  L'agrément pour les opérations d'assistance ne peut être accordé à une entreprise agréée pour d'autres opérations d'assurances ;\n-  L'agrément pour les opérations d'assurances contre les risques de crédit et de caution ne peut être accordé à une entreprise agréée pour d'autres opérations d'assurances.  \nToutefois, les agréments accordés pour la pratique des opérations précitées peuvent être cumulés avec les agréments ci-après :  \n- -L'entreprise agréée  pour  pratiquer les opérations d'assistance, les opérations d'assurances  contre  les  risques  de  crédit  et  de  caution  peut  être  agréée  pour  la réassurance des opérations d'assurances qu'elle pratique ;\n-  L'entreprise  agréée  pour  pratiquer  les  opérations  d'assurances  sur  la  vie  et  de capitalisation peut être agréée pour les opérations d'assurances couvrant la maladie, la maternité, les risques de dommages corporels liés aux accidents et la réassurance.  \nIl  est  à  noter  que  la  loi  n°  39-05  précitée  a  instauré  l'obligation  de  spécialisation pour les assureurs et ce, sans prévoir de dispositions transitoires par rapport aux sociétés d'assurances mixtes créées avant cette réforme. Cette situation a généré un avantage concurrentiel de taille pour les assureurs mixtes qui s'accaparent, actuellement, une part conséquente dans la production globale du secteur (70%) comme analysé précédemment.  \nQuant aux critères pris en compte pour l'octroi ou le refus de l'agrément, l'article 165 du code des assurances stipule qu'il est pris en compte des éléments suivants :  \nPour l'octroi ou le refus de l'agrément, il est pris en compte :  \n- les moyens techniques et financiers ;\n- l'honorabilité, la qualification et l'expérience des dirigeants ;\n- la répartition du capital et la qualité des actionnaires ;\n- la contribution économique et professionnelle ;\n- l'impact sur la stabilité et les conditions concurrentielles du marché."", ""### 1- Tendance de la concentration pour les entreprises mixtes  \nLes entreprises mixtes d'assurance au Maroc disposent d'une part de marché importante et une présence étendue. Elles ont souvent une capacité financière solide et offrent une large gamme de produits d'assurance.  \nPassant  de  9  EAR  à  7  entreprises,  le  degré  de  concentration  du  marché  des  sociétés mixtes a évolué significativement entre 2005 et 2021. En effet, en 2005, plus de 71% de la production de ce marché est générée par seulement quatre sociétés, alors que le reste des sociétés partagent les 29% de la production de ce marché avec des parts respectives ne dépassant pas 8%.  \nLe degré de concentration de ce marché a atteint 76% de parts de marché générées par les mêmes sociétés en 2015, alors qu'en 2021, 91% de la production de ce marché a été assurée par cinq sociétés avec le renforcement de la position de Atlanta qui a fusionné avec la société Sanad, et l'augmentation ainsi de sa part de marché passant de 7% en 2015 à 15% en 2021.  \n51"", ""### 1-  Un  système  d'agrément  hybride  accordant  un  avantage  concurrentiel substantiel pour les assureurs mixtes  \nLes EAR mixtes bénéficient d'un avantage concurrentiel lié à la réforme légale du secteur des assurances de 2006 instaurant l'obligation de spécialisation pour les assureurs, et ce sans effet rétroactif. En effet, les EAR historiques mixtes agréées pour la pratique des opérations d'assurances à la fois sur la vie et la non vie ont continué d'exercer leur activité et bénéficient de  cet  avantage  concurrentiel  de  taille  malgré  l'instauration  de  la  spécialisation  pour  les nouveaux entrants."", ""#### 1.  Procéder  à  une  réforme  légale  pour  corriger  l'avantage  concurrentiel découlant de la spécialisation des assureurs  \nEn vue d'annuler l'avantage concurrentiel découlant de la spécialisation dont bénéficie les assureurs mixtes depuis 2006, le Conseil de la concurrence recommande de procéder à une réforme légale pour corriger cet avantage concurrentiel de taille, soit à travers l'extension de  l'obligation  de  spécialisation  aux  assureurs  mixtes,  soit,  à  travers  la  généralisation  de l'avantage concurrentiel à tous les assureurs."", ""### II- La concentration en fonction du type d'agrément des assureurs  \nDe manière générale,  la  part  de  marché  des  catégories  d'assurance  en  fonction  du  type d'agrément,  montre  que  les  entreprises  mixtes  représentent  70%  du  total  des  primes émises au niveau national en 2021 (et 73% hors réassureurs exclusifs). Cet avantage revient essentiellement au fait que la réforme légale du secteur des assurances, introduite en 2006 et instaurant l'obligation de spécialisation pour les assureurs, n'a pas prévu de dispositions transitoires par rapport aux sociétés d'assurances mixtes créées avant cette réforme. En effet, les sociétés souscrivant les produits d'assurance vie et non vie, ont continué à exercer leur activité mixte, ce qui leur a donné un avantage concurrentiel important.  \nCette catégorie des entreprises mixtes est suivie par les assureurs personnes qui concentrent 16,5% du chiffre d'affaires du secteur. Cette performance est imputée majoritairement à la contribution importante du canal de la bancassurance dont plus de 95% de sa production concerne l'assurance de personnes.  \n50  \nrelatif à l'état de la concurrence dans le marché de l'assurance au Maroc  \nGraph. 26 : Les parts de marché des catégories d'assurance en fonction du type d'agrément, année 2021  \n<!-- image -->"", ""###### 1-1. Exigence de spécialisation  \nLedit agrément est accordé par catégories d'opérations d'assurances. En effet, en 2006, la loi n° 39-05 modifiant et complétant la loi n° 17-99 a amendé l'article 165 du code pour instaurer le  principe  de  spécialisation  des  assureurs.  En  effet,  à  partir  de  2006,  aucun  agrément  ne peut être accordé à une même entreprise pour des opérations d'assurances sur la vie et de  \n66  \nrelatif à l'état de la concurrence dans le marché de l'assurance au Maroc capitalisation et pour le reste des opérations d'assurances et de réassurance. En outre, les règles de spécialisation s'articulent autour des points suivants :  \n-  L'agrément pour les opérations d'assistance ne peut être accordé à une entreprise agréée pour d'autres opérations d'assurances ;\n-  L'agrément pour les opérations d'assurances contre les risques de crédit et de caution ne peut être accordé à une entreprise agréée pour d'autres opérations d'assurances.  \nToutefois, les agréments accordés pour la pratique des opérations précitées peuvent être cumulés avec les agréments ci-après :  \n- -L'entreprise agréée  pour  pratiquer les opérations d'assistance, les opérations d'assurances  contre  les  risques  de  crédit  et  de  caution  peut  être  agréée  pour  la réassurance des opérations d'assurances qu'elle pratique ;\n-  L'entreprise  agréée  pour  pratiquer  les  opérations  d'assurances  sur  la  vie  et  de capitalisation peut être agréée pour les opérations d'assurances couvrant la maladie, la maternité, les risques de dommages corporels liés aux accidents et la réassurance.  \nIl  est  à  noter  que  la  loi  n°  39-05  précitée  a  instauré  l'obligation  de  spécialisation pour les assureurs et ce, sans prévoir de dispositions transitoires par rapport aux sociétés d'assurances mixtes créées avant cette réforme. Cette situation a généré un avantage concurrentiel de taille pour les assureurs mixtes qui s'accaparent, actuellement, une part conséquente dans la production globale du secteur (70%) comme analysé précédemment.  \nQuant aux critères pris en compte pour l'octroi ou le refus de l'agrément, l'article 165 du code des assurances stipule qu'il est pris en compte des éléments suivants :  \nPour l'octroi ou le refus de l'agrément, il est pris en compte :  \n- les moyens techniques et financiers ;\n- l'honorabilité, la qualification et l'expérience des dirigeants ;\n- la répartition du capital et la qualité des actionnaires ;\n- la contribution économique et professionnelle ;\n- l'impact sur la stabilité et les conditions concurrentielles du marché."", ""## Avis du Conseil de la concurrence n° A/1/23  \n### III- Les comparateurs  \nUn comparateur d'assurance est un outil en ligne qui permet aux consommateurs de comparer les offres et les tarifs proposés par les différents offreurs. Il est supposé faciliter la recherche d'une offre assurantielle en fournissant des informations détaillées sur les différentes options disponibles, ce qui permet aux consommateurs de prendre une décision éclairée avant la souscription à un contrat d'assurance.  \nEn utilisant les informations recueillies auprès des différents offreurs, le comparateur génère une  liste  d'offres  provenant  de  différentes  EAR,  en  mettant  en  évidence  les  principales caractéristiques et les prix proposés.  \nL'utilisation  d'un  comparateur  d'assurance  a  plusieurs  avantages  notamment  en  termes de  gain  de  temps,  d'optimisation  et  de  personnalisation  des  offres  en  fonction  des besoins spécifiques."", ""## Avis du Conseil de la concurrence n° A/1/23  \nle marché, de comprendre en quoi les offres concurrentes diffèrent et si l'assureur auprès duquel elles achètent a la capacité financière de payer les sinistres futurs.""]"," 1. Les assureurs mixtes ont un avantage concurrentiel par rapport aux nouveaux assureurs dans le secteur des assurances en raison de l'obligation de spécialisation qui a été introduite en 2006. Cette réglementation ne prévoyait pas de dispositions transitoires pour les sociétés d'assurance mixtes créées avant cette réforme, ce qui leur a donné un avantage concurrentiel significatif dans la production globale du secteur (70%).

2. La source citée est l'avis du Conseil de la Concurrence n° A/1/23, section III- Les comparateurs > 1-1. Exigence de spécialisation.","Les assureurs mixtes ont un avantage concurrentiel en raison de la réforme légale du secteur des assurances de 2006, qui a instauré l'obligation de spécialisation pour les nouveaux entrants sans effet rétroactif. Ainsi, les EAR historiques mixtes agréées continuent d'exercer leurs activités sur la vie et la non-vie, bénéficiant d'un avantage de taille.",0.8552579364972458,1.0,1.0,0.9540749425089318,gpt-4o-mini,bge-m3,mistral:7b,True,False,False,0.5
